Unnamed: 0,id,text,Hashtags,date,follower_count
683,1410294251167137799,Completed google cert yet again and glad say passed #google #CPD #techgoals,"[{'text': 'google', 'indices': [63, 70]}, {'text': 'CPD', 'indices': [71, 75]}, {'text': 'techgoals', 'indices': [76, 86]}]",2021-06-30 17:48:46,147
684,1410294175082422272,Gray Raven Database Karenina Ember vol Releasing the weapon restriction Karenina able unleash the full force,[],2021-06-30 17:48:27,1868
685,1410294070761734147,Learn about Google patent that enables searchers explore connections between related entities different types med,[],2021-06-30 17:48:03,226
686,1410293946090024962,Google Analytics Beginners Certificate Completion #Google #GoogleAnalyticsAcademy #GoogleAcademy,"[{'text': 'Google', 'indices': [56, 63]}, {'text': 'GoogleAnalyticsAcademy', 'indices': [64, 87]}, {'text': 'GoogleAcademy', 'indices': [88, 102]}]",2021-06-30 17:47:33,24
687,1410293849482698752,Pico Tanks Fast Attack with the Pro iOS Android Channel Offline Arcade #gaming,"[{'text': 'gaming', 'indices': [130, 137]}]",2021-06-30 17:47:10,2537
688,1410293710760419331,COVID UPDATE amp District wise positive cases deaths and recoveries #sadahaqpb #sadahaqenglish #sadahaqurdu,"[{'text': 'sadahaqpb', 'indices': [78, 88]}, {'text': 'sadahaqenglish', 'indices': [89, 104]}, {'text': 'sadahaqurdu', 'indices': [105, 117]}]",2021-06-30 17:46:37,21298
689,1410293675175952395,Cool Experiments with Google that Everyone Must Try #AI #AIExperiments #Google #AIExperiments,"[{'text': 'AI', 'indices': [98, 101]}, {'text': 'AIExperiments', 'indices': [102, 116]}, {'text': 'Google', 'indices': [117, 124]}]",2021-06-30 17:46:28,1530
690,1410293636265295875,Pico Tanks Fast Attack with the Pro iOS Android Channel Offline Arcade #gaming,"[{'text': 'gaming', 'indices': [130, 137]}]",2021-06-30 17:46:19,1245
691,1410293449392377864,Pico Tanks Fast Attack with the Pro iOS Android Channel Offline Arcade #gaming,"[{'text': 'gaming', 'indices': [130, 137]}]",2021-06-30 17:45:34,719
692,1410293439841902592,Pico Tanks Fast Attack with the Pro iOS Android Channel Offline Arcade #gaming,"[{'text': 'gaming', 'indices': [130, 137]}]",2021-06-30 17:45:32,10
693,1410293425207877634,The latest #Bitcoin price now displayed our search engine results when you use the FINANCE icon,"[{'text': 'Bitcoin', 'indices': [27, 35]}]",2021-06-30 17:45:29,2537
694,1410293371017515015,#Google moving away from #APKs the Play Store,"[{'text': 'Google', 'indices': [0, 7]}, {'text': 'APKs', 'indices': [28, 33]}]",2021-06-30 17:45:16,790
695,1410293340738752517,Gray Raven Database Karenina Ember vol Releasing the weapon restriction Karenina able unleash the full force,[],2021-06-30 17:45:09,2537
696,1410293340663205891,Gray Raven Database Karenina Ember vol Releasing the weapon restriction Karenina able unleash the full force,[],2021-06-30 17:45:09,2537
697,1410293328567062535,Good #Google reviews can boost your business search listings amp improve your local #SEO how you get,"[{'text': 'Google', 'indices': [5, 12]}, {'text': 'B2B', 'indices': [36, 40]}, {'text': 'SEO', 'indices': [94, 98]}]",2021-06-30 17:45:06,209
698,1410293240847241223,Gray Raven Database Karenina Ember vol Releasing the weapon restriction Karenina able unleash the full force,[],2021-06-30 17:44:45,57
699,1410293192067538953,Cool Experiments with Google that Everyone Must Try #AI #AIExperiments #Google #AIExperiments,"[{'text': 'AI', 'indices': [98, 101]}, {'text': 'AIExperiments', 'indices': [102, 116]}, {'text': 'Google', 'indices': [117, 124]}]",2021-06-30 17:44:33,80
700,1410293139076784128,Improve your #content #longevity and #ROI with predictable #framework #Seo #Startup #Digitalma,"[{'text': 'content', 'indices': [30, 38]}, {'text': 'longevity', 'indices': [41, 51]}, {'text': 'ROI', 'indices': [56, 60]}, {'text': 'framework', 'indices': [80, 90]}, {'text': 'Seo', 'indices': [115, 119]}, {'text': 'Startup', 'indices': [120, 128]}]",2021-06-30 17:44:20,329
701,1410293042624466952,#NewRelease BOUND RING amp SECRET Warm funny heartbreaking amazing story #Kindle,"[{'text': 'NewRelease', 'indices': [20, 31]}, {'text': 'Kindle', 'indices': [109, 116]}]",2021-06-30 17:43:57,6265
702,1410293001990062083,Top #Google Products Empowered #ArtificialIntelligence #AI #DATA #DataAnalytics Googl,"[{'text': 'Google', 'indices': [25, 32]}, {'text': 'ArtificialIntelligence', 'indices': [55, 78]}, {'text': 'AI', 'indices': [103, 106]}, {'text': 'DATA', 'indices': [107, 112]}, {'text': 'DataAnalytics', 'indices': [113, 127]}]",2021-06-30 17:43:48,188
703,1410292852999872514,Congratulations for #followers sir,"[{'text': 'followers', 'indices': [55, 65]}]",2021-06-30 17:43:12,391
704,1410292771467018241,Gray Raven Database Karenina Ember vol Releasing the weapon restriction Karenina able unleash the full force,[],2021-06-30 17:42:53,14
705,1410292700625129481,Top #Google Products Empowered #ArtificialIntelligence #AI #DATA #DataAnalytics Googl,"[{'text': 'Google', 'indices': [7, 14]}, {'text': 'ArtificialIntelligence', 'indices': [37, 60]}, {'text': 'AI', 'indices': [85, 88]}, {'text': 'DATA', 'indices': [89, 94]}, {'text': 'DataAnalytics', 'indices': [95, 109]}]",2021-06-30 17:42:36,3947
706,1410292643989540869,Gray Raven Database Karenina Ember vol Releasing the weapon restriction Karenina able unleash the full force,[],2021-06-30 17:42:22,4360
707,1410292612024745992,TRAFFIC POLICE HEADQUARTERS amp JAMMU SRINAGAR #sadahaqpb #sadahaqenglish #sadahaqurdu #saaddahaqnews #sadahaq,"[{'text': 'sadahaqpb', 'indices': [54, 64]}, {'text': 'sadahaqenglish', 'indices': [65, 80]}, {'text': 'sadahaqurdu', 'indices': [81, 93]}, {'text': 'saaddahaqnews', 'indices': [94, 108]}, {'text': 'sadahaq', 'indices': [109, 117]}]",2021-06-30 17:42:15,21298
708,1410292562125115393,Google John Mueller answers the question how long does SEO take for new pages the latest episode Ask Googlebot,[],2021-06-30 17:42:03,50
709,1410292363482697732,#logodesign #lovelylouies #logo designer #Losliya#logo are offering some logo for you have time don,"[{'text': 'logodesign', 'indices': [0, 11]}, {'text': 'lovelylouies', 'indices': [12, 25]}, {'text': 'logo_designer', 'indices': [26, 40]}]",2021-06-30 17:41:16,387
710,1410292325402787841,Cool Experiments with Google that Everyone Must Try #AI #AIExperiments #Google #AIExperiments,"[{'text': 'AI', 'indices': [98, 101]}, {'text': 'AIExperiments', 'indices': [102, 116]}, {'text': 'Google', 'indices': [117, 124]}]",2021-06-30 17:41:06,1895
711,1410292284340543489,The only way companies can protect your data never have had #LinkedIn #Facebook #Google #amazon,"[{'text': 'LinkedIn', 'indices': [91, 100]}, {'text': 'Facebook', 'indices': [101, 110]}, {'text': 'Google', 'indices': [111, 118]}, {'text': 'amazon', 'indices': [119, 126]}]",2021-06-30 17:40:57,206
712,1410292263138349061,#Google moving away from APKs the Play Store,"[{'text': 'Google', 'indices': [0, 7]}]",2021-06-30 17:40:52,94
713,1410292235627679746,Complete Guide the Google Panda Update via #Google #HeyGoogle,"[{'text': 'Google', 'indices': [115, 122]}, {'text': 'HeyGoogle', 'indices': [123, 133]}]",2021-06-30 17:40:45,333
714,1410291893309562882,#DRreddys commercially Launched Medicine for #COVID Kindly #Retweet amp #Like #StillWithYou stWin #FilterByJim,"[{'text': 'DRreddys', 'indices': [18, 27]}, {'text': '2DG', 'indices': [51, 55]}, {'text': 'COVID19', 'indices': [69, 77]}, {'text': 'Retweet', 'indices': [86, 94]}, {'text': 'Like', 'indices': [101, 106]}, {'text': 'StillWithYou1stWin', 'indices': [111, 130]}]",2021-06-30 17:39:23,11
715,1410291821352304652,The best way monitor your strategies and the impact Google algorithm changes Learn the process tracking,[],2021-06-30 17:39:06,192
716,1410291713822887939,you use #GoogleMaps #Google tracking you right now Yes even you turned off Location History Here,"[{'text': 'GoogleMaps', 'indices': [12, 23]}, {'text': 'Google', 'indices': [25, 32]}]",2021-06-30 17:38:41,1921
717,1410291711411208199,#usher #crowder #june coup #google #ethan Multifunction Cholesterol Uric acid Blood glucose meter glucometer,"[{'text': 'usher', 'indices': [0, 6]}, {'text': 'crowder', 'indices': [7, 15]}, {'text': 'june22coup', 'indices': [16, 27]}, {'text': 'google', 'indices': [28, 35]}, {'text': 'ethan', 'indices': [36, 42]}]",2021-06-30 17:38:40,420
718,1410291653936570374,How HTTP status codes affect Google Search Let take look what included Google new guide for site owners,[],2021-06-30 17:38:26,2321
719,1410291589478596615,Social media provides many great benefits its own but also aids other areas your digital marketing efforts inc,[],2021-06-30 17:38:11,2321
720,1410291567638757392,Google Analytics working fine #google #googleanalytics,"[{'text': 'google', 'indices': [34, 41]}, {'text': 'googleanalytics', 'indices': [42, 58]}]",2021-06-30 17:38:06,64
721,1410291502027358211,#Google moving away from #APK the #PlayStore August developers will have use #AndroidAppBundle,"[{'text': 'Google', 'indices': [0, 7]}, {'text': 'APK', 'indices': [28, 32]}, {'text': 'PlayStore', 'indices': [41, 51]}, {'text': 'AndroidAppBundle', 'indices': [91, 108]}]",2021-06-30 17:37:50,5616
722,1410291444871532549,#Roscomnadzor Accused #Google Breach Databases via Business Today,"[{'text': 'Roscomnadzor', 'indices': [0, 13]}, {'text': 'Google', 'indices': [22, 29]}]",2021-06-30 17:37:37,1661
723,1410291302416191492,amp launches social security scheme for families affected COVID #sadahaqpb #sadahaqenglish #sadahaqurdu,"[{'text': 'sadahaqpb', 'indices': [76, 86]}, {'text': 'sadahaqenglish', 'indices': [87, 102]}, {'text': 'sadahaqurdu', 'indices': [103, 115]}]",2021-06-30 17:37:03,21298
724,1410291216269209602,For more contents like this setup hit the link below #homescreensetup #homescreen,"[{'text': 'homescreensetup', 'indices': [79, 95]}, {'text': 'homescreen', 'indices': [96, 107]}]",2021-06-30 17:36:42,362
725,1410291047066791939,#Google moving away from #APK the #PlayStore August developers will have use #AndroidAppBundle,"[{'text': 'Google', 'indices': [0, 7]}, {'text': 'APK', 'indices': [28, 32]}, {'text': 'PlayStore', 'indices': [41, 51]}, {'text': 'AndroidAppBundle', 'indices': [91, 108]}]",2021-06-30 17:36:02,408
726,1410290995510587393,Gray Raven Database Karenina Ember vol Releasing the weapon restriction Karenina able unleash the full force,[],2021-06-30 17:35:49,16
727,1410290810344538114,Cool Experiments with Google that Everyone Must Try #AI #AIExperiments #Google,"[{'text': 'AI', 'indices': [79, 82]}, {'text': 'AIExperiments', 'indices': [83, 97]}, {'text': 'Google', 'indices': [98, 105]}]",2021-06-30 17:35:05,6224
728,1410290810118033408,#Google Launches Site Connect People With Food Providers,"[{'text': 'Google', 'indices': [0, 7]}]",2021-06-30 17:35:05,1236
729,1410290786663546891,Gray Raven Database Karenina Ember vol Releasing the weapon restriction Karenina able unleash the full force,[],2021-06-30 17:35:00,37
730,1410290606400757763,Another star review Thanks much for the kind words #southlantic #waterextperts,"[{'text': 'southlantic', 'indices': [87, 99]}, {'text': 'waterextperts', 'indices': [100, 114]}]",2021-06-30 17:34:17,52
731,1410290593633288195,Congratulations for #followers sir,"[{'text': 'followers', 'indices': [55, 65]}]",2021-06-30 17:34:14,85
732,1410290434103037966,Delimitation Commission plans four day visit amp from July #sadahaqpb #sadahaqenglish #sadahaqurdu,"[{'text': 'sadahaqpb', 'indices': [70, 80]}, {'text': 'sadahaqenglish', 'indices': [81, 96]}, {'text': 'sadahaqurdu', 'indices': [97, 109]}]",2021-06-30 17:33:36,21298
733,1410290356604878854,#NewRelease BOUND RING amp SECRET Warm funny heartbreaking amazing story #Kindle,"[{'text': 'NewRelease', 'indices': [20, 31]}, {'text': 'Kindle', 'indices': [109, 116]}]",2021-06-30 17:33:17,15683
734,1410290346936963078,#NewRelease BOUND RING amp SECRET Warm funny heartbreaking amazing story #Kindle,"[{'text': 'NewRelease', 'indices': [20, 31]}, {'text': 'Kindle', 'indices': [109, 116]}]",2021-06-30 17:33:15,15683
735,1410290299814006785,all #businessmen The best #investment #advertising The best #advertising #domain The best #domain,"[{'text': 'businessmen', 'indices': [7, 19]}, {'text': 'investment', 'indices': [30, 41]}, {'text': 'advertising', 'indices': [45, 57]}, {'text': 'advertising', 'indices': [68, 80]}, {'text': 'domain', 'indices': [86, 93]}, {'text': 'domain', 'indices': [104, 111]}]",2021-06-30 17:33:04,9
736,1410290261800914948,#Listen the most recent episode podcast Beware People Playing Both Sides,"[{'text': 'Listen', 'indices': [0, 7]}]",2021-06-30 17:32:54,582
737,1410290117445627912,Researcher uncover unpatched #vulnerability #Google Compute Engine platform that could abused attacker,"[{'text': 'vulnerability', 'indices': [52, 66]}, {'text': 'Google', 'indices': [70, 77]}]",2021-06-30 17:32:20,225
738,1410290090912325632,Brandon Williams the CEO Founder based #AfroFuturist Experience Agency focusing promoting equity through Stra,"[{'text': 'AfroFuturist', 'indices': [65, 78]}]",2021-06-30 17:32:14,1085
739,1410290050005413893,When was the last time your checked your PageSpeed #google #websitedevelopment #OnlineMarketing,"[{'text': 'google', 'indices': [71, 78]}, {'text': 'websitedevelopment', 'indices': [79, 98]}, {'text': 'OnlineMarketing', 'indices': [99, 115]}]",2021-06-30 17:32:04,11222
740,1410289978035163137,Will Isnady Insurance Agency #Google,"[{'text': 'Google', 'indices': [32, 39]}]",2021-06-30 17:31:47,59
741,1410289965712424966,Why this Google engineer teaching students code #Google,"[{'text': 'Google', 'indices': [78, 85]}]",2021-06-30 17:31:44,1662
742,1410289804802207745,Pump Service Staten Island #Google #PumpService #PumpServiceStatenIslandNY,"[{'text': 'Google', 'indices': [34, 41]}, {'text': 'PumpService', 'indices': [67, 79]}, {'text': 'PumpServiceStatenIslandNY', 'indices': [81, 107]}]",2021-06-30 17:31:06,46
743,1410289656101494797,Researching the Know more #Google #GoogleShopping #Keyword,"[{'text': 'Google', 'indices': [81, 88]}, {'text': 'GoogleShopping', 'indices': [89, 104]}, {'text': 'Keyword', 'indices': [105, 113]}]",2021-06-30 17:30:30,2276
744,1410289585196834823,Use Drones Flying Toys Public Banned Rajouri #sadahaqpb #sadahaqenglish #sadahaqurdu #saaddahaqnews,"[{'text': 'sadahaqpb', 'indices': [57, 67]}, {'text': 'sadahaqenglish', 'indices': [68, 83]}, {'text': 'sadahaqurdu', 'indices': [84, 96]}, {'text': 'saaddahaqnews', 'indices': [97, 111]}]",2021-06-30 17:30:13,21298
745,1410289563453431811,Clash the titans #Google #microsoft,"[{'text': 'Google', 'indices': [35, 42]}, {'text': 'microsoft', 'indices': [43, 53]}]",2021-06-30 17:30:08,33
746,1410289531660668936,Clash the titans #Google #microsoft,"[{'text': 'Google', 'indices': [23, 30]}, {'text': 'microsoft', 'indices': [31, 41]}]",2021-06-30 17:30:00,12517
747,1410289510844411914,Google John Mueller answers the question how long does SEO take for new pages the latest episode Ask Googlebot,[],2021-06-30 17:29:55,30639
748,1410289450492571651,How Google used MUM search for the first time #Google #Searchengine,"[{'text': 'Google', 'indices': [49, 56]}, {'text': 'Searchengine', 'indices': [57, 70]}]",2021-06-30 17:29:41,1622
749,1410289444448579593,Google John Mueller answers the question how long does SEO take for new pages the latest episode Ask Googlebot,[],2021-06-30 17:29:40,2796
750,1410289317604438021,Playa Blanca Takeaway Restaurant Delivery Lanzarote #Google,"[{'text': 'Google', 'indices': [55, 62]}]",2021-06-30 17:29:09,37
751,1410289305994600460,Google Messages will auto delete OTPs and sort like Gmail but only India #google,"[{'text': 'google', 'indices': [101, 108]}]",2021-06-30 17:29:07,1786
752,1410289281411686400,are PUMPED have Lisa Highfill back for the Great Plains Summit gpsummit #esu #google #nebedchat Register today htt,"[{'text': 'esu9', 'indices': [94, 99]}, {'text': 'google', 'indices': [101, 108]}, {'text': 'nebedchat', 'indices': [109, 119]}]",2021-06-30 17:29:01,2131
753,1410289040331579402,The competition for spot page one Google can fierce but with the right work and effort achievable Here,[],2021-06-30 17:28:03,85
754,1410288879844827138,will create epic gaming intro and outro full #epicintro #gaming #intro,"[{'text': 'epicintro', 'indices': [83, 93]}, {'text': 'gaming', 'indices': [94, 101]}, {'text': 'intro', 'indices': [102, 108]}]",2021-06-30 17:27:25,42
755,1410288704556572673,Congratulations and thank you Melissa Welcome the Vip family #nissan #nissanaltima #nissancar #kbb,"[{'text': 'nissan', 'indices': [72, 79]}, {'text': 'nissanaltima', 'indices': [80, 93]}, {'text': 'nissancar', 'indices': [94, 104]}, {'text': 'kbb', 'indices': [105, 109]}]",2021-06-30 17:26:43,89
756,1410288662445805578,Kulgam Encounter Two unidentified militants killed Ops #sadahaqpb #sadahaqenglish #sadahaqurdu,"[{'text': 'sadahaqpb', 'indices': [62, 72]}, {'text': 'sadahaqenglish', 'indices': [73, 88]}, {'text': 'sadahaqurdu', 'indices': [89, 101]}]",2021-06-30 17:26:33,21298
757,1410288459403694080,are PUMPED have Lisa Highfill back for the Great Plains Summit gpsummit #esu #google #nebedchat Registe,"[{'text': 'esu9', 'indices': [82, 87]}, {'text': 'google', 'indices': [89, 96]}, {'text': 'nebedchat', 'indices': [97, 107]}]",2021-06-30 17:25:45,224
758,1410288270760685568,This week the Mindful Montana Wellness Podcast Impeccable With Your Word Find,[],2021-06-30 17:25:00,1305
759,1410288270412595210,This week the Mindful Montana Wellness Podcast Impeccable With Your Word Find,[],2021-06-30 17:25:00,71
760,1410288219346722817,Gray Raven Database Karenina Ember vol Releasing the weapon restriction Karenina able unleash the full force,[],2021-06-30 17:24:48,6
761,1410288094968942597,Researcher uncover unpatched #vulnerability #Google Compute Engine platform that could abused attacker,"[{'text': 'vulnerability', 'indices': [52, 66]}, {'text': 'Google', 'indices': [70, 77]}]",2021-06-30 17:24:18,2022
762,1410288050341617664,Finally Glad hear that Google clamping down financial scam adverts #google,"[{'text': 'google', 'indices': [77, 84]}]",2021-06-30 17:24:07,2251
763,1410288028250083329,Google first report under new rules out the search engine has registered removals #Google,"[{'text': 'Google', 'indices': [119, 126]}]",2021-06-30 17:24:02,2168
764,1410287868824543234,Researcher uncover unpatched #vulnerability #Google Compute Engine platform that could abused attacker,"[{'text': 'vulnerability', 'indices': [52, 66]}, {'text': 'Google', 'indices': [70, 77]}]",2021-06-30 17:23:24,716015
765,1410287855893508100,BREAKING NEWS Alberta ended the fiscal year with deficit billion which billion lower,[],2021-06-30 17:23:21,3207
766,1410287787568472065,#Warren urges federal watchdog investigate #Google over advertising manipulation #TheHill,"[{'text': 'Warren', 'indices': [0, 7]}, {'text': 'Google', 'indices': [46, 53]}, {'text': 'TheHill', 'indices': [86, 94]}]",2021-06-30 17:23:05,0
767,1410287748682977281,The only way companies can protect your data never have had #LinkedIn #Facebook #Google #amazon,"[{'text': 'LinkedIn', 'indices': [91, 100]}, {'text': 'Facebook', 'indices': [101, 110]}, {'text': 'Google', 'indices': [111, 118]}, {'text': 'amazon', 'indices': [119, 126]}]",2021-06-30 17:22:55,841
768,1410287538242158592,Brandon Williams the CEO Founder based #AfroFuturist Experience Agency focusing promoting equity through Stra,"[{'text': 'AfroFuturist', 'indices': [65, 78]}]",2021-06-30 17:22:05,61
769,1410287469573001223,Very excited see this launch market that helped lead big congrats teammates who helped with this,[],2021-06-30 17:21:49,181
770,1410287450044481539,Gray Raven Database Karenina Ember vol Releasing the weapon restriction Karenina able unleash the full force,[],2021-06-30 17:21:44,250
771,1410287340950589457,Thinking about advertising Google can help #SEO #Google #Ranking #advertising #smm #bus,"[{'text': 'SEO', 'indices': [69, 73]}, {'text': 'Google', 'indices': [74, 81]}, {'text': 'Ranking', 'indices': [82, 90]}, {'text': 'advertising', 'indices': [91, 103]}, {'text': 'smm', 'indices': [130, 134]}]",2021-06-30 17:21:18,1898
772,1410287099484332037,Google Webmaster Tools could useful gizmo get issue that hindering the expansion your website,[],2021-06-30 17:20:21,93
773,1410287089468465158,FYI #Google Security Update Will Break Links Old Videos And Drive Files #sociallyacceptablemarketing,"[{'text': 'Google', 'indices': [8, 15]}, {'text': 'sociallyacceptablemarketing', 'indices': [80, 108]}]",2021-06-30 17:20:18,177
774,1410287088948453377,Shimala Group Texas Real Estate Team #Google,"[{'text': 'Google', 'indices': [40, 47]}]",2021-06-30 17:20:18,323
775,1410287014990200833,Writer Tools Novel Writing Software Review Writer Tools piece novel writing software that available,[],2021-06-30 17:20:00,25084
776,1410286791962238976,#Google and #Microsoft agree start suing each other again,"[{'text': 'Google', 'indices': [19, 26]}, {'text': 'Microsoft', 'indices': [31, 41]}]",2021-06-30 17:19:07,16
777,1410286790829768707,#Google and #Microsoft agree start suing each other again,"[{'text': 'Google', 'indices': [19, 26]}, {'text': 'Microsoft', 'indices': [31, 41]}]",2021-06-30 17:19:07,10
778,1410286786077548551,#Google and #Microsoft agree start suing each other again,"[{'text': 'Google', 'indices': [19, 26]}, {'text': 'Microsoft', 'indices': [31, 41]}]",2021-06-30 17:19:06,15
779,1410286647149613061,#Google and #Microsoft agree start suing each other again,"[{'text': 'Google', 'indices': [0, 7]}, {'text': 'Microsoft', 'indices': [12, 22]}]",2021-06-30 17:18:33,11996
780,1410286444007116809,#Google announces additional measures fight financial #fraud the,"[{'text': 'Google', 'indices': [0, 7]}, {'text': 'fraud', 'indices': [57, 63]}]",2021-06-30 17:17:44,91000
781,1410286381084053511,#Google Chat now suggests group conversations based #Calendar events,"[{'text': 'Google', 'indices': [0, 7]}, {'text': 'Calendar', 'indices': [55, 64]}]",2021-06-30 17:17:29,91000
782,1410286340206379012,Threat hxxps purchasebillingid com amazon sign #phishing #google,"[{'text': 'phishing', 'indices': [57, 66]}, {'text': 'google', 'indices': [68, 75]}]",2021-06-30 17:17:20,536
783,1410286232857370628,#Amazon #SpaceX #Google #Bloomberg This need,"[{'text': 'Amazon', 'indices': [93, 100]}, {'text': 'SpaceX', 'indices': [101, 108]}, {'text': 'Google', 'indices': [109, 116]}, {'text': 'Bloomberg', 'indices': [117, 127]}]",2021-06-30 17:16:54,2588
784,1410286029605646340,amp cancels residential accommodation darbar move employees #sadahaqpb #sadahaqenglish #sadahaqurdu,"[{'text': 'sadahaqpb', 'indices': [72, 82]}, {'text': 'sadahaqenglish', 'indices': [83, 98]}, {'text': 'sadahaqurdu', 'indices': [99, 111]}]",2021-06-30 17:16:05,21298
785,1410286027529465861,NSG CISF chiefs inspect scene drone strike Air Force station Jammu #sadahaqpb #sadahaqenglish #sadahaqurdu #sa,"[{'text': 'sadahaqpb', 'indices': [96, 106]}, {'text': 'sadahaqenglish', 'indices': [107, 122]}, {'text': 'sadahaqurdu', 'indices': [123, 135]}]",2021-06-30 17:16:05,235
786,1410285958528860161,Fascinating read about #Google with great comments #dataprivacy and #competition article contributor,"[{'text': 'Google', 'indices': [23, 30]}, {'text': 'dataprivacy', 'indices': [54, 66]}, {'text': 'competition', 'indices': [71, 83]}]",2021-06-30 17:15:49,4232
787,1410285797388034055,The rise cryptocurrency adoption comes surprise online environment where #Bitcoin trends almost daily and cryp,"[{'text': 'Bitcoin', 'indices': [101, 109]}]",2021-06-30 17:15:10,0
788,1410285782435340302,#Consumers Trust Online Reviews Much Personal Recommendations Get #Google #Reviews,"[{'text': 'Consumers', 'indices': [7, 17]}, {'text': 'Google', 'indices': [81, 88]}, {'text': 'Reviews', 'indices': [89, 97]}]",2021-06-30 17:15:07,102
789,1410285774667489290,Thinking about advertising Google can help #SEO #Google #Ranking #advertising,"[{'text': 'SEO', 'indices': [52, 56]}, {'text': 'Google', 'indices': [57, 64]}, {'text': 'Ranking', 'indices': [65, 73]}, {'text': 'advertising', 'indices': [74, 86]}]",2021-06-30 17:15:05,6667
790,1410285712528846853,Thank you much each our clients for their reviews See more reviews #google #fivestarreview,"[{'text': 'google', 'indices': [80, 87]}, {'text': 'fivestarreview', 'indices': [100, 115]}]",2021-06-30 17:14:50,70
791,1410285701233627136,Gray Raven Database Karenina Ember vol Releasing the weapon restriction Karenina able unleash the full force,[],2021-06-30 17:14:47,149
792,1410285519808962563,June buy #oneplus #device #smoothos #oneplus tpro #neversettle #beyondthespeed,"[{'text': 'oneplus', 'indices': [39, 47]}, {'text': 'device', 'indices': [48, 55]}, {'text': 'smoothos', 'indices': [56, 65]}, {'text': '90hz', 'indices': [66, 71]}, {'text': 'oneplus8tpro', 'indices': [72, 85]}, {'text': 'neversettle', 'indices': [86, 98]}, {'text': 'beyondthespeed', 'indices': [99, 114]}]",2021-06-30 17:14:04,119
793,1410285498287853573,Gray Raven Database Karenina Ember vol Releasing the weapon restriction Karenina able unleash the full force,[],2021-06-30 17:13:59,28
794,1410285406487302156,How pretty that #usher #crowder #june coup #google #ethan,"[{'text': 'usher', 'indices': [20, 26]}, {'text': 'crowder', 'indices': [27, 35]}, {'text': 'june22coup', 'indices': [36, 47]}, {'text': 'google', 'indices': [48, 55]}, {'text': 'ethan', 'indices': [56, 62]}]",2021-06-30 17:13:37,420
795,1410285281887014920,HUD Senior Living Community Essex Fells Area #Google #HUDSeniorLivingCommunity,"[{'text': 'Google', 'indices': [50, 57]}, {'text': 'HUDSeniorLivingCommunity', 'indices': [83, 108]}]",2021-06-30 17:13:07,32
796,1410285226568396806,Push the #BAT #HERO #Funny #game try and give feedback indie game #developper encourage Thanks,"[{'text': 'BAT', 'indices': [12, 16]}, {'text': 'HERO', 'indices': [17, 22]}, {'text': 'Funny', 'indices': [24, 30]}, {'text': 'game', 'indices': [31, 36]}, {'text': 'developper', 'indices': [83, 94]}]",2021-06-30 17:12:54,809
