Unnamed: 0,id,text,Hashtags,date,follower_count
3,1408758418492514306,Insanely curious What the #Google,"[{'text': 'Google', 'indices': [30, 37]}]",2021-06-26 12:05:55,292
4,1408758150375874567,Redeay #poco pro #pocox pro #Review #poco pro Review #Mobile #Phone #Blog #Redeay #redea,"[{'text': 'poco_x3_pro', 'indices': [52, 64]}, {'text': 'pocox3pro', 'indices': [65, 75]}, {'text': 'Review', 'indices': [76, 83]}, {'text': 'poco_x3_pro_Review', 'indices': [84, 103]}, {'text': 'Mobile', 'indices': [104, 111]}, {'text': 'Phone', 'indices': [112, 118]}, {'text': 'Blog', 'indices': [119, 124]}, {'text': 'Redeay', 'indices': [125, 132]}]",2021-06-26 12:04:51,301
5,1408757977264254982,Anatomy SEO #searchengineoptimization #DigitalMarketing #Google #DataScience #MachineLearning #SeoYeaJi #SEO,"[{'text': 'searchengineoptimization', 'indices': [16, 41]}, {'text': 'DigitalMarketing', 'indices': [42, 59]}, {'text': 'Google', 'indices': [60, 67]}, {'text': 'DataScience', 'indices': [68, 80]}, {'text': 'MachineLearning', 'indices': [81, 97]}, {'text': 'SeoYeaJi', 'indices': [98, 107]}, {'text': 'SEO', 'indices': [108, 112]}]",2021-06-26 12:04:09,18
8,1408757846985093120,Google announced the launch new collaborative creation tool Here what know far via,[],2021-06-26 12:03:38,1662
10,1408757816769355776,Redeay #poco pro #pocox pro #Review #poco pro Review #Mobile #Phone #Blog #Redeay,"[{'text': 'poco_x3_pro', 'indices': [32, 44]}, {'text': 'pocox3pro', 'indices': [45, 55]}, {'text': 'Review', 'indices': [56, 63]}, {'text': 'poco_x3_pro_Review', 'indices': [64, 83]}, {'text': 'Mobile', 'indices': [84, 91]}, {'text': 'Phone', 'indices': [92, 98]}, {'text': 'Blog', 'indices': [99, 104]}, {'text': 'Redeay', 'indices': [105, 112]}]",2021-06-26 12:03:31,95
11,1408757743469559808,Reviews Schema Changed Address Growing Problems with Profanity #SEO #Google #Schema,"[{'text': 'SEO', 'indices': [110, 114]}, {'text': 'Google', 'indices': [115, 122]}, {'text': 'Schema', 'indices': [123, 130]}]",2021-06-26 12:03:14,1353
12,1408757549982179334,#usher #crowder #june coup #google #ethan HOT Cycling Anti slip Anti sweat Men Women Half Finger Gloves Breathable,"[{'text': 'usher', 'indices': [0, 6]}, {'text': 'crowder', 'indices': [7, 15]}, {'text': 'june22coup', 'indices': [16, 27]}, {'text': 'google', 'indices': [28, 35]}, {'text': 'ethan', 'indices': [36, 42]}]",2021-06-26 12:02:28,421
13,1408757526682865670,Play First Game Fallopian Fighter Android now drop email there any features you like see,[],2021-06-26 12:02:22,427
14,1408757368012390403,Would you like gain more conversions for much lower digital marketing spend You come the right place,[],2021-06-26 12:01:44,3808
15,1408757185920778242,#RT Ways Get Traffic Your New Online Store Get New Traffic with #SocialMediaMarketing Leverage,"[{'text': 'RT', 'indices': [13, 16]}, {'text': 'SocialMediaMarketing', 'indices': [106, 127]}]",2021-06-26 12:01:01,152680
16,1408757118438682625,Trying look things from different angle otherwise your information safe #BigData #Python #RStats #JavaScript #Re,"[{'text': 'BigData', 'indices': [99, 107]}, {'text': 'Python', 'indices': [108, 115]}, {'text': 'RStats', 'indices': [116, 123]}, {'text': 'JavaScript', 'indices': [124, 135]}]",2021-06-26 12:00:45,3964
17,1408757080878727170,noir thriller laced with tartan #tartannoir #noiralley #books #booky #bookz #BookPlug #BookP,"[{'text': 'tartannoir', 'indices': [79, 90]}, {'text': 'noiralley', 'indices': [91, 101]}, {'text': 'books', 'indices': [102, 108]}, {'text': 'booky', 'indices': [109, 115]}, {'text': 'bookz', 'indices': [116, 122]}, {'text': 'BookPlug', 'indices': [123, 132]}]",2021-06-26 12:00:36,724
18,1408757036641361923,the best family friendly campsites Devon #Devon #Campsites #Camping #google #smm,"[{'text': 'Devon', 'indices': [50, 56]}, {'text': 'Campsites', 'indices': [57, 67]}, {'text': 'Camping', 'indices': [68, 76]}, {'text': 'google', 'indices': [102, 109]}, {'text': 'smm', 'indices': [110, 114]}]",2021-06-26 12:00:25,6665
19,1408757002189295617,nation who sacrificed everything for the entire Muslim Ummah #FreePalestine #Bangtan #Pakistan #political #WhatsApp #ty,"[{'text': 'FreePalestine', 'indices': [81, 95]}, {'text': 'Bangtan', 'indices': [96, 104]}, {'text': 'Pakistan', 'indices': [105, 114]}, {'text': 'political', 'indices': [115, 125]}, {'text': 'WhatsApp', 'indices': [126, 135]}]",2021-06-26 12:00:17,3400
20,1408756981054152704,Trying look things from different angle otherwise your information safe #BigData #Python #RStats #JavaScript #Re,"[{'text': 'BigData', 'indices': [99, 107]}, {'text': 'Python', 'indices': [108, 115]}, {'text': 'RStats', 'indices': [116, 123]}, {'text': 'JavaScript', 'indices': [124, 135]}]",2021-06-26 12:00:12,210
21,1408756961919733763,nation who sacrificed everything for the entire Muslim Ummah #FreePalestine #Bangtan #Pakistan #political #WhatsApp #ty,"[{'text': 'FreePalestine', 'indices': [81, 95]}, {'text': 'Bangtan', 'indices': [96, 104]}, {'text': 'Pakistan', 'indices': [105, 114]}, {'text': 'political', 'indices': [115, 125]}, {'text': 'WhatsApp', 'indices': [126, 135]}]",2021-06-26 12:00:07,209
22,1408756955145977865,Google announced the launch new collaborative creation tool Here what know far via,[],2021-06-26 12:00:06,235700
23,1408756938733613056,Trying look things from different angle otherwise your information safe #BigData #Python #RStats #JavaScript #Re,"[{'text': 'BigData', 'indices': [99, 107]}, {'text': 'Python', 'indices': [108, 115]}, {'text': 'RStats', 'indices': [116, 123]}, {'text': 'JavaScript', 'indices': [124, 135]}]",2021-06-26 12:00:02,527
24,1408756937236299781,#JIO planning enter mobile industry they Collab with #Google launch their #JioPhoneNext,"[{'text': 'JIO', 'indices': [0, 4]}, {'text': 'Google', 'indices': [66, 73]}, {'text': 'JioPhoneNext', 'indices': [90, 103]}]",2021-06-26 12:00:01,5
25,1408756930311376902,Today #Google discount hardware day where you can save Spend and save additional select items,"[{'text': 'Google', 'indices': [9, 16]}]",2021-06-26 12:00:00,126
26,1408756904734584834,Trying look things from different angle otherwise your information safe #BigData #Python #RStats #JavaScript #Re,"[{'text': 'BigData', 'indices': [99, 107]}, {'text': 'Python', 'indices': [108, 115]}, {'text': 'RStats', 'indices': [116, 123]}, {'text': 'JavaScript', 'indices': [124, 135]}]",2021-06-26 11:59:54,9042
27,1408756838271655946,Trying look things from different angle otherwise your information safe #BigData #Python #RStats #JavaScript #Re,"[{'text': 'BigData', 'indices': [99, 107]}, {'text': 'Python', 'indices': [108, 115]}, {'text': 'RStats', 'indices': [116, 123]}, {'text': 'JavaScript', 'indices': [124, 135]}]",2021-06-26 11:59:38,16916
28,1408756817354661890,Trying look things from different angle otherwise your information safe #BigData #Python #RStats #JavaScript #Re,"[{'text': 'BigData', 'indices': [99, 107]}, {'text': 'Python', 'indices': [108, 115]}, {'text': 'RStats', 'indices': [116, 123]}, {'text': 'JavaScript', 'indices': [124, 135]}]",2021-06-26 11:59:33,942
29,1408756618477584386,Trying look things from different angle otherwise your information safe #BigData #Python #RStats #JavaScript #Re,"[{'text': 'BigData', 'indices': [99, 107]}, {'text': 'Python', 'indices': [108, 115]}, {'text': 'RStats', 'indices': [116, 123]}, {'text': 'JavaScript', 'indices': [124, 135]}]",2021-06-26 11:58:45,2742
30,1408756547761676288,Google exposes Windows privilege escalation bug following botched fix #Windows #Google #ProjectZero,"[{'text': 'Windows', 'indices': [86, 94]}, {'text': 'Google', 'indices': [95, 102]}, {'text': 'ProjectZero', 'indices': [103, 115]}]",2021-06-26 11:58:29,165
31,1408756163806699524,#Computing #Google #Fi #VPN finally rolling out #iPhones Google built VPN service,"[{'text': 'Computing', 'indices': [41, 51]}, {'text': 'Google', 'indices': [52, 59]}, {'text': 'Fi', 'indices': [60, 63]}, {'text': 'VPN', 'indices': [64, 68]}, {'text': 'iPhones', 'indices': [95, 103]}]",2021-06-26 11:56:57,115
32,1408755953193861121,Trying look things from different angle otherwise your information safe #BigData #Python #RStats #JavaScript #Re,"[{'text': 'BigData', 'indices': [99, 107]}, {'text': 'Python', 'indices': [108, 115]}, {'text': 'RStats', 'indices': [116, 123]}, {'text': 'JavaScript', 'indices': [124, 135]}]",2021-06-26 11:56:07,456
33,1408755889176207360,Trying look things from different angle otherwise your information safe #BigData #Python #RStats #JavaScript #Re,"[{'text': 'BigData', 'indices': [99, 107]}, {'text': 'Python', 'indices': [108, 115]}, {'text': 'RStats', 'indices': [116, 123]}, {'text': 'JavaScript', 'indices': [124, 135]}]",2021-06-26 11:55:52,549
34,1408755874630455303,Trying look things from different angle otherwise your information safe #BigData #Python #RStats,"[{'text': 'BigData', 'indices': [86, 94]}, {'text': 'Python', 'indices': [95, 102]}, {'text': 'RStats', 'indices': [103, 110]}]",2021-06-26 11:55:48,7756
35,1408755829583527938,sale install brand new grade fairly used the lowest price Nigeria Like amp retweet Just send #chid,[],2021-06-26 11:55:37,1101
36,1408755826047737858,nation who sacrificed everything for the entire Muslim Ummah #FreePalestine #Bangtan #Pakistan #political,"[{'text': 'FreePalestine', 'indices': [67, 81]}, {'text': 'Bangtan', 'indices': [82, 90]}, {'text': 'Pakistan', 'indices': [91, 100]}, {'text': 'political', 'indices': [101, 111]}]",2021-06-26 11:55:37,275
37,1408755688021495818,you wish see your website rank the top the #SearchEngine results Get better #rankings #optimize your websit,"[{'text': 'SearchEngine', 'indices': [73, 86]}, {'text': 'rankings', 'indices': [107, 116]}, {'text': 'optimize', 'indices': [118, 127]}]",2021-06-26 11:55:04,19344
38,1408755444630229002,you wish see your website rank the top the #SearchEngine results Get better #rankings #optimize your websit,"[{'text': 'SearchEngine', 'indices': [73, 86]}, {'text': 'rankings', 'indices': [107, 116]}, {'text': 'optimize', 'indices': [118, 127]}]",2021-06-26 11:54:06,148
39,1408755375755628545,Isn cool #usher #crowder #june coup #google #ethan,"[{'text': 'usher', 'indices': [15, 21]}, {'text': 'crowder', 'indices': [22, 30]}, {'text': 'june22coup', 'indices': [31, 42]}, {'text': 'google', 'indices': [43, 50]}, {'text': 'ethan', 'indices': [51, 57]}]",2021-06-26 11:53:49,421
40,1408755361918689280,Cambridge Tour Guides #Google Shared tours available every day Tickets,"[{'text': 'Google', 'indices': [25, 32]}]",2021-06-26 11:53:46,5222
41,1408755327718338563,Toy Theatre Virtual Manipulatives and Games ProPD #professionaldevelopment #distancelearning,"[{'text': '360ProPD', 'indices': [87, 96]}, {'text': 'professionaldevelopment', 'indices': [97, 121]}, {'text': 'distancelearning', 'indices': [122, 139]}]",2021-06-26 11:53:38,1395
42,1408755252220743680,Here little pizza fun fact for your weekend trivia nights #okgoogle #google #pizzafacts #thincrust,"[{'text': 'okgoogle', 'indices': [71, 80]}, {'text': 'google', 'indices': [81, 88]}, {'text': 'pizzafacts', 'indices': [89, 100]}, {'text': 'thincrust', 'indices': [101, 111]}]",2021-06-26 11:53:20,2
43,1408754916131287040,Russell Brooks #Google,"[{'text': 'Google', 'indices': [18, 25]}]",2021-06-26 11:52:00,299
44,1408754889866432512,HELLO are you looking for #Logo #Designer for your #businesses you want professional Logo Design Order,"[{'text': 'Logo', 'indices': [30, 35]}, {'text': 'Designer', 'indices': [36, 45]}, {'text': 'businesses', 'indices': [55, 66]}]",2021-06-26 11:51:53,0
45,1408754113098231810,Every faded flowers has story #FreePalestine #Bangtan #Pakistan #political #WhatsApp #tyt #yks #Google #Purple,"[{'text': 'FreePalestine', 'indices': [49, 63]}, {'text': 'Bangtan', 'indices': [64, 72]}, {'text': 'Pakistan', 'indices': [73, 82]}, {'text': 'political', 'indices': [83, 93]}, {'text': 'WhatsApp', 'indices': [94, 103]}, {'text': 'tyt2021', 'indices': [104, 112]}, {'text': 'yks2021', 'indices': [113, 121]}, {'text': 'Google', 'indices': [122, 129]}, {'text': 'Purple', 'indices': [130, 137]}]",2021-06-26 11:48:48,209
46,1408754108249501698,Thread thought Google photo What #Google keep collecting binaries every human faces One day Google may able,"[{'text': 'Google', 'indices': [56, 63]}]",2021-06-26 11:48:47,0
47,1408753892184104963,Our study revealed that over websites failed achieve good #CoreWebVitals score Discover the impact these,"[{'text': 'CoreWebVitals', 'indices': [89, 103]}]",2021-06-26 11:47:55,1252
48,1408753728400855041,#TechToday June Twitter may soon let you connect your Google Account Read More Source,"[{'text': 'TechToday', 'indices': [0, 10]}]",2021-06-26 11:47:16,6
49,1408753474150580228,Every faded flowers has story #FreePalestine #Bangtan #Pakistan #political #WhatsApp #tyt #yks #Google,"[{'text': 'FreePalestine', 'indices': [35, 49]}, {'text': 'Bangtan', 'indices': [50, 58]}, {'text': 'Pakistan', 'indices': [59, 68]}, {'text': 'political', 'indices': [69, 79]}, {'text': 'WhatsApp', 'indices': [80, 89]}, {'text': 'tyt2021', 'indices': [90, 98]}, {'text': 'yks2021', 'indices': [99, 107]}, {'text': 'Google', 'indices': [108, 115]}]",2021-06-26 11:46:16,275
50,1408753405900828672,Julia Winter Studio #Google,"[{'text': 'Google', 'indices': [23, 30]}]",2021-06-26 11:45:59,558
51,1408753260026941450,Work Hard employee #tesla and grow the company upto sky and surely one day,"[{'text': 'tesla', 'indices': [55, 61]}]",2021-06-26 11:45:25,1
52,1408752980485156864,sale install brand new grade fairly used the lowest price Nigeria Like amp retweet Just send,[],2021-06-26 11:44:18,591
53,1408752920829513731,#AI creating new opportunities and improving people lives Explore how #Google helping,"[{'text': 'AI', 'indices': [0, 3]}, {'text': 'Google', 'indices': [78, 85]}]",2021-06-26 11:44:04,11693
54,1408752914567512064,The CMA has claimed for fake reviews Amazon and Google CMA has put these allegations order break customer prote,[],2021-06-26 11:44:02,3964
55,1408752858611130370,Are you Searching for BEST DIGITAL MARKETING SERVICES Contact Reach,[],2021-06-26 11:43:49,41
56,1408752834066239491,Chill Zone Alert Never dull day The #Parachain pressing onwards The cap,"[{'text': 'Parachain', 'indices': [103, 113]}]",2021-06-26 11:43:43,1905
57,1408752681397673988,DeepMind scientist calls for #ethicalAI #Google faces ongoing backlash #AIEthics #AI #ArtificialIntelligence,"[{'text': 'ethicalAI', 'indices': [29, 39]}, {'text': 'Google', 'indices': [43, 50]}, {'text': 'AIEthics', 'indices': [74, 83]}, {'text': 'AI', 'indices': [84, 87]}, {'text': 'ArtificialIntelligence', 'indices': [88, 111]}]",2021-06-26 11:43:07,1547
58,1408752326257483778,succesfully completed Semrush SEO Toolkit exam Thank you for this valuable certificate #seo #seotips,"[{'text': 'seo', 'indices': [124, 128]}, {'text': 'seotips', 'indices': [129, 137]}]",2021-06-26 11:41:42,1252
59,1408752099395981312,The CMA has claimed for fake reviews Amazon and Google CMA has put these allegations order break customer prote,[],2021-06-26 11:40:48,9042
60,1408752025605652488,Google Play Hurry GET #FREE #GooglePlay #GIFT #CARD Only #UnitedStates #Australia #Canada #Unit,"[{'text': 'FREE', 'indices': [60, 65]}, {'text': 'GooglePlay', 'indices': [66, 77]}, {'text': 'GIFT', 'indices': [78, 83]}, {'text': 'CARD', 'indices': [84, 89]}, {'text': 'UnitedStates', 'indices': [101, 114]}, {'text': 'Australia', 'indices': [115, 125]}, {'text': 'Canada', 'indices': [126, 133]}]",2021-06-26 11:40:30,2
61,1408751906307153920,From sponsored social media posts #Google Ads have your site and message display the audience you want wit,"[{'text': 'Google', 'indices': [37, 44]}]",2021-06-26 11:40:02,88
62,1408751823880658949,The CMA has claimed for fake reviews Amazon and Google CMA has put these allegations order break customer,[],2021-06-26 11:39:42,132
63,1408751807526969345,How Google Protects Your Privacy You Choose Save Audio Data #Google,"[{'text': 'Google', 'indices': [100, 107]}]",2021-06-26 11:39:38,12
64,1408751645262073859,#iartg #ASMSG #EARTG #indieauthors #RomanceReaders #indiebooksbeseen #bookboost #indiebookspromo #amwriting,"[{'text': 'iartg', 'indices': [0, 6]}, {'text': 'ASMSG', 'indices': [7, 13]}, {'text': 'EARTG', 'indices': [14, 20]}, {'text': 'indieauthors', 'indices': [21, 34]}, {'text': 'RomanceReaders', 'indices': [35, 50]}, {'text': 'indiebooksbeseen', 'indices': [51, 68]}, {'text': 'bookboost', 'indices': [69, 79]}, {'text': 'indiebookspromo', 'indices': [80, 96]}, {'text': 'amwriting', 'indices': [97, 107]}]",2021-06-26 11:39:00,5094
65,1408751555155795975,Pay per click #Advertising goes beyond just #Google and #Facebook find out what your options are here #PPC,"[{'text': 'Advertising', 'indices': [14, 26]}, {'text': 'Google', 'indices': [44, 51]}, {'text': 'Facebook', 'indices': [56, 65]}, {'text': 'PPC', 'indices': [111, 115]}]",2021-06-26 11:38:38,18
66,1408751169640579073,Crab Shack Dabaso Mida Creek #Google,"[{'text': 'Google', 'indices': [33, 40]}]",2021-06-26 11:37:06,125
67,1408751027432591361,#iartg #eartg #asmsg #indieauthors #bookboost #indiebooksbeseen #indiebookspromo #amreading #amwriting Amazon# #Bests,"[{'text': 'iartg', 'indices': [21, 27]}, {'text': 'eartg', 'indices': [28, 34]}, {'text': 'asmsg', 'indices': [35, 41]}, {'text': 'indieauthors', 'indices': [42, 55]}, {'text': 'bookboost', 'indices': [56, 66]}, {'text': 'indiebooksbeseen', 'indices': [67, 84]}, {'text': 'indiebookspromo', 'indices': [85, 101]}, {'text': 'amreading', 'indices': [102, 112]}, {'text': 'amwriting', 'indices': [113, 123]}]",2021-06-26 11:36:32,21083
68,1408750791033303045,#iartg #eartg #asmsg #indieauthors #bookboost #indiebooksbeseen #indiebookspromo #amreading #amwriting Amazon#,"[{'text': 'iartg', 'indices': [0, 6]}, {'text': 'eartg', 'indices': [7, 13]}, {'text': 'asmsg', 'indices': [14, 20]}, {'text': 'indieauthors', 'indices': [21, 34]}, {'text': 'bookboost', 'indices': [35, 45]}, {'text': 'indiebooksbeseen', 'indices': [46, 63]}, {'text': 'indiebookspromo', 'indices': [64, 80]}, {'text': 'amreading', 'indices': [81, 91]}, {'text': 'amwriting', 'indices': [92, 102]}]",2021-06-26 11:35:36,5094
69,1408750772783747074,you wish see your website rank the top the #SearchEngine results Get better #rankings #optimize your,"[{'text': 'SearchEngine', 'indices': [55, 68]}, {'text': 'rankings', 'indices': [89, 98]}, {'text': 'optimize', 'indices': [100, 109]}]",2021-06-26 11:35:32,121
70,1408750043272781826,delighted announce that have been #mentor for the Google Android track the Google Africa Developer Schola,"[{'text': 'mentor', 'indices': [65, 72]}]",2021-06-26 11:32:38,3393
71,1408749963916500994,#usher #crowder #june coup #google #ethan Adaprox Fingerbot Home Hub Bluetooth Bridge Smart Home System Voice Cont,"[{'text': 'usher', 'indices': [0, 6]}, {'text': 'crowder', 'indices': [7, 15]}, {'text': 'june22coup', 'indices': [16, 27]}, {'text': 'google', 'indices': [28, 35]}, {'text': 'ethan', 'indices': [36, 42]}]",2021-06-26 11:32:19,421
72,1408749908790743043,delighted announce that have been #mentor for the Google Android track the Google Africa Developer,"[{'text': 'mentor', 'indices': [47, 54]}]",2021-06-26 11:32:06,1005
73,1408749701692903425,Google has now officially announced the new innovations that will address the specific challenges and opportunities the,[],2021-06-26 11:31:16,1692
74,1408749579693133824,#SEO Tip Submit unique content your webpages Avoid duplicates #google #bing #web,"[{'text': 'SEO', 'indices': [0, 4]}, {'text': 'google', 'indices': [66, 73]}, {'text': 'bing', 'indices': [74, 79]}, {'text': 'web', 'indices': [80, 84]}]",2021-06-26 11:30:47,364
75,1408749567902990336,You rank higher Google heart everyone talks about you #seo #digitalmarketing #google,"[{'text': 'seo', 'indices': [66, 70]}, {'text': 'digitalmarketing', 'indices': [71, 88]}, {'text': 'google', 'indices': [89, 96]}]",2021-06-26 11:30:44,18
76,1408749390307627016,you know #Google Replaces #BERT Self Attention with #FourierTransform Accuracy Times Faster #GPUs,"[{'text': 'Google', 'indices': [13, 20]}, {'text': 'BERT', 'indices': [30, 35]}, {'text': 'FourierTransform', 'indices': [56, 73]}, {'text': 'GPUs', 'indices': [107, 112]}]",2021-06-26 11:30:02,12
77,1408749285244559364,Never let your children say they want grow and robots will make them feel unwanted #Google mad,"[{'text': 'Google', 'indices': [104, 111]}]",2021-06-26 11:29:37,80
78,1408748893760851970,report Web Stories usage Google says new stories are now being added the search index every day via,[],2021-06-26 11:28:04,4026
79,1408748634884165634,Google Exploring Post Pandemic Remote Work Options for Employees Gizmodo #pandemic #work #tool #google #allow,"[{'text': 'pandemic', 'indices': [78, 87]}, {'text': 'work', 'indices': [88, 93]}, {'text': 'tool', 'indices': [94, 99]}, {'text': 'google', 'indices': [100, 107]}, {'text': 'allow', 'indices': [108, 114]}]",2021-06-26 11:27:02,6989
80,1408748566898561027,google business account has been suspended without pre informing warning about the mistake please restore,[],2021-06-26 11:26:46,29
81,1408748074734739459,Ultimate Fat Burning Solution #Google,"[{'text': 'Google', 'indices': [33, 40]}]",2021-06-26 11:24:48,6216
82,1408748051418734600,Are you looking improve your #Google expertise authority and trust you want know about some the quickest and,"[{'text': 'Google', 'indices': [49, 56]}]",2021-06-26 11:24:43,996
83,1408747761026076674,Absolute Bristol The heat Surgeon #Google,"[{'text': 'Google', 'indices': [38, 45]}]",2021-06-26 11:23:34,70
84,1408747759298039809,#Computing #Google #Fi #VPN finally rolling out #iPhones Google built VPN ser,"[{'text': 'Computing', 'indices': [25, 35]}, {'text': 'Google', 'indices': [36, 43]}, {'text': 'Fi', 'indices': [44, 47]}, {'text': 'VPN', 'indices': [48, 52]}, {'text': 'iPhones', 'indices': [79, 87]}]",2021-06-26 11:23:33,93
85,1408747400047431684,#sketchupmini iofficial large scale truss framing #Architect #archilovers,"[{'text': 'sketchupmini_iofficial', 'indices': [0, 23]}, {'text': 'Architect', 'indices': [64, 74]}, {'text': 'archilovers', 'indices': [75, 87]}]",2021-06-26 11:22:08,5
86,1408746443163176960,just take look this #usher #crowder #june coup #google #ethan,"[{'text': 'usher', 'indices': [29, 35]}, {'text': 'crowder', 'indices': [36, 44]}, {'text': 'june22coup', 'indices': [45, 56]}, {'text': 'google', 'indices': [57, 64]}, {'text': 'ethan', 'indices': [65, 71]}]",2021-06-26 11:18:19,421
87,1408746363177873413,The first impression with #App #Icon Design determines how further the interactions with app will,"[{'text': 'App', 'indices': [47, 51]}, {'text': 'Icon', 'indices': [52, 57]}]",2021-06-26 11:18:00,1634
88,1408745648023814146,Play First Game Fallopian Fighter Android now drop email there any features you like see,[],2021-06-26 11:15:10,285
89,1408745617447436291,Google sweeping proposals deprecate third party cookies Chrome browser going back the drawing board,[],2021-06-26 11:15:03,280
90,1408745616776237060,Google sweeping proposals deprecate third party cookies Chrome browser going back the drawing board,[],2021-06-26 11:15:02,54
91,1408745380456636418,Touch and Mark Parisi Listen #markparisiguitar #music #guitar #rocknroll #Google,"[{'text': 'markparisiguitar', 'indices': [70, 87]}, {'text': 'music', 'indices': [88, 94]}, {'text': 'guitar', 'indices': [95, 102]}, {'text': 'rocknroll', 'indices': [103, 113]}, {'text': 'Google', 'indices': [114, 121]}]",2021-06-26 11:14:06,2613
92,1408744484087623682,google business account has been suspended without pre informing warning about the mistake please restore,[],2021-06-26 11:10:32,80
93,1408744121301299204,google business account has been suspended without pre informing warning about the mistake please restore,[],2021-06-26 11:09:06,80
94,1408744016124866560,The only time Google wrong DRUGS ARE HARMFUL QUIT DRUGS #ahmedabadpolice #antidrugsday #drugsarenotcool #dru,"[{'text': 'ahmedabadpolice', 'indices': [87, 103]}, {'text': 'antidrugsday', 'indices': [104, 117]}, {'text': 'drugsarenotcool', 'indices': [118, 134]}]",2021-06-26 11:08:41,1
95,1408743934487150592,FREE Winter check for your Google Ads account #google #adwords,"[{'text': 'google', 'indices': [51, 58]}, {'text': 'adwords', 'indices': [59, 67]}]",2021-06-26 11:08:21,3297
96,1408743932381569025,#Google #Android #Al #Huawei #samsung #Apple #USA #AppleMusic #AllStars #gamer #Russia #ger #uk Guys Foun,"[{'text': 'Google', 'indices': [0, 7]}, {'text': 'Android', 'indices': [8, 16]}, {'text': 'Al', 'indices': [17, 20]}, {'text': 'Huawei', 'indices': [21, 28]}, {'text': '5G', 'indices': [29, 32]}, {'text': 'samsung', 'indices': [33, 41]}, {'text': 'Apple', 'indices': [42, 48]}, {'text': 'USA', 'indices': [49, 53]}, {'text': 'AppleMusic', 'indices': [54, 65]}, {'text': 'AllStars6', 'indices': [66, 76]}, {'text': 'gamer', 'indices': [77, 83]}, {'text': 'Russia', 'indices': [84, 91]}, {'text': 'ger', 'indices': [92, 96]}, {'text': 'uk', 'indices': [99, 102]}]",2021-06-26 11:08:21,96
97,1408743912286556162,Tech fact Like share amp follow #computer #Google #askew #techfacts #technology #didyouknow #didyouknowfacts,"[{'text': 'computer', 'indices': [42, 51]}, {'text': 'Google', 'indices': [52, 59]}, {'text': 'askew', 'indices': [60, 66]}, {'text': 'techfacts', 'indices': [67, 77]}, {'text': 'technology', 'indices': [78, 89]}, {'text': 'didyouknow', 'indices': [90, 101]}, {'text': 'didyouknowfacts', 'indices': [102, 118]}]",2021-06-26 11:08:16,1
98,1408743576813592579,Chill Zone Alert Never dull day The #Parachain pressing onwards The cap,"[{'text': 'Parachain', 'indices': [103, 113]}]",2021-06-26 11:06:56,5
99,1408743546341965826,Play First Game Fallopian Fighter Android now drop email there any features you like see,[],2021-06-26 11:06:49,4325
100,1408743523449442310,Play First Game Fallopian Fighter Android now drop email there any features you like,[],2021-06-26 11:06:43,210
