Unnamed: 0,id,text,Hashtags,date,follower_count
459,1410321706422616072,#Google announced the introduction new artificial intelligence tools help fight against range spam Learn,"[{'text': 'Google', 'indices': [17, 24]}]",2021-06-30 19:37:51,994
460,1410321694347177992,Looking forward providing with Google training tomorrow Excited learning from this super,[],2021-06-30 19:37:49,38
461,1410321594564681733,Rollout the DENT App update are rolling out worldwide speak More details updates very soon #AppStore,"[{'text': 'AppStore', 'indices': [129, 138]}]",2021-06-30 19:37:25,212
462,1410321473781260304,#androiddev #android #kotlin #jetbrains #google Some lesser known points about Android Drawable Like which one you didn know,"[{'text': 'androiddev', 'indices': [11, 22]}, {'text': 'android', 'indices': [23, 31]}, {'text': 'kotlin', 'indices': [32, 39]}, {'text': 'jetbrains', 'indices': [40, 50]}, {'text': 'google', 'indices': [51, 58]}]",2021-06-30 19:36:56,447
463,1410321150106800134,#androiddev #android #kotlin #jetbrains #google Some lesser known points about Android Drawable Like which one you didn know,"[{'text': 'androiddev', 'indices': [11, 22]}, {'text': 'android', 'indices': [23, 31]}, {'text': 'kotlin', 'indices': [32, 39]}, {'text': 'jetbrains', 'indices': [40, 50]}, {'text': 'google', 'indices': [51, 58]}]",2021-06-30 19:35:39,3395
464,1410321000512819208,looks like big tech companies need start planning for structure Congress considering breaking Goo,[],2021-06-30 19:35:03,32
465,1410320994208653312,#androiddev #android #kotlin #jetbrains #google Some lesser known points about Android Drawable Like which one,"[{'text': 'androiddev', 'indices': [0, 11]}, {'text': 'android', 'indices': [12, 20]}, {'text': 'kotlin', 'indices': [21, 28]}, {'text': 'jetbrains', 'indices': [29, 39]}, {'text': 'google', 'indices': [40, 47]}]",2021-06-30 19:35:02,525
466,1410320902592602112,Check out this new photograph that uploaded #Woman #Dress #Beach,"[{'text': 'Woman', 'indices': [117, 123]}, {'text': 'Dress', 'indices': [124, 130]}, {'text': 'Beach', 'indices': [131, 137]}]",2021-06-30 19:34:40,3429
467,1410320830920376323,Another star review Thanks much for the kind words,[],2021-06-30 19:34:23,52
468,1410320662493679616,Reliance Jio working services expand India collaboration with NXP semiconductors #Reliance,"[{'text': 'Reliance', 'indices': [121, 130]}, {'text': '5G', 'indices': [131, 134]}]",2021-06-30 19:33:43,9100
469,1410320626854809601,Rollout the DENT App update are rolling out worldwide speak More details updates very soon #AppStore,"[{'text': 'AppStore', 'indices': [129, 138]}]",2021-06-30 19:33:34,76
470,1410320520915034116,Guys please lemme know there any chance could trader our google balance our bank account #GooglePlay #Google,"[{'text': 'GooglePlay', 'indices': [101, 112]}, {'text': 'Google', 'indices': [113, 120]}]",2021-06-30 19:33:09,72
471,1410320399825616897,Check out this new photograph that uploaded #Woman #Dress #Beach,"[{'text': 'Woman', 'indices': [117, 123]}, {'text': 'Dress', 'indices': [124, 130]}, {'text': 'Beach', 'indices': [131, 137]}]",2021-06-30 19:32:40,4211
472,1410320316405067784,Are you looking improve your #Google expertise authority and trust you want know about some the quickest amp,"[{'text': 'Google', 'indices': [49, 56]}]",2021-06-30 19:32:20,1159
473,1410320088176148485,hot one How heat waves have trended over time #Google,"[{'text': 'Google', 'indices': [78, 85]}]",2021-06-30 19:31:26,1662
474,1410320086213201920,update our progress responsible innovation #Google,"[{'text': 'Google', 'indices': [79, 86]}]",2021-06-30 19:31:25,1662
475,1410319996249690115,Reliance Jio working services expand India collaboration with NXP semiconductors #Reliance,"[{'text': 'Reliance', 'indices': [121, 130]}, {'text': '5G', 'indices': [131, 134]}]",2021-06-30 19:31:04,1334
476,1410319952263979010,#Stadia also has free version where you only pay for the game and don have pay for console,"[{'text': 'Stadia', 'indices': [14, 21]}]",2021-06-30 19:30:53,637
477,1410319905719738371,Reliance Jio working services expand India collaboration with NXP semiconductors #Reliance,"[{'text': 'Reliance', 'indices': [121, 130]}, {'text': '5G', 'indices': [131, 134]}]",2021-06-30 19:30:42,1608
478,1410319905702961153,Reliance Jio working services expand India collaboration with NXP semiconductors #Reliance,"[{'text': 'Reliance', 'indices': [121, 130]}, {'text': '5G', 'indices': [131, 134]}]",2021-06-30 19:30:42,670
479,1410319882537914394,Reliance Jio working services expand India collaboration with NXP semiconductors #Reliance,"[{'text': 'Reliance', 'indices': [103, 112]}]",2021-06-30 19:30:37,131
480,1410319806084141061,#Bowmonk #BrakeCheck #Calibration amp Product Kit #Service Upgrade you own Bowmonk BrakeCheck amp requires,"[{'text': 'Bowmonk', 'indices': [0, 8]}, {'text': 'BrakeCheck', 'indices': [9, 20]}, {'text': 'Calibration', 'indices': [24, 36]}, {'text': 'Service', 'indices': [55, 63]}]",2021-06-30 19:30:18,503
481,1410319592073818115,Gray Raven Database Karenina Ember vol Releasing the weapon restriction Karenina able unleash the full force,[],2021-06-30 19:29:27,201
482,1410319493822246912,Okay Meg Thank you for what you are doing for your community know there much learn,[],2021-06-30 19:29:04,38
483,1410319381746257920,Mutton Power Equipment #Google,"[{'text': 'Google', 'indices': [26, 33]}]",2021-06-30 19:28:37,520
484,1410319250946809858,Gray Raven Database Karenina Ember vol Releasing the weapon restriction Karenina able unleash the full force,[],2021-06-30 19:28:06,466
485,1410319215119196162,Your integration Google Calendar has been down since yesterday Any updates #Google,"[{'text': 'Google', 'indices': [98, 105]}]",2021-06-30 19:27:58,498
486,1410319185700327426,#Google announced the introduction new artificial intelligence tools help fight against range spam Learn,"[{'text': 'Google', 'indices': [17, 24]}]",2021-06-30 19:27:50,7849
487,1410318831944232960,#BitTitan #MigrationWiz introduces Shared Drive destination endpoint for organizations looking consolidate multiple,"[{'text': 'BitTitan', 'indices': [14, 23]}, {'text': 'MigrationWiz', 'indices': [24, 37]}]",2021-06-30 19:26:26,3980
488,1410318738784587783,Not the Megapixels How You Use Them GoogleTV home screen ads One Plus Nord first look,[],2021-06-30 19:26:04,107
489,1410317910493470720,Today #GoogleDoodle Celebrating the Wadden Sea #GoogleDoodle Find out more,"[{'text': 'GoogleDoodle', 'indices': [8, 21]}, {'text': 'GoogleDoodle', 'indices': [52, 65]}]",2021-06-30 19:22:46,350
490,1410317903996456963,Not the Megapixels How You Use Them GoogleTV home screen ads One Plus Nord first look,[],2021-06-30 19:22:45,107
491,1410317772605775872,Google Documents How HTTP Status Codes Network amp DNS Errors Impact Google Search #gone #http #google #document,"[{'text': 'gone', 'indices': [86, 91]}, {'text': 'http', 'indices': [92, 97]}, {'text': 'google', 'indices': [98, 105]}, {'text': 'document', 'indices': [106, 115]}]",2021-06-30 19:22:14,2489
492,1410317216516476931,The Google Pixel could arrive August but rocking the same specs and design the Pixel Does this make sense,[],2021-06-30 19:20:01,690
493,1410317148858245121,What can learn from #Google cookie deprecation delay #VentureBeat,"[{'text': 'Google', 'indices': [23, 30]}, {'text': 'VentureBeat', 'indices': [58, 70]}]",2021-06-30 19:19:45,1729
494,1410316966460416001,Apps News #Google moving away from APKs the Play Store The Verge #News,"[{'text': 'Google', 'indices': [12, 19]}, {'text': 'News', 'indices': [75, 80]}]",2021-06-30 19:19:01,23787
495,1410316864312467462,#Google announced the introduction new artificial intelligence tools help fight against range spam Learn,"[{'text': 'Google', 'indices': [17, 24]}]",2021-06-30 19:18:37,1159
496,1410316749812215809,#Tesla accelerated world EVs But #Google first company attack self driving Been since #Waymo,"[{'text': 'Tesla', 'indices': [0, 6]}, {'text': 'Google', 'indices': [37, 44]}, {'text': 'Waymo', 'indices': [109, 115]}]",2021-06-30 19:18:10,212
497,1410316551916441603,Trying look things from different angle otherwise your information safe #BigData #Python #RStats #JavaScript #Re,"[{'text': 'BigData', 'indices': [99, 107]}, {'text': 'Python', 'indices': [108, 115]}, {'text': 'RStats', 'indices': [116, 123]}, {'text': 'JavaScript', 'indices': [124, 135]}]",2021-06-30 19:17:23,2805
498,1410316514331303936,Mutton Power Equipment #Google,"[{'text': 'Google', 'indices': [26, 33]}]",2021-06-30 19:17:14,520
499,1410316445318193154,Ultra will sale July stay tuned #trend #doge #mi #xiaomi #MI #Mi #xiaomi #apple #google #reliance,"[{'text': 'trend', 'indices': [65, 71]}, {'text': 'doge', 'indices': [72, 77]}, {'text': 'mi11', 'indices': [78, 83]}, {'text': 'xiaomi', 'indices': [84, 91]}, {'text': 'MI11', 'indices': [92, 97]}, {'text': 'Mi11X', 'indices': [98, 104]}, {'text': 'xiaomi', 'indices': [105, 112]}, {'text': 'apple', 'indices': [113, 119]}, {'text': 'google', 'indices': [120, 127]}, {'text': 'reliance', 'indices': [128, 137]}]",2021-06-30 19:16:57,34
500,1410316437781053440,#Google Funded #Virus Research Carried out #Wuhan linked #Scientist Peter #Dasak #EcoHealth Alliance for over deca,"[{'text': 'Google', 'indices': [15, 22]}, {'text': 'Virus', 'indices': [30, 36]}, {'text': 'Wuhan', 'indices': [62, 68]}, {'text': 'Scientist', 'indices': [78, 88]}, {'text': 'Dasak', 'indices': [95, 101]}, {'text': 'EcoHealth', 'indices': [104, 114]}]",2021-06-30 19:16:55,251
501,1410315159126556681,#usher #crowder #june coup #google #ethan Face Cleansing Brush Silicone Facial Brush Deep Cleaning Pore Cle,"[{'text': 'usher', 'indices': [0, 6]}, {'text': 'crowder', 'indices': [7, 15]}, {'text': 'june22coup', 'indices': [16, 27]}, {'text': 'google', 'indices': [28, 35]}, {'text': 'ethan', 'indices': [36, 42]}]",2021-06-30 19:11:50,420
502,1410315097264828416,Trying look things from different angle otherwise your information safe #BigData #Python #RStats #JavaScript #Re,"[{'text': 'BigData', 'indices': [99, 107]}, {'text': 'Python', 'indices': [108, 115]}, {'text': 'RStats', 'indices': [116, 123]}, {'text': 'JavaScript', 'indices': [124, 135]}]",2021-06-30 19:11:36,896
503,1410315088867778567,Trying look things from different angle otherwise your information safe #BigData #Python #RStats #JavaScript #Re,"[{'text': 'BigData', 'indices': [99, 107]}, {'text': 'Python', 'indices': [108, 115]}, {'text': 'RStats', 'indices': [116, 123]}, {'text': 'JavaScript', 'indices': [124, 135]}]",2021-06-30 19:11:34,1170
504,1410315061198045185,Funeral Home Queens #Google #FuneralHome #FuneralHomeQueens,"[{'text': 'Google', 'indices': [23, 30]}, {'text': 'FuneralHome', 'indices': [55, 67]}, {'text': 'FuneralHomeQueens', 'indices': [69, 87]}]",2021-06-30 19:11:27,182
505,1410315056403845123,Trying look things from different angle otherwise your information safe #BigData #Python #RStats #JavaScript #Re,"[{'text': 'BigData', 'indices': [99, 107]}, {'text': 'Python', 'indices': [108, 115]}, {'text': 'RStats', 'indices': [116, 123]}, {'text': 'JavaScript', 'indices': [124, 135]}]",2021-06-30 19:11:26,579
506,1410315007422783491,Trying look things from different angle otherwise your information safe #BigData #Python #RStats #JavaScript #Re,"[{'text': 'BigData', 'indices': [99, 107]}, {'text': 'Python', 'indices': [108, 115]}, {'text': 'RStats', 'indices': [116, 123]}, {'text': 'JavaScript', 'indices': [124, 135]}]",2021-06-30 19:11:14,1098
507,1410314985025150976,Trying look things from different angle otherwise your information safe #BigData #Python #RStats #JavaScript #Re,"[{'text': 'BigData', 'indices': [99, 107]}, {'text': 'Python', 'indices': [108, 115]}, {'text': 'RStats', 'indices': [116, 123]}, {'text': 'JavaScript', 'indices': [124, 135]}]",2021-06-30 19:11:09,2167
508,1410314842473443328,Good news Google longer requires publishers use the AMP format Bad news What replaces might worse,[],2021-06-30 19:10:35,4555
509,1410314784092819456,Not good day for capturing star #teampixel #Google #GooglePixel #Astrophotography #nightsights #Pixel,"[{'text': 'teampixel', 'indices': [36, 46]}, {'text': 'Google', 'indices': [47, 54]}, {'text': 'GooglePixel', 'indices': [55, 67]}, {'text': 'Astrophotography', 'indices': [68, 85]}, {'text': 'nightsights', 'indices': [86, 98]}, {'text': 'Pixel3', 'indices': [99, 106]}]",2021-06-30 19:10:21,27
510,1410314717353189381,Painting with Twist #Google,"[{'text': 'Google', 'indices': [25, 32]}]",2021-06-30 19:10:05,143
511,1410314711686598656,Facebook Insights going away today Find out how continue analyzing the performance your posts and learn,[],2021-06-30 19:10:04,821
512,1410314234081251328,Sharing caring Wednesday daily brief #marketing #google #seo,"[{'text': 'marketing', 'indices': [86, 96]}, {'text': 'google', 'indices': [97, 104]}, {'text': 'seo', 'indices': [105, 109]}]",2021-06-30 19:08:10,531
513,1410314211255803907,Sharing caring Wednesday daily brief #marketing #google #seo,"[{'text': 'marketing', 'indices': [67, 77]}, {'text': 'google', 'indices': [78, 85]}, {'text': 'seo', 'indices': [86, 90]}]",2021-06-30 19:08:04,47229
514,1410314056679006210,Trying look things from different angle otherwise your information safe #BigData #Python #RStats #JavaScript #Re,"[{'text': 'BigData', 'indices': [99, 107]}, {'text': 'Python', 'indices': [108, 115]}, {'text': 'RStats', 'indices': [116, 123]}, {'text': 'JavaScript', 'indices': [124, 135]}]",2021-06-30 19:07:28,2761
515,1410313860167487498,Gray Raven Database Karenina Ember vol Releasing the weapon restriction Karenina able unleash the full force,[],2021-06-30 19:06:41,0
516,1410313834313756672,Carrier injects SMS into Google verification code Google via #message #google #smsad,"[{'text': 'message', 'indices': [108, 116]}, {'text': 'google', 'indices': [117, 124]}, {'text': 'smsad', 'indices': [125, 131]}]",2021-06-30 19:06:35,1152
517,1410313451595964416,#Google searches Raj Kaushal old,"[{'text': 'Google', 'indices': [26, 33]}]",2021-06-30 19:05:03,23787
518,1410313446088970246,#Google announced the introduction new artificial intelligence tools help fight against range spam Learn,"[{'text': 'Google', 'indices': [17, 24]}]",2021-06-30 19:05:02,3984
519,1410313294347448322,Like and share #usher #crowder #june coup #google #ethan,"[{'text': 'usher', 'indices': [16, 22]}, {'text': 'crowder', 'indices': [23, 31]}, {'text': 'june22coup', 'indices': [32, 43]}, {'text': 'google', 'indices': [44, 51]}, {'text': 'ethan', 'indices': [52, 58]}]",2021-06-30 19:04:26,420
520,1410313184846639105,The Best Relaxing Piano amp Flute Music Ever via #relaxingmusic #stressfree,"[{'text': 'relaxingmusic', 'indices': [84, 98]}, {'text': 'stressfree', 'indices': [99, 110]}]",2021-06-30 19:04:00,108
521,1410313027115622404,#Google has published updated document which goes over six different types URL redirects and their effects,"[{'text': 'Google', 'indices': [0, 7]}]",2021-06-30 19:03:22,8548
522,1410312984757420043,#Google searches Raj Kaushal old,"[{'text': 'Google', 'indices': [6, 13]}]",2021-06-30 19:03:12,3316
523,1410312970484211714,#Google searches Severe Thunderstorm Watch old,"[{'text': 'Google', 'indices': [5, 12]}]",2021-06-30 19:03:09,3316
524,1410312967413911554,would they feel threatened finally #amazon #apple #facebook #google #microsoft,"[{'text': 'amazon', 'indices': [53, 60]}, {'text': 'apple', 'indices': [61, 67]}, {'text': 'facebook', 'indices': [68, 77]}, {'text': 'google', 'indices': [78, 85]}, {'text': 'microsoft', 'indices': [86, 96]}]",2021-06-30 19:03:08,15
525,1410312683837018114,Expert #GoogleAnalytics Tips for Beginners Define your main objectives and goals Watch Google #Analytics tuto,"[{'text': 'GoogleAnalytics', 'indices': [32, 48]}, {'text': 'Analytics', 'indices': [124, 134]}]",2021-06-30 19:02:00,9384
526,1410312683056893952,What Makes Good Quality #ContentMarketing #SCORESmallBiz #Newsletter #SmallBiz #business #SmallBusiness #SEO #Google #market,"[{'text': 'ContentMarketing', 'indices': [39, 56]}, {'text': 'SCORESmallBiz', 'indices': [57, 71]}, {'text': 'Newsletter', 'indices': [72, 83]}, {'text': 'SmallBiz', 'indices': [84, 93]}, {'text': 'business', 'indices': [94, 103]}, {'text': 'SmallBusiness', 'indices': [104, 118]}, {'text': 'SEO', 'indices': [119, 123]}, {'text': 'Google', 'indices': [124, 131]}]",2021-06-30 19:02:00,2004
527,1410312500956913668,#Google owned #VideoStreaming giant #YouTube introducing new add that introduces quality downloads and,"[{'text': 'Google', 'indices': [20, 27]}, {'text': 'VideoStreaming', 'indices': [34, 49]}, {'text': 'YouTube', 'indices': [56, 64]}, {'text': '4K', 'indices': [112, 115]}]",2021-06-30 19:01:17,3145
528,1410312319423320068,Gray Raven Database Karenina Ember vol Releasing the weapon restriction Karenina able unleash the full force,[],2021-06-30 19:00:33,11
529,1410312239148642322,#Google announced the introduction new artificial intelligence tools help fight against range spam,"[{'text': 'Google', 'indices': [0, 7]}]",2021-06-30 19:00:14,5498
530,1410312208777682948,#Google Begins Using MUM For Vaccine Search Results Google first application MUM real world search result,"[{'text': 'Google', 'indices': [0, 7]}]",2021-06-30 19:00:07,430
531,1410312179161645059,You haven listened the latest episode #GGNP yet Its the most unique sports show the world,"[{'text': 'GGNP', 'indices': [46, 51]}]",2021-06-30 19:00:00,71
532,1410312144223100935,Asus ZenFone review Android iPhone mini #google,"[{'text': 'google', 'indices': [70, 77]}]",2021-06-30 18:59:52,1786
533,1410312095321706496,Assisted Living Locators Chicagoland North #Google Discussions about Senior Living Placement Agents,"[{'text': 'Google', 'indices': [46, 53]}]",2021-06-30 18:59:40,586
534,1410311959942160390,write ready publish #Google friendly website content for agencies and marketers Everything you need from,"[{'text': 'Google', 'indices': [26, 33]}]",2021-06-30 18:59:08,12788
535,1410311918045306892,Security Researcher points out Google Cloud hijack using DHCP floods via weak random number generator #News #Infosec,"[{'text': 'News', 'indices': [123, 128]}, {'text': 'Infosec', 'indices': [129, 137]}]",2021-06-30 18:58:58,1418
536,1410311916648423426,Security Researcher points out Google Cloud hijack using DHCP floods via weak random number generator #News #Infosec,"[{'text': 'News', 'indices': [123, 128]}, {'text': 'Infosec', 'indices': [129, 137]}]",2021-06-30 18:58:57,971
537,1410311857080979458,#BitTitan #MigrationWiz introduces Shared Drive destination endpoint for organizations looking consolidate multiple,"[{'text': 'BitTitan', 'indices': [14, 23]}, {'text': 'MigrationWiz', 'indices': [24, 37]}]",2021-06-30 18:58:43,528
538,1410311835232915462,Security Researcher points out Google Cloud hijack using DHCP floods via weak random number generator #News #Infosec,"[{'text': 'News', 'indices': [123, 128]}, {'text': 'Infosec', 'indices': [129, 137]}]",2021-06-30 18:58:38,1429
539,1410311531611529222,amp switching all Android phones Google Messages app for RCS #phones #app #messagesapp #att #google,"[{'text': 'phones', 'indices': [74, 81]}, {'text': 'app', 'indices': [82, 86]}, {'text': 'messagesapp', 'indices': [87, 99]}, {'text': 'att', 'indices': [100, 104]}, {'text': 'google', 'indices': [105, 112]}]",2021-06-30 18:57:26,1685
540,1410311366649466890,Starting July advertisers will longer able create broad match modifier keywords with the keyword notat,[],2021-06-30 18:56:46,257
541,1410311052340781056,#BitTitan #MigrationWiz introduces Shared Drive destination endpoint for organizations looking consolidate multiple,"[{'text': 'BitTitan', 'indices': [14, 23]}, {'text': 'MigrationWiz', 'indices': [24, 37]}]",2021-06-30 18:55:31,352
542,1410310780176764931,Dual blocking interesting #Iran authority blocks the using #waze application #Iran #Google and #waze,"[{'text': 'Iran', 'indices': [34, 39]}, {'text': 'waze', 'indices': [67, 72]}, {'text': 'Iran', 'indices': [88, 93]}, {'text': 'Google', 'indices': [95, 102]}, {'text': 'waze', 'indices': [107, 112]}]",2021-06-30 18:54:26,2
543,1410310749898035201,Twitch Watch Parties feature rolling out Android and iOS from #google,"[{'text': 'google', 'indices': [106, 113]}]",2021-06-30 18:54:19,227
544,1410310686090084360,How Login Blogger Blogspot Easy Steps #blogger #google #Blog #Tips,"[{'text': 'blogger', 'indices': [85, 93]}, {'text': 'google', 'indices': [94, 101]}, {'text': 'Blog', 'indices': [111, 116]}, {'text': 'Tips', 'indices': [117, 122]}]",2021-06-30 18:54:04,3169
545,1410310653248671751,For decades #Google has been making millions #dollars from the #government #WHO and #CDC ranking high,"[{'text': 'Google', 'indices': [13, 20]}, {'text': 'dollars', 'indices': [49, 57]}, {'text': 'government', 'indices': [70, 81]}, {'text': 'WHO', 'indices': [83, 87]}, {'text': 'CDC', 'indices': [93, 97]}]",2021-06-30 18:53:56,6103
546,1410310652980338691,New Google Cloud VMware Engine autoscaling Mumbai expansion etc #GCP #Google #GoogleClou,"[{'text': 'GCP', 'indices': [115, 119]}, {'text': 'Google', 'indices': [120, 127]}]",2021-06-30 18:53:56,1418
547,1410310109398458379,Google Messages Start Autodeleting OTP Messages For Users via #GoogleMessages #Google,"[{'text': 'GoogleMessages', 'indices': [104, 119]}, {'text': 'Google', 'indices': [120, 127]}]",2021-06-30 18:51:47,129
548,1410309491384532992,#Apple now #Google largest corporate customer for #cloud storage,"[{'text': 'Apple', 'indices': [20, 26]}, {'text': 'Google', 'indices': [34, 41]}, {'text': 'cloud', 'indices': [75, 81]}]",2021-06-30 18:49:19,3096
549,1410309464985640964,#Google Wing launches free app help drone pilots obey regulations OpenSky lets pilots request authorization,"[{'text': 'Google', 'indices': [18, 25]}]",2021-06-30 18:49:13,1878
550,1410309102786461698,Tankless Water Heater Service #Google #TanklessWaterHeaterService,"[{'text': 'Google', 'indices': [37, 44]}, {'text': 'TanklessWaterHeaterService', 'indices': [69, 96]}]",2021-06-30 18:47:47,94
551,1410308958556880896,Genshin Impact Google Play Gift Card Collab Event Brings Redeemable Furniture Blueprints More Details,[],2021-06-30 18:47:12,25
552,1410308782949810178,Max Muscle Sports Nutrition #Google,"[{'text': 'Google', 'indices': [31, 38]}]",2021-06-30 18:46:30,39
553,1410308734757359618,Researcher uncover unpatched #vulnerability #Google Compute Engine platform that could abused attacker,"[{'text': 'vulnerability', 'indices': [51, 65]}, {'text': 'Google', 'indices': [69, 76]}]",2021-06-30 18:46:19,16807
554,1410308720500772868,AMAZON Excellent product This versatile and affordable laptop sale Amazon for less than #amazon,"[{'text': 'amazon', 'indices': [105, 112]}]",2021-06-30 18:46:15,162
555,1410308679417610240,#Google publishes #SEO guide HTTP status codes network issues and DNS errors,"[{'text': 'Google', 'indices': [20, 27]}, {'text': 'SEO', 'indices': [38, 42]}]",2021-06-30 18:46:06,3349
556,1410308539583660035,#Google will warn you about #fakenews websites before you click them,"[{'text': 'Google', 'indices': [0, 7]}, {'text': 'fakenews', 'indices': [28, 37]}]",2021-06-30 18:45:32,1296
557,1410308470063173639,Notary Services Pompano Beach amp Mobile the leading notary public service provider Pompano Beach Fort,[],2021-06-30 18:45:16,663
558,1410308398210588678,Just had our last session with she been fab mentor and #Google,"[{'text': 'Google', 'indices': [103, 110]}]",2021-06-30 18:44:59,694
559,1410308383232741378,you know what Google Cloud Find out right here Knowledge power,[],2021-06-30 18:44:55,159
560,1410308300093067264,Google records over complaints the first monthly transparency report under India rules #Google #India,"[{'text': 'Google', 'indices': [101, 108]}, {'text': 'India', 'indices': [109, 115]}]",2021-06-30 18:44:35,3
561,1410308292241510401,Gray Raven Database Karenina Ember vol Releasing the weapon restriction Karenina able unleash the full force,[],2021-06-30 18:44:33,89
562,1410308254224244736,#Google not only #racist #company but institution that preaches virtue and practices vice #supporting,"[{'text': 'Google', 'indices': [0, 7]}, {'text': 'racist', 'indices': [22, 29]}, {'text': 'company', 'indices': [30, 38]}, {'text': 'supporting', 'indices': [101, 112]}]",2021-06-30 18:44:24,6103
563,1410307784042631169,#BitTitan #MigrationWiz introduces Shared Drive destination endpoint for organizations looking consolidate multiple,"[{'text': 'BitTitan', 'indices': [14, 23]}, {'text': 'MigrationWiz', 'indices': [24, 37]}]",2021-06-30 18:42:32,4927
564,1410307661489270786,How Login Blogger Blogspot Easy Steps #blogger #google #Blog #Tips,"[{'text': 'blogger', 'indices': [71, 79]}, {'text': 'google', 'indices': [80, 87]}, {'text': 'Blog', 'indices': [97, 102]}, {'text': 'Tips', 'indices': [103, 108]}]",2021-06-30 18:42:03,264
565,1410307313051725825,Gray Raven Database Karenina Ember vol Releasing the weapon restriction Karenina able unleash the full force,[],2021-06-30 18:40:40,0
566,1410307289274146819,Professional Village Compounding Pharmacy #Google,"[{'text': 'Google', 'indices': [45, 52]}]",2021-06-30 18:40:34,5
567,1410307282588430340,#Apple now #Google largest corporate customer for #cloud storage,"[{'text': 'Apple', 'indices': [20, 26]}, {'text': 'Google', 'indices': [34, 41]}, {'text': 'cloud', 'indices': [75, 81]}]",2021-06-30 18:40:33,40902
568,1410307154196766726,New Google Cloud VMware Engine autoscaling Mumbai expansion etc #GCP #Google #GoogleCloud #CloudMigration,"[{'text': 'GCP', 'indices': [95, 99]}, {'text': 'Google', 'indices': [100, 107]}, {'text': 'GoogleCloud', 'indices': [108, 120]}, {'text': 'CloudMigration', 'indices': [121, 136]}]",2021-06-30 18:40:02,233
569,1410306858070458370,#Apple now #Google largest corporate customer for #cloud storage,"[{'text': 'Apple', 'indices': [2, 8]}, {'text': 'Google', 'indices': [16, 23]}, {'text': 'cloud', 'indices': [57, 63]}]",2021-06-30 18:38:51,34535
