Unnamed: 0,id,text,Hashtags,date,follower_count
0,1413657983762976769,The route that have taken the best way know leads the direction That need But not,[],2021-07-10 00:35:02,309
1,1413657425996140549,Like Share Top Companies Innovators the World Brazil SFE Company,"[{'text': 'DêLike', 'indices': [0, 7]}]",2021-07-10 00:32:49,1201
2,1413657199214317575,Google bought off Samsung limit app store competition states allege #competition #Sa,"[{'text': 'competition', 'indices': [123, 135]}]",2021-07-10 00:31:55,854
3,1413656927595343877,#SEO guide Search Engine friendly #AJAX web development #SEM #programming #google,"[{'text': 'SEO', 'indices': [0, 4]}, {'text': 'AJAX', 'indices': [35, 40]}, {'text': 'SEM', 'indices': [82, 86]}, {'text': 'programming', 'indices': [87, 99]}, {'text': 'google', 'indices': [100, 107]}]",2021-07-10 00:30:50,350
4,1413656896184094723,Google bought off Samsung limit app store competition states allege #competition,"[{'text': 'competition', 'indices': [102, 114]}]",2021-07-10 00:30:43,16
5,1413656889779425280,Showtime Stingaree Restaurant Crystal beach #setx #crystalbeach #mpi #sing #dance #party #drink,"[{'text': 'setx', 'indices': [56, 61]}, {'text': 'crystalbeach', 'indices': [62, 75]}, {'text': 'mpi', 'indices': [76, 80]}, {'text': 'sing', 'indices': [81, 86]}, {'text': 'dance', 'indices': [87, 93]}, {'text': 'party', 'indices': [94, 100]}, {'text': 'drink', 'indices': [101, 107]}]",2021-07-10 00:30:41,330
6,1413656717087346689,ways SEO experts say you should optimize for Rank rain #SEO #Google #creative,"[{'text': 'SEO', 'indices': [84, 88]}, {'text': 'Google', 'indices': [89, 96]}, {'text': 'creative', 'indices': [97, 106]}]",2021-07-10 00:30:00,3670
7,1413656610749222918,With new innovations Search Google can get you even closer what you looking for Click find out more #Google,"[{'text': 'Google', 'indices': [127, 134]}]",2021-07-10 00:29:35,263
8,1413656126508474375,Legal scholar says President Trump class action lawsuits against #Facebook #Google and #Twitter are very,"[{'text': 'Facebook', 'indices': [94, 103]}, {'text': 'Google', 'indices': [105, 112]}, {'text': 'Twitter', 'indices': [118, 126]}]",2021-07-10 00:27:39,38
9,1413655757627830277,Google Pixel Specs Leak Shows Final Look Before Potential October Launch #google,"[{'text': 'google', 'indices': [102, 109]}]",2021-07-10 00:26:11,1904
10,1413654828329230336,#googletraffic #google #googlediscover Use Google Discover For More Google Traffic Google Traffic Secrets,"[{'text': 'googletraffic', 'indices': [14, 28]}, {'text': 'google', 'indices': [29, 36]}, {'text': 'googlediscover', 'indices': [37, 52]}]",2021-07-10 00:22:30,5030
11,1413654813246582785,Legal scholar says President Trump class action lawsuits against #Facebook #Google and #Twitter are very,"[{'text': 'Facebook', 'indices': [94, 103]}, {'text': 'Google', 'indices': [105, 112]}, {'text': 'Twitter', 'indices': [118, 126]}]",2021-07-10 00:22:26,120
12,1413654560950849543,Macramen Jewelry #Google,"[{'text': 'Google', 'indices': [41, 48]}]",2021-07-10 00:21:26,151
13,1413654468382494724,#Google #Pixel amp Pro specs #Pixel AMOLED mAh Google processor Android Wifi,"[{'text': 'Google', 'indices': [17, 24]}, {'text': 'Pixel', 'indices': [25, 31]}, {'text': 'Pixel6', 'indices': [52, 59]}]",2021-07-10 00:21:04,34
14,1413654165004320770,The environmental parameters this field have just changed commandant New enemies confirmed Let discuss the functi,[],2021-07-10 00:19:52,3
15,1413653939078246408,Great huh #usher #crowder #june coup #google #ethan,"[{'text': 'usher', 'indices': [12, 18]}, {'text': 'crowder', 'indices': [19, 27]}, {'text': 'june22coup', 'indices': [28, 39]}, {'text': 'google', 'indices': [40, 47]}, {'text': 'ethan', 'indices': [48, 54]}]",2021-07-10 00:18:58,2
16,1413653231226527745,Top Level Traffic Web Design Bridgend #Google #topleveltraffic #bridgend #digitalmarketin,"[{'text': 'Google', 'indices': [64, 71]}, {'text': 'topleveltraffic', 'indices': [96, 112]}, {'text': 'bridgend', 'indices': [113, 122]}]",2021-07-10 00:16:09,5935
17,1413653187979055105,Best Computer Repair Bridgend and South Wales #Google #bestcomputerrepair #bridgend #porthcaw,"[{'text': 'Google', 'indices': [68, 75]}, {'text': 'bestcomputerrepair', 'indices': [100, 119]}, {'text': 'bridgend', 'indices': [120, 129]}]",2021-07-10 00:15:59,5935
18,1413652943862210564,July buy #oneplus #device #smoothos #oneplus tpro #neversettle #beyondthespeed,"[{'text': 'oneplus', 'indices': [39, 47]}, {'text': 'device', 'indices': [48, 55]}, {'text': 'smoothos', 'indices': [56, 65]}, {'text': '90hz', 'indices': [66, 71]}, {'text': 'oneplus8tpro', 'indices': [72, 85]}, {'text': 'neversettle', 'indices': [86, 98]}, {'text': 'beyondthespeed', 'indices': [99, 114]}]",2021-07-10 00:15:00,120
19,1413652300837490688,Gray Raven Database Nanami Pulse Vol Construct Features Mixed Damage Able deal Physical and Elemental DMG Resi,[],2021-07-10 00:12:27,39
20,1413652148802490370,#usher #crowder #june coup #google #ethan New Mens Watches LIGE Top Brand Leather Chronograph Waterproof Spor,"[{'text': 'usher', 'indices': [0, 6]}, {'text': 'crowder', 'indices': [7, 15]}, {'text': 'june22coup', 'indices': [16, 27]}, {'text': 'google', 'indices': [28, 35]}, {'text': 'ethan', 'indices': [36, 42]}]",2021-07-10 00:11:51,2
21,1413651524828471299,#Flux For today dceentralised app Flux the next step #cloud #computing bringing #decentralise,"[{'text': 'Flux', 'indices': [11, 16]}, {'text': 'cloud', 'indices': [99, 105]}, {'text': 'computing', 'indices': [106, 116]}]",2021-07-10 00:09:22,297
22,1413651204631007232,When any song only few clicks away your phone almost hard imagine the days when cassette tapes were seen,[],2021-07-10 00:08:06,5123
23,1413650667390963713,Discover the dangers routinely pausing underperforming Google Ads campaigns and sinking all your budget into top performe,[],2021-07-10 00:05:58,100
24,1413650393108713475,amp discuss the episode The Arrival and debate better ways prove airplane illusion,[],2021-07-10 00:04:52,1367
25,1413650358157578245,Legal scholar says President Trump class action lawsuits against #Facebook #Google and #Twitter are very,"[{'text': 'Facebook', 'indices': [94, 103]}, {'text': 'Google', 'indices': [105, 112]}, {'text': 'Twitter', 'indices': [118, 126]}]",2021-07-10 00:04:44,3402
26,1413650322736640000,Featured snippets can help boost brand reputation and drive organic traffic Learn how optimize for them this step,[],2021-07-10 00:04:35,100
27,1413650156935737347,Tips for creating sustainable content strategy suggested successful content creators via,[],2021-07-10 00:03:56,100
28,1413650058017263616,#Flux For today dceentralised app Flux the next step #cloud #computing bringing #decentralise,"[{'text': 'Flux', 'indices': [11, 16]}, {'text': 'cloud', 'indices': [99, 105]}, {'text': 'computing', 'indices': [106, 116]}]",2021-07-10 00:03:32,789
29,1413649924005277701,Looking back Discover ideas and apps you can use your classroom with Google Chromebook App Hub #eduk,"[{'text': 'eduk8me', 'indices': [103, 111]}]",2021-07-10 00:03:00,13473
30,1413649923451588609,Looking back Discover ideas and apps you can use your classroom with Google Chromebook App Hub #eduk,"[{'text': 'eduk8me', 'indices': [103, 111]}]",2021-07-10 00:03:00,7576
31,1413649386735816709,Google Analytics Event Tracking Virtual Pageviews #google #analytics,"[{'text': 'google', 'indices': [79, 86]}, {'text': 'analytics', 'indices': [87, 97]}]",2021-07-10 00:00:52,350
32,1413649000797020162,are NOT closed Please suggest and edit and say that are open Thank you #google #googlemaps #googlereviews https,"[{'text': 'google', 'indices': [98, 105]}, {'text': 'googlemaps', 'indices': [106, 117]}, {'text': 'googlereviews', 'indices': [118, 132]}]",2021-07-09 23:59:20,138
33,1413648729584848899,hate how Android handles google accounts you can not log Google app individually without giving that acc,[],2021-07-09 23:58:16,72
34,1413648708055490564,Salute already filed complaint against with,[],2021-07-09 23:58:10,2194
35,1413647870159466496,Threat hxxps alahsiatot com secureweb page inc #phishing #google,"[{'text': 'phishing', 'indices': [65, 74]}, {'text': 'google', 'indices': [76, 83]}]",2021-07-09 23:54:51,541
36,1413647684964081667,Possible threat hxxps alahsiacok com #phishing #google,"[{'text': 'phishing', 'indices': [44, 53]}, {'text': 'google', 'indices': [55, 62]}]",2021-07-09 23:54:07,541
37,1413647598930612225,Google the internet #google #googl #goog #stock #market #tech #technology #epic #internet #monster,"[{'text': 'google', 'indices': [26, 33]}, {'text': 'googl', 'indices': [34, 40]}, {'text': 'goog', 'indices': [41, 46]}, {'text': 'stock', 'indices': [47, 53]}, {'text': 'market', 'indices': [54, 61]}, {'text': 'tech', 'indices': [62, 67]}, {'text': 'technology', 'indices': [68, 79]}, {'text': 'epic', 'indices': [80, 85]}, {'text': 'internet', 'indices': [86, 95]}, {'text': 'monster', 'indices': [96, 104]}]",2021-07-09 23:53:46,214
38,1413647230423142405,are NOT closed Please suggest and edit and say that are open Thank you #google #googlemaps #googlereviews https,"[{'text': 'google', 'indices': [98, 105]}, {'text': 'googlemaps', 'indices': [106, 117]}, {'text': 'googlereviews', 'indices': [118, 132]}]",2021-07-09 23:52:18,312
39,1413647198085074946,are NOT closed Please suggest and edit and say that are open Thank you #google #googlemaps #googlereviews https,"[{'text': 'google', 'indices': [98, 105]}, {'text': 'googlemaps', 'indices': [106, 117]}, {'text': 'googlereviews', 'indices': [118, 132]}]",2021-07-09 23:52:10,422
40,1413646844400390144,are NOT closed Please suggest and edit and say that are open Thank you #google #googlemaps #googlereviews https,"[{'text': 'google', 'indices': [98, 105]}, {'text': 'googlemaps', 'indices': [106, 117]}, {'text': 'googlereviews', 'indices': [118, 132]}]",2021-07-09 23:50:46,27594
41,1413646829431017475,World Tanks Ranked battles for justice #youtubechannel #memes #youtuber #gamer #games #twitchaffiliate,"[{'text': 'youtubechannel', 'indices': [48, 63]}, {'text': 'memes', 'indices': [64, 70]}, {'text': 'youtuber', 'indices': [71, 80]}, {'text': 'gamer', 'indices': [81, 87]}, {'text': 'games', 'indices': [88, 94]}, {'text': 'twitchaffiliate', 'indices': [95, 111]}]",2021-07-09 23:50:43,34
42,1413645097615470593,Great huh #usher #crowder #june coup #google #ethan,"[{'text': 'usher', 'indices': [12, 18]}, {'text': 'crowder', 'indices': [19, 27]}, {'text': 'june22coup', 'indices': [28, 39]}, {'text': 'google', 'indices': [40, 47]}, {'text': 'ethan', 'indices': [48, 54]}]",2021-07-09 23:43:50,2
43,1413645035409743874,Legal scholar says President Trump class action lawsuits against #Facebook #Google and #Twitter are very,"[{'text': 'Facebook', 'indices': [94, 103]}, {'text': 'Google', 'indices': [105, 112]}, {'text': 'Twitter', 'indices': [118, 126]}]",2021-07-09 23:43:35,18092
44,1413644790713896960,Gray Raven Database Nanami Pulse Vol Construct Features Mixed Damage Able deal Physical and Elemental DMG Resi,[],2021-07-09 23:42:37,8
45,1413644518398861312,#usher #crowder #june coup #google #ethan LIGE New Men Smart watch heart rate Blood pressure waterproof Sport,"[{'text': 'usher', 'indices': [0, 6]}, {'text': 'crowder', 'indices': [7, 15]}, {'text': 'june22coup', 'indices': [16, 27]}, {'text': 'google', 'indices': [28, 35]}, {'text': 'ethan', 'indices': [36, 42]}]",2021-07-09 23:41:32,2
46,1413643714015203328,Nimbus Marketing #Google,"[{'text': 'Google', 'indices': [20, 27]}]",2021-07-09 23:38:20,69
47,1413643354743713797,This #chicago not concrete jungle HOME #google #googleearth #googlefiber #isp Chicago Illinois,"[{'text': 'chicago', 'indices': [8, 16]}, {'text': 'google', 'indices': [47, 54]}, {'text': 'googleearth', 'indices': [55, 67]}, {'text': 'googlefiber', 'indices': [68, 80]}, {'text': 'isp', 'indices': [81, 85]}]",2021-07-09 23:36:54,61
48,1413643299697664003,Phamous Phrillz expands his music empire Philadelphia DroidJournal EXPANDiNG Why did make front page,[],2021-07-09 23:36:41,11774
49,1413643235201884162,Trends checker Google word trend searcher link,[],2021-07-09 23:36:26,715
50,1413643169254813698,CENTURY Ocean #Google #capecanaveral #villagesofseaport,"[{'text': 'Google', 'indices': [20, 27]}, {'text': 'capecanaveral', 'indices': [54, 68]}, {'text': 'villagesofseaport', 'indices': [69, 87]}]",2021-07-09 23:36:10,387
51,1413642884465766405,Find your Google Activity page and purge all those awkward Google Home Google Nest voice searches,[],2021-07-09 23:35:02,205
52,1413642720766091265,Urgent More Top Networks Required Global For Unlimited Money Week With Cryptocurrency amp Networking Joi,[],2021-07-09 23:34:23,2830
53,1413642446324396034,Urgent More Top Networks Required Global For Unlimited Money Week With Cryptocurrency amp Networking Join Free,[],2021-07-09 23:33:18,62
54,1413642346063974402,#GodofAbraham #Jesus News Release #Actor #Entertainer #Facebook #Tumblr,"[{'text': 'GodofAbraham', 'indices': [0, 13]}, {'text': 'Jesus', 'indices': [14, 20]}, {'text': 'Actor', 'indices': [67, 73]}, {'text': 'Entertainer', 'indices': [75, 87]}, {'text': 'Facebook', 'indices': [90, 99]}, {'text': 'Tumblr', 'indices': [101, 108]}]",2021-07-09 23:32:54,342
55,1413642270667001857,Urgent More Top Networks Required Global For Unlimited Money Week With Cryptocurrency amp Networking Join Free,[],2021-07-09 23:32:36,282
56,1413642035777523717,Urgent More Top Networks Required Global For Unlimited Money Week With Cryptocurrency amp Networking Join Free,[],2021-07-09 23:31:40,2830
57,1413641819775242243,Geotargeting websites with Country Code TLDs #SEO #SEM #google,"[{'text': 'SEO', 'indices': [70, 74]}, {'text': 'SEM', 'indices': [75, 79]}, {'text': 'google', 'indices': [80, 87]}]",2021-07-09 23:30:48,350
58,1413641747339546624,Jamie Stevens Max River Cities Realtor Licensed #Google,"[{'text': 'Google', 'indices': [64, 71]}]",2021-07-09 23:30:31,108
59,1413641633711656960,The best browser replace #Google Chrome Windows Mac iPhone and Android ZDNet,"[{'text': 'Google', 'indices': [28, 35]}]",2021-07-09 23:30:04,14802
60,1413641617718796291,Ways Unlock The Benefits Semantic Search #SEO #Google #creative #marketingdigital,"[{'text': 'SEO', 'indices': [75, 79]}, {'text': 'Google', 'indices': [80, 87]}, {'text': 'creative', 'indices': [88, 97]}, {'text': 'marketingdigital', 'indices': [98, 115]}]",2021-07-09 23:30:00,3670
61,1413641617622372357,Learn how Google assesses the authority web pages #SEO #Google #creative,"[{'text': 'SEO', 'indices': [82, 86]}, {'text': 'Google', 'indices': [87, 94]}, {'text': 'creative', 'indices': [95, 104]}]",2021-07-09 23:30:00,3670
62,1413641616393269250,#Google privacy engineer says quit over constant gaslighting following the firing two #AI experts,"[{'text': 'Google', 'indices': [2, 9]}, {'text': 'AI', 'indices': [96, 99]}]",2021-07-09 23:30:00,109533
63,1413641497568714755,Startups with founder that has worked please apply here present More info,[],2021-07-09 23:29:31,1445
64,1413640712386662400,EXPANDiNG Why did make front page google New Yesterday #Googleit #google #googlenews,"[{'text': 'Googleit', 'indices': [65, 74]}, {'text': 'google', 'indices': [81, 88]}, {'text': 'googlenews', 'indices': [89, 100]}]",2021-07-09 23:26:24,11774
65,1413640530907500546,#Facebook now trillion company Joining #Apple #Microsoft #Amazon amp #Google Their gains during the pandemic were,"[{'text': 'Facebook', 'indices': [17, 26]}, {'text': 'Apple', 'indices': [64, 70]}, {'text': 'Microsoft', 'indices': [72, 82]}, {'text': 'Amazon', 'indices': [84, 91]}, {'text': 'Google', 'indices': [98, 105]}]",2021-07-09 23:25:41,2402
66,1413640048428388357,Google What Can Say #google #googl #stock #tech #internet #goog #technology #epic #monster,"[{'text': 'google', 'indices': [27, 34]}, {'text': 'googl', 'indices': [35, 41]}, {'text': 'stock', 'indices': [42, 48]}, {'text': 'tech', 'indices': [49, 54]}, {'text': 'internet', 'indices': [55, 64]}, {'text': 'goog', 'indices': [65, 70]}, {'text': 'technology', 'indices': [71, 82]}, {'text': 'epic', 'indices': [83, 88]}, {'text': 'monster', 'indices': [89, 97]}]",2021-07-09 23:23:46,214
67,1413639655858311171,#GodofAbraham #Jesus News Release #Actor #Entertainer #Facebook #Tumblr,"[{'text': 'GodofAbraham', 'indices': [0, 13]}, {'text': 'Jesus', 'indices': [14, 20]}, {'text': 'Actor', 'indices': [67, 73]}, {'text': 'Entertainer', 'indices': [75, 87]}, {'text': 'Facebook', 'indices': [90, 99]}, {'text': 'Tumblr', 'indices': [101, 108]}]",2021-07-09 23:22:12,342
68,1413639589005303809,Take them DOWN #CPAC #trump #Google #Twitter #Facebook #ArtistOnTwitter #censorship #BigTech,"[{'text': 'CPAC2021', 'indices': [18, 27]}, {'text': 'trump', 'indices': [28, 34]}, {'text': 'Google', 'indices': [35, 42]}, {'text': 'Twitter', 'indices': [43, 51]}, {'text': 'Facebook', 'indices': [52, 61]}, {'text': 'ArtistOnTwitter', 'indices': [62, 78]}, {'text': 'censorship', 'indices': [79, 90]}, {'text': 'BigTech', 'indices': [91, 99]}]",2021-07-09 23:21:56,3562
69,1413639549239058432,#Via via #Google #Search #Trending #Topic GREGORY ANTWONE ALEXANDER,"[{'text': 'Via', 'indices': [0, 4]}, {'text': 'Google', 'indices': [10, 17]}, {'text': 'Search', 'indices': [27, 34]}, {'text': 'Trending', 'indices': [35, 44]}, {'text': 'Topic', 'indices': [45, 51]}]",2021-07-09 23:21:47,525
70,1413639368195989504,top notch Bissell vac for just Amazon #amazon #marketing #cybersecurity #ai #google #digitalmarketing #info,"[{'text': 'amazon', 'indices': [69, 76]}, {'text': 'marketing', 'indices': [77, 87]}, {'text': 'cybersecurity', 'indices': [88, 102]}, {'text': 'ai', 'indices': [103, 106]}, {'text': 'google', 'indices': [107, 114]}, {'text': 'digitalmarketing', 'indices': [115, 132]}]",2021-07-09 23:21:04,2675
71,1413639020173742082,Are you #journalist interested collabing with someone all topics #PopCulture #industry,"[{'text': 'journalist', 'indices': [10, 21]}, {'text': 'PopCulture', 'indices': [83, 94]}, {'text': 'industry', 'indices': [96, 105]}]",2021-07-09 23:19:41,525
72,1413638568044601355,you woke would you Google the #Bitcoin price #prediction #Google #future,"[{'text': 'Bitcoin', 'indices': [58, 66]}, {'text': 'prediction', 'indices': [75, 86]}, {'text': 'Google', 'indices': [87, 94]}, {'text': 'future', 'indices': [95, 102]}]",2021-07-09 23:17:53,8
73,1413637926999691265,This week #Techstars #Artificialintelligence #AI Top #startups #OpenAI amp #GitHu,"[{'text': 'Techstars', 'indices': [36, 46]}, {'text': 'Artificialintelligence', 'indices': [65, 88]}, {'text': 'AI', 'indices': [92, 95]}, {'text': 'startups', 'indices': [103, 112]}, {'text': 'OpenAI', 'indices': [123, 130]}]",2021-07-09 23:15:20,2741
74,1413637851732971525,July buy #oneplus #device #smoothos #oneplus tpro #neversettle #beyondthespeed,"[{'text': 'oneplus', 'indices': [39, 47]}, {'text': 'device', 'indices': [48, 55]}, {'text': 'smoothos', 'indices': [56, 65]}, {'text': '90hz', 'indices': [66, 71]}, {'text': 'oneplus8tpro', 'indices': [72, 85]}, {'text': 'neversettle', 'indices': [86, 98]}, {'text': 'beyondthespeed', 'indices': [99, 114]}]",2021-07-09 23:15:02,120
75,1413637643087212546,Cruise Planners Roxana Burns #Google Great value and price for getaway San Jose,"[{'text': 'Google', 'indices': [32, 39]}]",2021-07-09 23:14:12,56
76,1413637610673737730,Legal scholar says President Trump class action lawsuits against #Facebook #Google and #Twitter are very,"[{'text': 'Facebook', 'indices': [94, 103]}, {'text': 'Google', 'indices': [105, 112]}, {'text': 'Twitter', 'indices': [118, 126]}]",2021-07-09 23:14:05,158
77,1413637583737823235,Gray Raven Database Nanami Pulse Vol Construct Features Mixed Damage Able deal Physical and Elemental DMG Resi,[],2021-07-09 23:13:58,34
78,1413637582303469568,Google Street View car spotted Nigeria #google #googlestreetview #googlestreetviewcar,"[{'text': 'google', 'indices': [67, 74]}, {'text': 'googlestreetview', 'indices': [75, 92]}, {'text': 'googlestreetviewcar', 'indices': [93, 113]}]",2021-07-09 23:13:58,13
79,1413637249854410753,Check out Gig Fiverr #Ireland local #SEO gmb optimization #Google map citation,"[{'text': 'Ireland', 'indices': [31, 39]}, {'text': 'SEO', 'indices': [47, 51]}, {'text': 'Google', 'indices': [69, 76]}]",2021-07-09 23:12:39,1358
80,1413637051392659459,Top Level Traffic Web Design Bridgend #Google #topleveltraffic #bridgend #digitalmarketin,"[{'text': 'Google', 'indices': [64, 71]}, {'text': 'topleveltraffic', 'indices': [96, 112]}, {'text': 'bridgend', 'indices': [113, 122]}]",2021-07-09 23:11:51,926
81,1413636834295488512,#usher #crowder #june coup #google #ethan Kryssma Synthetic Wigs For Women Natural Wig Black Bob Wigs With Bangs,"[{'text': 'usher', 'indices': [0, 6]}, {'text': 'crowder', 'indices': [7, 15]}, {'text': 'june22coup', 'indices': [16, 27]}, {'text': 'google', 'indices': [28, 35]}, {'text': 'ethan', 'indices': [36, 42]}]",2021-07-09 23:11:00,2
82,1413636719186878464,Legal scholar says President Trump class action lawsuits against #Facebook #Google and #Twitter are very,"[{'text': 'Facebook', 'indices': [94, 103]}, {'text': 'Google', 'indices': [105, 112]}, {'text': 'Twitter', 'indices': [118, 126]}]",2021-07-09 23:10:32,176
83,1413636607660462084,CMA Investigates and for Potentially Fake Online Reviews #Amazon #Google,"[{'text': 'Amazon', 'indices': [78, 85]}, {'text': 'Google', 'indices': [86, 93]}]",2021-07-09 23:10:06,2360
84,1413636476366032905,Legal scholar says President Trump class action lawsuits against #Facebook #Google and #Twitter are very,"[{'text': 'Facebook', 'indices': [94, 103]}, {'text': 'Google', 'indices': [105, 112]}, {'text': 'Twitter', 'indices': [118, 126]}]",2021-07-09 23:09:34,10309
85,1413636142562414596,Legal scholar says President Trump class action lawsuits against #Facebook #Google and #Twitter are very,"[{'text': 'Facebook', 'indices': [94, 103]}, {'text': 'Google', 'indices': [105, 112]}, {'text': 'Twitter', 'indices': [118, 126]}]",2021-07-09 23:08:15,24062
86,1413636101600911363,Search Engine Land mentorship program partnerships announced #marketing #google #seo,"[{'text': 'marketing', 'indices': [85, 95]}, {'text': 'google', 'indices': [96, 103]}, {'text': 'seo', 'indices': [104, 108]}]",2021-07-09 23:08:05,47200
87,1413636026921324549,Top Level Traffic Web Design Bridgend #Google #topleveltraffic #bridgend,"[{'text': 'Google', 'indices': [43, 50]}, {'text': 'topleveltraffic', 'indices': [75, 91]}, {'text': 'bridgend', 'indices': [92, 101]}]",2021-07-09 23:07:47,2613
88,1413635804971274241,How pretty that #usher #crowder #june coup #google #ethan,"[{'text': 'usher', 'indices': [20, 26]}, {'text': 'crowder', 'indices': [27, 35]}, {'text': 'june22coup', 'indices': [36, 47]}, {'text': 'google', 'indices': [48, 55]}, {'text': 'ethan', 'indices': [56, 62]}]",2021-07-09 23:06:54,2
89,1413635706367332352,you #need #professional #LogoDesigner You are the right place you need any logo for your Business Order,"[{'text': 'need', 'indices': [28, 33]}, {'text': 'professional', 'indices': [36, 49]}, {'text': 'LogoDesigner', 'indices': [50, 63]}]",2021-07-09 23:06:31,4153
90,1413635622607200259,Trends checker Google word trend searcher link,[],2021-07-09 23:06:11,8251
91,1413635569972826119,Android Fake Cryptocurrency Mining Apps Have Stolen Estimated From Their Users,[],2021-07-09 23:05:58,501
92,1413635439999655939,you know that you probably already use every single day #ai #artificialintelligence #google,"[{'text': 'ai', 'indices': [82, 85]}, {'text': 'artificialintelligence', 'indices': [86, 109]}, {'text': 'google', 'indices': [110, 117]}]",2021-07-09 23:05:27,1396
93,1413635437218910218,GlennB Side Show Sponsored Probably Funny and Entirely Fictional listen LATEST episode,[],2021-07-09 23:05:26,9562
94,1413635383837986819,Minor SEO Errors That You May Making SEO #Google,"[{'text': 'Google', 'indices': [71, 78]}]",2021-07-09 23:05:14,7075
95,1413635056665497600,#Quantum computing comes #Google #GCP #publiccloud #cloudcomputing #cloud,"[{'text': 'Quantum', 'indices': [21, 29]}, {'text': 'Google', 'indices': [49, 56]}, {'text': 'GCP', 'indices': [57, 61]}, {'text': 'publiccloud', 'indices': [64, 76]}, {'text': 'cloudcomputing', 'indices': [77, 92]}, {'text': 'cloud', 'indices': [93, 99]}]",2021-07-09 23:03:56,1497
96,1413634909596438532,#Google searches Genshin redeem code old,"[{'text': 'Google', 'indices': [5, 12]}]",2021-07-09 23:03:21,3316
97,1413634854818885636,#Google searches old,"[{'text': 'Google', 'indices': [5, 12]}]",2021-07-09 23:03:08,3316
98,1413634726037004290,Tell that Google Amazon Facebook and Twitter #Google #Amazon #Facebook #Twitter,"[{'text': 'Google', 'indices': [58, 65]}, {'text': 'Amazon', 'indices': [66, 73]}, {'text': 'Facebook', 'indices': [74, 83]}, {'text': 'Twitter', 'indices': [84, 92]}]",2021-07-09 23:02:37,13
99,1413634718415925249,Site Updates and Big News #FridayMotivation #fridaymorning #FridayFeeling #blog #Writing,"[{'text': 'FridayMotivation', 'indices': [77, 94]}, {'text': 'fridaymorning', 'indices': [95, 109]}, {'text': 'FridayFeeling', 'indices': [110, 124]}, {'text': 'blog', 'indices': [125, 130]}]",2021-07-09 23:02:35,752
100,1413634201585397760,Site Updates and Big News #FridayMotivation #fridaymorning #FridayFeeling #blog,"[{'text': 'FridayMotivation', 'indices': [59, 76]}, {'text': 'fridaymorning', 'indices': [77, 91]}, {'text': 'FridayFeeling', 'indices': [92, 106]}, {'text': 'blog', 'indices': [107, 112]}]",2021-07-09 23:00:32,16
101,1413634105695215624,GlennB Side Show Sponsored Probably Funny and Entirely Fictional listen LATEST episode,[],2021-07-09 23:00:09,127
102,1413633950480748545,The shameless GQP lies continue This time Ken Buck blames Google for Trump election loss #UnderCurre,[],2021-07-09 22:59:32,866
