Unnamed: 0,id,text,Hashtags,date,follower_count
380,1413589441839603712,Site Updates and Big News #FridayMotivation #fridaymorning #FridayFeeling #blog #Writing,"[{'text': 'FridayMotivation', 'indices': [77, 94]}, {'text': 'fridaymorning', 'indices': [95, 109]}, {'text': 'FridayFeeling', 'indices': [110, 124]}, {'text': 'blog', 'indices': [125, 130]}]",2021-07-09 20:02:40,752
381,1413589435539763203,Burrow amp Crowe Accountants amp Business Advisers Ltd #Google,"[{'text': 'Google', 'indices': [62, 69]}]",2021-07-09 20:02:39,117
382,1413589257873154051,Threat hxxp yandps com #phishing #facebook #google,"[{'text': 'phishing', 'indices': [31, 40]}, {'text': 'facebook', 'indices': [42, 51]}, {'text': 'google', 'indices': [52, 59]}]",2021-07-09 20:01:56,541
383,1413589187287203841,#Apple Finally Allows Some #Marijuana Businesses the App Store While #Google Still Says,"[{'text': 'Apple', 'indices': [0, 6]}, {'text': 'Marijuana', 'indices': [27, 37]}, {'text': 'Google', 'indices': [73, 80]}]",2021-07-09 20:01:40,2280
384,1413589036120170497,GOP Rep Google Changed Algorithm Hurt Trump Help Biden #BigTech #Google via,"[{'text': 'BigTech', 'indices': [84, 92]}, {'text': 'Google', 'indices': [93, 100]}]",2021-07-09 20:01:04,1216
385,1413589005032038401,#Google #blockchain #Background #Bitcoin #Crypto #professional #javascript #javascript,"[{'text': 'Google', 'indices': [0, 7]}, {'text': 'blockchain', 'indices': [16, 27]}, {'text': 'Background', 'indices': [28, 39]}, {'text': 'Bitcoin', 'indices': [40, 48]}, {'text': 'Crypto', 'indices': [59, 66]}, {'text': 'professional', 'indices': [68, 81]}, {'text': 'javascript30', 'indices': [83, 96]}, {'text': 'javascript', 'indices': [98, 109]}]",2021-07-09 20:00:56,5
386,1413588902028402688,Site Updates and Big News #FridayMotivation #fridaymorning #FridayFeeling #blog,"[{'text': 'FridayMotivation', 'indices': [59, 76]}, {'text': 'fridaymorning', 'indices': [77, 91]}, {'text': 'FridayFeeling', 'indices': [92, 106]}, {'text': 'blog', 'indices': [107, 112]}]",2021-07-09 20:00:32,16
387,1413588770482397184,Those who communicate well use #transcreation for communicating their #InternationalContent Context,"[{'text': 'transcreation', 'indices': [31, 45]}, {'text': 'InternationalContent', 'indices': [70, 91]}]",2021-07-09 20:00:00,2109
388,1413588454785667079,Google Suite Workspace Google Docs Forms Sheets Slides Free for hours #google,"[{'text': 'google', 'indices': [107, 114]}]",2021-07-09 19:58:45,282
389,1413588144083984387,Google UGLY FRONT CLEAN BACK DECENT INSIDE CLEAN FRONT CLEAN BACK WEAK INSIDE,[],2021-07-09 19:57:31,412
390,1413587986990518272,really need another expensive state led antitrust lawsuit against #Google Utahn taxpayer money should not,"[{'text': 'Google', 'indices': [72, 79]}]",2021-07-09 19:56:53,9
391,1413587747512754178,The Running Educator would love your feedback Post review our profile #Google #podcast,"[{'text': 'Google', 'indices': [122, 129]}, {'text': 'podcast', 'indices': [130, 138]}]",2021-07-09 19:55:56,4369
392,1413587207420485634,glad gave #Zoho chance couldn happier with their service fraction the price,"[{'text': 'Zoho', 'indices': [17, 22]}]",2021-07-09 19:53:48,616
393,1413586656129585153,iPhone Repair NYC #Google,"[{'text': 'Google', 'indices': [21, 28]}]",2021-07-09 19:51:36,63
394,1413586524856332288,GOP Rep Google Changed Algorithm Hurt Trump Help Biden #BigTech #Google via,"[{'text': 'BigTech', 'indices': [84, 92]}, {'text': 'Google', 'indices': [93, 100]}]",2021-07-09 19:51:05,1083
395,1413586448251424770,Trust will never hang you let hope for the best #Google,"[{'text': 'Google', 'indices': [108, 115]}]",2021-07-09 19:50:47,37
396,1413586444774481923,When type Ios Greek Island into phone Autocorrect gives iOS when type Andros another Greek island,[],2021-07-09 19:50:46,17
397,1413586164666281987,Footwear #Google,"[{'text': 'Google', 'indices': [21, 28]}]",2021-07-09 19:49:39,1006
398,1413586142226755585,#YouTube ist #google #Alphabet bestes via,"[{'text': 'YouTube', 'indices': [21, 29]}, {'text': 'google', 'indices': [34, 41]}, {'text': 'Alphabet', 'indices': [46, 55]}]",2021-07-09 19:49:34,2041
399,1413586004250927107,#Google has launched updated version Scorecards its automated security tool that produces risk score,"[{'text': 'Google', 'indices': [1, 8]}]",2021-07-09 19:49:01,16
400,1413585747622367235,GOP Rep Google Changed Algorithm Hurt Trump Help Biden #BigTech #Google via,"[{'text': 'BigTech', 'indices': [84, 92]}, {'text': 'Google', 'indices': [93, 100]}]",2021-07-09 19:48:00,1971
401,1413585721189830658,Smile Education Consultancy #Google,"[{'text': 'Google', 'indices': [53, 60]}]",2021-07-09 19:47:53,51
402,1413585655444099076,#MBBS #Bangladesh #Google,"[{'text': 'MBBS', 'indices': [21, 26]}, {'text': 'Bangladesh', 'indices': [30, 41]}, {'text': 'Google', 'indices': [45, 52]}]",2021-07-09 19:47:38,51
403,1413585495787978761,Tokenize your card for touchless experience with Swipe powered debit cards that enable access #Apple Pay #Google Pay and,"[{'text': 'Apple', 'indices': [110, 116]}, {'text': 'Google', 'indices': [122, 129]}]",2021-07-09 19:47:00,31
404,1413585460274761736,FAQ About MBBS Bangladesh #Google,"[{'text': 'Google', 'indices': [79, 86]}]",2021-07-09 19:46:51,51
405,1413585430381875206,MBBS ABROAD #Google,"[{'text': 'Google', 'indices': [15, 22]}]",2021-07-09 19:46:44,51
406,1413584871277142018,Hang there folks #seo #Google,"[{'text': 'seo', 'indices': [21, 25]}, {'text': 'Google', 'indices': [26, 33]}]",2021-07-09 19:44:31,612
407,1413584869893066754,GOP Rep Google Changed Algorithm Hurt Trump Help Biden #BigTech #Google via,"[{'text': 'BigTech', 'indices': [103, 111]}, {'text': 'Google', 'indices': [112, 119]}]",2021-07-09 19:44:30,1275
408,1413584706805903363,Gray Raven Database Lee Entropy Vol Construct Features Combo Easy deal high combo damage Physical Damage Skil,[],2021-07-09 19:43:51,371
409,1413584602078367744,The environmental parameters this field have just changed commandant New enemies confirmed Let discuss the functi,[],2021-07-09 19:43:26,371
410,1413584585745604609,New machine added army along with Shot,[],2021-07-09 19:43:23,103
411,1413584511619710977,GOP Rep Google Changed Algorithm Hurt Trump Help Biden #BigTech #Google via,"[{'text': 'BigTech', 'indices': [84, 92]}, {'text': 'Google', 'indices': [93, 100]}]",2021-07-09 19:43:05,1083
412,1413584315246538754,Huge thanks for giving star #Google review coral lesley jackson Positive Professionalism Responsiveness,"[{'text': 'Google', 'indices': [33, 40]}]",2021-07-09 19:42:18,1477
413,1413584212305788931,Wisdom the Source auf #Google,"[{'text': 'Google', 'indices': [25, 32]}]",2021-07-09 19:41:53,1
414,1413584007145660422,New #Details #Google top #Models #Update #Duration #Probably #Iphone level,"[{'text': 'Details', 'indices': [4, 12]}, {'text': 'Google', 'indices': [16, 23]}, {'text': 'Models', 'indices': [30, 37]}, {'text': 'Update', 'indices': [40, 47]}, {'text': 'Duration', 'indices': [48, 57]}, {'text': 'Probably', 'indices': [58, 67]}, {'text': 'Iphone', 'indices': [71, 78]}]",2021-07-09 19:41:05,3414
415,1413583705323491331,#Amazon #SamsungGalaxyTabA gets One #google #phonemafia #portal news #gaming #portal news #phonemafia #am,"[{'text': 'Amazon', 'indices': [21, 28]}, {'text': 'SamsungGalaxyTabA8', 'indices': [31, 50]}, {'text': 'google', 'indices': [69, 76]}, {'text': 'phonemafia', 'indices': [77, 88]}, {'text': 'portal4news', 'indices': [89, 101]}, {'text': 'gaming', 'indices': [102, 109]}, {'text': 'portal4news', 'indices': [110, 122]}, {'text': 'phonemafia', 'indices': [124, 135]}]",2021-07-09 19:39:53,1981
416,1413583584082808833,Huge thanks for giving star #Google review Anthonia Ifeanyi Okoro Positive Professionalism Quality Respo,"[{'text': 'Google', 'indices': [33, 40]}]",2021-07-09 19:39:24,2720
417,1413583435138945024,Was Google Looking For Coronavirus #COVID #virus #research #wuhanlab #funding,"[{'text': 'COVID19', 'indices': [70, 78]}, {'text': 'virus', 'indices': [79, 85]}, {'text': 'research', 'indices': [86, 95]}, {'text': 'wuhanlab', 'indices': [96, 105]}, {'text': 'funding', 'indices': [106, 114]}]",2021-07-09 19:38:48,951
418,1413583276745404417,Why does hate people Imagine you spend your whole life studying marketer making one mistake your,[],2021-07-09 19:38:10,31
419,1413583049594388482,ISRO amp MapmyIndia build alternative Google Maps #ISRO India answer #NASA #MapmyIndia that,"[{'text': 'ISRO', 'indices': [87, 92]}, {'text': 'NASA', 'indices': [114, 119]}, {'text': 'MapmyIndia', 'indices': [121, 132]}]",2021-07-09 19:37:16,352
420,1413582960390033413,#GodofAbraham #Jesus #video #movie Alex Jones Introduces Jeff Davis The Man with the Plan #Twitter #Google,"[{'text': 'GodofAbraham', 'indices': [25, 38]}, {'text': 'Jesus', 'indices': [39, 45]}, {'text': 'video', 'indices': [47, 53]}, {'text': 'movie', 'indices': [54, 60]}, {'text': 'Twitter', 'indices': [121, 129]}, {'text': 'Google', 'indices': [130, 137]}]",2021-07-09 19:36:55,342
421,1413582807801241605,they tried from was able retrieve the link for the,[],2021-07-09 19:36:19,254
422,1413582757347958784,Google the devil invested over university for marketing and they bann,[],2021-07-09 19:36:07,31
423,1413582697251983361,Online Property Deals #Google,"[{'text': 'Google', 'indices': [25, 32]}]",2021-07-09 19:35:52,132
424,1413582639999692810,Google the devil invested over university for marketing and they,[],2021-07-09 19:35:39,31
425,1413582423246483465,March #GodofAbraham #Jesus News Release #Actor #Entertainer #Facebook #Tumb,"[{'text': 'GodofAbraham', 'indices': [33, 46]}, {'text': 'Jesus', 'indices': [47, 53]}, {'text': 'Actor', 'indices': [100, 106]}, {'text': 'Entertainer', 'indices': [108, 120]}, {'text': 'Facebook', 'indices': [123, 132]}]",2021-07-09 19:34:47,342
426,1413582377872408584,NEWBURY #Google,"[{'text': 'Google', 'indices': [13, 20]}]",2021-07-09 19:34:36,5332
427,1413582135181684738,Google Ads Campaign Services Google Search Ads Google Display Ads Google Shopping Ads Google Video Ads,[],2021-07-09 19:33:38,1
428,1413582027597680643,#usher #crowder #june coup #google #ethan Knot Bow Baby Headbands Toddler Headwraps Baby Flower Turban Hats Babes,"[{'text': 'usher', 'indices': [0, 6]}, {'text': 'crowder', 'indices': [7, 15]}, {'text': 'june22coup', 'indices': [16, 27]}, {'text': 'google', 'indices': [28, 35]}, {'text': 'ethan', 'indices': [36, 42]}]",2021-07-09 19:33:13,2
429,1413581895091302401,GOP Rep Google Changed Algorithm Hurt Trump Help Biden #BigTech #Google via,"[{'text': 'BigTech', 'indices': [84, 92]}, {'text': 'Google', 'indices': [93, 100]}]",2021-07-09 19:32:41,232
430,1413581570192019459,will targeted LinkedIn lead generation Order now #digitalmarketing #sales,"[{'text': 'digitalmarketing', 'indices': [84, 101]}, {'text': 'sales', 'indices': [102, 108]}]",2021-07-09 19:31:24,71
431,1413581568954806273,Why does hate people Imagine you spend your whole life studying marketer making one mistake,[],2021-07-09 19:31:23,31
432,1413581329741008899,Site Updates and Big News #FridayMotivation #fridaymorning #FridayFeeling #blog,"[{'text': 'FridayMotivation', 'indices': [59, 76]}, {'text': 'fridaymorning', 'indices': [77, 91]}, {'text': 'FridayFeeling', 'indices': [92, 106]}, {'text': 'blog', 'indices': [107, 112]}]",2021-07-09 19:30:26,16
433,1413581220009496576,senior #Google executive who reportedly opposed employees working remotely has caused internal stir moving,"[{'text': 'Google', 'indices': [9, 16]}]",2021-07-09 19:30:00,109533
434,1413581215161008132,#Google open physical store NYC summer,"[{'text': 'Google', 'indices': [0, 7]}]",2021-07-09 19:29:59,864
435,1413580987825631234,Whats with freaking out everytime log from somewhere new they know more about than mother they know wher,[],2021-07-09 19:29:05,568
436,1413580965205536768,Whats with freaking out everytime log from somewhere new they know more about than mother,[],2021-07-09 19:28:59,151
437,1413580863548313604,Getting ready for presentation the International #Schumpeter Society Conference will speak,"[{'text': 'Schumpeter', 'indices': [78, 89]}]",2021-07-09 19:28:35,2037
438,1413580731109056515,Check out #usher #crowder #june coup #google #ethan,"[{'text': 'usher', 'indices': [14, 20]}, {'text': 'crowder', 'indices': [21, 29]}, {'text': 'june22coup', 'indices': [30, 41]}, {'text': 'google', 'indices': [42, 49]}, {'text': 'ethan', 'indices': [50, 56]}]",2021-07-09 19:28:04,2
439,1413580695654576130,Invest one the best exchange Sir Brian Armstrong and,[],2021-07-09 19:27:55,79
440,1413580539915866113,please try reaching out they will surely help #YouTuber #YouTube #Goo,"[{'text': 'YouTuber', 'indices': [116, 125]}, {'text': 'YouTube', 'indices': [126, 134]}]",2021-07-09 19:27:18,1868
441,1413580481128509441,#Amazon #SamsungGalaxyTabA gets One #google #phonemafia #portal news #gaming #portal news #phonemafia #am,"[{'text': 'Amazon', 'indices': [21, 28]}, {'text': 'SamsungGalaxyTabA8', 'indices': [31, 50]}, {'text': 'google', 'indices': [69, 76]}, {'text': 'phonemafia', 'indices': [77, 88]}, {'text': 'portal4news', 'indices': [89, 101]}, {'text': 'gaming', 'indices': [102, 109]}, {'text': 'portal4news', 'indices': [110, 122]}, {'text': 'phonemafia', 'indices': [124, 135]}]",2021-07-09 19:27:04,532
442,1413580388409171968,#Amazon #SamsungGalaxyTabA gets One #google #phonemafia #portal news #gaming #portal news #phonemafia #am,"[{'text': 'Amazon', 'indices': [21, 28]}, {'text': 'SamsungGalaxyTabA8', 'indices': [31, 50]}, {'text': 'google', 'indices': [69, 76]}, {'text': 'phonemafia', 'indices': [77, 88]}, {'text': 'portal4news', 'indices': [89, 101]}, {'text': 'gaming', 'indices': [102, 109]}, {'text': 'portal4news', 'indices': [110, 122]}, {'text': 'phonemafia', 'indices': [124, 135]}]",2021-07-09 19:26:42,2029
443,1413580227041656833,Tokenize your card for touchless experience with Swipe powered debit cards that enable access #Apple Pay #Google Pay and,"[{'text': 'Apple', 'indices': [110, 116]}, {'text': 'Google', 'indices': [122, 129]}]",2021-07-09 19:26:03,540
444,1413580136377581569,#Amazon #SamsungGalaxyTabA gets One #google #phonemafia #portal news #gaming #portal news #phonemafia,"[{'text': 'Amazon', 'indices': [0, 7]}, {'text': 'SamsungGalaxyTabA8', 'indices': [10, 29]}, {'text': 'google', 'indices': [48, 55]}, {'text': 'phonemafia', 'indices': [56, 67]}, {'text': 'portal4news', 'indices': [68, 80]}, {'text': 'gaming', 'indices': [81, 88]}, {'text': 'portal4news', 'indices': [89, 101]}, {'text': 'phonemafia', 'indices': [103, 114]}]",2021-07-09 19:25:42,182
445,1413579974364344328,Like what Leave review sharing your thoughts #PickingMe #Google #Facebook #Yelp you help,"[{'text': 'PickingMe', 'indices': [61, 71]}, {'text': 'Google', 'indices': [75, 82]}, {'text': 'Facebook', 'indices': [84, 93]}, {'text': 'Yelp', 'indices': [97, 102]}]",2021-07-09 19:25:03,3599
446,1413579693358338050,Mutton Power Equipment #Google,"[{'text': 'Google', 'indices': [26, 33]}]",2021-07-09 19:23:56,519
447,1413579622919380992,missed you much #navypier #navypierchicago #chicago,"[{'text': 'navypier', 'indices': [53, 62]}, {'text': 'navypierchicago', 'indices': [63, 79]}, {'text': 'chicago', 'indices': [80, 88]}]",2021-07-09 19:23:39,61
448,1413579501271883777,please try reaching out they will surely help #YouTuber #YouTube #Google #support,"[{'text': 'YouTuber', 'indices': [95, 104]}, {'text': 'YouTube', 'indices': [105, 113]}, {'text': 'Google', 'indices': [114, 121]}, {'text': 'support', 'indices': [122, 130]}]",2021-07-09 19:23:10,37
449,1413579437455646724,Tokenize your card for touchless experience with Swipe powered debit cards that enable access #Apple Pay #Google Pay and,"[{'text': 'Apple', 'indices': [110, 116]}, {'text': 'Google', 'indices': [122, 129]}]",2021-07-09 19:22:55,1884
450,1413579406707150850,GlennB Side Show Sponsored Probably Funny and Entirely Fictional listen LATEST episode,[],2021-07-09 19:22:48,2990
451,1413579382078255105,Tokenize your card for touchless experience with Swipe powered debit cards that enable access #Apple Pay #Google Pay and,"[{'text': 'Apple', 'indices': [110, 116]}, {'text': 'Google', 'indices': [122, 129]}]",2021-07-09 19:22:42,6999
452,1413579129664987137,GOP Rep Google Changed Algorithm Hurt Trump Help Biden #BigTech #Google via,"[{'text': 'BigTech', 'indices': [84, 92]}, {'text': 'Google', 'indices': [93, 100]}]",2021-07-09 19:21:42,1061
453,1413579022630629379,Today #GoogleDoodle wishes everyone Happy Independence Day Argentina #GoogleDoodle Find out more,"[{'text': 'GoogleDoodle', 'indices': [8, 21]}, {'text': 'GoogleDoodle', 'indices': [75, 88]}]",2021-07-09 19:21:16,349
454,1413578939218472961,Beach Yoga #Google,"[{'text': 'Google', 'indices': [17, 24]}]",2021-07-09 19:20:56,219
455,1413578712491208705,How Long Should Entrepreneur Wait Before Closing Failing Venture #arbitrage,"[{'text': 'arbitrage', 'indices': [95, 105]}]",2021-07-09 19:20:02,11230
456,1413578684368314372,#Facebook now trillion company Joining #Apple #Microsoft #Amazon amp #Google Their gains during the pandemic were,"[{'text': 'Facebook', 'indices': [17, 26]}, {'text': 'Apple', 'indices': [64, 70]}, {'text': 'Microsoft', 'indices': [72, 82]}, {'text': 'Amazon', 'indices': [84, 91]}, {'text': 'Google', 'indices': [98, 105]}]",2021-07-09 19:19:56,2140
457,1413578642781786117,Tokenize your card for touchless experience with Swipe powered debit cards that enable access #Apple Pay #Google Pay and,"[{'text': 'Apple', 'indices': [110, 116]}, {'text': 'Google', 'indices': [122, 129]}]",2021-07-09 19:19:46,90
458,1413578596254457857,Survey Many water utilities lack data assets daysofcode #nowplaying #technology #business #google #video #ama,"[{'text': '100daysofcode', 'indices': [71, 85]}, {'text': 'nowplaying', 'indices': [86, 97]}, {'text': 'technology', 'indices': [98, 109]}, {'text': 'business', 'indices': [110, 119]}, {'text': 'google', 'indices': [120, 127]}, {'text': 'video', 'indices': [128, 134]}]",2021-07-09 19:19:35,11636
459,1413578546878967810,Check out paidmarketer will increase sales #shopify website #Google #AdWords #Fiverr adwords fiverr #ppc,"[{'text': 'shopify', 'indices': [50, 58]}, {'text': 'Google', 'indices': [70, 77]}, {'text': 'AdWords', 'indices': [78, 86]}, {'text': 'Fiverr', 'indices': [87, 94]}, {'text': 'ppc', 'indices': [134, 138]}]",2021-07-09 19:19:23,983
460,1413578438405984265,Survey Many water utilities lack data assets daysofcode #nowplaying #technology #business #google #video #ama,"[{'text': '100daysofcode', 'indices': [71, 85]}, {'text': 'nowplaying', 'indices': [86, 97]}, {'text': 'technology', 'indices': [98, 109]}, {'text': 'business', 'indices': [110, 119]}, {'text': 'google', 'indices': [120, 127]}, {'text': 'video', 'indices': [128, 134]}]",2021-07-09 19:18:57,1497
461,1413578235896418304,vendors specialize public cloud keeps growing #technology #business #infosec #google #blockchain #amazon,"[{'text': 'technology', 'indices': [50, 61]}, {'text': 'business', 'indices': [62, 71]}, {'text': 'infosec', 'indices': [72, 80]}, {'text': 'google', 'indices': [81, 88]}, {'text': 'blockchain', 'indices': [89, 100]}, {'text': 'amazon', 'indices': [101, 108]}]",2021-07-09 19:18:09,8957
462,1413578079230889987,Critical infrastructure sites face greater cyberthreat amid remote connectivity #privacy #redteam #google #video #amazon,"[{'text': 'privacy', 'indices': [95, 103]}, {'text': 'redteam', 'indices': [104, 112]}, {'text': 'google', 'indices': [113, 120]}, {'text': 'video', 'indices': [121, 127]}, {'text': 'amazon', 'indices': [128, 135]}]",2021-07-09 19:17:31,54
463,1413577808736047104,Critical infrastructure sites face greater cyberthreat amid remote connectivity #privacy #redteam #google #video #amazon,"[{'text': 'privacy', 'indices': [95, 103]}, {'text': 'redteam', 'indices': [104, 112]}, {'text': 'google', 'indices': [113, 120]}, {'text': 'video', 'indices': [121, 127]}, {'text': 'amazon', 'indices': [128, 135]}]",2021-07-09 19:16:27,1544
464,1413577574752559104,Critical infrastructure sites face greater cyberthreat amid remote connectivity #privacy #redteam #google #video,"[{'text': 'privacy', 'indices': [80, 88]}, {'text': 'redteam', 'indices': [89, 97]}, {'text': 'google', 'indices': [98, 105]}, {'text': 'video', 'indices': [106, 112]}]",2021-07-09 19:15:31,8957
465,1413577442023940100,That tracks all your viewing habits and send you #tracking #monitore #google #noprivacy,"[{'text': 'tracking', 'indices': [72, 81]}, {'text': 'monitore', 'indices': [82, 91]}, {'text': 'google', 'indices': [92, 99]}, {'text': 'noprivacy', 'indices': [100, 110]}]",2021-07-09 19:14:59,58
466,1413577418942468096,Check out this new digital art that uploaded #Woman #Dress #Hat,"[{'text': 'Woman', 'indices': [118, 124]}, {'text': 'Dress', 'indices': [125, 131]}, {'text': 'Hat', 'indices': [132, 136]}]",2021-07-09 19:14:54,17317
467,1413577307407601665,Survey Many water utilities lack data assets daysofcode #nowplaying #technology #business #google,"[{'text': '100daysofcode', 'indices': [56, 70]}, {'text': 'nowplaying', 'indices': [71, 82]}, {'text': 'technology', 'indices': [83, 94]}, {'text': 'business', 'indices': [95, 104]}, {'text': 'google', 'indices': [105, 112]}]",2021-07-09 19:14:27,8957
468,1413576713783574530,You not just won the #SpellingBeeChamp but billions hearts The first champion from Louisiana Scripps nation,"[{'text': 'SpellingBeeChamp', 'indices': [21, 38]}]",2021-07-09 19:12:06,999
469,1413576693625671682,Curious know what might affecting your site organic SEO performance Get the latest details how Google,[],2021-07-09 19:12:01,813
470,1413576553129152512,The Continuing Evolution SCADA Networks #blockchain #youtube #bitcoin #music #twitter #art #live daysofcode,"[{'text': 'blockchain', 'indices': [43, 54]}, {'text': 'youtube', 'indices': [55, 63]}, {'text': 'bitcoin', 'indices': [64, 72]}, {'text': 'music', 'indices': [73, 79]}, {'text': 'twitter', 'indices': [80, 88]}, {'text': 'art', 'indices': [89, 93]}, {'text': 'live', 'indices': [94, 99]}, {'text': '100daysofcode', 'indices': [100, 114]}]",2021-07-09 19:11:27,8957
471,1413576479674413056,Google Algorithm Updates History from Search Engine Result Page and Search Engine Optimization #Algori,[],2021-07-09 19:11:10,2359
472,1413576394420809732,Mutton Power Equipment #Google,"[{'text': 'Google', 'indices': [26, 33]}]",2021-07-09 19:10:50,519
473,1413576329883230208,MinnieRee LLC #Google #jewelery #menfashion #minniereesllc,"[{'text': 'Google', 'indices': [19, 26]}, {'text': 'jewelery', 'indices': [53, 62]}, {'text': 'menfashion', 'indices': [63, 74]}, {'text': 'minniereesllc', 'indices': [75, 89]}]",2021-07-09 19:10:34,86
474,1413576102648426496,Get Google playstore WOLF BIKE #venom #mcu #games #stop #hero #wolf #super #comics #motocross #bike #prototype,"[{'text': 'venom', 'indices': [58, 64]}, {'text': 'mcu', 'indices': [65, 69]}, {'text': 'games', 'indices': [70, 76]}, {'text': 'stop', 'indices': [77, 82]}, {'text': 'hero', 'indices': [83, 88]}, {'text': 'wolf', 'indices': [89, 94]}, {'text': 'super', 'indices': [95, 101]}, {'text': 'comics', 'indices': [102, 109]}, {'text': 'motocross', 'indices': [110, 120]}, {'text': 'bike', 'indices': [121, 126]}, {'text': 'prototype', 'indices': [127, 137]}]",2021-07-09 19:09:40,1989
475,1413575948251828224,Google Algorithm Updates History from Search Engine Result Page and Search Engine Optimization #Algori,[],2021-07-09 19:09:03,6403
476,1413575919227260928,Must read piece from you want utilise full potential BigQuery #BigQuery #GCP #Google #DataScience,"[{'text': 'BigQuery', 'indices': [102, 111]}, {'text': 'GCP', 'indices': [112, 116]}, {'text': 'Google', 'indices': [117, 124]}, {'text': 'DataScience', 'indices': [125, 137]}]",2021-07-09 19:08:56,1497
477,1413575853393465350,Leak The upcoming Google Pixel series will get years updates #Google #GooglePixel Pro #googlepixel #Android #Andr,"[{'text': 'Google', 'indices': [87, 94]}, {'text': 'GooglePixel6Pro', 'indices': [95, 111]}, {'text': 'googlepixel', 'indices': [112, 124]}, {'text': 'Android', 'indices': [125, 133]}]",2021-07-09 19:08:41,3406
478,1413575844363132930,Leak The upcoming Google Pixel series will get years updates #Google #GooglePixel Pro #googlepixel,"[{'text': 'Google', 'indices': [71, 78]}, {'text': 'GooglePixel6Pro', 'indices': [79, 95]}, {'text': 'googlepixel', 'indices': [96, 108]}]",2021-07-09 19:08:38,1
479,1413575821785108480,Google Algorithm Updates History from Search Engine Result Page and Search Engine Optimization,[],2021-07-09 19:08:33,359
480,1413575719230361606,IAC CEO anti competitive practices Apple many senses worse than Google #Apple #Google #Alphabet #IAC #Sto,"[{'text': 'Apple', 'indices': [105, 111]}, {'text': 'Google', 'indices': [112, 119]}, {'text': 'Alphabet', 'indices': [120, 129]}, {'text': 'IAC', 'indices': [130, 134]}]",2021-07-09 19:08:09,386
481,1413575479848751107,#Google exec will reportedly keep working remote opposes for staff,"[{'text': 'Google', 'indices': [20, 27]}]",2021-07-09 19:07:12,34706
482,1413575412702236678,IAC CEO anti competitive practices Apple many senses worse than Google #Apple #Google #Alphabet,"[{'text': 'Apple', 'indices': [87, 93]}, {'text': 'Google', 'indices': [94, 101]}, {'text': 'Alphabet', 'indices': [102, 111]}]",2021-07-09 19:06:56,1727
483,1413575119851622409,Problem noone doing anything about conservatives Right care they would all,[],2021-07-09 19:05:46,771
484,1413575101296095237,DuckDuckGo internet search engine that emphasizes protecting searchers privacy and avoiding the filter bubble,[],2021-07-09 19:05:41,2748
485,1413575078936080385,DuckDuckGo internet search engine that emphasizes protecting searchers privacy and avoiding the filter bubbl,[],2021-07-09 19:05:36,0
486,1413575077724098565,Social Media Marketing not just posting product images,[],2021-07-09 19:05:36,224
487,1413574986787328000,Direct Renovation Products #Google,"[{'text': 'Google', 'indices': [30, 37]}]",2021-07-09 19:05:14,97
