Unnamed: 0,id,text,Hashtags,date,follower_count
193,1408723352735334406,The Most Useful #Google #Chrome Shortcuts which can make your life easier and save you alot time #developer,"[{'text': 'Google', 'indices': [37, 44]}, {'text': 'Chrome', 'indices': [45, 52]}, {'text': 'developer', 'indices': [124, 134]}]",2021-06-26 09:46:34,1208
194,1408723278772924420,Samsung releases Android update for Galaxy India #android #india #google #mobile #phonemafia #iphone,"[{'text': 'android', 'indices': [60, 68]}, {'text': 'india', 'indices': [69, 75]}, {'text': 'google', 'indices': [76, 83]}, {'text': 'mobile', 'indices': [84, 91]}, {'text': 'phonemafia', 'indices': [92, 103]}, {'text': 'iphone', 'indices': [104, 111]}]",2021-06-26 09:46:17,156
195,1408723000057372678,Possible threat hxxp pool playback com #phishing #google,"[{'text': 'phishing', 'indices': [46, 55]}, {'text': 'google', 'indices': [57, 64]}]",2021-06-26 09:45:10,531
196,1408722482283134984,These people wiil not get away wiih That promise #SARSCoV #Covid #Coverup #EnemyWithin #EnemiesOfHumanity #Goog,"[{'text': 'SARSCoV2', 'indices': [76, 85]}, {'text': 'Covid', 'indices': [86, 92]}, {'text': 'Coverup', 'indices': [93, 101]}, {'text': 'EnemyWithin', 'indices': [102, 114]}, {'text': 'EnemiesOfHumanity', 'indices': [115, 133]}]",2021-06-26 09:43:07,1272
197,1408722459654856704,These people wiil not get away wiih That promise #SARSCoV #Covid #Coverup #EnemyWithin,"[{'text': 'SARSCoV2', 'indices': [59, 68]}, {'text': 'Covid', 'indices': [69, 75]}, {'text': 'Coverup', 'indices': [76, 84]}, {'text': 'EnemyWithin', 'indices': [85, 97]}]",2021-06-26 09:43:01,10
198,1408722358815268864,myfeelingsfoundwords That one goodbye #Google #WritingCommunity #writing #DigitalMarketing #QEPD #quotes,"[{'text': 'Google', 'indices': [40, 47]}, {'text': 'WritingCommunity', 'indices': [48, 65]}, {'text': 'writing', 'indices': [66, 74]}, {'text': 'DigitalMarketing', 'indices': [75, 92]}, {'text': 'QEPD', 'indices': [93, 98]}, {'text': 'quotes', 'indices': [99, 106]}]",2021-06-26 09:42:37,348
199,1408722119224082436,Check out Gig #Fiverr #google #scraping for #search,"[{'text': 'Fiverr', 'indices': [74, 81]}, {'text': 'google', 'indices': [86, 93]}, {'text': 'scraping', 'indices': [94, 103]}, {'text': 'search', 'indices': [108, 115]}]",2021-06-26 09:41:40,175
200,1408722116254605312,Check out Gig #Fiverr #google #scraping for #search results #business,"[{'text': 'Fiverr', 'indices': [47, 54]}, {'text': 'google', 'indices': [59, 66]}, {'text': 'scraping', 'indices': [67, 76]}, {'text': 'search', 'indices': [81, 88]}, {'text': 'business', 'indices': [100, 109]}]",2021-06-26 09:41:39,175
201,1408722008922284032,Rank top google search pages Visit know more about SEO ranking #seo #socialmedia #marketi,"[{'text': 'seo', 'indices': [113, 117]}, {'text': 'socialmedia', 'indices': [118, 130]}]",2021-06-26 09:41:14,153
202,1408721978987454470,Thinking the name for this chrome extension #google #googleChrome,"[{'text': 'google', 'indices': [49, 56]}, {'text': 'googleChrome', 'indices': [57, 70]}]",2021-06-26 09:41:07,2
203,1408721967923052548,Sometimes talking makes feel better about and surroundings #ai #robots #google #ArtificialIntelligence https,"[{'text': 'ai', 'indices': [87, 90]}, {'text': 'robots', 'indices': [91, 98]}, {'text': 'google', 'indices': [99, 106]}, {'text': 'ArtificialIntelligence', 'indices': [107, 130]}]",2021-06-26 09:41:04,3129
204,1408721522898849792,really great achievement got design Google first page #graphicdesign #graphicdesigner #PNG #BinanceLearnAndEarn,"[{'text': 'graphicdesign', 'indices': [82, 96]}, {'text': 'graphicdesigner', 'indices': [97, 113]}, {'text': 'PNG', 'indices': [114, 118]}, {'text': 'BinanceLearnAndEarn', 'indices': [119, 139]}]",2021-06-26 09:39:18,1301
205,1408721504334872577,Please check recent Ramadm Design and download free Download #graphicdesign #graphicde,"[{'text': 'graphicdesign', 'indices': [114, 128]}]",2021-06-26 09:39:14,1301
206,1408721423917481986,Google Lawsuit for Hiding Security Risks from Investors via #Google #IndianITblog,"[{'text': 'Google', 'indices': [98, 105]}, {'text': 'IndianITblog', 'indices': [106, 119]}]",2021-06-26 09:38:54,121
207,1408721076587089923,Mukesh Ambani announced JioPhone Next the world most affordable smartphone partnership with #Google the Reli,"[{'text': 'Google', 'indices': [120, 127]}]",2021-06-26 09:37:32,87
208,1408721056160833537,Mukesh Ambani announced JioPhone Next the world most affordable smartphone partnership with #Google the,"[{'text': 'Google', 'indices': [99, 106]}]",2021-06-26 09:37:27,129
209,1408720438784446469,#Nasdaq has broken out wedge daily amp weekly chart While #amzn #google #Microsoft all are showing diverge,"[{'text': 'Nasdaq', 'indices': [0, 7]}, {'text': 'amzn', 'indices': [70, 75]}, {'text': 'google', 'indices': [76, 83]}, {'text': 'Microsoft', 'indices': [85, 95]}]",2021-06-26 09:35:00,3215
210,1408720226854871041,The first month seo usually bit more expensive this the month that the site SEO takes place wel,[],2021-06-26 09:34:09,735
211,1408720031417053186,The Most Useful #Google #Chrome Shortcuts which can make your life easier and save you alot time #developer,"[{'text': 'Google', 'indices': [18, 25]}, {'text': 'Chrome', 'indices': [26, 33]}, {'text': 'developer', 'indices': [105, 115]}]",2021-06-26 09:33:22,46
212,1408719498266365953,Current valuations #Apple trillion #Microsoft trillion #Amazon trillion #Google,"[{'text': 'Apple', 'indices': [21, 27]}, {'text': 'Microsoft', 'indices': [50, 60]}, {'text': 'Amazon', 'indices': [77, 84]}, {'text': 'Google', 'indices': [103, 110]}]",2021-06-26 09:31:15,1078
213,1408719181722365952,#Google delays #Chrome blocking tracking cookies late Source Indian Express #technews #technology #newsupdate,"[{'text': 'Google', 'indices': [0, 7]}, {'text': 'Chrome', 'indices': [15, 22]}, {'text': 'technews', 'indices': [92, 101]}, {'text': 'technology', 'indices': [102, 113]}, {'text': 'newsupdate', 'indices': [114, 125]}]",2021-06-26 09:30:00,713
214,1408719181525262339,absolutely bang #usher #crowder #june coup #google #ethan,"[{'text': 'usher', 'indices': [25, 31]}, {'text': 'crowder', 'indices': [32, 40]}, {'text': 'june22coup', 'indices': [41, 52]}, {'text': 'google', 'indices': [53, 60]}, {'text': 'ethan', 'indices': [61, 67]}]",2021-06-26 09:30:00,421
215,1408719104987615235,Climbing New Heights has been haven for climbers West Virginia since When the pandemic hit Chris and owner Jordy,[],2021-06-26 09:29:42,489
216,1408719097794162689,#Google has gone beyond #Cloud amp will trace you heaven #Gates amp #Windows have opened,"[{'text': 'Google', 'indices': [10, 17]}, {'text': 'Cloud', 'indices': [34, 40]}, {'text': 'Gates', 'indices': [73, 79]}, {'text': 'Windows', 'indices': [86, 94]}]",2021-06-26 09:29:40,1615
217,1408718936082989056,Google Algorithm Misidentified Software Engineer Serial Killer #Google #Misinformation #Algorithm #Software,"[{'text': 'Google', 'indices': [85, 92]}, {'text': 'Misinformation', 'indices': [93, 108]}, {'text': 'Algorithm', 'indices': [109, 119]}, {'text': 'Software', 'indices': [120, 129]}, {'text': '𝒟𝒾𝑒𝒷𝒪37', 'indices': [130, 138]}]",2021-06-26 09:29:01,3912
218,1408718900423016452,Google Algorithm Misidentified Software Engineer Serial Killer #Google #Misinformation #Algorithm #Software,"[{'text': 'Google', 'indices': [85, 92]}, {'text': 'Misinformation', 'indices': [93, 108]}, {'text': 'Algorithm', 'indices': [109, 119]}, {'text': 'Software', 'indices': [120, 129]}, {'text': '𝒟𝒾𝑒𝒷𝒪37', 'indices': [130, 138]}]",2021-06-26 09:28:53,1116
219,1408718873071788036,Google Algorithm Misidentified Software Engineer Serial Killer #Google #Misinformation #Algorithm #Software,"[{'text': 'Google', 'indices': [85, 92]}, {'text': 'Misinformation', 'indices': [93, 108]}, {'text': 'Algorithm', 'indices': [109, 119]}, {'text': 'Software', 'indices': [120, 129]}, {'text': '𝒟𝒾𝑒𝒷𝒪37', 'indices': [130, 138]}]",2021-06-26 09:28:46,1284
220,1408718839337132034,Google Algorithm Misidentified Software Engineer Serial Killer #Google #Misinformation #Algorithm #Software,"[{'text': 'Google', 'indices': [85, 92]}, {'text': 'Misinformation', 'indices': [93, 108]}, {'text': 'Algorithm', 'indices': [109, 119]}, {'text': 'Software', 'indices': [120, 129]}, {'text': '𝒟𝒾𝑒𝒷𝒪37', 'indices': [130, 138]}]",2021-06-26 09:28:38,968
221,1408718662463365123,really into free HTC Vive right now #Google,"[{'text': 'Google', 'indices': [40, 47]}]",2021-06-26 09:27:56,122
222,1408718647149821959,Sometimes talking makes feel better about and surroundings #ai #robots #google,"[{'text': 'ai', 'indices': [74, 77]}, {'text': 'robots', 'indices': [78, 85]}, {'text': 'google', 'indices': [86, 93]}]",2021-06-26 09:27:52,9
223,1408718499778727943,Comprehensive Comparison between GMail and Suite #GSuite #Gmail #Google #GSuiteBasic #GSuiteBusiness #GSuiteEnterprise,"[{'text': 'GSuite', 'indices': [66, 73]}, {'text': 'Gmail', 'indices': [74, 80]}, {'text': 'Google', 'indices': [81, 88]}, {'text': 'GSuiteBasic', 'indices': [89, 101]}, {'text': 'GSuiteBusiness', 'indices': [102, 117]}, {'text': 'GSuiteEnterprise', 'indices': [118, 135]}]",2021-06-26 09:27:17,286
224,1408718467507769347,ISRO amp MapmyIndia build alternative Google Maps #ISRO India answer #NASA #MapmyIndia that,"[{'text': 'ISRO', 'indices': [87, 92]}, {'text': 'NASA', 'indices': [114, 119]}, {'text': 'MapmyIndia', 'indices': [121, 132]}]",2021-06-26 09:27:10,274
225,1408717909170458627,#usher #crowder #june coup #google #ethan Stool Folding Stool Retractable Outdoor Portable Stool Camping Stool Fol,"[{'text': 'usher', 'indices': [0, 6]}, {'text': 'crowder', 'indices': [7, 15]}, {'text': 'june22coup', 'indices': [16, 27]}, {'text': 'google', 'indices': [28, 35]}, {'text': 'ethan', 'indices': [36, 42]}]",2021-06-26 09:24:56,421
226,1408717525706326019,Learn about Google patent that enables searchers explore connections between related entities different types med,[],2021-06-26 09:23:25,1662
227,1408717491073806338,Excellent Canada Overseas Educational consultant jalandhar for Indian students Punjab India Apply,[],2021-06-26 09:23:17,256
228,1408717410731954177,Great offer from Optimize Media #Google,"[{'text': 'Google', 'indices': [35, 42]}]",2021-06-26 09:22:58,68
229,1408717279953526787,Top image Still from the movie Taare Zameen Par dated December Down image Google logo now,[],2021-06-26 09:22:26,26
230,1408716892236173316,#Google proposing solution ensure the integrity #software packages and prevent unauthorized modifications Rea,"[{'text': 'Google', 'indices': [18, 25]}, {'text': 'software', 'indices': [77, 86]}]",2021-06-26 09:20:54,16916
231,1408716565562814466,#Google proposing solution ensure the integrity #software packages and prevent unauthorized modifications Rea,"[{'text': 'Google', 'indices': [18, 25]}, {'text': 'software', 'indices': [77, 86]}]",2021-06-26 09:19:36,36158
232,1408716354534969348,Honor Magic Watch will launch July India #Apple #honor #honormagic #google #tech #TwitterCrush #watc,"[{'text': 'Apple', 'indices': [78, 84]}, {'text': 'honor', 'indices': [86, 92]}, {'text': 'honormagic', 'indices': [93, 104]}, {'text': 'google', 'indices': [105, 112]}, {'text': 'tech', 'indices': [113, 118]}, {'text': 'TwitterCrush', 'indices': [120, 133]}]",2021-06-26 09:18:46,1372
233,1408716255348072452,Who can help Why Adsense application rejected due insufficient content,[],2021-06-26 09:18:22,652
234,1408716232954724355,Who can help Why Adsense application rejected due insufficient content,[],2021-06-26 09:18:17,652
235,1408716144790413313,Who can help Why Adsense application rejected due insufficient content,[],2021-06-26 09:17:56,652
236,1408716137798553600,#Google proposing solution ensure the integrity #software packages and prevent unauthorized modifications Rea,"[{'text': 'Google', 'indices': [18, 25]}, {'text': 'software', 'indices': [77, 86]}]",2021-06-26 09:17:54,16739
237,1408716122548015105,Who can help Why Adsense application rejected due insufficient content,[],2021-06-26 09:17:50,652
238,1408716042009034754,Who can help Why Adsense application rejected due insufficient content #Google,"[{'text': 'Google', 'indices': [132, 139]}]",2021-06-26 09:17:31,2902
239,1408715968411541505,Learn about Google patent that enables searchers explore connections between related entities different types med,[],2021-06-26 09:17:14,2902
240,1408715945854607360,Who can help Why Adsense application rejected due insufficient content,[],2021-06-26 09:17:08,652
241,1408715918260244481,Who can help Why Adsense application rejected due insufficient content,[],2021-06-26 09:17:02,652
242,1408715803965509635,Who can help Why Adsense application rejected due insufficient content,[],2021-06-26 09:16:34,652
243,1408715792166707208,#Keyword research the process which you research popular search terms people type into search engines like,"[{'text': 'Keyword', 'indices': [0, 8]}]",2021-06-26 09:16:32,258
244,1408715733350166530,Pot Ney sur #Google,"[{'text': 'Google', 'indices': [21, 28]}]",2021-06-26 09:16:18,31
245,1408715634062413828,Honor Magic Watch will launch July India #Apple #honor #honormagic #google #tech,"[{'text': 'Apple', 'indices': [63, 69]}, {'text': 'honor', 'indices': [71, 77]}, {'text': 'honormagic', 'indices': [78, 89]}, {'text': 'google', 'indices': [90, 97]}, {'text': 'tech', 'indices': [98, 103]}]",2021-06-26 09:15:54,63
246,1408715627708272642,One the major Excuse people give for not starting with #development that they don have money buy any course,"[{'text': 'development', 'indices': [78, 90]}]",2021-06-26 09:15:52,1242
247,1408715585974943744,One the major Excuse people give for not starting with #development that they don have money buy any course,"[{'text': 'development', 'indices': [78, 90]}]",2021-06-26 09:15:43,1533
248,1408715563912765441,One the major Excuse people give for not starting with #development that they don have money buy any cou,"[{'text': 'development', 'indices': [58, 70]}]",2021-06-26 09:15:37,84
249,1408715435785216002,know all things #Google for your business and know exactly what ensure you utilise all business feat,"[{'text': 'Google', 'indices': [19, 26]}]",2021-06-26 09:15:07,1540
250,1408715410028048384,Learn about Google patent that enables searchers explore connections between related entities different typ,[],2021-06-26 09:15:01,235700
251,1408715208189689859,Perfect highlights lengthy Read the greatest part the most significant tech event from #Google,"[{'text': 'Google', 'indices': [130, 137]}]",2021-06-26 09:14:12,255
252,1408715162664722433,June buy #oneplus #device #smoothos #oneplus tpro #neversettle #beyondthespeed,"[{'text': 'oneplus', 'indices': [39, 47]}, {'text': 'device', 'indices': [48, 55]}, {'text': 'smoothos', 'indices': [56, 65]}, {'text': '90hz', 'indices': [66, 71]}, {'text': 'oneplus8tpro', 'indices': [72, 85]}, {'text': 'neversettle', 'indices': [86, 98]}, {'text': 'beyondthespeed', 'indices': [99, 114]}]",2021-06-26 09:14:02,119
253,1408715117550780420,Another gem #MachineLearning #DeepLearning #Python #Pandas #Google #Colab #Jupyter #software,"[{'text': 'MachineLearning', 'indices': [29, 45]}, {'text': 'DeepLearning', 'indices': [46, 59]}, {'text': 'Python', 'indices': [60, 67]}, {'text': 'Pandas', 'indices': [68, 75]}, {'text': 'Google', 'indices': [76, 83]}, {'text': 'Colab', 'indices': [84, 90]}, {'text': 'Jupyter', 'indices': [91, 99]}, {'text': 'software', 'indices': [100, 109]}]",2021-06-26 09:13:51,3238
254,1408714909685272579,important know exactly what your SEO will doing for you and how they will provide you with measurable,[],2021-06-26 09:13:01,735
255,1408714660929474567,interview between Design Advocate #Google who speaks Developer Advocate Google about they are born,"[{'text': 'Google', 'indices': [60, 67]}]",2021-06-26 09:12:02,102
256,1408714631590318080,Google Algorithm Misidentified Software Engineer Serial Killer #Google #Misinformation #Algorithm #Software,"[{'text': 'Google', 'indices': [85, 92]}, {'text': 'Misinformation', 'indices': [93, 108]}, {'text': 'Algorithm', 'indices': [109, 119]}, {'text': 'Software', 'indices': [120, 129]}, {'text': '𝒟𝒾𝑒𝒷𝒪37', 'indices': [130, 138]}]",2021-06-26 09:11:55,255
257,1408714593061511170,#UK checks #Google and #Amazon for fake merchant reviews,"[{'text': 'UK', 'indices': [16, 19]}, {'text': 'Google', 'indices': [27, 34]}, {'text': 'Amazon', 'indices': [39, 46]}]",2021-06-26 09:11:46,1597
258,1408714174495002626,Another gem #MachineLearning #DeepLearning #Python #Pandas #Google #Colab #Jupyter #software,"[{'text': 'MachineLearning', 'indices': [15, 31]}, {'text': 'DeepLearning', 'indices': [32, 45]}, {'text': 'Python', 'indices': [46, 53]}, {'text': 'Pandas', 'indices': [54, 61]}, {'text': 'Google', 'indices': [62, 69]}, {'text': 'Colab', 'indices': [70, 76]}, {'text': 'Jupyter', 'indices': [77, 85]}, {'text': 'software', 'indices': [86, 95]}]",2021-06-26 09:10:06,79
259,1408714118870208513,Amazon and Google under investigation over fake reviews #Amazon #Amazon #Google #Uk,"[{'text': 'Amazonギフト', 'indices': [80, 90]}, {'text': 'Amazon', 'indices': [91, 98]}, {'text': 'Google', 'indices': [99, 106]}, {'text': 'Uk', 'indices': [107, 110]}]",2021-06-26 09:09:53,1861
260,1408713733812150277,Need get the top Google right now Google Ads will this #adwords #ppc #google,"[{'text': 'adwords', 'indices': [93, 101]}, {'text': 'ppc', 'indices': [102, 106]}, {'text': 'google', 'indices': [107, 114]}]",2021-06-26 09:08:21,3328
261,1408713448800849921,SEO could benefit many businesses who are looking increase their online presence and drive more targeted traffic,[],2021-06-26 09:07:13,526
262,1408713426063577090,SEO could benefit many businesses who are looking increase their online presence and drive more targeted traffic,[],2021-06-26 09:07:08,7852
263,1408713392727248896,quick guide #Point #Domain From #Google #Bluehost,"[{'text': 'Point', 'indices': [17, 23]}, {'text': 'Domain', 'indices': [24, 31]}, {'text': 'Google', 'indices': [37, 44]}, {'text': 'Bluehost', 'indices': [48, 57]}]",2021-06-26 09:07:00,26
264,1408713178557603840,manage your Google Business Listing from only day Get more from local search results with Google,[],2021-06-26 09:06:09,253
265,1408713077931986945,Ishika Fashion Pvt Ltd #Google #fashion #google #designer #party #women #collection,"[{'text': 'Google', 'indices': [28, 35]}, {'text': 'fashion', 'indices': [60, 68]}, {'text': 'google', 'indices': [69, 76]}, {'text': 'designer', 'indices': [77, 86]}, {'text': 'party', 'indices': [87, 93]}, {'text': 'women', 'indices': [94, 100]}, {'text': 'collection', 'indices': [101, 112]}]",2021-06-26 09:05:45,658
266,1408712931710173184,Access Infoway #Google time merge into Technology Transformation #Haloocom #IPPBX,"[{'text': 'Google', 'indices': [15, 22]}, {'text': 'Haloocom', 'indices': [97, 106]}, {'text': 'IPPBX', 'indices': [107, 113]}]",2021-06-26 09:05:10,23
267,1408712877582729217,Google VPN Starts Rolling Out iPhone Users #Google,"[{'text': 'Google', 'indices': [50, 57]}]",2021-06-26 09:04:57,241
268,1408712628105629697,Understanding the changes and updating the website all that required restore the rank #NewWebsite #DigitalMa,"[{'text': 'NewWebsite', 'indices': [117, 128]}]",2021-06-26 09:03:57,7852
269,1408712484458885123,#Google fresh trouble India reportedly orders antitrust investigation over #Android #smartTVs #antitrustprobe,"[{'text': 'Google', 'indices': [21, 28]}, {'text': 'Android', 'indices': [104, 112]}, {'text': 'smartTVs', 'indices': [113, 122]}, {'text': 'antitrustprobe', 'indices': [123, 138]}]",2021-06-26 09:03:23,33
270,1408712194259406848,Google home screen gains autoplaying video ads #Google,"[{'text': 'Google', 'indices': [52, 59]}]",2021-06-26 09:02:14,241
271,1408712130996494342,Let Get Your Business Google Today #googlemybusiness #google #digitalmarketing #searchengineoptimization,"[{'text': 'googlemybusiness', 'indices': [41, 58]}, {'text': 'google', 'indices': [59, 66]}, {'text': 'digitalmarketing', 'indices': [67, 84]}, {'text': 'searchengineoptimization', 'indices': [85, 110]}]",2021-06-26 09:01:59,32
272,1408712007461707780,Leading Swimming Pool construction company #Google #Crytalpools #crystalpoolsinidia,"[{'text': 'Google', 'indices': [46, 53]}, {'text': 'Crytalpools', 'indices': [79, 91]}, {'text': 'crystalpoolsinidia', 'indices': [92, 111]}]",2021-06-26 09:01:29,165
273,1408711856819159045,Google now alerts you when you should not trust search results #Google,"[{'text': 'Google', 'indices': [64, 71]}]",2021-06-26 09:00:53,241
274,1408711709146103813,The party #cookie lives again well least until the end #Google backs down from planned early,"[{'text': 'cookie', 'indices': [14, 21]}, {'text': 'Google', 'indices': [75, 82]}]",2021-06-26 09:00:18,359
275,1408711682449231876,Please watch this video and subscribe the channel you like content #trending #jugadugeek #jiophone #jiophonenext #an,"[{'text': 'trending', 'indices': [89, 98]}, {'text': 'jugadugeek', 'indices': [99, 110]}, {'text': 'jiophone3', 'indices': [111, 121]}, {'text': 'jiophonenext', 'indices': [122, 135]}]",2021-06-26 09:00:12,144
276,1408711554141351938,Things that are #Banned #China #Google #WhatsApp #YouTube #Facebook #Instagram #Snapchat #Twitter #Telegram,"[{'text': 'Banned', 'indices': [16, 23]}, {'text': 'China', 'indices': [27, 33]}, {'text': 'Google', 'indices': [34, 41]}, {'text': 'WhatsApp', 'indices': [42, 51]}, {'text': 'YouTube', 'indices': [52, 60]}, {'text': 'Facebook', 'indices': [61, 70]}, {'text': 'Instagram', 'indices': [71, 81]}, {'text': 'Snapchat', 'indices': [82, 91]}, {'text': 'Twitter', 'indices': [92, 100]}, {'text': 'Telegram', 'indices': [101, 110]}]",2021-06-26 08:59:41,2334
277,1408711436289859587,Things that are #Banned #China #Google #WhatsApp #YouTube #Facebook #Instagram #Snapchat #Twitter #Telegram,"[{'text': 'Banned', 'indices': [16, 23]}, {'text': 'China', 'indices': [27, 33]}, {'text': 'Google', 'indices': [34, 41]}, {'text': 'WhatsApp', 'indices': [42, 51]}, {'text': 'YouTube', 'indices': [52, 60]}, {'text': 'Facebook', 'indices': [61, 70]}, {'text': 'Instagram', 'indices': [71, 81]}, {'text': 'Snapchat', 'indices': [82, 91]}, {'text': 'Twitter', 'indices': [92, 100]}, {'text': 'Telegram', 'indices': [101, 110]}]",2021-06-26 08:59:13,2334
278,1408711420699496451,Understanding the changes and updating the website all that required restore the rank #NewWebsite #DigitalMa,"[{'text': 'NewWebsite', 'indices': [117, 128]}]",2021-06-26 08:59:09,4
279,1408711272540033026,#UK checks #Google and #Amazon for fake merchant reviews,"[{'text': 'UK', 'indices': [0, 3]}, {'text': 'Google', 'indices': [11, 18]}, {'text': 'Amazon', 'indices': [23, 30]}]",2021-06-26 08:58:34,4278
280,1408711218811052037,SEO could benefit many businesses who are looking increase their online presence and drive more targeted traffic,[],2021-06-26 08:58:21,735
281,1408710919241146374,Color may launch August could based Android #OPPO #ColorOS #ColorOS #doge #TwitterCrush,"[{'text': 'OPPO', 'indices': [69, 74]}, {'text': 'ColorOS12', 'indices': [75, 85]}, {'text': 'ColorOS', 'indices': [86, 94]}, {'text': 'doge', 'indices': [95, 100]}, {'text': 'TwitterCrush', 'indices': [101, 114]}]",2021-06-26 08:57:10,63
282,1408710894465425414,Check out Gig #Fiverr #google #scraping for #search results #business #profiles Like,"[{'text': 'Fiverr', 'indices': [35, 42]}, {'text': 'google', 'indices': [47, 54]}, {'text': 'scraping', 'indices': [55, 64]}, {'text': 'search', 'indices': [69, 76]}, {'text': 'business', 'indices': [88, 97]}, {'text': 'profiles', 'indices': [98, 107]}]",2021-06-26 08:57:04,1050
283,1408710632795303937,#Apple and #Google are changing the way advertisers are thinking about ads The changes #BigTech web tracking tools,"[{'text': 'Apple', 'indices': [18, 24]}, {'text': 'Google', 'indices': [29, 36]}, {'text': 'BigTech', 'indices': [109, 117]}]",2021-06-26 08:56:02,7475
284,1408710156330975235,#usher #crowder #june coup #google #ethan YALU DIY Mountain Bicycle BLDC Middle Bike Motor Conversion,"[{'text': 'usher', 'indices': [0, 6]}, {'text': 'crowder', 'indices': [7, 15]}, {'text': 'june22coup', 'indices': [16, 27]}, {'text': 'google', 'indices': [28, 35]}, {'text': 'ethan', 'indices': [36, 42]}]",2021-06-26 08:54:08,421
285,1408710135053172736,just take look this #usher #crowder #june coup #google #ethan,"[{'text': 'usher', 'indices': [29, 35]}, {'text': 'crowder', 'indices': [36, 44]}, {'text': 'june22coup', 'indices': [45, 56]}, {'text': 'google', 'indices': [57, 64]}, {'text': 'ethan', 'indices': [65, 71]}]",2021-06-26 08:54:03,421
286,1408709928664006658,The unrevealed secrets interlinking Work less and Get more Boost your website with real visitors Increase you,[],2021-06-26 08:53:14,118
287,1408709856308178944,What #SEO and How Works Here the Answer #digitalmarketing #marketing #socialmediamarketing #socialmedia #web,"[{'text': 'SEO', 'indices': [28, 32]}, {'text': 'digitalmarketing', 'indices': [71, 88]}, {'text': 'marketing', 'indices': [89, 99]}, {'text': 'socialmediamarketing', 'indices': [100, 121]}, {'text': 'socialmedia', 'indices': [122, 134]}]",2021-06-26 08:52:56,7852
288,1408709841703641093,Google Play Hurry GET #FREE #GooglePlay #GIFT #CARD Only #UnitedStates #Australia #Canada #Unit,"[{'text': 'FREE', 'indices': [60, 65]}, {'text': 'GooglePlay', 'indices': [66, 77]}, {'text': 'GIFT', 'indices': [78, 83]}, {'text': 'CARD', 'indices': [84, 89]}, {'text': 'UnitedStates', 'indices': [101, 114]}, {'text': 'Australia', 'indices': [115, 125]}, {'text': 'Canada', 'indices': [126, 133]}]",2021-06-26 08:52:53,18
289,1408709762812813316,Play Battlegrounds Mobile India Your Know How Download #BattlegroundsMobileIndia #Google #PUBG,"[{'text': 'BattlegroundsMobileIndia', 'indices': [65, 90]}, {'text': 'Google', 'indices': [91, 98]}, {'text': 'PUBG', 'indices': [99, 104]}]",2021-06-26 08:52:34,13655
