Unnamed: 0,id,text,Hashtags,date,follower_count
0,1413295892937940993,Daily Roundup amp Edge Shimmers Google Cloud Leaves AWS Prem #World SFirstMobile GNetworks #Google,"[{'text': 'World', 'indices': [79, 85]}, {'text': 'Google', 'indices': [109, 116]}]",2021-07-09 00:36:13,191
1,1413295304326017025,Lavine Extended Care Benefits Advisor #Google,"[{'text': 'Google', 'indices': [42, 49]}]",2021-07-09 00:33:52,1264
2,1413295106099236865,GlennB Side Show Sponsored Probably Funny and Entirely Fictional listen LATEST episode,[],2021-07-09 00:33:05,9543
3,1413294889584893952,#PresidentTrump Announces #ClassActionLawsuit Against #Facebook #Google and #Twitter Along with Their Executive,"[{'text': 'PresidentTrump', 'indices': [0, 15]}, {'text': 'ClassActionLawsuit', 'indices': [27, 46]}, {'text': 'Facebook', 'indices': [55, 64]}, {'text': 'Google', 'indices': [66, 73]}, {'text': 'Twitter', 'indices': [78, 86]}]",2021-07-09 00:32:14,4680
4,1413294870106501124,Introducing web #wallet for Kadena new seamless wallet experience connecting your social account your,"[{'text': 'wallet', 'indices': [43, 50]}]",2021-07-09 00:32:09,61
5,1413294664644448269,Self care important #quotes #quoteoftheday #ThursdayThoughts #selfcare #COVID #Days #earthquake,"[{'text': 'quotes', 'indices': [30, 37]}, {'text': 'quoteoftheday', 'indices': [38, 52]}, {'text': 'ThursdayThoughts', 'indices': [53, 70]}, {'text': 'selfcare', 'indices': [71, 80]}, {'text': 'COVID19', 'indices': [81, 89]}, {'text': 'Days', 'indices': [90, 95]}, {'text': 'earthquake', 'indices': [96, 107]}]",2021-07-09 00:31:20,42
6,1413294638279106562,Legal scholar said President Trump class action lawsuits against #Facebook #Google and #Twitter are very,"[{'text': 'Facebook', 'indices': [94, 103]}, {'text': 'Google', 'indices': [105, 112]}, {'text': 'Twitter', 'indices': [118, 126]}]",2021-07-09 00:31:14,126
7,1413294595962597377,#WorldNews Story States Allege #Google Unlawfully Preserves Play Store Monopoly #News,"[{'text': 'WorldNews', 'indices': [1, 11]}, {'text': 'Google', 'indices': [33, 40]}, {'text': 'News', 'indices': [84, 89]}]",2021-07-09 00:31:04,23784
8,1413294565868646406,How Trump acted after announced the lawsuit against #Facebook #Twitter and #Google #Trump #suingtrumpfor #FormerGuy,"[{'text': 'Facebook', 'indices': [73, 82]}, {'text': 'Twitter', 'indices': [83, 91]}, {'text': 'Google', 'indices': [96, 103]}, {'text': 'Trump', 'indices': [107, 113]}, {'text': 'suingtrumpfor', 'indices': [114, 128]}, {'text': 'FormerGuy', 'indices': [129, 139]}]",2021-07-09 00:30:56,25
9,1413294528589713411,How Speed Search Engine Indexing #SEO #google #bing #SEM #howto,"[{'text': 'SEO', 'indices': [64, 68]}, {'text': 'google', 'indices': [69, 76]}, {'text': 'bing', 'indices': [77, 82]}, {'text': 'SEM', 'indices': [83, 87]}, {'text': 'howto', 'indices': [88, 94]}]",2021-07-09 00:30:48,349
10,1413294528560205825,Senior Google exec opposes remote work moves New Zealand work remotely #opposes,"[{'text': 'opposes', 'indices': [103, 111]}]",2021-07-09 00:30:48,16
11,1413294340382789638,Anti trust suite against Google #google #antitrust,"[{'text': 'google', 'indices': [36, 43]}, {'text': 'antitrust', 'indices': [44, 54]}]",2021-07-09 00:30:03,7046
12,1413294312570433539,GlennB Side Show Sponsored Probably Funny and Entirely Fictional listen LATEST episode,[],2021-07-09 00:29:56,126
13,1413294197629620228,Katy Perry will launch line collectible NFTs Perry line #NFTs will produced partnership with Theta Labs,"[{'text': 'NFTs', 'indices': [83, 88]}]",2021-07-09 00:29:29,59
14,1413294179418050567,Check out this new photograph that uploaded #Seattle #GreatWheel,"[{'text': 'Seattle', 'indices': [117, 125]}, {'text': 'GreatWheel', 'indices': [126, 137]}]",2021-07-09 00:29:24,8821
15,1413294086212173828,Check out Gig #Fiverr #google #scraping for search results #business #profiles provide #bulk,"[{'text': 'Fiverr', 'indices': [20, 27]}, {'text': 'google', 'indices': [32, 39]}, {'text': 'scraping', 'indices': [40, 49]}, {'text': 'business', 'indices': [72, 81]}, {'text': 'profiles', 'indices': [82, 91]}, {'text': 'bulk', 'indices': [105, 110]}]",2021-07-09 00:29:02,1714
16,1413293870616612866,#Google continues donate #GQP Seditionists Time Boycott Google,"[{'text': 'Google', 'indices': [21, 28]}, {'text': 'GQP', 'indices': [52, 56]}]",2021-07-09 00:28:11,421
17,1413293737589968896,How Trump acted after announced the lawsuit against #Facebook #Twitter and #Google #Trump #suingtrumpfor #FormerGuy,"[{'text': 'Facebook', 'indices': [73, 82]}, {'text': 'Twitter', 'indices': [83, 91]}, {'text': 'Google', 'indices': [96, 103]}, {'text': 'Trump', 'indices': [107, 113]}, {'text': 'suingtrumpfor', 'indices': [114, 128]}, {'text': 'FormerGuy', 'indices': [129, 139]}]",2021-07-09 00:27:39,9729
18,1413293616680800258,#Google Makes New Attempt #UMCG Part Their Open Sourcing Effort Around #Fibers,"[{'text': 'Google', 'indices': [0, 7]}, {'text': 'UMCG', 'indices': [30, 35]}, {'text': 'Fibers', 'indices': [82, 89]}]",2021-07-09 00:27:10,26260
19,1413293527509856261,Google account hacked someone Gmail there are some important educatinal documents and some invoices,[],2021-07-09 00:26:49,2
20,1413293143152369666,The people Paradise will not grieve over anything they lament hour when they did not mention Allh,[],2021-07-09 00:25:17,3
21,1413293120326877187,#Best #Google #Business #Reviews for #Joomla #Website Check here #TravelTuesday #Transformat,"[{'text': 'Best', 'indices': [20, 25]}, {'text': 'Google', 'indices': [26, 33]}, {'text': 'Business', 'indices': [34, 43]}, {'text': 'Reviews', 'indices': [44, 52]}, {'text': 'Joomla', 'indices': [57, 64]}, {'text': 'Website', 'indices': [65, 73]}, {'text': 'TravelTuesday', 'indices': [112, 126]}]",2021-07-09 00:25:12,24
22,1413292459593932802,funding those that didn certification president #WallStreet #Corporations #Wallmart #Google,"[{'text': 'WallStreet', 'indices': [65, 76]}, {'text': 'Corporations', 'indices': [77, 90]}, {'text': 'Wallmart', 'indices': [91, 100]}, {'text': 'Google', 'indices': [101, 108]}]",2021-07-09 00:22:34,2424
23,1413292056475312135,#Trump States File #Antitrust Lawsuit Against #Google over App Store Abuses via,"[{'text': 'Trump', 'indices': [3, 9]}, {'text': 'Antitrust', 'indices': [26, 36]}, {'text': 'Google', 'indices': [53, 60]}]",2021-07-09 00:20:58,2042
24,1413291845686288387,GlennB Side Show Sponsored Probably Funny and Entirely Fictional listen LATEST episode,[],2021-07-09 00:20:08,126
25,1413291829286612994,new series learnings will now include Fun Facts Don forget follow #GAFunFacts You can have,"[{'text': 'GAFunFacts', 'indices': [80, 91]}]",2021-07-09 00:20:04,1
26,1413291145665335303,Tips for creating sustainable content strategy suggested successful content creators via,[],2021-07-09 00:17:21,4029
27,1413290999401656320,The web #wallet for Kadena now live Mainnet allowing users create their own KDA wallet the browser,"[{'text': 'wallet', 'indices': [35, 42]}]",2021-07-09 00:16:46,85
28,1413290713081540609,How Make Someone Love You Forever Minutes Less #selfhelp #books #bookstores #relationships #usedbo,"[{'text': 'selfhelp', 'indices': [88, 97]}, {'text': 'books', 'indices': [98, 104]}, {'text': 'bookstores', 'indices': [105, 116]}, {'text': 'relationships', 'indices': [117, 131]}]",2021-07-09 00:15:38,239
29,1413290678537359360,Check out this new photograph that uploaded #Dove #Blue #Beach #Fa,"[{'text': 'Dove', 'indices': [117, 122]}, {'text': 'Blue', 'indices': [123, 128]}, {'text': 'Beach', 'indices': [129, 135]}]",2021-07-09 00:15:30,3693
30,1413290213762338818,reached pre registration Thank you for your passion for Punishing Gray Raven Cog,[],2021-07-09 00:13:39,43
31,1413290050046078977,Chauffeur Booking Melbourne #Google #chauffeur #Melbourne,"[{'text': 'Google', 'indices': [31, 38]}, {'text': 'chauffeur', 'indices': [63, 73]}, {'text': 'Melbourne', 'indices': [74, 84]}]",2021-07-09 00:13:00,561
32,1413289954063503363,#Google first ever Twitter post was feeling lucky #Fact,"[{'text': 'Google', 'indices': [0, 7]}, {'text': 'Fact', 'indices': [59, 64]}]",2021-07-09 00:12:37,643
33,1413289941853945857,YouTube automatically and arbitrarily deletes comments without notification explanation chance appeal,[],2021-07-09 00:12:34,93
34,1413289848257929216,Dear #Google when will the chain bad news stop #COVID has snatched family members friends neighbors and much,"[{'text': 'Google', 'indices': [24, 31]}, {'text': 'COVID19', 'indices': [72, 80]}]",2021-07-09 00:12:12,295
35,1413289828649771010,#usher #crowder #june coup #google #ethan for IWO and Smartwatch IWO Pro Inch Smart Wat,"[{'text': 'usher', 'indices': [0, 6]}, {'text': 'crowder', 'indices': [7, 15]}, {'text': 'june22coup', 'indices': [16, 27]}, {'text': 'google', 'indices': [28, 35]}, {'text': 'ethan', 'indices': [36, 42]}]",2021-07-09 00:12:07,2
36,1413289591071727619,Get The Best VPN Deal OFF Storage #VPN #cybersecurity #security #internet #pr,"[{'text': 'VPN', 'indices': [96, 100]}, {'text': 'cybersecurity', 'indices': [101, 115]}, {'text': 'security', 'indices': [116, 125]}, {'text': 'internet', 'indices': [126, 135]}]",2021-07-09 00:11:10,4240
37,1413288983250051076,Google reportedly plans offer Pixel owners years Android updates Sponsored #google,"[{'text': 'google', 'indices': [129, 136]}]",2021-07-09 00:08:45,535
38,1413288968175689729,MinnieRee LLC #Google #jewlery #menwatch,"[{'text': 'Google', 'indices': [19, 26]}, {'text': 'jewlery', 'indices': [53, 61]}, {'text': 'menwatch', 'indices': [62, 71]}]",2021-07-09 00:08:42,86
39,1413288760779939841,Hoodie Provided Download His App #Google #ad #music #Instagram #Facebook #Apple #Tidal #gym,"[{'text': 'Google', 'indices': [80, 87]}, {'text': 'ad', 'indices': [88, 91]}, {'text': 'music', 'indices': [92, 98]}, {'text': 'Instagram', 'indices': [99, 109]}, {'text': 'Facebook', 'indices': [110, 119]}, {'text': 'Apple', 'indices': [120, 126]}, {'text': 'Tidal', 'indices': [127, 133]}, {'text': 'gym', 'indices': [134, 138]}]",2021-07-09 00:07:52,387
40,1413288602469953537,YouTube Channel learnfromzero with subscribers got hacked today please help get back soon,[],2021-07-09 00:07:15,2
41,1413288320977752064,why #Excel help useless After digging through results failed searches find out how,"[{'text': 'Excel', 'indices': [20, 26]}]",2021-07-09 00:06:08,34
42,1413288231106453508,Random Question The Day you believe Canadian HOME PRICES will continue RISE #housingmar,[],2021-07-09 00:05:46,904
43,1413287933675778052,Random Question The Day you believe Canadian HOME PRICES will continue RISE #housingmar,[],2021-07-09 00:04:35,1835
44,1413287662128148481,Hoodie Provided Download His App #Google #ad #music #Instagram #Facebook #Apple #Tidal,"[{'text': 'Google', 'indices': [59, 66]}, {'text': 'ad', 'indices': [67, 70]}, {'text': 'music', 'indices': [71, 77]}, {'text': 'Instagram', 'indices': [78, 88]}, {'text': 'Facebook', 'indices': [89, 98]}, {'text': 'Apple', 'indices': [99, 105]}, {'text': 'Tidal', 'indices': [106, 112]}]",2021-07-09 00:03:30,43
45,1413287630322552832,With new innovations Search Google can get you even closer what you looking for Click find out more #Google,"[{'text': 'Google', 'indices': [127, 134]}]",2021-07-09 00:03:23,106
46,1413287257780391940,Users will soon able turn Google Search learn foreign languages using robust system called Tivoli Goo,[],2021-07-09 00:01:54,14924
47,1413287067082268675,Does anyone have contact for #google Support not admitting the problems with the phone and security,"[{'text': 'google', 'indices': [31, 38]}, {'text': '4a5G', 'indices': [39, 44]}]",2021-07-09 00:01:09,126
48,1413286988493565965,Isn awesome #usher #crowder #june coup #google #ethan,"[{'text': 'usher', 'indices': [18, 24]}, {'text': 'crowder', 'indices': [25, 33]}, {'text': 'june22coup', 'indices': [34, 45]}, {'text': 'google', 'indices': [46, 53]}, {'text': 'ethan', 'indices': [54, 60]}]",2021-07-09 00:00:50,2
49,1413286948492304386,Former President Donald Trump says sue #Facebook #Twitter and YouTube owner #Google well each their,"[{'text': 'Facebook', 'indices': [66, 75]}, {'text': 'Twitter', 'indices': [77, 85]}, {'text': 'Google', 'indices': [105, 112]}]",2021-07-09 00:00:40,1338
50,1413286945971744770,Alan Dershowitz knows that private tech company not legally obligated allow you post their platform #Twit,[],2021-07-09 00:00:40,169
51,1413286895740674050,#Google years old,"[{'text': 'Google', 'indices': [0, 7]}]",2021-07-09 00:00:28,2426
52,1413286895014989824,you need Children book illustration contact #Spotify #BlackWidow #Telfar,"[{'text': 'Spotify', 'indices': [76, 84]}, {'text': 'BlackWidow', 'indices': [85, 96]}, {'text': 'Telfar', 'indices': [97, 104]}]",2021-07-09 00:00:28,230
53,1413286843831881734,Thank you #Google for censoring all references the many lab leaks which have occurred over the years typed,"[{'text': 'Google', 'indices': [27, 34]}]",2021-07-09 00:00:15,5410
54,1413286213235011586,The environmental parameters this field have just changed commandant New enemies confirmed Let discuss the functi,[],2021-07-08 23:57:45,227
55,1413286136097689602,Checkout tech provider #Trigo now making easier for #retailers accelerate their digital transformations #AI,"[{'text': 'Trigo', 'indices': [41, 47]}, {'text': 'retailers', 'indices': [76, 86]}, {'text': 'AI', 'indices': [134, 137]}]",2021-07-08 23:57:27,10197
56,1413286090233032714,Thank you #Google for censoring all references the many lab leaks which have occurred over the years typed,"[{'text': 'Google', 'indices': [27, 34]}]",2021-07-08 23:57:16,124
57,1413285803887894531,Legal scholar said President Trump class action lawsuits against #Facebook #Google and #Twitter are very,"[{'text': 'Facebook', 'indices': [94, 103]}, {'text': 'Google', 'indices': [105, 112]}, {'text': 'Twitter', 'indices': [118, 126]}]",2021-07-08 23:56:07,2398
58,1413285320309678081,Legal scholar said President Trump class action lawsuits against #Facebook #Google and #Twitter are very,"[{'text': 'Facebook', 'indices': [94, 103]}, {'text': 'Google', 'indices': [105, 112]}, {'text': 'Twitter', 'indices': [118, 126]}]",2021-07-08 23:54:12,486
59,1413285282057621505,Surprising #Google #Facts,"[{'text': 'Google', 'indices': [11, 18]}, {'text': 'Facts', 'indices': [19, 25]}]",2021-07-08 23:54:03,5356
60,1413285254727495680,Legal scholar said President Trump class action lawsuits against #Facebook #Google and #Twitter are very,"[{'text': 'Facebook', 'indices': [94, 103]}, {'text': 'Google', 'indices': [105, 112]}, {'text': 'Twitter', 'indices': [118, 126]}]",2021-07-08 23:53:56,183
61,1413285187543252993,Legal scholar said President Trump class action lawsuits against #Facebook #Google and #Twitter are very,"[{'text': 'Facebook', 'indices': [94, 103]}, {'text': 'Google', 'indices': [105, 112]}, {'text': 'Twitter', 'indices': [118, 126]}]",2021-07-08 23:53:40,107
62,1413284752971366403,Get The Best VPN Deal OFF Storage #VPN #cybersecurity #security #internet #pr,"[{'text': 'VPN', 'indices': [96, 100]}, {'text': 'cybersecurity', 'indices': [101, 115]}, {'text': 'security', 'indices': [116, 125]}, {'text': 'internet', 'indices': [126, 135]}]",2021-07-08 23:51:57,1026
63,1413284736601141252,Fresh data detailing GOOGL May weekly price movements for your Price Pattern Coordinates database May Alphab,[],2021-07-08 23:51:53,1001
64,1413284368030867460,How Trump acted after announced the lawsuit against #Facebook #Twitter and #Google #Trump #suingtrumpfor #FormerGuy,"[{'text': 'Facebook', 'indices': [73, 82]}, {'text': 'Twitter', 'indices': [83, 91]}, {'text': 'Google', 'indices': [96, 103]}, {'text': 'Trump', 'indices': [107, 113]}, {'text': 'suingtrumpfor', 'indices': [114, 128]}, {'text': 'FormerGuy', 'indices': [129, 139]}]",2021-07-08 23:50:25,3068
65,1413284241048317953,This week #Techstars #Artificialintelligence #AI Top #startups #OpenAI amp,"[{'text': 'Techstars', 'indices': [15, 25]}, {'text': 'Artificialintelligence', 'indices': [44, 67]}, {'text': 'AI', 'indices': [71, 74]}, {'text': 'startups', 'indices': [82, 91]}, {'text': 'OpenAI', 'indices': [102, 109]}]",2021-07-08 23:49:55,391
66,1413283893042585603,Love our products Leave #Google review,"[{'text': 'Google', 'indices': [52, 59]}]",2021-07-08 23:48:32,110
67,1413283512023756800,The #GQPDomesticTerrorists haven lost They #GQPTraitorsToDemocracy and using the #TwiceImpeachedOneTermLoser,"[{'text': 'GQPDomesticTerrorists', 'indices': [22, 44]}, {'text': 'GQPTraitorsToDemocracy', 'indices': [70, 93]}, {'text': 'TwiceImpeachedOneTermLoser', 'indices': [108, 135]}]",2021-07-08 23:47:01,584
68,1413283381043945483,Introducing web #wallet for Kadena new seamless wallet experience connecting your social account your,"[{'text': 'wallet', 'indices': [43, 50]}]",2021-07-08 23:46:30,9
69,1413283344041889795,Get The Best VPN Deal OFF Storage #VPN #cybersecurity #security #internet #pr,"[{'text': 'VPN', 'indices': [96, 100]}, {'text': 'cybersecurity', 'indices': [101, 115]}, {'text': 'security', 'indices': [116, 125]}, {'text': 'internet', 'indices': [126, 135]}]",2021-07-08 23:46:21,906
70,1413283238009786369,Legal scholar said President Trump class action lawsuits against #Facebook #Google and #Twitter are very,"[{'text': 'Facebook', 'indices': [94, 103]}, {'text': 'Google', 'indices': [105, 112]}, {'text': 'Twitter', 'indices': [118, 126]}]",2021-07-08 23:45:56,243
71,1413283021348876291,The Right Tools You Can Use Track Your Local SEO and SEM SEO #LocalSEO #LocalSEM #Google,"[{'text': 'LocalSEO', 'indices': [88, 97]}, {'text': 'LocalSEM', 'indices': [98, 107]}, {'text': 'Google', 'indices': [108, 115]}]",2021-07-08 23:45:04,7075
72,1413282991531511809,Check out this new photograph that uploaded #Seattle #GreatWheel,"[{'text': 'Seattle', 'indices': [117, 125]}, {'text': 'GreatWheel', 'indices': [126, 137]}]",2021-07-08 23:44:57,3406
73,1413282607094190081,Legal scholar said President Trump class action lawsuits against #Facebook #Google and #Twitter are very,"[{'text': 'Facebook', 'indices': [94, 103]}, {'text': 'Google', 'indices': [105, 112]}, {'text': 'Twitter', 'indices': [118, 126]}]",2021-07-08 23:43:25,971
74,1413282460612317186,Get The Best VPN Deal OFF Storage #VPN #cybersecurity #security #internet #pr,"[{'text': 'VPN', 'indices': [96, 100]}, {'text': 'cybersecurity', 'indices': [101, 115]}, {'text': 'security', 'indices': [116, 125]}, {'text': 'internet', 'indices': [126, 135]}]",2021-07-08 23:42:50,5605
75,1413282164200951815,Legal scholar said President Trump class action lawsuits against #Facebook #Google and #Twitter are very,"[{'text': 'Facebook', 'indices': [94, 103]}, {'text': 'Google', 'indices': [105, 112]}, {'text': 'Twitter', 'indices': [118, 126]}]",2021-07-08 23:41:40,298
76,1413281989482975240,The web #wallet for Kadena now live Mainnet allowing users create their own KDA wallet the browser,"[{'text': 'wallet', 'indices': [35, 42]}]",2021-07-08 23:40:58,165
77,1413281946541518853,#BigTech like #twitter #Facebook #Google #youtube now already standing opposite side the #Justice time fight,"[{'text': 'BigTech', 'indices': [15, 23]}, {'text': 'twitter', 'indices': [29, 37]}, {'text': 'Facebook', 'indices': [38, 47]}, {'text': 'Google', 'indices': [48, 55]}, {'text': 'youtube', 'indices': [56, 64]}, {'text': 'Justice', 'indices': [107, 115]}]",2021-07-08 23:40:48,438
78,1413281942691368961,#usher #crowder #june coup #google #ethan Digital Infrared Thermometer Non Contact Forehead Ear Fever Electroni,"[{'text': 'usher', 'indices': [0, 6]}, {'text': 'crowder', 'indices': [7, 15]}, {'text': 'june22coup', 'indices': [16, 27]}, {'text': 'google', 'indices': [28, 35]}, {'text': 'ethan', 'indices': [36, 42]}]",2021-07-08 23:40:47,2
79,1413281767952355329,Thirty seven #US state and district attorneys general are suing #Google saying the tech giant bought off competitors and used,"[{'text': 'US', 'indices': [27, 30]}, {'text': 'Google', 'indices': [78, 85]}]",2021-07-08 23:40:05,5761
80,1413281709836079110,Thirty seven #US state and district attorneys general are suing #Google saying the tech giant bought off competitor,"[{'text': 'US', 'indices': [13, 16]}, {'text': 'Google', 'indices': [64, 71]}]",2021-07-08 23:39:51,12228
81,1413281694698909700,Dear #Google when will the chain bad news stop #COVID has snatched family members friends neighbors and much,"[{'text': 'Google', 'indices': [24, 31]}, {'text': 'COVID19', 'indices': [72, 80]}]",2021-07-08 23:39:48,1383
82,1413281649484312582,The environmental parameters this field have just changed commandant New enemies confirmed Let discuss the functi,[],2021-07-08 23:39:37,50
83,1413281623840366595,don know would call the comics activism just passive aggressive commentary said Cornet who rece,[],2021-07-08 23:39:31,1513
84,1413281602520616962,Legal scholar said President Trump class action lawsuits against #Facebook #Google and #Twitter are very,"[{'text': 'Facebook', 'indices': [94, 103]}, {'text': 'Google', 'indices': [105, 112]}, {'text': 'Twitter', 'indices': [118, 126]}]",2021-07-08 23:39:26,375
85,1413281288040112128,Legal scholar said President Trump class action lawsuits against #Facebook #Google and #Twitter are very,"[{'text': 'Facebook', 'indices': [94, 103]}, {'text': 'Google', 'indices': [105, 112]}, {'text': 'Twitter', 'indices': [118, 126]}]",2021-07-08 23:38:11,1422
86,1413281277218721793,Disadvantages SEO Setting expectations search not saying SEO important not all But does,[],2021-07-08 23:38:08,13
87,1413281142099251205,Remember Dot com private protected private sector While dot gov protected federal Plz,[],2021-07-08 23:37:36,4
88,1413281081520967687,Legal scholar said President Trump class action lawsuits against #Facebook #Google and #Twitter are very,"[{'text': 'Facebook', 'indices': [94, 103]}, {'text': 'Google', 'indices': [105, 112]}, {'text': 'Twitter', 'indices': [118, 126]}]",2021-07-08 23:37:21,101
89,1413281055121960961,Remember Dot com private protected private sector While dot gov protected federal Plz find,[],2021-07-08 23:37:15,4
90,1413280937501085698,Remember Dot com private protected private sector While dot gov protected fede,[],2021-07-08 23:36:47,4
91,1413280876075667456,Get The Best VPN Deal OFF Storage #VPN #cybersecurity #security #internet #pr,"[{'text': 'VPN', 'indices': [96, 100]}, {'text': 'cybersecurity', 'indices': [101, 115]}, {'text': 'security', 'indices': [116, 125]}, {'text': 'internet', 'indices': [126, 135]}]",2021-07-08 23:36:33,1522
92,1413280826423496711,are extremely grateful for all our customers who have shared their experiences with You the best,[],2021-07-08 23:36:21,426
93,1413280818122870788,Legal scholar said President Trump class action lawsuits against #Facebook #Google and #Twitter are very,"[{'text': 'Facebook', 'indices': [94, 103]}, {'text': 'Google', 'indices': [105, 112]}, {'text': 'Twitter', 'indices': [118, 126]}]",2021-07-08 23:36:19,79
94,1413280797902131205,Legal scholar said President Trump class action lawsuits against #Facebook #Google and #Twitter are very,"[{'text': 'Facebook', 'indices': [94, 103]}, {'text': 'Google', 'indices': [105, 112]}, {'text': 'Twitter', 'indices': [118, 126]}]",2021-07-08 23:36:14,9973
95,1413280717941854210,Legal scholar said President Trump class action lawsuits against #Facebook #Google and #Twitter are very,"[{'text': 'Facebook', 'indices': [94, 103]}, {'text': 'Google', 'indices': [105, 112]}, {'text': 'Twitter', 'indices': [118, 126]}]",2021-07-08 23:35:55,61
96,1413280703228387330,Get The Best VPN Deal OFF Storage #VPN #cybersecurity #security #internet #pr,"[{'text': 'VPN', 'indices': [96, 100]}, {'text': 'cybersecurity', 'indices': [101, 115]}, {'text': 'security', 'indices': [116, 125]}, {'text': 'internet', 'indices': [126, 135]}]",2021-07-08 23:35:51,844
97,1413280688795656195,Remember Dot com private protected private sector While,[],2021-07-08 23:35:48,4
98,1413280519878447105,Get The Best VPN Deal OFF Storage #VPN #cybersecurity #security #internet #pr,"[{'text': 'VPN', 'indices': [96, 100]}, {'text': 'cybersecurity', 'indices': [101, 115]}, {'text': 'security', 'indices': [116, 125]}, {'text': 'internet', 'indices': [126, 135]}]",2021-07-08 23:35:08,17527
99,1413280516795682816,Legal scholar said President Trump class action lawsuits against #Facebook #Google and #Twitter are very,"[{'text': 'Facebook', 'indices': [94, 103]}, {'text': 'Google', 'indices': [105, 112]}, {'text': 'Twitter', 'indices': [118, 126]}]",2021-07-08 23:35:07,235
100,1413280515294064640,Get The Best VPN Deal OFF Storage #VPN #cybersecurity #security #internet #pr,"[{'text': 'VPN', 'indices': [96, 100]}, {'text': 'cybersecurity', 'indices': [101, 115]}, {'text': 'security', 'indices': [116, 125]}, {'text': 'internet', 'indices': [126, 135]}]",2021-07-08 23:35:06,36355
101,1413280506511192065,Get The Best VPN Deal OFF Storage #VPN #cybersecurity #security,"[{'text': 'VPN', 'indices': [77, 81]}, {'text': 'cybersecurity', 'indices': [82, 96]}, {'text': 'security', 'indices': [97, 106]}]",2021-07-08 23:35:04,4
102,1413280372687732736,Remember Dot com private protected private sector While dot gov protected federal Plz,[],2021-07-08 23:34:32,4
103,1413280313485242372,Legal scholar said President Trump class action lawsuits against #Facebook #Google and #Twitter are very,"[{'text': 'Facebook', 'indices': [94, 103]}, {'text': 'Google', 'indices': [105, 112]}, {'text': 'Twitter', 'indices': [118, 126]}]",2021-07-08 23:34:18,350
104,1413280260477620224,Legal scholar said President Trump class action lawsuits against #Facebook #Google and #Twitter are very,"[{'text': 'Facebook', 'indices': [94, 103]}, {'text': 'Google', 'indices': [105, 112]}, {'text': 'Twitter', 'indices': [118, 126]}]",2021-07-08 23:34:06,86
