Unnamed: 0,id,text,Hashtags,date,follower_count
510,1430808575144718340,you want shopify theme customization please visit profile,[],2021-08-26 08:25:22,254
511,1430808503778562052,you want shopify theme customization please visit profile,[],2021-08-26 08:25:05,254
512,1430808453535211523,Google Microsoft plan spend billions cybersecurity after meeting with Biden #cybersecurity #google,"[{'text': 'cybersecurity', 'indices': [83, 97]}, {'text': 'google', 'indices': [98, 105]}]",2021-08-26 08:24:53,105
513,1430808396450516996,you want shopify theme customization please visit profile,[],2021-08-26 08:24:39,254
514,1430808340959883266,you want shopify theme customization please visit profile,[],2021-08-26 08:24:26,254
515,1430808288220778497,Admin Payroll Outsourcing Singapore #Google #LeadershipDevelopment #hr #payroll,"[{'text': 'Google', 'indices': [43, 50]}, {'text': 'LeadershipDevelopment', 'indices': [51, 73]}, {'text': 'hr', 'indices': [74, 77]}, {'text': 'payroll', 'indices': [78, 86]}]",2021-08-26 08:24:13,65
516,1430808255996047360,Google Ads has announced that some impression share metrics will now available for use within custom columns Learn more,[],2021-08-26 08:24:06,416
517,1430808242943184903,you want shopify theme customization please visit profile,[],2021-08-26 08:24:02,254
518,1430807757792415747,Isn awesome #usher #crowder #june coup #google #ethan,"[{'text': 'usher', 'indices': [18, 24]}, {'text': 'crowder', 'indices': [25, 33]}, {'text': 'june22coup', 'indices': [34, 45]}, {'text': 'google', 'indices': [46, 53]}, {'text': 'ethan', 'indices': [54, 60]}]",2021-08-26 08:22:07,4
519,1430807749315776512,your #Website not performing well #MobileSearch does #DesktopSearch results #Google John Muel,"[{'text': 'Website', 'indices': [8, 16]}, {'text': 'MobileSearch', 'indices': [43, 56]}, {'text': 'DesktopSearch', 'indices': [71, 85]}, {'text': 'Google', 'indices': [96, 103]}]",2021-08-26 08:22:05,1205
520,1430807737445896194,Other one How long takes rank website #seomemes #seo #inboundmarketer #growthhacker #growth,"[{'text': 'seomemes', 'indices': [51, 60]}, {'text': 'seo', 'indices': [61, 65]}, {'text': 'inboundmarketer', 'indices': [66, 82]}, {'text': 'growthhacker', 'indices': [83, 96]}, {'text': 'growth', 'indices': [97, 104]}]",2021-08-26 08:22:02,165
521,1430807700691066889,You are want best local #citations #Organic local #traffice #google #rank for your #Website Visit gig,"[{'text': 'citations', 'indices': [24, 34]}, {'text': 'Organic', 'indices': [35, 43]}, {'text': 'traffice', 'indices': [53, 62]}, {'text': 'google', 'indices': [63, 70]}, {'text': 'rank', 'indices': [71, 76]}, {'text': 'Website', 'indices': [86, 94]}]",2021-08-26 08:21:53,350
522,1430807694450036739,#Google new Link Spam Update has finally finished rolling out taking weeks longer than expected This update eve,"[{'text': 'Google', 'indices': [18, 25]}]",2021-08-26 08:21:52,1113
523,1430807579492593670,the #VoiceTalks day TODAY Join talk all about #voice ecosystem with fantastic guests and the new,"[{'text': 'VoiceTalks', 'indices': [9, 20]}, {'text': 'voice', 'indices': [58, 64]}]",2021-08-26 08:21:24,679
524,1430807503810568194,BeyondCorp Enterprise Zero Trust Enhancements Are Designed Boost Customer Trust,[],2021-08-26 08:21:06,2100
525,1430807394624311307,Must follow instagram #MORADABAD #freedomfighters #kaif khan pataudi #twitter #google,"[{'text': 'MORADABAD', 'indices': [45, 55]}, {'text': 'freedomfighters', 'indices': [57, 73]}, {'text': 'kaif_khan_pataudi_', 'indices': [75, 94]}, {'text': 'twitter', 'indices': [96, 104]}, {'text': 'google', 'indices': [105, 112]}]",2021-08-26 08:20:40,1
526,1430807281386639364,Sunflowers how best keep them Flowers Moonstones Fareham Florist #Google,"[{'text': 'Google', 'indices': [83, 90]}]",2021-08-26 08:20:13,871
527,1430807275019542538,Ways Use Google Trends for SEO #Google #marketing #seo #seotips #digitalmarketing #staysafe #business #seotools #st,"[{'text': 'Google', 'indices': [55, 62]}, {'text': 'marketing', 'indices': [63, 73]}, {'text': 'seo', 'indices': [74, 78]}, {'text': 'seotips', 'indices': [79, 87]}, {'text': 'digitalmarketing', 'indices': [88, 105]}, {'text': 'staysafe', 'indices': [106, 115]}, {'text': 'business', 'indices': [116, 125]}, {'text': 'seotools', 'indices': [126, 135]}]",2021-08-26 08:20:12,2189
528,1430807251065860106,How Set Google Advanced Protection Program PCMag #Google #marketing #seo #seotips #digitalmarketing #staysafe #bu,"[{'text': 'Google', 'indices': [75, 82]}, {'text': 'marketing', 'indices': [83, 93]}, {'text': 'seo', 'indices': [94, 98]}, {'text': 'seotips', 'indices': [99, 107]}, {'text': 'digitalmarketing', 'indices': [108, 125]}, {'text': 'staysafe', 'indices': [126, 135]}]",2021-08-26 08:20:06,2189
529,1430807219705024516,After Online News Spat Google Blasts Microsoft Over Exchange #Google #marketing #seo #seotips #digitalmarketing,"[{'text': 'Google', 'indices': [87, 94]}, {'text': 'marketing', 'indices': [95, 105]}, {'text': 'seo', 'indices': [106, 110]}, {'text': 'seotips', 'indices': [111, 119]}, {'text': 'digitalmarketing', 'indices': [120, 137]}]",2021-08-26 08:19:58,2189
530,1430807206920740865,Google Facebook move restrict ads fake news sites Reuters #Google #marketing #seo #seotips #digitalmarketing #sta,"[{'text': 'Google', 'indices': [84, 91]}, {'text': 'marketing', 'indices': [92, 102]}, {'text': 'seo', 'indices': [103, 107]}, {'text': 'seotips', 'indices': [108, 116]}, {'text': 'digitalmarketing', 'indices': [117, 134]}]",2021-08-26 08:19:55,2189
531,1430807111038951425,Corporate culture matter What according you the best company work for #poll #octanetworks #knowledge,"[{'text': 'poll', 'indices': [84, 89]}, {'text': 'octanetworks', 'indices': [90, 103]}, {'text': 'knowledge', 'indices': [104, 114]}]",2021-08-26 08:19:33,1
532,1430806602676936705,New #job GCP Data Engineer Remote Location London Salary #newjob #cloud #GCP #google,"[{'text': 'job', 'indices': [4, 8]}, {'text': 'newjob', 'indices': [103, 110]}, {'text': 'cloud', 'indices': [111, 117]}, {'text': 'GCP', 'indices': [118, 122]}, {'text': 'google', 'indices': [123, 130]}]",2021-08-26 08:17:31,884
533,1430806486297419784,decided try using #Google Lens gave few results with one that really looks like match #GoogleLens,"[{'text': 'Google', 'indices': [21, 28]}, {'text': 'GoogleLens', 'indices': [102, 113]}]",2021-08-26 08:17:04,231
534,1430806271003869185,August buy #oneplus #device #smoothos #oneplus tpro #neversettle,"[{'text': 'oneplus', 'indices': [41, 49]}, {'text': 'device', 'indices': [50, 57]}, {'text': 'smoothos', 'indices': [58, 67]}, {'text': '90hz', 'indices': [68, 73]}, {'text': 'oneplus8tpro', 'indices': [74, 87]}, {'text': 'neversettle', 'indices': [88, 100]}]",2021-08-26 08:16:12,120
535,1430806091663912963,Glasgow Property Letting Ltd #Google,"[{'text': 'Google', 'indices': [32, 39]}]",2021-08-26 08:15:30,233
536,1430805869487263748,Google commits billion cybersecurity initiatives including open source funding amp training #google,"[{'text': 'google', 'indices': [103, 110]}]",2021-08-26 08:14:37,4
537,1430805783654981645,Ogma Conceptions Website Design amp Development Company India #Google,"[{'text': 'Google', 'indices': [72, 79]}]",2021-08-26 08:14:16,242
538,1430805337288765445,Have quick glance which programming languages are being used some the profound tech giants out there,[],2021-08-26 08:12:30,4
539,1430805250403930114,Your useless #Memecoins are pump and dump schemes that will forgotten short period The team are,"[{'text': 'Memecoins', 'indices': [34, 44]}]",2021-08-26 08:12:09,129
540,1430805200621772800,Top universities and colleges free courses DaysofCode #Pyt,"[{'text': '100DaysofCode', 'indices': [120, 134]}]",2021-08-26 08:11:57,17888
541,1430805026746687491,Learn How implement #google #pubSub #javascript #typescript #nodeJs creating #cipher working with #angular #react,"[{'text': 'google', 'indices': [39, 46]}, {'text': 'pubSub', 'indices': [47, 54]}, {'text': 'javascript', 'indices': [57, 68]}, {'text': 'typescript', 'indices': [70, 81]}, {'text': 'nodeJs', 'indices': [83, 90]}, {'text': 'cipher', 'indices': [101, 108]}, {'text': 'angular', 'indices': [123, 131]}, {'text': 'react', 'indices': [133, 139]}]",2021-08-26 08:11:16,30270
542,1430804945448493056,Financial analysts estimate Google paying Apple billion remain the default search provider the Safari browser,[],2021-08-26 08:10:56,129
543,1430804842805698560,Top universities and colleges free courses DaysofCode #Python,"[{'text': '100DaysofCode', 'indices': [115, 129]}, {'text': 'Python', 'indices': [130, 137]}]",2021-08-26 08:10:32,8704
544,1430804819330142212,Top universities and colleges free courses DaysofCode #Python,"[{'text': '100DaysofCode', 'indices': [115, 129]}, {'text': 'Python', 'indices': [130, 137]}]",2021-08-26 08:10:26,17888
545,1430804657371222019,case someone wants you use the next #Google #chat just read this article and all links when you done new next Goog,"[{'text': 'Google', 'indices': [53, 60]}, {'text': 'chat', 'indices': [61, 66]}]",2021-08-26 08:09:48,474
546,1430804642695315461,Catch free ride Waymo Catch only autonomous vehicles though safety,[],2021-08-26 08:09:44,1013
547,1430804242089103362,Free Machine Learning crash course from Google #programmer #MachineLearning #Google #SoftwareEngineer,"[{'text': 'programmer', 'indices': [71, 82]}, {'text': 'MachineLearning', 'indices': [83, 99]}, {'text': 'Google', 'indices': [100, 107]}, {'text': 'SoftwareEngineer', 'indices': [108, 125]}]",2021-08-26 08:08:09,2
548,1430804079324717059,Google dismantles Health unit favor tried and tested throw everything the wall strategy Via,[],2021-08-26 08:07:30,511
549,1430803970008641540,From startup founder product manager Nairobi via #digitalmarketing #Google,"[{'text': 'digitalmarketing', 'indices': [87, 104]}, {'text': 'Google', 'indices': [105, 112]}]",2021-08-26 08:07:04,7120
550,1430803847266635780,#BigTech pledges billions #cybersecurity investments #Biden calls core national security challenge #Apple #IB,"[{'text': 'BigTech', 'indices': [17, 25]}, {'text': 'cybersecurity', 'indices': [46, 60]}, {'text': 'Biden', 'indices': [76, 82]}, {'text': 'Apple', 'indices': [129, 135]}]",2021-08-26 08:06:34,533
551,1430803765964251137,Optimizing Your Content Become the Google Featured Snippet #Google #Search,"[{'text': 'Google', 'indices': [87, 94]}, {'text': 'Search', 'indices': [95, 102]}]",2021-08-26 08:06:15,3611
552,1430803717159280641,#BigTech pledges billions #cybersecurity investments #Biden calls core national security challenge,"[{'text': 'BigTech', 'indices': [0, 8]}, {'text': 'cybersecurity', 'indices': [29, 43]}, {'text': 'Biden', 'indices': [59, 65]}]",2021-08-26 08:06:03,323
553,1430803395682709505,#Apple amp #Google are rivals many spheres technology There are rival smartphone operating systems #Android and #ios,"[{'text': 'Apple', 'indices': [13, 19]}, {'text': 'Google', 'indices': [26, 33]}, {'text': 'Android', 'indices': [125, 133]}, {'text': 'ios', 'indices': [138, 142]}]",2021-08-26 08:04:47,333
554,1430803369199869952,Are you ready fly with WBE Digital #digitalmarketing #socialmediamarketing #ecommerce #webdesign,"[{'text': 'digitalmarketing', 'indices': [44, 61]}, {'text': 'socialmediamarketing', 'indices': [62, 83]}, {'text': 'ecommerce', 'indices': [84, 94]}, {'text': 'webdesign', 'indices': [95, 105]}]",2021-08-26 08:04:40,103
555,1430803340636659713,Google has entered into collaboration with Setu fintech enterprise that specializes offering application programmi,[],2021-08-26 08:04:34,196
556,1430803147040120832,#Google From startup founder product manager Nairobi,"[{'text': 'Google', 'indices': [0, 7]}]",2021-08-26 08:03:47,11080
557,1430802959839813640,Google has entered into collaboration with Setu fintech enterprise that specializes offering application prog,[],2021-08-26 08:03:03,8101
558,1430802954479575041,#Apple amp #Google are rivals many spheres technology There are rival smartphone operating systems,"[{'text': 'Apple', 'indices': [0, 6]}, {'text': 'Google', 'indices': [13, 20]}]",2021-08-26 08:03:02,88
559,1430802362491408390,Lord Charrington has problem CHRISTMAS ANGEL BESTSELL Beverley #Romance #Regency #ebook #Google,"[{'text': 'Romance', 'indices': [72, 80]}, {'text': 'Regency', 'indices': [81, 89]}, {'text': 'ebook', 'indices': [90, 96]}, {'text': 'Google', 'indices': [97, 104]}]",2021-08-26 08:00:40,61696
560,1430802255654096900,The Bee Charm #Google,"[{'text': 'Google', 'indices': [17, 24]}]",2021-08-26 08:00:15,36
561,1430802219000111106,Check out Gig #Fiverr #google #scraping for search results #business #profiles provide #bulk #data #rea,"[{'text': 'Fiverr', 'indices': [35, 42]}, {'text': 'google', 'indices': [47, 54]}, {'text': 'scraping', 'indices': [55, 64]}, {'text': 'business', 'indices': [87, 96]}, {'text': 'profiles', 'indices': [97, 106]}, {'text': 'bulk', 'indices': [120, 125]}, {'text': 'data', 'indices': [126, 131]}]",2021-08-26 08:00:06,223
562,1430802204181639169,Check out Gig #Fiverr #google #scraping for search results #business #profiles provide #bulk,"[{'text': 'Fiverr', 'indices': [20, 27]}, {'text': 'google', 'indices': [32, 39]}, {'text': 'scraping', 'indices': [40, 49]}, {'text': 'business', 'indices': [72, 81]}, {'text': 'profiles', 'indices': [82, 91]}, {'text': 'bulk', 'indices': [105, 110]}]",2021-08-26 08:00:03,1743
563,1430802094387302402,#Google #SongQuiz #GoogleSongQuiz having one today Keeps saying all the punctuation parenthesis etc,"[{'text': 'Google', 'indices': [0, 7]}, {'text': 'SongQuiz', 'indices': [8, 17]}, {'text': 'GoogleSongQuiz', 'indices': [18, 33]}]",2021-08-26 07:59:36,702
564,1430801394466902018,Tech giant #Google has released the #YouTubeMusic streaming service its #WearOS platform,"[{'text': 'Google', 'indices': [25, 32]}, {'text': 'YouTubeMusic', 'indices': [50, 63]}, {'text': 'WearOS', 'indices': [89, 96]}]",2021-08-26 07:56:50,46
565,1430801362439213061,Tech giant #Google has released the #YouTubeMusic streaming service its #WearOS platform,"[{'text': 'Google', 'indices': [11, 18]}, {'text': 'YouTubeMusic', 'indices': [36, 49]}, {'text': 'WearOS', 'indices': [75, 82]}]",2021-08-26 07:56:42,1980163
566,1430801089536790528,The level security used #Aadhar the same security used #Google amp #Paypal Thanks lot,"[{'text': 'Aadhar', 'indices': [30, 37]}, {'text': 'Google', 'indices': [67, 74]}, {'text': 'Paypal', 'indices': [81, 88]}]",2021-08-26 07:55:37,54
567,1430801043844120576,case someone wants you use the next #Google #chat just read this article and all links when you done,"[{'text': 'Google', 'indices': [42, 49]}, {'text': 'chat', 'indices': [50, 55]}]",2021-08-26 07:55:26,497
568,1430801011837444096,Urgent #Google warning fix your #Chrome right now after security holes revealed #security,"[{'text': 'Google', 'indices': [28, 35]}, {'text': 'Chrome', 'indices': [56, 63]}, {'text': 'security', 'indices': [106, 115]}]",2021-08-26 07:55:18,1302
569,1430799965681487872,Important you saw drop performance GSC over this period here note from #Google #SEO,"[{'text': 'Google', 'indices': [88, 95]}, {'text': 'SEO', 'indices': [96, 100]}]",2021-08-26 07:51:09,40
570,1430799693865439233,Check out Gig #Fiverr #google #scraping for #search results #business #profiles,"[{'text': 'Fiverr', 'indices': [66, 73]}, {'text': 'google', 'indices': [78, 85]}, {'text': 'scraping', 'indices': [86, 95]}, {'text': 'search', 'indices': [100, 107]}, {'text': 'business', 'indices': [119, 128]}, {'text': 'profiles', 'indices': [129, 138]}]",2021-08-26 07:50:04,150
571,1430799686986829824,Check out Gig #Fiverr #google #scraping for #search results #business #profiles,"[{'text': 'Fiverr', 'indices': [66, 73]}, {'text': 'google', 'indices': [78, 85]}, {'text': 'scraping', 'indices': [86, 95]}, {'text': 'search', 'indices': [100, 107]}, {'text': 'business', 'indices': [119, 128]}, {'text': 'profiles', 'indices': [129, 138]}]",2021-08-26 07:50:03,150
572,1430799446934052864,The latest update for Pixel Buds adds Android home screen widget,[],2021-08-26 07:49:05,1572
573,1430799171624263680,Google Ads Expert FFFF #GOOGLEADS #GOOGLEADCAMPAIGN #GOOGLEADWORDSGOOGLEPPC,"[{'text': 'GOOGLEADS', 'indices': [60, 70]}, {'text': 'GOOGLEADCAMPAIGN', 'indices': [71, 88]}, {'text': 'GOOGLEADWORDSGOOGLEPPC', 'indices': [89, 112]}]",2021-08-26 07:48:00,124
574,1430799151776817153,The future here the bridge coming xdc xrp xlm qnt #blockchain #DLT #interoperability #google #Microsoft #facebook,"[{'text': 'blockchain', 'indices': [76, 87]}, {'text': 'DLT', 'indices': [88, 92]}, {'text': 'interoperability', 'indices': [93, 110]}, {'text': 'google', 'indices': [111, 118]}, {'text': 'Microsoft', 'indices': [119, 129]}, {'text': 'facebook', 'indices': [130, 139]}]",2021-08-26 07:47:55,422
575,1430799107229196290,More developments Russia #internet #itlaw #socialmedia #WhatsApp #google and other giants,"[{'text': 'internet', 'indices': [31, 40]}, {'text': 'itlaw', 'indices': [43, 49]}, {'text': 'socialmedia', 'indices': [50, 62]}, {'text': 'WhatsApp', 'indices': [65, 74]}, {'text': 'google', 'indices': [77, 84]}]",2021-08-26 07:47:44,831
576,1430799016263135236,Google Ads Expert FFFF #GOOGLEADS #GOOGLEADCAMPAIGN #GOOGLEADWORDSGOOGLEPPC,"[{'text': 'GOOGLEADS', 'indices': [60, 70]}, {'text': 'GOOGLEADCAMPAIGN', 'indices': [71, 88]}, {'text': 'GOOGLEADWORDSGOOGLEPPC', 'indices': [89, 112]}]",2021-08-26 07:47:23,124
577,1430798857441529859,Now back Thanks #Google Took you about hour That not bad,"[{'text': 'Google', 'indices': [22, 29]}]",2021-08-26 07:46:45,57
578,1430798621511979009,Googling things correctly skill legitimate skill #Google,"[{'text': 'Google', 'indices': [56, 63]}]",2021-08-26 07:45:48,21
579,1430798503563902977,real pickup for you #usher #crowder #june coup #google #ethan,"[{'text': 'usher', 'indices': [23, 29]}, {'text': 'crowder', 'indices': [30, 38]}, {'text': 'june22coup', 'indices': [39, 50]}, {'text': 'google', 'indices': [51, 58]}, {'text': 'ethan', 'indices': [59, 65]}]",2021-08-26 07:45:20,4
580,1430798470634475524,Great News Ukraine #CrimeaPlatform has over million results #Google Admittedly few will Russia having,"[{'text': 'CrimeaPlatform', 'indices': [42, 57]}, {'text': 'Google', 'indices': [88, 95]}]",2021-08-26 07:45:13,1418
581,1430798463533342722,Value invested years ago #Bitcoin #Tesla #Netflix,"[{'text': 'Bitcoin', 'indices': [40, 48]}, {'text': 'Tesla', 'indices': [62, 68]}, {'text': 'Netflix', 'indices': [86, 94]}]",2021-08-26 07:45:11,1191
582,1430798454142345218,Hello Twitter Super happy share that finally after long wait received Google Cloud Schwags today,[],2021-08-26 07:45:09,50
583,1430797631828205569,ProfileTree Google ads Amazon ads #Google #Amazon #ads #socialmedia #marketing #online #internet,"[{'text': 'Google', 'indices': [66, 73]}, {'text': 'Amazon', 'indices': [74, 81]}, {'text': 'ads', 'indices': [82, 86]}, {'text': 'socialmedia', 'indices': [87, 99]}, {'text': 'marketing', 'indices': [100, 110]}, {'text': 'online', 'indices': [111, 118]}, {'text': 'internet', 'indices': [119, 128]}]",2021-08-26 07:41:53,80
584,1430797625058541568,#YouTube forcing the popular Groovy #Discord music bot offline #Google gave the Groovy Bot owners seven days compl,"[{'text': 'YouTube', 'indices': [18, 26]}, {'text': 'Discord', 'indices': [57, 65]}, {'text': 'Google', 'indices': [85, 92]}]",2021-08-26 07:41:51,69
585,1430797447295508484,#Apple and Alphabet #Google have faced global criticism because they require #software developers using their app,"[{'text': 'Apple', 'indices': [0, 6]}, {'text': 'Google', 'indices': [22, 29]}, {'text': 'software', 'indices': [79, 88]}]",2021-08-26 07:41:09,1575
586,1430797311903469572,Commande sur Snap Telegram daysofcode #thegreenna,"[{'text': '100daysofcode', 'indices': [113, 127]}]",2021-08-26 07:40:36,581
587,1430797184690278403,Your own website #domainName will different You can use your name you are celebrity you can use product nam,"[{'text': 'domainName', 'indices': [17, 28]}]",2021-08-26 07:40:06,1641
588,1430797133859414017,How Optimize for #Google Featured Snippet Target Long tail Keywords Optimize for Questions Format Content for,"[{'text': 'Google', 'indices': [39, 46]}]",2021-08-26 07:39:54,57
589,1430796939319250945,Check out Gig #Fiverr #google #scraping for #search results #business,"[{'text': 'Fiverr', 'indices': [47, 54]}, {'text': 'google', 'indices': [59, 66]}, {'text': 'scraping', 'indices': [67, 76]}, {'text': 'search', 'indices': [81, 88]}, {'text': 'business', 'indices': [100, 109]}]",2021-08-26 07:39:07,187
590,1430796899519451136,Check out Gig #Fiverr #google #scraping for #search results #business,"[{'text': 'Fiverr', 'indices': [47, 54]}, {'text': 'google', 'indices': [59, 66]}, {'text': 'scraping', 'indices': [67, 76]}, {'text': 'search', 'indices': [81, 88]}, {'text': 'business', 'indices': [100, 109]}]",2021-08-26 07:38:58,187
591,1430796602331963392,Google VPN now available iPhone #Google #GoogleFi #GoogleFiVPN #FiVPN #VPN,"[{'text': 'Google', 'indices': [67, 74]}, {'text': 'GoogleFi', 'indices': [75, 84]}, {'text': 'GoogleFiVPN', 'indices': [85, 97]}, {'text': 'FiVPN', 'indices': [98, 104]}, {'text': 'VPN', 'indices': [105, 109]}]",2021-08-26 07:37:47,48
592,1430795849928347651,Party #Google #BirthdayCelebration #DigitalMarketing #GoogleBirthday Giant Google Birthday coming Soon,"[{'text': 'Google', 'indices': [28, 35]}, {'text': 'BirthdayCelebration', 'indices': [37, 57]}, {'text': 'DigitalMarketing', 'indices': [59, 76]}, {'text': 'GoogleBirthday', 'indices': [78, 93]}]",2021-08-26 07:34:48,141
593,1430795793946976259,#Google #Microsoft plan spend billions #cybersecurity #Hackers #ransomware,"[{'text': 'Google', 'indices': [0, 7]}, {'text': 'Microsoft', 'indices': [9, 19]}, {'text': 'cybersecurity', 'indices': [46, 60]}, {'text': 'Hackers', 'indices': [106, 114]}, {'text': 'ransomware', 'indices': [115, 126]}]",2021-08-26 07:34:34,2376
594,1430795721293316099,#Google introduces global kids safety programme India updates Google Safety Centre,"[{'text': 'Google', 'indices': [0, 7]}]",2021-08-26 07:34:17,96237
595,1430795714376785923,Remark with the right answer #QuizTime #Quizoftheday #Quiz #Google #Ranking #SEOQuiz #Analytics,[],2021-08-26 07:34:15,1
596,1430795456645304328,#Google #Chat down #Dontpanic,"[{'text': 'Google', 'indices': [0, 7]}, {'text': 'Chat', 'indices': [8, 13]}, {'text': 'Dontpanic', 'indices': [23, 33]}]",2021-08-26 07:33:14,649
597,1430795431978569729,Massive OneLife System Starting Global Attention New Link Join Global,[],2021-08-26 07:33:08,2836
598,1430795410705207296,#Formatting Service ebook Paperback will provide you with digital files for #Kindle #Apple #Nook #Kobo and #Google,"[{'text': 'Formatting', 'indices': [18, 29]}, {'text': 'Kindle', 'indices': [96, 103]}, {'text': 'Apple', 'indices': [105, 111]}, {'text': 'Nook', 'indices': [113, 118]}, {'text': 'Kobo', 'indices': [120, 125]}, {'text': 'Google', 'indices': [131, 138]}]",2021-08-26 07:33:03,210
599,1430795404292071425,Great News Ukraine #CrimeaPlatform has over million results #Google Admittedly few will Russia having,"[{'text': 'CrimeaPlatform', 'indices': [42, 57]}, {'text': 'Google', 'indices': [88, 95]}]",2021-08-26 07:33:01,485
600,1430795159059501056,Download one the Best amp highly recommended Data Recovery App Experts Keep this installed amp Your Photos Video,[],2021-08-26 07:32:03,82
601,1430795123416178691,When love with them The leader always say learn earn because are team Believerz Raipur Chhatti,[],2021-08-26 07:31:54,37
602,1430795096270594050,Which Android Auto for Phone Screens and Google Assistant you feel most comfortable while driving,[],2021-08-26 07:31:48,17
603,1430795074569326593,MHL Realty #Google #commercialpropertyinnoida #cyberthum #bhutani #bhutanigroup #propertydealerinnoida #shopin,"[{'text': 'Google', 'indices': [40, 47]}, {'text': 'commercialpropertyinnoida', 'indices': [48, 74]}, {'text': 'cyberthum', 'indices': [75, 85]}, {'text': 'bhutani', 'indices': [86, 94]}, {'text': 'bhutanigroup', 'indices': [95, 108]}, {'text': 'propertydealerinnoida', 'indices': [109, 131]}]",2021-08-26 07:31:43,323
604,1430795018114056199,Download one the Best amp highly recommended Data Recovery App Experts Keep this installed amp Your Photos Video,[],2021-08-26 07:31:29,339
605,1430794939361792003,morning #Google reminder that #RussiaInvadedUkraine #Crimea #Poland #Georgia #Finland #Afghanistan,"[{'text': 'Google', 'indices': [28, 35]}, {'text': 'RussiaInvadedUkraine', 'indices': [55, 76]}, {'text': 'Crimea', 'indices': [80, 87]}, {'text': 'Poland', 'indices': [91, 98]}, {'text': 'Georgia', 'indices': [102, 110]}, {'text': 'Finland', 'indices': [114, 122]}, {'text': 'Afghanistan', 'indices': [126, 138]}]",2021-08-26 07:31:11,485
606,1430794934777491458,set your ads campaign and ads management through pixels You want promote your business with,[],2021-08-26 07:31:09,9761
607,1430794860907229187,Top universities and colleges free courses DaysofCode #Python,"[{'text': '100DaysofCode', 'indices': [115, 129]}, {'text': 'Python', 'indices': [130, 137]}]",2021-08-26 07:30:52,3133
608,1430794860261298176,Top universities and colleges free courses DaysofCode #Pyt,"[{'text': '100DaysofCode', 'indices': [120, 134]}]",2021-08-26 07:30:52,3133
609,1430794834386640903,#BreakingNews Google website along with youtube are not accessible from desktop able tweet internet,"[{'text': 'BreakingNews', 'indices': [0, 13]}]",2021-08-26 07:30:46,16
610,1430794724210794496,Top universities and colleges free courses DaysofCode #Python,"[{'text': '100DaysofCode', 'indices': [115, 129]}, {'text': 'Python', 'indices': [130, 137]}]",2021-08-26 07:30:19,3307
611,1430794644158308355,Looking build agility into your #apps and infrastructure whilst enabling workforce productivity and inclusivity,"[{'text': 'apps', 'indices': [35, 40]}]",2021-08-26 07:30:00,11867
