Unnamed: 0,id,text,Hashtags,date,follower_count
685,1413552553493766146,Google Pixel Leak Adds Specs Previous Design Hints Digital Trends #Google,"[{'text': 'Google', 'indices': [97, 104]}]",2021-07-09 17:36:05,3363
686,1413552521373753347,Join live with Lior Krolewicz CEO Yael Consulting find out how you can increase your profitability and return,[],2021-07-09 17:35:58,3369
687,1413552503547957252,Gray Raven Database Nanami Pulse Vol Construct Features Mixed Damage Able deal Physical and Elemental DMG Resi,[],2021-07-09 17:35:54,41
688,1413552117030162434,Former President #DonaldTrump Wednesday filed #lawsuits against #Twitter Inc #Facebook Inc and #Alphabet Inc,"[{'text': 'DonaldTrump', 'indices': [39, 51]}, {'text': 'lawsuits', 'indices': [71, 80]}, {'text': 'Twitter', 'indices': [89, 97]}, {'text': 'Facebook', 'indices': [103, 112]}, {'text': 'Alphabet', 'indices': [122, 131]}]",2021-07-09 17:34:21,11
689,1413552012759912453,How Make Login amp Registration Form GameMaker #gamemaker #GameMakerStudio #mobile #android #io,"[{'text': 'gamemaker', 'indices': [94, 104]}, {'text': 'GameMakerStudio2', 'indices': [105, 122]}, {'text': 'mobile', 'indices': [123, 130]}, {'text': 'android', 'indices': [131, 139]}]",2021-07-09 17:33:57,1497
690,1413551974088314886,How Make Login amp Registration Form GameMaker #gamemaker #GameMakerStudio #mobile #android #io,"[{'text': 'gamemaker', 'indices': [94, 104]}, {'text': 'GameMakerStudio2', 'indices': [105, 122]}, {'text': 'mobile', 'indices': [123, 130]}, {'text': 'android', 'indices': [131, 139]}]",2021-07-09 17:33:47,1337
691,1413551961434038276,How Make Login amp Registration Form GameMaker #gamemaker #GameMakerStudio #mobile #android #io,"[{'text': 'gamemaker', 'indices': [94, 104]}, {'text': 'GameMakerStudio2', 'indices': [105, 122]}, {'text': 'mobile', 'indices': [123, 130]}, {'text': 'android', 'indices': [131, 139]}]",2021-07-09 17:33:44,2835
692,1413551900599988225,Senior Living Community North #Google #SeniorLivingCommunity,"[{'text': 'Google', 'indices': [36, 43]}, {'text': 'SeniorLivingCommunity', 'indices': [68, 90]}]",2021-07-09 17:33:30,32
693,1413551775945314306,How Make Login amp Registration Form GameMaker #gamemaker #GameMakerStudio #mobile #android #io,"[{'text': 'gamemaker', 'indices': [94, 104]}, {'text': 'GameMakerStudio2', 'indices': [105, 122]}, {'text': 'mobile', 'indices': [123, 130]}, {'text': 'android', 'indices': [131, 139]}]",2021-07-09 17:33:00,4153
694,1413551626414034944,NorCoSaw llc routerbits and saw blades sales amp sharpening services #Google,"[{'text': 'Google', 'indices': [75, 82]}]",2021-07-09 17:32:24,258
695,1413551557933625346,Never watch #YouTube alone present this opportunity the entire YouTube team including Rob Pilgrim and,"[{'text': 'YouTube', 'indices': [12, 20]}]",2021-07-09 17:32:08,408
696,1413551392736825345,#usher #crowder #june coup #google #ethan Adaprox Fingerbot Home Hub Bluetooth Bridge Smart Home System Voice Cont,"[{'text': 'usher', 'indices': [0, 6]}, {'text': 'crowder', 'indices': [7, 15]}, {'text': 'june22coup', 'indices': [16, 27]}, {'text': 'google', 'indices': [28, 35]}, {'text': 'ethan', 'indices': [36, 42]}]",2021-07-09 17:31:29,2
697,1413551178781233152,the key thing they all need about get over themselves and not blow this opportunity,[],2021-07-09 17:30:38,5620
698,1413551175937363972,will step step monthly SEO process for google top ranking will provide page and #Technical SEO well,"[{'text': 'Technical', 'indices': [93, 103]}]",2021-07-09 17:30:37,477
699,1413551020525903874,Thousands users bought fake Android cryptocurrency mining apps The apps advertised way earning money via,[],2021-07-09 17:30:00,3375
700,1413550871363801089,HIGHLIGHTS Google Pixel Fold may arrive later this year codenamed Passport The smartphone tipped fea,[],2021-07-09 17:29:24,83
701,1413550870948687872,Pixel Pro Google One Ups Samsung #pixel #pixel pro #googleone #samsung #google #apple #tech #technews,"[{'text': 'pixel6', 'indices': [37, 44]}, {'text': 'pixel6pro', 'indices': [45, 55]}, {'text': 'googleone', 'indices': [56, 66]}, {'text': 'samsung', 'indices': [67, 75]}, {'text': 'google', 'indices': [76, 83]}, {'text': 'apple', 'indices': [84, 90]}, {'text': 'tech', 'indices': [91, 96]}, {'text': 'technews', 'indices': [97, 106]}]",2021-07-09 17:29:24,2140
702,1413550870726316032,Check out this new digital art that uploaded #Woman #Dress #Hat,"[{'text': 'Woman', 'indices': [118, 124]}, {'text': 'Dress', 'indices': [125, 131]}, {'text': 'Hat', 'indices': [132, 136]}]",2021-07-09 17:29:24,3438
703,1413550864275578880,have considered LOT things but not #podcasting let #Google what first,"[{'text': 'podcasting', 'indices': [53, 64]}, {'text': 'Google', 'indices': [72, 79]}]",2021-07-09 17:29:23,833
704,1413550829202780165,Must read for #cybersecurity #AI boost your career amp knowledge Shira amp her panel experts talk all things cyber,"[{'text': 'cybersecurity', 'indices': [34, 48]}, {'text': 'AI', 'indices': [49, 52]}]",2021-07-09 17:29:14,2788
705,1413550676190371841,EXCLUSIVE Pixel and Pixel Pro Full Final Specifications #Google #Android,"[{'text': 'Google', 'indices': [90, 97]}, {'text': 'Android', 'indices': [98, 106]}]",2021-07-09 17:28:38,994
706,1413550571793969152,Trinity Care Foundation #Google #SDGs #PHC #CovidRelief #COVID #India,"[{'text': 'Google', 'indices': [27, 34]}, {'text': 'SDGs', 'indices': [73, 78]}, {'text': 'PHC', 'indices': [79, 83]}, {'text': 'CovidRelief', 'indices': [84, 96]}, {'text': 'COVID19', 'indices': [97, 105]}, {'text': 'India', 'indices': [106, 112]}]",2021-07-09 17:28:13,759
707,1413550294177402885,Join playing spot the #Google,"[{'text': 'Google', 'indices': [47, 54]}]",2021-07-09 17:27:07,19
708,1413550282940854287,Daily Hint Design special offer #dailyui #ui #ux #logo #film #designer #wordpress #adobe,"[{'text': 'dailyui', 'indices': [46, 54]}, {'text': 'ui', 'indices': [56, 59]}, {'text': 'ux', 'indices': [60, 63]}, {'text': 'logo', 'indices': [64, 69]}, {'text': 'film2021', 'indices': [70, 79]}, {'text': 'designer', 'indices': [80, 89]}, {'text': 'wordpress', 'indices': [90, 100]}, {'text': 'adobe', 'indices': [101, 107]}]",2021-07-09 17:27:04,32
709,1413550241605902337,#HLPF discussed gender digital equity digital safety amp global and social contracts protect wome,"[{'text': 'HLPF2021', 'indices': [3, 12]}]",2021-07-09 17:26:54,20892
710,1413550225017516032,Join live with Lior Krolewicz CEO Yael Consulting find out how you can increase your profitability and return,[],2021-07-09 17:26:50,166
711,1413550207590191107,Tokenize your card for touchless experience with Swipe powered debit cards that enable access #Apple Pay #Google Pay and,"[{'text': 'Apple', 'indices': [110, 116]}, {'text': 'Google', 'indices': [122, 129]}]",2021-07-09 17:26:46,6
712,1413550146026151937,Finally #GearHub returned #GooglePlay need point very very bad #google work and support Respon,"[{'text': 'GearHub', 'indices': [9, 17]}, {'text': 'GooglePlay', 'indices': [30, 41]}, {'text': 'google', 'indices': [76, 83]}]",2021-07-09 17:26:31,41
713,1413550036718391296,#Google roll out slate over #updates for #Classroom Meet and other online #education tools TechCrunch https,"[{'text': 'Google', 'indices': [15, 22]}, {'text': 'updates', 'indices': [52, 60]}, {'text': 'Classroom', 'indices': [65, 75]}, {'text': 'education', 'indices': [99, 109]}]",2021-07-09 17:26:05,2073
714,1413549941616742402,all know one maybe you Guilty here #Trending #Google #fridaymorning,"[{'text': 'Trending', 'indices': [71, 80]}, {'text': 'Google', 'indices': [81, 88]}, {'text': 'fridaymorning', 'indices': [89, 103]}]",2021-07-09 17:25:43,332
715,1413549774419095553,will rank your website first page google with white hat SEO More info #marketing #Fiverr,"[{'text': 'marketing', 'indices': [120, 130]}, {'text': 'Fiverr', 'indices': [131, 138]}]",2021-07-09 17:25:03,92
716,1413549599843885056,Gray Raven Database Nanami Pulse Vol Construct Features Mixed Damage Able deal Physical and Elemental DMG Resi,[],2021-07-09 17:24:21,56
717,1413549559402409988,How Make Login amp Registration Form GameMaker #gamemaker #GameMakerStudio #mobile,"[{'text': 'gamemaker', 'indices': [81, 91]}, {'text': 'GameMakerStudio2', 'indices': [92, 109]}, {'text': 'mobile', 'indices': [110, 117]}]",2021-07-09 17:24:12,312
718,1413549452019777550,Google the internet #google #googl #goog #stock #market #tech #technology #epic #internet #monster,"[{'text': 'google', 'indices': [26, 33]}, {'text': 'googl', 'indices': [34, 40]}, {'text': 'goog', 'indices': [41, 46]}, {'text': 'stock', 'indices': [47, 53]}, {'text': 'market', 'indices': [54, 61]}, {'text': 'tech', 'indices': [62, 67]}, {'text': 'technology', 'indices': [68, 79]}, {'text': 'epic', 'indices': [80, 85]}, {'text': 'internet', 'indices': [86, 95]}, {'text': 'monster', 'indices': [96, 104]}]",2021-07-09 17:23:46,214
719,1413549270511374336,PageRank just one over #SEO ranking factors Google uses organic search algorithm High,"[{'text': 'SEO', 'indices': [38, 42]}]",2021-07-09 17:23:03,9146
720,1413549057515999233,ISRO amp MapmyIndia build alternative Google Maps #ISRO India answer #NASA #MapmyIndia that,"[{'text': 'ISRO', 'indices': [87, 92]}, {'text': 'NASA', 'indices': [114, 119]}, {'text': 'MapmyIndia', 'indices': [121, 132]}]",2021-07-09 17:22:12,761
721,1413548978554105858,Advertise here #digitalmarketing #marketing #business #promotion #design #logodesigner #seo #websitedesign #instagood,"[{'text': 'digitalmarketing', 'indices': [36, 53]}, {'text': 'marketing', 'indices': [54, 64]}, {'text': 'business', 'indices': [65, 74]}, {'text': 'promotion', 'indices': [75, 85]}, {'text': 'design', 'indices': [86, 93]}, {'text': 'logodesigner', 'indices': [94, 107]}, {'text': 'seo', 'indices': [108, 112]}, {'text': 'websitedesign', 'indices': [113, 127]}, {'text': 'instagood', 'indices': [128, 138]}]",2021-07-09 17:21:53,92
722,1413548939240947718,this week #TechTip explore Sharing YouTube Videos Precise Timeframe #TechImaginations,"[{'text': 'TechTip', 'indices': [29, 37]}, {'text': 'TechImaginations', 'indices': [119, 136]}]",2021-07-09 17:21:44,3057
723,1413548847930953738,Hugo Restaurant #Google,"[{'text': 'Google', 'indices': [21, 28]}]",2021-07-09 17:21:22,131
724,1413548683061305348,Lock Security #Google,"[{'text': 'Google', 'indices': [20, 27]}]",2021-07-09 17:20:43,358
725,1413548609895809028,night sight photo with #pixel #GooglePhotos #Google #Summer,"[{'text': 'pixel4', 'indices': [23, 30]}, {'text': 'GooglePhotos', 'indices': [31, 44]}, {'text': 'Google', 'indices': [45, 52]}, {'text': 'Summer2021', 'indices': [53, 64]}]",2021-07-09 17:20:25,57
726,1413548503318470656,think our employees are among the best around Individuals who are friendly punctual and trustworthy not,[],2021-07-09 17:20:00,24
727,1413548468841369611,Vibration feat Full video entertain #Djokovic #music #SarkOnHammerTime,"[{'text': 'Djokovic', 'indices': [73, 82]}, {'text': 'music', 'indices': [83, 89]}, {'text': 'SarkOnHammerTime', 'indices': [90, 107]}]",2021-07-09 17:19:52,1
728,1413548191916560386,Just applied for the WiCys Security Training Scholarship and here hoping get #wicys #cybersecurity #infos,"[{'text': 'wicys', 'indices': [111, 117]}, {'text': 'cybersecurity', 'indices': [118, 132]}]",2021-07-09 17:18:46,465
729,1413547793361346566,#SCORESmallBiz #Webinars amp Person #SmallBiz #Workshops #MesaAZ #Mesa #Marketing #SmallBusiness #business #DigitalMarketing,"[{'text': 'SCORESmallBiz', 'indices': [14, 28]}, {'text': 'Webinars', 'indices': [29, 38]}, {'text': 'SmallBiz', 'indices': [55, 64]}, {'text': 'Workshops', 'indices': [65, 75]}, {'text': 'MesaAZ', 'indices': [76, 83]}, {'text': 'Mesa', 'indices': [84, 89]}, {'text': 'Marketing', 'indices': [90, 100]}, {'text': 'SmallBusiness', 'indices': [101, 115]}, {'text': 'business', 'indices': [116, 125]}, {'text': 'DigitalMarketing', 'indices': [126, 143]}]",2021-07-09 17:17:11,2156
730,1413547651333824515,The best streaming device buy right now #google,"[{'text': 'google', 'indices': [67, 74]}]",2021-07-09 17:16:37,1810
731,1413547465798676480,Content the atomic particle all digital marketing Rebecca Lieb #marketing #DigitalMarketing #content #technolo,"[{'text': 'marketing', 'indices': [92, 102]}, {'text': 'DigitalMarketing', 'indices': [103, 120]}, {'text': 'content', 'indices': [121, 129]}]",2021-07-09 17:15:52,92
732,1413547443807993858,The shameless GQP lies continue This time Ken Buck blames Google for Trump election loss #UnderCurre,[],2021-07-09 17:15:47,150
733,1413547401810518016,Suing Big Tech Another Trump Cash Grab Send him your money the poorly educated loves you,[],2021-07-09 17:15:37,25
734,1413547377911209994,Must read for #cybersecurity #AI boost your career amp knowledge Shira amp her panel experts talk all things cyb,"[{'text': 'cybersecurity', 'indices': [14, 28]}, {'text': 'AI', 'indices': [29, 32]}]",2021-07-09 17:15:31,1827
735,1413547264937693186,Thinking about advertising Google can help #SEO #Google #Ranking #advertising,"[{'text': 'SEO', 'indices': [52, 56]}, {'text': 'Google', 'indices': [57, 64]}, {'text': 'Ranking', 'indices': [65, 73]}, {'text': 'advertising', 'indices': [74, 86]}]",2021-07-09 17:15:05,6672
736,1413547228883562503,Digital Health World Congress ONLINE Sep Book Now #iot #ai,"[{'text': 'iot', 'indices': [108, 112]}, {'text': 'ai', 'indices': [113, 116]}]",2021-07-09 17:14:56,2301
737,1413547138575867909,Digital Health World Congress ONLINE Sep Book Now #iot #ai,"[{'text': 'iot', 'indices': [108, 112]}, {'text': 'ai', 'indices': [113, 116]}]",2021-07-09 17:14:34,17556
738,1413547138575847427,Digital Health World Congress ONLINE Sep Book Now #iot #ai,"[{'text': 'iot', 'indices': [108, 112]}, {'text': 'ai', 'indices': [113, 116]}]",2021-07-09 17:14:34,36362
739,1413547125871362056,Digital Health World Congress ONLINE Sep Book Now #iot #ai,"[{'text': 'iot', 'indices': [108, 112]}, {'text': 'ai', 'indices': [113, 116]}]",2021-07-09 17:14:31,2211
740,1413547121144438787,Digital Health World Congress ONLINE Sep Book Now #iot #ai,"[{'text': 'iot', 'indices': [108, 112]}, {'text': 'ai', 'indices': [113, 116]}]",2021-07-09 17:14:30,3280
741,1413546995470503936,Digital Health World Congress ONLINE Sep Book Now #iot #ai,"[{'text': 'iot', 'indices': [108, 112]}, {'text': 'ai', 'indices': [113, 116]}]",2021-07-09 17:14:00,2526
742,1413546986326921219,#Google faces major multi state antitrust lawsuit over Google Play fees https,"[{'text': 'Google', 'indices': [20, 27]}]",2021-07-09 17:13:58,3363
743,1413546980467486720,Digital Health World Congress ONLINE Sep Book Now #iot #ai,"[{'text': 'iot', 'indices': [108, 112]}, {'text': 'ai', 'indices': [113, 116]}]",2021-07-09 17:13:57,5473
744,1413546934170701824,Digital Health World Congress ONLINE Sep Book Now #iot #ai,"[{'text': 'iot', 'indices': [89, 93]}, {'text': 'ai', 'indices': [94, 97]}]",2021-07-09 17:13:46,8887
745,1413546862087270401,Thankfully our Senators are okay but have #KillEmAllKen that was filmed saying,"[{'text': 'KillEmAllKen', 'indices': [61, 74]}]",2021-07-09 17:13:29,2451
746,1413546809432018946,ISRO amp MapmyIndia build alternative Google Maps #ISRO India answer #NASA #MapmyIndia that,"[{'text': 'ISRO', 'indices': [87, 92]}, {'text': 'NASA', 'indices': [114, 119]}, {'text': 'MapmyIndia', 'indices': [121, 132]}]",2021-07-09 17:13:16,57789
747,1413546429763756039,Google now extending the RSVP option Google Calendar invites virtual meetings With the new feature Google,[],2021-07-09 17:11:45,562
748,1413546316743983108,MORIN Entertainment Law #Google,"[{'text': 'Google', 'indices': [27, 34]}]",2021-07-09 17:11:18,706
749,1413546020512931846,#Google Don #Link All Your #Pages All Your Pages,"[{'text': 'Google', 'indices': [17, 24]}, {'text': 'Link', 'indices': [32, 37]}, {'text': 'Pages', 'indices': [47, 53]}]",2021-07-09 17:10:08,16942
750,1413546009603477511,Every point counts Don forget claim your free Google Play Perks every week the Play Store #Google #GooglePlay #Goo,"[{'text': 'Google', 'indices': [115, 122]}, {'text': 'GooglePlay', 'indices': [123, 134]}]",2021-07-09 17:10:05,7
751,1413545796050501632,Titles not only have significant impact the ranking potential web page but also large extent determine how,[],2021-07-09 17:09:14,1009
752,1413545774030495745,Experts also believe you should avoid having certain things your page that would decrease your ranking such,[],2021-07-09 17:09:09,1009
753,1413545761002991621,How quickly your website loads your website takes longer than six seconds load properly you need have look,[],2021-07-09 17:09:06,1009
754,1413545750278049792,Image alt tags Image alt tags should written for accessibility People who use screen readers access the internet,[],2021-07-09 17:09:03,1009
755,1413545722780192771,Using keywords and titles rank higher Google Think keywords what you type into Google though remember the,[],2021-07-09 17:08:57,1009
756,1413545718133018627,Use internal links Link between different posts your blog you touch something you previously written about,[],2021-07-09 17:08:56,1009
758,1413545561274388494,#Google now does soft detection device type #marketing #seo,"[{'text': 'Google', 'indices': [0, 7]}, {'text': 'marketing', 'indices': [75, 85]}, {'text': 'seo', 'indices': [86, 90]}]",2021-07-09 17:08:18,47200
759,1413545530026721283,There lots more than just Maps behind success intelligence and widespread acceptability,[],2021-07-09 17:08:11,5
760,1413545478285926402,Suing Big Tech Another Trump Cash Grab Send him your money the poorly educated lov,[],2021-07-09 17:07:59,10479
761,1413545451630989323,With new innovations Search Google can get you even closer what you looking for Click find out more #Google,"[{'text': 'Google', 'indices': [127, 134]}]",2021-07-09 17:07:52,4
762,1413545430940540933,#Platform #Tech giants move into ever more sectors #Google roll out fintech services Japan Nikkei Asia #PrinzipMe,"[{'text': 'Platform', 'indices': [16, 25]}, {'text': 'Tech', 'indices': [26, 31]}, {'text': 'Google', 'indices': [68, 75]}]",2021-07-09 17:07:47,454
763,1413545365727584260,FCC listing suggests Google midrange Pixel could arrive soon #google,"[{'text': 'google', 'indices': [93, 100]}]",2021-07-09 17:07:32,1810
764,1413545336920969219,Mutton Power Equipment #Google,"[{'text': 'Google', 'indices': [26, 33]}]",2021-07-09 17:07:25,519
765,1413545061766287360,Care Education App Find Here Download Over Premium Resources Only https,[],2021-07-09 17:06:19,5766
766,1413544940378931203,This insane CPU consumption never high even you browse sites with loads advertisements #DEVCommunity,"[{'text': 'DEVCommunity', 'indices': [122, 135]}]",2021-07-09 17:05:50,166
767,1413544894765879299,This insane CPU consumption never high even you browse sites with loads advertisements #DEVCommunity,"[{'text': 'DEVCommunity', 'indices': [122, 135]}]",2021-07-09 17:05:39,4812
768,1413544892584931334,Incredible #usher #crowder #june coup #google #ethan,"[{'text': 'usher', 'indices': [12, 18]}, {'text': 'crowder', 'indices': [19, 27]}, {'text': 'june22coup', 'indices': [28, 39]}, {'text': 'google', 'indices': [40, 47]}, {'text': 'ethan', 'indices': [48, 54]}]",2021-07-09 17:05:39,2
769,1413544840634191875,This insane CPU consumption never high even you browse sites with loads advertisements #DEVCommunity,"[{'text': 'DEVCommunity', 'indices': [122, 135]}]",2021-07-09 17:05:27,6649
770,1413544835974320137,This insane CPU consumption never high even you browse sites with loads advertisements #DEVCommunity,"[{'text': 'DEVCommunity', 'indices': [122, 135]}]",2021-07-09 17:05:25,2748
771,1413544813299830788,This insane CPU consumption never high even you browse sites with loads advertisements,[],2021-07-09 17:05:20,193
772,1413544585679319043,#hello from #Fl bragging department five stars #reviews #Google Check out Renata,"[{'text': 'hello', 'indices': [18, 24]}, {'text': 'Fl', 'indices': [30, 33]}, {'text': 'reviews', 'indices': [95, 103]}, {'text': 'Google', 'indices': [107, 114]}]",2021-07-09 17:04:26,24874
773,1413544454527623170,Your website marketing while you are working other aspects your Business sleeping vacation,[],2021-07-09 17:03:55,137
774,1413544348755501057,Mutton Power Equipment #Google,"[{'text': 'Google', 'indices': [26, 33]}]",2021-07-09 17:03:29,519
775,1413544324730474497,Care Education App Find Here Download Over Premium Resources Only https,[],2021-07-09 17:03:24,6
776,1413544281206370306,#Google searches Kendall Jenner old,"[{'text': 'Google', 'indices': [5, 12]}]",2021-07-09 17:03:13,3316
777,1413544270577930248,#Google searches Avenatti old,"[{'text': 'Google', 'indices': [5, 12]}]",2021-07-09 17:03:11,3316
778,1413544217570418691,#SCORESmallBiz #Webinars amp Person #SmallBiz #Workshops #MesaAZ #Mesa #Marketing #SmallBusiness #business,"[{'text': 'SCORESmallBiz', 'indices': [0, 14]}, {'text': 'Webinars', 'indices': [15, 24]}, {'text': 'SmallBiz', 'indices': [41, 50]}, {'text': 'Workshops', 'indices': [51, 61]}, {'text': 'MesaAZ', 'indices': [62, 69]}, {'text': 'Mesa', 'indices': [70, 75]}, {'text': 'Marketing', 'indices': [76, 86]}, {'text': 'SmallBusiness', 'indices': [87, 101]}, {'text': 'business', 'indices': [102, 111]}]",2021-07-09 17:02:58,1614
779,1413544169772134411,Tokenize your card for touchless experience with Swipe powered debit cards that enable access #Apple Pay #Google Pay and,"[{'text': 'Apple', 'indices': [110, 116]}, {'text': 'Google', 'indices': [122, 129]}]",2021-07-09 17:02:47,2
780,1413544119339782144,Tokenize your card for touchless experience with Swipe powered debit cards that enable access #Apple Pay #Google Pay and,"[{'text': 'Apple', 'indices': [110, 116]}, {'text': 'Google', 'indices': [122, 129]}]",2021-07-09 17:02:35,16
781,1413544115946545155,Matter Impact June updates from via #digitalmarketing #Google,"[{'text': 'digitalmarketing', 'indices': [113, 130]}, {'text': 'Google', 'indices': [131, 138]}]",2021-07-09 17:02:34,6707
782,1413544004768215048,Featured snippets can help boost brand reputation and drive organic traffic Learn how optimize for them this step,[],2021-07-09 17:02:07,51
783,1413543796298616834,FINALLY Buh bye #Apple #Google #Microsoft #Facebook,"[{'text': 'Apple', 'indices': [29, 35]}, {'text': 'Google', 'indices': [37, 44]}, {'text': 'Microsoft', 'indices': [46, 56]}, {'text': 'Facebook', 'indices': [58, 67]}]",2021-07-09 17:01:18,283
784,1413543708931284995,Enabling telecom media and entertainment teams connect collaborate and get work done real time from anywh,[],2021-07-09 17:00:57,7267
785,1413543701448691717,Our training with Joe after our live was great Easy follow and navigate which makes updating our page much,[],2021-07-09 17:00:55,6672
786,1413543679134998528,Care Education App Find Here Download Over Premium Resources Only,[],2021-07-09 17:00:50,86
787,1413543667923566595,#Google faces major multi state antitrust lawsuit over Google Play fees,"[{'text': 'Google', 'indices': [0, 7]}]",2021-07-09 17:00:47,24915
788,1413543623069769731,#Google #Pixel #Pixel Pro Google Pixel and Pixel Pro specs leaked Jon Prosser https,"[{'text': 'Google', 'indices': [16, 23]}, {'text': 'Pixel6', 'indices': [26, 33]}, {'text': 'Pixel6Pro', 'indices': [36, 46]}]",2021-07-09 17:00:36,0
789,1413543615058612229,Today #RankRiskIndex Jul Orange getting hot here There might algorithm update the way,"[{'text': 'RankRiskIndex', 'indices': [23, 37]}]",2021-07-09 17:00:34,987
790,1413543603457101833,Join our free trading community discord link the bio #pennybois #stockalerts #gains #profit,"[{'text': 'pennybois', 'indices': [76, 86]}, {'text': 'stockalerts', 'indices': [87, 99]}, {'text': 'gains', 'indices': [100, 106]}, {'text': 'profit', 'indices': [107, 114]}]",2021-07-09 17:00:32,1253
791,1413543592866557953,Amazon And Google Face Investigation Into Fake Reviews via #Forbes,"[{'text': 'Forbes', 'indices': [99, 106]}]",2021-07-09 17:00:29,89
792,1413543573614698498,#usher #crowder #june coup #google #ethan High Quality Plastic Kitchen Croissant Cutter Rolling Cutter Knife Bread,"[{'text': 'usher', 'indices': [0, 6]}, {'text': 'crowder', 'indices': [7, 15]}, {'text': 'june22coup', 'indices': [16, 27]}, {'text': 'google', 'indices': [28, 35]}, {'text': 'ethan', 'indices': [36, 42]}]",2021-07-09 17:00:24,2
793,1413543424679190537,Many Constructs have professed their love for her she has gotten uneasy about talking with other squads especially,[],2021-07-09 16:59:49,0
794,1413543403795714053,Family Law Attorney Glen Rock #Google #FamilyLawAttorney,"[{'text': 'Google', 'indices': [37, 44]}, {'text': 'FamilyLawAttorney', 'indices': [69, 87]}]",2021-07-09 16:59:44,15
795,1413543295968493569,Podcasts COVID #eHealth #mhealth #blog #blogger #blogging Julio #farmacia #pedromu #CastillaLaMancha #Espa,"[{'text': 'eHealth', 'indices': [42, 50]}, {'text': 'mhealth', 'indices': [51, 59]}, {'text': 'blog', 'indices': [60, 65]}, {'text': 'blogger', 'indices': [66, 74]}, {'text': 'blogging', 'indices': [75, 84]}, {'text': '9Julio', 'indices': [85, 92]}, {'text': 'farmacia', 'indices': [94, 103]}, {'text': 'pedromuñoz', 'indices': [104, 115]}, {'text': 'CastillaLaMancha', 'indices': [116, 133]}]",2021-07-09 16:59:18,7310
796,1413543273482833923,Podcasts COVID #eHealth #mhealth #blog #blogger #blogging Julio #farmacia #pedromu #CastillaLaMancha #Espa,"[{'text': 'eHealth', 'indices': [42, 50]}, {'text': 'mhealth', 'indices': [51, 59]}, {'text': 'blog', 'indices': [60, 65]}, {'text': 'blogger', 'indices': [66, 74]}, {'text': 'blogging', 'indices': [75, 84]}, {'text': '9Julio', 'indices': [85, 92]}, {'text': 'farmacia', 'indices': [94, 103]}, {'text': 'pedromuñoz', 'indices': [104, 115]}, {'text': 'CastillaLaMancha', 'indices': [116, 133]}]",2021-07-09 16:59:13,1924
797,1413543254247854082,Cityprint #Google,"[{'text': 'Google', 'indices': [16, 23]}]",2021-07-09 16:59:08,548
