Unnamed: 0,id,text,Hashtags,date,follower_count
0,1430864403721818112,Coloring the black box new look managing Smart Shopping campaigns #digitalmarketing #seo #google #searchengine,"[{'text': 'digitalmarketing', 'indices': [96, 113]}, {'text': 'seo', 'indices': [114, 118]}, {'text': 'google', 'indices': [119, 126]}, {'text': 'searchengine', 'indices': [127, 140]}]",2021-08-26 12:07:12,1220
1,1430864271181684740,How Get Your Website Google Discover Feed What Google Discover Feed #google,"[{'text': 'google', 'indices': [105, 112]}]",2021-08-26 12:06:41,2851
2,1430864147080679426,See ping action #distracteddriving #safety #multitasking #amazon #google #ai #voicetech,"[{'text': 'distracteddriving', 'indices': [46, 64]}, {'text': 'safety', 'indices': [65, 72]}, {'text': 'multitasking', 'indices': [73, 86]}, {'text': 'amazon', 'indices': [87, 94]}, {'text': 'google', 'indices': [95, 102]}, {'text': 'ai', 'indices': [103, 106]}, {'text': 'voicetech', 'indices': [107, 117]}]",2021-08-26 12:06:11,3505
3,1430864132274892803,Check this out Did you know you can bring the elements the Periodic Table alive #Google,"[{'text': 'Google', 'indices': [107, 114]}]",2021-08-26 12:06:07,2509
4,1430864052985634821,the latest update has said will nullify spammy links simply not counting them Follow,[],2021-08-26 12:05:49,33
5,1430863865173188610,Fletcher Avon #Google,"[{'text': 'Google', 'indices': [17, 24]}]",2021-08-26 12:05:04,25
6,1430863859976482823,Love this feedback from homeowner who was under the impression she couldn buy house Our team made happen,[],2021-08-26 12:05:03,105
7,1430863782599815168,Automotive #COMMERCIAL #VEHICLE #WORKSHOP PRODUCTS Products For Efficient amp Effective #Repair #Garage Bowmonk,"[{'text': 'COMMERCIAL', 'indices': [11, 22]}, {'text': 'VEHICLE', 'indices': [23, 31]}, {'text': 'WORKSHOP', 'indices': [32, 41]}, {'text': 'Repair', 'indices': [93, 100]}, {'text': 'Garage', 'indices': [101, 108]}]",2021-08-26 12:04:44,505
8,1430863755865477123,#googlecloudready #Google was great experience during the journey Learned many new things about the cloud,"[{'text': 'googlecloudready', 'indices': [0, 17]}, {'text': 'Google', 'indices': [18, 25]}]",2021-08-26 12:04:38,21
9,1430863363043561480,new gear #Pixel #Pixel #Google,"[{'text': 'Pixel5a', 'indices': [18, 26]}, {'text': 'Pixel5a5G', 'indices': [27, 37]}, {'text': 'Google', 'indices': [38, 45]}]",2021-08-26 12:03:04,209
10,1430863360875192327,#Google searches old #London,"[{'text': 'Google', 'indices': [5, 12]}, {'text': 'London', 'indices': [96, 103]}]",2021-08-26 12:03:04,3326
11,1430863267849641989,Google Reportedly Paying Apple Stay Default Search Engine #Google #payments #Apple,"[{'text': 'Google', 'indices': [91, 98]}, {'text': 'payments', 'indices': [99, 108]}, {'text': 'Apple', 'indices': [109, 115]}]",2021-08-26 12:02:41,159
12,1430863209003634688,New Drop MonaPunks #xtz #NFTs #NFT #nftcollector #pixelart #artpixel #larry,"[{'text': 'xtz', 'indices': [81, 85]}, {'text': 'NFTs', 'indices': [88, 93]}, {'text': 'NFT', 'indices': [94, 98]}, {'text': 'nftcollector', 'indices': [99, 112]}, {'text': 'pixelart', 'indices': [113, 122]}, {'text': 'artpixel', 'indices': [123, 132]}]",2021-08-26 12:02:27,1019
13,1430863147812986885,ColourFence Garden Fencing Solihull #Google,"[{'text': 'Google', 'indices': [59, 66]}]",2021-08-26 12:02:13,1542
14,1430863060194021379,Airbnb offers free accommodation for Afghan refugees #technology #blockchain #innovation,"[{'text': 'technology', 'indices': [60, 71]}, {'text': 'blockchain', 'indices': [72, 83]}, {'text': 'innovation', 'indices': [84, 95]}]",2021-08-26 12:01:52,390
15,1430863003528859649,DONLEX ENTERPRISES #Google,"[{'text': 'Google', 'indices': [26, 33]}]",2021-08-26 12:01:38,27
16,1430862985044561920,This past year truly was the year advanced video streaming Visit read more from,[],2021-08-26 12:01:34,204
17,1430862944770969600,Korea parliament committee votes curb #Google #Apple commission dominance,"[{'text': 'Google', 'indices': [43, 50]}, {'text': 'Apple', 'indices': [52, 58]}]",2021-08-26 12:01:24,1240
18,1430862856757538823,#Google about tell drivers little more about how their trips will cost thanks this #Waze tool,"[{'text': 'Google', 'indices': [0, 7]}, {'text': 'Waze', 'indices': [95, 100]}]",2021-08-26 12:01:03,1193
19,1430862849899831296,#Google about tell drivers little more about how their trips will cost thanks this #Waze tool,"[{'text': 'Google', 'indices': [0, 7]}, {'text': 'Waze', 'indices': [95, 100]}]",2021-08-26 12:01:02,861
20,1430862784347127811,New Drop MonaPunks #xtz #NFTs #NFT #nftcollector #pixelart #artpixel #larry,"[{'text': 'xtz', 'indices': [81, 85]}, {'text': 'NFTs', 'indices': [88, 93]}, {'text': 'NFT', 'indices': [94, 98]}, {'text': 'nftcollector', 'indices': [99, 112]}, {'text': 'pixelart', 'indices': [113, 122]}, {'text': 'artpixel', 'indices': [123, 132]}]",2021-08-26 12:00:46,4898
21,1430862753292562432,Don Skimp Ask the experts search Google test for yourself User Experience ultimately determines your,[],2021-08-26 12:00:39,689
22,1430862696052707328,Rely CDW Google Cloud Fellows and engineers specializing Anthos Database Modernization Google Cloud,[],2021-08-26 12:00:25,262
23,1430862610115698690,Digital marketing solutions that will take your #results the next #level #Social media marketing #Search eng,"[{'text': 'results', 'indices': [50, 58]}, {'text': 'level', 'indices': [71, 77]}, {'text': 'Social', 'indices': [80, 87]}, {'text': 'Search', 'indices': [104, 111]}]",2021-08-26 12:00:05,1
24,1430862602486304773,know more visit #google #laravel #trending #php #Apple #github #phpdevelopers #javascrip,"[{'text': 'google', 'indices': [67, 74]}, {'text': 'laravel', 'indices': [75, 83]}, {'text': 'trending', 'indices': [84, 93]}, {'text': 'php', 'indices': [94, 98]}, {'text': 'Apple', 'indices': [99, 105]}, {'text': 'github', 'indices': [106, 113]}, {'text': 'phpdevelopers', 'indices': [114, 128]}]",2021-08-26 12:00:03,73
25,1430862598480687107,know more visit #google #laravel #trending #php #Apple #github #phpdevelopers #javascrip,"[{'text': 'google', 'indices': [67, 74]}, {'text': 'laravel', 'indices': [75, 83]}, {'text': 'trending', 'indices': [84, 93]}, {'text': 'php', 'indices': [94, 98]}, {'text': 'Apple', 'indices': [99, 105]}, {'text': 'github', 'indices': [106, 113]}, {'text': 'phpdevelopers', 'indices': [114, 128]}]",2021-08-26 12:00:02,681
26,1430862598400921600,know more visit #google #laravel #trending #php #Apple #github #phpdevelopers #javascrip,"[{'text': 'google', 'indices': [67, 74]}, {'text': 'laravel', 'indices': [75, 83]}, {'text': 'trending', 'indices': [84, 93]}, {'text': 'php', 'indices': [94, 98]}, {'text': 'Apple', 'indices': [99, 105]}, {'text': 'github', 'indices': [106, 113]}, {'text': 'phpdevelopers', 'indices': [114, 128]}]",2021-08-26 12:00:02,681
27,1430862543183036423,Like and share #usher #crowder #june coup #google #ethan,"[{'text': 'usher', 'indices': [16, 22]}, {'text': 'crowder', 'indices': [23, 31]}, {'text': 'june22coup', 'indices': [32, 43]}, {'text': 'google', 'indices': [44, 51]}, {'text': 'ethan', 'indices': [52, 58]}]",2021-08-26 11:59:49,4
28,1430862425989996548,know more visit #google #laravel #trending #php #Apple #github #phpdevelopers #javascrip,"[{'text': 'google', 'indices': [67, 74]}, {'text': 'laravel', 'indices': [75, 83]}, {'text': 'trending', 'indices': [84, 93]}, {'text': 'php', 'indices': [94, 98]}, {'text': 'Apple', 'indices': [99, 105]}, {'text': 'github', 'indices': [106, 113]}, {'text': 'phpdevelopers', 'indices': [114, 128]}]",2021-08-26 11:59:21,1701
29,1430862403202392064,know more visit #google #laravel #trending #php #Apple #github #phpdevelopers,"[{'text': 'google', 'indices': [46, 53]}, {'text': 'laravel', 'indices': [54, 62]}, {'text': 'trending', 'indices': [63, 72]}, {'text': 'php', 'indices': [73, 77]}, {'text': 'Apple', 'indices': [78, 84]}, {'text': 'github', 'indices': [85, 92]}, {'text': 'phpdevelopers', 'indices': [93, 107]}]",2021-08-26 11:59:15,291
30,1430862108556619776,ARE YOU HAVING ANY BUSINESS HERE DEVELOP YOUR BUSINESS ONLINE# #Through #Twitter ads face book amp,"[{'text': 'Through', 'indices': [78, 86]}, {'text': 'Twitter', 'indices': [87, 95]}]",2021-08-26 11:58:05,1
31,1430861833745965058,DONLEX ENTERPRISES #Google,"[{'text': 'Google', 'indices': [26, 33]}]",2021-08-26 11:56:59,27
32,1430861830969167872,Clicks Newsletter Links Not Help Your #Google Search Rankings,"[{'text': 'Google', 'indices': [44, 51]}]",2021-08-26 11:56:59,114
33,1430861531772645376,#Google Search Opens Complaint Form For Title Changes,"[{'text': 'Google', 'indices': [0, 7]}]",2021-08-26 11:55:47,114
34,1430861303959080971,Tech giants like Google Microsoft Amazon Apple and IBM are coming together help bolster cybersecurity htt,[],2021-08-26 11:54:53,1149
35,1430861187424481282,has sent cease and desist the owners the popular which lets users play music,[],2021-08-26 11:54:25,17
36,1430861101713997825,Google lead form extensions are powerful tool for Search Display YouTube Discovery campaigns Read about them here,[],2021-08-26 11:54:05,1679
37,1430860700671414273,Google will require its app developers share information about what data their apps collect and for what purpose Read,[],2021-08-26 11:52:29,4550
38,1430860619477966855,its defence also filed this week Google denied Barilaro was defamed the way,[],2021-08-26 11:52:10,341
39,1430860600515694596,#Roskomnadzor accused #Google blackmail after its statement about possible risks for #Russia associated with the req,"[{'text': 'Roskomnadzor', 'indices': [20, 33]}, {'text': 'Google', 'indices': [42, 49]}, {'text': 'Russia', 'indices': [108, 115]}]",2021-08-26 11:52:05,1634
40,1430860588859678727,How Set Google Advanced Protection Program PCMag #Google #marketing #seo #seotips #digitalmarketing #staysafe,"[{'text': 'Google', 'indices': [76, 83]}, {'text': 'marketing', 'indices': [84, 94]}, {'text': 'seo', 'indices': [95, 99]}, {'text': 'seotips', 'indices': [100, 108]}, {'text': 'digitalmarketing', 'indices': [109, 126]}, {'text': 'staysafe', 'indices': [127, 136]}]",2021-08-26 11:52:03,9761
41,1430860523176857605,Google lead form extensions are powerful tool for Search Display YouTube Discovery campaigns Read about,[],2021-08-26 11:51:47,241387
42,1430860406306787329,Google will require its app developers share information about what data their apps collect and for what purpose,[],2021-08-26 11:51:19,3604
43,1430860221438648320,Learn how build dynamic and effective #GoogleAds campaign our one day #training course Find out more,"[{'text': 'GoogleAds', 'indices': [43, 53]}, {'text': 'training', 'indices': [78, 87]}]",2021-08-26 11:50:35,1790
44,1430860084763049986,The #Google Argument #chuckphillips #innovation #oracle #siliconvalley,"[{'text': 'Google', 'indices': [4, 11]}, {'text': 'chuckphillips', 'indices': [45, 59]}, {'text': 'innovation', 'indices': [60, 71]}, {'text': 'oracle', 'indices': [72, 79]}, {'text': 'siliconvalley', 'indices': [80, 94]}]",2021-08-26 11:50:02,11221
45,1430860073404801029,#Nordic pay giant #AllenteNordic has become one the world first operators complete #Google Common Broadc,"[{'text': 'Nordic', 'indices': [0, 7]}, {'text': 'AllenteNordic', 'indices': [21, 35]}, {'text': 'Google', 'indices': [94, 101]}]",2021-08-26 11:50:00,3046
46,1430860056958996480,Microsoft Google spend billions cybersecurity following high level meeting with Biden #cybersecurity #clouds,"[{'text': 'cybersecurity', 'indices': [117, 131]}]",2021-08-26 11:49:56,2027
47,1430860049015001089,Microsoft Google spend billions cybersecurity following high level meeting with Biden #cybersecurity,"[{'text': 'cybersecurity', 'indices': [96, 110]}]",2021-08-26 11:49:54,195
48,1430860022746017793,How Set Google Advanced Protection Program PCMag #Google #marketing #seo #seotips #digitalmarketing,"[{'text': 'Google', 'indices': [59, 66]}, {'text': 'marketing', 'indices': [67, 77]}, {'text': 'seo', 'indices': [78, 82]}, {'text': 'seotips', 'indices': [83, 91]}, {'text': 'digitalmarketing', 'indices': [92, 109]}]",2021-08-26 11:49:48,197
49,1430859702624194564,The future here the bridge coming xdc xrp xlm qnt #blockchain #DLT #interoperability #google #Microsoft #facebook,"[{'text': 'blockchain', 'indices': [76, 87]}, {'text': 'DLT', 'indices': [88, 92]}, {'text': 'interoperability', 'indices': [93, 110]}, {'text': 'google', 'indices': [111, 118]}, {'text': 'Microsoft', 'indices': [119, 129]}, {'text': 'facebook', 'indices': [130, 139]}]",2021-08-26 11:48:31,113
50,1430859686639722498,Error correction key element quantum computing its current state given the physical properties the underlying,[],2021-08-26 11:48:28,269
51,1430859550660382723,Tech giants like Google Microsoft Amazon Apple and IBM are coming together help bolster cybersecurity,[],2021-08-26 11:47:55,479744
52,1430859461166518276,anyone else AdSense monthly payment late #AdSense #Google #GoogleAdSense,"[{'text': 'AdSense', 'indices': [47, 55]}, {'text': 'Google', 'indices': [56, 63]}, {'text': 'GoogleAdSense', 'indices': [64, 78]}]",2021-08-26 11:47:34,901
53,1430859349191102465,online exam Rtmu que mind that even Google #checkingoogleknowledge,"[{'text': 'checkingoogleknowledge', 'indices': [82, 105]}]",2021-08-26 11:47:07,2
54,1430859337287806980,Ophelia Cruises #Google,"[{'text': 'Google', 'indices': [19, 26]}]",2021-08-26 11:47:04,42
55,1430859302517067779,The future here the bridge coming xdc xrp xlm qnt #blockchain #DLT #interoperability #google #Microsoft #facebook,"[{'text': 'blockchain', 'indices': [76, 87]}, {'text': 'DLT', 'indices': [88, 92]}, {'text': 'interoperability', 'indices': [93, 110]}, {'text': 'google', 'indices': [111, 118]}, {'text': 'Microsoft', 'indices': [119, 129]}, {'text': 'facebook', 'indices': [130, 139]}]",2021-08-26 11:46:56,69
56,1430859147235495937,You can now control your Android phone with your facial expressions Read more #technology #And,"[{'text': 'technology', 'indices': [123, 134]}]",2021-08-26 11:46:19,22
57,1430858941727182852,The future here the bridge coming xdc xrp xlm qnt #blockchain #DLT #interoperability #google #Microsoft #facebook,"[{'text': 'blockchain', 'indices': [76, 87]}, {'text': 'DLT', 'indices': [88, 92]}, {'text': 'interoperability', 'indices': [93, 110]}, {'text': 'google', 'indices': [111, 118]}, {'text': 'Microsoft', 'indices': [119, 129]}, {'text': 'facebook', 'indices': [130, 139]}]",2021-08-26 11:45:30,132
58,1430858768573558791,All you marketers the house let know your favourite google search the comment section below,[],2021-08-26 11:44:49,7
59,1430858277726867461,easy way see #Google thinks your webpages are #keyword relevant #Smallbusiness #Smallbiz #Entrepreneur #SEO,"[{'text': 'Google', 'indices': [35, 42]}, {'text': 'keyword', 'indices': [68, 76]}, {'text': 'Smallbusiness', 'indices': [86, 100]}, {'text': 'Smallbiz', 'indices': [101, 110]}, {'text': 'Entrepreneur', 'indices': [111, 124]}, {'text': 'SEO', 'indices': [125, 129]}]",2021-08-26 11:42:52,30
60,1430858175855554565,Check out EXTREMELY RARE LEGO Hayabusa Aerospace Exploration Agency Space Japan #LEGO,"[{'text': 'LEGO', 'indices': [89, 94]}]",2021-08-26 11:42:27,113
61,1430857949455388675,What the best #translation #app TWOC tests out #Sogou #Google Baidu and more see which the most accurate,"[{'text': 'translation', 'indices': [36, 48]}, {'text': 'app', 'indices': [49, 53]}, {'text': 'Sogou', 'indices': [70, 76]}, {'text': 'Google', 'indices': [78, 85]}]",2021-08-26 11:41:33,994
62,1430857947609911303,Check out EXTREMELY RARE Golden Bear Teletubbies Home Play Set from Japan New,[],2021-08-26 11:41:33,113
63,1430857711474774020,Check out Apple Computer Apron Novelty Give Away from Japan Special Edition Super Rare #Apple,"[{'text': 'Apple', 'indices': [91, 97]}]",2021-08-26 11:40:37,113
64,1430857671234580480,How Optimize for #Google Featured Snippet Target Long tail Keywords Optimize for Questions Format Content,"[{'text': 'Google', 'indices': [20, 27]}]",2021-08-26 11:40:27,430
65,1430857576980299781,Check this out Did you know you can bring the elements the Periodic Table alive #Google,"[{'text': 'Google', 'indices': [107, 114]}]",2021-08-26 11:40:05,483
66,1430857528166936576,Check out Adidas SUPERSTAR Pharrell Williams Anniversary Size Japan #adidas,"[{'text': 'adidas', 'indices': [90, 97]}]",2021-08-26 11:39:53,113
67,1430857513986052104,Goodada #Google,"[{'text': 'Google', 'indices': [14, 21]}]",2021-08-26 11:39:50,8497
68,1430857500585127945,Pixel series will the first Google smartphones feature display fingerprint sensor Samsung,[],2021-08-26 11:39:46,6
69,1430857354615029763,Fun #FinSpy Fact the Day When The Cops FBI amp Got Hacked #Google using #FinSpy #MCM,"[{'text': 'FinSpy', 'indices': [4, 11]}, {'text': 'Google', 'indices': [93, 100]}, {'text': 'FinSpy', 'indices': [107, 114]}, {'text': 'MCM', 'indices': [115, 119]}]",2021-08-26 11:39:12,85
70,1430857334478106625,Check out WEDGWOOD Made England Cliveden House amp MAIDEN HEAD CUP amp SAUCER #Wedgwood,"[{'text': 'Wedgwood', 'indices': [94, 103]}]",2021-08-26 11:39:07,113
71,1430857325225463813,Ways Use Google Trends for SEO #Google #marketing #seo #seotips #digitalmarketing #staysafe #business #seotools #st,"[{'text': 'Google', 'indices': [55, 62]}, {'text': 'marketing', 'indices': [63, 73]}, {'text': 'seo', 'indices': [74, 78]}, {'text': 'seotips', 'indices': [79, 87]}, {'text': 'digitalmarketing', 'indices': [88, 105]}, {'text': 'staysafe', 'indices': [106, 115]}, {'text': 'business', 'indices': [116, 125]}, {'text': 'seotools', 'indices': [126, 135]}]",2021-08-26 11:39:05,65
72,1430856978058805248,Google Pixel Buds Series sale India launch day price INR Bundled offer with Pixel INR,[],2021-08-26 11:37:42,2747
73,1430856862371516416,Google Pixel Buds Series TWS look cute #google #PixelBudsA,"[{'text': 'google', 'indices': [62, 69]}, {'text': 'PixelBudsA', 'indices': [70, 81]}]",2021-08-26 11:37:14,2747
74,1430856572184506372,Check this out Did you know you can bring the elements the Periodic Table alive #Google,"[{'text': 'Google', 'indices': [107, 114]}]",2021-08-26 11:36:05,1382
75,1430856075905957888,Check out WEDGWOOD Made England STATION HARTCOURT CUP amp SAUCER Japan #Wedgwood,"[{'text': 'Wedgwood', 'indices': [88, 97]}]",2021-08-26 11:34:07,113
76,1430856051080015872,The RESILIENT PEOPLE #podcast features conversations folks from around the world who are admired for their,"[{'text': 'podcast', 'indices': [21, 29]}]",2021-08-26 11:34:01,413
77,1430855906976276490,Transcend Company #Google #jeremybuendia #transcendhrt #transcendfamily,"[{'text': 'Google', 'indices': [21, 28]}, {'text': 'jeremybuendia', 'indices': [53, 67]}, {'text': 'transcendhrt', 'indices': [68, 81]}, {'text': 'transcendfamily', 'indices': [82, 98]}]",2021-08-26 11:33:26,35
78,1430855835446620160,Sometimes don bother Google stuff just ask people around about the things wondering about instead Why always Goo,[],2021-08-26 11:33:09,360
79,1430855686187933708,Hey Sonos The speaker giant planning new #voice #assistant for multi room commands Not rival #Alexa amp,"[{'text': 'voice', 'indices': [47, 53]}, {'text': 'assistant', 'indices': [54, 64]}, {'text': 'Alexa', 'indices': [105, 111]}]",2021-08-26 11:32:34,799
80,1430855648493854723,Check this out Did you know you can bring the elements the Periodic Table alive #Google,"[{'text': 'Google', 'indices': [107, 114]}]",2021-08-26 11:32:25,2050
81,1430855580894257152,Google increases user privacy controls Reuters #Google #marketing #seo #seotips #digitalmarketing #staysafe #business,"[{'text': 'Google', 'indices': [66, 73]}, {'text': 'marketing', 'indices': [74, 84]}, {'text': 'seo', 'indices': [85, 89]}, {'text': 'seotips', 'indices': [90, 98]}, {'text': 'digitalmarketing', 'indices': [99, 116]}, {'text': 'staysafe', 'indices': [117, 126]}, {'text': 'business', 'indices': [127, 136]}]",2021-08-26 11:32:09,9761
82,1430855424748658690,Check out DISNEYLAND YEAR ANNIVERSARY SHRTS Adult Small from Japan #Disney,"[{'text': 'Disney', 'indices': [89, 96]}]",2021-08-26 11:31:31,113
83,1430855326224379912,Far Field Combat Runner Revised update information thread #ffcr #farfieldcombatrunner #herrugattodev #unity #gamedev,"[{'text': 'ffcr', 'indices': [80, 85]}, {'text': 'farfieldcombatrunner', 'indices': [86, 107]}, {'text': 'herrugattodev', 'indices': [108, 122]}, {'text': 'unity', 'indices': [123, 129]}, {'text': 'gamedev', 'indices': [130, 138]}]",2021-08-26 11:31:08,3133
84,1430855264203382791,for online Ads #leadsgeneration #Seo #socialmediamarketing #digitalmarketing #videomarketing,"[{'text': 'leadsgeneration', 'indices': [61, 77]}, {'text': 'Seo', 'indices': [78, 82]}, {'text': 'socialmediamarketing', 'indices': [83, 104]}, {'text': 'digitalmarketing', 'indices': [105, 122]}, {'text': 'videomarketing', 'indices': [123, 138]}]",2021-08-26 11:30:53,9761
85,1430855242581569539,Check out Dean Rag Book Limited Edition Black Bear Japan #Deans,"[{'text': 'Deans', 'indices': [88, 94]}]",2021-08-26 11:30:48,113
86,1430855237523361792,HaiR UpTown #Google,"[{'text': 'Google', 'indices': [25, 32]}]",2021-08-26 11:30:47,162
87,1430855225884045319,its defence also filed this week Google denied Barilaro was defamed the way,[],2021-08-26 11:30:44,966
88,1430855221639454722,Jio only telco gain RMS Trai data #RelianceJio #TelecomRegulatoryAuthorityOfIndia #VodafoneIdea #Google #Vil #Icic,"[{'text': 'RelianceJio', 'indices': [59, 71]}, {'text': 'TelecomRegulatoryAuthorityOfIndia', 'indices': [72, 106]}, {'text': 'VodafoneIdea', 'indices': [107, 120]}, {'text': 'Google', 'indices': [121, 128]}, {'text': 'Vil', 'indices': [129, 133]}]",2021-08-26 11:30:43,212
89,1430855178283110408,#YouTube search for Reasons Recall Gavin Newsom yielded eight other videos about the recall election,"[{'text': 'YouTube', 'indices': [29, 37]}]",2021-08-26 11:30:33,1483
90,1430855113300578304,Check out Supreme VANS Old Skool Blue Size from Japan Super Rare Limited #Sneaker,"[{'text': 'Sneaker', 'indices': [87, 95]}]",2021-08-26 11:30:17,113
91,1430855106333970432,Our SEO techniques are transparent and what Google requires for your business rank well With our services your,[],2021-08-26 11:30:16,712
92,1430855082086596619,Jio only telco gain RMS Trai data #RelianceJio #TelecomRegulatoryAuthorityOfIndia #VodafoneIdea #Google,"[{'text': 'RelianceJio', 'indices': [44, 56]}, {'text': 'TelecomRegulatoryAuthorityOfIndia', 'indices': [57, 91]}, {'text': 'VodafoneIdea', 'indices': [92, 105]}, {'text': 'Google', 'indices': [106, 113]}]",2021-08-26 11:30:10,596
93,1430855078303256580,Jio only telco gain RMS Trai data #RelianceJio #TelecomRegulatoryAuthorityOfIndia #VodafoneIdea #Google,"[{'text': 'RelianceJio', 'indices': [44, 56]}, {'text': 'TelecomRegulatoryAuthorityOfIndia', 'indices': [57, 91]}, {'text': 'VodafoneIdea', 'indices': [92, 105]}, {'text': 'Google', 'indices': [106, 113]}]",2021-08-26 11:30:09,37842
94,1430854829946007553,Check out Eagle Anniversary Plastic Model Hasegawa Pre Order #Hasegawa,"[{'text': 'Hasegawa', 'indices': [89, 98]}]",2021-08-26 11:29:10,113
95,1430854819388878850,How Set Google Advanced Protection Program PCMag #Google #marketing #seo #seotips #digitalmarketing #staysafe #bu,"[{'text': 'Google', 'indices': [75, 82]}, {'text': 'marketing', 'indices': [83, 93]}, {'text': 'seo', 'indices': [94, 98]}, {'text': 'seotips', 'indices': [99, 107]}, {'text': 'digitalmarketing', 'indices': [108, 125]}, {'text': 'staysafe', 'indices': [126, 135]}]",2021-08-26 11:29:07,60
96,1430854638501187588,Check out Human Made FACE LOGO Shirt Size with box from Japan Length Rare,[],2021-08-26 11:28:24,113
97,1430854597925490695,Google Facebook move restrict ads fake news sites Reuters #Google #marketing #seo #seotips #digitalmarketing #sta,"[{'text': 'Google', 'indices': [84, 91]}, {'text': 'marketing', 'indices': [92, 102]}, {'text': 'seo', 'indices': [103, 107]}, {'text': 'seotips', 'indices': [108, 116]}, {'text': 'digitalmarketing', 'indices': [117, 134]}]",2021-08-26 11:28:14,60
98,1430854569668399106,its defence also filed this week Google denied Barilaro was defamed,[],2021-08-26 11:28:08,145
99,1430854567172972545,have say that Google Assistant shits all over Siri for finding and reading out relevant answers #Google #Siri,"[{'text': 'Google', 'indices': [103, 110]}, {'text': 'Siri', 'indices': [111, 116]}]",2021-08-26 11:28:07,1206
100,1430854520205099014,Microsoft Further Explores #Blockchain Linking its Major Products the #Tech The blockchain actually digital,"[{'text': 'Blockchain', 'indices': [27, 38]}, {'text': 'Tech', 'indices': [73, 78]}]",2021-08-26 11:27:56,7386
101,1430854420447719425,Check out Disney Aladdin Live Action Film Genie Lamp Limited Edition Rare #Disney,"[{'text': 'Disney', 'indices': [87, 94]}]",2021-08-26 11:27:32,113
102,1430854395403456521,#Google Mobile amp Desktop Pages Don Have Match But They Must Fulfill The Same Purpose,"[{'text': 'Google', 'indices': [0, 7]}]",2021-08-26 11:27:26,114
103,1430854327266992130,JustAuto Solutions Automobile Training Centre ECM Repair Training Automobile Parts #Google,"[{'text': 'Google', 'indices': [92, 99]}]",2021-08-26 11:27:10,6
104,1430853795387428867,Error correction key element quantum computing its current state given the physical properties the,[],2021-08-26 11:25:03,854
105,1430853780132663305,Google starts shows Fact check article labels Top stories #google #seo,"[{'text': 'google', 'indices': [64, 71]}, {'text': 'seo', 'indices': [72, 76]}]",2021-08-26 11:24:59,52
106,1430853646242119685,the latest update has said will nullify spammy links simply not counting them Follow,[],2021-08-26 11:24:27,64
107,1430853483545169920,for online Ads #leadsgeneration #Seo #socialmediamarketing #digitalmarketing,"[{'text': 'leadsgeneration', 'indices': [40, 56]}, {'text': 'Seo', 'indices': [57, 61]}, {'text': 'socialmediamarketing', 'indices': [62, 83]}, {'text': 'digitalmarketing', 'indices': [84, 101]}]",2021-08-26 11:23:49,26
