Unnamed: 0,id,text,Hashtags,date,follower_count
818,1430765119206662148,The Much needed SEO Services for your business Hurry NOW #keywords #contentmarketing #Google #ADS #DigitalMarketing #pagep,"[{'text': 'keywords', 'indices': [74, 83]}, {'text': 'contentmarketing', 'indices': [84, 101]}, {'text': 'Google', 'indices': [102, 109]}, {'text': 'ADS', 'indices': [110, 114]}, {'text': 'DigitalMarketing', 'indices': [115, 132]}]",2021-08-26 05:32:41,46
819,1430765058858971139,Check out #BCLeaks contributor #ChicoCrypto newest livestream where breaks down HUGE connections between,"[{'text': 'BCLeaks', 'indices': [37, 45]}, {'text': 'ChicoCrypto', 'indices': [58, 70]}]",2021-08-26 05:32:27,366
820,1430764968631283717,Google announced that the link spam update that initially began rolling out That over full month rolling,[],2021-08-26 05:32:05,1159
821,1430764968488669186,Rizwan Photography #Google #shorts #youtubeshorts,"[{'text': 'Google', 'indices': [24, 31]}, {'text': 'shorts', 'indices': [33, 40]}, {'text': 'youtubeshorts', 'indices': [42, 56]}]",2021-08-26 05:32:05,587
822,1430764936897056768,#BCLeaks Contributor #chicocrypto Going Live SOON #Google Has Favorite Altcoin,"[{'text': 'BCLeaks', 'indices': [21, 29]}, {'text': 'chicocrypto', 'indices': [42, 54]}, {'text': 'Google', 'indices': [80, 87]}]",2021-08-26 05:31:57,366
823,1430764843796099074,Google was paying smartphone makers little money prevent party app stores Android Android being the most,[],2021-08-26 05:31:35,4
824,1430764754633515012,Google Pixel Buds Series TWS look cute #google #PixelBudsA,"[{'text': 'google', 'indices': [62, 69]}, {'text': 'PixelBudsA', 'indices': [70, 81]}]",2021-08-26 05:31:14,126
825,1430764742856122368,what then ORGANIC link building #linkbuilding #seo #digitalmarketing #backlinks #searchengineoptimization,"[{'text': 'linkbuilding', 'indices': [42, 55]}, {'text': 'seo', 'indices': [56, 60]}, {'text': 'digitalmarketing', 'indices': [61, 78]}, {'text': 'backlinks', 'indices': [79, 89]}, {'text': 'searchengineoptimization', 'indices': [90, 115]}]",2021-08-26 05:31:11,19
826,1430764672127471616,#Google Webmaster #Videos multiple links from one page another page count #SEO #PageRank,"[{'text': 'Google', 'indices': [0, 7]}, {'text': 'Videos', 'indices': [18, 25]}, {'text': 'SEO', 'indices': [106, 110]}, {'text': 'PageRank', 'indices': [111, 120]}]",2021-08-26 05:30:54,368
827,1430764668491010049,Terming terrorism and violence curse for the civilised society the said while #India was producing CEOs,"[{'text': 'India', 'indices': [87, 93]}]",2021-08-26 05:30:53,6716
828,1430764443563008001,Search Engine Optimisation the key boost your business #konvertklicks #ThursdayThoughts #thursdaymorning,"[{'text': 'konvertklicks', 'indices': [62, 76]}, {'text': 'ThursdayThoughts', 'indices': [77, 94]}, {'text': 'thursdaymorning', 'indices': [95, 111]}]",2021-08-26 05:30:00,93
829,1430764362197651456,Ads The,[],2021-08-26 05:29:40,1744
830,1430764288122175492,Are you looking improve your #Google expertise authority and trust you want know about some the quickest amp,"[{'text': 'Google', 'indices': [49, 56]}]",2021-08-26 05:29:23,9761
831,1430764193733435399,Google the most important player consider when optimizing your website for search,[],2021-08-26 05:29:00,72
832,1430764131938877441,The Much needed SEO Services for your business Hurry NOW #keywords #contentmarketing #Google #ADS #DigitalMarketing #pagep,"[{'text': 'keywords', 'indices': [74, 83]}, {'text': 'contentmarketing', 'indices': [84, 101]}, {'text': 'Google', 'indices': [102, 109]}, {'text': 'ADS', 'indices': [110, 114]}, {'text': 'DigitalMarketing', 'indices': [115, 132]}]",2021-08-26 05:28:46,1127
833,1430763958798102531,#Google certified #adwords #ads #ppc campaign specialist Please check out gig Fiverr prof,"[{'text': 'Google', 'indices': [21, 28]}, {'text': 'adwords', 'indices': [39, 47]}, {'text': 'ads', 'indices': [48, 52]}, {'text': 'ppc', 'indices': [53, 57]}]",2021-08-26 05:28:04,1127
834,1430763215881789444,India Creators Hello Team Today sandeepsharma com got Hacked,[],2021-08-26 05:25:07,20
835,1430763102870507526,The future here the bridge coming xdc xrp xlm qnt #blockchain #DLT #interoperability #google #Microsoft #facebook,"[{'text': 'blockchain', 'indices': [76, 87]}, {'text': 'DLT', 'indices': [88, 92]}, {'text': 'interoperability', 'indices': [93, 110]}, {'text': 'google', 'indices': [111, 118]}, {'text': 'Microsoft', 'indices': [119, 129]}, {'text': 'facebook', 'indices': [130, 139]}]",2021-08-26 05:24:40,36
836,1430762957995220994,Google created more control for advertisers with new conversion value rules Here what they are why they useful amp how,[],2021-08-26 05:24:06,416
837,1430762811446206468,Are you looking improve your #Google expertise authority and trust you want know about some the quickest amp,"[{'text': 'Google', 'indices': [49, 56]}]",2021-08-26 05:23:31,527
838,1430762569657196546,Google will add privacy steps for teenagers via,[],2021-08-26 05:22:33,610
839,1430762456347987969,Growth Strategies Small Businesses Can Learn From Google #Google #marketing #seo #seotips #digitalmarketing #staysafe,"[{'text': 'Google', 'indices': [77, 84]}, {'text': 'marketing', 'indices': [85, 95]}, {'text': 'seo', 'indices': [96, 100]}, {'text': 'seotips', 'indices': [101, 109]}, {'text': 'digitalmarketing', 'indices': [110, 127]}, {'text': 'staysafe', 'indices': [128, 137]}]",2021-08-26 05:22:06,1113
840,1430762398328176644,Great News Ukraine #CrimeaPlatform has over million results #Google Admittedly few will Russia having,"[{'text': 'CrimeaPlatform', 'indices': [42, 57]}, {'text': 'Google', 'indices': [88, 95]}]",2021-08-26 05:21:52,1940
841,1430762233890439171,Google Pixel Buds Series TWS look cute #google #PixelBudsA,"[{'text': 'google', 'indices': [62, 69]}, {'text': 'PixelBudsA', 'indices': [70, 81]}]",2021-08-26 05:21:13,23
842,1430762196062068741,Who likes #usher #crowder #june coup #google #ethan,"[{'text': 'usher', 'indices': [14, 20]}, {'text': 'crowder', 'indices': [21, 29]}, {'text': 'june22coup', 'indices': [30, 41]}, {'text': 'google', 'indices': [42, 49]}, {'text': 'ethan', 'indices': [50, 56]}]",2021-08-26 05:21:04,4
843,1430762019427213313,Google was paying smartphone makers little money prevent party app stores Android Android being the most,[],2021-08-26 05:20:22,0
844,1430761866100318210,Google Pixel Buds Series sale India launch day price INR Bundled offer with Pixel INR,[],2021-08-26 05:19:45,23
845,1430761733614751747,Google partners with fintech Setu allow users open FDs GPay #Google #Googlepay #FDs,"[{'text': 'Google', 'indices': [72, 79]}, {'text': 'Googlepay', 'indices': [80, 90]}, {'text': 'FDs', 'indices': [91, 95]}]",2021-08-26 05:19:14,1136765
846,1430761723125026818,computer science writing code the most easy job let that sink #Google #Engineering #Coding,"[{'text': 'Google', 'indices': [93, 100]}, {'text': 'Engineering', 'indices': [101, 113]}, {'text': 'Coding', 'indices': [114, 121]}]",2021-08-26 05:19:11,4584
847,1430761657467289601,computer science writing code the most easy job let that sink #Google #Engineering #Coding,"[{'text': 'Google', 'indices': [93, 100]}, {'text': 'Engineering', 'indices': [101, 113]}, {'text': 'Coding', 'indices': [114, 121]}]",2021-08-26 05:18:56,7952
848,1430761629025587210,Google Pixel Buds Series TWS look cute #google #PixelBudsA,"[{'text': 'google', 'indices': [62, 69]}, {'text': 'PixelBudsA', 'indices': [70, 81]}]",2021-08-26 05:18:49,245
849,1430761592749178889,#usher #crowder #june coup #google #ethan #cristiano #cristiano ronaldo Large Aluminum Foil Repair Tape inch,"[{'text': 'usher', 'indices': [0, 6]}, {'text': 'crowder', 'indices': [7, 15]}, {'text': 'june22coup', 'indices': [16, 27]}, {'text': 'google', 'indices': [28, 35]}, {'text': 'ethan', 'indices': [36, 42]}, {'text': 'cristiano', 'indices': [43, 53]}, {'text': 'cristiano', 'indices': [54, 64]}]",2021-08-26 05:18:40,4
850,1430761487346245639,Want Get Your Website The Top Google Search Just Follow Few Simple Steps Use Right Keywords Have,[],2021-08-26 05:18:15,1106
851,1430761431792689152,When #Google entered Indian market with their #UPI app was sure #paytm was big trouble Looks like things are,"[{'text': 'Google', 'indices': [5, 12]}, {'text': 'UPI', 'indices': [46, 50]}, {'text': 'paytm', 'indices': [67, 73]}]",2021-08-26 05:18:02,233
852,1430761338708574212,#Google certified #adwords #ads #ppc campaign specialist Please check out gig Fiverr prof,"[{'text': 'Google', 'indices': [21, 28]}, {'text': 'adwords', 'indices': [39, 47]}, {'text': 'ads', 'indices': [48, 52]}, {'text': 'ppc', 'indices': [53, 57]}]",2021-08-26 05:17:40,3353
853,1430761289903714305,#Google certified #adwords #ads #ppc campaign specialist Please check out gig Fiverr prof,"[{'text': 'Google', 'indices': [21, 28]}, {'text': 'adwords', 'indices': [39, 47]}, {'text': 'ads', 'indices': [48, 52]}, {'text': 'ppc', 'indices': [53, 57]}]",2021-08-26 05:17:28,3022
854,1430761084986617858,#Google certified #adwords #ads #ppc campaign specialist Please check out gig Fiverr,"[{'text': 'Google', 'indices': [0, 7]}, {'text': 'adwords', 'indices': [18, 26]}, {'text': 'ads', 'indices': [27, 31]}, {'text': 'ppc', 'indices': [32, 36]}]",2021-08-26 05:16:39,94
855,1430761007811424262,computer science writing code the most easy job let that sink #Google #Engineering #Coding,"[{'text': 'Google', 'indices': [75, 82]}, {'text': 'Engineering', 'indices': [83, 95]}, {'text': 'Coding', 'indices': [96, 103]}]",2021-08-26 05:16:21,2
856,1430760893625765893,Check out #BCLeaks contributor #ChicoCrypto newest livestream where breaks down HUGE connections between,"[{'text': 'BCLeaks', 'indices': [37, 45]}, {'text': 'ChicoCrypto', 'indices': [58, 70]}]",2021-08-26 05:15:53,469
857,1430760849082306562,Marc Benioff Satya Nadella Jeff Bezos Mark Zuckerberg #CloudThat #unscramble #giveaways #cloudc,"[{'text': 'CloudThat', 'indices': [98, 108]}, {'text': 'unscramble', 'indices': [109, 120]}, {'text': 'giveaways', 'indices': [121, 131]}]",2021-08-26 05:15:43,611
858,1430760837195567107,#BCLeaks Contributor #chicocrypto Going Live SOON #Google Has Favorite Altcoin,"[{'text': 'BCLeaks', 'indices': [21, 29]}, {'text': 'chicocrypto', 'indices': [42, 54]}, {'text': 'Google', 'indices': [80, 87]}]",2021-08-26 05:15:40,469
859,1430760698745815043,Google was paying smartphone makers little money prevent party app stores Android Android being the,[],2021-08-26 05:15:07,42
860,1430760675530493952,August buy #oneplus #device #smoothos #oneplus tpro #neversettle,"[{'text': 'oneplus', 'indices': [41, 49]}, {'text': 'device', 'indices': [50, 57]}, {'text': 'smoothos', 'indices': [58, 67]}, {'text': '90hz', 'indices': [68, 73]}, {'text': 'oneplus8tpro', 'indices': [74, 87]}, {'text': 'neversettle', 'indices': [88, 100]}]",2021-08-26 05:15:01,120
861,1430760061173854212,Cash these tech companies have #Apple Today #Microsoft billion #Google #Amazon,"[{'text': 'Apple', 'indices': [54, 60]}, {'text': 'Microsoft', 'indices': [88, 98]}, {'text': 'Google', 'indices': [124, 131]}, {'text': 'Amazon', 'indices': [132, 139]}]",2021-08-26 05:12:35,879
862,1430760059810631680,Jolla hits profitability ahead turning ten eyes growth beyond mobile #Europe #Mobile #Tc #Africa #Android,"[{'text': 'Europe', 'indices': [73, 80]}, {'text': 'Mobile', 'indices': [81, 88]}, {'text': 'Tc', 'indices': [89, 92]}, {'text': 'Africa', 'indices': [93, 100]}, {'text': 'Android', 'indices': [101, 109]}]",2021-08-26 05:12:35,1754
863,1430759478090108941,What your opinion the Google #linkspamupdate #SEO #Google #SEOtips #SEOexperts,"[{'text': 'linkspamupdate', 'indices': [34, 49]}, {'text': 'SEO', 'indices': [52, 56]}, {'text': 'Google', 'indices': [57, 64]}, {'text': 'SEOtips', 'indices': [65, 73]}, {'text': 'SEOexperts', 'indices': [74, 85]}]",2021-08-26 05:10:16,444
864,1430759342265880580,Google increases user privacy controls Reuters #Google #marketing #seo #seotips #digitalmarketing #staysafe #business #se,"[{'text': 'Google', 'indices': [65, 72]}, {'text': 'marketing', 'indices': [73, 83]}, {'text': 'seo', 'indices': [84, 88]}, {'text': 'seotips', 'indices': [89, 97]}, {'text': 'digitalmarketing', 'indices': [98, 115]}, {'text': 'staysafe', 'indices': [116, 125]}, {'text': 'business', 'indices': [126, 135]}]",2021-08-26 05:09:44,8006
865,1430759323160829953,Growth Strategies Small Businesses Can Learn From Google #Google #marketing #seo #seotips #digitalmarketing #staysafe,"[{'text': 'Google', 'indices': [77, 84]}, {'text': 'marketing', 'indices': [85, 95]}, {'text': 'seo', 'indices': [96, 100]}, {'text': 'seotips', 'indices': [101, 109]}, {'text': 'digitalmarketing', 'indices': [110, 127]}, {'text': 'staysafe', 'indices': [128, 137]}]",2021-08-26 05:09:39,8006
866,1430759300679421956,Ways Use Google Trends for SEO #Google #marketing #seo #seotips #digitalmarketing #staysafe #business #seotools #st,"[{'text': 'Google', 'indices': [55, 62]}, {'text': 'marketing', 'indices': [63, 73]}, {'text': 'seo', 'indices': [74, 78]}, {'text': 'seotips', 'indices': [79, 87]}, {'text': 'digitalmarketing', 'indices': [88, 105]}, {'text': 'staysafe', 'indices': [106, 115]}, {'text': 'business', 'indices': [116, 125]}, {'text': 'seotools', 'indices': [126, 135]}]",2021-08-26 05:09:34,8006
867,1430759036539047940,Gmen #comic #webcomic #funny #garbage #google,"[{'text': 'comic', 'indices': [59, 65]}, {'text': 'webcomic', 'indices': [66, 75]}, {'text': 'funny', 'indices': [76, 82]}, {'text': 'garbage', 'indices': [83, 91]}, {'text': 'google', 'indices': [92, 99]}]",2021-08-26 05:08:31,19
868,1430758972655603712,#Google announced the introduction new artificial intelligence tools help fight against range spam Learn,"[{'text': 'Google', 'indices': [17, 24]}]",2021-08-26 05:08:15,1169
869,1430758923473088512,Get more traffic with our fully managed affordable SEO service Visit our website for more info #digitalmarketing,"[{'text': 'digitalmarketing', 'indices': [98, 115]}]",2021-08-26 05:08:04,93
870,1430758901784453123,What the best #translation #app TWOC tests out #Sogou #Google Baidu and more see which the most accurate,"[{'text': 'translation', 'indices': [36, 48]}, {'text': 'app', 'indices': [49, 53]}, {'text': 'Sogou', 'indices': [70, 76]}, {'text': 'Google', 'indices': [78, 85]}]",2021-08-26 05:07:59,223
871,1430758647043219464,Make sure you taking advantage these recently released Google Business features and attributes improve your loca,[],2021-08-26 05:06:58,13898
872,1430758372056330244,Marc Benioff Satya Nadella Jeff Bezos Mark Zuckerberg #CloudThat #unscramble #giveaways,"[{'text': 'CloudThat', 'indices': [77, 87]}, {'text': 'unscramble', 'indices': [88, 99]}, {'text': 'giveaways', 'indices': [100, 110]}]",2021-08-26 05:05:52,1908
873,1430758212052131843,Are you looking improve your #Google expertise authority and trust you want know about some the quickest amp,"[{'text': 'Google', 'indices': [49, 56]}]",2021-08-26 05:05:14,1169
874,1430758028760870914,#WomenEqualityDay Team corporation corporation digital marketing agency Surat Gujarat Call,"[{'text': 'WomenEqualityDay', 'indices': [0, 17]}]",2021-08-26 05:04:30,27
875,1430757548118790144,#Google amp #AmarChitraKatha Information will available eight languages,"[{'text': 'Google', 'indices': [0, 7]}, {'text': 'AmarChitraKatha', 'indices': [14, 30]}]",2021-08-26 05:02:36,2297
876,1430757482025132032,#Google brings Samsung modem tech market with new Pixel #smartphone,"[{'text': 'Google', 'indices': [17, 24]}, {'text': '5G', 'indices': [40, 43]}, {'text': 'smartphone', 'indices': [85, 96]}]",2021-08-26 05:02:20,1011
877,1430757402840911874,Google Ads released Google Ads Editor with new features including easier downloads audio ads and more,[],2021-08-26 05:02:01,2
878,1430757369349246980,YouTube Music Wear app will out Samsung new smartwatches #youtube,"[{'text': 'youtube', 'indices': [94, 102]}]",2021-08-26 05:01:53,614
879,1430757094530158599,#USA #UK #Asia #business #online #freelancer #fiverr #tshirt #icon #logo #brand #branding #package #packagedesign #logod,"[{'text': 'USA', 'indices': [19, 23]}, {'text': 'UK', 'indices': [24, 27]}, {'text': 'Asia', 'indices': [28, 33]}, {'text': 'business', 'indices': [34, 43]}, {'text': 'online', 'indices': [44, 51]}, {'text': 'freelancer', 'indices': [52, 63]}, {'text': 'fiverr', 'indices': [64, 71]}, {'text': 'tshirt', 'indices': [72, 79]}, {'text': 'icon', 'indices': [80, 85]}, {'text': 'logo', 'indices': [86, 91]}, {'text': 'brand', 'indices': [92, 98]}, {'text': 'branding', 'indices': [99, 108]}, {'text': 'package', 'indices': [109, 117]}, {'text': 'packagedesign', 'indices': [118, 132]}]",2021-08-26 05:00:48,91
880,1430757084790870018,DAILY #Prediction Results For August out predictions are correct #SP #DowJones #Apple #Google,"[{'text': 'Prediction', 'indices': [6, 17]}, {'text': 'SP500', 'indices': [84, 90]}, {'text': 'DowJones', 'indices': [91, 100]}, {'text': 'Apple', 'indices': [101, 107]}, {'text': 'Google', 'indices': [108, 115]}]",2021-08-26 05:00:45,3163
881,1430757074363830272,Personality Development Classes Pune #Google,"[{'text': 'Google', 'indices': [43, 50]}]",2021-08-26 05:00:43,70
882,1430757073063759872,Google made fun Apple products even the new iPhone #Google #Apple #Joke,"[{'text': 'Google', 'indices': [73, 80]}, {'text': 'Apple', 'indices': [81, 87]}, {'text': 'Joke', 'indices': [88, 93]}]",2021-08-26 05:00:43,91
883,1430757003731816448,you know that the world most used Search Engine Google was crashed June when legendary Dancer Mich,[],2021-08-26 05:00:26,2110
884,1430756651737354245,#USA #UK #Asia #business #online #freelancer #fiverr #tshirt #icon #logo #brand #branding #package #packagedesign,"[{'text': 'USA', 'indices': [0, 4]}, {'text': 'UK', 'indices': [5, 8]}, {'text': 'Asia', 'indices': [9, 14]}, {'text': 'business', 'indices': [15, 24]}, {'text': 'online', 'indices': [25, 32]}, {'text': 'freelancer', 'indices': [33, 44]}, {'text': 'fiverr', 'indices': [45, 52]}, {'text': 'tshirt', 'indices': [53, 60]}, {'text': 'icon', 'indices': [61, 66]}, {'text': 'logo', 'indices': [67, 72]}, {'text': 'brand', 'indices': [73, 79]}, {'text': 'branding', 'indices': [80, 89]}, {'text': 'package', 'indices': [90, 98]}, {'text': 'packagedesign', 'indices': [99, 113]}]",2021-08-26 04:59:02,60
885,1430756273960624130,Just sold eth for #hbar hbar #crypto #hedera #google #ibm ibm googl tsla aapl amzn #defi #nft,"[{'text': 'hbar', 'indices': [36, 41]}, {'text': 'crypto', 'indices': [50, 57]}, {'text': 'hedera', 'indices': [58, 65]}, {'text': 'google', 'indices': [66, 73]}, {'text': 'ibm', 'indices': [74, 78]}, {'text': 'defi', 'indices': [109, 114]}, {'text': 'nft', 'indices': [115, 119]}]",2021-08-26 04:57:32,43
886,1430756207157866499,The Much needed SEO Services for your business Hurry NOW #keywords #contentmarketing #Google #ADS,"[{'text': 'keywords', 'indices': [59, 68]}, {'text': 'contentmarketing', 'indices': [69, 86]}, {'text': 'Google', 'indices': [87, 94]}, {'text': 'ADS', 'indices': [95, 99]}]",2021-08-26 04:57:16,34
887,1430756125796937729,Google made fun Apple products even the new iPhone #Google #Apple #Joke,"[{'text': 'Google', 'indices': [56, 63]}, {'text': 'Apple', 'indices': [64, 70]}, {'text': 'Joke', 'indices': [71, 76]}]",2021-08-26 04:56:57,4580
888,1430756122995183620,Ways Use Google Trends for SEO #Google #marketing #seo #seotips #digitalmarketing #staysafe #business #seotools #st,"[{'text': 'Google', 'indices': [55, 62]}, {'text': 'marketing', 'indices': [63, 73]}, {'text': 'seo', 'indices': [74, 78]}, {'text': 'seotips', 'indices': [79, 87]}, {'text': 'digitalmarketing', 'indices': [88, 105]}, {'text': 'staysafe', 'indices': [106, 115]}, {'text': 'business', 'indices': [116, 125]}, {'text': 'seotools', 'indices': [126, 135]}]",2021-08-26 04:56:56,9761
889,1430756027964674054,Personality Development Classes Pune #Google,"[{'text': 'Google', 'indices': [43, 50]}]",2021-08-26 04:56:33,70
890,1430755928941420548,Growth Strategies Small Businesses Can Learn From Google #Google #marketing #seo #seotips #digitalmarketing #staysafe,"[{'text': 'Google', 'indices': [77, 84]}, {'text': 'marketing', 'indices': [85, 95]}, {'text': 'seo', 'indices': [96, 100]}, {'text': 'seotips', 'indices': [101, 109]}, {'text': 'digitalmarketing', 'indices': [110, 127]}, {'text': 'staysafe', 'indices': [128, 137]}]",2021-08-26 04:56:10,9761
891,1430755755867660290,How Set Google Advanced Protection Program PCMag #Google #marketing #seo #seotips #digitalmarketing #staysafe #bu,"[{'text': 'Google', 'indices': [75, 82]}, {'text': 'marketing', 'indices': [83, 93]}, {'text': 'seo', 'indices': [94, 98]}, {'text': 'seotips', 'indices': [99, 107]}, {'text': 'digitalmarketing', 'indices': [108, 125]}, {'text': 'staysafe', 'indices': [126, 135]}]",2021-08-26 04:55:29,9761
892,1430755720375402498,Column Chromatography Adsorbents Swambe Chemicals #Google,"[{'text': 'Google', 'indices': [55, 62]}]",2021-08-26 04:55:20,304
893,1430755698833432579,ASK DYOR Not financial advice #chainlink #ico #ethereumking #crypto #altcoins,"[{'text': 'chainlink', 'indices': [90, 100]}, {'text': 'ico', 'indices': [101, 105]}, {'text': 'ethereumking', 'indices': [106, 119]}, {'text': 'crypto', 'indices': [120, 127]}, {'text': 'altcoins', 'indices': [128, 137]}]",2021-08-26 04:55:15,4742
894,1430755422596747266,Google increases user privacy controls Reuters #Google #marketing #seo #seotips #digitalmarketing #staysafe #business #se,"[{'text': 'Google', 'indices': [65, 72]}, {'text': 'marketing', 'indices': [73, 83]}, {'text': 'seo', 'indices': [84, 88]}, {'text': 'seotips', 'indices': [89, 97]}, {'text': 'digitalmarketing', 'indices': [98, 115]}, {'text': 'staysafe', 'indices': [116, 125]}, {'text': 'business', 'indices': [126, 135]}]",2021-08-26 04:54:09,9761
895,1430755137874710534,often looked the silver lining and the lines drawn the sand however the burden proof there,[],2021-08-26 04:53:01,46
896,1430755121210695684,ASK DYOR Not financial advice #chainlink #ico #ethereumking #crypto #altcoins,"[{'text': 'chainlink', 'indices': [90, 100]}, {'text': 'ico', 'indices': [101, 105]}, {'text': 'ethereumking', 'indices': [106, 119]}, {'text': 'crypto', 'indices': [120, 127]}, {'text': 'altcoins', 'indices': [128, 137]}]",2021-08-26 04:52:57,8417
897,1430754780008300544,#Google core updates can impact the people also ask #PAA results,"[{'text': 'Google', 'indices': [20, 27]}, {'text': 'PAA', 'indices': [73, 77]}]",2021-08-26 04:51:36,729
898,1430754736471412741,Google Search Ranking Algorithm Update might the tail end the #Google link #spamdeespejo update which not,"[{'text': 'Google', 'indices': [92, 99]}, {'text': 'spamdeespejo', 'indices': [105, 118]}]",2021-08-26 04:51:25,729
899,1430754699884498947,#Google rewriting #Title tags for limited amount pages search results often replacing the text with page,"[{'text': 'Google', 'indices': [20, 27]}, {'text': 'Title', 'indices': [41, 47]}]",2021-08-26 04:51:17,729
900,1430754584146890758,Ads,[],2021-08-26 04:50:49,949
901,1430754481239592961,The future here the bridge coming xdc xrp xlm qnt #blockchain #DLT #interoperability #google #Microsoft #facebook,"[{'text': 'blockchain', 'indices': [76, 87]}, {'text': 'DLT', 'indices': [88, 92]}, {'text': 'interoperability', 'indices': [93, 110]}, {'text': 'google', 'indices': [111, 118]}, {'text': 'Microsoft', 'indices': [119, 129]}, {'text': 'facebook', 'indices': [130, 139]}]",2021-08-26 04:50:25,177
902,1430754240398446594,ASK DYOR Not financial advice #chainlink #ico #ethereumking #crypto #altcoins,"[{'text': 'chainlink', 'indices': [90, 100]}, {'text': 'ico', 'indices': [101, 105]}, {'text': 'ethereumking', 'indices': [106, 119]}, {'text': 'crypto', 'indices': [120, 127]}, {'text': 'altcoins', 'indices': [128, 137]}]",2021-08-26 04:49:27,6383
903,1430754113428627457,Share laugh #funny #comedy #laugh #laughter #Google #kids,"[{'text': 'funny', 'indices': [32, 38]}, {'text': 'comedy', 'indices': [39, 46]}, {'text': 'laugh', 'indices': [47, 53]}, {'text': 'laughter', 'indices': [54, 63]}, {'text': 'Google', 'indices': [64, 71]}, {'text': 'kids', 'indices': [72, 77]}]",2021-08-26 04:48:57,11475
904,1430754101432815621,OPINION Rather than simply collecting the minutiae our lives the fine grained #surveillance #SmartHomes might,"[{'text': 'surveillance', 'indices': [105, 118]}, {'text': 'SmartHomes', 'indices': [122, 133]}]",2021-08-26 04:48:54,643
905,1430754098651955201,Google increases user privacy controls Reuters #Google #marketing #seo #seotips #digitalmarketing #staysafe #business #se,"[{'text': 'Google', 'indices': [65, 72]}, {'text': 'marketing', 'indices': [73, 83]}, {'text': 'seo', 'indices': [84, 88]}, {'text': 'seotips', 'indices': [89, 97]}, {'text': 'digitalmarketing', 'indices': [98, 115]}, {'text': 'staysafe', 'indices': [116, 125]}, {'text': 'business', 'indices': [126, 135]}]",2021-08-26 04:48:53,3943
906,1430754081220415488,How Set Google Advanced Protection Program PCMag #Google #marketing #seo #seotips #digitalmarketing #staysafe #bu,"[{'text': 'Google', 'indices': [75, 82]}, {'text': 'marketing', 'indices': [83, 93]}, {'text': 'seo', 'indices': [94, 98]}, {'text': 'seotips', 'indices': [99, 107]}, {'text': 'digitalmarketing', 'indices': [108, 125]}, {'text': 'staysafe', 'indices': [126, 135]}]",2021-08-26 04:48:49,3943
907,1430754071862931462,Growth Strategies Small Businesses Can Learn From Google #Google #marketing #seo #seotips #digitalmarketing #staysafe,"[{'text': 'Google', 'indices': [77, 84]}, {'text': 'marketing', 'indices': [85, 95]}, {'text': 'seo', 'indices': [96, 100]}, {'text': 'seotips', 'indices': [101, 109]}, {'text': 'digitalmarketing', 'indices': [110, 127]}, {'text': 'staysafe', 'indices': [128, 137]}]",2021-08-26 04:48:47,3943
