Unnamed: 0,id,text,Hashtags,date,follower_count
237,1410349669138550791,Best Computer Repair Bridgend and South Wales #Google #custombuild #customgamingpc #gaming,"[{'text': 'Google', 'indices': [71, 78]}, {'text': 'custombuild', 'indices': [103, 115]}, {'text': 'customgamingpc', 'indices': [116, 131]}, {'text': 'gaming', 'indices': [132, 139]}]",2021-06-30 21:28:58,16807
238,1410349611496136706,Breaking SSL Locks App Developers Behaving Badly #Symantec analyzed five years worth #Android and #iOS apps see how,"[{'text': 'Symantec', 'indices': [66, 75]}, {'text': 'Android', 'indices': [106, 114]}, {'text': 'iOS', 'indices': [119, 123]}]",2021-06-30 21:28:45,48
239,1410349484832223232,Temecula Men Suit Outlet #Google,"[{'text': 'Google', 'indices': [30, 37]}]",2021-06-30 21:28:14,149
240,1410349406944116745,After month since published site #google has finally started added pages its index,"[{'text': 'google', 'indices': [47, 54]}]",2021-06-30 21:27:56,630
241,1410349385309958150,Rollout the DENT App update are rolling out worldwide speak More details updates very soon #AppStore,"[{'text': 'AppStore', 'indices': [129, 138]}]",2021-06-30 21:27:51,1
242,1410349311599202307,what age did you know this was possible with #JavaScript and your #browser Edit text elements the fly https,"[{'text': 'JavaScript', 'indices': [68, 79]}, {'text': 'browser', 'indices': [89, 97]}]",2021-06-30 21:27:33,579
243,1410349305089728513,what age did you know this was possible with #JavaScript and your #browser Edit text elements the fly https,"[{'text': 'JavaScript', 'indices': [68, 79]}, {'text': 'browser', 'indices': [89, 97]}]",2021-06-30 21:27:32,896
244,1410349291076419584,what age did you know this was possible with #JavaScript and your #browser Edit text elements the fly https,"[{'text': 'JavaScript', 'indices': [68, 79]}, {'text': 'browser', 'indices': [89, 97]}]",2021-06-30 21:27:28,2923
245,1410349267886043136,what age did you know this was possible with #JavaScript and your #browser Edit text elements the fly https,"[{'text': 'JavaScript', 'indices': [68, 79]}, {'text': 'browser', 'indices': [89, 97]}]",2021-06-30 21:27:23,9100
246,1410349108964073482,Law Office Michael Paz #Google,"[{'text': 'Google', 'indices': [38, 45]}]",2021-06-30 21:26:45,80
247,1410349063552262148,GOOG #google #investment #freetrade #isa #daily dca NFA,"[{'text': 'google', 'indices': [19, 26]}, {'text': 'investment', 'indices': [27, 38]}, {'text': 'freetrade', 'indices': [39, 49]}, {'text': 'isa', 'indices': [50, 54]}, {'text': 'daily_dca', 'indices': [55, 65]}]",2021-06-30 21:26:34,2
248,1410348955540541445,Yaya Bodysculpting #Google,"[{'text': 'Google', 'indices': [22, 29]}]",2021-06-30 21:26:08,275
249,1410348935663783941,Complete Guide the Google Panda Update via #Google #HeyGoogle,"[{'text': 'Google', 'indices': [115, 122]}, {'text': 'HeyGoogle', 'indices': [123, 133]}]",2021-06-30 21:26:03,50
250,1410348916802048012,OGN amazing partnerships with #Amazon #Paypal #Brave #Google First #NFT platform #googlecloud,"[{'text': 'Amazon', 'indices': [68, 75]}, {'text': 'Paypal', 'indices': [76, 83]}, {'text': 'Brave', 'indices': [84, 90]}, {'text': 'Google', 'indices': [91, 98]}, {'text': 'NFT', 'indices': [106, 110]}, {'text': 'googlecloud', 'indices': [123, 135]}]",2021-06-30 21:25:59,3
251,1410348836141338627,whole family uses #google for our cell service googlepay will not allow update use any credit,"[{'text': 'google', 'indices': [21, 28]}]",2021-06-30 21:25:40,500
252,1410348543542366210,Gray Raven Database Karenina Ember vol Releasing the weapon restriction Karenina able unleash the full force,[],2021-06-30 21:24:30,83
253,1410348157398093827,The crises experienced should strengthen the team spirit #togetherisbetter #wednesdaythought #itcompany,"[{'text': 'togetherisbetter', 'indices': [58, 75]}, {'text': 'wednesdaythought', 'indices': [78, 95]}, {'text': 'itcompany', 'indices': [97, 107]}]",2021-06-30 21:22:58,337
254,1410347986438197258,what age did you know this was possible with #JavaScript and your #browser Edit text elements the fly,"[{'text': 'JavaScript', 'indices': [49, 60]}, {'text': 'browser', 'indices': [70, 78]}]",2021-06-30 21:22:17,31
255,1410347950639828992,#Brave browser better than #Google invest now into #BasicAttentionToken #BAT earn free #BAT for browsing and doe,"[{'text': 'Brave', 'indices': [0, 6]}, {'text': 'Google', 'indices': [30, 37]}, {'text': 'BasicAttentionToken', 'indices': [54, 74]}, {'text': 'BAT', 'indices': [75, 79]}, {'text': 'BAT', 'indices': [90, 94]}]",2021-06-30 21:22:09,1148
256,1410346947043602433,Check out this new photograph that uploaded #Woman #Dress #Beach,"[{'text': 'Woman', 'indices': [117, 123]}, {'text': 'Dress', 'indices': [124, 130]}, {'text': 'Beach', 'indices': [131, 137]}]",2021-06-30 21:18:09,4910
257,1410346937971212291,The Institute for Drone Technology #Google,"[{'text': 'Google', 'indices': [39, 46]}]",2021-06-30 21:18:07,7724
258,1410346924314607622,Android App Bundles are replacing APKs They can handle bigger apps but can only exist within the Google Play Stor,[],2021-06-30 21:18:04,132
259,1410346881323053058,Android App Bundles are replacing APKs They can handle bigger apps but can only exist within the Google Play Stor,[],2021-06-30 21:17:54,792
260,1410346341289578499,all new #LaMDA promises bring about conversational flow #AI responses user queries Being,"[{'text': 'LaMDA', 'indices': [18, 24]}, {'text': 'AI', 'indices': [75, 78]}]",2021-06-30 21:15:45,32
261,1410345975055486978,Rollout the DENT App update are rolling out worldwide speak More details updates very soon #AppStore,"[{'text': 'AppStore', 'indices': [129, 138]}]",2021-06-30 21:14:18,56
262,1410345921842458626,Top Gun Anthem The Green Planet Project featuring myself guitar #SPOTIFYPLAYLIST #TopGun #guitar #spotify,"[{'text': 'SPOTIFYPLAYLIST', 'indices': [72, 88]}, {'text': 'TopGun', 'indices': [89, 96]}, {'text': 'guitar', 'indices': [97, 104]}, {'text': 'spotify', 'indices': [105, 113]}]",2021-06-30 21:14:05,2609
263,1410345878846685188,#NewRelease BOUND RING amp SECRET Warm funny heartbreaking amazing story #Kindle,"[{'text': 'NewRelease', 'indices': [20, 31]}, {'text': 'Kindle', 'indices': [109, 116]}]",2021-06-30 21:13:55,11093
264,1410345866599317507,#NewRelease BOUND RING amp SECRET Warm funny heartbreaking amazing story #Kindle,"[{'text': 'NewRelease', 'indices': [20, 31]}, {'text': 'Kindle', 'indices': [109, 116]}]",2021-06-30 21:13:52,11093
265,1410345801189138432,Push the #BAT #HERO #Funny #game try and give feedback indie game #developper encourage Thanks #Andro,"[{'text': 'BAT', 'indices': [29, 33]}, {'text': 'HERO', 'indices': [34, 39]}, {'text': 'Funny', 'indices': [41, 47]}, {'text': 'game', 'indices': [48, 53]}, {'text': 'developper', 'indices': [100, 111]}]",2021-06-30 21:13:36,809
266,1410345761376718860,Indian origin founders launch free subscription based search engine alternat,[],2021-06-30 21:13:27,1600
267,1410345581038522373,Google the World Biggest Censor and Its Power Must Regulated #FreedomOfSpeech #info #freedom #usa #elite #google,"[{'text': 'FreedomOfSpeech', 'indices': [86, 102]}, {'text': 'info', 'indices': [103, 108]}, {'text': 'freedom', 'indices': [109, 117]}, {'text': 'usa', 'indices': [118, 122]}, {'text': 'elite', 'indices': [123, 129]}, {'text': 'google', 'indices': [130, 137]}]",2021-06-30 21:12:44,251
268,1410345418593124355,Google How Long SEO Takes #OrganicSearch #Google #DigitalStrategy #DigitalMarketing,"[{'text': 'OrganicSearch', 'indices': [56, 70]}, {'text': 'Google', 'indices': [71, 78]}, {'text': 'DigitalStrategy', 'indices': [79, 95]}, {'text': 'DigitalMarketing', 'indices': [96, 113]}]",2021-06-30 21:12:05,191
269,1410345411647348736,Google first use MUM real world search results involves using the technology understand variations searches,[],2021-06-30 21:12:03,50
270,1410345092565643270,COOL PHONE CASES ONLINE APPLY ANY DESIGN OTHER BRAND CASES #iPhone #Apple #Smartphones,"[{'text': 'iPhone', 'indices': [111, 118]}, {'text': 'Apple', 'indices': [119, 125]}, {'text': 'Smartphones', 'indices': [126, 138]}]",2021-06-30 21:10:47,251
271,1410345068096073731,are now Check out #linkinbio #podcastlife #podcasting #SpotifyPodcasts #Clubhouse #podcasting,"[{'text': 'linkinbio', 'indices': [58, 68]}, {'text': 'podcastlife', 'indices': [74, 86]}, {'text': 'podcasting', 'indices': [87, 98]}, {'text': 'SpotifyPodcasts', 'indices': [99, 115]}, {'text': 'Clubhouse', 'indices': [116, 126]}, {'text': 'podcasting', 'indices': [127, 138]}]",2021-06-30 21:10:41,2218
272,1410344904413179904,Google demonstrates leading performance latest MLPerf Benchmarks #GCP #Google #GoogleCloud #AI #MachineLearning,"[{'text': 'GCP', 'indices': [92, 96]}, {'text': 'Google', 'indices': [97, 104]}, {'text': 'GoogleCloud', 'indices': [105, 117]}, {'text': 'AI', 'indices': [118, 121]}, {'text': 'MachineLearning', 'indices': [122, 138]}]",2021-06-30 21:10:02,233
273,1410344701408866304,following back all those who retweet this and follow Let DaysOfCode #DEVCommunity #CodeNewbies,"[{'text': '100DaysOfCode', 'indices': [95, 109]}, {'text': 'DEVCommunity', 'indices': [110, 123]}, {'text': 'CodeNewbies', 'indices': [124, 136]}]",2021-06-30 21:09:14,2805
274,1410344643099832322,Best Free Alternatives Google Public DNS LinuxLinks DNS short for domain name syst,[],2021-06-30 21:09:00,3418
275,1410344465009713166,Reach compel convert attend SMX Convert for just #marketing #google #seo,"[{'text': 'marketing', 'indices': [81, 91]}, {'text': 'google', 'indices': [92, 99]}, {'text': 'seo', 'indices': [100, 104]}]",2021-06-30 21:08:18,47229
276,1410344148033486850,#GoogleAnalytics #RT Read get subj grasp site Need #traffic for page #Google,"[{'text': 'GoogleAnalytics', 'indices': [0, 16]}, {'text': 'RT', 'indices': [17, 20]}, {'text': 'traffic', 'indices': [57, 65]}, {'text': 'Google', 'indices': [82, 89]}]",2021-06-30 21:07:02,2905
277,1410343407990550532,Let clear #Americaisracist #fascist regime #Government #KKKops #military Who tweets violence,"[{'text': 'Americaisracist', 'indices': [27, 43]}, {'text': 'fascist', 'indices': [45, 53]}, {'text': 'Government', 'indices': [61, 72]}, {'text': 'KKKops', 'indices': [73, 80]}, {'text': 'military', 'indices': [81, 90]}]",2021-06-30 21:04:06,96
278,1410343210103324679,Less time managing Google Facebook and Microsoft Ads means more time focus growing your business,[],2021-06-30 21:03:18,207
279,1410343205393076224,#Google searches NXIVM old,"[{'text': 'Google', 'indices': [6, 13]}]",2021-06-30 21:03:17,3316
280,1410343150619611138,following back all those who retweet this and follow Let DaysOfCode #DEVCommunity #CodeNewbies,"[{'text': '100DaysOfCode', 'indices': [95, 109]}, {'text': 'DEVCommunity', 'indices': [110, 123]}, {'text': 'CodeNewbies', 'indices': [124, 136]}]",2021-06-30 21:03:04,6392
281,1410343145565474817,#Google searches old,"[{'text': 'Google', 'indices': [5, 12]}]",2021-06-30 21:03:03,3316
282,1410343142155591684,following back all those who retweet this and follow Let DaysOfCode #DEVCommunity #CodeNewbies,"[{'text': '100DaysOfCode', 'indices': [95, 109]}, {'text': 'DEVCommunity', 'indices': [110, 123]}, {'text': 'CodeNewbies', 'indices': [124, 136]}]",2021-06-30 21:03:02,579
283,1410343123977392130,following back all those who retweet this and follow Let DaysOfCode #DEVCommunity #CodeNewbies,"[{'text': '100DaysOfCode', 'indices': [95, 109]}, {'text': 'DEVCommunity', 'indices': [110, 123]}, {'text': 'CodeNewbies', 'indices': [124, 136]}]",2021-06-30 21:02:58,23
284,1410343111658672132,Are you looking for experts create custom #realEstate #landingpage #website designer can design any kind website,"[{'text': 'realEstate', 'indices': [60, 71]}, {'text': 'landingpage', 'indices': [72, 84]}, {'text': 'website', 'indices': [85, 93]}]",2021-06-30 21:02:55,4044
285,1410343106990407681,following back all those who retweet this and follow Let DaysOfCode #DEVCommunity #CodeNewbies,"[{'text': '100DaysOfCode', 'indices': [95, 109]}, {'text': 'DEVCommunity', 'indices': [110, 123]}, {'text': 'CodeNewbies', 'indices': [124, 136]}]",2021-06-30 21:02:54,2167
286,1410342683785273347,#AT amp TRCS now default for #Android with #Messages #Google #SlashGear,"[{'text': 'AT', 'indices': [0, 3]}, {'text': 'Android', 'indices': [29, 37]}, {'text': 'Messages', 'indices': [43, 52]}, {'text': 'Google', 'indices': [56, 63]}, {'text': 'SlashGear', 'indices': [64, 74]}]",2021-06-30 21:01:13,1729
287,1410342451877908485,Google WiFi System Pack Router Replacement Whole Home Coverage NLS white #Google #Wi,"[{'text': 'Google', 'indices': [128, 135]}]",2021-06-30 21:00:18,34
288,1410342413261053963,Finally deleted #lastpass after introducing their shocking pricing strategy Next start unshackling myself from,"[{'text': 'lastpass', 'indices': [16, 25]}]",2021-06-30 21:00:08,22
289,1410342404436135936,Google WiFi System Pack Router Replacement Whole Home Coverage NLS white #Google #Wi,"[{'text': 'Google', 'indices': [128, 135]}]",2021-06-30 21:00:06,16807
290,1410342291152244737,wanna know everything about free VISA #Google,"[{'text': 'Google', 'indices': [40, 47]}]",2021-06-30 20:59:39,122
291,1410342263792807944,dear #Google and #TwitterIndia you can not correctly display simple map India which all,"[{'text': 'Google', 'indices': [25, 32]}, {'text': 'TwitterIndia', 'indices': [54, 67]}]",2021-06-30 20:59:33,23
292,1410341852667072516,real pickup for you #usher #crowder #june coup #google #ethan,"[{'text': 'usher', 'indices': [23, 29]}, {'text': 'crowder', 'indices': [30, 38]}, {'text': 'june22coup', 'indices': [39, 50]}, {'text': 'google', 'indices': [51, 58]}, {'text': 'ethan', 'indices': [59, 65]}]",2021-06-30 20:57:55,420
293,1410341758437892102,Guys #followme will #followback #RT #retweet #AdamRoberts #Casseroledishes #Cuisine #Foodanddrink #Google #InaGarten,"[{'text': 'followme', 'indices': [26, 35]}, {'text': 'followback', 'indices': [43, 54]}, {'text': 'RT', 'indices': [55, 58]}, {'text': 'retweet', 'indices': [59, 67]}, {'text': 'AdamRoberts', 'indices': [68, 80]}, {'text': 'Casseroledishes', 'indices': [81, 97]}, {'text': 'Cuisine', 'indices': [98, 106]}, {'text': 'Foodanddrink', 'indices': [107, 120]}, {'text': 'Google', 'indices': [121, 128]}, {'text': 'InaGarten', 'indices': [129, 139]}]",2021-06-30 20:57:32,4340
294,1410341672853061634,#Google not sharing your pro #Gsy anti Hetero anti #Procreation antichristian #AntiUSA,"[{'text': 'Google', 'indices': [3, 10]}, {'text': 'Gsy', 'indices': [38, 42]}, {'text': 'Procreation', 'indices': [61, 73]}, {'text': 'AntiUSA', 'indices': [90, 98]}]",2021-06-30 20:57:12,0
295,1410341497405284352,#SinthSity and #CooleHigh #DarkMagenta out now #iTunes #GooglePlay #Amazon #AmazonMusic #TIDAL #Deeze,"[{'text': 'SinthSity', 'indices': [15, 25]}, {'text': 'CooleHigh', 'indices': [48, 58]}, {'text': 'DarkMagenta', 'indices': [61, 73]}, {'text': 'iTunes', 'indices': [85, 92]}, {'text': 'GooglePlay', 'indices': [93, 104]}, {'text': 'Amazon', 'indices': [105, 112]}, {'text': 'AmazonMusic', 'indices': [113, 125]}, {'text': 'TIDAL', 'indices': [126, 132]}]",2021-06-30 20:56:30,8790
296,1410341445286965249,You should get #Google Pixel phone you can use the Hold for feature You,"[{'text': 'Google', 'indices': [49, 56]}]",2021-06-30 20:56:18,5
297,1410341442296303617,Guys #followme will #followback #RT #retweet #AdamRoberts #Casseroledishes #Cuisine #Foodanddrink #Google,"[{'text': 'followme', 'indices': [9, 18]}, {'text': 'followback', 'indices': [26, 37]}, {'text': 'RT', 'indices': [38, 41]}, {'text': 'retweet', 'indices': [42, 50]}, {'text': 'AdamRoberts', 'indices': [51, 63]}, {'text': 'Casseroledishes', 'indices': [64, 80]}, {'text': 'Cuisine', 'indices': [81, 89]}, {'text': 'Foodanddrink', 'indices': [90, 103]}, {'text': 'Google', 'indices': [104, 111]}]",2021-06-30 20:56:17,859
298,1410341410142920705,Gray Raven Database Karenina Ember vol Releasing the weapon restriction Karenina able unleash the full force,[],2021-06-30 20:56:09,12
299,1410341324612685824,After six year truce Microsoft and Google plan reignite the rivalry over market claims apps and content marketi,[],2021-06-30 20:55:49,7989
300,1410341301434867712,Rollout the DENT App update are rolling out worldwide speak More details updates very soon #AppStore,"[{'text': 'AppStore', 'indices': [129, 138]}]",2021-06-30 20:55:43,192
301,1410341087839989763,#usher #crowder #june coup #google #ethan EFERO Teeth Whitening Essence Powder Clean Oral Hygiene Whiten Teeth Rem,"[{'text': 'usher', 'indices': [0, 6]}, {'text': 'crowder', 'indices': [7, 15]}, {'text': 'june22coup', 'indices': [16, 27]}, {'text': 'google', 'indices': [28, 35]}, {'text': 'ethan', 'indices': [36, 42]}]",2021-06-30 20:54:52,420
302,1410340813540712452,Are you looking for experts create custom #realEstate #landingpage #website designer can design any kind,"[{'text': 'realEstate', 'indices': [47, 58]}, {'text': 'landingpage', 'indices': [59, 71]}, {'text': 'website', 'indices': [72, 80]}]",2021-06-30 20:53:47,182
303,1410340646850867213,Looking forward providing with Google training tomorrow Excited learning from this super award win,[],2021-06-30 20:53:07,3695
304,1410340601095151620,Check out this article Google secret hiring challenge #hiring #google #softwareengineeringjobs,"[{'text': 'hiring', 'indices': [84, 91]}, {'text': 'google', 'indices': [92, 99]}, {'text': 'softwareengineeringjobs', 'indices': [100, 124]}]",2021-06-30 20:52:56,2404
305,1410340249914458119,following back all those who retweet this and follow Let DaysOfCode #DEVCommunity #CodeNewbies,"[{'text': '100DaysOfCode', 'indices': [95, 109]}, {'text': 'DEVCommunity', 'indices': [110, 123]}, {'text': 'CodeNewbies', 'indices': [124, 136]}]",2021-06-30 20:51:33,244
306,1410340167676829696,Looking forward providing with Google training tomorrow Excited learning from this super award win,[],2021-06-30 20:51:13,1041
307,1410340135560912898,YouTube abruptly loses Newsy channel today adds Law amp Crime channel #Google,"[{'text': 'Google', 'indices': [102, 109]}]",2021-06-30 20:51:05,1842
308,1410340125943373824,New YouTube Studio icon awfully similar the YouTube Music logo #Google #Technology,"[{'text': 'Google', 'indices': [93, 100]}, {'text': 'Technology', 'indices': [101, 112]}]",2021-06-30 20:51:03,1842
309,1410339792232067072,Here are unique places put your #Google Home smart speaker home #smarttech,"[{'text': 'Google', 'indices': [35, 42]}, {'text': 'smarttech', 'indices': [71, 81]}]",2021-06-30 20:49:43,52
310,1410339635297873922,Experts have been saying this for some time now hybrid cloud and multi cloud are the way your organization tran,[],2021-06-30 20:49:06,572
311,1410339595787587587,Experts have been saying this for some time now hybrid cloud and multi cloud are the way your organization tran,[],2021-06-30 20:48:57,1418
312,1410339464828829697,After six year truce Microsoft and Google plan reignite the rivalry over market claims apps and content,[],2021-06-30 20:48:25,96
313,1410339402535129095,Thank Stephanie for explaining detail how #google #coach Shout out #ECOpenChat,"[{'text': 'google', 'indices': [67, 74]}, {'text': 'coach', 'indices': [75, 81]}, {'text': 'ECOpenChat', 'indices': [97, 108]}]",2021-06-30 20:48:11,39
314,1410339234658013211,Researcher uncover unpatched #vulnerability #Google Compute Engine platform that could abused attacker,"[{'text': 'vulnerability', 'indices': [52, 66]}, {'text': 'Google', 'indices': [70, 77]}]",2021-06-30 20:47:31,4345
315,1410338935616806913,#Google Tuesday announced new website designed one stop shop for people with food insecurity the,"[{'text': 'Google', 'indices': [17, 24]}]",2021-06-30 20:46:19,2784
316,1410338623984128006,Google Secretly Updates AMP and Featured Snippets #Google SEOHacker,"[{'text': 'Google', 'indices': [76, 83]}]",2021-06-30 20:45:05,7076
317,1410338606166601728,Experts have been saying this for some time now hybrid cloud and multi cloud are the way your organizati,[],2021-06-30 20:45:01,84
318,1410338578752839681,Latest digital health research paper Google #googleai #digitalhealth #prostratecancer #aidiagnostics,"[{'text': 'googleai', 'indices': [48, 57]}, {'text': 'digitalhealth', 'indices': [58, 72]}, {'text': 'prostratecancer', 'indices': [74, 90]}, {'text': 'aidiagnostics', 'indices': [91, 105]}]",2021-06-30 20:44:54,281
319,1410338338758877198,What new with Google Cloud #GCP #Google #GoogleCloud #GoogleWorkspace,"[{'text': 'GCP', 'indices': [73, 77]}, {'text': 'Google', 'indices': [78, 85]}, {'text': 'GoogleCloud', 'indices': [86, 98]}, {'text': 'GoogleWorkspace', 'indices': [99, 115]}]",2021-06-30 20:43:57,1418
320,1410338334627581953,Build platform with KRM Part Administering multi cluster environment #GCP #Google #Goo,"[{'text': 'GCP', 'indices': [122, 126]}, {'text': 'Google', 'indices': [127, 134]}]",2021-06-30 20:43:56,1418
321,1410338325630787586,Rollout the DENT App update are rolling out worldwide speak More details updates very soon #AppStore,"[{'text': 'AppStore', 'indices': [129, 138]}]",2021-06-30 20:43:54,225
322,1410338270106591234,Law Office Michael Paz #Google,"[{'text': 'Google', 'indices': [38, 45]}]",2021-06-30 20:43:41,80
323,1410337756337688576,Did you know that there are blocking extensions for Chrome and kills all those annoying ads YouTube ins,[],2021-06-30 20:41:38,7503
324,1410337363507699717,Google first use MUM real world search results involves using the technology understand variations searches,[],2021-06-30 20:40:04,4026
325,1410337216862244876,Check out this new photograph that uploaded #Woman #Dress #Beach,"[{'text': 'Woman', 'indices': [117, 123]}, {'text': 'Dress', 'indices': [124, 130]}, {'text': 'Beach', 'indices': [131, 137]}]",2021-06-30 20:39:29,2139
326,1410337174797570059,Will Bring #Digital #Vaccine Cards #Android Phones #Google will begin letting people easily store their,"[{'text': 'Digital', 'indices': [19, 27]}, {'text': 'Vaccine', 'indices': [28, 36]}, {'text': 'Android', 'indices': [46, 54]}, {'text': 'Google', 'indices': [62, 69]}]",2021-06-30 20:39:19,2269
327,1410336908828348417,OGN amazing partnerships with #Amazon #Paypal #Brave #Google First #NFT platform,"[{'text': 'Amazon', 'indices': [49, 56]}, {'text': 'Paypal', 'indices': [57, 64]}, {'text': 'Brave', 'indices': [65, 71]}, {'text': 'Google', 'indices': [72, 79]}, {'text': 'NFT', 'indices': [87, 91]}]",2021-06-30 20:38:16,110
328,1410336833897046017,#Google finally making genuine #privacy move scrapping IDs for users who opt out targeted ads But onl,"[{'text': 'Google', 'indices': [18, 25]}, {'text': 'privacy', 'indices': [54, 62]}]",2021-06-30 20:37:58,54
329,1410336203963043844,After series dead end jobs Junie hired apprentice struggling feng shui practice,[],2021-06-30 20:35:28,1811
330,1410335816652492803,#Google finally making genuine #privacy move scrapping IDs for users who opt out targeted ads But onl,"[{'text': 'Google', 'indices': [18, 25]}, {'text': 'privacy', 'indices': [54, 62]}]",2021-06-30 20:33:56,412
331,1410335405828804609,#Videoverbrennung #DataLoss #Zensur #censorship BOW longer available because the #YouTube account ass,"[{'text': 'Videoverbrennung', 'indices': [14, 31]}, {'text': 'DataLoss', 'indices': [37, 46]}, {'text': 'Zensur', 'indices': [47, 54]}, {'text': 'censorship', 'indices': [55, 66]}, {'text': 'YouTube', 'indices': [119, 127]}]",2021-06-30 20:32:18,36222
332,1410335396534226945,#Videoverbrennung #DataLoss #Zensur #censorship BOW longer available because the #YouTube account ass,"[{'text': 'Videoverbrennung', 'indices': [14, 31]}, {'text': 'DataLoss', 'indices': [37, 46]}, {'text': 'Zensur', 'indices': [47, 54]}, {'text': 'censorship', 'indices': [55, 66]}, {'text': 'YouTube', 'indices': [119, 127]}]",2021-06-30 20:32:15,17139
333,1410335167273750538,Learn how create new user group from the Google Workspace Suite admin console #Google,"[{'text': 'Google', 'indices': [130, 137]}]",2021-06-30 20:31:21,1700
334,1410335029293637636,all #businessmen The best #investment #advertising The best #advertising #domain The best #domain #brandable,"[{'text': 'businessmen', 'indices': [21, 33]}, {'text': 'investment', 'indices': [44, 55]}, {'text': 'advertising', 'indices': [59, 71]}, {'text': 'advertising', 'indices': [82, 94]}, {'text': 'domain', 'indices': [100, 107]}, {'text': 'domain', 'indices': [118, 125]}, {'text': 'brandable', 'indices': [129, 139]}]",2021-06-30 20:30:48,9
335,1410334959504703491,#Google getting ready bring back people office,"[{'text': 'Google', 'indices': [0, 7]}]",2021-06-30 20:30:31,4660
336,1410334560030793730,BOLT Upgrades Watch your favourite Live Streams amp Read what happening Twitter the Same time #Twitter,"[{'text': 'Twitter', 'indices': [133, 141]}]",2021-06-30 20:28:56,622
337,1410334549322645505,Data Direct Thames Valley Ltd #Google Not too late register for tomorrow,"[{'text': 'Google', 'indices': [35, 42]}]",2021-06-30 20:28:53,896
338,1410334539403116544,Gray Raven Database Karenina Ember vol Releasing the weapon restriction Karenina able unleash the full force,[],2021-06-30 20:28:51,2
339,1410334501016903690,#Google Will Now Warn You That You Are Searching For Fake News Before You Click Links Who Determines What Fake,"[{'text': 'Google', 'indices': [0, 7]}]",2021-06-30 20:28:42,1895
340,1410334420033323010,Gray Raven Database Karenina Ember vol Releasing the weapon restriction Karenina able unleash the full force,[],2021-06-30 20:28:23,24
341,1410334200293695496,#Google Please deploy couple your internet balloons Swaziland the gov has shut down the internet for all citizens,"[{'text': 'Google', 'indices': [13, 20]}]",2021-06-30 20:27:30,459
342,1410333577858981888,Build platform with KRM Part Administering multi cluster environment #GCP #Google,"[{'text': 'GCP', 'indices': [102, 106]}, {'text': 'Google', 'indices': [107, 114]}]",2021-06-30 20:25:02,233
