tweet,follower_count,neg,neu,pos,compound,time
Pattaya One News #Google,5314,0.0,1.0,0.0,0.0,2021-05-17 08:17:20
population just men work women Benefits cost billion plus houses wonder they look,2093,0.0,0.822,0.178,0.3818,2021-05-17 08:16:50
population just men work women Benefits cost billion plus houses wonder they look,261,0.0,0.822,0.178,0.3818,2021-05-17 08:16:35
#Google Party Cookie Ban What Means and Why You Should Care via #ThirdPartyC,4376,0.185,0.513,0.303,0.3182,2021-05-17 08:15:10
Earn Free Google Play Codes Gift Cards #MareOfEasttown #PoseFX #MissUniverse #WMBacklash,3556,0.0,0.482,0.518,0.8225,2021-05-17 08:15:09
#Amazon for travellers smartphone that truly understands you Honor View,4284,0.0,0.567,0.433,0.7269,2021-05-17 08:13:09
Autoscreens #Google Our new fleet van the making and ready soon What simple,715,0.0,0.828,0.172,0.3612,2021-05-17 08:13:07
What expect Google Google big developer conference back after year absence,2822,0.0,1.0,0.0,0.0,2021-05-17 08:13:05
What expect Google Google big developer conference back after year absence,854,0.0,1.0,0.0,0.0,2021-05-17 08:12:18
#MemeMonday What level brain power are you going this week #JustTrustMe #Google,28,0.0,1.0,0.0,0.0,2021-05-17 08:12:16
Check Out More #Website #Google #Linkedin,35,0.0,1.0,0.0,0.0,2021-05-17 08:12:05
Year and Year have taken part STEM initiative Google based Internet Safety For each corr,5479,0.0,0.833,0.167,0.4215,2021-05-17 08:12:02
Many local businesses were affected over the last year which why Google explained how local businesses can incr,1602,0.086,0.914,0.0,-0.1531,2021-05-17 08:12:00
KASHISH Indian Sub Continent IPR Management Limited #Google,118,0.213,0.787,0.0,-0.2263,2021-05-17 08:11:09
Why Social Media Marketing Important #seo #digitalmarketing #searchengineoptimization #google,36,0.0,0.816,0.184,0.2023,2021-05-17 08:08:48
Check out National Productivity Council Google Please follow NPC Google and stay tuned,375,0.0,0.839,0.161,0.3182,2021-05-17 08:07:23
DID YOU KNOW THIS #RecycleDevice #DidYouKnow #Google #GoogleSearchEngine #Facts #KnowledgeIsPower #knowledgeable #Sel,852,0.0,1.0,0.0,0.0,2021-05-17 08:06:45
How index backlink search engines #Google #DataScience #DigitalTransformation #SEOKJIN #RETWEEET #replytweet,873,0.0,1.0,0.0,0.0,2021-05-17 08:06:12
How index backlink search engines #Google #DataScience #DigitalTransformation #SEOKJIN #RETWEEET #replytweet,2054,0.0,1.0,0.0,0.0,2021-05-17 08:05:55
How index backlink search engines #Google #DataScience #DigitalTransformation #SEOKJIN #RETWEEET #replytweet,1807,0.0,1.0,0.0,0.0,2021-05-17 08:05:07
#Google recently cited #passageindexing way can help with search What exactly passage indexing And wha,2995,0.0,0.838,0.162,0.4019,2021-05-17 08:05:03
Kai Travel Services #Google,55,0.0,1.0,0.0,0.0,2021-05-17 08:05:00
Speech Text Google Speech Amazon Transcribe Via #SpeechtoText #voicerecognit,2519,0.0,0.825,0.175,0.1779,2021-05-17 08:03:52
Tel Aviv University And Google Launch Artificial Intelligence For Social Good #ai #artifici,1721,0.0,0.647,0.353,0.7184,2021-05-17 08:03:29
Everyone talking about the new AirPods and Apple Music HiFi for May but don forget about #GoogleIO that the,2,0.115,0.885,0.0,-0.3291,2021-05-17 08:03:24
Without making big changes There way for Google retain its research credibility especially ethical #AI #Et,21296,0.0,0.807,0.193,0.5563,2021-05-17 08:03:13
Get the most out your Google Chrome experience Here are the Chrome shortcuts you need boost productivity when browsin,4030,0.0,0.87,0.13,0.4019,2021-05-17 08:02:06
Check out National Productivity Council Google Please follow NPC Google and stay tuned,66,0.0,0.839,0.161,0.3182,2021-05-17 08:01:35
Tel Aviv University And Google Launch Artificial Intelligence For Social Good #ai #artifici,1325,0.0,0.647,0.353,0.7184,2021-05-17 08:01:29
Launch #Google amp #Apple #App #Promotion Campaigns where CPI Starts from just #Bountyhub #Bounty #germany #website,4445,0.0,1.0,0.0,0.0,2021-05-17 08:01:21
What makes great SEO report Pat Ahern and other industry experts share their best tips for buil,2410,0.0,0.571,0.429,0.8885,2021-05-17 08:01:06
The new Google button and the Effects SEO Web SEO Analytics #google #socialmedia #marketing,344,0.0,1.0,0.0,0.0,2021-05-17 08:00:55
Have you got #Google #Facebook #Microsoft ads account and want analyse its performance With our smart tec,234,0.0,0.789,0.211,0.4588,2021-05-17 08:00:28
Launch #Google amp #Apple #App #Promotion Campaigns where CPI Starts from just #Bountyhub #Bounty #germany #website,319,0.0,1.0,0.0,0.0,2021-05-17 07:59:56
Content Writing Easier Than You Think #Google #SEO #Copywriting,25745,0.0,0.741,0.259,0.4215,2021-05-17 07:58:04
Launch #Google amp #Apple #App #Promotion Campaigns where CPI Starts from just #Bountyhub #Bounty #germany,1229,0.0,1.0,0.0,0.0,2021-05-17 07:58:00
Have you noticed something relatively new the SERPs Here what online sellers need know about,19641,0.0,1.0,0.0,0.0,2021-05-17 07:56:33
John Mueller was asked FAQ structured data still produces rich results explained the fine tunin,19641,0.0,0.707,0.293,0.6597,2021-05-17 07:56:22
replacement for Google Structured Data Testing Tool called the Schema Markup Validator now,19641,0.0,1.0,0.0,0.0,2021-05-17 07:56:13
SevenMentor German Language Classes French Classes Japanese Classes #Google,68,0.0,1.0,0.0,0.0,2021-05-17 07:55:48
Have you noticed something relatively new the SERPs Here what online sellers need know about,419,0.0,1.0,0.0,0.0,2021-05-17 07:55:48
The Google world account Stay tuned #Google #Alphabet #YouTube #GoogleEarth #Constellatio,0,0.0,1.0,0.0,0.0,2021-05-17 07:55:41
John Mueller was asked FAQ structured data still produces rich results explained the fine tunin,419,0.0,0.707,0.293,0.6597,2021-05-17 07:55:38
replacement for Google Structured Data Testing Tool called the Schema Markup Validator now,419,0.0,1.0,0.0,0.0,2021-05-17 07:55:30
#Ecosia great option for #private #searchengine you don want use #Google Ecosia plants tree,0,0.0,0.69,0.31,0.6597,2021-05-17 07:55:30
DID YOU KNOW THIS #RecycleDevice #DidYouKnow #Google #GoogleSearchEngine #Facts #KnowledgeIsPower #knowledgeable,206,0.0,1.0,0.0,0.0,2021-05-17 07:55:13
#Google #RemoteWork Policy Allows #Employees Permanent #WFH via Coincident,19,0.0,1.0,0.0,0.0,2021-05-17 07:53:52
The Core Elements Ranking Google #onlinelearning #education #Google #SEO #BusinessOwners,1008,0.0,1.0,0.0,0.0,2021-05-17 07:52:56
United Driving School and Training Centre #Google shimza bonang,112,0.0,0.741,0.259,0.4215,2021-05-17 07:52:44
you own website even personal blog corporate website commerce website Pop ups are bad for SEO,314,0.189,0.811,0.0,-0.5423,2021-05-17 07:52:27
Worried about covid Please see how you can enhance your immunity this trying time with simple yogic workshop,143,0.107,0.78,0.112,0.0258,2021-05-17 07:52:15
#RT #RaviVisvesvarayaSharadaPrasad cybersec feeds #adcy,121,0.0,1.0,0.0,0.0,2021-05-17 07:51:43
loveavonxx #Google,145,0.0,1.0,0.0,0.0,2021-05-17 07:51:34
Tel Aviv University And Google Launch Artificial Intelligence For Social Good #ai #artifici,259,0.0,0.647,0.353,0.7184,2021-05-17 07:51:08
you own website even personal blog corporate website commerce website Pop ups are bad for,598,0.2,0.8,0.0,-0.5423,2021-05-17 07:50:12
Tel Aviv University And Google Launch Artificial Intelligence For Social Good #ai,59247,0.0,0.625,0.375,0.7184,2021-05-17 07:50:03
What Google Campaign Run #Google #digitalstrategy,0,0.0,1.0,0.0,0.0,2021-05-17 07:49:17
srinarmadaittraining com #angular #angularjs #react #reactjs #backend #backenddeveloper #fron,1905,0.0,1.0,0.0,0.0,2021-05-17 07:48:48
#RaviVisvesvarayaSharadaPrasad cybersec feeds #adcy #cybercrime,4288,0.0,1.0,0.0,0.0,2021-05-17 07:47:25
Speech Text Google Speech Amazon Transcribe Via #SpeechtoText #voicerecogni,1325,0.0,0.825,0.175,0.1779,2021-05-17 07:46:23
Speech Text Google Speech Amazon Transcribe Via #SpeechtoText #voicerecognit,1325,0.0,0.825,0.175,0.1779,2021-05-17 07:46:18
Importance Hits Clicks Linkedin and Social Media for Marketing #marketing,413,0.0,0.783,0.217,0.3612,2021-05-17 07:45:25
#LearningAtWorkWeek Charlie has decided refresh her mind and expand her marketing knowledge after retu,488,0.0,0.85,0.15,0.3182,2021-05-17 07:44:13
SevenMentor amp Training Pvt Ltd Interior Designing Courses #Google,68,0.0,1.0,0.0,0.0,2021-05-17 07:43:54
Puc English Romeo And Juliet One mark important question and answers Question Bank Answers With PDF,0,0.0,0.893,0.107,0.2023,2021-05-17 07:43:44
ArtExtremeBrands #Google,74,0.0,1.0,0.0,0.0,2021-05-17 07:43:24
Get amazing deal selling your used old locked broken financed amp Bad ESN cell phones with Recell Cellular,201,0.26,0.591,0.15,-0.4215,2021-05-17 07:42:31
Obsessed with knowing every Google ranking factor Here are five the best resources for info Google ranking factors,4030,0.078,0.731,0.192,0.5423,2021-05-17 07:42:05
Parcel Forwarding Poland #Google,215,0.0,1.0,0.0,0.0,2021-05-17 07:41:53
Check out Gig #Fiverr #google #scraping for #search results #business,167,0.0,1.0,0.0,0.0,2021-05-17 07:41:50
SevenMentor AutoCAD Training #Google,68,0.0,1.0,0.0,0.0,2021-05-17 07:40:41
Parcel Forwarding Poland #Google,215,0.0,1.0,0.0,0.0,2021-05-17 07:39:14
The Google world account Stay tuned #Google #Alphabet #YouTube #GoogleEarth #Constellatio,12,0.0,1.0,0.0,0.0,2021-05-17 07:38:14
Follow for more free signals thanks #Google #Bitcoin BTC,82,0.0,0.509,0.491,0.7755,2021-05-17 07:37:15
Instagram will soon let you create posts desktop Check out #Instagram #Desktop,0,0.0,0.84,0.16,0.2732,2021-05-17 07:36:58
Check out National Productivity Council Google Please follow NPC Google and stay tuned,108,0.0,0.839,0.161,0.3182,2021-05-17 07:36:44
Grandioso Travel amp Tours #Google Always Summer Somewhere Join PAL Summer promo and experience,6,0.0,0.855,0.145,0.296,2021-05-17 07:36:07
Check out National Productivity Council Google Please follow NPC Google and stay tuned,180,0.0,0.839,0.161,0.3182,2021-05-17 07:35:20
Instagram will soon let you create posts desktop Check out #Instagram #Desktop,14,0.0,0.84,0.16,0.2732,2021-05-17 07:35:06
Purfect Choice Pets Plus #Google,115,0.0,1.0,0.0,0.0,2021-05-17 07:35:03
Speech Text Google Speech Amazon Transcribe Via #SpeechtoText #voicerecognit,4334,0.0,0.825,0.175,0.1779,2021-05-17 07:34:20
srinarmadaittraining com #angular #angularjs #react #reactjs #backend #backenddeveloper #fron,3858,0.0,1.0,0.0,0.0,2021-05-17 07:34:18
srinarmadaittraining com #angular #angularjs #react #reactjs #backend,10,0.0,1.0,0.0,0.0,2021-05-17 07:34:13
Instagram will soon let you create posts desktop Check out #Instagram #Desktop,14,0.0,0.84,0.16,0.2732,2021-05-17 07:34:01
Besides now for every bank card payment take money from the atm need turn off smartphone Probl,84,0.0,1.0,0.0,0.0,2021-05-17 07:33:51
Check out National Productivity Council Google Please follow NPC Google and stay tuned,248,0.0,0.839,0.161,0.3182,2021-05-17 07:33:29
can agree more #Technology enabler that brings everyone the same plane #tech #MondayMotivaton #backgroundch,3104,0.0,0.839,0.161,0.3612,2021-05-17 07:33:06
can agree more #Technology enabler that brings everyone the same plane #tech #MondayMotivaton #backgroundch,1333,0.0,0.839,0.161,0.3612,2021-05-17 07:33:02
Speech Text Google Speech Amazon Transcribe Via #SpeechtoText #voicerecogni,1333,0.0,0.825,0.175,0.1779,2021-05-17 07:32:46
started learning flutter couple months ago and have learnt alot these couple months Starting tomorrow,200,0.0,1.0,0.0,0.0,2021-05-17 07:32:35
have all seen the wonderful #googlepixel product renders from but what about this Google Pixel sma,129,0.0,0.865,0.135,0.3291,2021-05-17 07:32:22
the installers who are wondering how our products are installed here are the guidelines below Run the wires and you,107,0.0,1.0,0.0,0.0,2021-05-17 07:31:44
Speech Text Google Speech Amazon Transcribe Via #SpeechtoText,4334,0.0,0.805,0.195,0.1779,2021-05-17 07:31:33
the installers who are wondering how our products are installed here are the guidelines below Run the wires and you,973,0.0,1.0,0.0,0.0,2021-05-17 07:31:20
#SEO Pagination Guide Best Practices and Advanced Methods part #guide #pagination #google,344,0.0,0.617,0.383,0.7351,2021-05-17 07:30:50
the installers who are wondering how our products are installed here are the guidelines below Run the wires,50,0.0,1.0,0.0,0.0,2021-05-17 07:30:45
Check out some new design elements Android ahead Google,484326,0.0,1.0,0.0,0.0,2021-05-17 07:30:34
Google Search Ranking Algorithm Latest Updates #seo #digitalmarketer,1328,0.0,1.0,0.0,0.0,2021-05-17 07:30:14
The latest #crypto hit the headlines Internet Computer Within days its launch hit market cap,67,0.0,1.0,0.0,0.0,2021-05-17 07:30:13
there way see how many unique visitors #GoogleSheets doc gets #Google #seo,1328,0.0,1.0,0.0,0.0,2021-05-17 07:30:10
Optimizing Your Content Become the Google Featured Snippet #Google,1328,0.0,0.727,0.273,0.4588,2021-05-17 07:29:57
Inspiration Motivation Digitals work for you #ecommerce #MarketingDigital #chatbots #socia,963,0.0,0.58,0.42,0.7003,2021-05-17 07:29:19
weeks left before your Google Photos uploads start eat into your account storage Video,14,0.0,1.0,0.0,0.0,2021-05-17 07:28:59
will your clickfunnels expert will design one funnel page for just designs are amazing responsive conve,126,0.0,0.637,0.363,0.7506,2021-05-17 07:28:58
#Denon Home Wireless Speaker Stereo speaker with Bluetooth #Wifi AirPlay #Google Assistant Siri Alexa,92,0.0,1.0,0.0,0.0,2021-05-17 07:28:24
Google Patents Under Display Camera system for its Pixel Smartphones #Google #GoogleIO,543,0.0,1.0,0.0,0.0,2021-05-17 07:27:08
Check out National Productivity Council Google Please follow NPC Google and stay tuned,393,0.0,0.839,0.161,0.3182,2021-05-17 07:27:03
How Use Google Lens Android Phone Tips Google Search via,772,0.0,1.0,0.0,0.0,2021-05-17 07:25:45
New PowerBI Course English Build Amazing Dashboards and take your work the next level,7298,0.0,0.774,0.226,0.5859,2021-05-17 07:25:05
Have you noticed something relatively new the SERPs Here what online sellers need know about Google Top,888,0.0,0.899,0.101,0.2023,2021-05-17 07:24:56
John Mueller was asked FAQ structured data still produces rich results explained the fine tuning process for,888,0.0,0.735,0.265,0.6597,2021-05-17 07:24:54
replacement for Google Structured Data Testing Tool called the Schema Markup Validator now available,888,0.0,1.0,0.0,0.0,2021-05-17 07:24:49
John Mueller was asked FAQ structured data still produces rich results explained the fine tuning process for,888,0.0,0.735,0.265,0.6597,2021-05-17 07:24:46
critical #google #art #digitalart #butisitart #criticalroleofart #googlepredictions #whatwouldgooglesay about,13,0.223,0.777,0.0,-0.3182,2021-05-17 07:24:15
Google Pixel Pro will feature Periscopic telephoto lens #Google #Pixel Pro,4,0.0,1.0,0.0,0.0,2021-05-17 07:24:00
Google developer conference back the May and these are some educated guesses what expect,342,0.0,1.0,0.0,0.0,2021-05-17 07:23:49
Google the internet #google #googl #goog #stock #market #tech #technology #epic #internet #monster,206,0.0,1.0,0.0,0.0,2021-05-17 07:23:46
secure global #serverless #cloudprint management amp support,665,0.0,0.495,0.505,0.6249,2021-05-17 07:23:23
can agree more #Technology enabler that brings everyone the same plane #tech #MondayMotivaton,1068,0.0,0.828,0.172,0.3612,2021-05-17 07:23:11
#RT Riafy was the first Indian developer showcased Google Android largest annual event,182,0.0,1.0,0.0,0.0,2021-05-17 07:22:46
#mondaymotivation #google #googlereview #googlemybuisness #customerreview Very good service Friendly staff Tha,2514,0.0,0.575,0.425,0.7688,2021-05-17 07:21:58
How Install And Update Multiple Apps Your Laptop Once Check out And please Like Share and Subscribe,4445,0.0,0.667,0.333,0.7184,2021-05-17 07:20:32
Australia Media Code Battle and Government Regulation Tech Giants,266,0.245,0.755,0.0,-0.3818,2021-05-17 07:20:05
Inspiration Motivation Digitals work for you #ecommerce #MarketingDigital #chatbots,16,0.0,0.547,0.453,0.7003,2021-05-17 07:20:04
How Install And Update Multiple Apps Your Laptop Once Check out And please Like Share and Subscribe,727,0.0,0.667,0.333,0.7184,2021-05-17 07:19:55
How Install And Update Multiple Apps Your Laptop Once Check out And please Like Share and Subscribe,971,0.0,0.667,0.333,0.7184,2021-05-17 07:19:41
How Install And Update Multiple Apps Your Laptop Once Check out And please Like Share and Subscribe,1293,0.0,0.667,0.333,0.7184,2021-05-17 07:19:32
How Install And Update Multiple Apps Your Laptop Once Check out And please Like Share and Subscribe,3858,0.0,0.667,0.333,0.7184,2021-05-17 07:19:27
How Install And Update Multiple Apps Your Laptop Once Check out And please Like Share and Subscribe,18,0.0,0.667,0.333,0.7184,2021-05-17 07:19:22
Does Google Gives Preference Content Above the Fold #Google #SEO #Website via,2054,0.0,1.0,0.0,0.0,2021-05-17 07:19:09
Hadith the Day #Hadith #Goldenwords #updatesonislam #Tumblr #Linkedin #Googleplus #Facebook #Pinterest #Twitter,600,0.0,1.0,0.0,0.0,2021-05-17 07:18:16
Golden Words #Hadith #Goldenwords #updatesonislam #Tumblr #Linkedin #Googleplus #Facebook #Pinterest #Twitter #Instagra,600,0.0,1.0,0.0,0.0,2021-05-17 07:18:07
The Best Advice #Hadith #Goldenwords #updatesonislam #Tumblr #Linkedin #Googleplus #Facebook #Pinterest #Twitter #Insta,600,0.0,0.741,0.259,0.6369,2021-05-17 07:18:04
Homemade Beetroot Powder #beetrootpowder #dessert #homemade #health #fitness #Google #healthyfood #nutrition #vegan #Natur,244,0.0,1.0,0.0,0.0,2021-05-17 07:17:02
Google SpaceX partnership #blockchain #AWSSummit #ArtificialIntelligence #Clubhouse #DigitalTransformation #cybersecurity,1461,0.0,1.0,0.0,0.0,2021-05-17 07:16:58
How improve SEO for free #seo #blogger #google #digitalmarketingtips #marketing #blogging #busine,3438,0.0,0.617,0.383,0.7351,2021-05-17 07:16:56
Moutan Flowers #Google #mondaymotivation #peonyseason,984,0.0,1.0,0.0,0.0,2021-05-17 07:16:53
How Check When Your Google Meet Codes Expire #Google #GoogleMeet #GoogleWorkspace #Update via,2021,0.0,1.0,0.0,0.0,2021-05-17 07:15:35
How improve SEO for free #seo #blogger #google #digitalmarketingtips #marketing,695,0.0,0.563,0.437,0.7351,2021-05-17 07:15:19
wish #Google could takeover #Facebook cuz the way works doesn work for any business Facebook horrible,134,0.173,0.693,0.134,-0.2023,2021-05-17 07:13:40
The Google world account Stay tuned #Google #Alphabet #YouTube #GoogleEarth #Constellatio,0,0.0,1.0,0.0,0.0,2021-05-17 07:13:26
Homemade Beetroot Powder #beetrootpowder #dessert #homemade #health #fitness #Google #healthyfood #nutrition,10,0.0,1.0,0.0,0.0,2021-05-17 07:13:22
#translation #service #mongolia #english #TEP #LSP #achievement #lookingback #Google translation,937,0.0,1.0,0.0,0.0,2021-05-17 07:13:20
#Googledevices #googlecloud #google #cloudcomputing #cloudstorage What the maximum limit free cloud storage Google device,55,0.0,0.798,0.202,0.5106,2021-05-17 07:11:59
Check out National Productivity Council Google Please follow NPC Google and stay tuned,228,0.0,0.839,0.161,0.3182,2021-05-17 07:11:51
Hello everyone Are you looking for line art design vector tracing Please hire Fiverr,360,0.0,0.85,0.15,0.3182,2021-05-17 07:11:16
Portcullis Legals Wills Power Attorney Probate amp Trusts Specialists #Google,428,0.0,0.744,0.256,0.4767,2021-05-17 07:10:55
The Best Advice #Hadith #Goldenwords #updatesonislam #Tumblr #Linkedin #Googleplus #Facebook #Pinterest #Twitter,89,0.0,0.724,0.276,0.6369,2021-05-17 07:10:24
Golden Words #Hadith #Goldenwords #updatesonislam #Tumblr #Linkedin #Googleplus #Facebook #Pinterest #Twitter,89,0.0,1.0,0.0,0.0,2021-05-17 07:10:13
Hadith the Day #Hadith #Goldenwords #updatesonislam #Tumblr #Linkedin #Googleplus #Facebook #Pinterest,89,0.0,1.0,0.0,0.0,2021-05-17 07:10:06
Google SpaceX partnership #blockchain #AWSSummit #ArtificialIntelligence #Clubhouse #DigitalTransformation #cybersecurity,15911,0.0,1.0,0.0,0.0,2021-05-17 07:09:43
Check out most recent article Medium where detailed all the tips and tricks that used land offer,1460,0.086,0.914,0.0,-0.128,2021-05-17 07:08:25
ICYMI Episode the #inconversationwith podcast with now live You can listen wherever you get,3249,0.0,1.0,0.0,0.0,2021-05-17 07:08:25
#Formatting Service ebook Paperback will provide you with digital files for #Kindle #Apple #Nook #Kobo and #Goog,323,0.0,1.0,0.0,0.0,2021-05-17 07:08:02
#Formatting Service ebook Paperback will provide you with digital files for #Kindle #Apple #Nook #Kobo and #Goog,5744,0.0,1.0,0.0,0.0,2021-05-17 07:07:43
#RT Riafy was the first Indian developer showcased Google Android largest annual event,71,0.0,1.0,0.0,0.0,2021-05-17 07:07:42
replacement for Google Structured Data Testing Tool called the Schema Markup Validator now available use,530,0.0,1.0,0.0,0.0,2021-05-17 07:07:34
Check out National Productivity Council Google Please follow NPC Google and stay tuned,248,0.0,0.839,0.161,0.3182,2021-05-17 07:07:03
Google Business GMB important tool for local Search Engine Optimisation SEO with local SEO being,158,0.0,0.747,0.253,0.5267,2021-05-17 07:06:56
Life skills education #Google,114,0.0,1.0,0.0,0.0,2021-05-17 07:06:54
#Formatting Service ebook Paperback will provide you with digital files for #Kindle #Apple #Nook #Kobo and,32882,0.0,1.0,0.0,0.0,2021-05-17 07:06:06
Check out National Productivity Council Google Please follow NPC Google and stay tuned,65,0.0,0.839,0.161,0.3182,2021-05-17 07:05:25
Always make your own research about any #Crypto About #BitcoinZ you can read here #BTCZ #BitcoinZ,459,0.0,1.0,0.0,0.0,2021-05-17 07:05:22
New PowerBI Course English Build Amazing Dashboards and take your work the next level,160,0.0,0.774,0.226,0.5859,2021-05-17 07:05:05
All About Google Dorks from #work #google #hacking #databases,324,0.158,0.842,0.0,-0.128,2021-05-17 07:03:32
Transform your #Google Chrome browser into powerful #SEO tool with these best SEO Chrome extensions,3577,0.0,0.65,0.35,0.7906,2021-05-17 07:03:01
Check out National Productivity Council Google Please follow NPC Google and stay tuned,257,0.0,0.839,0.161,0.3182,2021-05-17 07:01:03
eGovWatch Free now railway stations #Digital #PSU #DoT #Google #MinistryOfRailways,2700,0.0,0.732,0.268,0.5106,2021-05-17 07:00:39
Check out National Productivity Council Google Please follow NPC Google and stay tuned,64,0.0,0.839,0.161,0.3182,2021-05-17 07:00:18
Cool #franklinlakes #wyckoff #oaklandnj #franklinlakesmoms #technology #jmor #google #adobe,407,0.0,0.777,0.223,0.3182,2021-05-17 07:00:05
#OccupiedPalestine correct map #google,109,0.0,1.0,0.0,0.0,2021-05-17 06:58:44
Swim Life swimming Classes Dubai #Google,290,0.0,1.0,0.0,0.0,2021-05-17 06:58:22
Popular #News Trend Read Popular News the Explore whats #Trending Live around the globe Popular News Tre,107,0.0,0.625,0.375,0.8126,2021-05-17 06:57:25
Speech Text Google Speech Amazon Transcribe Via #SpeechtoText,1029,0.0,0.805,0.195,0.1779,2021-05-17 06:57:22
#RT Riafy was the first Indian developer showcased Google Android largest annual event,193,0.0,1.0,0.0,0.0,2021-05-17 06:57:18
Are you using Google Trends gain your competitive edge Learn tips for how you can use Google Trends for better SEO,1228,0.0,0.692,0.308,0.7906,2021-05-17 06:57:10
Full Potential Learning Academy FPLA #Google Salient Features FPLA Virtual Classr,157,0.0,0.826,0.174,0.2732,2021-05-17 06:57:03
Diligence consciously paying proper attention given task and also giving the right amount care and conce,64,0.0,0.714,0.286,0.6808,2021-05-17 06:56:52
Final Fantasy director Paralympics RPG launching next month from #google,227,0.0,1.0,0.0,0.0,2021-05-17 06:54:27
Sure the evil one Tell more about the over forced labor concentratio,53,0.396,0.481,0.123,-0.7269,2021-05-17 06:53:59
Google What Can Say #google #googl #stock #tech #internet #goog #technology #epic #monster,206,0.0,1.0,0.0,0.0,2021-05-17 06:53:46
Phone cleaner will helps boost your phones speed while removing log files apk files temp files empty files and,578,0.076,0.63,0.294,0.6369,2021-05-17 06:53:32
Best #Gmail Tools Supercharge Your Email Experience #Google,13344,0.0,0.625,0.375,0.6369,2021-05-17 06:52:45
#Google What Going With FAQ Rich Results #seo #seotips,940,0.0,0.69,0.31,0.5574,2021-05-17 06:51:53
Check out National Productivity Council Google Please follow NPC Google and stay tuned,123,0.0,0.839,0.161,0.3182,2021-05-17 06:51:31
make this really sadistic doctor who has proven that physical pain felt one person also felt som,8,0.171,0.829,0.0,-0.5106,2021-05-17 06:51:25
Check out National Productivity Council Google Please follow NPC Google and stay tuned,398,0.0,0.839,0.161,0.3182,2021-05-17 06:51:20
ISRO amp MapmyIndia build alternative Google Maps #ISRO India answer #NASA #MapmyIndia that,149,0.0,1.0,0.0,0.0,2021-05-17 06:51:09
Google and Unite for Starlink Satellite Internet #starlink #starlinksatellite #spacex #StarlinkNews,454,0.0,1.0,0.0,0.0,2021-05-17 06:50:27
Cloud computing often far more secure than traditional computing you agree with this Get touch with know,455,0.0,0.743,0.257,0.6361,2021-05-17 06:49:49
Google Pixel Will Come With Unique Design and Have Cameras #Gadget #Google,153,0.0,1.0,0.0,0.0,2021-05-17 06:49:24
google #Google,13,0.0,1.0,0.0,0.0,2021-05-17 06:49:22
Check out National Productivity Council Google Please follow NPC Google and stay tuned,194,0.0,0.839,0.161,0.3182,2021-05-17 06:47:12
Check out National Productivity Council Google Please follow NPC Google and stay tuned,78,0.0,0.839,0.161,0.3182,2021-05-17 06:46:53
#Google phasing out third party #cookies Companies dependent them understand their clients custome,1158,0.0,0.816,0.184,0.4019,2021-05-17 06:46:47
The other recipients #VentureCapital dollars that missing #AWS for hosting and #Google #Facebook for ads #SiliconVall,10322,0.128,0.872,0.0,-0.296,2021-05-17 06:45:08
Big SEO netlinking positionnement punchlines via #SEO #google,1988,0.0,1.0,0.0,0.0,2021-05-17 06:45:01
