tweet,follower_count,neg,neu,pos,compound,time
Google Business Categories List Updated for,70,0.0,1.0,0.0,0.0,2021-06-20 00:30:00
The Future Video Marketing Growth and Demand #iot #ai #chatbot #digitalmarketing #socia,5331,0.106,0.709,0.184,0.2732,2021-06-20 00:29:54
Top ebay Alternatives The Best Marketplaces Sell #adtech #advertising,2917,0.0,0.538,0.462,0.7184,2021-06-20 00:29:39
The Future Video Marketing Growth and Demand #iot #ai #chatbot #digitalmarketing #socia,1503,0.106,0.709,0.184,0.2732,2021-06-20 00:29:16
The Future Video Marketing Growth and Demand #iot #ai #chatbot #digitalmarketing,2917,0.115,0.687,0.198,0.2732,2021-06-20 00:28:08
#microsoft and #google promote Microsoft and Google controlled Mozilla and Github language inside #linux #kernel,7415,0.0,0.843,0.157,0.3818,2021-06-20 00:24:14
What your Locus Control Find out here Adrian Jackson Therapy #Google,50,0.0,1.0,0.0,0.0,2021-06-20 00:21:48
The Problem With Social #apple #behavioral #democracy #economicframework #economics,11235,0.252,0.748,0.0,-0.4019,2021-06-20 00:20:02
Global Reach SEO has global reach and can even provide dynamic translation and localization that can bring,112,0.0,0.745,0.255,0.4215,2021-06-20 00:20:00
Here how setup and use Google Photos Locked Folder secure your sensitive photos and videos,90,0.0,0.854,0.146,0.34,2021-06-20 00:16:52
June buy #oneplus #device #smoothos #oneplus tpro #neversettle #beyondthespeed,119,0.0,1.0,0.0,0.0,2021-06-20 00:15:02
Google first ever retail store #Google,3257,0.0,1.0,0.0,0.0,2021-06-20 00:15:01
#RT Hear from several global academic leaders the impact #AI amp #MachineLearning Higher Education Regis,1278,0.0,1.0,0.0,0.0,2021-06-20 00:13:59
REVEALED Google Funded Gain Function COVID Research EcoHealth Alliance Who Was Collaborating With Wuhan Institu,780,0.0,0.805,0.195,0.5267,2021-06-20 00:11:24
Google Mueller Ranking Impact Poor HTML Spelling and Grammar Roger Montti,4571,0.237,0.763,0.0,-0.4767,2021-06-20 00:11:03
#RT Hear from several global academic leaders the impact #AI amp #MachineLearning Higher Education Regis,6375,0.0,1.0,0.0,0.0,2021-06-20 00:09:18
#RT Hear from several global academic leaders the impact #AI amp #MachineLearning Higher Education,109852,0.0,1.0,0.0,0.0,2021-06-20 00:09:15
Only Phenomenal Top Level #DomainName For Sale #MEV #MachineLearning #DataScience #Python,4779,0.0,0.847,0.153,0.2023,2021-06-20 00:08:10
Only Phenomenal Top Level #DomainName For Sale #MEV #MachineLearning #DataScience #Python,798,0.0,0.847,0.153,0.2023,2021-06-20 00:08:07
Only Phenomenal Top Level #DomainName For Sale #MEV #MachineLearning #DataScience #Python,16778,0.0,0.847,0.153,0.2023,2021-06-20 00:08:07
Only Phenomenal Top Level #DomainName For Sale #MEV #MachineLearning #DataScience #Python,36085,0.0,0.847,0.153,0.2023,2021-06-20 00:08:05
Only Phenomenal Top Level #DomainName For Sale #MEV #MachineLearning #DataScience #Python,16640,0.0,0.847,0.153,0.2023,2021-06-20 00:07:06
Apple and #Google New #AI Wizardry Promises #Privacy Cost #fintech #ArtificialIntell,2895,0.0,0.794,0.206,0.3818,2021-06-20 00:02:08
Apple and #Google New #AI Wizardry Promises #Privacy Cost #fintech,110235,0.0,0.776,0.224,0.3818,2021-06-20 00:01:03
What Google Search Console Google Search Console free platform that helps marketers and SEO specialists,110,0.0,0.688,0.312,0.7096,2021-06-20 00:00:37
SEO what Google uses assess the quality website pages for search results Here why crucia,8856,0.0,1.0,0.0,0.0,2021-06-20 00:00:30
FLoC the privacy scapegoat Ethan Elshyeb #ITNEXT #Google google #Tag #Tagslug #Privacy privacy,3758,0.184,0.816,0.0,-0.4019,2021-06-20 00:00:26
Google plans Android version Apple Find network via #geektech,111,0.0,1.0,0.0,0.0,2021-06-20 00:00:05
John Mueller provides rule thumb for bad HTML and explains how spelling mistakes and poor grammar,174,0.412,0.588,0.0,-0.8442,2021-06-20 00:00:00
Artificial intelligence software that can design chips faster than any human could ever #AI #Google,1002,0.0,0.819,0.181,0.4767,2021-06-19 23:59:49
#Google Maps had face would Superman kick right the nose,768,0.0,1.0,0.0,0.0,2021-06-19 23:58:16
Artificial intelligence software that can design chips faster than any human could ever #AI #Google,251,0.0,0.819,0.181,0.4767,2021-06-19 23:56:53
How Fake your Location #Google Chrome Sometimes websites may request access your location that they can,617,0.171,0.829,0.0,-0.4767,2021-06-19 23:54:35
have admit that #Fantom #DeFi powerhouse How know that did #Google always right,24,0.0,0.87,0.13,0.2023,2021-06-19 23:54:26
Steps Launch Startup Visual Infographic #marketing #digitalmarketing #business #data,2560,0.0,1.0,0.0,0.0,2021-06-19 23:54:11
#GodofAbraham #Jesus Archived #Webdesign #PHOTOS #Videos #Twitter #Google #GooglePhotos #Googlemaps,343,0.0,1.0,0.0,0.0,2021-06-19 23:52:48
Extremely Simple Ways How Boost Blog Traffic #bloggingtips #SEO #startablog #makemoneyonl,376,0.0,0.787,0.213,0.4019,2021-06-19 23:52:40
REVEALED #Google amp #USAID Funded Wuhan Institute Virology Collaborator Peter Daszak Virus Experiments For Over,391,0.0,1.0,0.0,0.0,2021-06-19 23:52:28
Extremely Simple Ways How Boost Blog Traffic #bloggingtips #SEO #startablog,2673,0.0,0.769,0.231,0.4019,2021-06-19 23:52:02
Google claims using Artificial Intelligence design chips faster than humans #ai #artific,8510,0.0,0.78,0.22,0.4767,2021-06-19 23:51:46
Google claims using Artificial Intelligence design chips faster than humans #ai #artific,1247,0.0,0.78,0.22,0.4767,2021-06-19 23:51:40
REVEALED #Google amp #USAID Funded Wuhan Institute Virology Collaborator Peter Daszak Virus Experiments For Over,286,0.0,1.0,0.0,0.0,2021-06-19 23:51:33
#Google using #AI make next gen #AIchips humans are now far too slow,9036,0.0,1.0,0.0,0.0,2021-06-19 23:49:20
#GodofAbraham #Jesus Archived #Webdesign #PHOTOS #Videos #Twitter #Google #GooglePhotos #Googlemaps,343,0.0,1.0,0.0,0.0,2021-06-19 23:49:01
#CivilLiberties group takes aim the #SecretDossiers #InternetFirms keep all Please Read amp,601,0.0,0.827,0.173,0.3182,2021-06-19 23:48:59
Watch out and open #GoogleDocs with caution attackers are using new exploit spread #phishing links,194,0.282,0.718,0.0,-0.6249,2021-06-19 23:47:51
Watch out and open #GoogleDocs with caution attackers are using new exploit spread #phishing links,59,0.282,0.718,0.0,-0.6249,2021-06-19 23:47:37
Watch out and open #GoogleDocs with caution attackers are using new exploit spread #phishing links,902,0.282,0.718,0.0,-0.6249,2021-06-19 23:46:14
Amazing Action Photography #Google,222,0.0,0.441,0.559,0.5859,2021-06-19 23:46:13
Supper Fast speed optimization any website with Rocket Check page speed #speedoptim,7662,0.0,0.809,0.191,0.3818,2021-06-19 23:46:13
You can just set and forget with #SEO That why offer robust #search strategies that get you and,20,0.094,0.788,0.118,0.128,2021-06-19 23:46:02
#Google employees admit lawsuit that they made nearly impossible for users keep their location private With,202,0.107,0.791,0.102,-0.0258,2021-06-19 23:45:39
Watch out and open #GoogleDocs with caution attackers are using new exploit spread #phishing links,803,0.282,0.718,0.0,-0.6249,2021-06-19 23:45:25
Watch out and open #GoogleDocs with caution attackers are using new exploit spread #phishing links,589,0.282,0.718,0.0,-0.6249,2021-06-19 23:41:51
Supper Fast speed optimization any website with Rocket Check page speed,534,0.0,0.794,0.206,0.3818,2021-06-19 23:41:41
DogeCoin Pillows And Much More The Mystery School #Google #DogecoinToTheMoon,35,0.0,1.0,0.0,0.0,2021-06-19 23:41:36
Hear from several global academic leaders the impact #AI amp #MachineLearning Higher Education Register,1749,0.0,1.0,0.0,0.0,2021-06-19 23:40:25
Watch out and open #GoogleDocs with caution attackers are using new exploit spread #phishing links,31238,0.282,0.718,0.0,-0.6249,2021-06-19 23:39:44
Watch out and open #GoogleDocs with caution attackers are using new exploit spread #phishing links,31238,0.282,0.718,0.0,-0.6249,2021-06-19 23:39:39
COOL PHONE CASES ONLINE APPLY ANY DESIGN OTHER BRAND CASES #iPhone #Apple #Smartphones,249,0.0,0.798,0.202,0.4648,2021-06-19 23:39:31
Get your gear for next school year Support our #UpliftTitans purchasing from the link below,851,0.0,0.838,0.162,0.4019,2021-06-19 23:38:17
finally the top restaurant reviewers GOOGLE Local guides unite #google #localguide,2478,0.0,0.847,0.153,0.2023,2021-06-19 23:36:03
The lighthouse test goes dark and pops some confetti you get the highest score each category,353,0.0,1.0,0.0,0.0,2021-06-19 23:34:22
#Google #FLoC #Privacy Gone Amok,294,0.0,1.0,0.0,0.0,2021-06-19 23:34:05
Hear from several global academic leaders the impact #AI amp #MachineLearning Higher Education Register,5475,0.0,1.0,0.0,0.0,2021-06-19 23:33:03
All the hallmarks great mystery writing are here Midwest Book Review SORROW LAKE March amp,4397,0.195,0.612,0.193,-0.0085,2021-06-19 23:32:32
steps change your #Domain name without losing your rankings #SEO #google #webmaster #web,363,0.0,0.846,0.154,0.2924,2021-06-19 23:30:46
wanna know everything about totally free Justin Bieber #Google,123,0.0,0.69,0.31,0.5563,2021-06-19 23:27:00
anthony fineran europe and america itn gal #google #art,7,0.0,1.0,0.0,0.0,2021-06-19 23:26:49
Reports surfacing that YouTube banning some verticals from advertising the coveted YouTube Masthead via,416,0.0,1.0,0.0,0.0,2021-06-19 23:26:03
Watch out Android users Joker malware back Play Store #cybersecurity #android #security #malware #androidapps,2567,0.0,0.755,0.245,0.4404,2021-06-19 23:24:20
Google Nest Wifi Mesh WiFi System Wifi Router #Google #Nest #Wifi,1310,0.0,1.0,0.0,0.0,2021-06-19 23:24:00
Watch out and open #GoogleDocs with caution attackers are using new exploit spread #phishing links,837,0.282,0.718,0.0,-0.6249,2021-06-19 23:23:35
Google Nest Wifi Mesh WiFi System Wifi Router #Google #Nest,4455,0.0,1.0,0.0,0.0,2021-06-19 23:23:14
Exactly Too many firms think tech about efficiency and saving clients time when fact abo,2072,0.0,0.848,0.152,0.3612,2021-06-19 23:23:14
the buzz around #corewebvitals has been huge Even doesn hurt get little refresher what exac,9283,0.182,0.695,0.123,-0.2732,2021-06-19 23:23:02
Google Adds New Search Console Insights Provide Quick Pointers Key Website Visitor Trends Social Media Today,14931,0.0,1.0,0.0,0.0,2021-06-19 23:21:50
REVEALED #Google amp #USAID Funded Wuhan Institute Virology Collaborator Peter Daszak Virus Experiments For Over,193,0.0,1.0,0.0,0.0,2021-06-19 23:18:20
Watch out and open #GoogleDocs with caution attackers are using new exploit spread #phishing links,146,0.282,0.718,0.0,-0.6249,2021-06-19 23:15:42
Can wait for this come out #Skyclimbers #Skycon #Google #Stadia #Stadia,386,0.0,1.0,0.0,0.0,2021-06-19 23:13:05
REVEALED #Google amp #USAID Funded Wuhan Institute Virology Collaborator Peter Daszak Virus Experiments For Over,163,0.0,1.0,0.0,0.0,2021-06-19 23:12:50
clobbering time this week Ringside Rant the boys Rant about Punk and his pipe bomb promo from #AppleP,4405,0.348,0.652,0.0,-0.7906,2021-06-19 23:12:16
Can wait for this come out #Skyclimbers #Skycon #Google #Stadia #Stadia,81,0.0,1.0,0.0,0.0,2021-06-19 23:12:11
FASHION EXPRESS #Google,139,0.0,1.0,0.0,0.0,2021-06-19 23:12:03
Steps Launch Startup Visual Infographic #marketing #digitalmarketing #business #data #google #ai #success,509,0.0,1.0,0.0,0.0,2021-06-19 23:11:20
search engine optimization important Yes Check out this quick fact about #SearchEngineOptimization #Google #Ma,166,0.0,0.608,0.392,0.7269,2021-06-19 23:10:54
Watch out Android users Joker malware back Play Store #cybersecurity #android #security #malware #androidapps,2567,0.0,0.755,0.245,0.4404,2021-06-19 23:10:54
Realtor Terri Boysaw Max Champions Fontana #Google,47,0.0,0.638,0.362,0.5267,2021-06-19 23:10:23
great write how #google #gcp dominant the #analytics #ai and #MachineLearning space #publiccloud #clo,1278,0.0,0.76,0.24,0.6249,2021-06-19 23:08:56
Check out this new digital art that uploaded #Woman #Dress #Hat,332,0.0,1.0,0.0,0.0,2021-06-19 23:08:31
you think failure the end then think again Tune into remoteBase listen Bhaskar Mehta about the highs and low,123,0.241,0.759,0.0,-0.6597,2021-06-19 23:06:03
Threat actors using #Google Docs exploit spread #phishing links,1041,0.407,0.593,0.0,-0.5859,2021-06-19 23:01:09
Threat actors using #Google Docs exploit spread #phishing links,15232,0.407,0.593,0.0,-0.5859,2021-06-19 23:00:22
What more secure than complex password according #Google more password all,15232,0.0,0.788,0.212,0.4005,2021-06-19 23:00:22
Gym Truck Chico #Google,343,0.0,1.0,0.0,0.0,2021-06-19 22:54:06
Steps Launch Startup Visual Infographic #marketing #digitalmarketing #business #data #google #ai #success,7662,0.0,1.0,0.0,0.0,2021-06-19 22:53:08
Watch out and open #GoogleDocs with caution attackers are using new exploit spread #phishing links,993,0.282,0.718,0.0,-0.6249,2021-06-19 22:51:56
This App The Developers Incompetents Every Apps Have Few Here There But Not Like Google Every Updates,295,0.143,0.857,0.0,-0.395,2021-06-19 22:49:29
have admit that #Fantom #DeFi powerhouse How know that did #Google always right,23,0.0,0.87,0.13,0.2023,2021-06-19 22:48:41
Steps Launch Startup Visual Infographic #marketing #digitalmarketing #business #data #google #ai #success,1409,0.0,1.0,0.0,0.0,2021-06-19 22:48:34
great write how #google #gcp dominant the #analytics #ai and #MachineLearning space #publiccloud,1541,0.0,0.745,0.255,0.6249,2021-06-19 22:45:49
Machine Learning with MacBook GPU Google Colab Tesla GPU pays use the right tool for the right,1525,0.0,1.0,0.0,0.0,2021-06-19 22:45:09
hours now amp this train has only moved But okay #viarail gave water and cookie refund hotel accommodat,2762,0.0,0.879,0.121,0.3291,2021-06-19 22:44:43
hours now amp this train has only moved But okay #viarail gave water and cookie refund hotel,4,0.0,0.872,0.128,0.3291,2021-06-19 22:44:19
Understanding The New Google Analytics and Its Event Parameters #Google,1515,0.0,1.0,0.0,0.0,2021-06-19 22:44:03
Google Adds New Search Console Insights Provide Quick Pointers Key Website Visitor Trends Social Media Toda,4440,0.0,1.0,0.0,0.0,2021-06-19 22:44:01
#home #homes #forsale #homeforsale #realestate #realtor #realtors #sweethome #homesweethome #homebuying #sell,47,0.0,1.0,0.0,0.0,2021-06-19 22:43:55
Speaking roadmaps EVERY street London now has contraflow roadworks with workers Satnavs are,83,0.0,1.0,0.0,0.0,2021-06-19 22:42:03
just published video exploring #Stadia #Google,13,0.0,1.0,0.0,0.0,2021-06-19 22:42:03
Red Rocks Music Festival #Google,607,0.0,0.556,0.444,0.4939,2021-06-19 22:41:54
ATC #Google,343,0.0,1.0,0.0,0.0,2021-06-19 22:41:16
#CaliLili #SustainableCinema #HandMadeToMakeADifference #Oscars Contender htt,5452,0.0,0.769,0.231,0.128,2021-06-19 22:39:02
What social engineering #cyberarms #AI #DataScience #cybersecurity #BigData #CyberAttack #password #Java #YouTube,4,0.0,1.0,0.0,0.0,2021-06-19 22:38:44
#CaliLili #SustainableCinema #HandMadeToMakeADifference #Oscars Contender,5452,0.0,0.727,0.273,0.128,2021-06-19 22:38:42
#CaliLili #SustainableCinema #HandMadeToMakeADifference #Oscars Contender,5452,0.0,0.727,0.273,0.128,2021-06-19 22:38:01
Buy Old Gmail Accounts Buy Old Gmail accounts the most popular email service the world #buygmailaccounts #BuyOldGmailA,166,0.0,0.838,0.162,0.4754,2021-06-19 22:35:54
Steps Launch Startup Visual Infographic #marketing #digitalmarketing #business #data,952,0.0,1.0,0.0,0.0,2021-06-19 22:35:38
REVEALED #Google amp #USAID Funded Wuhan Institute Virology Collaborator Peter Daszak Virus Experiments For Over,87,0.0,1.0,0.0,0.0,2021-06-19 22:34:55
Autoworks Specialists Apple Valley #Google,343,0.0,1.0,0.0,0.0,2021-06-19 22:34:44
Autoworks Smog #Google,343,0.524,0.476,0.0,-0.296,2021-06-19 22:32:17
Watch out Android users Joker malware back Play Store #cybersecurity #android #security #malware #androidapps,4779,0.0,0.755,0.245,0.4404,2021-06-19 22:31:45
Watch out Android users Joker malware back Play Store #cybersecurity #android #security #malware #androidapps,2660,0.0,0.755,0.245,0.4404,2021-06-19 22:31:33
Watch out Android users Joker malware back Play Store #cybersecurity #android #security #malware #androidapps #infose,2567,0.0,0.769,0.231,0.4404,2021-06-19 22:30:55
Could hardly agree more don have lose time because won create European #Google,1432,0.148,0.451,0.401,0.6179,2021-06-19 22:27:58
REVEALED #Google amp #USAID Funded Wuhan Institute Virology Collaborator Peter Daszak Virus Experiments For Over,264,0.0,1.0,0.0,0.0,2021-06-19 22:25:49
#CrimeLords #PuppetMasters and #DisinfoSpecialists #Google want rename colours they are not #racist,3154,0.0,0.894,0.106,0.0772,2021-06-19 22:24:45
Google force installs Massachusetts MassNotify Android COVID app #Security #Google,597,0.0,1.0,0.0,0.0,2021-06-19 22:24:34
Google the internet #google #googl #goog #stock #market #tech #technology #epic #internet #monster,210,0.0,1.0,0.0,0.0,2021-06-19 22:23:46
Watch out Android users Joker malware back Play Store #cybersecurity #android #security #malware #androidapps,2567,0.0,0.755,0.245,0.4404,2021-06-19 22:23:40
#CaliLili #SustainableCinema #HandMadeToMakeADifference #Oscars Contender,5452,0.0,0.727,0.273,0.128,2021-06-19 22:22:35
#CaliLili #SustainableCinema #HandMadeToMakeADifference #Oscars Contender,5452,0.0,0.727,0.273,0.128,2021-06-19 22:22:21
REVEALED Google amp USAID Funded Wuhan Collaborator Peter Daszak Virus Experiments For Over Decade #google,172,0.0,1.0,0.0,0.0,2021-06-19 22:21:00
American Tree Company #Google,343,0.0,1.0,0.0,0.0,2021-06-19 22:20:29
Shelly Eshelman Realty #Google,1399,0.0,1.0,0.0,0.0,2021-06-19 22:18:59
Watch out and open #GoogleDocs with caution attackers are using new exploit spread #phishing links,794,0.282,0.718,0.0,-0.6249,2021-06-19 22:18:10
Google Docs Master Course hours students May release LINK,2361,0.0,1.0,0.0,0.0,2021-06-19 22:18:09
Google Select com The seven Bucks com Alibaba cart com Faugi com Soldier All are available for sale,1986,0.0,1.0,0.0,0.0,2021-06-19 22:18:04
Google force installs Massachusetts MassNotify app Android phones #Security #Google,597,0.0,1.0,0.0,0.0,2021-06-19 22:17:34
Reminder #Google Photos Will Start Charging You One Month Digital Trends #SocialMedia,60125,0.0,1.0,0.0,0.0,2021-06-19 22:17:00
Google Select com The seven Bucks com Alibaba cart com Faugi com Soldier All are available for sale,651,0.0,1.0,0.0,0.0,2021-06-19 22:15:22
Google Select com The seven Bucks com Alibaba cart com Faugi com Soldier All are available for sale,10,0.0,1.0,0.0,0.0,2021-06-19 22:15:17
REVEALED #Google amp #USAID Funded Wuhan Institute Virology Collaborator Peter Daszak Virus Experiments For Over,13,0.0,1.0,0.0,0.0,2021-06-19 22:13:26
Steps Launch Startup Visual Infographic #marketing #digitalmarketing #business #data,4319,0.0,1.0,0.0,0.0,2021-06-19 22:11:16
thought leader with expert content freelance marketing and writing services Hire standout #contentmarketing,195,0.0,0.845,0.155,0.296,2021-06-19 22:10:02
#Google believes that technology should improve life not distract from and couldn agree more were prou,424,0.0,0.641,0.359,0.7421,2021-06-19 22:10:00
REVEALED #Google amp #USAID Funded Wuhan Institute Virology Collaborator Peter Daszak Virus Experiments For Over,7098,0.0,1.0,0.0,0.0,2021-06-19 22:09:58
ONE MORE REASON NEVER TRUST GOOGLE #Google and #USAID funded #Wuhan collaborator #PeterDaszak virus experimen,9159,0.229,0.771,0.0,-0.6331,2021-06-19 22:08:32
Watch out Android users Joker malware back Play Store #cybersecurity #android #security #malware #androidapps,2567,0.0,0.755,0.245,0.4404,2021-06-19 22:07:26
Rizwan Photography #Google INTIMATE WEDDING #WEDDINGPHOTOGRAPHY Special Discount Offer,577,0.0,0.748,0.252,0.4019,2021-06-19 22:06:44
Ditch Google Chrome for something better Linux #Google #Chrome #Linux,33,0.0,0.756,0.244,0.4404,2021-06-19 22:06:25
Cruise Planners Gregory Lane #Google,110,0.0,1.0,0.0,0.0,2021-06-19 22:05:32
#Google searches Juneteenth flag old,3315,0.0,1.0,0.0,0.0,2021-06-19 22:03:15
Critical Defense Group #Google,139,0.397,0.345,0.259,-0.2023,2021-06-19 22:02:28
Sneak Preview Brave Search Challenger Google via #google #brave #using #users,2485,0.0,0.647,0.353,0.5994,2021-06-19 22:01:08
Get #Google strongest security protect your data from today evolving threats Watch What Google Adv,229,0.129,0.507,0.364,0.6249,2021-06-19 22:00:47
#internet #pioneer Vint Cerf featured this authenticated #autographed photo from VeriSigned,74,0.0,1.0,0.0,0.0,2021-06-19 22:00:13
How Make #Google #Chrome #web #browser #show #full #URL #address including #http #https #URI schemes and #www,109,0.0,1.0,0.0,0.0,2021-06-19 22:00:00
pretty astounding sites like claim they want stop fake news but won even correct simple factual,482,0.148,0.366,0.486,0.8074,2021-06-19 21:59:10
Critical Defense Group #Google,139,0.397,0.345,0.259,-0.2023,2021-06-19 21:59:09
New destruction level with background buildings and meanie The backgrounds are generated with #google Maps,1117,0.209,0.791,0.0,-0.5719,2021-06-19 21:57:56
New destruction level with background buildings and meanie The backgrounds are generated with #google Maps,85,0.209,0.791,0.0,-0.5719,2021-06-19 21:57:51
Learn object oriented programming principles creating your own text based adventure game #Python Supported,1500,0.0,0.618,0.382,0.7003,2021-06-19 21:56:29
Learn object oriented programming principles creating your own text based adventure game #Python Supported,1599,0.0,0.618,0.382,0.7003,2021-06-19 21:56:29
Learn object oriented programming principles creating your own text based adventure game #Python Supported,679,0.0,0.618,0.382,0.7003,2021-06-19 21:56:23
Google What Can Say #google #googl #stock #tech #internet #goog #technology #epic #monster,210,0.0,1.0,0.0,0.0,2021-06-19 21:53:46
Steps Launch Startup Visual Infographic #marketing #digitalmarketing #business #data,283,0.0,1.0,0.0,0.0,2021-06-19 21:51:50
Game Time #apexlegends #apex #entrepreneurship #valorant #trade #microsoft #amazon #playapex #etsyfinds #apple #cryptoc,201,0.0,1.0,0.0,0.0,2021-06-19 21:51:03
REVEALED #Google amp #USAID Funded Wuhan Institute Virology Collaborator Peter Daszak Virus Experiments For Over,387,0.0,1.0,0.0,0.0,2021-06-19 21:50:27
Game Time #apexlegends #apex #entrepreneurship #valorant #trade #microsoft #amazon #playapex #etsyfinds #apple,250,0.0,1.0,0.0,0.0,2021-06-19 21:50:02
you looking for smart display with large screen this one from #Google has you covered #smarthome,5,0.0,0.847,0.153,0.4019,2021-06-19 21:49:43
Watch out and open #GoogleDocs with caution attackers are using new exploit spread #phishing links,902,0.282,0.718,0.0,-0.6249,2021-06-19 21:49:08
Watch out and open #GoogleDocs with caution attackers are using new exploit spread #phishing links,21626,0.282,0.718,0.0,-0.6249,2021-06-19 21:48:26
#Google continues following people after they opted out location tracking And pressures device producers make,1414,0.141,0.859,0.0,-0.3182,2021-06-19 21:48:13
have admit that #Fantom #DeFi powerhouse How know that did #Google always right,390,0.0,0.87,0.13,0.2023,2021-06-19 21:47:52
Spotify Launches Greenroom Clubhouse Competitor #notesfromnet #news #breakingnews #Spotify #greenroom #Clubhou,2393,0.0,1.0,0.0,0.0,2021-06-19 21:45:04
#Google continues following people after they opted out location tracking And pressures device producers make,1370,0.141,0.859,0.0,-0.3182,2021-06-19 21:44:43
Moose River Lookout Vacation Home Rental #Google,955,0.0,1.0,0.0,0.0,2021-06-19 21:44:26
population just men work women Benefits cost billion plus houses wonder they look,1735,0.0,0.822,0.178,0.3818,2021-06-19 21:44:20
population just men work women Benefits cost billion plus houses wonder they look,525,0.0,0.822,0.178,0.3818,2021-06-19 21:43:31
please release update that allows view cameras split screen via,20,0.0,0.796,0.204,0.3182,2021-06-19 21:42:07
Google Data Studio for Data Visualization and Dashboards hours students April release,2361,0.0,1.0,0.0,0.0,2021-06-19 21:40:27
REVEALED #Google amp #USAID Funded Wuhan Institute Virology Collaborator Peter Daszak Virus Experiments For Over,4087,0.0,1.0,0.0,0.0,2021-06-19 21:39:53
REVEALED #Google amp USAID Funded #Wuhan Collaborator Peter Daszak Virus Experiments For Over Decade,596,0.0,1.0,0.0,0.0,2021-06-19 21:39:43
REVEALED #Google amp USAID Funded #Wuhan Collaborator Peter Daszak Virus Experiments For Over Decade,6286,0.0,1.0,0.0,0.0,2021-06-19 21:39:08
know more visit #google #laravel #trending #Website #phpdevelopers #javascript #fullstac,2898,0.0,1.0,0.0,0.0,2021-06-19 21:38:44
you like Learn How Using The Softwares listed below ranked Virgin Google Business Listing the pack,683,0.0,0.857,0.143,0.3612,2021-06-19 21:37:44
Create Attention Grabbing Thumbnails Clicks With The World Only Thumbnail Creation APP for YouTube Facebook,683,0.0,0.756,0.244,0.4939,2021-06-19 21:37:40
#juneteenth #juneteenth #google Redwood City California,83,0.0,1.0,0.0,0.0,2021-06-19 21:37:33
Just reminder that you should remove access your google account from the sites which you are not using #Google,1248,0.0,1.0,0.0,0.0,2021-06-19 21:37:24
Start promoting Clickbank products using Highly Effective and Proven Method Recent Income Proof from Software User,683,0.0,0.704,0.296,0.7089,2021-06-19 21:37:12
Learn How Make Money While You Make Money How Went From Day Over Month Using Google Adsense https,683,0.0,1.0,0.0,0.0,2021-06-19 21:36:31
MAFFEIS Vin Verification #Google,88,0.0,1.0,0.0,0.0,2021-06-19 21:35:37
#Spotify also announced during the #Google keynote that will soon let users download playlists and #podcasts,11,0.0,1.0,0.0,0.0,2021-06-19 21:34:42
Spotify Launches Greenroom Clubhouse Competitor #notesfromnet #news #breakingnews #Spotify #greenroom,11,0.0,1.0,0.0,0.0,2021-06-19 21:34:33
stars went medicine has just right for stars #google,7,0.0,1.0,0.0,0.0,2021-06-19 21:33:44
Massachusetts MassNotify Android app auto installed for some but COVID exposure alerts were not enabled,1836,0.0,1.0,0.0,0.0,2021-06-19 21:32:04
