tweet,follower_count,neg,neu,pos,compound,time
What about top ranked competitors who are breaking all the rules and laughing all the way the bank via,893,0.0,0.773,0.227,0.6124,2021-07-11 07:24:23
member Google Search Quality team said never seen search rankings impact from improving party autho,893,0.0,0.703,0.297,0.6705,2021-07-11 07:24:21
Google John Mueller explains that using too many internal links the same page can dilute their value and goes,893,0.0,0.882,0.118,0.34,2021-07-11 07:24:19
Link exchanges are against Google Webmaster Guidelines and can result manual penalties Learn how navigate,893,0.0,1.0,0.0,0.0,2021-07-11 07:24:15
Google John Mueller goes over what site owners need know about using multiple types schema structured data,893,0.0,1.0,0.0,0.0,2021-07-11 07:24:13
Supposedly Arkansas yet #Chicago #Google,48,0.0,1.0,0.0,0.0,2021-07-11 07:20:23
Reviews are the strongest form advertising because they are more credible consumers #reviews #advertisement,38,0.0,0.818,0.182,0.4404,2021-07-11 07:20:04
Hadith the Day #Hadith #Goldenwords #updatesonislam #Tumblr #Linkedin #Googleplus #Facebook #Pinterest #Twitter,604,0.0,1.0,0.0,0.0,2021-07-11 07:18:22
Golden Words #Hadith #Goldenwords #updatesonislam #Tumblr #Linkedin #Googleplus #Facebook #Pinterest #Twitter #Instagra,604,0.0,1.0,0.0,0.0,2021-07-11 07:18:14
Ways Measure and Tips Improve Website Engagement #page #using #website #google #form #seo via,2923,0.0,0.67,0.33,0.7096,2021-07-11 07:17:35
What about top ranked competitors who are breaking all the rules and laughing all the way the bank via,862,0.0,0.773,0.227,0.6124,2021-07-11 07:17:33
Ways Measure and Tips Improve Website Engagement #page #using #website #google #form #seo via,2489,0.0,0.67,0.33,0.7096,2021-07-11 07:17:06
Here the Samsung #Bixby entertaining does your #Siri #Google can something like this,6,0.0,0.671,0.329,0.6597,2021-07-11 07:16:25
July buy #oneplus #device #smoothos #oneplus tpro #neversettle #beyondthespeed,120,0.0,1.0,0.0,0.0,2021-07-11 07:16:02
Now help your business more visible local search results Google you also own physical location for,72,0.0,0.847,0.153,0.4019,2021-07-11 07:14:47
Golden Words #Hadith #Goldenwords #updatesonislam #Tumblr #Linkedin #Googleplus #Facebook #Pinterest #Twitter,91,0.0,1.0,0.0,0.0,2021-07-11 07:14:15
Hadith the Day #Hadith #Goldenwords #updatesonislam #Tumblr #Linkedin #Googleplus #Facebook #Pinterest,91,0.0,1.0,0.0,0.0,2021-07-11 07:13:55
The lawsuit claims that Google violates federal and state antitrust laws discouraging and preventing competition,207,0.455,0.545,0.0,-0.802,2021-07-11 07:13:38
Satguru Documentation Satguru Documentation Ramesh Nagar #Google,0,0.0,1.0,0.0,0.0,2021-07-11 07:12:52
zone Why You Suddenly Need Delete #Google Maps Your #iPhone,266,0.0,1.0,0.0,0.0,2021-07-11 07:12:13
#usher #crowder #june coup #google #ethan Smart Insulation Cup Water Bottle Led Digital Temperature Display Stainl,2,0.0,0.847,0.153,0.4019,2021-07-11 07:12:00
Shafa Home Rehabilitation Addiction Treatment Center Delhi #Google,120,0.0,1.0,0.0,0.0,2021-07-11 07:11:05
Iternal the storytelling platform and giving you the chance win Google Nest Mini and other great goodi,604,0.0,0.514,0.486,0.9062,2021-07-11 07:10:44
Advantages #machinelearning #artificialintelligence #codinghumor #datascience #programmers #codingisfun,399,0.0,0.706,0.294,0.3612,2021-07-11 07:10:22
Advantages #machinelearning #artificialintelligence #codinghumor #datascience #programmers #codingisfun,8627,0.0,0.706,0.294,0.3612,2021-07-11 07:10:01
Easy Branches Online Marketing and Web Development Software Company #Google,51528,0.0,0.756,0.244,0.4404,2021-07-11 07:09:59
Advantages #machinelearning #artificialintelligence #codinghumor #datascience #programmers #codingisfun,28,0.0,0.706,0.294,0.3612,2021-07-11 07:09:56
Easy Branches Online Marketing and Web Development Software Company #Google,51528,0.0,0.756,0.244,0.4404,2021-07-11 07:09:50
How about bringing these home too Family are conducting dig themselves,18,0.0,1.0,0.0,0.0,2021-07-11 07:09:49
Shafa Home Rehabilitation Addiction Treatment Center Delhi #Google,120,0.0,1.0,0.0,0.0,2021-07-11 07:09:47
Advantages #machinelearning #artificialintelligence #codinghumor #datascience #programmers #codingisfun,1513,0.0,0.706,0.294,0.3612,2021-07-11 07:08:57
developed Turo clone using #flutter two month called our app #ezze and will lunch soon #dubai Thank,7,0.0,0.865,0.135,0.3612,2021-07-11 07:08:47
Advantages #machinelearning #artificialintelligence #codinghumor #datascience #programmers #codingisfun,235,0.0,0.706,0.294,0.3612,2021-07-11 07:06:00
Partnering with Google for Startups helped redefine community via,736,0.0,1.0,0.0,0.0,2021-07-11 07:05:52
What New #GoogleSearchConsole Insights Analyze the performance Your Content,2273,0.0,1.0,0.0,0.0,2021-07-11 07:05:23
case you already don know here how install any #android beta #Android #android,311,0.0,1.0,0.0,0.0,2021-07-11 07:05:07
case you already don know here how install any #android beta #Android,2,0.0,1.0,0.0,0.0,2021-07-11 07:04:42
Indian Army attack Guluthi started skill development course information technology #ARMY #AMC #COVID #insiders,14,0.193,0.807,0.0,-0.4767,2021-07-11 07:03:54
Indian army Guluthi started #India #ARMY #SundayMorning #SaturdayMotivation #SaturdayMorning #motivation,14,0.0,1.0,0.0,0.0,2021-07-11 07:03:20
Partnering with Google for Startups helped redefine community via,356,0.0,1.0,0.0,0.0,2021-07-11 07:02:42
begins #stadia #google #googlestadia,129,0.0,1.0,0.0,0.0,2021-07-11 07:02:18
This Digital Marketing course provides basic advanced Social Media Marketing Courses and its they can used,13,0.0,0.882,0.118,0.25,2021-07-11 07:02:04
Easy Page SEO Tips #backlinks,462,0.0,0.58,0.42,0.4404,2021-07-11 07:01:30
begins #stadia #google #googlestadia,24,0.0,1.0,0.0,0.0,2021-07-11 07:01:16
#SEO Video When will Rich Snippets become widely available #google #seo #mattcutts,351,0.0,0.753,0.247,0.5574,2021-07-11 07:00:51
Twitter appoints resident grievance officer India comply with new internet rules #Apps #Asia #Government,1773,0.193,0.807,0.0,-0.4767,2021-07-11 07:00:10
That great Search will help you for #SpellingBee All the best finalists Good luck Thanks #Google,293,0.0,0.336,0.664,0.9628,2021-07-11 06:57:54
NICS and Business Solutions LTD #Google,909,0.0,0.746,0.254,0.1779,2021-07-11 06:57:48
Update Persists July Some #Google #Pixel phones stuck with Widevine amp quality,524,0.154,0.846,0.0,-0.25,2021-07-11 06:57:34
Great huh #usher #crowder #june coup #google #ethan,2,0.0,0.631,0.369,0.6249,2021-07-11 06:56:30
Reach Roadmap #programmingmemes #programinglife #programmer #programmerlife #programmers #tech #reactnative,235,0.0,0.879,0.121,0.0258,2021-07-11 06:54:36
your Webcam Hacked checked your computer you notice any these things happening #cyberarms #cybersecur,1039,0.172,0.828,0.0,-0.4019,2021-07-11 06:53:43
begins #stadia #google #googlestadia,28,0.0,1.0,0.0,0.0,2021-07-11 06:53:43
your Webcam Hacked checked your computer you notice any these things happening #cyberarms #cybersecur,1,0.172,0.828,0.0,-0.4019,2021-07-11 06:52:59
Word the Day Backlinks Courtesy the SEOpedia from #SEOabudhabi,160,0.0,0.762,0.238,0.3612,2021-07-11 06:52:15
Which Your Most Excited Launch Event,68,0.0,0.65,0.35,0.4005,2021-07-11 06:50:28
Pre registration Achieved Over commandants finished pre registration this time Sincerely thanks for,16,0.0,0.647,0.353,0.7184,2021-07-11 06:47:17
MANUFACTURED FACTS #GOOGLE INVENTION,1217,0.0,1.0,0.0,0.0,2021-07-11 06:46:09
begins #stadia #google #googlestadia,47,0.0,1.0,0.0,0.0,2021-07-11 06:43:40
Pre Registration Coating The smooth design significantly reduces friction while the stealth but passionate cut,16,0.186,0.588,0.225,0.4215,2021-07-11 06:42:28
#usher #crowder #june coup #google #ethan Sexy Shiny Rhinestones Masks For Women Black Bling Crystal Face Cover Masquerade,3144,0.0,0.833,0.167,0.5267,2021-07-11 06:41:46
#usher #crowder #june coup #google #ethan Sexy Shiny Rhinestones Masks For Women Black Bling Crystal Face Cover,2,0.0,0.825,0.175,0.5267,2021-07-11 06:41:44
BOUND RING amp SECRET Warm funny heartbreaking amazing story #Kindle KindleUK https,55433,0.153,0.408,0.439,0.6808,2021-07-11 06:41:39
Google video ads campaigns very effective way gain Website Traffic App Promotion Brand Awareness subs,0,0.0,0.648,0.352,0.7939,2021-07-11 06:39:57
Social media the greatest tool for digital marketing cap #Google #Dstv #WhatsApp #Nigeria,1159,0.0,0.741,0.259,0.6369,2021-07-11 06:35:01
Reach Top Google with our SEO Services call #seo #digitalmarketing #marketing,33,0.0,0.756,0.244,0.2263,2021-07-11 06:33:45
Pre Registration Coating The smooth design significantly reduces friction while the stealth but passionate cut,7,0.186,0.588,0.225,0.4215,2021-07-11 06:33:37
People are beating cancer not even able beat previous high score the Google dino game #Google #Inspi,2668,0.33,0.67,0.0,-0.8126,2021-07-11 06:33:15
#Opinion #Google App Store Antitrust Suit Right Target Wrong Idea,2893,0.256,0.744,0.0,-0.4767,2021-07-11 06:32:37
Pre Registration Coating The smooth design significantly reduces friction while the stealth but passionate cut,875,0.186,0.588,0.225,0.4215,2021-07-11 06:32:27
Stories graphical data #minutearticle #business #python #javascript DaysOfCode #OpenSourc,695,0.0,1.0,0.0,0.0,2021-07-11 06:31:34
Pre Registration Coating The smooth design significantly reduces friction while the stealth but passionate cut,110,0.186,0.588,0.225,0.4215,2021-07-11 06:31:23
Stories graphical data #minutearticle #business #python #javascript DaysOfCode #OpenSourc,2843,0.0,1.0,0.0,0.0,2021-07-11 06:30:45
Stories graphical data #minutearticle #business #python #javascript DaysOfCode #OpenSourc,2759,0.0,1.0,0.0,0.0,2021-07-11 06:30:36
Stories graphical data #minutearticle #business #python #javascript DaysOfCode,320,0.0,1.0,0.0,0.0,2021-07-11 06:30:30
#Opinion #Google App Store Antitrust Suit Right Target Wrong Idea,141444,0.256,0.744,0.0,-0.4767,2021-07-11 06:30:00
Amazon fashion link product link product,180,0.0,0.746,0.254,0.1779,2021-07-11 06:29:20
Arrays and UIUX off Amir Senator with JakePaul and JayZ opening Barclays #Internacional #ebitdata,111,0.0,1.0,0.0,0.0,2021-07-11 06:29:02
Hold the #vision Drop the #excuses Remember your #why #Trust the #process #mindset #entrepreneurship,403,0.139,0.861,0.0,-0.2732,2021-07-11 06:28:41
The Antitrust Case Against Google Becoming Too Much Like Apple The Wall Street Journal was #apple and,185,0.0,0.865,0.135,0.3612,2021-07-11 06:28:39
your Webcam Hacked checked your computer you notice any these things happening #cyberarms #cybersecur,532,0.172,0.828,0.0,-0.4019,2021-07-11 06:27:00
your Webcam Hacked checked your computer you notice any these things happening #cyberarms,35,0.184,0.816,0.0,-0.4019,2021-07-11 06:26:50
interesting section from Google Document #seo #google,170,0.0,0.69,0.31,0.4019,2021-07-11 06:26:02
Reach Roadmap #programmingmemes #programinglife #programmer #programmerlife #programmers #tech #reactnative,4161,0.0,0.879,0.121,0.0258,2021-07-11 06:22:46
Like and share this pure awesomeness #usher #crowder #june coup #google #ethan,2,0.0,0.68,0.32,0.5719,2021-07-11 06:21:46
Sunday info make things interesting now google meet have filters video call #Google #googlemeet,25,0.0,0.828,0.172,0.4019,2021-07-11 06:21:22
Vivace International School Music Vivace Houston Dun Huang Plaza #Google,9,0.0,1.0,0.0,0.0,2021-07-11 06:20:45
Reach Roadmap #programmingmemes #programinglife #programmer #programmerlife #programmers #tech #reactnative,1457,0.0,0.879,0.121,0.0258,2021-07-11 06:20:40
begins #stadia #google #googlestadia,152,0.0,1.0,0.0,0.0,2021-07-11 06:20:06
Reach Roadmap #programmingmemes #programinglife #programmer #programmerlife #programmers #tech,24,0.0,0.864,0.136,0.0258,2021-07-11 06:20:00
#Formatting Service ebook Paperback will provide you with digital files for #Kindle #Apple #Nook #Kobo,32989,0.0,1.0,0.0,0.0,2021-07-11 06:19:04
People are beating cancer not even able beat previous high score the Google dino game #Google #Inspiration,2,0.33,0.67,0.0,-0.8126,2021-07-11 06:18:47
Did you know the show Knight Rider that Kitt only had memory could still more than Andr,17,0.0,1.0,0.0,0.0,2021-07-11 06:17:51
Let have quick recap our last week share #not for expert #NetFrendz Tips Series #SEOtips #SEO #SearchEngineOptim,2923,0.0,0.879,0.121,0.296,2021-07-11 06:17:11
Indian army Guluthi started #India #ARMY #SundayMorning #SaturdayMotivation #SaturdayMorning #motivation,22,0.0,1.0,0.0,0.0,2021-07-11 06:16:56
Indian army Guluthi started #India #ARMY #SundayMorning #SaturdayMotivation #SaturdayMorning #motivation,17,0.0,1.0,0.0,0.0,2021-07-11 06:16:39
Indian Army attack Guluthi started skill development course information technology #ARMY #AMC #COVID #insiders,17,0.193,0.807,0.0,-0.4767,2021-07-11 06:16:05
Indian Army attack Guluthi started skill development course information technology #ARMY #AMC #COVID #insiders,22,0.193,0.807,0.0,-0.4767,2021-07-11 06:15:46
Let have quick recap our last week share #not for expert #NetFrendz Tips Series #SEOtips #SEO,22,0.0,0.872,0.128,0.296,2021-07-11 06:14:20
Planet goes public with SPAC valued billion #Blackrock #earthdataanalytics #Google #KochStrategicPlatforms #Ma,1540,0.0,0.791,0.209,0.4404,2021-07-11 06:14:12
Check out our #Google page and add get daily event updates and #festival reviews,863,0.0,1.0,0.0,0.0,2021-07-11 06:14:06
July buy #oneplus #device #smoothos #oneplus tpro #neversettle #beyondthespeed,120,0.0,1.0,0.0,0.0,2021-07-11 06:14:02
Canadian soldier patrols earthquake ravaged street Jacmel Haiti Gary Moore photo Real World Photogra,5799,0.0,1.0,0.0,0.0,2021-07-11 06:13:34
#usher #crowder #june coup #google #ethan Classic Luxury Real Solid Sterling Silver Ring Hearts,2,0.0,0.89,0.11,0.1531,2021-07-11 06:10:21
Indian army Guluthi started #India #ARMY #SundayMorning #SaturdayMotivation #SaturdayMorning #motivation,34,0.0,1.0,0.0,0.0,2021-07-11 06:08:03
begins #stadia #google #googlestadia,26,0.0,1.0,0.0,0.0,2021-07-11 06:07:38
Indian Army attack Guluthi started skill development course information technology #ARMY #AMC #COVID #insiders,34,0.193,0.807,0.0,-0.4767,2021-07-11 06:07:29
Pre registration Achieved Over commandants finished pre registration this time Sincerely thanks for,8,0.0,0.647,0.353,0.7184,2021-07-11 06:06:13
Studio Art Zone #Google,48,0.0,1.0,0.0,0.0,2021-07-11 06:05:53
Grateful for this featured Google News team PunjabMetro #chirasreebose #Google #news #theresbloodonyourheart,19740,0.0,0.786,0.214,0.4588,2021-07-11 06:05:19
What will replace the Big they survive #FreeSpeech #censorship #Section #Google #Twitter #Facebook,130,0.0,1.0,0.0,0.0,2021-07-11 06:04:54
begins #stadia #google #googlestadia,177,0.0,1.0,0.0,0.0,2021-07-11 06:04:44
addition PSBDMP recommend using own #Google Custom Search Engines kit search email logins and password,25,0.0,0.848,0.152,0.3612,2021-07-11 06:03:55
Indian army Guluthi started #India #ARMY #SundayMorning #SaturdayMotivation #SaturdayMorning #motivation #TREASURE #Tr,6832,0.0,1.0,0.0,0.0,2021-07-11 06:03:32
Indian Army attack Guluthi started skill development course information technology #ARMY #AMC #COVID #insiders #motiv,6832,0.181,0.819,0.0,-0.4767,2021-07-11 06:03:22
Pre Registration Coating The smooth design significantly reduces friction while the stealth but passionate cut,12,0.186,0.588,0.225,0.4215,2021-07-11 06:03:18
Are you very worried about not finding google ads and merchant expert Don worry expert have years,131,0.264,0.736,0.0,-0.659,2021-07-11 06:02:46
Indian army Guluthi started #India #ARMY #SundayMorning #SaturdayMotivation #SaturdayMorning #motivation,10,0.0,1.0,0.0,0.0,2021-07-11 06:02:44
Waiting For Update #POCOX For #Android And The #google #SecurityUpdate Last Was April Still not,22,0.0,1.0,0.0,0.0,2021-07-11 06:02:43
Indian Army attack Guluthi started skill development course information technology #ARMY #AMC #COVID #insiders,10,0.193,0.807,0.0,-0.4767,2021-07-11 06:02:19
There now been over #peachfolio app downloads from our website can wait see even more once launch the,8,0.0,1.0,0.0,0.0,2021-07-11 06:00:59
Latest video drop Are you ready for price alerts profit amp loss tracking future #Ethereum #blockchain integration and,8,0.185,0.588,0.227,0.25,2021-07-11 06:00:56
Don take kindness sign weakness #sidhumoosewala #ftharsh #harshchoudhary #google #moosetape,120,0.203,0.58,0.217,0.0516,2021-07-11 06:00:37
said and Google said setting timer for minutes #Marvel #google #myaccent,48,0.0,1.0,0.0,0.0,2021-07-11 05:59:10
Planet goes public with SPAC valued billion #Blackrock #earthdataanalytics #Google,6789,0.0,0.756,0.244,0.4404,2021-07-11 05:59:08
Pre registration Achieved Over commandants finished pre registration this time Sincerely thanks for,3,0.0,0.647,0.353,0.7184,2021-07-11 05:58:45
Pre Registration Coating The smooth design significantly reduces friction while the stealth but passionate cut,3,0.186,0.588,0.225,0.4215,2021-07-11 05:56:16
Indian army Guluthi started #India #ARMY #SundayMorning #SaturdayMotivation #SaturdayMorning #motivation #TREASURE,10970,0.0,1.0,0.0,0.0,2021-07-11 05:55:40
Indian army Guluthi started #India #ARMY #SundayMorning #SaturdayMotivation #SaturdayMorning #motivation,115,0.0,1.0,0.0,0.0,2021-07-11 05:54:28
How Fake your Location #Google Chrome Sometimes websites may request access your location that they can,619,0.171,0.829,0.0,-0.4767,2021-07-11 05:54:24
Indian Army attack Guluthi started skill development course information technology #ARMY #AMC #COVID #insiders,115,0.193,0.807,0.0,-0.4767,2021-07-11 05:53:53
These The Voyages Travel #Google Resorts back with their award winning spa getaways Learn more today,65,0.0,0.67,0.33,0.7845,2021-07-11 05:53:14
begins #stadia #google #googlestadia,25066,0.0,1.0,0.0,0.0,2021-07-11 05:51:29
Grateful for this featured Google News team PunjabMetro #chirasreebose #Google #news,967,0.0,0.769,0.231,0.4588,2021-07-11 05:50:32
#GodofAbraham #Jesus #Twitter #Pinterest #Google #Facebook #Instagram #photography #Austintx,341,0.0,1.0,0.0,0.0,2021-07-11 05:49:57
Trump announces lawsuit against Facebook Twitter and Google Dude you can make people play with you they,32,0.098,0.777,0.124,0.128,2021-07-11 05:48:35
Dear #Google Can get Millennial Wunderkinds fix glitch Google Blogger realize blogging not,546,0.0,0.822,0.178,0.3818,2021-07-11 05:48:23
What about top ranked competitors who are breaking all the rules and laughing all the way the bank via,339,0.0,0.773,0.227,0.6124,2021-07-11 05:47:31
member Google Search Quality team said never seen search rankings impact from improving party authority scor,484,0.0,0.657,0.343,0.7003,2021-07-11 05:47:15
Pre Registration Coating The smooth design significantly reduces friction while the stealth but passionate cut,10,0.186,0.588,0.225,0.4215,2021-07-11 05:46:56
That really out sight #usher #crowder #june coup #google #ethan,2,0.0,1.0,0.0,0.0,2021-07-11 05:46:43
member Google Search Quality team said never seen search rankings impact from improving party authority scor,339,0.0,0.657,0.343,0.7003,2021-07-11 05:46:25
Google John Mueller goes over what site owners need know about using multiple types schema structured data markup,423,0.0,1.0,0.0,0.0,2021-07-11 05:46:06
Google discusses the most problematic kind spam and how prevent via #Goog,339,0.318,0.427,0.255,-0.2911,2021-07-11 05:45:17
Pre Registration Coating The smooth design significantly reduces friction while the stealth but passionate cut,409,0.186,0.588,0.225,0.4215,2021-07-11 05:44:25
#Google #Microsoft #Amazon AWS #Cisco IBM HPE #LinkedIn Nvidia and #Facebook have partnered with the UAE for its,58,0.0,1.0,0.0,0.0,2021-07-11 05:44:24
Google has announced its generation tensor processing units TPUs which the company claims can complete #AI and,239,0.0,1.0,0.0,0.0,2021-07-11 05:44:21
Google John Mueller explains that using too many internal links the same page can dilute their value and goes over wha,339,0.0,0.893,0.107,0.34,2021-07-11 05:43:53
lied court secure unlawful restraints against individual Parker and allowed his clie,118,0.173,0.667,0.16,-0.0516,2021-07-11 05:43:36
How Create Custom #Google Form Step Step Guide Google has expanded its portfolio massively the last,3857,0.0,0.877,0.123,0.2732,2021-07-11 05:40:54
Google hacks #ArgentinaVsBrazil #Google #afa #argentinacampeon #messi,502,0.0,1.0,0.0,0.0,2021-07-11 05:40:32
#usher #crowder #june coup #google #ethan kafitt Pro Team Triathlon Set Women Cycling Jersey One Piece Jumpsuit,2,0.0,1.0,0.0,0.0,2021-07-11 05:39:17
Stop lining the pockets the rich with with the hard earnings the working class sWomen #miners,1541,0.178,0.644,0.178,0.25,2021-07-11 05:37:58
BoAt immortal and launching July India Drivers Breathing RGB LEDs surround,79,0.0,0.833,0.167,0.25,2021-07-11 05:34:46
will backup migrate transfer wordpress website hours #fiverr #wordpress #webdesign #back,4161,0.0,1.0,0.0,0.0,2021-07-11 05:34:38
join telegram using this code #facebook #odnoklassniki #telegram #twitter #reddit #discord #tiktok,36,0.0,0.833,0.167,0.296,2021-07-11 05:34:31
interesting section from Google Document #seo #google,69,0.0,0.69,0.31,0.4019,2021-07-11 05:34:29
attending Google Cloud Delhi NCR region launch Join the official opening CloudforIndia Watch Live https,1513,0.0,0.864,0.136,0.296,2021-07-11 05:33:57
Update Back #Google app beta loses built browser and returns Chrome Custom,524,0.173,0.827,0.0,-0.3182,2021-07-11 05:31:02
Learn what the entrepreneurial journey and running #marathon have common,3678,0.0,1.0,0.0,0.0,2021-07-11 05:30:00
Dear Guy this project deserves depth review Deeply integrated with #Polkado,55,0.0,0.794,0.206,0.3818,2021-07-11 05:28:43
Google will begin accepting advertisements cryptocurrency exchanges and digital wallets targeting consumers,616,0.0,0.809,0.191,0.3818,2021-07-11 05:25:42
Google wants ban Xbox Game Pass and other streaming services from helping users sign the web,118,0.182,0.707,0.111,-0.34,2021-07-11 05:25:42
Pre Registration Coating The smooth design significantly reduces friction while the stealth but passionate cut,2,0.186,0.588,0.225,0.4215,2021-07-11 05:20:02
Satguru Documentation Ramesh Nagar #Google,0,0.0,1.0,0.0,0.0,2021-07-11 05:19:30
Stop lining the pockets the rich with with the hard earnings the working class sWomen #miners,1518,0.178,0.644,0.178,0.25,2021-07-11 05:18:54
#Google #Gmail How delete your Gmail account you longer require your Gmail service quick and easy,18,0.0,0.838,0.162,0.4404,2021-07-11 05:17:40
July buy #oneplus #device #smoothos #oneplus tpro #neversettle #beyondthespeed,120,0.0,1.0,0.0,0.0,2021-07-11 05:15:01
The usual pain that never ends Follow for more #DigitalMarketing #digitalasset #digitalagency,3,0.231,0.769,0.0,-0.5106,2021-07-11 05:13:22
attending Google Cloud Delhi NCR region launch Join the official opening CloudforIndia Watch Live,17,0.0,0.855,0.145,0.296,2021-07-11 05:13:13
Just look that outstanding #usher #crowder #june coup #google #ethan,2,0.0,0.692,0.308,0.6124,2021-07-11 05:12:30
Over states the have now sued #Google over anti competitive practices #Innovation #antit,7452,0.153,0.733,0.113,-0.1531,2021-07-11 05:12:04
Iowa joins lawsuit accusing Google anti competitive practices via #Google,7452,0.434,0.441,0.125,-0.4939,2021-07-11 05:11:41
Good morning Begin your day with #freshthoughts #sunremindsme Happy Sunday #YourQuoteAndMine Collaborating,4,0.0,0.602,0.398,0.765,2021-07-11 05:11:24
look forward actually said Trump Former President Trump said eager and willing provide sworn testimo,148,0.0,0.848,0.152,0.3612,2021-07-11 05:11:10
#Google was hit lawsuit from group state attorneys over alleged #Antitrust violations The complaint centers,7452,0.385,0.615,0.0,-0.7579,2021-07-11 05:10:19
Booking trip with Canine Safaris has been automated with interesting guide help you book your excursion Let explore,234,0.0,0.748,0.252,0.6597,2021-07-11 05:09:53
Pre Registration Coating The smooth design significantly reduces friction while the stealth but passionate cut,141,0.186,0.588,0.225,0.4215,2021-07-11 05:08:00
#usher #crowder #june coup #google #ethan Yrs Children Cotton Baby Girls Pantyhose Spring Autumn Winter Bowkno,2,0.0,1.0,0.0,0.0,2021-07-11 05:07:19
Learn HVAC Google classroom and Google meet book here info hvac com Also for additional content,32,0.0,1.0,0.0,0.0,2021-07-11 05:06:52
Iternal the storytelling platform and giving you the chance win Google Nest Mini and other great goodie,14,0.0,0.514,0.486,0.9062,2021-07-11 05:06:35
went dark place when accidentally googling Puss roots instead Puss boots #typo #pussinboots #thanks #google,124,0.146,0.854,0.0,-0.34,2021-07-11 05:06:11
Global Covid caseload tops Deaths surge more than #sadahaqpb #sadahaqenglish #sadahaqurdu,21325,0.0,0.752,0.248,0.5106,2021-07-11 05:02:55
#Google #Gmail How delete your Gmail account you longer require your Gmail service quick and easy,85,0.0,0.838,0.162,0.4404,2021-07-11 05:02:32
All the excitement #BGMI turned into disappointment when saw data transfer not possible for users who link,21,0.153,0.698,0.149,-0.0258,2021-07-11 05:00:32
Take your business new heights with Superforce Info #webdesign #design,60,0.0,1.0,0.0,0.0,2021-07-11 05:00:24
Pre Registration Coating The smooth design significantly reduces friction while the stealth but passionate cut,5,0.186,0.588,0.225,0.4215,2021-07-11 04:59:15
Use the #Google Search Console find the proper keywords,3602,0.0,1.0,0.0,0.0,2021-07-11 04:57:42
And yet #Democrats will lose next elections because they have idea how reach out common folks,110,0.152,0.787,0.062,-0.3818,2021-07-11 04:57:36
Indian army Guluthi started #India #ARMY #SundayMorning #SaturdayMotivation #SaturdayMorning #motivation #TREASURE,10970,0.0,1.0,0.0,0.0,2021-07-11 04:55:30
Check out this new digital art that uploaded #Couple #Dancing #Mus,1754,0.0,1.0,0.0,0.0,2021-07-11 04:55:01
Sarah Ruggera LMFT #Google,109,0.0,1.0,0.0,0.0,2021-07-11 04:54:54
