tweet,follower_count,neg,neu,pos,compound,time
Honoured that Google shows featured snippet extracted from paper with and Such,476,0.0,0.775,0.225,0.4939,2021-08-09 00:35:33
Extra tags because why not #LuckytheCat #Cat #Google #TokyoMachine #Monstercat #digitalartwork #Olympics sorr,36,0.0,1.0,0.0,0.0,2021-08-09 00:32:35
How move new Domain without losing your rankings #SEO #google #webmaster #web,352,0.0,0.834,0.166,0.2924,2021-08-09 00:30:51
Tips for Executing Cost Effective #GoogleAds Bidding Strategy Align the Bidding Strategy the goal the,151117,0.0,0.819,0.181,0.4767,2021-08-09 00:30:01
Trivia Minute Question What tool did Krystsina Tsimanouskaya use converse with the Japanese authorities,66,0.0,1.0,0.0,0.0,2021-08-09 00:30:00
Data Analyst Day Blockchain Developer Night know Right not that easy mixing two different paths #blockchain,15299,0.138,0.862,0.0,-0.3412,2021-08-09 00:26:16
#Coinbase gives green light #Apple Pay and says #Google Pay next,17,0.237,0.763,0.0,-0.2023,2021-08-09 00:26:10
#Coinbase gives green light #Apple Pay and says #Google Pay next,430,0.237,0.763,0.0,-0.2023,2021-08-09 00:25:31
#Coinbase gives green light #Apple Pay and says #Google Pay next,114,0.237,0.763,0.0,-0.2023,2021-08-09 00:25:30
#Coinbase gives green light #Apple Pay and says #Google Pay next,94,0.237,0.763,0.0,-0.2023,2021-08-09 00:24:45
#Coinbase gives green light #Apple Pay and says #Google Pay next,151,0.237,0.763,0.0,-0.2023,2021-08-09 00:24:27
#Coinbase gives green light #Apple Pay and says #Google Pay next,285,0.237,0.763,0.0,-0.2023,2021-08-09 00:24:19
you still have time learn from pickup any prime time,82,0.0,1.0,0.0,0.0,2021-08-09 00:23:03
#BARACKOBAMA Former #POTUS #AI #BIGDATA #MEDIA #GOOGLE #INSTAGRAM #MSN #APPLE #HUFFINGTONPOST #VIVILABRIDONNAIRE,3235,0.0,1.0,0.0,0.0,2021-08-09 00:21:57
#Coinbase gives green light #Apple Pay and says #Google Pay next,22517,0.237,0.763,0.0,-0.2023,2021-08-09 00:21:17
Inazuma Giveaway Google Play Store RULES Like and Retweet Follow USA play sto,0,0.0,0.578,0.422,0.743,2021-08-09 00:21:08
Like and share this pure awesomeness #usher #crowder #june coup #google #ethan,4,0.0,0.68,0.32,0.5719,2021-08-09 00:19:30
INSANE THE BLOCKCHAIN #Web #Cloud #Programmer #WebDev #ArtificialIntelligence #ElonMusk #SmartCar #Python #Linux #Microso,36498,0.222,0.778,0.0,-0.5319,2021-08-09 00:18:59
INSANE THE BLOCKCHAIN #Web #Cloud #Programmer #WebDev #ArtificialIntelligence #ElonMusk #SmartCar #Python #Linux #Microso,18466,0.222,0.778,0.0,-0.5319,2021-08-09 00:18:57
During COVID tech companies have gathered there most valuable analytics data how humans operate since,219,0.0,0.805,0.195,0.5256,2021-08-09 00:18:35
August buy #oneplus #device #smoothos #oneplus tpro #neversettle,118,0.0,1.0,0.0,0.0,2021-08-09 00:16:08
INSANE THE BLOCKCHAIN #Web #Cloud #Programmer #WebDev #ArtificialIntelligence #ElonMusk #SmartCar #Python #Linux #Microso,17558,0.222,0.778,0.0,-0.5319,2021-08-09 00:15:59
google guava just surpassed serverless serverless stars #GitHub now the most starred software,3665,0.0,1.0,0.0,0.0,2021-08-09 00:15:51
google guava just surpassed serverless serverless stars #GitHub now the most starred softwar,670,0.0,1.0,0.0,0.0,2021-08-09 00:15:46
necolas normalize css just surpassed google guava stars #GitHub now the most starred softwar,670,0.0,1.0,0.0,0.0,2021-08-09 00:15:46
Automate your with Red Hat #privacy #redteam #google #video #amazon daysofcode #infosec #cybersecurity #live #sysadmi,17558,0.0,1.0,0.0,0.0,2021-08-09 00:14:58
Thank you Google #Google For Lovely Wishes Birthday,1377,0.0,0.388,0.612,0.7845,2021-08-09 00:14:36
What absolute blast this was tonight Check out #spotify #itunes #google #youtube #amazon and #tunein hear cha,2129,0.0,1.0,0.0,0.0,2021-08-09 00:12:18
Google Announces New Ads Creative Studio Amy Bishop #Google,4567,0.0,0.734,0.266,0.4404,2021-08-09 00:11:03
Google Pack WiFi Router Renewed #Google #Pack #WiFi #Router #Renewed #cybersecurity,17558,0.0,1.0,0.0,0.0,2021-08-09 00:08:50
Invest one the best exchange Sir Brian Armstrong and lis,405,0.0,0.682,0.318,0.6369,2021-08-09 00:08:01
Invest one the best exchange Sir Brian Armstrong and,77,0.0,0.656,0.344,0.6369,2021-08-09 00:05:04
Introducing Marina and Natalie two #Google Cloud #Engineers who used #MachineLearning generate the Bake off challe,320,0.0,1.0,0.0,0.0,2021-08-09 00:03:46
Can Apple support engineer damage device without touching manager Apple stores said this,65,0.189,0.651,0.16,-0.128,2021-08-09 00:03:29
Xtreme Reggae Dancehall International Promotions Hub #Google,1177,0.0,1.0,0.0,0.0,2021-08-09 00:00:46
#BARACKOBAMA Former #POTUS #AI #BIGDATA #MEDIA #GOOGLE #INSTAGRAM #MSN #APPLE #HUFFINGTONPOST #VIVILABRIDONNAIRE,87,0.0,1.0,0.0,0.0,2021-08-09 00:00:42
Introducing Marina and Natalie two #Google Cloud #Engineers who used #MachineLearning generate the Bake off cha,1,0.0,1.0,0.0,0.0,2021-08-09 00:00:24
Custom Virtual Solutions provides SEO services for your website help you gain more conversions Talk,4,0.0,0.606,0.394,0.7783,2021-08-09 00:00:01
#BARACKOBAMA Former #POTUS #AI #BIGDATA #MEDIA #GOOGLE #INSTAGRAM #MSN #APPLE #HUFFINGTONPOST,902,0.0,1.0,0.0,0.0,2021-08-08 23:59:56
What find changes who become #jobsearch #FutureOfWork #Google #FALLSEMESTER #TheGospelTruth #ConManNickMwendwa #So,3235,0.0,1.0,0.0,0.0,2021-08-08 23:58:25
#Google #AI Introduces Translatotron Neural Direct Speech Speech Translation Model Without The #Deepfake Potential,3235,0.0,1.0,0.0,0.0,2021-08-08 23:57:12
New #Google project #Israel aims use #AI help detect #colon cancer via,1517,0.257,0.585,0.158,-0.4019,2021-08-08 23:56:44
Gizmodo Google Signing Out Free Hangouts Users Mobile Gets Closer Finally Killing the Thing,5610,0.223,0.609,0.168,-0.2732,2021-08-08 23:54:00
Reporting from Fiji suggested that Page flew back into the country June that correct still,2955,0.0,1.0,0.0,0.0,2021-08-08 23:52:59
Pattons Fine Jewelry #Google,1111,0.0,0.625,0.375,0.2023,2021-08-08 23:52:04
Like you are Excited Yeah #usher #crowder #june coup #google #ethan,4,0.0,0.53,0.47,0.7269,2021-08-08 23:45:24
#Google #AI Introduces Translatotron Neural Direct Speech Speech Translation Model Without The #Deepfake Potential,130,0.0,1.0,0.0,0.0,2021-08-08 23:45:02
#Google #AI Introduces Translatotron Neural Direct Speech Speech Translation Model Without The #Deepfake Potential,208,0.0,1.0,0.0,0.0,2021-08-08 23:44:50
#Google #AI Introduces Translatotron Neural Direct Speech Speech Translation Model Without The #Deepfake,1288,0.0,1.0,0.0,0.0,2021-08-08 23:43:27
Google desperately repels attacks from civil society consumer protection organizations and government antitrust authorities,875,0.314,0.686,0.0,-0.6705,2021-08-08 23:40:46
Google Pack WiFi Router Renewed #Google #Pack #WiFi #Router #Renewed #cybersecurity,887,0.0,1.0,0.0,0.0,2021-08-08 23:36:58
Top best free graphic design online site #uidesign #design,2576,0.0,0.392,0.608,0.8519,2021-08-08 23:35:55
NailBiting Runner Game Download #mobilegames #games #gamer #videogames #videogame #IndieGameDev,7707,0.0,1.0,0.0,0.0,2021-08-08 23:35:04
Google Pack WiFi Router Renewed #Google #Pack #WiFi #Router #Renewed,4843,0.0,1.0,0.0,0.0,2021-08-08 23:34:59
NailBiting Runner Game Download #mobilegames #games #gamer #videogames #videogame #IndieGameDev,3376,0.0,1.0,0.0,0.0,2021-08-08 23:34:46
NailBiting Runner Game Download #mobilegames #games #gamer #videogames #videogame #IndieGameDev,1671,0.0,1.0,0.0,0.0,2021-08-08 23:34:45
What find changes who become #jobsearch #FutureOfWork #Google #FALLSEMESTER #TheGospelTruth #ConManNickMwendwa #So,1057,0.0,1.0,0.0,0.0,2021-08-08 23:34:29
NailBiting Runner Game Download #mobilegames #games #gamer #videogames #videogame #IndieGameDev,755,0.0,1.0,0.0,0.0,2021-08-08 23:34:22
Can you #rank #Google without #niche You could possibly Media sites like #Forbes and #Business Insider,4,0.0,0.857,0.143,0.3612,2021-08-08 23:33:58
Last one Rose and Cedarwood Essential Oil homemade soap #flowersoap #handmadesoap,778,0.0,1.0,0.0,0.0,2021-08-08 23:32:42
Automate your with Red Hat #privacy #redteam #google #video #amazon daysofcode #infosec #cybersecurity #live #sysadmi,56,0.0,1.0,0.0,0.0,2021-08-08 23:31:04
INSANE THE BLOCKCHAIN #Web #Cloud #Programmer #WebDev #ArtificialIntelligence #ElonMusk #SmartCar #Python #Linux #Microso,3018,0.222,0.778,0.0,-0.5319,2021-08-08 23:30:45
INSANE THE BLOCKCHAIN #Web #Cloud #Programmer #WebDev #ArtificialIntelligence #ElonMusk #SmartCar #Python #Linux #Microso,5368,0.222,0.778,0.0,-0.5319,2021-08-08 23:30:11
Does anyone else remember Google Plus was lame #GooglePlus #Google,538,0.237,0.763,0.0,-0.4215,2021-08-08 23:30:07
Facebook raises concerns about apple new child safety update #facebook #fb #google #apple,7025,0.0,0.811,0.189,0.4215,2021-08-08 23:30:02
Reasons Why Switch #AdSense Alternatives #Blogging #Publishers #Earnings #BloggingTips #WordPress #Vlogging,248,0.0,1.0,0.0,0.0,2021-08-08 23:30:00
INSANE THE BLOCKCHAIN #Web #Cloud #Programmer #WebDev #ArtificialIntelligence #ElonMusk #SmartCar #Python #Linux #Microso,1882,0.222,0.778,0.0,-0.5319,2021-08-08 23:29:42
INSANE THE BLOCKCHAIN #Web #Cloud #Programmer #WebDev #ArtificialIntelligence #ElonMusk #SmartCar #Python,330,0.256,0.744,0.0,-0.5319,2021-08-08 23:29:35
After odd years collecting storing recording and stealing our personal data google now concerned about,3,0.316,0.684,0.0,-0.7184,2021-08-08 23:29:09
Automate your with Red Hat #privacy #redteam #google #video #amazon daysofcode #infosec #cybersecurity #live #sysadmi,4966,0.0,1.0,0.0,0.0,2021-08-08 23:28:55
Automate your with Red Hat #privacy #redteam #google #video #amazon daysofcode #infosec #cybersecurity #live #sysadmi,313,0.0,1.0,0.0,0.0,2021-08-08 23:28:41
Automate your with Red Hat #privacy #redteam #google #video #amazon daysofcode #infosec #cybersecurity #live #sysadmi,36498,0.0,1.0,0.0,0.0,2021-08-08 23:28:39
Automate your with Red Hat #privacy #redteam #google #video #amazon daysofcode #infosec #cybersecurity #live #sysadmi,18466,0.0,1.0,0.0,0.0,2021-08-08 23:28:38
Automate your with Red Hat #privacy #redteam #google #video #amazon daysofcode #infosec #cybersecurity #live #sysadmi,11886,0.0,1.0,0.0,0.0,2021-08-08 23:28:28
Automate your with Red Hat #privacy #redteam #google #video #amazon daysofcode #infosec #cybersecurity #live #sysadmi,577,0.0,1.0,0.0,0.0,2021-08-08 23:27:15
Automate your with Red Hat #privacy #redteam #google #video #amazon daysofcode #infosec #cybersecurity #live #sysadmi,1882,0.0,1.0,0.0,0.0,2021-08-08 23:25:21
Automate your with Red Hat #privacy #redteam #google #video #amazon daysofcode #infosec #cybersecurity #live,8964,0.0,1.0,0.0,0.0,2021-08-08 23:25:08
Lately Google maps getting laggy unresponsive inaccurate iOS Sometimes just shows min walk while,0,0.0,1.0,0.0,0.0,2021-08-08 23:24:38
Google desperately repels attacks from civil society consumer protection organizations and government antitrust authorities,5825,0.314,0.686,0.0,-0.6705,2021-08-08 23:24:29
New video out now Did some background changes let know you like are always appreciated #nexus,340,0.0,0.707,0.293,0.7003,2021-08-08 23:23:53
Google desperately repels attacks from civil society consumer protection organizations and government antitrust aut,62,0.314,0.686,0.0,-0.6705,2021-08-08 23:23:34
#Google Home Device Setup #googleassistant,135,0.0,1.0,0.0,0.0,2021-08-08 23:23:28
CTP GREEN SLIP INJURIES Fit Physio Sports Physiotherapy amp Massage Mosman,684,0.0,0.8,0.2,0.3612,2021-08-08 23:23:18
August buy #oneplus #device #smoothos #oneplus tpro #neversettle,118,0.0,1.0,0.0,0.0,2021-08-08 23:16:06
new obsession #gan #GenerativeAdversarialNetwork #AI #imagesynthesis #VQGAN #artificialintelligence #MachineLearning,3154,0.231,0.769,0.0,-0.34,2021-08-08 23:11:04
Zach Vorhies #Google #whistleblower discusses his new book Google Leaks and the power machine learning #censorship,1685,0.0,1.0,0.0,0.0,2021-08-08 23:09:44
Share you find terrific #usher #crowder #june coup #google #ethan,4,0.0,0.602,0.398,0.6486,2021-08-08 23:09:14
Now you can join amp register #google #facebook #instagram #twitter #socialmedia #business,148,0.0,0.833,0.167,0.296,2021-08-08 23:04:02
Top Level Traffic Web Design Bridgend #Google #topleveltraffic #bridgend #digitalmarketin,5927,0.0,0.833,0.167,0.2023,2021-08-08 23:02:53
Best Computer Repair Bridgend and South Wales #Google #custombuild #customgamingpc #gaming,5927,0.0,0.704,0.296,0.6369,2021-08-08 23:02:45
Want Save your site from Adsense Ban Avoid these Mistakes That #Violate #Google #Adsense,48537,0.381,0.413,0.206,-0.5859,2021-08-08 23:02:38
SEO Tips for QMDJ Business #digitalmarketing #sales #google,7932,0.0,1.0,0.0,0.0,2021-08-08 23:00:34
Looks good but racially biased #Google #Neuralink,0,0.276,0.521,0.203,-0.1779,2021-08-08 23:00:06
theta are finally staked Great pump coming #theta tfuel #bitcoin eth #crypto #nfts #Binance bnb #samsung,942,0.0,0.785,0.215,0.6249,2021-08-08 22:58:37
They are not getting away from this work #knockoutcity #knockout #entrepreneurship #valorant #trade #microsoft,250,0.0,1.0,0.0,0.0,2021-08-08 22:57:59
theta are finally staked Great pump coming #theta tfuel #bitcoin eth #crypto #nfts #Binance bnb #samsung,8,0.0,0.785,0.215,0.6249,2021-08-08 22:57:12
#Google search scooter amp impaled for more reasons why they shouldn allowed sidewalks,130,0.0,1.0,0.0,0.0,2021-08-08 22:52:17
#antivaxxers #Google the #Doctor,2889,0.0,1.0,0.0,0.0,2021-08-08 22:52:04
Page Experience Update HTTPS #page #protocol #google #urls #data #seo via,2488,0.0,1.0,0.0,0.0,2021-08-08 22:52:04
theta are finally staked Great pump coming #theta tfuel #bitcoin eth #crypto #nfts #Binance bnb #samsung,324,0.0,0.785,0.215,0.6249,2021-08-08 22:52:03
What true though that related the most recent #Apple controversy the fact that lot other companies are,259,0.0,0.851,0.149,0.4215,2021-08-08 22:51:12
What true though that related the most recent #Apple controversy the fact that lot other companies,3,0.0,0.843,0.157,0.4215,2021-08-08 22:50:37
Holiday time #bali #Seminyak #geriabali #beautifuldestination,1989,0.0,0.649,0.351,0.4019,2021-08-08 22:49:40
new obsession #gan #GenerativeAdversarialNetwork #AI #imagesynthesis #VQGAN #artificialintelligence #MachineLearning,484,0.231,0.769,0.0,-0.34,2021-08-08 22:48:58
new obsession #gan #GenerativeAdversarialNetwork #AI #imagesynthesis #VQGAN #artificialintelligence,601,0.255,0.745,0.0,-0.34,2021-08-08 22:48:51
Free #Giveaway #BTC For People #BTCUSD #dogecoin #Ethereum #Bitcoin #xrp #Ripple #tron,0,0.0,0.769,0.231,0.5106,2021-08-08 22:45:46
Soon sharing some insider tactics how small companies can leapfrog bigger companies Google Busine,749,0.0,0.823,0.177,0.4215,2021-08-08 22:44:13
Charge wherever you Magnetic Wireless Charger #magsafe #iPhone,18,0.0,1.0,0.0,0.0,2021-08-08 22:43:29
Google John Mueller explains how ranking changes can attributed page speed but core updates were separate things via,51,0.0,1.0,0.0,0.0,2021-08-08 22:43:07
Zach Vorhies #Google #whistleblower discusses his new book Google Leaks and the power machine learning #censorship,2196,0.0,1.0,0.0,0.0,2021-08-08 22:40:48
#Google Artificial Intelligence Reveals That Has Human Emotions After Was Observed Doing This #AI,1606,0.0,0.807,0.193,0.4767,2021-08-08 22:40:42
Zach Vorhies #Google #whistleblower discusses his new book Google Leaks and the power machine learning #censorship,2031,0.0,1.0,0.0,0.0,2021-08-08 22:40:20
Users always make the assumption that results that appear the top #Google search are the most accurate However,478,0.0,0.904,0.096,0.2023,2021-08-08 22:37:20
Google published handy document sharing insights how Core Web Vitals CWV works Read about here via,4020,0.0,0.741,0.259,0.5994,2021-08-08 22:36:09
Google Nest WiFi Router Pack One Router Two extenders Generation #Google #Nest #WiFi,887,0.0,1.0,0.0,0.0,2021-08-08 22:35:51
Google the internet #google #googl #goog #stock #market #tech #technology #epic #internet #monster,3092,0.0,1.0,0.0,0.0,2021-08-08 22:35:42
Learn how easily use Google Sheets for web and data scraping improving execution times and reducing mistakes codin,4020,0.11,0.661,0.229,0.4019,2021-08-08 22:35:11
Like you are Excited Yeah #usher #crowder #june coup #google #ethan,4,0.0,0.53,0.47,0.7269,2021-08-08 22:34:28
Check out the latest episode #podcast Subway Shea #Google Podcasts #Mets #LGM #LFGM #MetsTwitter,1643,0.0,1.0,0.0,0.0,2021-08-08 22:32:44
Now you can join amp register #google #facebook #instagram #twitter #socialmedia,36,0.0,0.82,0.18,0.296,2021-08-08 22:32:29
Now you can join amp register #google #facebook #instagram #twitter #socialmedia,74,0.0,0.82,0.18,0.296,2021-08-08 22:32:09
Local Hero Review Tap Into New Local Opportunity And Find Contact And Land Unlimited Local SEO Leads,230,0.0,0.701,0.299,0.7506,2021-08-08 22:31:33
Google Nest WiFi Router Pack One Router Two extenders Generation #Google #Nest #WiFi,1882,0.0,1.0,0.0,0.0,2021-08-08 22:31:32
Google Nest WiFi Router Pack One Router Two extenders Generation #Google #Nest,4843,0.0,1.0,0.0,0.0,2021-08-08 22:31:28
Hacking with Google Search #seo #google #search #hacking #hacks #web,352,0.0,1.0,0.0,0.0,2021-08-08 22:30:51
#Google video streaming site brought nearly much #ad revenue the past quarter the streaming pioneer,279,0.0,1.0,0.0,0.0,2021-08-08 22:28:00
Zach Vorhies #Google #whistleblower discusses his new book Google Leaks and the power machine learning #censorship,192,0.0,1.0,0.0,0.0,2021-08-08 22:27:22
JUST technology companies #Amazon #Google and #Microsoft among others have joined government effort fight,1322,0.167,0.833,0.0,-0.3818,2021-08-08 22:25:03
JUST #Google founder Larry Page has been granted residency New Zealand through the country Investor Plus resid,1322,0.0,0.889,0.111,0.25,2021-08-08 22:24:00
Zach Vorhies #Google #whistleblower discusses his new book Google Leaks and the power machine learning #censorship,212,0.0,1.0,0.0,0.0,2021-08-08 22:22:33
Zach Vorhies #Google #whistleblower discusses his new book Google Leaks and the power machine learning,70681,0.0,1.0,0.0,0.0,2021-08-08 22:20:17
Check out paidmarketer will increase sales #shopify website #Google #AdWords #Fiverr adwords fiverr #ppc,972,0.0,0.85,0.15,0.3182,2021-08-08 22:19:41
Ardern said she was not briefed the time Page was New Zealand #growthhacking #IO #google #opt,1641,0.0,1.0,0.0,0.0,2021-08-08 22:18:19
How Google Search Engine Algorithm Makes Breaks Industries #google #businesses #algorithm #time #years #seo via https,2241,0.0,1.0,0.0,0.0,2021-08-08 22:17:27
its new #bnb #tixl This project has mega potential and believe that two years #tixl will Buy,37,0.0,1.0,0.0,0.0,2021-08-08 22:17:16
Google BigQuery and PostgreSQL Big Query for Data Analysis FREE #blacktechtwitter #developer #coding dayso,836,0.0,0.763,0.237,0.6166,2021-08-08 22:17:14
Google BigQuery and PostgreSQL Big Query for Data Analysis FREE #blacktechtwitter #developer #coding dayso,587,0.0,0.763,0.237,0.6166,2021-08-08 22:17:06
Google BigQuery and PostgreSQL Big Query for Data Analysis FREE #blacktechtwitter #developer #coding dayso,232,0.0,0.763,0.237,0.6166,2021-08-08 22:17:04
Google BigQuery and PostgreSQL Big Query for Data Analysis FREE #blacktechtwitter #developer #coding dayso,4966,0.0,0.763,0.237,0.6166,2021-08-08 22:16:51
Google BigQuery and PostgreSQL Big Query for Data Analysis FREE #blacktechtwitter #developer #coding dayso,2902,0.0,0.763,0.237,0.6166,2021-08-08 22:16:47
#amazon com #google #theechoshow #amazon comberger,1174,0.0,1.0,0.0,0.0,2021-08-08 22:13:31
Take look our new website Join Google Business #Google,586,0.0,0.784,0.216,0.296,2021-08-08 22:13:30
Change your Business for the better Show higher #google #bing #yahoo search engines where people find,141,0.0,0.838,0.162,0.4404,2021-08-08 22:13:28
Data Analyst Day Blockchain Developer Night know Right not that easy mixing two different paths,836,0.147,0.853,0.0,-0.3412,2021-08-08 22:13:07
Unknown Interesting #Google Facts #business,1843,0.0,0.597,0.403,0.4019,2021-08-08 22:09:22
Fuck #google stay strong #EpicGames,648,0.357,0.306,0.337,-0.0516,2021-08-08 22:07:31
Join #Google celebrating the spaces that represent belonging strength and joy for the LGBTQ community,247,0.0,0.46,0.54,0.9169,2021-08-08 22:05:59
#Google searches Peyton Manning old,3325,0.0,1.0,0.0,0.0,2021-08-08 22:04:10
Rizwan Photography #Google Intimate Wedding Nikkah Ceremony #weddingphotography,586,0.0,1.0,0.0,0.0,2021-08-08 22:01:38
Hey #Developers make sure read latest article Web Campaign from Google Forms Enga,55911,0.0,0.839,0.161,0.3182,2021-08-08 22:00:19
Watch the recording this interactive webcast learn how #HCL amp #Google #Cloud can help #manufacturing enterpri,271,0.0,0.847,0.153,0.4019,2021-08-08 22:00:10
Isn cool #usher #crowder #june coup #google #ethan,4,0.0,0.753,0.247,0.3182,2021-08-08 22:00:08
How Google Search Engine Algorithm Makes Breaks Industries #google #businesses #algorithm #time #years #seo,2488,0.0,1.0,0.0,0.0,2021-08-08 21:57:07
collected all the trophies and scrolls this game #Google #GoogleDoodles #DoodleChampionIslandGamesBegin,41,0.0,1.0,0.0,0.0,2021-08-08 21:54:54
Low Code Code Development Platforms What the Difference #blockchain #youtube #bitcoin #music #twitter #art #live,21642,0.13,0.87,0.0,-0.2732,2021-08-08 21:54:18
Low Code Code Development Platforms What the Difference #blockchain #youtube #bitcoin #music #twitter #art #live,2017,0.13,0.87,0.0,-0.2732,2021-08-08 21:51:43
Ardern said she was not briefed the time Page was New Zealand #growthhacking #IO,20,0.0,1.0,0.0,0.0,2021-08-08 21:51:16
Low Code Code Development Platforms What the Difference #blockchain #youtube #bitcoin #music #twitter #art #live,867,0.13,0.87,0.0,-0.2732,2021-08-08 21:50:59
Low Code Code Development Platforms What the Difference #blockchain #youtube #bitcoin #music #twitter #art #live,4385,0.13,0.87,0.0,-0.2732,2021-08-08 21:50:59
Low Code Code Development Platforms What the Difference #blockchain #youtube #bitcoin #music #twitter,8964,0.149,0.851,0.0,-0.2732,2021-08-08 21:50:54
GTA Renovation specialists contact for your project #Google business verified Renovate home income property law suit,827,0.0,1.0,0.0,0.0,2021-08-08 21:49:52
NIST selects tech companies for zero trust demos #technology #business #cybersecurity #fortnite #nowplaying #love #google,2017,0.0,0.809,0.191,0.5106,2021-08-08 21:49:43
NIST selects tech companies for zero trust demos #technology #business #cybersecurity #fortnite #nowplaying #love #google,4385,0.0,0.809,0.191,0.5106,2021-08-08 21:49:16
NIST selects tech companies for zero trust demos #technology #business #cybersecurity #fortnite #nowplaying #love #google,867,0.0,0.809,0.191,0.5106,2021-08-08 21:49:16
NIST selects tech companies for zero trust demos #technology #business #cybersecurity #fortnite #nowplaying,8964,0.0,0.784,0.216,0.5106,2021-08-08 21:49:11
Google Maps and search Loch Ness Click the street view and spin around the Loch Ness Monster #Loch,46,0.0,1.0,0.0,0.0,2021-08-08 21:48:45
LOL Pixel launch only countries Japan and Whats wrong with you Google #google #android,405,0.166,0.644,0.19,0.1111,2021-08-08 21:48:44
#Whitehat #seo are precious saw one them today say that links aren Legiit and thought that was,2589,0.0,0.812,0.188,0.5719,2021-08-08 21:47:08
MILLION VIEWS #GOOGLE Thanks all Low Rent #Foodies for your support For those you who haven yet,574,0.097,0.645,0.258,0.5423,2021-08-08 21:47:01
Yummy Tummy Kitchen #Google,6,0.0,0.469,0.531,0.5267,2021-08-08 21:40:49
Why #Google and #Facebook may eventually disappear,4250,0.241,0.759,0.0,-0.2263,2021-08-08 21:40:40
JUST #Google founder Larry Page has been granted residency New Zealand through the country Investor Plus resid,991,0.0,0.889,0.111,0.25,2021-08-08 21:38:50
exclusive Shop #Google,191,0.0,0.571,0.429,0.128,2021-08-08 21:36:19
Online and Home Tutoring Whitby Ajax Oshawa amp Surrounding Areas #Google,245,0.0,1.0,0.0,0.0,2021-08-08 21:35:49
Online and Home Tutoring Whitby Ajax Oshawa amp Surrounding Areas #Google,245,0.0,1.0,0.0,0.0,2021-08-08 21:35:04
Have you seen our newest #Google review Just Google read what some our other clients have say,22,0.0,1.0,0.0,0.0,2021-08-08 21:34:20
its new #bnb #tixl This project has mega potential and believe that two years #tixl,37,0.0,1.0,0.0,0.0,2021-08-08 21:33:47
lies detected #Apple #Google #Waze,83,0.412,0.588,0.0,-0.4215,2021-08-08 21:32:07
CDW Tech Talk Series Join the Live Experience #blockchain #youtube #bitcoin #music #twitter #art #live daysofcode #nowp,2902,0.0,0.879,0.121,0.296,2021-08-08 21:32:03
The race #business #companies #innovation #entreprenership #startup tech #tech #apple #google,158,0.0,1.0,0.0,0.0,2021-08-08 21:30:58
John Mueller offers insights into ranking for local search queries Google via,51,0.0,1.0,0.0,0.0,2021-08-08 21:30:42
#Google founder Larry Page the richest person the planet has become resident New Zealand under,6198,0.0,0.805,0.195,0.5267,2021-08-08 21:30:00
GTA Renovation specialists contact for your project #Google business verified Renovate home income property law suit,0,0.0,1.0,0.0,0.0,2021-08-08 21:29:52
Check out Gig #Fiverr #google #scraping for #search results #business #profiles,1738,0.0,1.0,0.0,0.0,2021-08-08 21:29:03
Absolutely classic Google maps search Loch Ness click the bottom picture and have look around #lochness #Google,2983,0.0,1.0,0.0,0.0,2021-08-08 21:25:08
Google Plus One Social Button #googlenews #google #socialnetworking #seo #internetmarketing,7078,0.0,1.0,0.0,0.0,2021-08-08 21:25:04
ILYA VOLYKHINE Art Ilya Private Art Studio Open appointment #Google,706,0.0,1.0,0.0,0.0,2021-08-08 21:22:46
Like and share you think fantastic #usher #crowder #june coup #google #ethan,4,0.0,0.52,0.48,0.8074,2021-08-08 21:22:26
When learning code important have plan and know the steps necessary learn any coding language Take look,614,0.0,0.899,0.101,0.2023,2021-08-08 21:22:04
All hard work has finally paid off #localguides #google #totebags #reviewmyface,84,0.123,0.877,0.0,-0.1027,2021-08-08 21:20:36
