tweet,follower_count,neg,neu,pos,compound,time
Google the internet #google #googl #goog #stock #market #tech #technology #epic #internet #monster,210,0.0,1.0,0.0,0.0,2021-06-01 11:23:46
why #Google hiding the word Homeopathic Although showing results,4,0.216,0.784,0.0,-0.296,2021-06-01 11:23:41
There Quick Money #money #startup #google,372,0.0,1.0,0.0,0.0,2021-06-01 11:23:30
GOOGLE DOODLE HAPPY MOTHER DAY BHEL PURI BATATA PURI MUDHI,1187,0.0,0.709,0.291,0.5719,2021-06-01 11:23:18
Our latest #blog looks the advantages having #Google Business profile Today Google the search eng,208,0.0,0.848,0.152,0.3612,2021-06-01 11:22:30
Five years ago Google organic search results were dominated large publishers Does Google now have more diverse results,1027,0.0,1.0,0.0,0.0,2021-06-01 11:22:16
Your guide getting ranked Google #google #seo #seorank #clientjoy #crm #google,82,0.0,1.0,0.0,0.0,2021-06-01 11:22:13
Even with premium YouTube subscription #Google now refuses show mature content now required giv,4,0.0,0.823,0.177,0.4215,2021-06-01 11:22:03
have been using computers since the which isn ancient but few used may museum,766,0.0,1.0,0.0,0.0,2021-06-01 11:21:59
Check this out Wakelet Shalom Lamm Tells the Patterns That Can Move Your Business Forward #Shalomlamm,37,0.0,1.0,0.0,0.0,2021-06-01 11:21:52
Our new Content Writing Intern Heather has just written her first blog post for our website Read Now,1831,0.0,1.0,0.0,0.0,2021-06-01 11:21:17
#GOOGLE #NEXUS #MOBILE LITTLE #PUCHKI #TINY #BIRD #RAIN #RAINFALL #STRONG #WINDS #STORM,51,0.0,1.0,0.0,0.0,2021-06-01 11:21:11
#GOOGLE #NEXUS #MOBILE LITTLE #PUCHKI #TINY #BIRD #RAIN #RAINFALL #STRONG,1187,0.0,1.0,0.0,0.0,2021-06-01 11:20:52
TRAFFIC POLICE HEADQUARTERS amp JAMMU SRINAGAR #sadahaqpb #sadahaqenglish #sadahaqurdu #saaddahaqnews #sadahaq,21741,0.0,1.0,0.0,0.0,2021-06-01 11:19:43
Google Announces Three Data amp Analytics Tools Cloud Summit #ai #artificialintelligence #machin,3125,0.0,1.0,0.0,0.0,2021-06-01 11:19:21
get more info AWS Cloud Please follow Instagram page aws cloud data engineer #Python #cybersecurity #MachineLea,1405,0.0,0.867,0.133,0.3182,2021-06-01 11:19:12
Don want pay for Google Photos storage Here are offline storage devices for your smartphones #Google #GooglePho,1484,0.159,0.769,0.071,-0.1531,2021-06-01 11:18:48
#Hawa #Hawa #Hawa #Hasan #Jahangir #COKE #STUDIO #PAKISTAN PANASONIC HEAD PHONE,1187,0.0,1.0,0.0,0.0,2021-06-01 11:18:46
When you are building out your content you need understand how the actual intent behind that #keywords What #Goog,2095,0.0,1.0,0.0,0.0,2021-06-01 11:18:32
Are you programmer #developer #development #coder #coding #computer #internet #java #javascript #python #html #webdevelopme,3815,0.0,1.0,0.0,0.0,2021-06-01 11:18:01
get more info AWS Cloud Please follow Instagram page aws cloud data engineer #Python #cybersecurity #MachineLea,3815,0.0,0.867,0.133,0.3182,2021-06-01 11:17:15
Judgment Announcement Trailer PlayStation Xbox Series Stadia #Judgment #Sega #PlayS,3252,0.0,1.0,0.0,0.0,2021-06-01 11:17:14
Pitman Training Swords #Google,1717,0.0,1.0,0.0,0.0,2021-06-01 11:15:44
When you are building out your content you need understand how the actual intent behind that #keywords What #Goog,4549,0.0,1.0,0.0,0.0,2021-06-01 11:15:40
Pitman Training Swords #Google,1717,0.0,1.0,0.0,0.0,2021-06-01 11:15:40
Pitman Training Swords #Google,1717,0.0,1.0,0.0,0.0,2021-06-01 11:15:37
Want Unlimited Money Week amp You Can Network Global Join Free Paid With Million Members Global Our EcoSystem http,2835,0.0,0.702,0.298,0.7003,2021-06-01 11:15:35
Pitman Training Swords #Google,1717,0.0,1.0,0.0,0.0,2021-06-01 11:15:33
All Webspresso websites are built for #mobile AND #Google User Experience #UX and Speed are priorities with all our sites,1047,0.0,1.0,0.0,0.0,2021-06-01 11:15:12
Pitman Training Swords #Google,1717,0.0,1.0,0.0,0.0,2021-06-01 11:15:04
Pitman Training Swords #Google,1717,0.0,1.0,0.0,0.0,2021-06-01 11:15:00
Want Unlimited Money Week amp You Can Network Global Join Free Paid With Million Members Global Our EcoSystem http,61,0.0,0.702,0.298,0.7003,2021-06-01 11:14:49
CBS Renter Insurance Agency #Google,293,0.0,1.0,0.0,0.0,2021-06-01 11:14:44
Pitman Training Swords #Google,1717,0.0,1.0,0.0,0.0,2021-06-01 11:14:32
Pitman Training Swords #Google,1717,0.0,1.0,0.0,0.0,2021-06-01 11:14:27
Pitman Training Swords #Google,1717,0.0,1.0,0.0,0.0,2021-06-01 11:14:24
Pitman Training Swords #Google,1717,0.0,1.0,0.0,0.0,2021-06-01 11:14:21
Pitman Training Swords #Google,1717,0.0,1.0,0.0,0.0,2021-06-01 11:14:18
Pitman Training Swords #Google,1717,0.0,1.0,0.0,0.0,2021-06-01 11:14:15
Pitman Training Swords #Google,1717,0.0,1.0,0.0,0.0,2021-06-01 11:13:57
Here interesting question you may want answer Large Publishers Have Unfair Advantage Google,5004,0.171,0.497,0.331,0.2263,2021-06-01 11:13:12
Australian broadcaster and publisher Nine Entertainment has signed multi year content supply deals with #Google and,1093,0.0,0.843,0.157,0.4215,2021-06-01 11:10:34
Australian broadcaster and publisher Nine Entertainment has signed multi year content supply deals with #Google and,123,0.0,0.843,0.157,0.4215,2021-06-01 11:10:32
Australian broadcaster and publisher Nine Entertainment has signed multi year content supply deals with #Google and,961,0.0,0.843,0.157,0.4215,2021-06-01 11:10:31
Australian broadcaster and publisher Nine Entertainment has signed multi year content supply deals with #Google and,429,0.0,0.843,0.157,0.4215,2021-06-01 11:10:30
get more info AWS Cloud Please follow Instagram page aws cloud data engineer #Python #cybersecurity #MachineLea,2961,0.0,0.867,0.133,0.3182,2021-06-01 11:10:04
understand words and understand the meaning behind words not quite the same you know what #NLU and how help,162,0.0,0.87,0.13,0.4019,2021-06-01 11:09:39
Improve your content longevity and ROI with predictable framework #digitalmarketing #seo #google #searchengine,1121,0.0,0.805,0.195,0.4404,2021-06-01 11:08:29
You done everything you can optimize your website You optimized images amp conducted #keywordresearch set,1963,0.0,0.677,0.323,0.7351,2021-06-01 11:07:03
Please recommend names journalists who frequently write #China Hindi English Urdu any other vernacular als,225,0.0,0.73,0.27,0.5859,2021-06-01 11:06:41
Gloucester Road Gearboxes Ltd #Google,73,0.0,1.0,0.0,0.0,2021-06-01 11:05:33
get more info AWS Cloud Please follow Instagram page aws cloud data engineer #Python #cybersecurity #MachineLea,5041,0.0,0.867,0.133,0.3182,2021-06-01 11:05:29
Covid and the role virtual reality healthcare and life science research via,16,0.0,1.0,0.0,0.0,2021-06-01 11:05:15
OnePlus Gets New #android Beta Developer Preview Build #gadgets review #google https,281,0.0,1.0,0.0,0.0,2021-06-01 11:05:09
Voices Search Search Engine Optimization SEO amp Content Marketing Podcast #seo #digitalmarketing,336,0.0,0.809,0.191,0.3818,2021-06-01 11:04:36
These google reviews mean the world Please make sure head over our business pages and,1343,0.0,0.739,0.261,0.5574,2021-06-01 11:04:31
OnePlus Gets New #android Beta Developer Preview Build #gadgets review #google,4391,0.0,1.0,0.0,0.0,2021-06-01 11:04:27
#Google Cloud announces new #data cloud products Google Cloud Blog #MachineLearning #AI #hclswlobp #DigitalTransfor,13119,0.0,1.0,0.0,0.0,2021-06-01 11:04:08
get more info AWS Cloud Please follow Instagram page aws cloud data engineer #Python #cybersecurity #MachineLea,1340,0.0,0.867,0.133,0.3182,2021-06-01 11:04:03
get more info AWS Cloud Please follow Instagram page aws cloud data engineer #Python #cybersecurity,27,0.0,0.859,0.141,0.3182,2021-06-01 11:03:58
#Google Cloud announces new #data cloud products Google Cloud Blog #MachineLearning #AI #hclswlobp #DigitalTransfor,2347,0.0,1.0,0.0,0.0,2021-06-01 11:03:38
Nyna Books Honey Trap #Google,47,0.365,0.635,0.0,-0.3182,2021-06-01 11:02:44
#SEO #TestimonialTuesday today featuring #Shopify #Google ranking strategy for one clients Rocket your,5041,0.0,1.0,0.0,0.0,2021-06-01 11:02:05
Say hello Charlie PPC and SEO whizz who has wealth marketing knowledge behind him #newteammember,264,0.0,0.814,0.186,0.4939,2021-06-01 11:01:31
#Google Photos ends unlimited free storage today Here everything you need June #GooglePhotos will,330,0.0,0.798,0.202,0.5106,2021-06-01 11:01:07
#offerofthemonth Link #knowledgebuzzz #googlecloud #google #clouds #coursera,322,0.0,1.0,0.0,0.0,2021-06-01 11:01:07
Five years ago Google organic search results were dominated large publishers Does Google now have more diverse,234088,0.0,1.0,0.0,0.0,2021-06-01 11:00:48
#Osmania University Dept Journalism amp Mass Comm will host town hall virtual free training Vax misinformation alo,1534,0.112,0.728,0.16,0.25,2021-06-01 11:00:48
Export your #Google #Ads #data other platforms you can #analyze and #report trends and results your,88,0.0,1.0,0.0,0.0,2021-06-01 11:00:29
FORTH #AMPLEFORTH #GOOGLE #YALE #HARVARD FORTH WILL KING THIS JUNGLE,247,0.0,1.0,0.0,0.0,2021-06-01 11:00:05
#SEO #TestimonialTuesday today featuring #Shopify #Google ranking strategy for one clients Roc,2180,0.0,1.0,0.0,0.0,2021-06-01 11:00:02
Don want pay for Google Photos storage Here are offline storage devices for your smartphones #Google #GooglePho,3914237,0.159,0.769,0.071,-0.1531,2021-06-01 10:59:27
Google and #hospital chain #HCA #Healthcare are partnering develop health care algorithms giving #Google access,994,0.0,0.699,0.301,0.6808,2021-06-01 10:58:33
Our new Content Writing Intern Heather has just written her first blog post for our website Read Now,42,0.0,1.0,0.0,0.0,2021-06-01 10:58:27
Backspindle Games Ltd #Google More info about our #discworld news Love #terrypratchett,387,0.0,0.724,0.276,0.6369,2021-06-01 10:57:57
aware that you use Google Photographs you may have pay store your photos and videos #Googlephotos,3134,0.085,0.915,0.0,-0.1027,2021-06-01 10:57:50
Small steps together can make big difference Excel Colour Print #Google,1362,0.0,0.769,0.231,0.4588,2021-06-01 10:57:42
Let plant trees and save bees together Excel Colour Print #Google,1362,0.0,0.592,0.408,0.7351,2021-06-01 10:56:46
#WhatsApp chairs Paresh Lal Grievance Officer for India #PareshBLal,2370,0.279,0.721,0.0,-0.4767,2021-06-01 10:56:22
Our mission help businesses purchase sustainably made print and marketing material that eco friendly and,1362,0.0,0.688,0.312,0.7096,2021-06-01 10:56:21
#Osmania University Dept Journalism amp Mass Comm will host town hall virtual free training Vax misinformati,56449,0.0,0.82,0.18,0.5106,2021-06-01 10:56:06
Every order placed helps plant trees and encourages bees the provide eco friendly print and marketing col,1362,0.0,0.617,0.383,0.8271,2021-06-01 10:55:56
Are you programmer #developer #development #coder #coding #computer #internet #java #javascript #python #html #webdevelopme,2771,0.0,1.0,0.0,0.0,2021-06-01 10:55:54
Are you programmer #developer #development #coder #coding #computer #internet #java #javascript #python #html #webdevelopme,1340,0.0,1.0,0.0,0.0,2021-06-01 10:55:54
Are you programmer #developer #development #coder #coding #computer #internet #java #javascript #python #html,41,0.0,1.0,0.0,0.0,2021-06-01 10:55:48
Become sustainable partner Excel Colour Print Call today the small steps make togeth,1362,0.0,0.8,0.2,0.4588,2021-06-01 10:55:21
Contact the Bio Link for successful Ads campaign #ecommerce #entrepreneur #marketingtips #facebooklive #branding #google,227,0.0,0.774,0.226,0.5859,2021-06-01 10:54:31
How Glocal Content Marketing Helps International Brands Stay Local #DigitalMarketing #Google #Marketing #Marketingtips,2961,0.0,0.822,0.178,0.3818,2021-06-01 10:54:04
Google What Can Say #google #googl #stock #tech #internet #goog #technology #epic #monster,210,0.0,1.0,0.0,0.0,2021-06-01 10:53:47
YPB Group adds Android compatibility MotifMicro marketing release #Android #Google #Facebook,1378,0.0,1.0,0.0,0.0,2021-06-01 10:53:02
Why Google Data Studio Must For Your Business Latest Trending Automation News Via,9197,0.0,1.0,0.0,0.0,2021-06-01 10:52:18
Why Google Data Studio Must For Your Business Latest Trending Automation News Via,9197,0.0,1.0,0.0,0.0,2021-06-01 10:52:06
Our new Content Writing Intern Heather has just written her first blog post for our website Read Now,152,0.0,1.0,0.0,0.0,2021-06-01 10:50:48
Woke this mail this morning Couldn believe that selected one the Google Generation scholars for,5,0.0,1.0,0.0,0.0,2021-06-01 10:50:45
Suite Master Course Free for hours #learning #education #Udemy #google #coupons,242,0.0,0.752,0.248,0.5106,2021-06-01 10:50:02
Women suing #Google over gender pay disparity win class action status,5659,0.229,0.523,0.248,0.3182,2021-06-01 10:50:02
you use Google Business When was the last time you updated added post Check out our infographic,69,0.0,1.0,0.0,0.0,2021-06-01 10:50:00
Finally accepted from google #Google #BugBounty #bugbountytip,35836,0.0,0.741,0.259,0.2732,2021-06-01 10:49:52
Finally accepted from google #Google #BugBounty #bugbountytip,15933,0.0,0.741,0.259,0.2732,2021-06-01 10:49:47
Capturing Your Audience Making Your Podcast Grow With SEO #Google #Podcast #SEO,11320,0.0,1.0,0.0,0.0,2021-06-01 10:49:08
Follow the link #google #GoogleCloudPlatform #googlecertification #networking,89,0.0,1.0,0.0,0.0,2021-06-01 10:48:30
part #Google commitment building products and programs expand learning for everyone #GoogleEDU bri,321,0.0,0.692,0.308,0.5994,2021-06-01 10:48:00
How index blog website Google search console For beginners guide #blogger #WordPress #blogging #indexwebsite,3,0.0,1.0,0.0,0.0,2021-06-01 10:46:26
Backspindle Games Ltd #Google More info about our #discworld news Love #terrypratchett,2941,0.0,0.724,0.276,0.6369,2021-06-01 10:45:57
Finally accepted from google #Google #BugBounty #bugbountytip,1014,0.0,0.741,0.259,0.2732,2021-06-01 10:45:15
Want more than Monthly Reports Easy with #Google #DataStudio can put your website performance your fingertips,1047,0.0,0.769,0.231,0.4939,2021-06-01 10:45:12
Why Google Data Studio Must For Your Business Latest Trending Automation News Via,2026,0.0,1.0,0.0,0.0,2021-06-01 10:45:08
Digital Advertising Out with the old and with the new Our latest article looks Google Privacy Sandbox what,1003,0.0,1.0,0.0,0.0,2021-06-01 10:44:36
Why Google Data Studio Must For Your Business Latest Trending Automation News Via,2026,0.0,1.0,0.0,0.0,2021-06-01 10:44:34
Digital Advertising Out with the old and with the new Our latest article looks Google Privacy Sandbox,836,0.0,1.0,0.0,0.0,2021-06-01 10:43:10
Google stopped #PerconaLive provide users with tips and tricks how run their #databases better the,3862,0.186,0.656,0.158,0.128,2021-06-01 10:42:06
While indispensable tool for digital #marketing and #SEO professionals Google #Analytics not without its flaws,7329,0.0,1.0,0.0,0.0,2021-06-01 10:40:01
#NewRelease BOUND RING amp SECRET Warm funny heartbreaking amazing story #Kindle,13051,0.161,0.376,0.462,0.6808,2021-06-01 10:39:39
OxygenOS for OnePlus series comes yet more camera tweaks #Google #Technology,1835,0.0,1.0,0.0,0.0,2021-06-01 10:39:34
Don want pay for Google Photos storage Here are offline storage devices for your smartphones #Google,41537,0.169,0.756,0.076,-0.1531,2021-06-01 10:39:25
Last chance register for our upcoming webinar for introduction Google Cloud Platform GCP and learn about some key,992,0.0,0.895,0.105,0.25,2021-06-01 10:38:56
Chenies Mews Imaging Centre #Google,97,0.0,1.0,0.0,0.0,2021-06-01 10:38:50
will also posting more depth summary soon sure look out for that #marketing #google #digitalmarketing #insights,85,0.0,0.867,0.133,0.3182,2021-06-01 10:38:50
The Google world account Stay tuned #Google #Alphabet #YouTube #GoogleEarth #Constellatio,29,0.0,1.0,0.0,0.0,2021-06-01 10:38:49
Concentric Tech amp Digital #Google,0,0.0,1.0,0.0,0.0,2021-06-01 10:38:07
Finally accepted from google #Google #BugBounty #bugbountytip,140,0.0,0.741,0.259,0.2732,2021-06-01 10:38:02
New technology coming #Google #innovation #DigitalTransformation Check the vodeo,16361,0.0,1.0,0.0,0.0,2021-06-01 10:37:49
Vaibhav Shah Hair Transplant clinic Mumbai #Google,112,0.0,1.0,0.0,0.0,2021-06-01 10:37:16
Sites built with signed exchanges will pre fetched Google #Google #SearchEngine,1,0.0,1.0,0.0,0.0,2021-06-01 10:37:08
Why Google Data Studio Must For Your Business Latest Trending Automation News Via,2532,0.0,1.0,0.0,0.0,2021-06-01 10:36:22
Last Thursday was Google annual marketing livestream and Greg attended learn what the coming year has store Here,312,0.0,1.0,0.0,0.0,2021-06-01 10:35:57
Last Thursday was Google annual marketing livestream and Greg attended learn what the coming year has store,85,0.0,1.0,0.0,0.0,2021-06-01 10:35:51
Each seo tool provide different crawl depth report Which tool software can access this information most consiste,1340,0.0,1.0,0.0,0.0,2021-06-01 10:35:41
Each seo tool provide different crawl depth report Which tool software can access this information most consi,691,0.0,1.0,0.0,0.0,2021-06-01 10:35:36
Body Ponte Vedra Beach #Google,0,0.0,1.0,0.0,0.0,2021-06-01 10:34:43
WhatsApp names Paresh Lal grievance officer for India website #WhatsApp #PareshBLal #WhatsappGrievanceOfficer #ITRul,96,0.205,0.795,0.0,-0.4767,2021-06-01 10:34:16
#fourierTransform overhead reduced mixing input tokens #naturallanguageprocessing #google,1537,0.0,1.0,0.0,0.0,2021-06-01 10:34:02
Twitter has three weeks show compliance with India new rules #NewITRules #Twitter #IntermediaryRules #DelhiHighCourt,96,0.0,1.0,0.0,0.0,2021-06-01 10:33:56
Google doc Paperpile underrated #phdchat #Google #AcademicChatter #citations,361,0.0,1.0,0.0,0.0,2021-06-01 10:33:24
#NewRelease BOUND RING amp SECRET Warm funny heartbreaking amazing story #Kindle,16361,0.161,0.376,0.462,0.6808,2021-06-01 10:32:17
ISRO amp MapmyIndia build alternative Google Maps #ISRO India answer #NASA #MapmyIndia that,607,0.0,1.0,0.0,0.0,2021-06-01 10:32:05
Why Google Data Studio Must For Your Business Latest Trending Automation News Via,4378,0.0,1.0,0.0,0.0,2021-06-01 10:31:56
This happens every person who the SEO field Just for fun #SEO #Google #algorithm #Ranking #tuesdayvibe #Tues,772,0.0,0.829,0.171,0.5106,2021-06-01 10:30:32
Instagram will soon let you create posts desktop Check out #Instagram #Desktop,22,0.0,0.84,0.16,0.2732,2021-06-01 10:29:25
Why Google Data Studio Must For Your Business Latest Trending Automation News Via,4378,0.0,1.0,0.0,0.0,2021-06-01 10:29:16
Battleground Mobile India pre registration goes live Google Play Store Check out,22,0.179,0.662,0.159,-0.0772,2021-06-01 10:29:15
OLIX OIL Ltd #Google,241,0.0,1.0,0.0,0.0,2021-06-01 10:29:00
Please recommend names journalists who frequently write #China Hindi English Urdu any other vernacular als,94,0.0,0.73,0.27,0.5859,2021-06-01 10:28:48
Google Pays Billion Apple Check out #Google #finance #DigitalMarketing #What,22,0.0,1.0,0.0,0.0,2021-06-01 10:28:39
Apple iPhone pro images leaked Check out #Apple #iPhone #Google #privacy #Faceb,22,0.173,0.827,0.0,-0.3182,2021-06-01 10:28:19
The women claimed that Google paid women employees approximately less per year than similar suited man http,152,0.0,1.0,0.0,0.0,2021-06-01 10:28:13
Elon Musk replies Indian YouTuber Check out #dogelon #LabraCoin #cryptotwitter,22,0.0,1.0,0.0,0.0,2021-06-01 10:28:07
Why Google Data Studio Must For Your Business Latest Trending Automation News Via,1060,0.0,1.0,0.0,0.0,2021-06-01 10:27:31
#linkedin #twitter #facebook #instagram #birthdaygirl #tumblr #socialmedia #pinterest #google #deal #gift #gifts,67572,0.0,1.0,0.0,0.0,2021-06-01 10:27:20
#Google Photos free unlimited storage ends tomorrow via,410,0.0,0.68,0.32,0.5106,2021-06-01 10:27:07
#Gmail account seems down inbound email since few hours #Google Any problems out there,31,0.172,0.828,0.0,-0.4019,2021-06-01 10:26:40
Great news for Dublin offices Google announce plan extend treasury building accommodate extra staff,96,0.0,0.591,0.409,0.765,2021-06-01 10:25:50
This happens every person who the SEO field Just for fun #SEO #Google #algorithm #Ranking #tuesdayvibe,292,0.0,0.82,0.18,0.5106,2021-06-01 10:25:41
#fourierTransform overhead reduced mixing input tokens #naturallanguageprocessing,317,0.0,1.0,0.0,0.0,2021-06-01 10:25:18
How Remove Google FRP Lock Nokia Nokia Google FRP Bypass #frp #lock #frpbypass #google #account #remove,666,0.0,1.0,0.0,0.0,2021-06-01 10:25:06
#Google and #hospital chain have teamed build #algorithms that can improve #healthcare,213,0.0,0.791,0.209,0.4404,2021-06-01 10:25:06
The women claimed that Google paid women employees approximately less per year than similar suited man,113,0.0,1.0,0.0,0.0,2021-06-01 10:23:51
Advanced Film Solutions #Google,4450,0.0,0.351,0.649,0.4019,2021-06-01 10:23:23
Technocrat Technology Communication #Google,138,0.0,1.0,0.0,0.0,2021-06-01 10:23:03
Google doc Paperpile underrated #phdchat #Google #AcademicChatter #citations,156706,0.0,1.0,0.0,0.0,2021-06-01 10:22:47
Toy train dumna nature park jabalpur #discovery #history #google #photography #canon #nikon #mobilephotography #myinc,0,0.0,1.0,0.0,0.0,2021-06-01 10:22:24
How Rich Snippets Boost Website Traffic #RichSnippets #SEO #Google #SearchEngine #SERPs #SEOTips,1027,0.0,0.613,0.387,0.743,2021-06-01 10:21:57
#Google updated service terms take effect #YouTube #GooglePlay,1131,0.0,1.0,0.0,0.0,2021-06-01 10:21:53
Google John Mueller comments the idea using Google Translate create content different languages via,1027,0.0,0.861,0.139,0.2732,2021-06-01 10:21:47
Google has assured advertisers that will not build Privacy Sandbox backdoors #Google,481592,0.0,0.815,0.185,0.3612,2021-06-01 10:21:41
Please recommend names journalists who frequently write #China Hindi English Urdu any other vernacular als,304,0.0,0.73,0.27,0.5859,2021-06-01 10:21:08
Organic traffic the primary channel that inbound marketing strives increase This traffic defined visit,29,0.0,0.85,0.15,0.3182,2021-06-01 10:20:15
#Algorithms Automating decisions takes humans out the equation The risk that ethics are removed too Like,33408,0.113,0.753,0.134,0.1027,2021-06-01 10:18:57
Please recommend names journalists who frequently write #China Hindi English Urdu any other vernacular als,37,0.0,0.73,0.27,0.5859,2021-06-01 10:18:52
#Google #Amazon set provide Cloud services #Israel Govt,88,0.0,1.0,0.0,0.0,2021-06-01 10:18:51
Love writing for this article Using chrome extension that makes use Google feature show how quickly anal,1608,0.0,0.792,0.208,0.6369,2021-06-01 10:18:01
#Google updated service terms take effect #YouTube #GooglePlay,72865,0.0,1.0,0.0,0.0,2021-06-01 10:17:18
#Google #Android ushers into new Android #Pixel Era,88,0.0,1.0,0.0,0.0,2021-06-01 10:17:01
will help you grow Digital World Contact Now #logodesiging #brandingstrategy,9,0.0,0.769,0.231,0.4019,2021-06-01 10:14:47
Let Explore Google Kubernetes Engine Understand What Google Kubernetes Engine How does work Use Google,352,0.0,1.0,0.0,0.0,2021-06-01 10:13:51
Please recommend names journalists who frequently write #China Hindi English Urdu any other vernacular als,224,0.0,0.73,0.27,0.5859,2021-06-01 10:13:18
Our latest integrations with #Google Workspace #Dropbox #Box A#dobe Stock #GettyImages and #Shutterstock allow,7121,0.0,0.872,0.128,0.2263,2021-06-01 10:13:07
Love writing for this article Using chrome extension that makes use Google feature show how quickly,84,0.0,0.781,0.219,0.6369,2021-06-01 10:12:25
Google doc Paperpile underrated #phdchat #Google #AcademicChatter #citations,163,0.0,1.0,0.0,0.0,2021-06-01 10:12:12
Thanks Google for the bday gift #Google #GooglePhotos,1,0.0,0.508,0.492,0.7003,2021-06-01 10:11:01
Please recommend names journalists who frequently write #China Hindi English Urdu any other vernacular als,56,0.0,0.73,0.27,0.5859,2021-06-01 10:10:44
#Google won allow you change language the site you not logged Why tech companies wicked things like this,1041,0.133,0.549,0.318,0.5719,2021-06-01 10:10:12
Trading the easy with ChainEX You know what easier Using our Android app Download ASAP,48,0.0,0.695,0.305,0.6908,2021-06-01 10:08:45
Find tips and tricks help you get the most out using Google Maps features for business and your digital marketing,51,0.068,0.811,0.122,0.296,2021-06-01 10:08:05
Read the top Flutter libraries tools packages and plugins for your app development #flutterdev #Google #libraries #to,256,0.0,0.899,0.101,0.2023,2021-06-01 10:06:31
Please recommend names journalists who frequently write #China Hindi English Urdu any other vernacular als,422,0.0,0.73,0.27,0.5859,2021-06-01 10:06:12
Mobile tracker app using #Python #twitter #vscode #visualstudiocode #Google #mobiletrackerapp #lightweightsoftware,5,0.0,1.0,0.0,0.0,2021-06-01 10:05:53
all the Clients have some jal and part #DigitalMarketing #digitalagency #digitalmarketin,73,0.0,1.0,0.0,0.0,2021-06-01 10:05:28
make people understand that over period time #digitalmarketing has become dominant field During this pandemic,73,0.0,1.0,0.0,0.0,2021-06-01 10:05:21
Read the top Flutter libraries tools packages and plugins for your app development #flutterdev #Google #libraries #to,281,0.0,0.899,0.101,0.2023,2021-06-01 10:04:51
Last chance register for our upcoming webinar for introduction Google Cloud Platform GCP and learn about,3510,0.0,0.882,0.118,0.25,2021-06-01 10:04:00
Are you looking seo specialist amp Digital Marketer will create USA canada live local citations Order Now,83,0.0,0.884,0.116,0.2732,2021-06-01 10:03:59
Xiaomi started the mass production its Fast charge They are also making software for With which users can choos,18,0.0,1.0,0.0,0.0,2021-06-01 10:03:50
Read the top Flutter libraries tools packages and plugins for your app development #flutterdev #Google #libraries #to,1450,0.0,0.899,0.101,0.2023,2021-06-01 10:03:38
Read the top Flutter libraries tools packages and plugins for your app development #flutterdev #Google,951,0.0,0.886,0.114,0.2023,2021-06-01 10:03:33
SYDNEY Australia Broadcaster and publisher Nine Entertainment Holdings Ltd has signed multi year content,53,0.0,0.823,0.177,0.4215,2021-06-01 10:03:22
