tweet,follower_count,neg,neu,pos,compound,time
Full Potential Learning Academy FPLA #Google Solving Quadratic Equations Using The,158,0.0,0.806,0.194,0.34,2021-06-01 12:43:18
Adi Tatarko #Houzz Give all Befez #Evilest #Woman #Business #Canada #ghost #SEOClown #NO #fear #Google #rev,1389,0.0,1.0,0.0,0.0,2021-06-01 12:43:11
Adi Tatarko #Houzz Give all Befez #Evilest #Woman #Business #Canada #ghost #SEOClown #NO #fear #Google #rev,443,0.0,1.0,0.0,0.0,2021-06-01 12:43:11
Adi Tatarko #Houzz Give all Befez #Evilest #Woman #Business #Canada #ghost #SEOClown #NO #fear #Google,3941,0.0,1.0,0.0,0.0,2021-06-01 12:43:05
They are found using more than your phone services like camera mic location WiFi etc simultaneously,2961,0.0,0.857,0.143,0.3612,2021-06-01 12:43:04
Officially starting today June #GooglePhotos changing its policies Here all you need know abou,182,0.0,1.0,0.0,0.0,2021-06-01 12:42:50
You should never give big words someone even you are #Google Google Photos was launched with the promi,178,0.0,0.919,0.081,0.128,2021-06-01 12:42:50
The Merry Marcos with Dust Jacket Valenti Angelo Copyright #Etsy #doyourememberwhen,2517,0.0,0.741,0.259,0.5423,2021-06-01 12:42:25
Whenever tech company uses the term unlimited for any its services take with grain salt,0,0.0,1.0,0.0,0.0,2021-06-01 12:41:31
short interesting story Chew and Pour overrated #DigitizingTraditionalClassrooms #cfc #CitiCBS #Money #Google #Haala,81,0.0,0.816,0.184,0.4019,2021-06-01 12:41:30
When #Google tested versions its Android that made #privacy settings easier find users took advantage them,628,0.0,0.745,0.255,0.5859,2021-06-01 12:40:50
only vaccinated out points flaw vaccination policy #sadahaqpb #sadahaqenglish #sadahaqurdu #saaddahaqnews,21741,0.0,1.0,0.0,0.0,2021-06-01 12:40:46
What really banned how would you expand your business Contact MIDBRAINS TECHNOLOGIES for Promotion Midb,0,0.177,0.699,0.124,-0.2484,2021-06-01 12:40:44
How private your #Gmail amp should you switch Every way you interact with your Gmail account can monitored,12063,0.0,1.0,0.0,0.0,2021-06-01 12:40:39
Learn How Speak TEDx Workshop coming soon #Google,660,0.0,1.0,0.0,0.0,2021-06-01 12:40:37
They are found using more than your phone services like camera mic location WiFi etc simultaneousl,7,0.0,0.857,0.143,0.3612,2021-06-01 12:40:31
#google #upi #wordonmac #whodg #microsoftinc Digital transactions become preferred mode payments Aurangabad Jun,153,0.0,1.0,0.0,0.0,2021-06-01 12:40:17
The Merry Marcos with Dust Jacket Valenti Angelo Copyright #Etsy #doyourememberwhen,1697,0.0,0.741,0.259,0.5423,2021-06-01 12:39:35
Internal Combustion Engine into Electric Vehicles #ford #jaguar #Volks Wagon #volvo #General Motors #lotus #amazon,2040,0.0,1.0,0.0,0.0,2021-06-01 12:39:26
short interesting story Chew and Pour overrated #DigitizingTraditionalClassrooms #cfc #CitiCBS #Money #Google #Haala,5320,0.0,0.816,0.184,0.4019,2021-06-01 12:39:12
you click into the Classwork tab you will notice menu that shows access Google Meet turned Google,5320,0.0,1.0,0.0,0.0,2021-06-01 12:39:06
Google John Mueller comments the idea using Google Translate create content different languages via,1355,0.0,0.861,0.139,0.2732,2021-06-01 12:38:42
Angela Nwalie Educational Services Inc #Google Happy June Friends #WritingCommunity,1522,0.0,0.541,0.459,0.7783,2021-06-01 12:37:52
Mural Painting Clock #GoodMorningTwitterWorld #ArtistOnTwitter #crafts #HomeDecor #DIY #artwork #Creative #doge,75,0.0,1.0,0.0,0.0,2021-06-01 12:37:20
Leave star review Google have helped you out #landscaping #lawncare,1326,0.118,0.882,0.0,-0.0516,2021-06-01 12:37:15
First Baptist Church Passtown #Google #FBCoP #Passtown #Godstrong #GodsWord,32,0.0,1.0,0.0,0.0,2021-06-01 12:37:11
you click into the Classwork tab you will notice menu that shows access Google Meet turned Google,1401,0.0,1.0,0.0,0.0,2021-06-01 12:37:10
short interesting story Chew and Pour overrated #DigitizingTraditionalClassrooms #cfc #CitiCBS #Money,12,0.0,0.787,0.213,0.4019,2021-06-01 12:37:10
#Google accused #spying #Android users #GoogleIO #GooglePlay #GooglePhotos #googlemeet #GoogleEarth #GooglePay,1130,0.18,0.82,0.0,-0.296,2021-06-01 12:37:02
When google has problem they google #Google #problemsolving #quotes,46,0.252,0.748,0.0,-0.4019,2021-06-01 12:36:38
would vote for party that has principles its MPs were aware and happy support unlike the present,2843,0.0,0.606,0.394,0.8442,2021-06-01 12:36:37
Are your properties listed where millions travellers search compare and book their trips and accommodation ever,3087,0.0,1.0,0.0,0.0,2021-06-01 12:36:10
#Marketing through #locallisting can have major impact your #business These services help the customer,310,0.0,0.828,0.172,0.4019,2021-06-01 12:36:06
Class action lawsuit against #google using consumer data plans show you advertisement they are paid for,46,0.112,0.888,0.0,-0.2263,2021-06-01 12:35:56
Exciting news HCA partners with Google Cloud accelerate their transformation #strategicpartnerships,310,0.0,0.758,0.242,0.4939,2021-06-01 12:35:06
Get insights how get ready #Zenfi Networks #Pipeline #podcast #Amazon,492,0.0,0.783,0.217,0.3612,2021-06-01 12:35:04
Google open its first retail store sell devices Google has otherwise relied its website and other retaile,124,0.0,1.0,0.0,0.0,2021-06-01 12:35:03
Get insights how get ready #Zenfi Networks #Pipeline #podcast #Amazon,2503,0.0,0.783,0.217,0.3612,2021-06-01 12:35:02
VEGAS THE MURDERS HOW WEALTHY MAN CAN BERSERK #Foxnews #CNN #LA #CA #OHIO #SF #FL,2901,0.226,0.62,0.154,-0.3612,2021-06-01 12:34:40
VEGAS THE MURDERS HOW WEALTHY MAN CAN BERSERK #Foxnews #CNN #LA #CA #OHIO #SF #FL #MI #PA,1731,0.206,0.653,0.141,-0.3612,2021-06-01 12:34:27
The lawsuit was filed the state Arizona against Google alleging that the company secretly breached user,147,0.112,0.888,0.0,-0.2263,2021-06-01 12:34:26
VEGAS THE MURDERS HOW WEALTHY MAN CAN BERSERK #Foxnews #CNN #LA #CA #OHIO #SF #FL,2901,0.226,0.62,0.154,-0.3612,2021-06-01 12:34:11
are thrilled introduce you our DSC Core Team who have accompanied this incredible and exciting journ,32,0.0,0.697,0.303,0.7269,2021-06-01 12:33:09
FLIGHT This Tribute NEVER FORGET YEARS from Detroit The Garbageman,2901,0.0,0.803,0.197,0.2979,2021-06-01 12:33:02
The Complete Flutter amp Dart Development Course Arabic hours students May release LINK htt,1450,0.0,1.0,0.0,0.0,2021-06-01 12:32:12
The Complete Flutter amp Dart Development Course Arabic hours students May release,2312,0.0,1.0,0.0,0.0,2021-06-01 12:32:07
FLIGHT THE STORY Tribute NEVER FORGET YEARS LATER from Detroit The Garbagema,2901,0.0,0.833,0.167,0.2979,2021-06-01 12:31:20
#GooglePhotos #Google #Photos #ExternalHardDisk The free unlimited storage Google photos will end today Exte,14,0.0,0.798,0.202,0.5106,2021-06-01 12:31:03
Check out the Top LiDAR Apps for the iPhone Pro Max #lidar #trending,6538,0.0,0.87,0.13,0.2023,2021-06-01 12:31:01
Watch this weeks Tech Tuesday How use Google Webmaster Tools effectively follow the link below,1105,0.0,0.828,0.172,0.4404,2021-06-01 12:30:48
Just completed course for Digital Marketing which provided google for free cost #Google,8,0.0,0.784,0.216,0.5106,2021-06-01 12:30:46
Leave star review Google have helped you out #landscaping,9,0.13,0.87,0.0,-0.0516,2021-06-01 12:30:29
Today amp meet with educational consultant amp certified #Google guru This crew cov,254,0.0,1.0,0.0,0.0,2021-06-01 12:30:23
you are interested you can give review Google #excavation #construction,24,0.0,0.769,0.231,0.4019,2021-06-01 12:30:22
Backlinks can boost your business enhancing your SEO and moving you higher the search results Backlinks can,27,0.0,0.856,0.144,0.4019,2021-06-01 12:30:05
LEAVE BEHIND THESE SEO MYTHS okay have Slow Loading Site #seoexperts,78,0.151,0.701,0.148,-0.0085,2021-06-01 12:30:00
you can hire for good #visitors your website Click #CV #IkoKaziKE #hiring,221,0.0,0.791,0.209,0.4404,2021-06-01 12:29:52
Tommy Thompson Realtor Keller Williams Allen #Google,70,0.0,1.0,0.0,0.0,2021-06-01 12:29:50
#linkedin #twitter #facebook #instagram #tumblr #socialmedia #birthdaygirl #pinterest #google #deal #gift #gifts,67572,0.0,1.0,0.0,0.0,2021-06-01 12:27:36
Google cloud now provides blockchain insights for Polygon network #Google #blockchain #googlecloud #Polygon,108,0.0,1.0,0.0,0.0,2021-06-01 12:27:35
This happens every person who the SEO field Just for fun #SEO #Google #algorithm #Ranking #tuesdayvibe #Tues,1,0.0,0.829,0.171,0.5106,2021-06-01 12:27:17
BREAKING NEWS Booming sales again May for Calgary resale housing market #Calgary #yyc,3194,0.0,1.0,0.0,0.0,2021-06-01 12:26:42
Bye bye #unlimited #Google #storage planning leave you have any suggestions,347,0.107,0.893,0.0,-0.0516,2021-06-01 12:26:21
Take break And take some fun learning here #Google #GoogleSheets #GoogleSheet #learning #learningisfun,1274,0.0,0.784,0.216,0.5106,2021-06-01 12:25:56
Find Google Map Cimon Seafood Resto amp Coffee #Google,44,0.0,1.0,0.0,0.0,2021-06-01 12:25:55
Gary Fullwood Designed Living #Google Your own Dream Kitchens and Bathrooms Show,2895,0.0,0.846,0.154,0.25,2021-06-01 12:25:03
Please recommend names journalists who frequently write #China Hindi English Urdu any other vernacular als,262,0.0,0.73,0.27,0.5859,2021-06-01 12:23:03
Everywhere you look you hear people talking about meaning disillusioned #Google engineer told McCallum They,324,0.172,0.828,0.0,-0.4404,2021-06-01 12:19:19
DigiTMG Data Science Machine Learning Training Malaysia #Google,6673,0.0,1.0,0.0,0.0,2021-06-01 12:19:06
Google Photos will officially end its unlimited free storage policy for pictures starting today The basic plan sta,30,0.0,0.837,0.163,0.5106,2021-06-01 12:18:56
Dev Dev Hello google app review state from last months tired,0,0.225,0.775,0.0,-0.4404,2021-06-01 12:18:49
How #SergeyBrin and #LarryPage funded #Google,293,0.0,1.0,0.0,0.0,2021-06-01 12:18:39
The Bee Charm #Google,35,0.0,0.526,0.474,0.4019,2021-06-01 12:18:22
Search News Buzz Video Recap Google Search May Updates Featured Snippet Testing Fewer Manual Actions amp Google,2495,0.0,1.0,0.0,0.0,2021-06-01 12:18:04
#rekt #reporter asks top holders UTC #chicago TWTR Day Chart revisited #Institutional #Bot #Short,102,0.0,0.878,0.122,0.2023,2021-06-01 12:18:00
#Google Internationalization Languages amp What Takes Succeed #SEO,116,0.0,0.686,0.314,0.4939,2021-06-01 12:17:51
Google del dia Jun Winter Australia #Google #GoogleDoodle,90,0.0,1.0,0.0,0.0,2021-06-01 12:17:19
How #SergeyBrin and #LarryPage funded #Google,7,0.0,1.0,0.0,0.0,2021-06-01 12:16:35
Documents reveal that #Google tracks its users even when the option turned off #BoycottGoogle,86,0.0,1.0,0.0,0.0,2021-06-01 12:16:23
VIDEO Faisal Karmali talks about some the best entrepreneurial secrets #Calgary #yyc #yycbiz #Go,3817,0.0,0.756,0.244,0.6369,2021-06-01 12:16:19
#Google new approach attributing ads across its vast platform flies face antitrust pressure via,3093,0.145,0.855,0.0,-0.296,2021-06-01 12:15:36
New Google Doodle has been released Celebrating Frank Kameny #google #doodle #design,177,0.0,0.748,0.252,0.5719,2021-06-01 12:15:09
Five years ago Google organic search results were dominated large publishers Does Google now have more diverse results,337,0.0,1.0,0.0,0.0,2021-06-01 12:15:07
#Google just #amazing with some our crazy searches found song with one those,188,0.167,0.833,0.0,-0.34,2021-06-01 12:15:01
Google photos end support for unlimited free high quality storage from today #news #dailynews #Google,475,0.0,0.684,0.316,0.7184,2021-06-01 12:14:55
There were around new Google #PlayStore downloads globally for food and drink apps between the beginning,593,0.0,1.0,0.0,0.0,2021-06-01 12:14:25
Five years ago Google organic search results were dominated large publishers Does Google now have more diverse results,300,0.0,1.0,0.0,0.0,2021-06-01 12:13:45
Google John Mueller comments the idea using Google Translate create content different languages via,300,0.0,0.861,0.139,0.2732,2021-06-01 12:12:56
Home Costs Ascend Quickest Speed Since Here The place where They Took off the Most,4,0.0,1.0,0.0,0.0,2021-06-01 12:12:03
Being the first page #Google will increase your #sales and your visibility Our Advanced #SEO Strategies get you,26,0.0,0.788,0.212,0.5106,2021-06-01 12:11:53
When #Google tested versions its Android that made #privacy settings easier find users took advantage them,753,0.0,0.745,0.255,0.5859,2021-06-01 12:11:52
Google del dia Jun Get Vaccinated Wear Mask Save Lives June #Google #GoogleDoodle,90,0.0,0.789,0.211,0.4939,2021-06-01 12:11:44
Thanks the #google community #GADS #GADS for enabling this great program that imparted skills not only,78,0.0,0.643,0.357,0.8305,2021-06-01 12:10:45
matter the service you are searching for unless pizza gas station using near your search may,398,0.0,0.932,0.068,0.0258,2021-06-01 12:10:06
Johns Sales and Service Airstream South Carolina #Google Used #keystonerv,130,0.0,1.0,0.0,0.0,2021-06-01 12:10:03
Being the first page #Google will increase your #sales and your visibility Our Advanced #SEO Strategies get,19,0.0,0.777,0.223,0.5106,2021-06-01 12:09:48
Google Photos free unlimited storage Google Photos will officially end its unlimited free storage policy for pictu,3,0.0,0.694,0.306,0.765,2021-06-01 12:08:40
All the big companies from #Google #Facebook are over here #Bangladesh because knows the next big thi,34,0.0,1.0,0.0,0.0,2021-06-01 12:08:01
Google del dia Jun Children Day June #Google #GoogleDoodle,90,0.0,1.0,0.0,0.0,2021-06-01 12:07:01
Pitman Training Swords #Google,3808,0.0,1.0,0.0,0.0,2021-06-01 12:06:54
The companies blamed the errors glitches artificial intelligence software #facebook #goog,200,0.331,0.482,0.187,-0.34,2021-06-01 12:05:47
Masood Rana digital marketer have five years experience this market have lot experience,25,0.0,1.0,0.0,0.0,2021-06-01 12:05:07
Google executives and engineers have reportedly acknowledged that the company made difficult for smartphone user,45,0.152,0.848,0.0,-0.3612,2021-06-01 12:05:04
Great Our church open tomorrow for person service meet West Main Street Fort,19503,0.0,0.745,0.255,0.6249,2021-06-01 12:04:17
Every invested User Experience results return between and How can good user experience give benefi,65,0.0,0.828,0.172,0.4404,2021-06-01 12:03:38
Living Property #Google #LivingProperty #Beccles #WaveneyValley #Worlingham #Suffolk #Norfolk,197,0.0,1.0,0.0,0.0,2021-06-01 12:02:36
Learn use #Google Forms create digital #assessments from informal surveys graded quizzes how use Sheet,1776,0.0,0.87,0.13,0.2732,2021-06-01 12:02:00
#Apple eating our lunch #Google employees admit #lawsuit that the company made nearly impossible for,330,0.0,0.886,0.114,0.2023,2021-06-01 12:01:21
Interested Cyber Security #applications #google #googleplay #cybersecurity #cyber #hack #hacking #security #safety,16264,0.0,0.662,0.338,0.6249,2021-06-01 12:01:20
How Optimize Core Web Vitals know how optimize #CoreWebVitals CWV check out this image created Semrush Blog,5041,0.0,0.553,0.447,0.8591,2021-06-01 12:01:08
Google now embroiled full class action lawsuit over whether underpaid women #google,58,0.147,0.853,0.0,-0.2263,2021-06-01 12:01:05
#Google announced new features and rollouts existing tools for advertisers #marketing,410,0.0,1.0,0.0,0.0,2021-06-01 12:01:00
Are you looking for alternative platform store your photos Google Photos unlimited free storage ends today,215502,0.0,0.82,0.18,0.5106,2021-06-01 12:01:00
How Optimize Core Web Vitals know how optimize #CoreWebVitals CWV check out this image created Semrush Blog,3815,0.0,0.553,0.447,0.8591,2021-06-01 12:00:38
Web Accessibility free course Google Udacity platform #WebBrowsing #Empathy,47,0.0,0.708,0.292,0.5106,2021-06-01 12:00:36
OUT NOW EBOOK #GirlsWhoLie Cribb,23891,0.0,1.0,0.0,0.0,2021-06-01 12:00:34
Grey Hat SEO safe risky proceed with caution What Black White amp Grey Hat SEO Find out this,23286,0.085,0.664,0.251,0.3612,2021-06-01 12:00:22
Rothamsted Manor #Google,566,0.0,1.0,0.0,0.0,2021-06-01 12:00:22
Submarine #HTML #Games #juegos #gratis #games #free #play games juegos #games #freegames #onlinegames,33,0.0,1.0,0.0,0.0,2021-06-01 12:00:10
#Highway traffic gets your nerves but #DigitalTraffic you would love have lot fun see your,6391,0.051,0.512,0.437,0.9011,2021-06-01 12:00:01
Will #Google Increase Enforcement User Generated Content Spam,116,0.231,0.556,0.213,-0.0516,2021-06-01 11:59:44
Google There need worry about using JavaScript when building websites #Google #SEO #Website #SEOTalk #ad #Dig,4549,0.162,0.838,0.0,-0.4404,2021-06-01 11:59:28
Google del dia June Celebrating Daniel Balavoine #Google #GoogleDoodle,90,0.0,0.684,0.316,0.5719,2021-06-01 11:59:21
How have the Rules Link Building changed Find out most date Golden Rules Link Building,13939,0.0,1.0,0.0,0.0,2021-06-01 11:58:39
Update #Google Suddenly Flips The Password Privacy Switch For Billions Users via #tech,7133,0.0,1.0,0.0,0.0,2021-06-01 11:58:31
Unedited court documents lawsuit involving Google have alleged that the tech giant reportedly knew that was,302,0.112,0.888,0.0,-0.2263,2021-06-01 11:58:29
How Optimize Core Web Vitals know how optimize #CoreWebVitals CWV check out this image created Semrus,202,0.0,0.533,0.467,0.8591,2021-06-01 11:58:18
Here #SEO tip Optimise your website and content meet your prospective customer needs easy use,165,0.0,0.691,0.309,0.7003,2021-06-01 11:58:01
Learn out #Google reportedly made difficult for smartphone users find privacy settings via,7133,0.172,0.828,0.0,-0.3612,2021-06-01 11:57:30
Your #business will take new boost via #web development company Try your maximum different from your competi,194,0.0,0.856,0.144,0.4019,2021-06-01 11:57:10
now know everything need know about microsd cards thanks #Google,2403,0.0,0.756,0.244,0.4404,2021-06-01 11:56:46
VIDEO Faisal Karmali talks about some the best entrepreneurial secrets #Calgary #yyc,3194,0.0,0.724,0.276,0.6369,2021-06-01 11:56:34
Five years ago Google organic search results were dominated large publishers Does Google now have,19595,0.0,1.0,0.0,0.0,2021-06-01 11:56:21
order win the #attention large #audience #packaging industry introduce your #brand you must need,194,0.0,0.774,0.226,0.5859,2021-06-01 11:55:42
Five years ago Google organic search results were dominated large publishers Does Google now have,418,0.0,1.0,0.0,0.0,2021-06-01 11:55:07
#Google Merchant Center Website Needs Improvement Policy Status via,116,0.0,0.727,0.273,0.4588,2021-06-01 11:54:32
Learn out #Google reportedly made difficult for smartphone users find privacy settings via,618,0.172,0.828,0.0,-0.3612,2021-06-01 11:54:30
Future Proof #google #news Follow for latest news The Morning After With too few drivers Uber,225,0.0,1.0,0.0,0.0,2021-06-01 11:54:18
The dismantling bank brands big tech #banking #Amazon #PayPal #Google,1414,0.0,1.0,0.0,0.0,2021-06-01 11:53:07
Australia Nine signs Facebook Google deals #Android #Google #Facebook,1378,0.0,1.0,0.0,0.0,2021-06-01 11:53:05
NitroPack love life #Webdesign #ecommerce #ecommercebusiness #wordpress #WooCommerce #seo #Marketin,3815,0.0,0.682,0.318,0.6369,2021-06-01 11:52:58
Learn out #Google reportedly made difficult for smartphone users find privacy settings via,54044,0.172,0.828,0.0,-0.3612,2021-06-01 11:51:24
Update #Google Suddenly Flips The Password Privacy Switch For Billions Users via #tech,54044,0.0,1.0,0.0,0.0,2021-06-01 11:51:03
#Google Search Traffic Changes Aren Always Indicative Technical Issues,116,0.0,1.0,0.0,0.0,2021-06-01 11:50:48
The feature that allows the developer make instant changes the backend and reflect the changes the code right,3815,0.0,1.0,0.0,0.0,2021-06-01 11:49:28
Mahraj Events Services #Google,76,0.0,1.0,0.0,0.0,2021-06-01 11:48:41
#Google this just stunt well you got your mins the news Would interesting know you,3596,0.0,0.73,0.27,0.5859,2021-06-01 11:48:35
the month Have you updated your Google Business profile with Offer update event What,1023,0.0,1.0,0.0,0.0,2021-06-01 11:48:33
Court documents allege Google hid privacy settings Android Read more #technology #Google #pr,0,0.104,0.896,0.0,-0.1027,2021-06-01 11:48:19
NitroPack love life #Webdesign #ecommerce #ecommercebusiness #wordpress #WooCommerce #seo,0,0.0,0.656,0.344,0.6369,2021-06-01 11:46:42
Hello google app review state from last months tired waiting now please nee,0,0.179,0.679,0.142,-0.1531,2021-06-01 11:46:26
The feature that allows the developer make instant changes the backend and reflect the changes the code right,613,0.0,1.0,0.0,0.0,2021-06-01 11:45:22
informative guide give you tons information about google classroom Order Google Classroom now #guide,14007,0.0,1.0,0.0,0.0,2021-06-01 11:45:03
#PeggyKs Tips and Tricks Weekly Update May #YouTube #GooglePhotos #Google Via,2225,0.13,0.87,0.0,-0.128,2021-06-01 11:44:48
The feature that allows the developer make instant changes the backend and reflect the changes the code,218,0.0,1.0,0.0,0.0,2021-06-01 11:43:39
Every invested User Experience results return between and How can good user experience give,7,0.0,0.818,0.182,0.4404,2021-06-01 11:41:27
Technology giant #Google #ArtificialIntelligence development particularly understanding human #language,962114,0.0,1.0,0.0,0.0,2021-06-01 11:40:20
How Remove Google FRP Lock Samsung without #frp #lock #frpbypass #google #account #remove #unlock,666,0.0,1.0,0.0,0.0,2021-06-01 11:40:06
Google Announces Three Data amp Analytics Tools Cloud Summit #ai #artificialintelligence #machin,2961,0.0,1.0,0.0,0.0,2021-06-01 11:40:05
Nice #Google #PrideMonth,4,0.0,0.417,0.583,0.4215,2021-06-01 11:38:05
Vertrauliche Mail Korrespondenz von #Google Mitarbeitern Gerichtsverfahren offengelegt This doesn sound like some,1207,0.0,0.828,0.172,0.3612,2021-06-01 11:36:41
Hailstorm Wrecks Havoc Handwara Other Parts Kashmir #sadahaqpb #sadahaqenglish #sadahaqurdu #saaddahaqnews,21741,0.281,0.719,0.0,-0.5994,2021-06-01 11:36:31
Google Announces Three Data amp Analytics Tools Cloud Summit #ai #artificialintelligence #machin,30,0.0,1.0,0.0,0.0,2021-06-01 11:35:46
Google Announces Three Data amp Analytics Tools Cloud Summit #ai #artificialintelligence #machin,2340,0.0,1.0,0.0,0.0,2021-06-01 11:35:31
Motors Accident Repair MOT amp Service Centre #Google,89,0.307,0.693,0.0,-0.4767,2021-06-01 11:35:18
Audrey Paterson Expert Lifestyle Planner #Google Are you crossroads life and,483,0.0,1.0,0.0,0.0,2021-06-01 11:35:01
#Google #Microsoft Support #HewlettPackard #HP #Dell,692,0.0,0.649,0.351,0.4019,2021-06-01 11:34:52
Driving restaurant meet friends used #Google maps for directions amp when arrived restaurant this happened,13295,0.0,0.819,0.181,0.4767,2021-06-01 11:34:48
This #Google image doodle from LINK,84,0.0,1.0,0.0,0.0,2021-06-01 11:34:39
How get traffic from yandex search engine #yandex #Google #bing #baidu #marketing #Monday #SEOKJIN #business #produ,2066,0.0,1.0,0.0,0.0,2021-06-01 11:34:09
How get traffic from yandex search engine #yandex #Google #bing #baidu #marketing #Monday #SEOKJIN #business #produ,868,0.0,1.0,0.0,0.0,2021-06-01 11:33:58
How get traffic from yandex search engine #yandex #Google #bing #baidu #marketing #Monday #SEOKJIN #business #produ,1648,0.0,1.0,0.0,0.0,2021-06-01 11:33:37
How get traffic from yandex search engine #yandex #Google #bing #baidu #marketing #Monday #SEOKJIN #business,1843,0.0,1.0,0.0,0.0,2021-06-01 11:33:33
the past eight years the interest live dealer casino games has reached all time high That mainly because,163,0.0,0.784,0.216,0.5267,2021-06-01 11:31:36
Export your #Google #Ads #data other platforms you can #analyze and #report trends and results your #Goog,703,0.0,1.0,0.0,0.0,2021-06-01 11:30:27
you know your operating system Depending your choice operating system Microsoft Apple and Google the,5509,0.0,1.0,0.0,0.0,2021-06-01 11:30:24
Goodbye unlimited #google photos storage #photography #photo #storage #filestorage,1334,0.0,1.0,0.0,0.0,2021-06-01 11:29:42
Google search for outerspace movie made #morningmotivation #Google #oldschool,234,0.0,1.0,0.0,0.0,2021-06-01 11:29:39
Export your #Google #Ads #data other platforms you can #analyze and #report trends and results your #Goog,971,0.0,1.0,0.0,0.0,2021-06-01 11:29:00
Submarine #HTML #Games #juegos #gratis #games #free #play games juegos #games #freegames #onlinegames #gaming http,7540,0.0,1.0,0.0,0.0,2021-06-01 11:28:58
compiled plethora the latest insights for the local SEO industry into free study available for,252,0.0,0.809,0.191,0.5106,2021-06-01 11:27:33
Arizona Attorney says that #Google continues collect location data even after users turn off #tracking,111,0.0,1.0,0.0,0.0,2021-06-01 11:27:29
Google ends free and unlimited storage offer for Google Photos today your free storage over change thi,2055,0.0,0.694,0.306,0.765,2021-06-01 11:27:26
Xiaomi started the mass production its Fast charge They are also making software for With which users can choos,2,0.0,1.0,0.0,0.0,2021-06-01 11:27:14
#linkedin #twitter #facebook #instagram #tumblr #birthdaygirl #socialmedia #pinterest #google #deal #gift #gifts,67572,0.0,1.0,0.0,0.0,2021-06-01 11:27:09
there way give third party app your location and not #Google one employee said according the documen,11755,0.0,0.856,0.144,0.4019,2021-06-01 11:26:50
The height CSS optimization Why waste bandwidth #Google,704,0.246,0.526,0.228,-0.0516,2021-06-01 11:26:45
Your guide getting ranked Google #google #seo #seorank #clientjoy #crm #google #tu,5041,0.0,1.0,0.0,0.0,2021-06-01 11:26:03
Thatcher Gourmet Popcorn #Google #BirthdayParty #Popcorn #gifts,23,0.0,1.0,0.0,0.0,2021-06-01 11:25:41
How Download Everything Google Knows About You #google #privacy,3057,0.0,1.0,0.0,0.0,2021-06-01 11:24:42
GOOGLE DOODLE EARTH DAY EVEWIN LAKRA APRIL,1187,0.0,1.0,0.0,0.0,2021-06-01 11:24:07
Providing high quality content one the most important things you can attract clients and generate sales,2961,0.0,0.753,0.247,0.5563,2021-06-01 11:24:04
Court docs #Google made harder for #Android users find privacy settings,1422,0.0,1.0,0.0,0.0,2021-06-01 11:23:51
