tweet,follower_count,neg,neu,pos,compound,time
Check out Gig #Fiverr #SEO #backlinks white hat manual link building #service for #Google top,627,0.0,0.886,0.114,0.2023,2021-06-07 00:49:47
#HOLYCOW carrying Age old Name Ask Type #Google OldestSurvivingLanguage,108,0.0,1.0,0.0,0.0,2021-06-07 00:49:38
you missed the lengthy keynote from Google this the highlight the biggest technology event Google thi,2153,0.118,0.753,0.129,0.0516,2021-06-07 00:48:43
Core web vitals Googles algorithm update #google #digitalmarketing #smallbusinessau,724,0.0,0.792,0.208,0.2732,2021-06-07 00:47:27
sourcesbd #Google,4461,0.0,1.0,0.0,0.0,2021-06-07 00:47:11
The time buy Safebank now before the Whales before the bull run Buy the dip Catch the higher,136,0.0,1.0,0.0,0.0,2021-06-07 00:46:59
The time buy Safebank now before the Whales before the bull run Buy the dip Catch the higher pric,136,0.0,1.0,0.0,0.0,2021-06-07 00:46:44
The time buy Safebank now before the Whales before the bull run Buy the dip,136,0.0,1.0,0.0,0.0,2021-06-07 00:46:30
The time buy Safebank now before the Whales before the bull run Buy the dip Catch the high,136,0.0,1.0,0.0,0.0,2021-06-07 00:46:16
The time buy Safebank now before the Whales before the bull run Buy the dip Catch the hig,136,0.0,1.0,0.0,0.0,2021-06-07 00:45:53
probably talking about this tomorrow telly How robust this new agreement tax What does mean,101,0.0,0.699,0.301,0.6808,2021-06-07 00:40:47
Google productivity adviser How solve email fatigue #Google,2538,0.204,0.612,0.184,-0.0516,2021-06-07 00:33:03
Hacking with Google Search #seo #google #search #hacking #hacks #web,358,0.0,1.0,0.0,0.0,2021-06-07 00:30:48
The time buy Safebank now before the Whales before the bull run Buy the dip Catch the higher pric,136,0.0,1.0,0.0,0.0,2021-06-07 00:30:30
The time buy Safebank now before the Whales before the bull run Buy the dip Catch the higher,136,0.0,1.0,0.0,0.0,2021-06-07 00:30:20
Google New Trillion Parameter Language Model Read More #AIlanguage #Google #Googlelanguage,655,0.0,1.0,0.0,0.0,2021-06-07 00:30:09
The time buy Safebank now before the Whales before the bull run Buy the dip Catch the higher,136,0.0,1.0,0.0,0.0,2021-06-07 00:30:06
share photos with wife account Does count storage for both our accounts like assume,37,0.0,0.719,0.281,0.5719,2021-06-07 00:30:01
The time buy Safebank now before the Whales before the bull run Buy the dip Catch the higher,136,0.0,1.0,0.0,0.0,2021-06-07 00:29:54
The time buy Safebank now before the Whales before the bull run Buy the dip Catch the,136,0.0,1.0,0.0,0.0,2021-06-07 00:29:41
The time buy Safebank now before the Whales before the bull run Buy the dip Catch the higher,136,0.0,1.0,0.0,0.0,2021-06-07 00:29:27
The time buy Safebank now before the Whales before the bull run Buy the dip Catch the,136,0.0,1.0,0.0,0.0,2021-06-07 00:29:14
The time buy Safebank now before the Whales before the bull run Buy the dip Catch the higher,136,0.0,1.0,0.0,0.0,2021-06-07 00:29:01
The time buy Safebank now before the Whales before the bull run Buy the dip Catch the higher,136,0.0,1.0,0.0,0.0,2021-06-07 00:28:47
Woo hoo excited announce that The Geomancer Apprentice now available #Apple Books also available,10167,0.0,0.686,0.314,0.6705,2021-06-07 00:25:47
sourcesbd #Google,87,0.0,1.0,0.0,0.0,2021-06-07 00:22:21
traditional eat rice national day mourning for victims death the Catskills guarantee the,174,0.453,0.448,0.1,-0.7964,2021-06-07 00:21:31
Frustrated with overseas based agencies Rotapix your local based Agency located Sydney CBD Visit,1687,0.207,0.793,0.0,-0.5267,2021-06-07 00:18:31
Updates Maps and Search help during times crisis #Google #TopStories,2413,0.277,0.541,0.182,-0.34,2021-06-07 00:14:45
Compelled marry she UNWILLING BRIDE BESTSELL Beverley #Romance #Regency #ebook #Google,215,0.0,0.893,0.107,0.0516,2021-06-07 00:14:13
#ZYXEL Next Generation Unified #Security Gateway with LAN DMZ WAN Ports Includes Year UTM Services Bundle,194,0.0,0.852,0.148,0.3818,2021-06-07 00:13:12
The time buy Safebank now before the Whales before the bull run Buy the dip Catch the highe,136,0.0,1.0,0.0,0.0,2021-06-07 00:11:40
The time buy Safebank now before the Whales before the bull run Buy the dip Catch the high,136,0.0,1.0,0.0,0.0,2021-06-07 00:11:26
Get Know Google Analytics Complete Guide Kayle Larkin #Google,4582,0.0,1.0,0.0,0.0,2021-06-07 00:11:03
The time buy Safebank now before the Whales before the bull run Buy the dip Catch the highe,136,0.0,1.0,0.0,0.0,2021-06-07 00:10:56
What Happens When You Type URL Address Bar DaysOfCode #coding #webdevelopment #Google #womenwhocode,34,0.0,1.0,0.0,0.0,2021-06-07 00:09:10
For #Apple Maps #Google Maps iCloud Google Drive One Photos Google Photos Notes Google Keep Keychain,349,0.0,1.0,0.0,0.0,2021-06-07 00:07:52
Somebody stop These amp more #AR images are available view your environment using the #ARknet platform,1354,0.128,0.872,0.0,-0.296,2021-06-07 00:06:27
For #Apple Maps #Google Maps iCloud Google Drive One Photos Google Photos Notes Google Keep,262,0.0,1.0,0.0,0.0,2021-06-07 00:05:10
The Google suite good alternative small business individuals came across this info Google sheets,255,0.0,0.818,0.182,0.4404,2021-06-07 00:05:05
Boy Drip #music #streams #spotify #applemusic #amazonmusic #tidal #deezer #rap #cloud #cloudwander #follow,2665,0.0,1.0,0.0,0.0,2021-06-07 00:04:17
this wasn the worst email ever received shame read #linktr OwenMullen #bookdea #Kindle #Kobo #Nook,8089,0.356,0.644,0.0,-0.802,2021-06-07 00:03:16
Looking back MakeUseOf has collection Google Docs Templates that could very useful for you and student,13498,0.0,0.824,0.176,0.4927,2021-06-07 00:03:01
Looking back MakeUseOf has collection Google Docs Templates that could very useful for you and student,7584,0.0,0.824,0.176,0.4927,2021-06-07 00:03:00
Cinematic photos help you relive your memories way that feels more vivid and realistic you feel like you trans,5242,0.0,0.766,0.234,0.6369,2021-06-07 00:03:00
The time buy Safebank now before the Whales before the bull run Buy the dip,136,0.0,1.0,0.0,0.0,2021-06-07 00:02:57
The time buy Safebank now before the Whales before the bull run Buy the dip,136,0.0,1.0,0.0,0.0,2021-06-07 00:02:39
The time buy Safebank now before the Whales before the bull run Buy the dip Catch the highe,136,0.0,1.0,0.0,0.0,2021-06-07 00:02:09
The time buy Safebank now before the Whales before the bull run Buy the dip Catch the higher,136,0.0,1.0,0.0,0.0,2021-06-07 00:01:54
Hooker Launceston City #Google #launceston #ljhooker #realestate,1804,0.0,1.0,0.0,0.0,2021-06-07 00:01:28
The time buy Safebank now before the Whales before the bull run Buy the dip Catch,136,0.0,1.0,0.0,0.0,2021-06-07 00:01:27
Need refresh your local SEO campaigns Learn everything you need know about ranking and visibilit,171,0.0,1.0,0.0,0.0,2021-06-07 00:00:11
Never Google your Symptoms This song was sent #Maasi Aunt who doctor completely agree with the,68,0.0,0.843,0.157,0.4201,2021-06-06 23:57:58
#Amazon #Facebook #Google and other retail social and search platforms are all seeking grow adding more,4467,0.0,1.0,0.0,0.0,2021-06-06 23:57:33
This horrifying you support your Head Diversity speaking such violently anti Semitic rhetor,218,0.456,0.419,0.126,-0.7964,2021-06-06 23:56:54
The time buy Safebank now before the Whales before the bull run Buy the dip Catch the highe,136,0.0,1.0,0.0,0.0,2021-06-06 23:56:47
The time buy Safebank now before the Whales before the bull run Buy the dip Catch the higher,136,0.0,1.0,0.0,0.0,2021-06-06 23:56:34
TRULY amp MUST NEWLY REGULATED amp BROKEN APART #Google #DemocratPropaganda,17722,0.248,0.517,0.235,-0.0516,2021-06-06 23:56:32
The time buy Safebank now before the Whales before the bull run Buy the dip Catch the hig,136,0.0,1.0,0.0,0.0,2021-06-06 23:56:19
the first chinese people fall sick were the ones with lowered immunity microchipped due radiation per sour,64,0.242,0.758,0.0,-0.5859,2021-06-06 23:56:11
The time buy Safebank now before the Whales before the bull run Buy the dip Catch the high,136,0.0,1.0,0.0,0.0,2021-06-06 23:55:51
The time buy Safebank now before the Whales before the bull run Buy the dip Catch the highe,136,0.0,1.0,0.0,0.0,2021-06-06 23:55:36
#MassEffect Part available now amp #ApplePodcasts,7494,0.0,1.0,0.0,0.0,2021-06-06 23:53:57
Want build your website NOW Don wait Watch build right before your eyes Incredible value less costly than you,7074,0.053,0.769,0.178,0.3804,2021-06-06 23:53:43
Want build your website NOW Don wait Watch build right before your eyes Incredible value less costly than you,353,0.053,0.769,0.178,0.3804,2021-06-06 23:52:13
#ibiza #electro #techno #club #art #popart #soundcloud #music #beatport #itunes,188,0.0,1.0,0.0,0.0,2021-06-06 23:50:58
The time buy Safebank now before the Whales before the bull run Buy the dip Catch the high,136,0.0,1.0,0.0,0.0,2021-06-06 23:50:52
#ibiza #electro #techno #club #art #popart #soundcloud #music #beatport #itunes,600,0.0,1.0,0.0,0.0,2021-06-06 23:49:56
#ibiza #electro #techno #club #art #popart #soundcloud #music #beatport #itunes,17459,0.0,1.0,0.0,0.0,2021-06-06 23:49:26
Meet the team behind Roxe ROC Introducing Chief Business Officer Roxe formerly senior executive #google,36,0.0,1.0,0.0,0.0,2021-06-06 23:49:25
are not convinced say that this story too browsers should not profile users #FLoC #Google,1735,0.139,0.861,0.0,-0.3089,2021-06-06 23:49:23
Nancy The Organizer #Google,74,0.0,1.0,0.0,0.0,2021-06-06 23:48:57
Under pressure #UK government releases #NHS #COVID data deals with big tech hours before openDemocracy was due sue,563,0.115,0.885,0.0,-0.296,2021-06-06 23:47:41
LIMITED yup heard THAT Meanwhile other medical recreational states have #Google what OTHER states,3544,0.168,0.832,0.0,-0.3885,2021-06-06 23:47:37
Want build your website NOW Don wait Watch build right before your eyes Incredible value less costl,813,0.0,0.802,0.198,0.4019,2021-06-06 23:45:04
Over Optimization Penalty #Google #overoptimization seo,6433,0.312,0.417,0.271,-0.1027,2021-06-06 23:44:06
Whereas #Antisemitic #Google employee #KamauBobb was not sacked but only reassigned meaning sti,1306,0.0,1.0,0.0,0.0,2021-06-06 23:44:03
you have critics you likely have success #facebook #instagram #youtube #twitter #love #follow,25,0.13,0.651,0.219,0.3612,2021-06-06 23:41:56
Thank you all including students from #waterlooregion for attending #Coding workshop Happy see many young students,646,0.0,0.693,0.307,0.7351,2021-06-06 23:40:31
Thank you all including students from #waterlooregion for attending #Coding workshop Happy see many young students,1402,0.0,0.693,0.307,0.7351,2021-06-06 23:40:30
Thank you all including students from #waterlooregion for attending #Coding workshop Happy see many young students,1392,0.0,0.693,0.307,0.7351,2021-06-06 23:40:25
Ghost Writer Inc #Google still business spite Covid anything else,26124,0.416,0.584,0.0,-0.6908,2021-06-06 23:39:53
Thoughts from simple man #BTCZ #Crypto #cryptotwitter #CoinMarketCap #Coinbase #Dogecoins #doge #FarCry #nftcollec,2297,0.0,1.0,0.0,0.0,2021-06-06 23:38:25
Elon Musk threatened hacktivist group #latest #google #technology #elonmusk #hackers #anonymous #hacking #tesla #sp,748,0.188,0.812,0.0,-0.4588,2021-06-06 23:35:55
The purpose global minimum tax not stop #Google #Facebook amp the like block few lucrative,1003,0.15,0.622,0.227,0.125,2021-06-06 23:30:40
Hackers are targeting employees returning the post COVID office #COVID #Employees #RemoteWorkers,23,0.0,1.0,0.0,0.0,2021-06-06 23:30:00
strange blurs faces but includes images like this streetview The fourth image actual,10193,0.089,0.703,0.208,0.431,2021-06-06 23:29:37
Automating the creation student project placards with Google Sheets and Slides #YouTube #googleslides,13498,0.0,0.851,0.149,0.2732,2021-06-06 23:29:01
Automating the creation student project placards with Google Sheets and Slides #YouTube #googleslides,7584,0.0,0.851,0.149,0.2732,2021-06-06 23:29:01
The purpose global minimum tax not stop #Google #Facebook amp the like block few lucrative,1003,0.15,0.622,0.227,0.125,2021-06-06 23:28:24
LATEST REVIEW Fergus was very helpful with difficult treatment and have hesitation recommending his ser,689,0.244,0.601,0.155,-0.1952,2021-06-06 23:24:46
Rappers Commentary Suggestions amp Diary #Google,108,0.0,1.0,0.0,0.0,2021-06-06 23:22:16
Party the #GRIDNET Global Chat Wanna join been told The Old Wizard himself joined,216,0.0,0.71,0.29,0.5994,2021-06-06 23:21:28
Party the #GRIDNET Global Chat Wanna join been told The Old Wizard himself joined,123,0.0,0.71,0.29,0.5994,2021-06-06 23:21:28
Party the #GRIDNET Global Chat Wanna join been told The Old Wizard himself joined,113,0.0,0.71,0.29,0.5994,2021-06-06 23:21:28
Party the #GRIDNET Global Chat Wanna join been told The Old Wizard himself joined,564,0.0,0.71,0.29,0.5994,2021-06-06 23:21:27
Party the #GRIDNET Global Chat Wanna join been told The Old Wizard himself joined,129,0.0,0.71,0.29,0.5994,2021-06-06 23:21:27
Party the #GRIDNET Global Chat Wanna join been told The Old Wizard himself joined,25,0.0,0.71,0.29,0.5994,2021-06-06 23:20:26
#MassEffect Part available now amp #ApplePodcasts,656,0.0,1.0,0.0,0.0,2021-06-06 23:20:13
How long will #Google and #YouTube allowed trample over peoples rights They are sick and need stoppe,81,0.171,0.829,0.0,-0.5106,2021-06-06 23:16:37
Day years ago today How many people remember Did #Google honor these brave men their home page watched,1833,0.0,0.708,0.292,0.765,2021-06-06 23:16:16
NONE the players you mentioned were anywhere near peak powers when they were that team,2187,0.0,1.0,0.0,0.0,2021-06-06 23:12:47
Google Series Earbuds Are AirPods for Android #Gear Products Headphones #ProductReview #Gear Reviews #google,7470,0.0,1.0,0.0,0.0,2021-06-06 23:07:40
#Ranking #rankingrights Women bible site Keyword #Google search #page traffic,3628,0.0,1.0,0.0,0.0,2021-06-06 23:04:06
#Google searches Azerbaijan old,3323,0.0,1.0,0.0,0.0,2021-06-06 23:03:11
#Google searches Clarence Williams III old,3323,0.0,1.0,0.0,0.0,2021-06-06 23:03:09
The update known the Google Page Experience Update and will involve major changes how webpage rankings are,20790,0.0,1.0,0.0,0.0,2021-06-06 23:01:15
Fan art Google Chrome chan from #draw #illustration #digitalart #digitaldraw #digitalillustration #gijin,20,0.0,0.827,0.173,0.3182,2021-06-06 22:55:04
For #Google Home users this smart lock comes highly recommended #smarttech,21,0.0,0.633,0.367,0.6391,2021-06-06 22:53:24
With new innovations Search Google can get you even closer what you looking for #Google,24,0.0,1.0,0.0,0.0,2021-06-06 22:53:05
#MassEffect Part available now amp #ApplePodcasts,222,0.0,1.0,0.0,0.0,2021-06-06 22:52:17
#MassEffect Part available now amp #ApplePodcasts,2330,0.0,1.0,0.0,0.0,2021-06-06 22:49:39
Well #Google wants #Morikawa win #Cantlay wins but #Rahm should have had #pga,31,0.0,0.613,0.387,0.6486,2021-06-06 22:48:05
Drones Shot Down Above Iraq Base Housing Troops Army Says #Android #Google #Facebook,1385,0.0,1.0,0.0,0.0,2021-06-06 22:48:02
Welcoming War Crimes The Normalization Henry Kissinger #Kissinger #warcrimes #data #Science #datascience #AI,2207,0.219,0.618,0.163,-0.25,2021-06-06 22:42:13
#google header commemorating #DDay colour unsurprised,149,0.0,1.0,0.0,0.0,2021-06-06 22:41:17
Tutor Doctor The Central Coast #Google,757,0.0,1.0,0.0,0.0,2021-06-06 22:41:00
Sooo one year old has new favorite song The vaccine song Google She pointing the Google nest,222,0.0,0.842,0.158,0.4588,2021-06-06 22:40:10
Hide Your Phone Number Google Business Google Local #commons #somborac #search #google #companies #seo via,2495,0.106,0.812,0.081,-0.1027,2021-06-06 22:40:06
The Space Cloud Inside The Satellite Strategies for AWS Google and Microsoft closer look how the major #cloud plat,2843,0.0,1.0,0.0,0.0,2021-06-06 22:38:58
Fossil upcoming smartwatch run Google new Wear #Fossil #Google #Tech,4591,0.0,1.0,0.0,0.0,2021-06-06 22:37:23
The Space Cloud Inside The Satellite Strategies for AWS Google and Microsoft closer look how the major,404,0.0,1.0,0.0,0.0,2021-06-06 22:34:38
Pagus Wine Tours #Google,152,0.0,1.0,0.0,0.0,2021-06-06 22:33:09
Okay first all the fuck isn And also love how actually recommending this,261,0.179,0.51,0.311,0.3818,2021-06-06 22:32:25
How improve SEO for free via SEO for Beginners #seo #google #pagerank #digitalmarketin,7074,0.0,0.64,0.36,0.7351,2021-06-06 22:31:07
Ways Get Traffic Your New Online Store Get New Traffic with #SocialMediaMarketing Leverage,153464,0.0,1.0,0.0,0.0,2021-06-06 22:30:01
Check out Gig #Fiverr #google #scraping for #search results #business #profiles,1680,0.0,1.0,0.0,0.0,2021-06-06 22:29:02
How use Meta Titles rank higher Google SEO Tutorial for begin via SEO for,7074,0.0,1.0,0.0,0.0,2021-06-06 22:28:34
#linkedin #onlineshop #twitter #facebook #instagram #tumblr #socialmedia #pinterest #google #deal #gift #gifts,67655,0.0,1.0,0.0,0.0,2021-06-06 22:27:22
Mathesul Invisalign Invisible Braces Orthodontic Dental Implant Clinic #Google,628,0.0,1.0,0.0,0.0,2021-06-06 22:25:06
How use Meta Titles rank higher Google SEO Tutorial for begin via,722,0.0,1.0,0.0,0.0,2021-06-06 22:22:39
How improve SEO for free via SEO for Beginners #seo #google #pagerank,722,0.0,0.617,0.383,0.7351,2021-06-06 22:21:13
How Mandala Exchange Kucoin THETA only Huobi THETA only #Google #Samsu,213,0.0,1.0,0.0,0.0,2021-06-06 22:21:10
Thai Street Food #Google are open today for pick ups and deliveries Dining openin,40012,0.0,1.0,0.0,0.0,2021-06-06 22:20:46
Minions arms Fitbit collaborates for kids #Fitbit #Google #kids #movies #SmartBands,700,0.0,1.0,0.0,0.0,2021-06-06 22:20:38
OPINION Businesses need adapt die today ever changing world #Calgary #yyc #yycbiz #Googl,3190,0.245,0.755,0.0,-0.5994,2021-06-06 22:18:03
OPINION Businesses need adapt die today ever changing world #Calgary #yyc,3196,0.281,0.719,0.0,-0.5994,2021-06-06 22:16:30
time ditch #Google #Chrome,8348,0.0,1.0,0.0,0.0,2021-06-06 22:16:07
Top Level Traffic Web Design Bridgend #Google #topleveltraffic #bridgend #digitalmarketin,5950,0.0,0.833,0.167,0.2023,2021-06-06 22:15:59
Best Computer Repair Bridgend and South Wales #Google #custombuild #customgamingpc #gaming,5950,0.0,0.704,0.296,0.6369,2021-06-06 22:15:47
answer #MariaCallas #TDuckCode mean #lovefighters duckstheyARE #inspiration #no #data #AI #Google #GenshinImpact,3636,0.0,1.0,0.0,0.0,2021-06-06 22:15:08
You can now let specific Android apps bypass the Google One VPN #Google #Technology,1838,0.0,1.0,0.0,0.0,2021-06-06 22:15:08
AirPlay support comes Google Nest speakers latest update for Starling Home Hub,1838,0.0,0.803,0.197,0.4019,2021-06-06 22:15:06
There are signs that new Google algorithm update scheduled for June already being rolled out according,20790,0.0,1.0,0.0,0.0,2021-06-06 22:14:39
time ditch Chrome #webbrowsers #google,3404,0.0,1.0,0.0,0.0,2021-06-06 22:13:07
Thai Street Food #Google are open,40012,0.0,1.0,0.0,0.0,2021-06-06 22:12:25
Top Open Redirect Dorks #cyber #cybersecurity #security #infosec #dork #google #url #web #bugbountytips #bugbounty #go,1710,0.092,0.798,0.11,0.0772,2021-06-06 22:11:17
Top Open Redirect Dorks #cyber #cybersecurity #security #infosec #dork #google #url #web #bugbountytips #bugbounty #go,16374,0.092,0.798,0.11,0.0772,2021-06-06 22:11:12
silasTnkoana Content Marketing Modern Guide #searchengineoptimization #digitalmarketing,580,0.0,1.0,0.0,0.0,2021-06-06 22:10:33
#MassEffect Part available now amp #ApplePodcasts,4354,0.0,1.0,0.0,0.0,2021-06-06 22:10:19
Thai Street Food #Google,34444,0.0,1.0,0.0,0.0,2021-06-06 22:10:03
Google Pixel might get new Astrotimelapse feature Report #Google #PixelPhone #GooglePixel,4591,0.0,1.0,0.0,0.0,2021-06-06 22:09:53
#youtube keeps bombarding with many ads recent months the point where dread clicking YouTube,7418,0.188,0.812,0.0,-0.4588,2021-06-06 22:09:04
Nice courses and guides start with for beginners from #ai #google #mlearning #machin,336,0.0,0.811,0.189,0.4215,2021-06-06 22:07:03
Remember #Google knows,8837,0.0,1.0,0.0,0.0,2021-06-06 22:05:00
#Google use patient data develop #healthcare algorithms for hospital chain,10525,0.0,1.0,0.0,0.0,2021-06-06 22:04:04
Marketing Mistakes Avoid Small Business via #marketing #digitalmarketing #seo #go,7074,0.37,0.63,0.0,-0.5719,2021-06-06 22:04:00
Minions arms Fitbit collaborates for kids #Fitbit #Google #kids #movies #SmartBands,199,0.0,1.0,0.0,0.0,2021-06-06 22:03:54
#google header commemorating #DDay colour unsurprised,1039,0.0,1.0,0.0,0.0,2021-06-06 22:03:42
#Google searches old,3323,0.0,1.0,0.0,0.0,2021-06-06 22:03:14
Dear just saw your about the son communicating with his father via phone that supposed make,5613,0.0,0.852,0.148,0.3818,2021-06-06 22:02:03
Welcoming War Crimes The Normalization Henry Kissinger #Kissinger #warcrimes #data #Science #datascience #AI,278,0.219,0.618,0.163,-0.25,2021-06-06 22:01:58
Find what store near you #Google,677,0.0,1.0,0.0,0.0,2021-06-06 22:01:00
Google John Mueller says some cases possible forward ranking signals from old page new page without,4704,0.0,1.0,0.0,0.0,2021-06-06 22:00:07
#Siri amp #Google Nice idea,714,0.0,0.588,0.412,0.4215,2021-06-06 21:58:24
Marketing Mistakes Avoid Small Business via #marketing #digitalmarketing,722,0.439,0.561,0.0,-0.5719,2021-06-06 21:58:04
#Google will not build backdoors Privacy Sandbox product for collecting data,240,0.0,1.0,0.0,0.0,2021-06-06 21:54:51
Microsoft Kate Crawford neither artificial nor intelligent #News #Technology #Microsoft #Time #Google,1291,0.0,0.84,0.16,0.2721,2021-06-06 21:52:26
This domain for sale #Innovation #entrepreneurship #CodeHabit #CodeNewbie #Code #Progra,8579,0.0,1.0,0.0,0.0,2021-06-06 21:51:29
Welcoming War Crimes The Normalization Henry Kissinger #Kissinger #warcrimes #data #Science #datascience #AI,1710,0.219,0.618,0.163,-0.25,2021-06-06 21:49:16
Welcoming War Crimes The Normalization Henry Kissinger #Kissinger #warcrimes #data #Science #datascience #AI,646,0.219,0.618,0.163,-0.25,2021-06-06 21:49:05
Welcoming War Crimes The Normalization Henry Kissinger #Kissinger #warcrimes #data #Science #datascience #AI,4694,0.219,0.618,0.163,-0.25,2021-06-06 21:49:02
Welcoming War Crimes The Normalization Henry Kissinger #Kissinger #warcrimes #data #Science #datascience #AI,289,0.219,0.618,0.163,-0.25,2021-06-06 21:49:00
Welcoming War Crimes The Normalization Henry Kissinger #Kissinger #warcrimes #data #Science #datascience #AI,1449,0.219,0.618,0.163,-0.25,2021-06-06 21:48:59
Welcoming War Crimes The Normalization Henry Kissinger #Kissinger #warcrimes #data #Science #datascience #AI,1080,0.219,0.618,0.163,-0.25,2021-06-06 21:48:56
Welcoming War Crimes The Normalization Henry Kissinger #Kissinger #warcrimes #data #Science #datascience #AI,176,0.219,0.618,0.163,-0.25,2021-06-06 21:48:54
where are all those techies can they come with solutions #SiliconValley #Google,0,0.0,0.866,0.134,0.1779,2021-06-06 21:45:40
ISRO amp MapmyIndia build alternative Google Maps #ISRO India answer #NASA #MapmyIndia that,78,0.0,1.0,0.0,0.0,2021-06-06 21:44:15
Google begs apology ugliest language Kannada #google #programming #coding #tech #technology #webdeveloper #javas,1710,0.237,0.688,0.075,-0.5574,2021-06-06 21:42:15
Google begs apology ugliest language Kannada #google #programming #coding #tech #technology #webdeveloper #javas,289,0.237,0.688,0.075,-0.5574,2021-06-06 21:42:10
Google begs apology ugliest language Kannada #google #programming #coding #tech #technology #webdeveloper #javas,8579,0.237,0.688,0.075,-0.5574,2021-06-06 21:42:10
Google begs apology ugliest language Kannada #google #programming #coding #tech #technology #webdeveloper #javas,3031,0.237,0.688,0.075,-0.5574,2021-06-06 21:42:05
Google begs apology ugliest language Kannada #google #programming #coding #tech #technology #webdeveloper #javas,3031,0.237,0.688,0.075,-0.5574,2021-06-06 21:42:05
Matt Cutts getting requoted since with the statement Google does not read keyword meta tags Wrong,0,0.171,0.829,0.0,-0.4767,2021-06-06 21:40:11
worth buying Google pixel June should wait for Pixel launch India,0,0.0,0.84,0.16,0.2263,2021-06-06 21:39:48
Karan Chopra Edina amp Burnsville Plastic Surgeon #Google,113,0.0,1.0,0.0,0.0,2021-06-06 21:39:34
Content Marketing Modern Guide #searchengineoptimization,49,0.0,1.0,0.0,0.0,2021-06-06 21:37:21
Lavine Extended Care Benefits Advisor #Google,1265,0.0,0.408,0.592,0.7003,2021-06-06 21:34:00
Best alternative google search Any suggestions out there #google #googlealternatives,2,0.0,0.682,0.318,0.6369,2021-06-06 21:32:53
How deal with big tech #Amazon #Apple #bigtech #competition #Facebook #Google #Microsoft,797,0.0,1.0,0.0,0.0,2021-06-06 21:31:29
What #Google doing other than training Search that NOT being talked about least that not,0,0.0,1.0,0.0,0.0,2021-06-06 21:31:01
doodle hoy #google the world watching,1308,0.0,1.0,0.0,0.0,2021-06-06 21:30:32
New #podcast tomorrow last weeks are all available now for downloading #iTunes,559,0.0,1.0,0.0,0.0,2021-06-06 21:30:28
Google union pushes company drop deadnames from badges #google,1706,0.208,0.792,0.0,-0.2732,2021-06-06 21:29:09
When comes free speech Joe Biden either asleep the wheel just bad Donald Trump need leader,710,0.168,0.673,0.159,-0.0516,2021-06-06 21:28:04
#onlineshop #linkedin #twitter #facebook #instagram #tumblr #socialmedia #pinterest #google #deal #gift #gifts,67655,0.0,1.0,0.0,0.0,2021-06-06 21:27:27
Introducing Security Design #Google #infosec,5284,0.0,0.625,0.375,0.34,2021-06-06 21:26:49
#MassEffect Part available now amp #ApplePodcasts,1591,0.0,1.0,0.0,0.0,2021-06-06 21:26:27
Are you looking for someone who can take your #GoogleAds campaigns the Next Level Check Out,116,0.0,1.0,0.0,0.0,2021-06-06 21:25:53
Open Source Insights #google #supplychainintegrity,79,0.0,1.0,0.0,0.0,2021-06-06 21:25:39
Introducing Security Design #Google #infosec,1089,0.0,0.625,0.375,0.34,2021-06-06 21:25:12
Introducing Security Design #Google #infosec,2483,0.0,0.625,0.375,0.34,2021-06-06 21:25:08
