tweet,follower_count,neg,neu,pos,compound,time
Here are few main things consider when optimizing your content for Google Discover via,38,0.0,0.812,0.188,0.4588,2021-05-17 10:13:25
Just redesigned brand new logo and wallpaper for desktop what you guys think #MachineLearning #Google #App,1536,0.0,1.0,0.0,0.0,2021-05-17 10:12:41
Just redesigned brand new logo and wallpaper for desktop what you guys think #MachineLearning #Google #App,160,0.0,1.0,0.0,0.0,2021-05-17 10:12:37
Just redesigned brand new logo and wallpaper for desktop what you guys think #MachineLearning #Google #App,3858,0.0,1.0,0.0,0.0,2021-05-17 10:12:36
Just redesigned brand new logo and wallpaper for desktop what you guys think #MachineLearning #Google,51,0.0,1.0,0.0,0.0,2021-05-17 10:12:31
How Change Language #google Chrome #newstechnology,4388,0.0,1.0,0.0,0.0,2021-05-17 10:11:50
Rankings Collapsed After Buying Google Ads #Google #googlerankings #Ranking #googleads #dropping,810,0.174,0.826,0.0,-0.2732,2021-05-17 10:11:27
Tips Positioned Yourself the Top Feng Shui Master Singapore #fengshui #singapore #google,7997,0.0,0.859,0.141,0.2023,2021-05-17 10:10:48
Ranked #Website #Google for #bermuda #entertainment,10,0.0,1.0,0.0,0.0,2021-05-17 10:10:19
Great review our services #FiveStar #LawMadeSimple #MondayMotivation #mondaythoughts #MondayVibes #Monday,57,0.0,0.687,0.313,0.6249,2021-05-17 10:09:19
#Google Uncle got big misunderstanding did purpose They are not followers Islam but enemy Islam,68,0.338,0.662,0.0,-0.7684,2021-05-17 10:09:11
School Complementary Therapies #Google,1856,0.0,1.0,0.0,0.0,2021-05-17 10:08:36
The Google world account Stay tuned #Google #Alphabet #YouTube #GoogleEarth #Constellatio,0,0.0,1.0,0.0,0.0,2021-05-17 10:08:19
Matter new connectivity standard backed #IoT alliance #Google #Amazon and #Apple,618,0.0,0.804,0.196,0.0516,2021-05-17 10:08:17
Rankings Collapsed After Buying Google Ads #Google #googlerankings #Ranking #googleads,162,0.189,0.811,0.0,-0.2732,2021-05-17 10:07:53
Question was asked about Google rankings dropping after buying PPC Ads then coming back right after turning off the ads via,1671,0.0,1.0,0.0,0.0,2021-05-17 10:07:46
ALPHABET xGOOG strong trend line supports this area You can buy here with stop loss RSI,135,0.202,0.538,0.26,0.3182,2021-05-17 10:07:33
Check this article was very useful for #privacy #security #Google #CyberSecurity,95,0.0,0.758,0.242,0.4927,2021-05-17 10:05:52
The Idiot Guide Link Metrics SEO #Google #Linkbuilding,7122,0.32,0.68,0.0,-0.5106,2021-05-17 10:05:04
Google Assistant will soon get new Memory feature Android For any further inquiries feel free contact,1315,0.0,0.82,0.18,0.5106,2021-05-17 10:04:38
Google driving decided exertion tech goliaths help program that gives work,232,0.0,0.787,0.213,0.4019,2021-05-17 10:04:36
Here are few main things consider when optimizing your content for Google Discover via,831,0.0,0.812,0.188,0.4588,2021-05-17 10:04:20
DEFINITION WAHALA Your battery and you see your boss work upload pictures him and his family,247,0.0,1.0,0.0,0.0,2021-05-17 10:03:26
Have you tried Google Page Experience Option from Google Search Console What extra information provides about,58,0.0,1.0,0.0,0.0,2021-05-17 10:03:04
New episode Its that time again Another episode TJR Aftermath this episode joined Lacy from,597,0.0,1.0,0.0,0.0,2021-05-17 10:02:50
Will #Google ever launch its own #cryptocurrency going Happen now near What you think,32,0.0,1.0,0.0,0.0,2021-05-17 10:02:45
Some Clarification Show Must #cryptotwitter #dogecoin #Coinmarketcap #FFXIV #Crypto #Dogecoinarmy #BTCZ #BitcoinZ,241,0.0,1.0,0.0,0.0,2021-05-17 10:02:36
Google admitted copying Oracle source code the genesis the suit filed Oracle lower courts seeking damage,638,0.273,0.657,0.071,-0.6124,2021-05-17 10:01:38
ISRO amp MapmyIndia build alternative Google Maps #ISRO India answer #NASA #MapmyIndia that,80,0.0,1.0,0.0,0.0,2021-05-17 10:01:21
#Google Telegraphing the future security,11191,0.0,0.625,0.375,0.34,2021-05-17 10:00:57
Here #SEO tip Optimise your website and content meet your prospective customer needs easy use,216,0.0,0.691,0.309,0.7003,2021-05-17 10:00:31
Google Pixel with Cell Phone Only White Unlocked Box eBay #bar #google #Pixel #CellPhone #technology,1658,0.0,1.0,0.0,0.0,2021-05-17 10:00:21
Motors Accident Repair MOT amp Service Centre #Google,88,0.307,0.693,0.0,-0.4767,2021-05-17 10:00:08
Wall Mount Holder for Google Nest Mini gen Space Saving Outlet Mount with Cord Management,52,0.0,1.0,0.0,0.0,2021-05-17 10:00:03
Question was asked about Google rankings dropping after buying PPC Ads then coming back right after turning off the,234188,0.0,1.0,0.0,0.0,2021-05-17 09:59:29
Get Google Business Upload what you sell there directly Make sure you link your WhatsApp Business Line,92,0.0,0.874,0.126,0.3182,2021-05-17 09:59:00
#google reviews are coming through #wirral #Wirralsmallbusiness,834,0.0,1.0,0.0,0.0,2021-05-17 09:58:45
Question for #reactjs #Developer What you prefer Create react app Webpack Babel #javascript #nodejs DaysOfCod,160,0.0,0.87,0.13,0.2732,2021-05-17 09:57:57
Question for #reactjs #Developer What you prefer Create react app Webpack Babel #javascript #nodejs DaysOfCod,777,0.0,0.87,0.13,0.2732,2021-05-17 09:57:54
Here are few main things consider when optimizing your content for Google Discover via,1671,0.0,0.812,0.188,0.4588,2021-05-17 09:57:41
#Cumbia #Dance and #dancers #singer #rock and #latin #piano #digitalart #Clouds #Google https,5825,0.0,1.0,0.0,0.0,2021-05-17 09:57:36
Here are few main things consider when optimizing your content for Google Discover via,19641,0.0,0.812,0.188,0.4588,2021-05-17 09:56:42
Google event will virtual this year due the pandemic Interested viewers can watch the #Android,1675,0.0,0.838,0.162,0.4019,2021-05-17 09:56:40
Google event will virtual this year due the pandemic Interested viewers can watch the #Android,478,0.0,0.838,0.162,0.4019,2021-05-17 09:56:22
Google What Going With FAQ Rich Results #search #faq #google,8769,0.0,0.714,0.286,0.5574,2021-05-17 09:55:30
Here are few main things consider when optimizing your content for Google Discover via,419,0.0,0.812,0.188,0.4588,2021-05-17 09:55:27
Here are few main things consider when optimizing your content for Google Discover via,12123,0.0,0.812,0.188,0.4588,2021-05-17 09:53:17
Here are few main things consider when optimizing your content for Google Discover via,234188,0.0,0.812,0.188,0.4588,2021-05-17 09:52:41
Sharp new flagship phone has giant inch camera sensor and Leica branding #Sharp,273,0.0,0.896,0.104,0.1027,2021-05-17 09:52:36
Companies individuals looking have their App developed please reach out and team are specialist,188,0.0,0.779,0.221,0.34,2021-05-17 09:51:31
#flyinghighwithflutter Guest #KasperLund founder #Dart amp CEO #Toit platform for #IoT dev,200,0.0,1.0,0.0,0.0,2021-05-17 09:51:29
#flyinghighwithflutter Guest #KasperLund founder #Dart amp CEO #Toit platform for #IoT dev,1196,0.0,1.0,0.0,0.0,2021-05-17 09:50:58
#flyinghighwithflutter Guest #KasperLund founder #Dart amp CEO #Toit platform for,41,0.0,1.0,0.0,0.0,2021-05-17 09:50:42
This the way you show the mobile The how could even allowed such app Josh,17,0.0,1.0,0.0,0.0,2021-05-17 09:50:14
GTA House Buyers #Google,59,0.0,1.0,0.0,0.0,2021-05-17 09:48:48
OMG has leaked the design the upcoming Pixel amp Pixel Pro seems like really the year,158,0.122,0.745,0.133,0.0516,2021-05-17 09:47:11
Wing Chun International Oxford #Google,735,0.0,1.0,0.0,0.0,2021-05-17 09:45:58
Are you aware the new update #Google Core Web Vitals being rolled out May This session with,17026,0.0,0.884,0.116,0.2732,2021-05-17 09:45:05
Get Google Business Upload what you sell there directly Make sure you link your WhatsApp Business Line,1926,0.0,0.874,0.126,0.3182,2021-05-17 09:44:55
ISRO amp MapmyIndia build alternative Google Maps #ISRO India answer #NASA #MapmyIndia that,146,0.0,1.0,0.0,0.0,2021-05-17 09:44:37
you think #bitcoin means crypto you think #Google means the Internet #elongate #crypto #defi,0,0.0,1.0,0.0,0.0,2021-05-17 09:43:58
Googled Famous people who had business coaches and BOOM #Google former CEO Eric Schmidt had one Tak,151,0.0,1.0,0.0,0.0,2021-05-17 09:43:57
Google admitted copying Oracle source code the genesis the suit filed Oracle lower courts seeking damage,2755,0.273,0.657,0.071,-0.6124,2021-05-17 09:43:56
Have you visited recently would really appreciate you could leave some feedback following your exp,2156,0.07,0.756,0.174,0.4201,2021-05-17 09:43:00
The Google world account Stay tuned #Google #Alphabet #YouTube #GoogleEarth #Constellatio,12,0.0,1.0,0.0,0.0,2021-05-17 09:42:55
Ray Sun Property #Google,182,0.0,1.0,0.0,0.0,2021-05-17 09:42:52
Get Google Business Upload what you sell there directly Make sure you link your WhatsApp Business,40,0.0,0.867,0.133,0.3182,2021-05-17 09:42:28
The combined revenue the top public cloud service providers Amazon Web Services #Microsoft,2374,0.0,0.759,0.241,0.3612,2021-05-17 09:42:22
The combined revenue the top public cloud service providers Amazon Web Services #Microsoft,29524,0.0,0.759,0.241,0.3612,2021-05-17 09:42:01
Just worth mentioning #Google #Stadia while #technology trending,15427,0.0,0.787,0.213,0.2263,2021-05-17 09:41:58
Just worth mentioning #Google #Stadia while #technology trending,35755,0.0,0.787,0.213,0.2263,2021-05-17 09:41:52
#starlink #Tesla #bitcoin #riyadh #tokyo #dubai #sydney #offer #cristiano #london #nyc #egypt #paris #Google,553,0.0,1.0,0.0,0.0,2021-05-17 09:41:36
Just worth mentioning #Google #Stadia while #technology trending,0,0.0,0.787,0.213,0.2263,2021-05-17 09:41:34
worth reading article How Google Tests Software Dilusha Kumarage #Google #testing,35,0.0,0.84,0.16,0.2263,2021-05-17 09:39:59
Google rolling out dark mode for its search engine desktops Here how users can spot the feature,1095,0.0,1.0,0.0,0.0,2021-05-17 09:39:03
GIVEAWAY Today launching first promo codes get #NeXt #Widgets for free STEPS Follow Retweet amp lik,9,0.0,0.82,0.18,0.5106,2021-05-17 09:38:25
YourSpeech #Google,156,0.0,1.0,0.0,0.0,2021-05-17 09:36:39
Language models like #GPT could herald new type #SearchEngine The way search online hasn,387,0.0,0.839,0.161,0.3612,2021-05-17 09:35:46
videos sharing portal for children recognize children natural creative engagements,62,0.0,0.38,0.62,0.8316,2021-05-17 09:35:38
Artificial Intelligence diversity groups snub future funding from Google over staff treatment #ai,979,0.166,0.651,0.183,0.0772,2021-05-17 09:32:46
OMG has leaked the design the upcoming Pixel amp Pixel Pro seems like really the year,37,0.122,0.745,0.133,0.0516,2021-05-17 09:32:01
Pitman Training Swords #Google,1705,0.0,1.0,0.0,0.0,2021-05-17 09:31:59
Check out #Fiverr #SEO #backlinks white hat manual link building #service for #Google ranking #marketing,631,0.0,1.0,0.0,0.0,2021-05-17 09:31:28
Struggling reach the top #Google Read our latest article packed with tips and tricks improve your #SEO,1475,0.195,0.543,0.262,0.128,2021-05-17 09:30:19
Secure your website your software date Are your login pages encrypted Are you using secure host,6,0.0,0.745,0.255,0.5859,2021-05-17 09:29:59
Android info leaked ahead Google conference,3324,0.315,0.685,0.0,-0.3182,2021-05-17 09:29:33
Pitman Training Swords #Google,1705,0.0,1.0,0.0,0.0,2021-05-17 09:29:02
#SAVE #SAMSUNG #Smart Ultra HDR #QLED with #Bixby #Alexa amp #Google #Currys World,745,0.0,1.0,0.0,0.0,2021-05-17 09:28:27
#Googledevices #googlecloud #google #cloudcomputing #cloudstorage What the maximum limit free cloud storage Google,9125,0.0,0.784,0.216,0.5106,2021-05-17 09:27:49
Methods Brand Yourselves the Top Feng Shui Master Singapore #fengshui #singapore #google,7997,0.0,0.859,0.141,0.2023,2021-05-17 09:27:46
Check out #Gig #Fiverr #SEO #backlinks white hat manual #link #building service for #google top ranking https,631,0.0,0.899,0.101,0.2023,2021-05-17 09:27:18
critical #google #art #digitalart #butisitart #criticalroleofart #googlepredictions #whatwouldgooglesay about #crit,7288,0.204,0.796,0.0,-0.3182,2021-05-17 09:26:07
Pitman Training Swords #Google,1705,0.0,1.0,0.0,0.0,2021-05-17 09:24:01
Check out National Productivity Council Google Please follow NPC Google and stay tuned,218,0.0,0.839,0.161,0.3182,2021-05-17 09:23:49
Pitman Training Swords #Google,1705,0.0,1.0,0.0,0.0,2021-05-17 09:23:49
Pitman Training Swords #Google,1705,0.0,1.0,0.0,0.0,2021-05-17 09:23:38
Pitman Training Swords #Google,1705,0.0,1.0,0.0,0.0,2021-05-17 09:23:27
Pitman Training Swords #Google,1705,0.0,1.0,0.0,0.0,2021-05-17 09:23:12
#Google #AI Researchers Are Dreaming New Species Search Engine #SearchEngines,771,0.0,1.0,0.0,0.0,2021-05-17 09:23:08
Google Search #seojoke #digitalmarketingjoke #seo #digitalmarketing #business #google #smallbusiness,149,0.0,1.0,0.0,0.0,2021-05-17 09:23:00
Pitman Training Swords #Google,1705,0.0,1.0,0.0,0.0,2021-05-17 09:22:55
Pitman Training Swords #Google,1705,0.0,1.0,0.0,0.0,2021-05-17 09:22:42
Pitman Training Swords #Google,1705,0.0,1.0,0.0,0.0,2021-05-17 09:22:31
Pitman Training Swords #Google,1705,0.0,1.0,0.0,0.0,2021-05-17 09:22:15
Pitman Training Swords #Google,1705,0.0,1.0,0.0,0.0,2021-05-17 09:22:01
Pitman Training Swords #Google,1705,0.0,1.0,0.0,0.0,2021-05-17 09:21:48
Pitman Training Swords #Google,1705,0.0,1.0,0.0,0.0,2021-05-17 09:21:38
Pitman Training Swords #Google,1705,0.0,1.0,0.0,0.0,2021-05-17 09:21:24
Pitman Training Swords #Google,1705,0.0,1.0,0.0,0.0,2021-05-17 09:21:13
Language models like #GPT could herald new type #SearchEngine The way search online hasn,243,0.0,0.839,0.161,0.3612,2021-05-17 09:21:12
Language models like #GPT could herald new type #SearchEngine The way search online hasn,2822,0.0,0.839,0.161,0.3612,2021-05-17 09:21:05
Forex World Gold Reef City #Google,5685,0.0,1.0,0.0,0.0,2021-05-17 09:20:59
Pitman Training Swords #Google,1705,0.0,1.0,0.0,0.0,2021-05-17 09:20:57
Pitman Training Swords #Google,1705,0.0,1.0,0.0,0.0,2021-05-17 09:20:44
Pitman Training Swords #Google,1705,0.0,1.0,0.0,0.0,2021-05-17 09:20:00
Wonder who uses #BitTorrent protocols that right #Netflix #Facebook #Google #Twitter just name few Don,10,0.0,1.0,0.0,0.0,2021-05-17 09:19:09
Hackers stealing money via fake trading crypto apps Android iOS #Android #Google #Facebook,1373,0.382,0.618,0.0,-0.7783,2021-05-17 09:18:05
Fishing #discovery #history #google #photography #photographer #mobilephotography #myincrediblestory #netgeo #incredibleindi,270,0.0,1.0,0.0,0.0,2021-05-17 09:17:51
Fishing #discovery #history #google #photography #photographer #mobilephotography #myincrediblestory #netgeo,510,0.0,1.0,0.0,0.0,2021-05-17 09:17:46
How Long Does SEO Take And Why #page #google #show #search #year #seo,2803,0.0,1.0,0.0,0.0,2021-05-17 09:17:29
How Long Does SEO Take And Why #page #google #show #search #year #seo,129,0.0,1.0,0.0,0.0,2021-05-17 09:16:53
what this #ICP ICP out nowhere And inspires get get out here above BTC and,423,0.147,0.853,0.0,-0.3412,2021-05-17 09:15:31
People What your job Web Developer People nice job You smart wish could that too but,728,0.0,0.699,0.301,0.5574,2021-05-17 09:15:30
and committees decided will prepare joint report countering SLAPPs Italian antitrust,2126,0.0,1.0,0.0,0.0,2021-05-17 09:14:36
What makes great SEO report Pat Ahern and other industry experts share their best tips for buil,139,0.0,0.571,0.429,0.8885,2021-05-17 09:13:01
Website SEO can feel like foreign language you not familiar with but you can still good even you not,2412,0.0,0.752,0.248,0.6808,2021-05-17 09:12:37
Check out National Productivity Council Google Please follow NPC Google and stay tuned,126,0.0,0.839,0.161,0.3182,2021-05-17 09:12:01
Website SEO can feel like foreign language you not familiar with but you can still good even you not,810,0.0,0.752,0.248,0.6808,2021-05-17 09:11:28
Would you like own #Waterwaycondo #MyrtleBeach #Realtor with years experience can ass,12,0.219,0.625,0.156,-0.25,2021-05-17 09:10:46
Language models like #GPT could herald new type #SearchEngine The way search onl,396,0.0,0.828,0.172,0.3612,2021-05-17 09:10:34
people that click ads say said #Google #SearchAds make easier find the information they looking for,1049,0.0,0.843,0.157,0.4215,2021-05-17 09:10:12
Website SEO can feel like foreign language you not familiar with but you can still good even you not,410,0.0,0.752,0.248,0.6808,2021-05-17 09:10:03
Website SEO can feel like foreign language you not familiar with but you can still good even you,148,0.0,0.741,0.259,0.6808,2021-05-17 09:09:57
Android info leaked ahead Google conference,2022,0.315,0.685,0.0,-0.3182,2021-05-17 09:09:28
finally here #darkTheme #DarkWeb #Google,79,0.0,1.0,0.0,0.0,2021-05-17 09:09:21
The Jolly Sailor Southsea #Google,978,0.0,0.548,0.452,0.5106,2021-05-17 09:09:08
specialise printing NCR Carbon Copy Forms Print Shop #Google #nefollowers #jobshe,4871,0.0,1.0,0.0,0.0,2021-05-17 09:09:00
Keyword stuffing #Google Business something that should avoided where possible This practice has been,415,0.156,0.844,0.0,-0.34,2021-05-17 09:08:09
this guest post Sriya Sridhar analyses #DelhiHighCourt recent interim order the #righttobeforgotten direct,5404,0.0,1.0,0.0,0.0,2021-05-17 09:07:58
Google Researchers Are Dreaming New Species Search Engine #google #ai,2924,0.0,1.0,0.0,0.0,2021-05-17 09:07:21
The time buy Safebank now before the Whales before the bull run Buy the dip Catch the higher price,27,0.0,1.0,0.0,0.0,2021-05-17 09:05:29
The time buy Safebank now before the Whales before the bull run Buy the dip,27,0.0,1.0,0.0,0.0,2021-05-17 09:05:23
#Google finally adds basic Caller feature its Phone app #CallerIDFeature,1571,0.0,1.0,0.0,0.0,2021-05-17 09:05:22
February #GodofAbraham #Jesus #LEGENDARY #jeffdavisshow Guest The Trailer Park Show #television #Twitter,342,0.0,1.0,0.0,0.0,2021-05-17 09:04:12
you want expert knowledge your fingertips Entrusting your over experts enables you focus build,23,0.0,0.909,0.091,0.0772,2021-05-17 09:03:47
#Google Icons What you think,1116,0.0,1.0,0.0,0.0,2021-05-17 09:02:19
know more visit #google #laravel #trending #Website #phpdevelopers #javascript #fullstac,221,0.0,1.0,0.0,0.0,2021-05-17 09:02:09
know more visit #google #laravel #trending #Website #phpdevelopers #javascript,151,0.0,1.0,0.0,0.0,2021-05-17 09:01:49
you want more visitors your website then adding your company the growing global,1805,0.0,0.786,0.214,0.25,2021-05-17 09:01:27
SPI have caused Alarm amp Distress which crime Presumably they are above the law Unable read not,1324,0.399,0.601,0.0,-0.8519,2021-05-17 09:00:51
How you can use #Google Lighthouse optimize your #WordPress site performance Our blog post has all the pract,5921,0.0,0.842,0.158,0.4939,2021-05-17 09:00:31
Ensuring your company has visible digital presence essential One the best ways Search Engine Optimisati,507,0.0,0.674,0.326,0.743,2021-05-17 09:00:10
network crypto you can mine your phone for free Check out #btc #BTC,0,0.0,0.784,0.216,0.5106,2021-05-17 08:58:51
you miss Watch Amazing Theme park Enjoy Virtual Tour Video link #FacebookLive #inst,11148,0.086,0.538,0.376,0.7506,2021-05-17 08:58:35
you miss Watch Amazing Theme park Enjoy Virtual Tour Video link #FacebookLive,51,0.091,0.511,0.398,0.7506,2021-05-17 08:57:46
KASHISH Indian Sub Continent IPR Management Limited #Google,126,0.213,0.787,0.0,-0.2263,2021-05-17 08:57:04
Kai Travel Services #Google,55,0.0,1.0,0.0,0.0,2021-05-17 08:57:00
Google Pay users the may now send money app users India and Singapore Plans extend countries,23,0.082,0.819,0.099,0.0772,2021-05-17 08:56:11
Lawrence Cleaning Solutions Ltd #Google,1116,0.0,0.702,0.298,0.1779,2021-05-17 08:56:08
Sharp new flagship phone has giant inch camera sensor and Leica branding from #google,227,0.0,0.903,0.097,0.1027,2021-05-17 08:54:17
The Time Took Assets Reach Trillion Market Cap #MarketCap #Apple #Amazon #Microsoft #Google #BTC,12159,0.0,0.811,0.189,0.2023,2021-05-17 08:54:12
Each time search search #Google matter what Probably #Muslim can even use the most popular search,73,0.0,0.77,0.23,0.4927,2021-05-17 08:52:18
Check out National Productivity Council Google Please follow NPC Google and stay tuned,54,0.0,0.839,0.161,0.3182,2021-05-17 08:50:30
Check out National Productivity Council Google Please follow NPC Google and stay tuned,250,0.0,0.839,0.161,0.3182,2021-05-17 08:50:29
Google Search Console Crawl Stats #Google #SEO #Crawl,18760,0.0,1.0,0.0,0.0,2021-05-17 08:50:03
#CAPTCHA inefficient amp obsolete #google tech #Signata will leverage cryptography #YubiKey minimize #BigTech,187,0.155,0.845,0.0,-0.296,2021-05-17 08:49:47
Now you can search multiple platforms with single click Download the App now Link,9,0.0,1.0,0.0,0.0,2021-05-17 08:49:36
Language Learning and Teaching with Technology great read for #ESOL teachers and #Google learning opportunities,315,0.0,0.66,0.34,0.7717,2021-05-17 08:49:07
New Video Alert This going good one hope you guys enjoy Get your Popcorn ready Link,1471,0.0,0.445,0.555,0.9136,2021-05-17 08:46:33
Data Structures Algorithms System Design Aim for #Google #FAANG amp more Happy some who applied promo code say has,43,0.0,0.818,0.182,0.6115,2021-05-17 08:45:53
Check out National Productivity Council Google Please follow NPC Google and stay tuned,250,0.0,0.839,0.161,0.3182,2021-05-17 08:45:15
Check out Gig #Fiverr #google #scraping for #search results #business,167,0.0,1.0,0.0,0.0,2021-05-17 08:41:09
Transport companies require pallet truck move goods with this the operator needs think the truck secur,485,0.0,1.0,0.0,0.0,2021-05-17 08:40:10
#Google use #Android feature make #Chrome faster #Windows #macOS and #Linux via,8618,0.0,1.0,0.0,0.0,2021-05-17 08:40:00
Get ready for Google annual Developer Conference Google Dates May May virtual and free,1332,0.0,0.674,0.326,0.7003,2021-05-17 08:39:56
The research project Sergey Brin and Larry Page undertook Stanford University was termed BackRub but,1392,0.0,1.0,0.0,0.0,2021-05-17 08:39:18
Question for #reactjs #Developer What you prefer Create react app Webpack Babel #javascript #nodejs DaysOfCod,338,0.0,0.87,0.13,0.2732,2021-05-17 08:37:31
Question for #reactjs #Developer What you prefer Create react app Webpack Babel #javascript #nodejs,13,0.0,0.861,0.139,0.2732,2021-05-17 08:37:26
Ethnicitees LLC #Google,51,0.0,1.0,0.0,0.0,2021-05-17 08:36:53
How improve SEO for free via #BizTips #business #BusinessOwner #Entrepreneur,695,0.0,0.563,0.437,0.7351,2021-05-17 08:36:39
Transport companies require pallet truck move goods with this the operator needs think the truck secur,485,0.0,1.0,0.0,0.0,2021-05-17 08:35:28
Kai Travel Services #Google,55,0.0,1.0,0.0,0.0,2021-05-17 08:35:00
Get ready for Google annual Developer Conference Google Dates May May virtual and free,9,0.0,0.674,0.326,0.7003,2021-05-17 08:31:27
you looking for place start your flutter journey check out #flutterdev #Flutter,200,0.0,1.0,0.0,0.0,2021-05-17 08:31:15
Check out National Productivity Council Google Please follow NPC Google and stay tuned,86,0.0,0.839,0.161,0.3182,2021-05-17 08:31:11
you looking for place start your flutter journey check out #flutterdev #Flutter,1196,0.0,1.0,0.0,0.0,2021-05-17 08:30:55
you looking for place start your flutter journey check out #flutterdev,327,0.0,1.0,0.0,0.0,2021-05-17 08:30:39
Get #DigitalMarketer promote your #website #business #branding #product #Services and #leadgeneration with,25,0.0,0.809,0.191,0.3818,2021-05-17 08:30:17
Wonder who uses #BitTorrent protocols that right #Netflix #Facebook #Google #Twitter just name,25,0.0,1.0,0.0,0.0,2021-05-17 08:30:04
#google return,96,0.0,1.0,0.0,0.0,2021-05-17 08:29:38
Major shift #BigTech distancing itself from #USMilitary while other players are joining over use #FacialRecognition,1433,0.0,1.0,0.0,0.0,2021-05-17 08:29:19
Major shift #BigTech distancing itself from #USMilitary while other players are joining over use,260,0.0,1.0,0.0,0.0,2021-05-17 08:28:31
PALEOLOGOS Shipping amp Travel Enterprises #Google,133,0.0,1.0,0.0,0.0,2021-05-17 08:28:28
Our innovative technical experts work constantly with the subject experts make this more accurate and useful onl,6,0.0,0.712,0.288,0.7239,2021-05-17 08:27:09
expected start May Indian time #Google #GoogleIO #GooglePlay #YouTube #Android,858,0.0,1.0,0.0,0.0,2021-05-17 08:25:09
ISRO amp MapmyIndia build alternative Google Maps #ISRO India answer #NASA #MapmyIndia that,1204,0.0,1.0,0.0,0.0,2021-05-17 08:24:59
Niche Marketing strategy aimed advertising the marketing efforts towards very specialized and targeted audi,75,0.0,1.0,0.0,0.0,2021-05-17 08:22:14
specialise printing NCR Carbon Copy Forms Print Shop #Google #nefollowers,766,0.0,1.0,0.0,0.0,2021-05-17 08:21:55
Best online Branding and Marketing services India #seo #digitalmarketing #marketing #socialmediamarketing,425,0.0,0.704,0.296,0.6369,2021-05-17 08:21:53
Year and Year have taken part STEM initiative Google based Internet Safety For each corr,15427,0.0,0.833,0.167,0.4215,2021-05-17 08:21:52
Year and Year have taken part STEM initiative Google based Internet Safety For each corr,35755,0.0,0.833,0.167,0.4215,2021-05-17 08:21:48
Seo buz Best Seo Services Delhi NCR India #Google,43,0.0,0.656,0.344,0.6369,2021-05-17 08:20:44
Spoken English Classes Pune SevenMentor #Google,68,0.0,1.0,0.0,0.0,2021-05-17 08:20:32
Pattaya One News #Google,5314,0.0,1.0,0.0,0.0,2021-05-17 08:19:33
Pattaya One News #Google,5314,0.0,1.0,0.0,0.0,2021-05-17 08:19:16
Pattaya One News #Google,5314,0.0,1.0,0.0,0.0,2021-05-17 08:18:54
Check out National Productivity Council Google Please follow NPC Google and stay tuned,110,0.0,0.839,0.161,0.3182,2021-05-17 08:18:38
Pattaya One News #Google,5314,0.0,1.0,0.0,0.0,2021-05-17 08:18:36
Pattaya One News #Google,5314,0.0,1.0,0.0,0.0,2021-05-17 08:18:17
New robot helps with knee replacements #Android #Google #Facebook,1373,0.0,0.755,0.245,0.3818,2021-05-17 08:18:01
#CAPTCHA inefficient amp obsolete #google tech #Signata will leverage cryptography #YubiKey minimize #BigTech,83,0.155,0.845,0.0,-0.296,2021-05-17 08:17:56
Pattaya One News #Google,5314,0.0,1.0,0.0,0.0,2021-05-17 08:17:35
