tweet,follower_count,neg,neu,pos,compound,time
Google the internet #google #googl #goog #stock #market #tech #technology #epic #internet #monster,209,0.0,1.0,0.0,0.0,2021-06-06 21:23:46
three years after and #Google assistant still can anything really useful via,0,0.0,0.775,0.225,0.4927,2021-06-06 21:23:43
The true test disruptive technology company how hard everyone pushes against #Bitcoin,22,0.239,0.581,0.181,0.0258,2021-06-06 21:23:13
Our Unscripted Raw now live all the usual Podcast platforms let know what you think this was cra,66,0.0,1.0,0.0,0.0,2021-06-06 21:22:11
What Happened You Remember #google #history via #timetravel,247692,0.0,1.0,0.0,0.0,2021-06-06 21:21:00
#Google #Seo #Blackbox Thank you very much Have good day see you,1081,0.0,0.638,0.362,0.6872,2021-06-06 21:20:32
Writer Tools Novel Writing Software Review Writer Tools piece novel writing software that availabl,25006,0.0,0.723,0.277,0.5574,2021-06-06 21:20:01
Optimizing Your Content Become the Google Featured Snippet #Google #Search #SearchEngineMa,887,0.0,0.769,0.231,0.4588,2021-06-06 21:19:42
This drawing mine Google play music Chan Gee what mouthful did her the style marching band,20,0.0,0.862,0.138,0.34,2021-06-06 21:18:44
#MassEffect Part available now amp #ApplePodcasts,1871,0.0,1.0,0.0,0.0,2021-06-06 21:18:36
Optimizing Your Content Become the Google Featured Snippet #Google #Search,3456,0.0,0.75,0.25,0.4588,2021-06-06 21:18:10
Why #Google banning responsible orgs Can anti vaxxers manipulate YouTube algorithms throw off health advocates,29009,0.131,0.739,0.131,0.0,2021-06-06 21:16:00
attending the GDG Sacramento meetup June What new Angular Learn more and join,123,0.0,0.829,0.171,0.3566,2021-06-06 21:15:37
June buy #oneplus #device #smoothos #oneplus tpro #neversettle #beyondthespeed,116,0.0,1.0,0.0,0.0,2021-06-06 21:15:08
Google begs apology ugliest language Kannada #google #programming #coding #tech #technology #webdeveloper #javas,83,0.237,0.688,0.075,-0.5574,2021-06-06 21:14:32
Whatsapp Wechat adultjob Here the only opportunity get rich and make legal cash with one,63,0.0,0.603,0.397,0.7845,2021-06-06 21:14:03
Google begs apology ugliest language Kannada #google #programming #coding #tech #technology #webdeveloper #javas,418,0.237,0.688,0.075,-0.5574,2021-06-06 21:13:44
Google begs apology ugliest language Kannada #google #programming #coding #tech #technology #webdeveloper #javas,54,0.237,0.688,0.075,-0.5574,2021-06-06 21:13:39
Paid Organic Website Traffic Pros amp Cons #Google #SEO #PPC #SEM #PayPerClick #PPCChat #PPC,214302,0.0,1.0,0.0,0.0,2021-06-06 21:11:05
time for another adventure another BOOTCAMP with #Google DSC MUET,20,0.0,0.796,0.204,0.3182,2021-06-06 21:10:22
How deal with big tech #Amazon #Apple #bigtech #competition #Facebook #Google,4761,0.0,1.0,0.0,0.0,2021-06-06 21:08:00
Looking for Facebook Pixel expert the link #Facebook #remarketing #pixel #SEO,47,0.0,1.0,0.0,0.0,2021-06-06 21:07:45
Google Forms Multiple Versions and Retakes #Apps Advanced #Forms #Google,583,0.0,0.818,0.182,0.25,2021-06-06 21:05:19
Signed Egg Shape Russian Musical Trinket Box #doyourememberwhen #Etsy #Google,328,0.0,1.0,0.0,0.0,2021-06-06 21:04:53
#Google searches Azerbaijan old,3323,0.0,1.0,0.0,0.0,2021-06-06 21:03:09
Complete Beginners SEO Course SEO Fundamentals #seo #searchengineoptimization,1341,0.0,1.0,0.0,0.0,2021-06-06 21:02:45
What Happens When You Type URL Address Bar DaysOfCode #coding #webdevelopment #Google #womenwhocode,83,0.0,1.0,0.0,0.0,2021-06-06 21:02:31
#Hawley Proposes Antitrust Legislation Against #Amazon and #Google,68,0.0,1.0,0.0,0.0,2021-06-06 21:02:22
this the Greatest SEO hack all time via #seo #google #digitalmarketing #marketing,7074,0.0,0.724,0.276,0.6369,2021-06-06 21:02:12
OUT NOW EBOOK #GirlsWhoLie Cribb,3235,0.0,1.0,0.0,0.0,2021-06-06 21:02:06
Kitchen remodeling contractors Maple Valley Sound Remodeling LLC #Google,378,0.0,1.0,0.0,0.0,2021-06-06 21:02:06
#google #seo Website owners pay attention,722,0.219,0.781,0.0,-0.1027,2021-06-06 21:01:40
Thank you all including students from #waterlooregion for attending #Coding workshop Happy see many young students,83,0.0,0.693,0.307,0.7351,2021-06-06 21:01:31
What Happens When You Type URL Address Bar DaysOfCode #coding #webdevelopment #Google #womenwhocode,1199,0.0,1.0,0.0,0.0,2021-06-06 21:01:31
With new innovations Search Google can get you even closer what you looking for #Google,695,0.0,1.0,0.0,0.0,2021-06-06 21:01:31
Google ADS Self Xss amp HTML Injection Bug Bounty #bugbountytips #hackerone #vrp #google #CyberSecurity,989,0.0,1.0,0.0,0.0,2021-06-06 21:00:46
Thank you all including students from #waterlooregion for attending #Coding workshop Happy see many young students,1199,0.0,0.693,0.307,0.7351,2021-06-06 21:00:41
New battery #apple #iphone #iphonex Let see how long this iPhone will last #google,7,0.0,1.0,0.0,0.0,2021-06-06 21:00:40
OUT NOW EBOOK #GirlsWhoLie Cribb,23938,0.0,1.0,0.0,0.0,2021-06-06 21:00:36
this the Greatest SEO hack all time via #seo #google #digitalmarketing #marketing,456,0.0,0.724,0.276,0.6369,2021-06-06 20:59:35
Hey guys today sharing simple flutter app having Bottom Navigation Bar #mobiledeveloper #ios #iosdeveloper,4694,0.0,0.823,0.177,0.4215,2021-06-06 20:58:39
Hey guys today sharing simple flutter app having Bottom Navigation Bar #mobiledeveloper #ios #iosdeveloper,914,0.0,0.823,0.177,0.4215,2021-06-06 20:58:38
Hey guys today sharing simple flutter app having Bottom Navigation Bar #mobiledeveloper #ios #iosdeveloper,1470,0.0,0.823,0.177,0.4215,2021-06-06 20:58:32
#Google and #Alibaba Apply for License Establish #Crypto Exchange Singapore AronBoss,203,0.0,1.0,0.0,0.0,2021-06-06 20:58:28
Hey guys today sharing simple flutter app having Bottom Navigation Bar #mobiledeveloper #ios #iosdeveloper,1199,0.0,0.823,0.177,0.4215,2021-06-06 20:58:27
And #Google accepting Partners crime #BigTechCensorship #IvermectinSavesLives,1490,0.315,0.45,0.234,-0.2263,2021-06-06 20:58:24
According Google Kannad the ugliest language India However Google has removed from the search engine Hind,65,0.202,0.798,0.0,-0.5859,2021-06-06 20:58:00
NONE the players you mentioned were anywhere near peak powers when they were that team #GOOGLE,60,0.0,1.0,0.0,0.0,2021-06-06 20:57:57
Gunning and Company Estate Sales LLC #Google,59,0.0,1.0,0.0,0.0,2021-06-06 20:57:25
this the Greatest SEO hack all time via #seo #google #digitalmarketing #marketing #businesstips,722,0.0,0.741,0.259,0.6369,2021-06-06 20:57:14
Alibaba Google Among More Than Companies Seeking Singapore Crypto Licenses #cryptolicense #google #alibaba,7,0.0,1.0,0.0,0.0,2021-06-06 20:55:38
The business has only two functions marketing and innovation More Details #DigitalMarketing #Go,3031,0.0,0.822,0.178,0.3818,2021-06-06 20:54:04
Does #Google #BigQuery already provide much provides that very much different service GRT #GRT #Graphprotocol,1118,0.0,1.0,0.0,0.0,2021-06-06 20:53:48
Google What Can Say #google #googl #stock #tech #internet #goog #technology #epic #monster,209,0.0,1.0,0.0,0.0,2021-06-06 20:53:47
ARV Furniture Ontario Ltd #Google,3352,0.0,1.0,0.0,0.0,2021-06-06 20:53:21
this wasn the worst email ever received shame read #linktr OwenMullen #bookdea #Kindle #Kobo,8089,0.375,0.625,0.0,-0.802,2021-06-06 20:49:50
time for another adventure another BOOTCAMP with #Google DSC MUET,71,0.0,0.796,0.204,0.3182,2021-06-06 20:49:48
American Financial Network Inc #Google,42,0.0,1.0,0.0,0.0,2021-06-06 20:48:40
Natural Pain Solutions #Google,30,0.388,0.118,0.494,-0.0258,2021-06-06 20:48:08
Many people rely Google translate for Urdu Hindi word meaning Please keep mind translate not reliable Ple,12,0.0,0.874,0.126,0.3182,2021-06-06 20:47:12
Maybe this will provide BTC the boost needs get back #BTC #Google #DOGE #DogecoinToTheMoon,763,0.0,0.828,0.172,0.4019,2021-06-06 20:46:41
Welcoming War Crimes The Normalization Henry Kissinger #Kissinger #warcrimes #data #Science #datascience #AI,11324,0.219,0.618,0.163,-0.25,2021-06-06 20:45:30
Welcoming War Crimes The Normalization Henry Kissinger #Kissinger #warcrimes #data #Science #datascience #AI,2574,0.219,0.618,0.163,-0.25,2021-06-06 20:44:25
Stadia controller far better than some controllers out there hands down #google #googlestadia #stadia #gamingcontroller,651,0.0,0.828,0.172,0.4404,2021-06-06 20:44:00
#Google and #Alibaba Apply for License Establish #Crypto Exchange Singapore AronBoss,29070,0.0,1.0,0.0,0.0,2021-06-06 20:43:52
Welcoming War Crimes The Normalization Henry Kissinger #Kissinger #warcrimes #data #Science #datascience #AI,8579,0.219,0.618,0.163,-0.25,2021-06-06 20:42:00
Welcoming War Crimes The Normalization Henry Kissinger #Kissinger #warcrimes #data #Science #datascience #AI,1402,0.219,0.618,0.163,-0.25,2021-06-06 20:42:00
#NoPalantir #GPdatagrab The documents show the data sharing arrangements made between the #NHS and #Microsoft #Goo,390,0.0,0.843,0.157,0.4215,2021-06-06 20:40:54
#Google #Microsoft and #Mozilla are supporting #WebAuthn login standard enabling users access services without,729,0.0,0.818,0.182,0.4404,2021-06-06 20:40:26
recent big #tech partnerships #healthcare #Google #Amazon amp more,38,0.0,1.0,0.0,0.0,2021-06-06 20:39:15
#Google Cloud Partners with HCA Develop #Healthcare #Algorithms,38,0.0,1.0,0.0,0.0,2021-06-06 20:38:12
After Google Amazon hurts Kannada pride #Google #Amazon,14157,0.254,0.41,0.336,-0.0,2021-06-06 20:37:51
#Google announces its own version #AppTracking #Transparency touched this point independent work did,37,0.0,1.0,0.0,0.0,2021-06-06 20:37:46
fails #worst #navigation #app ever now #googlemaps #epicfail #googlemapsfail,220,0.259,0.741,0.0,-0.4215,2021-06-06 20:35:33
You more annoying than #Youtube #youtubeads #google #marketingisdead,76,0.3,0.7,0.0,-0.4576,2021-06-06 20:32:50
Google Pixel Buds Series priced #google #buds #pixel #headphones #wireless,1,0.0,1.0,0.0,0.0,2021-06-06 20:32:34
#linkedin #twitter #facebook #instagram #tumblr #socialmedia #pinterest #google #deal #gift #gifts #giftideas #shop,67655,0.0,1.0,0.0,0.0,2021-06-06 20:27:44
The #AIRTEETH #music #video #youtube Over #videos #youtubechannel #Verified #Google #Watch,155,0.0,1.0,0.0,0.0,2021-06-06 20:27:31
Soon #AIRTEETH #YouTube #youtubechannel #YouTuber #Verified #Google,155,0.0,1.0,0.0,0.0,2021-06-06 20:27:07
#TheSnakeThatBrokeMe available #amazon #lulu com #google #barnesandnoble #kindle #darealtrimkid,357,0.0,1.0,0.0,0.0,2021-06-06 20:26:12
#TheSnakeThatBrokeMe available #amazon #lulu com #google #barnesandnoble #kindle #darealtrimkid,357,0.0,1.0,0.0,0.0,2021-06-06 20:25:53
The #AIRTEETH #music #video #youtube Over #videos #youtubechannel #Verified #Google,155,0.0,1.0,0.0,0.0,2021-06-06 20:25:38
#TheSnakeThatBrokeMe available #amazon #lulu com #google #barnesandnoble #kindle #darealtrimkid,357,0.0,1.0,0.0,0.0,2021-06-06 20:25:00
#TheSnakeThatBrokeMe available #amazon #lulu com #google #barnesandnoble #kindle #darealtrimkid,357,0.0,1.0,0.0,0.0,2021-06-06 20:24:41
Google John Mueller says some cases possible forward ranking signals from old page new page without,119,0.0,1.0,0.0,0.0,2021-06-06 20:24:30
#TheSnakeThatBrokeMe available #amazon #lulu com #google #barnesandnoble #kindle #darealtrimkid,357,0.0,1.0,0.0,0.0,2021-06-06 20:24:27
Make your website position google ranking #seo #localseo #sell #Google #RankingRD #people #website,5,0.0,1.0,0.0,0.0,2021-06-06 20:21:50
Our websites are built with measured science Visit #google #business #marketingtips #webdesi,1838,0.0,1.0,0.0,0.0,2021-06-06 20:21:06
Make your website position google ranking #seo #localseo #sell #Google,5,0.0,1.0,0.0,0.0,2021-06-06 20:19:59
Popular #News Trend Read Popular News the Explore whats #Trending Live around the globe Popular News Trend All,152,0.0,0.641,0.359,0.8126,2021-06-06 20:19:09
When asked directly users have overwhelmingly rejected tracking Android users won asked directly they wan,9327,0.234,0.585,0.18,-0.0258,2021-06-06 20:18:01
#streaming #ResidentEvil and slayin were hangin out her #google assistant too GREA,218,0.0,1.0,0.0,0.0,2021-06-06 20:17:37
TekTok soviet Russia you need INTERNET STORE and Entering the Dark Store Business #europe,80,0.0,1.0,0.0,0.0,2021-06-06 20:15:02
Outraged back back attempts humiliate Kannadigas global search engine #Google and world largest tai,872,0.368,0.632,0.0,-0.7906,2021-06-06 20:14:59
Instagram will soon let you create posts desktop Check out #Instagram #Desktop #Fa,27,0.0,0.851,0.149,0.2732,2021-06-06 20:14:03
Battleground Mobile India pre registration goes live Google Play Store Check out #pu,27,0.168,0.683,0.149,-0.0772,2021-06-06 20:13:51
Google Pays Billion Apple Check out #Google #finance #DigitalMarketing #Whats,6735,0.0,1.0,0.0,0.0,2021-06-06 20:13:19
Google Pays Billion Apple Check out #Google #finance #DigitalMarketing #Whats,27,0.0,1.0,0.0,0.0,2021-06-06 20:13:18
Paway available for download the Google Play Store now Click the link our bio check out #android #iphon,3031,0.0,0.876,0.124,0.34,2021-06-06 20:13:04
Apple iPhone pro images leaked Check out #Apple #iPhone #Google #privacy #Facebo,27,0.173,0.827,0.0,-0.3182,2021-06-06 20:12:55
Elon Musk replies Indian YouTuber Check out #dogelon #LabraCoin #cryptotwitter,27,0.0,1.0,0.0,0.0,2021-06-06 20:12:43
Because reCaptcha likely every page website you signed into your Google account there,3851,0.0,1.0,0.0,0.0,2021-06-06 20:10:57
also want #ChellamSir life #chellam #google #familyman,112,0.0,0.822,0.178,0.0772,2021-06-06 20:10:23
Paway available for download the Google Play Store now Click the link our bio check out,171,0.0,0.862,0.138,0.34,2021-06-06 20:08:44
#MassEffect Part available now amp #ApplePodcasts,871,0.0,1.0,0.0,0.0,2021-06-06 20:07:10
Google PPC ads led infostealers #Malware #Google #Advertising #Threat #Infosec #Cybersecurity,16374,0.0,1.0,0.0,0.0,2021-06-06 20:06:59
Watch the Case Study the YEAR Google CEO Click #SundarPichai #Google,0,0.0,1.0,0.0,0.0,2021-06-06 20:06:39
Unheard Facts know more Facts watch the link #DrVivekBindra #BadaBusiness,0,0.0,1.0,0.0,0.0,2021-06-06 20:06:18
Today #GoogleDoodle wishes everyone Happy Teachers Day #GoogleDoodle Find out more,346,0.0,0.629,0.371,0.6486,2021-06-06 20:03:37
Today #GoogleDoodle wishes everyone Happy National Day Sweden #GoogleDoodle Find out more,346,0.0,0.654,0.346,0.6486,2021-06-06 20:03:37
Today #GoogleDoodle celebrates Peru Elections #GoogleDoodle Find out more,346,0.0,0.684,0.316,0.5719,2021-06-06 20:03:37
Today #GoogleDoodle celebrates Mexico Elections #GoogleDoodle Find out more,346,0.0,0.684,0.316,0.5719,2021-06-06 20:03:37
Today #GoogleDoodle wishes everyone Happy Father Day #GoogleDoodle Find out more,346,0.0,0.629,0.371,0.6486,2021-06-06 20:03:37
#media Read subj till climax site Twitter Facebook #Google which wins msg spread,3628,0.0,0.764,0.236,0.5719,2021-06-06 20:03:01
Relief Inc #Google,52,0.0,0.392,0.608,0.4767,2021-06-06 20:02:20
New Wave Magazine #Google,316,0.0,1.0,0.0,0.0,2021-06-06 20:01:51
Xiaomi says can now fully charge phone eight minutes #google,1706,0.0,1.0,0.0,0.0,2021-06-06 20:01:42
#Google #please give update for camera because want take even better photos with GooglePixel,2,0.0,0.741,0.259,0.4939,2021-06-06 20:01:05
Easy Page SEO Tips #backlinks,472,0.0,0.58,0.42,0.4404,2021-06-06 19:58:46
TEA #Google featuring #matchaTogo,6424,0.0,1.0,0.0,0.0,2021-06-06 19:58:10
Best Computer Repair Bridgend and South Wales #Google #custombuild #customgamingpc #gaming,16374,0.0,0.704,0.296,0.6369,2021-06-06 19:57:51
Best Computer Repair Bridgend and South Wales #Google #custombuild #customgamingpc #gaming,16374,0.0,0.704,0.296,0.6369,2021-06-06 19:57:21
guys suggest this article think very interesting and can give you many advices how effectively increase,1394,0.0,0.613,0.387,0.8016,2021-06-06 19:54:59
Asphalt Legends Available for Pre Registration #google Play With #technologyfact,5641,0.0,0.789,0.211,0.34,2021-06-06 19:53:23
DaysOfCode #DEVCommunity Day started IoT internship with full stack development,5308,0.0,1.0,0.0,0.0,2021-06-06 19:52:33
New Wave Magazine #Google,1291,0.0,1.0,0.0,0.0,2021-06-06 19:52:05
DaysOfCode #DEVCommunity Day started IoT internship with full stack development,2426,0.0,1.0,0.0,0.0,2021-06-06 19:51:34
really great achievement got design Google first page #graphicdesign #graphicdesigner #PNG #BinanceLearnAndEarn,1284,0.0,0.715,0.285,0.659,2021-06-06 19:51:14
Introducing Security Design Google #AppSec #google #CyberSecurity #SDL,16374,0.0,0.745,0.255,0.34,2021-06-06 19:50:41
#justsayno the #justsayno being lab #markofthebeast #fda #approval #liberalworldorder,887,0.0,1.0,0.0,0.0,2021-06-06 19:49:28
Braking #Google Advertising Policy Opens Doors Wider #Bitcoin Community will game changer #Googleads #Bitcoin,1264,0.0,1.0,0.0,0.0,2021-06-06 19:48:08
customer experience iERP has been featured #Google was selected into companies watch lists amp exhibited,30,0.0,1.0,0.0,0.0,2021-06-06 19:47:14
Listen Secret Healthy Hair Audiobook Google Play #audiobook #book #listening #soundclou,3235,0.0,0.638,0.362,0.6249,2021-06-06 19:47:05
Braking #Google Advertising Policy Opens Doors Wider #Bitcoin Community will game changer #Googleads #Bitcoin,959,0.0,1.0,0.0,0.0,2021-06-06 19:46:14
Photo Simon Pixabay via #magnifyingglass #google #searchengine #googleplay #googlepixel #googlemaps,1081,0.0,1.0,0.0,0.0,2021-06-06 19:46:04
Braking #Google Advertising Policy Opens Doors Wider #Bitcoin Community will game changer,11272,0.0,1.0,0.0,0.0,2021-06-06 19:45:09
Our Unscripted Raw now live all the usual Podcast platforms let know what you think this was,278,0.0,1.0,0.0,0.0,2021-06-06 19:45:04
guys suggest this article think very interesting and can give you many advices how effectivel,59,0.0,0.824,0.176,0.4576,2021-06-06 19:45:01
Climbing New Heights has been haven for climbers West Virginia since When the pandemic hit Chris and owner Jordy,69,0.0,1.0,0.0,0.0,2021-06-06 19:44:41
Tricks Rank for Multiple Keywords Easily SEO #Google,6433,0.152,0.606,0.242,0.2263,2021-06-06 19:44:10
LGTWO #Google Waiting For You builds powerful and momentous crescendo reminiscent Kate Bush Running That,11115,0.0,0.833,0.167,0.4215,2021-06-06 19:42:24
Beware the Spin and False Pretenses #IBM and #Google Are Dangerous #SoftwareFreedom Well,906,0.191,0.679,0.13,-0.25,2021-06-06 19:42:15
Beware the Spin and False Pretenses #IBM and #Google Are Dangerous #SoftwareFreedom Well,7418,0.191,0.679,0.13,-0.25,2021-06-06 19:41:34
#xrp the bridge currency #Google don lie #xrpholders,8,0.0,1.0,0.0,0.0,2021-06-06 19:41:21
Top Level Traffic Web Design Bridgend #Google #topleveltraffic #bridgend,2626,0.0,0.816,0.184,0.2023,2021-06-06 19:39:12
Our websites are built with measured science Visit #google #business #marketingtips,542,0.0,1.0,0.0,0.0,2021-06-06 19:37:54
Releases tomorrow BOUND RING amp SECRET Warm funny heartbreaking amazing story #Kindle,195877,0.153,0.408,0.439,0.6808,2021-06-06 19:37:21
Unfortunetly the real Competition his Holder and Fanatic Guys SEE MIAMI #BTCZ #BitcoinZ,571,0.0,1.0,0.0,0.0,2021-06-06 19:36:51
Release day BOUND RING amp SECRET Warm funny heartbreaking amazing story #Kindle,195877,0.153,0.408,0.439,0.6808,2021-06-06 19:36:29
are not convinced say that this story too browsers should not profile users #FLoC #Google,94,0.139,0.861,0.0,-0.3089,2021-06-06 19:35:43
and discuss the episode Shadow Play and their own experience with crazy dreams,47,0.137,0.571,0.291,0.4019,2021-06-06 19:35:00
Introducing Security Design Google #AppSec #google #CyberSecurity #SDL,2480,0.0,0.745,0.255,0.34,2021-06-06 19:34:42
Good Morning Lisa one off the Angel off #BTCZ #BitcoinZ #cryptocurrencies #Cryptocur,2117,0.0,0.791,0.209,0.4404,2021-06-06 19:34:25
Best Computer Repair Bridgend and South Wales #Google #custombuild #customgamingpc,385,0.0,0.682,0.318,0.6369,2021-06-06 19:32:31
Try some gyro wraps for your next meeting #restaurant #smallbusiness #womeninbusiness #food #tasty #yum #dmv,7,0.0,1.0,0.0,0.0,2021-06-06 19:32:12
Best Computer Repair Bridgend and South Wales #Google #custombuild #customgamingpc,2428,0.0,0.682,0.318,0.6369,2021-06-06 19:32:09
Watch the Case Study the YEAR Google CEO Click #SundarPichai #Google,276,0.0,1.0,0.0,0.0,2021-06-06 19:31:32
Good Morning Lisa one off the Angel off #BTCZ #BitcoinZ #cryptocurrencies,571,0.0,0.775,0.225,0.4404,2021-06-06 19:31:17
Listen Secret Healthy Hair Audiobook Google Play #audiobook #book #listening,1969,0.0,0.611,0.389,0.6249,2021-06-06 19:31:11
Check out #audiobook #Fiverr #audio #Audible #apple #applebooks #ibooks #Google,1969,0.0,1.0,0.0,0.0,2021-06-06 19:30:56
just added new articles open writing commissions you looking for,47,0.0,1.0,0.0,0.0,2021-06-06 19:30:44
The New Face Corporate India The Covid Warriors #Amazon #HCLTechnologies #ExpertSpeak #CovidWarriors #Facebook,587,0.0,1.0,0.0,0.0,2021-06-06 19:30:07
Yes Matt But Not Only Entire Space #Decentralized You know very well lot off #Shitcoin Cen,571,0.0,0.739,0.261,0.6046,2021-06-06 19:29:46
Battlegrounds Mobile India launch date features rules and more everything know far Check out https,27,0.103,0.897,0.0,-0.1531,2021-06-06 19:29:12
are not convinced say that this story too browsers should not profile users #FLoC #Google,385,0.139,0.861,0.0,-0.3089,2021-06-06 19:29:11
Google PPC ads led infostealers #Malware #Google #Advertising #Threat #Infosec #Cybersecurity,35921,0.0,1.0,0.0,0.0,2021-06-06 19:29:10
Google PPC ads led infostealers #Malware #Google #Advertising #Threat #Infosec #Cybersecurity,16172,0.0,1.0,0.0,0.0,2021-06-06 19:29:03
Google PPC ads led infostealers #Malware #Google #Advertising #Threat #Infosec #Cybersecurity,1089,0.0,1.0,0.0,0.0,2021-06-06 19:28:38
Google PPC ads led infostealers #Malware #Google #Advertising #Threat #Infosec #Cybersecurity,631,0.0,1.0,0.0,0.0,2021-06-06 19:28:10
You can now let specific #Android apps bypass the #Google One VPN,521,0.0,1.0,0.0,0.0,2021-06-06 19:27:32
You are amaizing guys #BTCZ #BitcoinZ,571,0.0,1.0,0.0,0.0,2021-06-06 19:26:53
Thank you all including students from #waterlooregion for attending #Coding workshop Happy see many young students,1592,0.0,0.693,0.307,0.7351,2021-06-06 19:25:42
there huge difference salary for #Magento Architect Tech Lead with and without DevOps skills Practical skills,1080,0.0,0.867,0.133,0.3182,2021-06-06 19:23:57
#MassEffect Part available now amp #ApplePodcasts,2493,0.0,1.0,0.0,0.0,2021-06-06 19:22:14
effective approach #online #ReputationManagement includes protecting how #google represents your staff,11265,0.0,0.763,0.237,0.4767,2021-06-06 19:21:40
Earlier Google Google Cloud announced Vertex new managed machine learning platform Let take look what,1080,0.0,1.0,0.0,0.0,2021-06-06 19:18:57
What Infinity Secrets Eternity #Google #MachineLearning #AI DaysOfCode #python #DEV,272,0.0,1.0,0.0,0.0,2021-06-06 19:18:15
#Favourite ever #photo and #Suki #Ragdoll #Cat #Exposed the #Web this photo has been used much all over,1071,0.0,1.0,0.0,0.0,2021-06-06 19:18:08
Earlier Google Google Cloud announced Vertex new managed machine learning platform Let take look what,358,0.0,1.0,0.0,0.0,2021-06-06 19:17:44
Google search penalty recovery How not get penalised Google and what does happen Here #recove,2848,0.176,0.824,0.0,-0.4588,2021-06-06 19:17:16
The #Online world #Google #YouTube #Tmall #Baidu amp #QQ take top spots,4728,0.0,0.859,0.141,0.2023,2021-06-06 19:16:21
Google search penalty recovery How not get penalised Google and what does happen Here,621,0.188,0.812,0.0,-0.4588,2021-06-06 19:16:07
Bruce Gage Family Law Lowell #Google,158,0.0,1.0,0.0,0.0,2021-06-06 19:15:21
quotes from country say Eevery forest has its droughts #BTCZ #BitcoinZ,571,0.0,1.0,0.0,0.0,2021-06-06 19:14:27
What Infinity Secrets Eternity #Google #MachineLearning #AI DaysOfCode #python #DEV,289,0.0,1.0,0.0,0.0,2021-06-06 19:13:54
What Infinity Secrets Eternity #Google #MachineLearning #AI DaysOfCode #python #DEV,2207,0.0,1.0,0.0,0.0,2021-06-06 19:13:47
Century Broadhurst #Google,628,0.0,1.0,0.0,0.0,2021-06-06 19:13:03
Earlier Google Google Cloud announced Vertex new managed machine learning platform Let take look what,914,0.0,1.0,0.0,0.0,2021-06-06 19:12:52
Earlier Google Google Cloud announced Vertex new managed machine learning platform Let take look what,4048,0.0,1.0,0.0,0.0,2021-06-06 19:12:47
Earlier Google Google Cloud announced Vertex new managed machine learning platform Let take look,4897,0.0,1.0,0.0,0.0,2021-06-06 19:12:42
dropshipping #SEO Army #ecompro yomi #ben sab #ECPRO ELITE YOMI #sea,13,0.0,1.0,0.0,0.0,2021-06-06 19:12:34
Century Broadhurst #Google,628,0.0,1.0,0.0,0.0,2021-06-06 19:12:00
Datasets search engine Filters results usage rights download format topic price,622,0.0,1.0,0.0,0.0,2021-06-06 19:11:11
But you compare with for HDFC Bank The business model banks are,39,0.0,1.0,0.0,0.0,2021-06-06 19:10:49
there huge difference salary for #Magento Architect Tech Lead with and without DevOps skills Practical,1145,0.0,0.859,0.141,0.3182,2021-06-06 19:09:38
Lesson number What transactions privacy and snarks prin Community,256,0.0,0.86,0.14,0.0772,2021-06-06 19:08:32
Thank you all including students from #waterlooregion for attending #Coding workshop Happy see many young students,2207,0.0,0.693,0.307,0.7351,2021-06-06 19:08:06
Lesson number What transactions privacy and snarks prin Community,571,0.0,0.86,0.14,0.0772,2021-06-06 19:07:30
What your best python IDE PyCharm for Application Jupyter for Data Analysis #pythondeveloper #Microsoft,6084,0.0,0.756,0.244,0.6369,2021-06-06 19:07:26
What your best python IDE PyCharm for Application Jupyter for Data Analysis #pythondeveloper #Microsoft,2207,0.0,0.756,0.244,0.6369,2021-06-06 19:07:20
answer #MariaCallas #TDuckCode mean #lovefighters duckstheyARE #inspiration #no #data #AI #Google #GenshinImpact,2207,0.0,1.0,0.0,0.0,2021-06-06 19:07:02
More info about that Google development San Jose #Google #Architecture #UrbanDevelopment #SanJose,7177,0.0,1.0,0.0,0.0,2021-06-06 19:06:53
