tweet,follower_count,neg,neu,pos,compound,time
#Google searches old,3334,0.0,1.0,0.0,0.0,2021-05-14 21:03:37
#Google searches old,3334,0.0,1.0,0.0,0.0,2021-05-14 21:03:36
#Google searches old,3334,0.0,1.0,0.0,0.0,2021-05-14 21:03:34
#Google fixes exploited Chrome zero day dropped Twitter last week via,10818,0.231,0.769,0.0,-0.4588,2021-05-14 21:01:58
Here What the Dreams #Google #ArtificialIntelligence Look Like #fintech #AI #Machi,989,0.0,0.634,0.366,0.6369,2021-05-14 21:01:52
Hey #Developers make sure read article learn how easily Sync Call Log into Google,52061,0.0,0.719,0.281,0.5719,2021-05-14 21:00:44
These extensions EAD are basic needs force immigrants into Servitude leading Suppression,16,0.0,1.0,0.0,0.0,2021-05-14 21:00:03
Aaand back Next Tuesday amp Thursday our Tech Talks return starting with #Google Forms Sign for this top,2715,0.0,0.895,0.105,0.25,2021-05-14 21:00:00
LINK Kasa #Smart WiFi Power Strip Outlets Works with #Alexa #Google #Currys World,746,0.0,1.0,0.0,0.0,2021-05-14 20:59:36
single Touch and Google Play #googleplay #Google #internetradio,2625,0.0,0.745,0.255,0.34,2021-05-14 20:59:01
LINO ARCI REAL ESTATE AGENT amp TEAM Your Home Sold Guaranteed Buy #Google,138,0.0,1.0,0.0,0.0,2021-05-14 20:58:45
Google announces several updates that will help provide site owners and advertisers with relevant data when cookies aren,92,0.0,0.863,0.137,0.4019,2021-05-14 20:57:53
This weekends wallpaper for Google Pixel photo took with the Pixel Looks good why not,212,0.0,0.828,0.172,0.4404,2021-05-14 20:57:53
These extensions EAD are basic needs force immigrants into Servitude leading Suppression,7,0.0,1.0,0.0,0.0,2021-05-14 20:56:09
#Crypto will boom when BIG TECH #Amazon #Google starts accepting them payments #dogecoin #Bitcoin,1,0.0,0.833,0.167,0.3818,2021-05-14 20:55:38
#GooglePay launches international #payments with #Wise and #WesternUnion #Google Pay users can now transfer money,23751,0.091,0.909,0.0,-0.1027,2021-05-14 20:55:28
#Apple hardware and #software protects user more than #Google However that doesn mean that you should simpl,61,0.0,0.874,0.126,0.3182,2021-05-14 20:54:42
What new with Google Cloud #GCP #Google #GoogleWorkspace #InsideGoogleCloud,601,0.0,1.0,0.0,0.0,2021-05-14 20:53:56
Why embedding financial services into digital experiences can generate new revenue #GCP #Google,601,0.0,1.0,0.0,0.0,2021-05-14 20:53:55
Google the internet #google #googl #goog #stock #market #tech #technology #epic #internet #monster,204,0.0,1.0,0.0,0.0,2021-05-14 20:53:47
Under the deal #ElonMusk space development company will install #Starlink ground stations #Google data centres that,124,0.0,1.0,0.0,0.0,2021-05-14 20:52:32
These extensions EAD are basic needs force immigrants into Servitude leading Suppression,61,0.0,1.0,0.0,0.0,2021-05-14 20:52:17
Six Useful Google Search Operators https,288,0.0,0.633,0.367,0.4404,2021-05-14 20:51:48
Future price bound lot greater #CloudComputing and being associated with #Google,406,0.0,0.8,0.2,0.3612,2021-05-14 20:49:31
Which you prefer #android #iphone #ios #samsung #smartphone #apple #tech #pro #technology #mobile #oneplus #xiaomi,222,0.0,1.0,0.0,0.0,2021-05-14 20:49:27
Google announces several updates that will help provide site owners and advertisers with relevant data when cookies aren,4468,0.0,0.863,0.137,0.4019,2021-05-14 20:47:36
Lol Discord logo remake #wap #google #googlesans #productsans #discord,58,0.216,0.56,0.224,0.0258,2021-05-14 20:46:43
These extensions EAD are basic needs force immigrants into Servitude leading Suppression,8,0.0,1.0,0.0,0.0,2021-05-14 20:46:19
These extensions EAD are basic needs force immigrants into Servitude leading Suppression,24,0.0,1.0,0.0,0.0,2021-05-14 20:45:04
INSTALAR GRATIS GOOGLE PLAY #anunciiar #ColombiaPuedesTodo #Colombia #BTT #Bogota #ParoNacional,742,0.0,0.612,0.388,0.6207,2021-05-14 20:44:57
GCP product cheat sheets #Google #GoogleCloud #CheatSheet,791,0.333,0.667,0.0,-0.4588,2021-05-14 20:44:07
Google joins other tech companies support the work visas for immigrant spouses Indiablooms First Portal Digit,20,0.0,0.847,0.153,0.4019,2021-05-14 20:43:17
Guys #followme will #followback #RT #retweet #Buildingengineering #Burke #Byron #Chemicalengineering,477,0.0,1.0,0.0,0.0,2021-05-14 20:43:08
INSTALAR GRATIS GOOGLE PLAY #anunciiar #ColombiaPuedesTodo #Colombia #BTT #Bogota,4,0.0,0.58,0.42,0.6207,2021-05-14 20:42:56
Get unlocked Google Pixel for Woot #google,1637,0.0,0.682,0.318,0.4215,2021-05-14 20:42:23
Samsung will adopt one the most mysterious Google projects #Android #Google #Mobile #Samsung #Smartphones,33561,0.0,0.884,0.116,0.1779,2021-05-14 20:40:49
These extensions EAD are basic needs force immigrants into Servitude leading Suppression,113,0.0,1.0,0.0,0.0,2021-05-14 20:40:04
Why embedding financial services into digital experiences can generate new revenue #GCP,185,0.0,1.0,0.0,0.0,2021-05-14 20:40:02
Google making steady progress South Korea search engine market #Google #Naver,80,0.0,0.781,0.219,0.4215,2021-05-14 20:37:29
Google Cloud CEO predicts boom business process service #Google #Cloud #technology,1103,0.0,1.0,0.0,0.0,2021-05-14 20:37:27
#SuperAnimalRoyale and #ShantaeandthePiratesCurse are coming #Stadia later this year #CloudGaming #CloudGamingNews #Google,626,0.0,1.0,0.0,0.0,2021-05-14 20:36:56
Here What the Dreams #Google #ArtificialIntelligence Look Like #fintech #AI #Machi,251,0.0,0.634,0.366,0.6369,2021-05-14 20:34:53
Future price bound lot greater #CloudComputing and being associated with,363,0.0,0.783,0.217,0.3612,2021-05-14 20:34:35
everyone you need cute illustration children book design for only contact bellow,212,0.0,0.786,0.214,0.4588,2021-05-14 20:33:38
#Italy Fines #Google for Excluding Car App #Sanctions #Chinese Official for Abuses NTD News WATCH HERE,2004,0.194,0.806,0.0,-0.5574,2021-05-14 20:32:15
Reel Life Photos #Google,351,0.0,1.0,0.0,0.0,2021-05-14 20:30:51
What gRPC #grpc #rpc #protobuf #rest #api #google #cplusplus #java #dev #web #programming #python #java #php,1940,0.0,1.0,0.0,0.0,2021-05-14 20:30:44
Virtual Learning Here Stay for #technology #business #bitcoin #youtube #live daysofcode #nowplaying #security,56,0.0,1.0,0.0,0.0,2021-05-14 20:30:33
Dvd screensaver nouvel easter egg #Google,1278,0.0,1.0,0.0,0.0,2021-05-14 20:30:23
MATIC #Polygon #Google #VISA #Crypto,192,0.0,1.0,0.0,0.0,2021-05-14 20:30:07
New Google Pixel and Pixel Pro leaks have skeptical but excited Read more #technology,2,0.099,0.716,0.185,0.3506,2021-05-14 20:30:03
What gRPC #grpc #rpc #protobuf #rest #api #google #cplusplus #java #dev #web #programming #python #java #php,1510,0.0,1.0,0.0,0.0,2021-05-14 20:29:29
Using the Android Google Jamboard App #YouTube #eduk #jamboard #google,13521,0.0,1.0,0.0,0.0,2021-05-14 20:29:02
Using the Android Google Jamboard App #YouTube #eduk #jamboard #google,7597,0.0,1.0,0.0,0.0,2021-05-14 20:29:01
Chill Zone Alert You asked for them and they coming Glad see taking interest,80,0.0,0.573,0.427,0.802,2021-05-14 20:28:59
When you want experienced mobile #locksmith your side call offer locksmith services for commercial,50,0.0,0.909,0.091,0.0772,2021-05-14 20:28:57
What gRPC #grpc #rpc #protobuf #rest #api #google #cplusplus #java #dev #web #programming #python #java #php,357,0.0,1.0,0.0,0.0,2021-05-14 20:28:30
Chill Zone Alert You asked for them and they coming Glad see taking interest,3941,0.0,0.573,0.427,0.802,2021-05-14 20:28:27
What gRPC #grpc #rpc #protobuf #rest #api #google #cplusplus #java #dev #web #programming #python #java #php,353,0.0,1.0,0.0,0.0,2021-05-14 20:28:08
What gRPC #grpc #rpc #protobuf #rest #api #google #cplusplus #java #dev #web #programming #python #java #php,651,0.0,1.0,0.0,0.0,2021-05-14 20:28:07
Better Way Business Solutions #Google,346,0.0,0.395,0.605,0.5574,2021-05-14 20:28:06
What gRPC #grpc #rpc #protobuf #rest #api #google #cplusplus #java #dev #web #programming #python #java #php,4314,0.0,1.0,0.0,0.0,2021-05-14 20:28:02
#Italy Fines #Google for Excluding Car App #Sanctions #Chinese Official for Abuses NTD News WATCH HERE,699,0.194,0.806,0.0,-0.5574,2021-05-14 20:27:07
What gRPC #grpc #rpc #protobuf #rest #api #google #cplusplus #java #dev #web #programming #python #java #php,4612,0.0,1.0,0.0,0.0,2021-05-14 20:27:00
What gRPC #grpc #rpc #protobuf #rest #api #google #cplusplus #java #dev #web #programming #python #java #php,3831,0.0,1.0,0.0,0.0,2021-05-14 20:26:58
What gRPC #grpc #rpc #protobuf #rest #api #google #cplusplus #java #dev #web #programming #python #java #php,308,0.0,1.0,0.0,0.0,2021-05-14 20:26:58
What gRPC #grpc #rpc #protobuf #rest #api #google #cplusplus #java #dev #web #programming #python #java,546,0.0,1.0,0.0,0.0,2021-05-14 20:26:53
What new with Google Cloud #GCP #Google #GoogleWorkspace #InsideGoogleCloud,185,0.0,1.0,0.0,0.0,2021-05-14 20:25:01
How Positioned Yourselves the Top Feng Shui Master Singapore #fengshui #singapore #google,8010,0.0,0.859,0.141,0.2023,2021-05-14 20:24:45
Advanced Aesthetic Clinic #Google,207,0.0,0.6,0.4,0.25,2021-05-14 20:24:38
Homes LLC #Google,2,0.0,1.0,0.0,0.0,2021-05-14 20:24:32
looking for the BEST APP FOR FINANCIAL ADVICE Any suggestions #cryptocurrencies #cryptoart #cryptocurrency #Cry,2790,0.0,0.725,0.275,0.7125,2021-05-14 20:24:05
Google What Can Say #google #googl #stock #tech #internet #goog #technology #epic #monster,204,0.0,1.0,0.0,0.0,2021-05-14 20:23:47
Don forget about these Google Map tricks Trust #Android #Google #Facebook,1368,0.231,0.544,0.224,0.2263,2021-05-14 20:23:04
What expect from Google all virtual #Apps #Hardware #Google #googleio,8275,0.0,1.0,0.0,0.0,2021-05-14 20:23:04
you still need file #extension you need hurry meet the tax deadline Check out our free app,1120,0.0,0.829,0.171,0.5106,2021-05-14 20:23:00
DevOps the Federal Government What Means and How Can Help #google #video #amazon daysofcode #infosec #devops,745,0.0,0.847,0.153,0.4019,2021-05-14 20:22:51
The Chelsea Bijouterie Ltd #Google,2790,0.0,1.0,0.0,0.0,2021-05-14 20:22:50
Virtual Learning Here Stay for #technology #business #bitcoin #youtube #live daysofcode #nowplaying #security,651,0.0,1.0,0.0,0.0,2021-05-14 20:22:46
Virtual Learning Here Stay for #technology #business #bitcoin #youtube #live daysofcode #nowplaying #security,35718,0.0,1.0,0.0,0.0,2021-05-14 20:22:41
Virtual Learning Here Stay for #technology #business #bitcoin #youtube #live daysofcode #nowplaying #security,15344,0.0,1.0,0.0,0.0,2021-05-14 20:22:40
Virtual Learning Here Stay for #technology #business #bitcoin #youtube #live daysofcode #nowplaying #security,745,0.0,1.0,0.0,0.0,2021-05-14 20:22:29
Venmo now lets users buy and sell Bitcoin and Ethereum #technology #business #mobile #google #blockchain #youtube #live,745,0.0,1.0,0.0,0.0,2021-05-14 20:22:27
Here What the Dreams #Google #ArtificialIntelligence Look Like #fintech #AI #Machi,2922,0.0,0.634,0.366,0.6369,2021-05-14 20:22:09
How the USPS deploying help track packages year #blockchain #youtube #bitcoin #music #twitter #art #live,745,0.0,0.838,0.162,0.4019,2021-05-14 20:22:03
The news comes after five months internal turmoil sparked #Google firing both leaders its ethics divisio,1348,0.259,0.741,0.0,-0.5994,2021-05-14 20:21:48
More Info order now #startup daysofcode #codenewbie #freelancing #introvert #medium #programming,353,0.0,1.0,0.0,0.0,2021-05-14 20:21:28
More Info order now #startup daysofcode #codenewbie #freelancing #introvert #medium #programming,745,0.0,1.0,0.0,0.0,2021-05-14 20:21:26
Advanced Aesthetic Clinic #Google,207,0.0,0.6,0.4,0.25,2021-05-14 20:21:03
Here What the Dreams #Google #ArtificialIntelligence Look Like #fintech #AI,109681,0.0,0.606,0.394,0.6369,2021-05-14 20:21:01
The Chelsea Bijouterie Ltd #Google,2790,0.0,1.0,0.0,0.0,2021-05-14 20:20:17
advice for getting your business found online #entrepreneur #socialmedia #marketing #business,5300,0.0,1.0,0.0,0.0,2021-05-14 20:19:53
SEOsiri Optimizing Search Engines Optimizing Social Media #Google #seosiri #momenulahmad,4080,0.0,0.571,0.429,0.7184,2021-05-14 20:19:52
Today going talking about How Customers Find Your Business Google got question about SEO going,5300,0.0,1.0,0.0,0.0,2021-05-14 20:19:21
#Google got interns working open source projects from home Tech Republic #RemoteWork,58155,0.0,1.0,0.0,0.0,2021-05-14 20:19:00
this episode visit with Kate Biberdorf aka along with Christian artist influencer podcaster,107682,0.0,1.0,0.0,0.0,2021-05-14 20:18:35
Chill Zone Alert You asked for them and they coming Glad see taking interest,7,0.0,0.573,0.427,0.802,2021-05-14 20:17:01
Diamond Exchange Houston #Google #jewelryexchange #jewelryconsignment #selljewelry,7,0.0,0.714,0.286,0.34,2021-05-14 20:16:51
This funny Argentinian man bought Google domain name for just few dollars #google #DomainName,150,0.0,0.818,0.182,0.4404,2021-05-14 20:16:31
#Google Search Console GSC one the most important tools SEO should learn use this beginner,1679,0.0,0.87,0.13,0.2716,2021-05-14 20:15:02
These extensions EAD are basic needs force immigrants into Servitude leading Suppression,63,0.0,1.0,0.0,0.0,2021-05-14 20:15:02
Google Page Experience algorithm update inches closer and closer here are five ways ensure that your website,803,0.0,0.86,0.14,0.3818,2021-05-14 20:11:32
#Google balloons travel the stratosphere deliver #internet people remote areas,3949,0.0,1.0,0.0,0.0,2021-05-14 20:11:19
John Mueller #Google stresses that #organizationmarkup should not appear every page best put organiz,21,0.156,0.625,0.219,0.296,2021-05-14 20:11:04
The company plans automatically enroll users two step verification their accounts are properly configured,298,0.0,1.0,0.0,0.0,2021-05-14 20:11:01
These extensions EAD are basic needs force immigrants into Servitude leading Suppression,33,0.0,1.0,0.0,0.0,2021-05-14 20:09:50
#Google updated #GoogleAnalytics #GA new model the web What about the rest Google The #search,2337,0.0,1.0,0.0,0.0,2021-05-14 20:09:43
Google Page Experience algorithm update inches closer and closer here are five ways ensure that your websi,26,0.0,0.86,0.14,0.3818,2021-05-14 20:09:15
How use the new Gmail feature everyone talking about iPhone Android #gmail #google,1776,0.0,1.0,0.0,0.0,2021-05-14 20:09:04
MATIC #Polygon #Google #VISA #Crypto,130,0.0,1.0,0.0,0.0,2021-05-14 20:08:27
slowly come out lockdown are extending our opening hours include Saturdays from May Dav,543,0.0,1.0,0.0,0.0,2021-05-14 20:08:23
#Google balloons travel the stratosphere deliver #internet people remote areas,12709,0.0,1.0,0.0,0.0,2021-05-14 20:06:14
Google What Expect #Google #technology #GoogleIO,36942,0.0,1.0,0.0,0.0,2021-05-14 20:06:01
Lula Catering #Google #Uniqueboutique COCKTAILS,396,0.0,1.0,0.0,0.0,2021-05-14 20:05:50
#Italy Fines #Google for Excluding Car App #Sanctions #Chinese Official for Abuses NTD News WATCH HERE,70145,0.194,0.806,0.0,-0.5574,2021-05-14 20:05:01
LEAKED Alleged first look the Pixel and Pixel Pro shows new horizontal rear camera layout credit Job Prosser,32,0.14,0.74,0.12,-0.1111,2021-05-14 20:04:09
Chill Zone Alert You asked for them and they coming Glad see taking interest,122,0.0,0.573,0.427,0.802,2021-05-14 20:01:32
Which one you think the hardest Here are more interview questions revealed Software Engineers Googl,354,0.0,1.0,0.0,0.0,2021-05-14 20:00:20
you haven done #SEO yet you must start now And you already are doing just keep going #Google #rankings chan,5,0.0,1.0,0.0,0.0,2021-05-14 20:00:18
How use the new Gmail feature everyone talking about iPhone Android via,112,0.0,1.0,0.0,0.0,2021-05-14 20:00:02
What does the landmark #Google Oracle #SCOTUS decision mean for the fair use doctrine #software #copyright,725,0.0,0.795,0.205,0.3818,2021-05-14 20:00:00
Outbound Trawas Timur Langit Outbound #Google,55,0.0,1.0,0.0,0.0,2021-05-14 19:59:42
More Info order now #startup daysofcode #codenewbie #freelancing #introvert #medium #programming,3831,0.0,1.0,0.0,0.0,2021-05-14 19:58:46
More Info order now #startup daysofcode #codenewbie #freelancing #introvert #medium #programming,308,0.0,1.0,0.0,0.0,2021-05-14 19:58:46
More Info order now #startup daysofcode #codenewbie #freelancing #introvert #medium,155,0.0,1.0,0.0,0.0,2021-05-14 19:58:41
See you the bar tonight partner #Google #googlepartners #fridayfunday #TGIF #DryJokesFriday #instadaily #weekend,36,0.0,1.0,0.0,0.0,2021-05-14 19:58:36
Chill Zone Alert You asked for them and they coming Glad see taking interest,7,0.0,0.573,0.427,0.802,2021-05-14 19:58:00
Your feedback matters #google #reviews #happy #weekend,3,0.0,0.845,0.155,0.0258,2021-05-14 19:56:08
Your feedback matters #google #reviews #happy #weekend,19,0.0,0.845,0.155,0.0258,2021-05-14 19:55:17
COVID paranoia starting get down But there light the end the tunnel,3204,0.12,0.88,0.0,-0.128,2021-05-14 19:55:04
Sportsman Warehouse hldg #facebook #youtube #twitter #tiktok #music #socialmedia,197,0.0,1.0,0.0,0.0,2021-05-14 19:55:03
Apple Music for Android reveals lossless audio could imminent from #google,227,0.0,1.0,0.0,0.0,2021-05-14 19:54:51
Your feedback matters #google #reviews #happy #weekend,3,0.0,0.845,0.155,0.0258,2021-05-14 19:54:23
Chill Zone Alert You asked for them and they coming Glad see taking interest,30,0.0,0.573,0.427,0.802,2021-05-14 19:53:43
AWS Azure GCP Brief Comparison PKV hours students March release LINK,2247,0.0,1.0,0.0,0.0,2021-05-14 19:53:32
Your feedback matters #google #reviews #happy #weekend,9,0.0,0.845,0.155,0.0258,2021-05-14 19:53:09
#Munzurkalem #parisianstyle #usd #twetter #work #war #lowcarb #istanbul #parisianstyle #fark ndal #stil #game,301,0.0,1.0,0.0,0.0,2021-05-14 19:52:34
Bonita Appliance Repair Oven amp Refrigerator Repair #Google #sandiego,97,0.0,1.0,0.0,0.0,2021-05-14 19:51:05
Your feedback matters #google #reviews #happy #weekend,4,0.0,0.845,0.155,0.0258,2021-05-14 19:50:57
Chill Zone Alert You asked for them and they coming Glad see taking interest,52,0.0,0.573,0.427,0.802,2021-05-14 19:50:26
Your feedback matters #google #reviews #happy #weekend,2,0.0,0.845,0.155,0.0258,2021-05-14 19:50:20
Shawn Delaney Maximum One Realty #Google,228,0.0,1.0,0.0,0.0,2021-05-14 19:50:08
Your feedback matters #google #reviews #happy #weekend,9,0.0,0.845,0.155,0.0258,2021-05-14 19:49:54
Outbound Pacet Timur Langit Outbound #Google,55,0.0,1.0,0.0,0.0,2021-05-14 19:49:53
#MaplinRecommends the #xiaomi range #smart #bulbs for their low price and compatibility with #Alexa #Google and #Apple,623,0.116,0.884,0.0,-0.2732,2021-05-14 19:49:50
Chill Zone Alert You asked for them and they coming Glad see taking interest,69,0.0,0.573,0.427,0.802,2021-05-14 19:49:49
Your feedback matters #google #reviews #happy #weekend,13,0.0,0.845,0.155,0.0258,2021-05-14 19:49:18
Thrilled speaking #GoogleIO about The women building voice and their role the voice revolution Registe,3097,0.0,0.828,0.172,0.4404,2021-05-14 19:49:17
#Google Chrome Tricks You Might Not Know Here are awesome features google chrome tricks which will amaze,605,0.127,0.551,0.322,0.765,2021-05-14 19:49:15
Venmo now lets users buy and sell Bitcoin and Ethereum #technology #business #mobile #google #blockchain #youtube #live,418,0.0,1.0,0.0,0.0,2021-05-14 19:48:59
Check out Women Flix Award winning Coaching Services for Women Google #google #businesswoman #woman,213,0.0,0.635,0.365,0.7845,2021-05-14 19:48:58
#starlink and #google #gcp teaming Really looks like the #cloud battle moving into #space,601,0.15,0.691,0.16,0.046,2021-05-14 19:48:55
Which you prefer #android #iphone #ios #samsung #smartphone #apple #tech #pro #technology #mobile #oneplus #xiaomi,5737,0.0,1.0,0.0,0.0,2021-05-14 19:48:18
Your feedback matters #google #reviews #happy #weekend,6,0.0,0.845,0.155,0.0258,2021-05-14 19:48:12
#starlink and #google #gcp teaming Really looks like the #cloud battle moving into #space,1462,0.15,0.691,0.16,0.046,2021-05-14 19:48:01
Your feedback matters #google #reviews #happy #weekend,64,0.0,0.845,0.155,0.0258,2021-05-14 19:47:45
Value invested year ago #Dogecoin #Ethereum #Bitcoin #Penn #Gap,827,0.0,0.769,0.231,0.34,2021-05-14 19:47:21
Your feedback matters #google #reviews #happy #weekend,28,0.0,0.845,0.155,0.0258,2021-05-14 19:46:54
Chill Zone Alert You asked for them and they coming Glad see taking interest,352,0.0,0.573,0.427,0.802,2021-05-14 19:46:20
Your feedback matters #google #reviews #happy #weekend,16,0.0,0.845,0.155,0.0258,2021-05-14 19:46:13
How the USPS deploying help track packages year #blockchain #youtube #bitcoin #music #twitter #art #live,3831,0.0,0.838,0.162,0.4019,2021-05-14 19:46:12
How the USPS deploying help track packages year #blockchain #youtube #bitcoin #music #twitter #art #live,308,0.0,0.838,0.162,0.4019,2021-05-14 19:46:12
How the USPS deploying help track packages year #blockchain #youtube #bitcoin #music #twitter #art #live,1806,0.0,0.838,0.162,0.4019,2021-05-14 19:46:12
How the USPS deploying help track packages year #blockchain #youtube #bitcoin #music #twitter #art,8829,0.0,0.828,0.172,0.4019,2021-05-14 19:46:07
Chill Zone Alert You asked for them and they coming Glad see taking interest,22,0.0,0.573,0.427,0.802,2021-05-14 19:45:58
GasBuddy Jumps Apple Store After Colonial Pipeline Shutdown #GasBuddy #Android #iOS #App #Apple,563,0.0,1.0,0.0,0.0,2021-05-14 19:45:47
Your feedback matters #google #reviews #happy #weekend,1,0.0,0.845,0.155,0.0258,2021-05-14 19:45:45
Andrea Smith #Google,1127,0.0,1.0,0.0,0.0,2021-05-14 19:45:07
Mediacom Seeks Halt Google Fiber Build Citing Favoritism #Google #fibernetwork,5514,0.0,0.841,0.159,0.1779,2021-05-14 19:45:07
Which you prefer #android #iphone #ios #samsung #smartphone #apple #tech #pro #technology #mobile #oneplus #xiaomi,1896,0.0,1.0,0.0,0.0,2021-05-14 19:45:05
Chill Zone Alert You asked for them and they coming Glad see taking interest,1663,0.0,0.573,0.427,0.802,2021-05-14 19:45:05
#Apple #Amazon and #Google are focusing Internet Things #IoT devices that keep the house safe This would,168,0.0,0.847,0.153,0.4404,2021-05-14 19:45:03
Value invested year ago #Dogecoin #Ethereum #Bitcoin #Penn #Gap,3764,0.0,0.769,0.231,0.34,2021-05-14 19:44:06
Alhamdulillah the full series the Qur anic Sciences now available #Youtube ads,139,0.0,1.0,0.0,0.0,2021-05-14 19:44:02
#Google envisioning simpler and safer future without passwords They recently announced that they are work,128,0.0,0.833,0.167,0.4215,2021-05-14 19:43:34
Alhamdulillah the full series the Qur anic Sciences now available #Youtube ads,51881,0.0,1.0,0.0,0.0,2021-05-14 19:42:45
amp wiped the #Palestinian state from the map app Why that #GenocideinGaza #google #apple,3,0.0,1.0,0.0,0.0,2021-05-14 19:41:39
#Google balloons travel the stratosphere deliver #internet people remote areas,90057,0.0,1.0,0.0,0.0,2021-05-14 19:40:13
Institute Design #Google,104,0.0,1.0,0.0,0.0,2021-05-14 19:38:57
Venmo now lets users buy and sell Bitcoin and Ethereum #technology #business #mobile #google #blockchain #youtube #live,3831,0.0,1.0,0.0,0.0,2021-05-14 19:38:28
Venmo now lets users buy and sell Bitcoin and Ethereum #technology #business #mobile #google #blockchain #youtube #live,353,0.0,1.0,0.0,0.0,2021-05-14 19:38:26
Venmo now lets users buy and sell Bitcoin and Ethereum #technology #business #mobile #google #blockchain #youtube,8829,0.0,1.0,0.0,0.0,2021-05-14 19:38:23
Virtual Learning Here Stay for #technology #business #bitcoin #youtube #live daysofcode #nowplaying #security,842,0.0,1.0,0.0,0.0,2021-05-14 19:38:16
Virtual Learning Here Stay for #technology #business #bitcoin #youtube #live daysofcode #nowplaying #security,3831,0.0,1.0,0.0,0.0,2021-05-14 19:37:48
Virtual Learning Here Stay for #technology #business #bitcoin #youtube #live daysofcode #nowplaying #security,353,0.0,1.0,0.0,0.0,2021-05-14 19:37:46
Virtual Learning Here Stay for #technology #business #bitcoin #youtube #live daysofcode #nowplaying,8829,0.0,1.0,0.0,0.0,2021-05-14 19:37:42
DevOps the Federal Government What Means and How Can Help #google #video #amazon daysofcode #infosec #devops,730,0.0,0.847,0.153,0.4019,2021-05-14 19:37:11
New feature idea Integrate #Google doc feature into Hangouts chat box Automatically turns the chat convo into meeting notes,1280,0.0,1.0,0.0,0.0,2021-05-14 19:35:53
Here how Web Webb Digital Marketing different #DigitalMarketingServices #digitalmarketingagency #Website #Websit,1384,0.0,1.0,0.0,0.0,2021-05-14 19:35:27
DevOps the Federal Government What Means and How Can Help #google #video #amazon daysofcode #infosec #devops,842,0.0,0.847,0.153,0.4019,2021-05-14 19:35:12
Here What the Dreams Google Artificial Intelligence Look Like #Google,5914,0.0,0.458,0.542,0.8074,2021-05-14 19:35:03
and discuss the episode Hundred Yards Over The Rim and the practicality wearing stove,1339,0.0,1.0,0.0,0.0,2021-05-14 19:34:13
These extensions EAD are basic needs force immigrants into Servitude leading Suppression,75,0.0,1.0,0.0,0.0,2021-05-14 19:34:13
How many ladies experience this you don know what ASK #Google,1490,0.0,1.0,0.0,0.0,2021-05-14 19:33:55
Today #GoogleDoodle celebrates Happy National Day Paraguay #GoogleDoodle Find out more,345,0.0,0.549,0.451,0.8126,2021-05-14 19:33:50
#CyberThreats have become part everyday life this was inevitable can real pain times but the,14328,0.133,0.867,0.0,-0.2846,2021-05-14 19:33:49
DevOps the Federal Government What Means and How Can Help #google #video #amazon daysofcode #infosec #devops,35718,0.0,0.847,0.153,0.4019,2021-05-14 19:32:42
Here What the Dreams Google Artificial Intelligence Look Like #ArtificialIntelligence #LatestNews #Google,7268,0.0,0.52,0.48,0.8074,2021-05-14 19:32:35
DevOps the Federal Government What Means and How Can Help #google #video #amazon daysofcode #infosec #devops,15344,0.0,0.847,0.153,0.4019,2021-05-14 19:32:16
DevOps the Federal Government What Means and How Can Help #google #video #amazon daysofcode #infosec #devops,651,0.0,0.847,0.153,0.4019,2021-05-14 19:32:00
DevOps the Federal Government What Means and How Can Help #google #video #amazon daysofcode #infosec #devops,29,0.0,0.847,0.153,0.4019,2021-05-14 19:31:07
