tweet,follower_count,neg,neu,pos,compound,time
launched national programme for coders with #Google #Microsoft #Amazon AWS #Cisco #IBM #HPE #LinkedIn #Nvi,3516,0.0,0.903,0.097,0.128,2021-07-11 02:18:56
Setting timers Wear with Google Assistant currently broken #Google #Technology,1849,0.256,0.744,0.0,-0.4767,2021-07-11 02:17:34
states sued Google for Play Store monopoly and cheating third party app makers #Google #PlayStore,8585,0.174,0.58,0.246,0.128,2021-07-11 02:16:12
look forward actually said Trump Former President Trump said eager and willing provide sworn testimo,18038,0.0,0.848,0.152,0.3612,2021-07-11 02:16:04
Chauffeur Booking Melbourne #Google,561,0.0,1.0,0.0,0.0,2021-07-11 02:16:00
look forward actually said Trump Former President Trump said eager and willing provide sworn testimo,2118,0.0,0.848,0.152,0.3612,2021-07-11 02:15:20
look forward actually said Trump Former President Trump said eager and willing provide sworn testimo,92,0.0,0.848,0.152,0.3612,2021-07-11 02:15:01
look forward actually said Trump Former President Trump said eager and willing provide sworn testimo,886,0.0,0.848,0.152,0.3612,2021-07-11 02:15:00
look forward actually said Trump Former President Trump said eager and willing provide sworn testimo,324,0.0,0.848,0.152,0.3612,2021-07-11 02:14:20
look forward actually said Trump Former President Trump said eager and willing provide sworn testimo,6009,0.0,0.848,0.152,0.3612,2021-07-11 02:14:01
Like and share you think fantastic #usher #crowder #june coup #google #ethan,2,0.0,0.52,0.48,0.8074,2021-07-11 02:13:58
#Google #PixelBuds are legit such great fit ear really good sound bucks steal,37,0.146,0.409,0.445,0.7645,2021-07-11 02:12:45
look forward actually said Trump Former President Trump said eager and willing provide sworn testimo,567,0.0,0.848,0.152,0.3612,2021-07-11 02:12:33
#cloudcomputing #google #artificialintelligence Google Cloud Vertex,1133,0.0,1.0,0.0,0.0,2021-07-11 02:12:17
look forward actually said Trump Former President Trump said eager and willing provide sworn testimo,2400,0.0,0.848,0.152,0.3612,2021-07-11 02:11:32
look forward actually said Trump Former President Trump said eager and willing provide sworn testimo,4680,0.0,0.848,0.152,0.3612,2021-07-11 02:11:23
look forward actually said Trump Former President Trump said eager and willing provide sworn testimo,4920,0.0,0.848,0.152,0.3612,2021-07-11 02:10:24
#Google #CEO Facing Intense Criticism for His #leadership His Response Pure #EmotionalIntelligence #EQ,1841,0.191,0.724,0.086,-0.3818,2021-07-11 02:10:23
look forward actually said Trump Former President Trump said eager and willing provide sworn testimo,146,0.0,0.848,0.152,0.3612,2021-07-11 02:10:14
look forward actually said Trump Former President Trump said eager and willing provide sworn,416687,0.0,0.839,0.161,0.3612,2021-07-11 02:10:01
please update your website now #Google #Messi #CopaAmericaFINAL #CopaAmerica,802,0.0,0.777,0.223,0.3182,2021-07-11 02:06:40
One search will give ads first then pages answers from #google aint reliable for shit,367,0.0,0.827,0.173,0.4449,2021-07-11 02:05:06
This works #Google #GoogleDocs,852,0.0,1.0,0.0,0.0,2021-07-11 02:03:25
Pre registration Achieved Over commandants finished pre registration this time Sincerely thanks for,125,0.0,0.647,0.353,0.7184,2021-07-11 02:03:23
Escape available Google Play #googleplay #internetradio #indiemusic #google,2602,0.0,0.594,0.406,0.4767,2021-07-11 01:59:06
KETO FIT TODAY #ketodiet Link below #ketogenic #GulfKanawut #PopulationControlBill,0,0.0,0.712,0.288,0.4995,2021-07-11 01:58:41
Get More Reviews via #google #blogger #blogging #seo,104,0.0,1.0,0.0,0.0,2021-07-11 01:58:38
#Google chooses cost over design for the #Pixel PhoneArena,3974,0.0,1.0,0.0,0.0,2021-07-11 01:57:20
Get More Reviews via #google #blogger #blogging #seo,737,0.0,1.0,0.0,0.0,2021-07-11 01:56:33
#ACER Chromebook Spin Qualcomm RAM eMMC Inch Full #Touchscreen Display,685,0.0,1.0,0.0,0.0,2021-07-11 01:56:24
Android Apps #Google Play Harvest #Facebook Credentials #Sec Cyber,2,0.0,0.769,0.231,0.34,2021-07-11 01:54:52
Rumors Google Pixel series will get the first years software update #Google #UPDATE,31,0.0,1.0,0.0,0.0,2021-07-11 01:54:35
good mrng prefer ios android #Android #android #iPhone #Apple #Google #Samsung #Tweet,1,0.0,0.791,0.209,0.4404,2021-07-11 01:53:39
try this and type without the quotes barrel roll #google #technology #geek #fun,21762,0.0,1.0,0.0,0.0,2021-07-11 01:53:00
How get the Google pack #contentmarketing #seo #digitalmarketing #businesstips #blogging #Ou,406,0.0,1.0,0.0,0.0,2021-07-11 01:52:31
follow the man win some free cash follow lol #shib #Bitcoin #Ethereum #Pokemon #Google #BabyDog,1885,0.0,0.548,0.452,0.872,2021-07-11 01:52:00
#Twitter #Facebook #Google Common carriers Open accommodation law Antirust law #JusticeThomas Consideration,389,0.0,1.0,0.0,0.0,2021-07-11 01:50:55
How get the Google pack #contentmarketing #seo #digitalmarketing #businesstips,737,0.0,1.0,0.0,0.0,2021-07-11 01:50:41
follow the man win some free cash follow lol #shib #Bitcoin #Ethereum #Pokemon #Google,315,0.0,0.526,0.474,0.872,2021-07-11 01:48:27
#Gravitas American states sue #Google,3662,0.0,1.0,0.0,0.0,2021-07-11 01:47:46
#Google created this our little brat #Pretzel,211,0.0,0.75,0.25,0.25,2021-07-11 01:47:05
Finally arrived #Google #sre,7,0.0,1.0,0.0,0.0,2021-07-11 01:46:41
#interested #reading some good #books #website for #poetry #childrensbooks #hood,5874,0.0,0.756,0.244,0.4404,2021-07-11 01:46:22
#interested #reading some good #books #website for #poetry #childrensbooks,42,0.0,0.734,0.266,0.4404,2021-07-11 01:44:53
Yep #google has some issues with retaining #AR #VR talents for sure,2261,0.0,0.545,0.455,0.7579,2021-07-11 01:43:44
Ian Taylor Trekking #Google,57,0.0,1.0,0.0,0.0,2021-07-11 01:40:54
WARNING going sleep Sunday will cause Monday #monrowshoes #monrow #Sunday #SundayThoughts,15,0.239,0.761,0.0,-0.4824,2021-07-11 01:40:42
#Experian #Acxiom #Transunion #LexisNexis Dun amp Bradstreet #Datalogix #Epsilon #Equifax Reed Elsevier #Rapleaf #Intelius,682,0.0,1.0,0.0,0.0,2021-07-11 01:40:00
absolutely bang #usher #crowder #june coup #google #ethan,2,0.0,1.0,0.0,0.0,2021-07-11 01:38:42
What the fuck happened google now starting get annoyed this least simply click still pass this,593,0.303,0.697,0.0,-0.7269,2021-07-11 01:38:05
July buy #oneplus #device #smoothos #oneplus tpro #neversettle #beyondthespeed tpro,172,0.0,1.0,0.0,0.0,2021-07-11 01:37:16
Pre registration Achieved Over commandants finished pre registration this time Sincerely thanks for,16,0.0,0.647,0.353,0.7184,2021-07-11 01:35:37
#usher #crowder #june coup #google #ethan Geometric Luxury Brand Leather Women Long Zipper Coin Purses Tassel,2,0.0,1.0,0.0,0.0,2021-07-11 01:34:14
Yep #google has some issues with retaining #AR #VR talents for sure,129,0.0,0.545,0.455,0.7579,2021-07-11 01:33:34
Android Apps #Google Play Harvest #Facebook Credentials #Sec Cyber,12908,0.0,0.769,0.231,0.34,2021-07-11 01:32:23
The shameless GQP lies continue This time Ken Buck blames Google for Trump election loss #UnderCurre,74,0.459,0.541,0.0,-0.8481,2021-07-11 01:31:26
Pre registration Achieved Over commandants finished pre registration this time Sincerely thanks for,9,0.0,0.647,0.353,0.7184,2021-07-11 01:30:51
have forgotten gmail password putten recovery account that also forgot please help recover account #Google,6,0.101,0.635,0.265,0.4767,2021-07-11 01:30:51
Pre Registration Coating The smooth design significantly reduces friction while the stealth but passionate cut,9,0.186,0.588,0.225,0.4215,2021-07-11 01:30:18
Happy Morning everyone #QuoteoftheDay #Goodmorning #SmallBusiness #GlobalWarming,25,0.0,0.619,0.381,0.5719,2021-07-11 01:30:05
Importance Positive Customer Interaction Boosting Sales #google #googleanalytics,3678,0.0,0.37,0.63,0.8176,2021-07-11 01:30:00
Catchment Brewing having fun with our Augmented Reality app #AugmentedReality #beer #andr,124,0.0,0.769,0.231,0.5106,2021-07-11 01:28:35
Pre Registration Coating The smooth design significantly reduces friction while the stealth but passionate cut,1166,0.186,0.588,0.225,0.4215,2021-07-11 01:28:19
#GoogleChrome #Chrome #Google How Clear Cache Google via,2,0.0,0.729,0.271,0.3818,2021-07-11 01:26:40
Pre registration Achieved Over commandants finished pre registration this time Sincerely thanks for,4,0.0,0.647,0.353,0.7184,2021-07-11 01:23:48
Google What Can Say #google #googl #stock #tech #internet #goog #technology #epic #monster,215,0.0,1.0,0.0,0.0,2021-07-11 01:23:46
Sarah Ruggera LMFT #Google,109,0.0,1.0,0.0,0.0,2021-07-11 01:22:02
Why one talking about this Movie while Radhe was gossip Please watch Share #ZEE,14,0.099,0.64,0.262,0.4215,2021-07-11 01:16:20
July buy #oneplus #device #smoothos #oneplus tpro #neversettle #beyondthespeed,120,0.0,1.0,0.0,0.0,2021-07-11 01:14:02
#Experian #Acxiom #Transunion #LexisNexis Dun amp Bradstreet #Datalogix #Epsilon #Equifax Reed Elsevier #Rapleaf,28675,0.0,1.0,0.0,0.0,2021-07-11 01:13:44
not sure why one talking about this Movie while Radhe was gossip Please watch #ZEE #StateOfSiegeT,111,0.193,0.686,0.121,-0.0931,2021-07-11 01:13:21
#DuckDuckGo now the search engine for mobile use #Privacy and anonymity improvements rolling out slowly least not #Google,754,0.0,0.881,0.119,0.3182,2021-07-11 01:12:01
#Elgin #Moray #Scotland #STUPID #JehovahsWitnesses who think got #Soul,518,0.0,1.0,0.0,0.0,2021-07-11 01:11:44
google acount got hacked how only this type security given you #google you can provide security,0,0.132,0.634,0.234,0.2732,2021-07-11 01:10:55
Pre Registration Coating The smooth design significantly reduces friction while the stealth but passionate cut,32,0.186,0.588,0.225,0.4215,2021-07-11 01:10:50
#google #youtube #youtuber #youtubers #affiliatemarketing Check website for #affiliate #referral #cashback,67534,0.0,1.0,0.0,0.0,2021-07-11 01:06:10
Google announced major impending change their algorithm over year ago giving everyone opportunity get,8844,0.0,0.698,0.302,0.6369,2021-07-11 01:05:02
#Google sued DOZENS states for violating #antitrust laws abusing power over developers who distribute apps through,155,0.317,0.683,0.0,-0.7579,2021-07-11 01:04:43
Incredible #usher #crowder #june coup #google #ethan,2,0.0,1.0,0.0,0.0,2021-07-11 01:04:42
New video guys Beetroot and mango smoothie #beetroot #smoothie #newvideo #subscribe,1183,0.0,1.0,0.0,0.0,2021-07-11 01:04:29
Pre Registration Coating The smooth design significantly reduces friction while the stealth but passionate cut,62,0.186,0.588,0.225,0.4215,2021-07-11 01:04:26
not sure why one talking about this Movie while Radhe was gossip Please watch #ZEE #StateOfSiegeT,28,0.193,0.686,0.121,-0.0931,2021-07-11 01:03:13
Google discusses the most problematic kind spam and how prevent via #Goog,4028,0.318,0.427,0.255,-0.2911,2021-07-11 01:02:10
Check out some favorite logo transformations here #Branding #SocialMedia #Follow,960,0.0,0.75,0.25,0.4588,2021-07-11 01:00:30
#Google #Adwords phishing scam,9055,0.552,0.448,0.0,-0.5719,2021-07-11 01:00:02
#July The Day steps into the courtroom amp that gets SUED NLST for infringement Precede,40,0.181,0.819,0.0,-0.4767,2021-07-11 00:59:38
Why #India ultracheap new #smartphone critical #Google future,3548,0.247,0.753,0.0,-0.3182,2021-07-11 00:59:34
Legal scholar says President Trump class action lawsuits against #Facebook #Google and #Twitter are very,1488,0.099,0.807,0.093,-0.0258,2021-07-11 00:57:40
Let celebrate the episode helping erase the stigma with Mental health and addiction #SpeakYourWay,42,0.0,0.67,0.33,0.7096,2021-07-11 00:56:19
How much #Google Will chaege for #Pixel #pixel pro,20,0.0,1.0,0.0,0.0,2021-07-11 00:53:49
Ugandans cyber safe today Transact from only https enabled sites #BigData #Python #RStats #JavaScript #ReactJS #AI #DevOp,411,0.0,0.847,0.153,0.4404,2021-07-11 00:51:29
Using analogy your SEO training can incredibly powerful teaching tool Learn how can help unlock the SEO pote,423,0.0,0.734,0.266,0.6997,2021-07-11 00:49:10
MinnieRee LLC #Google,86,0.0,1.0,0.0,0.0,2021-07-11 00:46:35
just been asked verify age can watch Billy Connolly saying fuck off licence,21426,0.226,0.774,0.0,-0.5423,2021-07-11 00:45:23
#Google #Tag #Manager implementation amp deployment guide via,4618,0.0,1.0,0.0,0.0,2021-07-11 00:45:05
Critical Defense Group #Google,139,0.397,0.345,0.259,-0.2023,2021-07-11 00:44:04
Critical Defense Group #Google,139,0.397,0.345,0.259,-0.2023,2021-07-11 00:41:02
#Google #Android #Al #Huawei #samsung #Apple #USA #AppleMusic #gamer #Amazon #russia #Germany #ad Guys here,89,0.0,1.0,0.0,0.0,2021-07-11 00:39:52
Support your website #Rank #Google #SEOeStore,9694,0.0,0.649,0.351,0.4019,2021-07-11 00:39:27
Disneyland Day Wish luck #smile #disneyland #californiaadventure #google #pixel #gay #gaypride #gaymer #gu,1501,0.0,0.659,0.341,0.6908,2021-07-11 00:37:17
Pre Registration Coating The smooth design significantly reduces friction while the stealth but passionate cut,11,0.186,0.588,0.225,0.4215,2021-07-11 00:35:42
Second certificate done Gone through research empathizing and ideating next week start with low,1,0.139,0.861,0.0,-0.2732,2021-07-11 00:34:15
#July The Day steps into the courtroom amp that gets SUED NLST for infringement,200,0.193,0.807,0.0,-0.4767,2021-07-11 00:34:11
Pre Registration Coating The smooth design significantly reduces friction while the stealth but passionate cut,300,0.186,0.588,0.225,0.4215,2021-07-11 00:33:51
Disneyland Day Wish luck #smile #disneyland #californiaadventure #google #pixel #gay #gaypride,108,0.0,0.612,0.388,0.6908,2021-07-11 00:33:46
#Google Webmaster #Videos multiple links from one page another page count #SEO #PageRank,351,0.0,1.0,0.0,0.0,2021-07-11 00:30:49
Showtime Stingaree Restaurant Crystal beach #setx #crystalbeach #mpi #sing #dance #party #drink,331,0.0,1.0,0.0,0.0,2021-07-11 00:30:37
#usher #crowder #june coup #google #ethan Punk Party Mask Personality Hair Accessories Alloy Chain Headwear for,2,0.0,0.847,0.153,0.4019,2021-07-11 00:30:02
How Delete Google Business Listing #google #googleanalytics #webanalytics #seo,3678,0.0,1.0,0.0,0.0,2021-07-11 00:30:00
Incredible #usher #crowder #june coup #google #ethan,2,0.0,1.0,0.0,0.0,2021-07-11 00:28:19
SHIB doge btc eth feg bnb Ada xrp sol matic link usdt cake tel dot ksm trx vet,283,0.0,1.0,0.0,0.0,2021-07-11 00:26:58
HOW THE SPECTER COMMUNISM RULING OUR WORLD USA #CCPAgents,206,0.0,1.0,0.0,0.0,2021-07-11 00:22:01
Pre Registration Coating The smooth design significantly reduces friction while the stealth but passionate cut,183,0.186,0.588,0.225,0.4215,2021-07-11 00:18:19
Chauffeur Booking Melbourne #Google #chauffeur #Melbourne,561,0.0,1.0,0.0,0.0,2021-07-11 00:18:00
July buy #oneplus #device #smoothos #oneplus tpro #neversettle #beyondthespeed,120,0.0,1.0,0.0,0.0,2021-07-11 00:15:02
#Facebook #Twitter #Google Threaten Quit Hong Kong Over Proposed Data Laws,2968,0.206,0.794,0.0,-0.3818,2021-07-11 00:13:41
Ten days since launch and our children #music #app sitting downloads the #GooglePlayStore,6,0.0,1.0,0.0,0.0,2021-07-11 00:13:30
Pre Registration Coating The smooth design significantly reduces friction while the stealth but passionate cut,40,0.186,0.588,0.225,0.4215,2021-07-11 00:13:30
begins #stadia #google #googlestadia,1364,0.0,1.0,0.0,0.0,2021-07-11 00:10:30
#Top #Reasons Why Don Like #SocialMedia #Censorship #top list #bigtech #censorshipsucks #bigtechcensorship,2669,0.0,0.815,0.185,0.3612,2021-07-11 00:10:19
Data Category Original Construct Blueprint Data Details Liv has said that Luminance her favorite loadout But,13,0.0,0.793,0.207,0.3919,2021-07-11 00:09:56
Kuroro Furniture Set for pre registration unlocked Keep reach out pre registrations unlock,13,0.0,0.916,0.084,0.0258,2021-07-11 00:09:50
Google begs apology ugliest language Kannada #google #programming #coding #tech #technology #webdeveloper #javas,6714,0.237,0.688,0.075,-0.5574,2021-07-11 00:09:45
Gray Raven Database Lee Entropy Vol Construct Features Combo Easy deal high combo damage Physical Damage Skil,13,0.275,0.601,0.124,-0.5423,2021-07-11 00:09:42
The environmental parameters this field have just changed commandant New enemies confirmed Let discuss the functi,13,0.176,0.824,0.0,-0.4939,2021-07-11 00:09:34
What isn #disruption #Uber rocked the taxi industry but didn open new market capitalize low gros,7,0.15,0.85,0.0,-0.3919,2021-07-11 00:09:29
Gray Raven Database Nanami Pulse Vol Construct Features Mixed Damage Able deal Physical and Elemental DMG Resi,13,0.167,0.833,0.0,-0.4939,2021-07-11 00:09:26
Pre Registration Coating The smooth design significantly reduces friction while the stealth but passionate cut,13,0.186,0.588,0.225,0.4215,2021-07-11 00:09:12
Pre registration Achieved Over commandants finished pre registration this time Sincerely thanks for,13,0.0,0.647,0.353,0.7184,2021-07-11 00:08:49
Google begs apology ugliest language Kannada #google #programming #coding #tech #technology #webdeveloper #javas,629,0.237,0.688,0.075,-0.5574,2021-07-11 00:08:43
ask for #GoFundMe contributions here graphics moments ago basic webstats evidence,1488,0.0,1.0,0.0,0.0,2021-07-11 00:08:02
Google begs apology ugliest language Kannada #google #programming #coding #tech #technology #webdeveloper #javas,2195,0.237,0.688,0.075,-0.5574,2021-07-11 00:07:13
Customization non human names would alleviate this issue #Google got right,985,0.0,1.0,0.0,0.0,2021-07-11 00:04:46
Google begs apology ugliest language Kannada #google #programming #coding #tech #technology #webdeveloper #javas,235,0.237,0.688,0.075,-0.5574,2021-07-11 00:04:31
Pre Registration Coating The smooth design significantly reduces friction while the stealth but passionate cut,71,0.186,0.588,0.225,0.4215,2021-07-11 00:04:02
What local SEO and benefits Manishaln Read #LNTECHINFO #localseo #seo #dig,8276,0.0,0.794,0.206,0.3818,2021-07-11 00:03:15
leoliennodApparel PURCHASE #merch and #apparel here #CryptoNews #Cryptocurency #NF,34,0.0,1.0,0.0,0.0,2021-07-11 00:01:49
#usher #crowder #june coup #google #ethan Lovyno Pcs Child Baby Safety Silicone Protector Table Corner Edge,2,0.0,0.843,0.157,0.4215,2021-07-11 00:00:59
Listen jFRESHIO TunedINTO LeoLiennod #SoundCloud #cryptoTwitter #SaturdayThoughts #Saturd,34,0.0,1.0,0.0,0.0,2021-07-11 00:00:49
New Music from BBPllcmusic and Logan Grayy dropping soon Produced the talented Siege out Lagos Nigeria,103,0.0,0.82,0.18,0.5106,2021-07-11 00:00:38
The paper still pending peer review but damn #Google can even compete that saying something,15238,0.202,0.798,0.0,-0.5499,2021-07-11 00:00:03
Why #India ultracheap new #smartphone critical #Google future,302914,0.247,0.753,0.0,-0.3182,2021-07-11 00:00:01
SHIB doge btc eth feg bnb Ada xrp sol matic link usdt cake tel dot ksm trx vet #YouTuber,283,0.0,1.0,0.0,0.0,2021-07-10 23:58:43
SHIB doge btc eth feg bnb Ada xrp sol matic link usdt cake tel dot ksm trx vet,283,0.0,1.0,0.0,0.0,2021-07-10 23:58:10
#ATT sending free phones non VOLTE users #Google Messaging RCS chat going all amp branded android devices https,199,0.0,0.837,0.163,0.5106,2021-07-10 23:58:04
What local SEO and benefits Manishaln Read #LNTECHINFO #localseo #seo,29,0.0,0.776,0.224,0.3818,2021-07-10 23:57:55
Listen jFRESHIO TunedINTO LeoLiennod #SoundCloud #cryptoTwitter,364,0.0,1.0,0.0,0.0,2021-07-10 23:57:03
SHIB doge btc eth feg bnb Ada xrp sol matic link usdt cake tel dot ksm,283,0.0,1.0,0.0,0.0,2021-07-10 23:55:48
New Indian Express Delhi government tie with Google reduce bus waiting time #Google #India #MassTransit,5592,0.0,1.0,0.0,0.0,2021-07-10 23:54:00
Mike Butean Life Insurance Broker #Google,21,0.0,1.0,0.0,0.0,2021-07-10 23:53:52
#KeywordResearch Keyword research practice search engine optimization professionals use find and research searc,8276,0.0,0.822,0.178,0.3818,2021-07-10 23:53:45
Oreal Mascara Review Inspire JCoulterJ Amazon Influencer Only via #DigitalMar,8276,0.0,0.597,0.403,0.6597,2021-07-10 23:53:13
That really out sight #usher #crowder #june coup #google #ethan,2,0.0,1.0,0.0,0.0,2021-07-10 23:52:59
Among the #OSINT community the service well known pic designed for quick access,850,0.0,0.851,0.149,0.2732,2021-07-10 23:52:41
Oreal Mascara Review Inspire JCoulterJ Amazon Influencer Only via #DigitalMar,406,0.0,0.597,0.403,0.6597,2021-07-10 23:52:21
Willie The Bee Man Bee Removal Specialists #Google,52,0.0,1.0,0.0,0.0,2021-07-10 23:52:14
#googlepixel could get five years software support #google #software #marketing #website #webdevelopment #wo,8276,0.0,0.816,0.184,0.4019,2021-07-10 23:51:14
#Google Chrome Tricks You Might Not Know Here are awesome features google chrome tricks which will amaze,619,0.127,0.551,0.322,0.765,2021-07-10 23:48:58
Pre registration Achieved Over commandants finished pre registration this time Sincerely thanks for,6,0.0,0.647,0.353,0.7184,2021-07-10 23:47:11
was just thinking how would put maple syrup coffee started typing Google can you put and the first,251,0.0,1.0,0.0,0.0,2021-07-10 23:45:20
Google John Mueller explains that using too many internal links the same page can dilute their value and goes over wha,4028,0.0,0.893,0.107,0.34,2021-07-10 23:45:07
Oreal Mascara Review Inspire JCoulterJ Amazon Influencer Only via,5947,0.0,0.565,0.435,0.6597,2021-07-10 23:43:21
begins #stadia #google #googlestadia,100,0.0,1.0,0.0,0.0,2021-07-10 23:42:35
#KeywordResearch Keyword research practice search engine optimization professionals use find and research,91,0.0,0.809,0.191,0.3818,2021-07-10 23:41:48
#googlepixel could get five years software support #google #software #marketing #website #webdevelopment #wo,235,0.0,0.816,0.184,0.4019,2021-07-10 23:40:30
Pre Registration Coating The smooth design significantly reduces friction while the stealth but passionate cut,376,0.186,0.588,0.225,0.4215,2021-07-10 23:38:28
Pre registration Achieved Over commandants finished pre registration this time Sincerely thanks for,376,0.0,0.647,0.353,0.7184,2021-07-10 23:38:25
member Google Search Quality team said never seen search rankings impact from improving party authority scor,4028,0.0,0.657,0.343,0.7003,2021-07-10 23:38:13
#Facebook #Twitter #Google Threaten Quit Hong Kong Over Proposed Data Laws,788,0.206,0.794,0.0,-0.3818,2021-07-10 23:37:35
Pre registration Achieved Over commandants finished pre registration this time Sincerely thanks for,15,0.0,0.647,0.353,0.7184,2021-07-10 23:37:09
Calling all young Ghanaians July CET the Chapter Ghana hosting Workshop about the,1533,0.0,1.0,0.0,0.0,2021-07-10 23:35:48
begins #stadia #google #googlestadia,5,0.0,1.0,0.0,0.0,2021-07-10 23:32:14
#contentcreation Content Creation How Create Great Web Content #content,91,0.0,0.42,0.58,0.8074,2021-07-10 23:32:14
Check out this new photograph that uploaded #Horse #Woman,310,0.0,1.0,0.0,0.0,2021-07-10 23:30:42
Convert any image cartoon using python code #Python #MachineLearning #DataScience #javascript #AI #Google #game,985,0.0,1.0,0.0,0.0,2021-07-10 23:30:00
will your digital social media marketing content manager #Facebook #facebookmarketing #Google,26,0.0,1.0,0.0,0.0,2021-07-10 23:29:53
Pre registration Achieved Over commandants finished pre registration this time Sincerely thanks for,73,0.0,0.647,0.353,0.7184,2021-07-10 23:29:11
Convert any image cartoon using python code #Python #MachineLearning #DataScience #javascript #AI #Google #game,1513,0.0,1.0,0.0,0.0,2021-07-10 23:28:59
purchase property fast amp ANY condition #buyingproperty #philadelphia #RealEstate #Philly #Google #ll,73,0.0,1.0,0.0,0.0,2021-07-10 23:28:36
Convert any image cartoon using python code #Python #MachineLearning #DataScience #javascript #AI #Google #game,36378,0.0,1.0,0.0,0.0,2021-07-10 23:27:52
Convert any image cartoon using python code #Python #MachineLearning #DataScience #javascript #AI #Google #game,11650,0.0,1.0,0.0,0.0,2021-07-10 23:27:52
Convert any image cartoon using python code #Python #MachineLearning #DataScience #javascript #AI #Google #game,11650,0.0,1.0,0.0,0.0,2021-07-10 23:27:52
Convert any image cartoon using python code #Python #MachineLearning #DataScience #javascript #AI #Google #game,11650,0.0,1.0,0.0,0.0,2021-07-10 23:27:52
Convert any image cartoon using python code #Python #MachineLearning #DataScience #javascript #AI #Google #game,11650,0.0,1.0,0.0,0.0,2021-07-10 23:27:52
Convert any image cartoon using python code #Python #MachineLearning #DataScience #javascript #AI #Google #game,11650,0.0,1.0,0.0,0.0,2021-07-10 23:27:52
Convert any image cartoon using python code #Python #MachineLearning #DataScience #javascript #AI #Google #game,11650,0.0,1.0,0.0,0.0,2021-07-10 23:27:52
Convert any image cartoon using python code #Python #MachineLearning #DataScience #javascript #AI #Google #game,17597,0.0,1.0,0.0,0.0,2021-07-10 23:27:41
#Google feared #Samsung #Galaxy #store and tried quash #lawsuit alleges Competition app distribution,1002,0.211,0.789,0.0,-0.4939,2021-07-10 23:27:38
Convert any image cartoon using python code #Python #MachineLearning #DataScience #javascript #AI #Google #game,1842,0.0,1.0,0.0,0.0,2021-07-10 23:27:38
Convert any image cartoon using python code #Python #MachineLearning #DataScience #javascript #AI #Google #game,2817,0.0,1.0,0.0,0.0,2021-07-10 23:27:32
Convert any image cartoon using python code #Python #MachineLearning #DataScience #javascript #AI #Google #game,4818,0.0,1.0,0.0,0.0,2021-07-10 23:27:30
Convert any image cartoon using python code #Python #MachineLearning #DataScience #javascript #AI #Google #game,6714,0.0,1.0,0.0,0.0,2021-07-10 23:27:29
Convert any image cartoon using python code #Python #MachineLearning #DataScience #javascript #AI #Google #game,476,0.0,1.0,0.0,0.0,2021-07-10 23:27:25
SHIB doge btc eth feg bnb Ada xrp sol matic link usdt cake tel dot ksm trx vet,283,0.0,1.0,0.0,0.0,2021-07-10 23:27:05
SHIB doge btc eth feg bnb Ada xrp sol matic link usdt cake tel dot ksm,283,0.0,1.0,0.0,0.0,2021-07-10 23:26:08
Consider #Google platform #ecommercemarketing evolves #seo #ppc,14950,0.0,1.0,0.0,0.0,2021-07-10 23:23:32
