tweet,follower_count,neg,neu,pos,compound,time
MDH World SPICE CLICK below LINK LISTEN Successful,975,0.0,0.648,0.352,0.5859,2021-07-21 08:00:11
Visibly vibrates excitement #android #iphone #ios #samsungtag #smartphone #apple #tech #pro #technology,335,0.0,0.775,0.225,0.4939,2021-07-21 08:00:01
Local SEO for Small Business Rank Better Local Searches #Google loves local businesses Google always tries,130,0.0,0.68,0.32,0.765,2021-07-21 07:59:02
#infographic The Most Innovative Companies via #Apple #inn,292,0.0,0.687,0.313,0.4927,2021-07-21 07:57:39
#IvanKlass #Chilled #MUSIC #Amazon #AppleMusic #Spotify #MiamiToIbiza #Google WELCOME IVAN KLASS CHILLED AND,77,0.0,0.763,0.237,0.5766,2021-07-21 07:57:19
Ranking yourself high search engines one the best ways advertising online interactions start,1134,0.0,0.741,0.259,0.6369,2021-07-21 07:56:24
Eyeline Travel #Google,93,0.0,1.0,0.0,0.0,2021-07-21 07:53:26
How Setup Google Stadia Google Chromecast #Google #Stadia #Android Sideload Stadia APK using Pendriv,258,0.0,1.0,0.0,0.0,2021-07-21 07:52:33
#Biden chooses #google critic #jonathankanter for #DOJ #antitrust chief envision strong and meaningful antitrust engagement,823,0.097,0.507,0.396,0.7579,2021-07-21 07:50:17
#infographic The Most Innovative Companies via #Apple #inn,334,0.0,0.687,0.313,0.4927,2021-07-21 07:49:29
NEWS #Techdirt #Google Jumps Into The Game Revenue Split Wars With #Stadia,7404,0.247,0.753,0.0,-0.5574,2021-07-21 07:47:49
Index Both #Google Trends #Bitcoin and Fear amp Greed Index came down compare,4490,0.349,0.651,0.0,-0.7096,2021-07-21 07:45:37
Biden Name Critic Big Tech the Top Antitrust Cop #Biden #BidenAdministration #WashingtonD,428,0.151,0.719,0.129,-0.0772,2021-07-21 07:44:19
AMP Content Links Spread Outside Search Results SEO #Google #AMP,6409,0.0,1.0,0.0,0.0,2021-07-21 07:44:08
Muhammida Muhajir Guiding Shaping And Navigating The Influencer Marketing Landscape Africa Read the full,220,0.0,1.0,0.0,0.0,2021-07-21 07:43:28
Smartphone The Day July Which smartphone should select smartphone the day Vote Now Follow,3,0.0,1.0,0.0,0.0,2021-07-21 07:42:46
xaelbot Ways Improve Your DevTools Console Logging #DeepLearning #DataScience #AI #MachineLearning #IoT,1951,0.0,0.791,0.209,0.4404,2021-07-21 07:41:40
xaelbot Ways Improve Your DevTools Console Logging #DeepLearning #DataScience #AI #MachineLearning #IoT,2746,0.0,0.791,0.209,0.4404,2021-07-21 07:40:41
Check out Gig #Fiverr #google #scraping for #search results #business,183,0.0,1.0,0.0,0.0,2021-07-21 07:40:34
Google John Mueller affirms that dedicated web hosting does not have SEO advantage over shared hosting via,898,0.082,0.662,0.255,0.5661,2021-07-21 07:39:31
Google gives site owners seven tips for analyzing the main causes drops organic search traffic via,898,0.0,1.0,0.0,0.0,2021-07-21 07:39:30
Google John Mueller explains the factors that influence how many pages from site get crawled and why some,898,0.0,1.0,0.0,0.0,2021-07-21 07:39:28
Google John Mueller explains what looks like bug Search Console that reports indexed URLs crawled but not,898,0.0,0.901,0.099,0.1901,2021-07-21 07:39:26
Yay Cloud Security #cloud #cybersecurity #google #fortinet #cloudsecurity #infosec,1627,0.0,0.547,0.453,0.7003,2021-07-21 07:39:08
YouTube rolls out new tool tip creators Creators India #YouTube #Google,634,0.0,1.0,0.0,0.0,2021-07-21 07:38:06
think time for the #put impose dispose new role for #master basic station the worl,223,0.136,0.864,0.0,-0.296,2021-07-21 07:37:55
SHFDigital Our Daniel Bumby loves good IDC report and this blog post picks out,601,0.0,0.645,0.355,0.765,2021-07-21 07:37:46
#infographic The Most Innovative Companies via #Apple #inn,99,0.0,0.687,0.313,0.4927,2021-07-21 07:36:58
Thanks #Google for the #birthday,94,0.0,0.58,0.42,0.4404,2021-07-21 07:35:39
Queries the form allintext text are #useful enhancement your #Google skills,5998,0.0,1.0,0.0,0.0,2021-07-21 07:35:12
#BCG #brightcomgroup cmp times weeks from our reco Upper circuit continues,18,0.0,1.0,0.0,0.0,2021-07-21 07:34:42
YouTube Music for Android loses Offline Mixtape app shortcut #Google #Technology,1858,0.297,0.703,0.0,-0.4215,2021-07-21 07:34:03
Appy Wednesday folks enjoy this fantastic weather and have great day #Apps #Websites #Google,92,0.0,0.488,0.512,0.9109,2021-07-21 07:32:34
Google Wallpapers Gets New Exciting Wallpapers #Google #googlewallpapers Stargazing Milkshakes Frien,4,0.0,0.758,0.242,0.4939,2021-07-21 07:32:29
#BCG #brightcomgroup cmp times weeks from our reco Upper circuit continues,43,0.0,1.0,0.0,0.0,2021-07-21 07:32:20
#BCG #brightcomgroup cmp times weeks from our reco Upper circuit continues,323,0.0,1.0,0.0,0.0,2021-07-21 07:31:50
Portcullis Legals Wills Trusts Probate amp Power Attorney #Google,421,0.0,0.721,0.279,0.4767,2021-07-21 07:30:10
Ways Improve Your DevTools Console Logging #DeepLearning #DataScience #AI #MachineLearning #IoT #IIoT #Python #RStats,99,0.0,0.818,0.182,0.4404,2021-07-21 07:29:47
New #job GCP Data Engineer Remote Location London Salary #newjob #cloud #GCP #google,878,0.0,1.0,0.0,0.0,2021-07-21 07:29:46
#infographic The Most Innovative Companies via #Apple #inn,11353,0.0,0.687,0.313,0.4927,2021-07-21 07:29:39
Commands the form site topleveldomain are #useful addition your #Google skills Example type site,5998,0.0,1.0,0.0,0.0,2021-07-21 07:29:10
One Snowflake Article Day for Days Day #Google #bigquery Clash,5,0.0,1.0,0.0,0.0,2021-07-21 07:28:35
#Update Google Ads launching new pilot program test three strikes system for repeat,1365,0.172,0.828,0.0,-0.3612,2021-07-21 07:27:40
Ways Improve Your DevTools Console Logging #DeepLearning #DataScience #AI #MachineLearning #IoT #IIoT,99,0.0,0.791,0.209,0.4404,2021-07-21 07:27:31
Optimizing Your Content Become the Google Featured Snippet #Google,1365,0.0,0.727,0.273,0.4588,2021-07-21 07:27:28
Google Has New Way Quickly and Easily Delete Your Search History #Google #privacy via,998,0.0,0.844,0.156,0.34,2021-07-21 07:25:02
Commands the form inurl searchstring are #useful addition your #Google skills,1227,0.0,1.0,0.0,0.0,2021-07-21 07:24:57
#BCG #brightcomgroup cmp times weeks from our reco Upper circuit continue,2003,0.0,1.0,0.0,0.0,2021-07-21 07:24:20
xaelbot Ways Improve Your DevTools Console Logging #DeepLearning #DataScience #AI #MachineLearning #IoT,99,0.0,0.791,0.209,0.4404,2021-07-21 07:24:09
Commands the form inurl searchstring are #useful addition your #Google skills,5998,0.0,1.0,0.0,0.0,2021-07-21 07:22:58
#Verizon partners with #Google offer robust messaging experience Android users,92844,0.0,0.789,0.211,0.34,2021-07-21 07:22:22
The latest Play Store update allows downloading Wear apps directly from phone,1568,0.0,0.821,0.179,0.34,2021-07-21 07:21:43
#Google #Support #African #Entrepreneurs With Two New Programs #tech #smallbusinesssupport #digital,5197,0.0,1.0,0.0,0.0,2021-07-21 07:21:17
Biden Name Critic Big Tech the Top Antitrust Cop #Biden #BidenAdministration,4128,0.163,0.698,0.14,-0.0772,2021-07-21 07:19:47
WASTiNNOVA #Google,95,0.0,1.0,0.0,0.0,2021-07-21 07:19:47
#infographic The Most Innovative Companies via #Apple #inn,1647,0.0,0.687,0.313,0.4927,2021-07-21 07:19:10
Google trying cheat people Sekhar master still alive with Then how Google decided that was died,13,0.297,0.586,0.117,-0.6124,2021-07-21 07:18:58
#infographic The Most Innovative Companies via #Apple #inn,8498,0.0,0.687,0.313,0.4927,2021-07-21 07:18:41
Google John Mueller affirms that dedicated web hosting does not have SEO advantage over shared hosting via,4026,0.082,0.662,0.255,0.5661,2021-07-21 07:18:03
xaelbot Ways Improve Your DevTools Console Logging #DeepLearning #DataScience #AI,98,0.0,0.756,0.244,0.4404,2021-07-21 07:17:41
and Limousine Services Inc Long Island Limo Service NYC Limo Service JFK Airport Transportation #Google,407,0.0,1.0,0.0,0.0,2021-07-21 07:16:19
Ways Improve Your DevTools Console Logging #DeepLearning #DataScience #AI #MachineLearning,12153,0.0,0.756,0.244,0.4404,2021-07-21 07:13:11
Google Factor Protects your Brand Reputation Expertise Authoritativeness trustworthiness helps you manage,189,0.0,0.539,0.461,0.7717,2021-07-21 07:12:47
Ways Improve Your DevTools Console Logging #DeepLearning #DataScience #AI #MachineLearning #IoT #IIoT #Python #RStats,250,0.0,0.818,0.182,0.4404,2021-07-21 07:10:41
Ways Improve Your DevTools Console Logging #DeepLearning #DataScience #AI #MachineLearning #IoT #IIoT #Python #RStats,4892,0.0,0.818,0.182,0.4404,2021-07-21 07:10:31
Ways Improve Your DevTools Console Logging #DeepLearning #DataScience #AI #MachineLearning #IoT #IIoT #Python #RStats,2746,0.0,0.818,0.182,0.4404,2021-07-21 07:10:25
Our PPC management service will provide measurable results amp goes well with the other marketing channels visit,1239,0.0,0.884,0.116,0.2732,2021-07-21 07:10:00
#infographic The Most Innovative Companies via #Apple #inn,83916,0.0,0.687,0.313,0.4927,2021-07-21 07:08:17
#infographic The Most Innovative Companies via #Apple #inn,28358,0.0,0.687,0.313,0.4927,2021-07-21 07:08:16
NEWS #TorrentFreak #copyright #copyrights #Google Delisted Hundreds Thousands URLs Comply with Russ,7404,0.0,1.0,0.0,0.0,2021-07-21 07:07:43
Daniel Waisberg Search Advocate #Google described and illustrated what various types organic search traff,123,0.0,1.0,0.0,0.0,2021-07-21 07:07:04
approaching the point where digital marketing longer idea but list,2694,0.0,1.0,0.0,0.0,2021-07-21 07:06:49
Ways Improve Your DevTools Console Logging #DeepLearning #DataScience #AI #MachineLearning #IoT #IIoT #Python #RStats,85,0.0,0.818,0.182,0.4404,2021-07-21 07:06:44
#infographic The Most Innovative Companies via #Apple #inn,3397,0.0,0.687,0.313,0.4927,2021-07-21 07:05:48
Voice Search Local Businesses Make Perfect Match #voice #search high exigency #tool for #Google search,212,0.0,0.791,0.209,0.5719,2021-07-21 07:05:32
Smartphone The Day July Which smartphone should select smartphone the day Vote Now Follow,42,0.0,1.0,0.0,0.0,2021-07-21 07:05:17
#Google owned #YouTube rolling out new tool Super Thanks that will let users tip their favourite creators,316,0.0,0.688,0.312,0.7783,2021-07-21 07:05:07
Smartphone The Day July Which smartphone should select smartphone the day Vote Now Follow,317,0.0,1.0,0.0,0.0,2021-07-21 07:04:52
Bark Busters Home Dog Training Phoenix #Google,156,0.0,1.0,0.0,0.0,2021-07-21 07:04:39
DREAM LINE COMPUTERS #Google,45,0.0,0.523,0.477,0.4084,2021-07-21 07:04:34
#infographic The Most Innovative Companies via #Apple #inn,4217,0.0,0.687,0.313,0.4927,2021-07-21 07:04:17
Smartphone The Day July Which smartphone should select smartphone the day Vote Now Follow,22,0.0,1.0,0.0,0.0,2021-07-21 07:03:29
Smartphone The Day July Which smartphone should select smartphone the day Vote Now Follow,22,0.0,1.0,0.0,0.0,2021-07-21 07:03:21
Software Design Skills design done properly then absolutely NOT MUCH left for programming #softwaredesign,1951,0.0,1.0,0.0,0.0,2021-07-21 07:02:38
Software Design Skills design done properly then absolutely NOT MUCH left for programming #softwaredesign,760,0.0,1.0,0.0,0.0,2021-07-21 07:02:37
With that move #Verizon would join peers amp Inc and Mobile Inc propping competition Apple Inc iMessage serv,250,0.0,0.885,0.115,0.296,2021-07-21 07:02:35
Software Design Skills design done properly then absolutely NOT MUCH left for programming #softwaredesign,533,0.0,1.0,0.0,0.0,2021-07-21 07:02:00
Software Design Skills design done properly then absolutely NOT MUCH left for programming #softwaredesign,4315,0.0,1.0,0.0,0.0,2021-07-21 07:01:52
Software Design Skills design done properly then absolutely NOT MUCH left for programming,23,0.0,1.0,0.0,0.0,2021-07-21 07:01:51
#Google #darkmode iOS #safari,604,0.0,1.0,0.0,0.0,2021-07-21 07:00:43
#Google owned #YouTube rolling out new tool Super Thanks that will let users tip their favourite,66562,0.0,0.673,0.327,0.7783,2021-07-21 06:59:48
#Google has also released the latest security bulletin that details vulnerabilities affecting #Android devices,36495,0.1,0.75,0.15,0.2023,2021-07-21 06:58:09
Google John Mueller explains the factors that influence how many pages from site get crawled and why some pages are,50,0.0,1.0,0.0,0.0,2021-07-21 06:58:04
#Google has also released the latest security bulletin that details vulnerabilities affecting #Android devices,18019,0.1,0.75,0.15,0.2023,2021-07-21 06:57:48
Top GOOGLE APPS you should definitely try out #Google #googleindia #Android #googleapps #playstore #kormojobs #photos,4,0.0,0.743,0.257,0.5423,2021-07-21 06:57:13
Top GOOGLE APPS you should definitely try out #Google #googleindia #Android #googleapps #playstore #kormojobs,22,0.0,0.727,0.273,0.5423,2021-07-21 06:56:49
amazing definition SEO SEO something for doing website code make Google and other search engines,10788,0.0,0.787,0.213,0.5859,2021-07-21 06:55:48
YouTube CEO Awarded Herself the Free Expression Award #freespeech #google #youtube #truth #bloggerstribe,965,0.0,0.513,0.487,0.8591,2021-07-21 06:54:39
you build you may still need Google AdWords Jennifer Mesenbrink #google #adwords #marketing #advertising,8436,0.0,1.0,0.0,0.0,2021-07-21 06:54:36
#GodofAbraham #Jesus #Twitter #Pinterest #Google #Facebook #GooglePlus #Instagram #socialmedia #NP #sn,341,0.0,1.0,0.0,0.0,2021-07-21 06:54:17
#Google has also released the latest security bulletin that details vulnerabilities affecting #Android devices,577,0.1,0.75,0.15,0.2023,2021-07-21 06:53:55
Real name Google Follow YouTube Ecceducation Instagram Ecceducatio,7,0.0,1.0,0.0,0.0,2021-07-21 06:52:29
Real name Google Follow YouTube Ecceducation Instagram Ecceducatio,7,0.0,1.0,0.0,0.0,2021-07-21 06:51:29
Sir Thank You for making these multinational profit making social media firms,2181,0.0,0.649,0.351,0.6597,2021-07-21 06:50:08
Check out paidmarketer will increase sales #shopify website #Google #AdWords #Fiverr adwords fiverr #ppc,977,0.0,0.85,0.15,0.3182,2021-07-21 06:48:44
#GodofAbraham #Jesus #Twitter #Pinterest #Google #Facebook #GooglePlus #Instagram #socialmedia #NP #sn,2250,0.0,1.0,0.0,0.0,2021-07-21 06:47:56
#GodofAbraham #Jesus #Twitter #Pinterest #Google #Facebook #GooglePlus #Instagram #socialmedia,341,0.0,1.0,0.0,0.0,2021-07-21 06:47:24
Ivano Casa Shop Online #Google,11,0.0,1.0,0.0,0.0,2021-07-21 06:47:06
Comment your answer below Don search #Google you want explore the journey #DataAnalyst and learn how,360,0.0,0.92,0.08,0.0772,2021-07-21 06:46:46
Google new update for the current wear #technology #tech #innovation #technews #gadgets #smartphone,8,0.0,1.0,0.0,0.0,2021-07-21 06:46:08
Study Ukraine without IELTS Ukraine study visa consultants jalandhar Call Now #google,258,0.0,1.0,0.0,0.0,2021-07-21 06:45:59
you build you may still need Google AdWords Jennifer Mesenbrink #google #adwords #marketing,6,0.0,1.0,0.0,0.0,2021-07-21 06:45:56
Was Google Looking For Coronavirus #COVID #virus #research #WuhanLabLeak,965,0.0,1.0,0.0,0.0,2021-07-21 06:45:46
Awesome day Received the cool gift the morning Thanks #JetpackCompose #AndroidDev #Google #KotlinBasics #androidstudio,1150,0.0,0.45,0.55,0.9042,2021-07-21 06:45:13
Did you know June Google rolled out new satellite imagery worldwide sourced from Landsat,32,0.0,1.0,0.0,0.0,2021-07-21 06:44:22
Awesome day Received the cool gift the morning Thanks #JetpackCompose #AndroidDev #Google #KotlinBasics,26,0.0,0.425,0.575,0.9042,2021-07-21 06:44:05
Ways Improve Your DevTools Console Logging #DeepLearning #DataScience #AI #MachineLearning #IoT #IIoT #Python #RStats,1612,0.0,0.818,0.182,0.4404,2021-07-21 06:43:59
What #Pegasus Explained #JPG Source #snooping #spyware #android #whatsapp #Parliament #Google #DataScienc,1333,0.0,1.0,0.0,0.0,2021-07-21 06:43:16
Riva night #travelgram #travel #trip #trentino #igerstrentino #android #nofilter #google #pixel #igersitalia,159,0.0,1.0,0.0,0.0,2021-07-21 06:41:06
wonder why #Google removed the flash icon the search results for #Accelerated Mobile Pages this,695,0.0,1.0,0.0,0.0,2021-07-21 06:40:36
Full Feast #Google #itsmerrynadetime,11,0.0,1.0,0.0,0.0,2021-07-21 06:40:08
Riva night #trip #trentino #garda #gardalake #lagodigarda #night #nofilter #android #google #travel,159,0.0,1.0,0.0,0.0,2021-07-21 06:38:19
for your construction engineering amp real estate development needs pls contact CDO HOME BUILDERS amp Development Corp,1034,0.0,0.925,0.075,0.0772,2021-07-21 06:38:06
Google Chrome out with security fixes #googlechrome #security #Google,6583,0.0,0.769,0.231,0.34,2021-07-21 06:37:41
Ways Improve Your DevTools Console Logging #DeepLearning #DataScience #AI #MachineLearning #IoT #IIoT #Python #RStats,4315,0.0,0.818,0.182,0.4404,2021-07-21 06:37:30
With that move #Verizon would join peers amp Inc and Mobile Inc propping competition Apple Inc iMessage serv,145,0.0,0.885,0.115,0.296,2021-07-21 06:37:03
#Google Clouds zero trust offerings help government organizations guard against cyberthreats #Sec Cyber,13558,0.0,0.647,0.353,0.7184,2021-07-21 06:36:11
With that move #Verizon would join peers amp Inc and Mobile Inc propping competition Apple Inc,2118529,0.0,0.872,0.128,0.296,2021-07-21 06:35:00
Top Google Executive Says Machine Learning Can Never Replace Search Engine Optimization #google #SEO,205,0.0,0.732,0.268,0.5267,2021-07-21 06:33:08
you want higher rank for your websites and promote your business online Google Oakville PushFire,88,0.0,0.769,0.231,0.4404,2021-07-21 06:32:48
Google John Mueller affirms that dedicated web hosting does not have SEO advantage over shared hosting via,298,0.082,0.662,0.255,0.5661,2021-07-21 06:31:54
Foreign used Mercedes Benz CLA Low mileage #adamugarba #Crowwe #Spain #SOLANA #Africa #East #Ron,2454,0.139,0.861,0.0,-0.2732,2021-07-21 06:31:16
Google Has New Way Quickly and Easily Delete Your Search History #Google #privacy via,3838,0.0,0.844,0.156,0.34,2021-07-21 06:31:03
#Google Replacing Android APK with AAB,301,0.0,1.0,0.0,0.0,2021-07-21 06:30:57
Multipack Plastic Industries #Google,44,0.0,1.0,0.0,0.0,2021-07-21 06:30:37
Pressure Big Tech builds Biden picks another critic for key Justice post #JonathanKanter #AppleInc,587,0.23,0.588,0.182,0.0258,2021-07-21 06:30:18
Foreign used Mercedes Benz matic Accident free #Africa #Africans #Nigerians #stephen #Olympi,2454,0.189,0.61,0.201,0.0516,2021-07-21 06:29:41
Many thanks our great guests Dan Mayer ratet with awesome #Google,17964,0.0,0.419,0.581,0.9022,2021-07-21 06:29:08
Did you know Follow Retweet #Python #javascript #Coding #Java #DataScience #Linux #MachineLearning #cloud Days,13231,0.0,1.0,0.0,0.0,2021-07-21 06:29:04
Did you know Follow Retweet #Python #javascript #Coding #Java #DataScience #Linux #MachineLearning #cloud Days,5792,0.0,1.0,0.0,0.0,2021-07-21 06:28:59
Google shutting down Google Bookmarks Here are alternatives #google #bookmarks #googlegraveyard,1050,0.0,1.0,0.0,0.0,2021-07-21 06:27:44
Pie Multilingual Services #Google,694,0.0,1.0,0.0,0.0,2021-07-21 06:27:15
#GoogleMeet has limited group video calls for free #Gmail accounts minutes according its support page,1326,0.095,0.603,0.302,0.6249,2021-07-21 06:26:46
Google John Mueller affirms that dedicated web hosting does not have SEO advantage over shared hosting via,50,0.082,0.662,0.255,0.5661,2021-07-21 06:26:04
Did you know Follow Retweet #Python #javascript #Coding #Java #DataScience #Linux #MachineLearning #cloud Days,1430,0.0,1.0,0.0,0.0,2021-07-21 06:25:45
Android BETA #Android #Google,3,0.0,1.0,0.0,0.0,2021-07-21 06:25:39
Did you know Follow Retweet #Python #javascript #Coding #Java #DataScience #Linux #MachineLearning #cloud Days,2863,0.0,1.0,0.0,0.0,2021-07-21 06:25:36
Comment your answer below Don search #Google you want explore the journey #DataAnalyst and learn how,7835,0.0,0.92,0.08,0.0772,2021-07-21 06:25:04
Google has new way optimize videos for search results when they published creator own website rather than You,101,0.0,0.842,0.158,0.4939,2021-07-21 06:24:44
this isn the smoothest motion the Then really dont know #Android #google,204,0.0,1.0,0.0,0.0,2021-07-21 06:24:35
Did you know Follow Retweet #Python #javascript #Coding #Java #DataScience #Linux #MachineLearning #cloud Days,7049,0.0,1.0,0.0,0.0,2021-07-21 06:24:31
Did you know Follow Retweet #Python #javascript #Coding #Java #DataScience #Linux #MachineLearning #cloud Days,1612,0.0,1.0,0.0,0.0,2021-07-21 06:23:59
#infographic The Most Innovative Companies via #Apple #inn,1612,0.0,0.687,0.313,0.4927,2021-07-21 06:23:56
#infographic The Most Innovative Companies via #Apple #inn,453,0.0,0.687,0.313,0.4927,2021-07-21 06:23:06
Google John Mueller explains what looks like bug Search Console that reports indexed URLs crawled but not indexed,237,0.0,0.907,0.093,0.1901,2021-07-21 06:22:08
Did you know that Google bought Fitbit Could release Pixel watch the future #Google #FitBit #NewGadgetsOnYourWrist,716,0.0,1.0,0.0,0.0,2021-07-21 06:20:41
Did you know Follow Retweet #Python #javascript #Coding #Java #DataScience #Linux #MachineLearning #cloud Days,533,0.0,1.0,0.0,0.0,2021-07-21 06:20:39
Did you know Follow Retweet #Python #javascript #Coding #Java #DataScience #Linux #MachineLearning #cloud Days,1411,0.0,1.0,0.0,0.0,2021-07-21 06:20:34
#Google rolling out new privacy features Chrome browser that will help Android users keep track,50,0.0,0.838,0.162,0.4019,2021-07-21 06:20:33
Tim Berners Lee defends auction NFT representing web source code Creator the world wide web says digital asset,19,0.0,0.872,0.128,0.3612,2021-07-21 06:20:04
Key Outcomes yesterday Before deciding how move forward must first decide what stop doing and mus,27435,0.128,0.872,0.0,-0.296,2021-07-21 06:19:48
Unlike crazy daddy #Apple #Google #Luxembourg wants favor #homebasedwork However #Tax playing the,1148,0.142,0.592,0.266,0.2732,2021-07-21 06:19:07
Korea closer banning Google app billing system #Google #AppleTH,169,0.0,1.0,0.0,0.0,2021-07-21 06:18:56
Comment your answer below Don search #Google you want explore the journey #DataAnalyst and lear,475,0.0,0.915,0.085,0.0772,2021-07-21 06:16:10
reddcoin turns December and buy reddcoin fast really share this #BitcoinComExchange #RDD #BTC,282,0.0,0.828,0.172,0.3597,2021-07-21 06:16:09
Ways Improve Your DevTools Console Logging #DeepLearning #DataScience #AI #MachineLearning #IoT #IIoT #Python #RStats,1430,0.0,0.818,0.182,0.4404,2021-07-21 06:15:45
Ways Improve Your DevTools Console Logging #DeepLearning #DataScience #AI #MachineLearning #IoT #IIoT #Python #RStats,21658,0.0,0.818,0.182,0.4404,2021-07-21 06:15:28
Ways Improve Your DevTools Console Logging #DeepLearning #DataScience #AI #MachineLearning #IoT #IIoT #Python #RStats,1790,0.0,0.818,0.182,0.4404,2021-07-21 06:15:28
Ways Improve Your DevTools Console Logging #DeepLearning #DataScience #AI #MachineLearning #IoT #IIoT,1178,0.0,0.791,0.209,0.4404,2021-07-21 06:15:23
According cofounder Wojciech Zaremba the company recently disbanded its #robotics team deploy robot,338,0.0,1.0,0.0,0.0,2021-07-21 06:15:17
Check out our #Google page and add get daily event updates and #festival reviews,863,0.0,1.0,0.0,0.0,2021-07-21 06:14:07
Netpremacy wins Google Cloud Specialization Partner the Year #Biz,27446,0.0,0.684,0.316,0.5719,2021-07-21 06:13:28
Netpremacy wins Google Cloud Specialization Partner the Year #Biz,15961,0.0,0.684,0.316,0.5719,2021-07-21 06:13:23
Netpremacy wins Google Cloud Specialization Partner the Year,28117,0.0,0.654,0.346,0.5719,2021-07-21 06:13:11
Should Voice Search Part Your #SEOstrategy According #Google online search will conducted using #Voi,1011,0.0,1.0,0.0,0.0,2021-07-21 06:11:41
With technology like #Pegasus the cat out the bag Once people especially governments see power they,445,0.0,0.857,0.143,0.3612,2021-07-21 06:10:15
Google offers easy access individual site permission chrome #google #googlechrome #chrome,7040,0.0,0.775,0.225,0.4404,2021-07-21 06:10:02
Google Cloud announces security tools for Government Read More GOOGL GOOG #Google #Cloud #secur,12291,0.0,0.844,0.156,0.34,2021-07-21 06:05:45
Google Categorizes What Organic Search Traffic Drops Look Like #seo #organicseo #Google,312,0.0,0.815,0.185,0.3612,2021-07-21 06:04:44
Did you know that Google bought Fitbit Could release Pixel watch the future #Google #FitBit,160,0.0,1.0,0.0,0.0,2021-07-21 06:04:06
new video uploaded hogi unboxing and review dekhna bulna #Mi Ultra #GalaxyS #Microso,214,0.0,1.0,0.0,0.0,2021-07-21 06:03:46
new video uploaded hogi unboxing and review dekhna bulna #Mi Ultra #GalaxyS #Microso,2934,0.0,1.0,0.0,0.0,2021-07-21 06:03:40
new video uploaded hogi unboxing and review dekhna bulna #Mi Ultra #GalaxyS #Microso,3894,0.0,1.0,0.0,0.0,2021-07-21 06:03:17
#Formatting Service ebook Paperback will provide you with digital files for #Kindle #Apple #Nook #Kobo and,33016,0.0,1.0,0.0,0.0,2021-07-21 06:03:04
#Google rolling out new privacy features Chrome browser that will help Android users keep track,66562,0.0,0.838,0.162,0.4019,2021-07-21 06:03:01
#NSOGroup Pegasus aKa #JioApp #Google #Facebook seriously wonder being,530,0.175,0.825,0.0,-0.1779,2021-07-21 06:01:48
Google Question Hub with New Look and More features Learn More #QuestionHub #Google #Que,11,0.0,1.0,0.0,0.0,2021-07-21 06:01:44
#infographic The Most Innovative Companies via #Apple #inn,1567,0.0,0.687,0.313,0.4927,2021-07-21 06:01:25
Top #AdWords amp #PPC Top Tips Build #Revenue Generating Machine all The Time #Keywords Research #Ad #copywriting #co,67,0.0,0.816,0.184,0.3818,2021-07-21 06:00:58
Google gives site owners seven tips for analyzing the main causes drops organic search traffic via,1111,0.0,1.0,0.0,0.0,2021-07-21 06:00:27
How Successful Using Google Ads This Year and Beyond #Marketing,4466,0.0,0.703,0.297,0.5859,2021-07-21 06:00:17
#infographic The Most Innovative Companies via #Apple #inn,4551,0.0,0.687,0.313,0.4927,2021-07-21 06:00:15
#infographic The Most Innovative Companies via #Apple #inn,24997,0.0,0.687,0.313,0.4927,2021-07-21 05:59:37
Chrome allows users manage their permissions websites #google,901,0.0,1.0,0.0,0.0,2021-07-21 05:58:25
you know that you probably already use every single day #ai #artificialintelligence #google,1490,0.0,1.0,0.0,0.0,2021-07-21 05:58:23
