tweet,follower_count,neg,neu,pos,compound,time
#Google hypocritical remote work policies anger #employees #TechJunkieNews #career,28586,0.489,0.511,0.0,-0.7717,2021-07-11 12:07:03
One the many issues one finds while managing websites duplicate content issues this guide you will find,81,0.0,1.0,0.0,0.0,2021-07-11 12:06:00
Pre registration Achieved Over commandants finished pre registration this time Sincerely thanks for,0,0.0,0.647,0.353,0.7184,2021-07-11 12:03:44
Pre Registration Coating The smooth design significantly reduces friction while the stealth but passionate cut,0,0.186,0.588,0.225,0.4215,2021-07-11 12:02:47
OUT NOW EBOOK #GirlsWhoLie Cribb,3301,0.0,1.0,0.0,0.0,2021-07-11 12:02:19
With the flexibility tablet and convenience smart display one Lenovo Smart Tab now sale,28,0.0,0.585,0.415,0.7783,2021-07-11 12:00:51
begins #stadia #google #googlestadia,692,0.0,1.0,0.0,0.0,2021-07-11 12:00:39
OUT NOW EBOOK #GirlsWhoLie Cribb,24287,0.0,1.0,0.0,0.0,2021-07-11 12:00:25
not too late prepare for the Google Page Experience update even rolling out Learn how get the,236836,0.0,1.0,0.0,0.0,2021-07-11 12:00:20
Foods that help avoid overcome depression amp anxiety #sundayvibes #SundayThoughts,54,0.466,0.368,0.166,-0.5994,2021-07-11 12:00:11
post special Did you know the difference Let know #technology #apple #tecnologia #innovation #webdesign #eng,4161,0.0,0.838,0.162,0.4019,2021-07-11 11:57:32
post special Did you know the difference Let know #technology #apple #tecnologia #innovation #webdesign,52,0.0,0.828,0.172,0.4019,2021-07-11 11:57:08
Pre Registration Coating The smooth design significantly reduces friction while the stealth but passionate cut,0,0.186,0.588,0.225,0.4215,2021-07-11 11:57:02
NEW SINGLE MONEY THE FLOOR all streaming platforms #Spotify #NewMusic #PermissionToDanceIsComing #Mets #NCT,178,0.0,1.0,0.0,0.0,2021-07-11 11:56:23
This Tool Shows How Google Changes Its Search Results Around the World #ai #ArtificialIntelligen,3570,0.0,1.0,0.0,0.0,2021-07-11 11:56:13
Easy Branches #Google,983,0.0,0.408,0.592,0.4404,2021-07-11 11:55:41
are happy announce that TOQA MUHAMMAD will our Arabic speaker for TensorFlow What are you waiting for,99,0.0,0.812,0.188,0.5719,2021-07-11 11:55:33
Even #Google Chacha anxious for the final #footballscominghome Insha Allah,72,0.182,0.818,0.0,-0.25,2021-07-11 11:55:28
problems technology AOL suddenly says password incorrect Another weird place where would never put,254,0.268,0.732,0.0,-0.5267,2021-07-11 11:54:14
#usher #crowder #june coup #google #ethan New Girls White Summer Bohemian Mini Dress Women Fashion Spring Solid,2,0.0,0.909,0.091,0.1531,2021-07-11 11:54:07
begins #stadia #google #googlestadia,77,0.0,1.0,0.0,0.0,2021-07-11 11:52:57
Would you like gain more conversions for much lower digital marketing spend You come the right place,23,0.1,0.633,0.267,0.5719,2021-07-11 11:52:41
Nathan Web Solution #Google,75,0.0,0.566,0.434,0.3182,2021-07-11 11:51:22
Does your business need boost Check out our #GoogleAds #training courses #Google #training,1787,0.0,0.816,0.184,0.4019,2021-07-11 11:50:35
Super Placement Services Placement Consultants Greater Noida Ghaziabad India #Google,370,0.0,0.556,0.444,0.7506,2021-07-11 11:49:50
looking for Sunday #longread Interested #ethical #AI This month #Wired has cover how #Google forced,526,0.16,0.695,0.144,-0.0772,2021-07-11 11:47:15
Stop lining the pockets the rich with with the hard earnings the working class sWomen #miners,246,0.178,0.644,0.178,0.25,2021-07-11 11:46:53
#Toshiba Inch Smart Ultra LED with Freeview Play Model Black Energy Clas,685,0.0,0.556,0.444,0.7351,2021-07-11 11:46:12
Google Announces New Audience Solutions for AdWords SEO #Google,7076,0.0,0.825,0.175,0.1779,2021-07-11 11:45:03
Just look that outstanding #usher #crowder #june coup #google #ethan,2,0.0,0.692,0.308,0.6124,2021-07-11 11:43:42
Pre registration Achieved Over commandants finished pre registration this time Sincerely thanks for,0,0.0,0.647,0.353,0.7184,2021-07-11 11:43:04
American citizens demand this same type justice for,380,0.138,0.55,0.312,0.4404,2021-07-11 11:43:00
This Tool Shows How Google Changes Its Search Results Around the World #ai #ArtificialIntelligen,736,0.0,1.0,0.0,0.0,2021-07-11 11:42:15
Google stopped #PerconaLive provide users with tips and tricks how run their #databases better the,374,0.186,0.656,0.158,0.128,2021-07-11 11:40:33
excited announce that second #GoogleCloud region built for India here Meet #Google leaders customers,131,0.0,0.844,0.156,0.34,2021-07-11 11:40:19
begins #stadia #google #googlestadia,42,0.0,1.0,0.0,0.0,2021-07-11 11:38:55
More information Archiving Google Classrooms Archive Your Google Classroom Classes #Classroom #Go,505,0.0,1.0,0.0,0.0,2021-07-11 11:36:35
Google testing showing the domain name the search result snippet instead the full URL,258,0.0,1.0,0.0,0.0,2021-07-11 11:36:17
Traffic Crushing #Google #Penalties and How #Prevent Them,11227,0.263,0.737,0.0,-0.3612,2021-07-11 11:35:39
Takeaway Lanzarote #Google,38,0.0,1.0,0.0,0.0,2021-07-11 11:34:27
Prepare yourself for the Airdrop SHIB doge btc eth feg bnb Ada xrp sol matic link usdt cake tel dot,57,0.0,1.0,0.0,0.0,2021-07-11 11:34:22
From #Google executive who opposed work from home about just that #India handing over holy relic #Georgia,12,0.0,1.0,0.0,0.0,2021-07-11 11:34:05
#AlanDershowitz #DonaldTrump #lawsuits against #Facebook #Google and #Twitter are very very important for the,1020,0.0,0.846,0.154,0.3338,2021-07-11 11:34:01
continue appreciating all our esteemed customers who continue supporting and urge the contin,43,0.0,0.535,0.465,0.8271,2021-07-11 11:33:40
#AlanDershowitz #DonaldTrump #lawsuits against #Facebook #Google and #Twitter are very very important,51,0.0,0.823,0.177,0.3338,2021-07-11 11:33:10
From #Google executive who opposed work from home about just that #India handing over holy relic #Georgia,43,0.0,1.0,0.0,0.0,2021-07-11 11:33:06
Stop lining the pockets the rich with with the hard earnings the working class sWomen #miners,596,0.178,0.644,0.178,0.25,2021-07-11 11:31:32
Important High Tech SEO Trends Know For #SEO #Google #SearchEngineOptimization,1117,0.0,0.833,0.167,0.2023,2021-07-11 11:31:01
Banned #Google Learn what next #webmaster #search #SEO,351,0.3,0.7,0.0,-0.4588,2021-07-11 11:30:46
The broom was late for our meeting today said over swept that morning #Google jokes,391,0.0,0.875,0.125,0.25,2021-07-11 11:30:35
Received grievances actioned URLs May Jun Twitter compliance report #Twitter #YouTube #WhatsApp,582,0.185,0.815,0.0,-0.3612,2021-07-11 11:30:07
Received grievances actioned URLs May Jun Twitter compliance report #Twitter #YouTube #WhatsApp,37270,0.185,0.815,0.0,-0.3612,2021-07-11 11:30:05
Lighthouse Page Speed Results for Search Engine Land What SEO #Google #SEO,2424,0.0,1.0,0.0,0.0,2021-07-11 11:30:03
excited announce that second #GoogleCloud region built for India here Meet #Google leaders custom,131225,0.0,0.844,0.156,0.34,2021-07-11 11:30:01
The FTC reportedly investigating Amazon purchase MGM Amazon buyout,27,0.0,0.673,0.327,0.34,2021-07-11 11:28:12
Was Google Looking For Coronavirus #COVID #virus #research #wuhanlab #funding #Go,956,0.0,1.0,0.0,0.0,2021-07-11 11:28:11
With new innovations Search Google can get you even closer what you looking for Click find out more #Google,90,0.0,1.0,0.0,0.0,2021-07-11 11:27:44
From #Google executive who opposed work from home about just that #India handing over holy relic,350514,0.0,1.0,0.0,0.0,2021-07-11 11:27:36
AAAAWW that precious #android #iphone #ios #samsungtag #smartphone #apple #tech #pro #technology #mobile #oneplus,2195,0.0,0.778,0.222,0.5719,2021-07-11 11:24:48
#Google translate not getting the complexities the #Gaelic negative interrogative,44852,0.291,0.709,0.0,-0.5719,2021-07-11 11:23:56
AAAAWW that precious #android #iphone #ios #samsungtag #smartphone #apple #tech #pro #technology #mobile #oneplus,235,0.0,0.778,0.222,0.5719,2021-07-11 11:22:59
#usher #crowder #june coup #google #ethan Baby Safety Corner Protector Children Protection Furniture Corners,2,0.0,0.823,0.177,0.4215,2021-07-11 11:22:53
#youtube #twitter #google worked with governments censor and cancel the called Conspiracy Theorists Good,5567,0.394,0.469,0.136,-0.6705,2021-07-11 11:22:29
Dyspraxia also known developmental ordination disorder DCD common disorder that affects movement,6479,0.351,0.649,0.0,-0.6597,2021-07-11 11:21:59
SERP Rankings Here how #google,2577,0.0,1.0,0.0,0.0,2021-07-11 11:20:45
Google Supermodel DeepMind Perceiver step the road machine that could process anything and everything,281,0.0,1.0,0.0,0.0,2021-07-11 11:19:52
Google Supermodel DeepMind Perceiver step the road machine that could process anything and everything,3747,0.0,1.0,0.0,0.0,2021-07-11 11:19:52
#GoogleAnalytics #RT Read get subj grasp site Need #traffic for page #Google,2905,0.0,1.0,0.0,0.0,2021-07-11 11:19:01
addition PSBDMP recommend using own #Google Custom Search Engines kit search email logins and password,653,0.0,0.848,0.152,0.3612,2021-07-11 11:17:55
PROPERTIES RYCE #Google,1557,0.0,1.0,0.0,0.0,2021-07-11 11:17:05
Social media the greatest tool for digital marketing cap #Google #Dstv #WhatsApp #Nigeria,234,0.0,0.741,0.259,0.6369,2021-07-11 11:16:25
Google Supermodel DeepMind Perceiver step the road machine that could process anything and everything,1547,0.0,1.0,0.0,0.0,2021-07-11 11:16:23
#LinkBuilding the most important process boost your website #Google #SEOeStore,287,0.0,0.613,0.387,0.6195,2021-07-11 11:15:50
Google Supermodel DeepMind Perceiver step the road machine that could process anything and everything,3208,0.0,1.0,0.0,0.0,2021-07-11 11:13:07
Google Supermodel DeepMind Perceiver step the road machine that could process anything and everything,1113,0.0,1.0,0.0,0.0,2021-07-11 11:13:00
SHIB doge btc eth feg bnb Ada xrp sol matic link usdt cake tel dot ksm trx vet,283,0.0,1.0,0.0,0.0,2021-07-11 11:11:08
Dyspraxia also known developmental ordination disorder DCD common disorder that affects movement,6479,0.351,0.649,0.0,-0.6597,2021-07-11 11:10:36
Google Supermodel DeepMind Perceiver step the road machine that could process anything and everything,2962,0.0,1.0,0.0,0.0,2021-07-11 11:10:14
Important High Tech SEO Trends Know For #SEO #Google #SearchEngineOptimization #Ranking,7767,0.0,0.847,0.153,0.2023,2021-07-11 11:10:05
Important High Tech SEO Trends Know For #SEO #Google #SearchEngineOptimization #Ranking #OnP,7767,0.0,0.859,0.141,0.2023,2021-07-11 11:10:04
Google Supermodel DeepMind Perceiver step the road machine that could process anything and ever,59832,0.0,1.0,0.0,0.0,2021-07-11 11:10:02
Important High Tech SEO Trends Know For #SEO #Google #SearchEngineOptimization,29413,0.0,0.833,0.167,0.2023,2021-07-11 11:10:01
Important High Tech SEO Trends Know For #SEO #Google #SearchEngineOptimization,945,0.0,0.833,0.167,0.2023,2021-07-11 11:10:01
Samsung Galaxy Prime Edition Edition will launch Amazon Prime day Specifications are similar,79,0.0,0.876,0.124,0.1779,2021-07-11 11:10:00
Crazy revolutionary idea get the free loaders #amazon #facebook #google pay all their taxes,144,0.21,0.608,0.182,0.128,2021-07-11 11:09:00
SHIB doge btc eth feg bnb Ada xrp sol matic link usdt cake tel dot ksm trx vet,283,0.0,1.0,0.0,0.0,2021-07-11 11:08:55
SHIB doge btc eth feg bnb Ada xrp sol matic link usdt cake tel dot ksm trx vet,283,0.0,1.0,0.0,0.0,2021-07-11 11:08:21
Prepare yourself for the Airdrop SHIB doge btc eth feg bnb Ada xrp sol matic link usdt cake tel dot,283,0.0,1.0,0.0,0.0,2021-07-11 11:08:16
SHIB doge btc eth feg bnb Ada xrp sol matic link usdt cake tel dot ksm trx vet,283,0.0,1.0,0.0,0.0,2021-07-11 11:08:03
#AI researchers #Facebook and #Google are teaching machines police human speech Washington Post can hard overs,1413,0.085,0.915,0.0,-0.1027,2021-07-11 11:07:31
see the full video please click this link #Google #googlecaptcha #captcha,2,0.0,0.813,0.187,0.3182,2021-07-11 11:07:28
How pretty that #usher #crowder #june coup #google #ethan,2,0.0,0.714,0.286,0.4939,2021-07-11 11:07:19
This hilarious #Google nepotism example,107,0.0,0.597,0.403,0.4019,2021-07-11 11:05:19
Well done #Google #ITA #ENG,492,0.0,0.656,0.344,0.2732,2021-07-11 11:03:37
Latest video drop Are you ready for price alerts profit amp loss tracking future #Ethereum #blockchain integration and,888,0.185,0.588,0.227,0.25,2021-07-11 11:03:23
This Tool Shows How Google Changes Its Search Results Around the World #ai #ArtificialIntelligen,1547,0.0,1.0,0.0,0.0,2021-07-11 11:01:36
Recently purchased from Why not leave review Trustpilot Facebook Google Receive off your nex,439,0.0,0.919,0.081,0.0382,2021-07-11 11:00:31
have #best days ahead Let keep growing our community and make history Get #BLAST and #BLASToff,28,0.0,0.898,0.102,0.1779,2021-07-11 11:00:04
Three new second videos released Google detail three features found the Pixel and the Pixel Thes,7,0.0,1.0,0.0,0.0,2021-07-11 10:59:42
What about top ranked competitors who are breaking all the rules and laughing all the way the bank via,1147,0.0,0.773,0.227,0.6124,2021-07-11 10:59:33
Canine Support #Google,173,0.0,0.426,0.574,0.4019,2021-07-11 10:59:27
Prepare yourself for the Airdrop SHIB doge btc eth feg bnb Ada xrp sol matic link usdt cake tel,90,0.0,1.0,0.0,0.0,2021-07-11 10:59:07
Google John Mueller goes over what site owners need know about using multiple types schema structured data markup,1147,0.0,1.0,0.0,0.0,2021-07-11 10:58:51
ISRO amp MapmyIndia build alternative Google Maps #ISRO India answer #NASA #MapmyIndia that,2195,0.0,1.0,0.0,0.0,2021-07-11 10:58:47
have star #Google #reviews Well done all the team,302,0.0,0.792,0.208,0.2732,2021-07-11 10:58:41
Link exchanges are against Google Webmaster Guidelines and can result manual penalties Learn how navigate this when,423,0.0,1.0,0.0,0.0,2021-07-11 10:58:05
ISRO amp MapmyIndia build alternative Google Maps #ISRO India answer #NASA #MapmyIndia that,407,0.0,1.0,0.0,0.0,2021-07-11 10:57:59
This Tool Shows How Google Changes Its Search Results Around the World #ai #ArtificialIntelligen,1904,0.0,1.0,0.0,0.0,2021-07-11 10:57:07
The most important thing they could improve #win #Windows #Windows really improv,12053,0.0,0.667,0.333,0.6115,2021-07-11 10:56:40
Vance accuses #Google conspiring with #Chinese government shirking #US want kids grow good,21,0.145,0.602,0.253,0.2023,2021-07-11 10:54:23
Dozens states are suing #Google over app store practices,300,0.208,0.792,0.0,-0.2732,2021-07-11 10:53:19
Google Being Sued States Over Google Play #Google #Internet #Lawsuit #Violation,801,0.0,0.806,0.194,0.34,2021-07-11 10:52:48
look forward actually said Trump Former President Trump said eager and willing provide sworn testimo,367,0.0,0.848,0.152,0.3612,2021-07-11 10:52:03
#usher #crowder #june coup #google #ethan Magnetic Child Lock Children Protection Baby Safety Lock Drawer Latch,2,0.0,0.843,0.157,0.4215,2021-07-11 10:51:27
This Tool Shows How Google Changes Its Search Results Around the World #ai #ArtificialIntelligen,281,0.0,1.0,0.0,0.0,2021-07-11 10:49:54
This Tool Shows How Google Changes Its Search Results Around the World #ai #ArtificialIntelligen,2962,0.0,1.0,0.0,0.0,2021-07-11 10:49:26
your Webcam Hacked checked your computer you notice any these things happening #cyberarms #cybersecur,11,0.172,0.828,0.0,-0.4019,2021-07-11 10:45:30
Registered for the #Google #kickstart competition better than yesterday you also haven gave try reg,37,0.0,0.828,0.172,0.4404,2021-07-11 10:45:02
Pre Registration Coating The smooth design significantly reduces friction while the stealth but passionate cut,40,0.186,0.588,0.225,0.4215,2021-07-11 10:44:35
#FinlandGovernment #Google #Wedgewood #Fiskars #JoeBiden #EU have not been able see Wedgwood webpage,0,0.0,1.0,0.0,0.0,2021-07-11 10:40:43
This Tool Shows How Google Changes Its Search Results Around the World #ai #ArtificialIntelligen,5624,0.0,1.0,0.0,0.0,2021-07-11 10:40:38
Failed once again The pain unable debug own code kills Can someone get some advice Compet,11,0.437,0.563,0.0,-0.8779,2021-07-11 10:40:37
This Tool Shows How Google Changes Its Search Results Around the World #ai,59832,0.0,1.0,0.0,0.0,2021-07-11 10:40:02
LapiLab Laptop Service Center #Google #laptopshop #Laptoploverpune,2,0.0,1.0,0.0,0.0,2021-07-11 10:39:11
signs off tax haven crackdown #Ireland #google #Apple #amazon,1522,0.0,1.0,0.0,0.0,2021-07-11 10:36:38
#google Phone #app for #android Gets Built Caller and Spam Protection,5455,0.2,0.8,0.0,-0.3612,2021-07-11 10:34:54
just need house stay can you please help sir #NBAFinals #NBAFinals #NCTzenSelcaDay #NFL #ConorMcGregor,2,0.0,0.706,0.294,0.6124,2021-07-11 10:34:13
Make Per day from Home simple sign survey and watching videos Link,37,0.0,1.0,0.0,0.0,2021-07-11 10:33:50
TenFourFox and Chromium Monoculture #Google #Moz #Web,7767,0.0,1.0,0.0,0.0,2021-07-11 10:32:24
Vance accuses #Google conspiring with #Chinese government shirking #US want kids grow good,66,0.145,0.602,0.253,0.2023,2021-07-11 10:32:23
you want know what google adsense click here #Android #Google #ADSB #adsence #COVID,1,0.0,0.902,0.098,0.0772,2021-07-11 10:31:57
How create gmail account you want know click here #DigitalMarketing #gmail #Google,1,0.0,0.746,0.254,0.34,2021-07-11 10:31:48
Indian Army attack Guluthi started skill development course information technology #ARMY #AMC #COVID #insiders #motivatio,22,0.181,0.819,0.0,-0.4767,2021-07-11 10:31:38
Indian army Guluthi started #India #ARMY #SundayMorning #SaturdayMotivation #SaturdayMorning #motivation #TREASURE #Trendi,22,0.0,1.0,0.0,0.0,2021-07-11 10:31:26
Check out #usher #crowder #june coup #google #ethan,2,0.0,1.0,0.0,0.0,2021-07-11 10:30:50
begins #stadia #google #googlestadia,1178,0.0,1.0,0.0,0.0,2021-07-11 10:30:38
have you noticed that you search arg bra this happens this nice,2310,0.0,0.772,0.228,0.5023,2021-07-11 10:29:55
Google Nasty New Technology Secretly Tracking Your iPhone Google busine,27,0.286,0.714,0.0,-0.5574,2021-07-11 10:29:25
Everyone #listen this and #Google what says Check out mikejack video #TikTok,195,0.0,1.0,0.0,0.0,2021-07-11 10:29:00
Google Being Sued States Over Google Play #Google #Internet #Lawsuit #Violation,313,0.0,0.806,0.194,0.34,2021-07-11 10:28:35
Indian Army attack Guluthi started skill development course information technology #ARMY #AMC #COVID #insiders,34,0.193,0.807,0.0,-0.4767,2021-07-11 10:28:30
Indian army Guluthi started #India #ARMY #SundayMorning #SaturdayMotivation #SaturdayMorning #motivation #TREASURE,34,0.0,1.0,0.0,0.0,2021-07-11 10:28:07
#Ranking #rankingrights Women bible site Keyword #Google search #page traffic,3623,0.0,1.0,0.0,0.0,2021-07-11 10:28:02
Pre Registration Coating The smooth design significantly reduces friction while the stealth but passionate cut,10,0.186,0.588,0.225,0.4215,2021-07-11 10:27:18
Canine Support #Google,232,0.0,0.426,0.574,0.4019,2021-07-11 10:26:50
How Select Multiple Files Google Drive #Howtodo #Google #Googleaccount #guide,296,0.0,1.0,0.0,0.0,2021-07-11 10:22:17
zone Why You Suddenly Need Delete #Google Maps Your #iPhone,629,0.0,1.0,0.0,0.0,2021-07-11 10:22:05
Google Being Sued States Over Google Play #Google #Internet #Lawsuit #Violation,5059,0.0,0.806,0.194,0.34,2021-07-11 10:20:57
#usher #crowder #june coup #google #ethan Protective Glass for iPhone,2,0.0,1.0,0.0,0.0,2021-07-11 10:20:19
SATSHOP #Google,71,0.0,1.0,0.0,0.0,2021-07-11 10:19:05
Chauffeur Booking Melbourne #Google #chauffeur #Melbourne,561,0.0,1.0,0.0,0.0,2021-07-11 10:18:00
July buy #oneplus #device #smoothos #oneplus tpro #neversettle #beyondthespeed,120,0.0,1.0,0.0,0.0,2021-07-11 10:16:03
Google Support #Google #Support Google,900,0.0,0.597,0.403,0.4019,2021-07-11 10:14:01
Trying look things from different angle otherwise your information safe #BigData #Python #RStats #JavaScript #Re,167,0.0,0.828,0.172,0.4404,2021-07-11 10:10:57
Trying look things from different angle otherwise your information safe #BigData #Python #RStats #JavaScript #Re,16994,0.0,0.828,0.172,0.4404,2021-07-11 10:10:54
#Google has said that its rity warn ings are signed pro tect consumers from the risk down load ing,1581,0.171,0.829,0.0,-0.3612,2021-07-11 10:10:48
#website #upgrade #google #webdesign #webdevelopment #webdevelopers #webdesignservices Bienderilk,235,0.0,1.0,0.0,0.0,2021-07-11 10:10:20
Google Being Sued States Over Google Play #Google #Internet #Lawsuit #Violation,370,0.0,0.806,0.194,0.34,2021-07-11 10:09:08
Oppo Reno Indian variant SPECS Mediatek Dimensity RAM quad rear camera Android Color,79,0.0,1.0,0.0,0.0,2021-07-11 10:08:52
Link exchanges are against Google Webmaster Guidelines and can result manual penalties Learn how navigate this when,51,0.0,1.0,0.0,0.0,2021-07-11 10:08:06
Title tags can anywhere from fat thin characters they are thin lowercase letters like iii more,15839,0.0,0.787,0.213,0.4215,2021-07-11 10:08:02
look forward actually said Trump Former President Trump said eager and willing provide sworn testimo,697,0.0,0.848,0.152,0.3612,2021-07-11 10:06:46
look forward actually said Trump Former President Trump said eager and willing provide sworn testimo,393,0.0,0.848,0.152,0.3612,2021-07-11 10:04:00
DONOT listen #Satan YOU have put FIRST #God #Sacrifice sinners for Sacrifice yourself #android,21,0.0,1.0,0.0,0.0,2021-07-11 10:03:12
Advanced Film Solutions #Google,4429,0.0,0.351,0.649,0.4019,2021-07-11 10:03:10
DONOT listen #Satan YOU have put FIRST #God #Sacrifice sinners for Sacrifice yourself #android,8,0.0,1.0,0.0,0.0,2021-07-11 10:01:49
Fancy #Apple #Google car Tech behemoths eye #selfdriving car market projected top trillion http,1547,0.0,0.878,0.122,0.2023,2021-07-11 10:01:36
Fancy #Apple #Google car Tech behemoths eye #selfdriving car market projected top trillion http,8627,0.0,0.878,0.122,0.2023,2021-07-11 10:00:57
Fancy #Apple #Google car Tech behemoths eye #selfdriving car market projected top trillion http,3219,0.0,0.878,0.122,0.2023,2021-07-11 10:00:51
What local SEO and benefits Manishaln Read #LNTECHINFO #localseo #seo,29,0.0,0.776,0.224,0.3818,2021-07-11 10:00:21
Former president #DonaldTrump has filed lawsuit against tech giants #Google #Twitter and #Facebook claiming,2950,0.128,0.872,0.0,-0.2263,2021-07-11 10:00:01
peachfolio The DeFi wallet tracking app Version coming soon,11,0.0,1.0,0.0,0.0,2021-07-11 09:57:25
Update Back #Google app beta loses built browser and returns #Chrome Custom Tabs Google,3974,0.15,0.85,0.0,-0.3182,2021-07-11 09:57:20
peachfolio The DeFi wallet tracking app Version coming soon,11,0.0,1.0,0.0,0.0,2021-07-11 09:57:01
peachfolio The DeFi wallet tracking app Version coming soon Download,11,0.0,1.0,0.0,0.0,2021-07-11 09:56:53
Xiaomi Sonic Charge Qualcomm Quick Charge Output Super Fast Type Cable Charge Type,79,0.0,0.755,0.245,0.5994,2021-07-11 09:55:00
Isn cool #usher #crowder #june coup #google #ethan,2,0.0,0.753,0.247,0.3182,2021-07-11 09:54:37
Gather Cafe #Google,0,0.0,1.0,0.0,0.0,2021-07-11 09:54:17
Half Picture Cute Boy #twitter #Tweet #lovely #post #Google #Instagram #Facebook,0,0.0,0.769,0.231,0.4588,2021-07-11 09:53:27
DONOT listen #Satan YOU have put FIRST #God #Sacrifice sinners for Sacrifice yourself,9,0.0,1.0,0.0,0.0,2021-07-11 09:52:50
Gboard Brings Spell Check and More Floating Keyboard Minis #virtual #google #tech,6524,0.0,1.0,0.0,0.0,2021-07-11 09:52:04
the very bottom #TheFanCaste watch list #Google #Hangout test session Should they keep delete,3602,0.0,1.0,0.0,0.0,2021-07-11 09:51:21
blackfatEATS #Google,409,0.0,1.0,0.0,0.0,2021-07-11 09:50:52
Have you ever used Google duo your main video calling app #android #duo #google,12,0.0,1.0,0.0,0.0,2021-07-11 09:50:47
Google CEO Sundar Pichai hails Lionel Messi best ever after Copa triumph READ,7439,0.0,0.601,0.399,0.8074,2021-07-11 09:50:36
#usher #crowder #june coup #google #ethan Bag For Women Cloud bag Soft Leather Hobos Bag Single Shoulder Purse Wom,2,0.0,1.0,0.0,0.0,2021-07-11 09:50:16
Check out paidmarketer will increase sales #shopify website #Google #AdWords #Fiverr adwords fiverr #ppc,982,0.0,0.85,0.15,0.3182,2021-07-11 09:48:29
#Turkey #Malatya zollu #mountain slopes village #google earth virtual travel #photo Aysel july,56,0.0,1.0,0.0,0.0,2021-07-11 09:48:19
#Turkey #Malatya zollu #Roads leading hills and villages #google earth virtual travel #photo Aysel july,56,0.0,1.0,0.0,0.0,2021-07-11 09:48:11
#Turkey #Malatya zollu aerial view village #google earth virtual travel #photo Aysel july,56,0.0,1.0,0.0,0.0,2021-07-11 09:48:02
#Turkey #Malatya zollu #highway and surrounding villages #google earth virtual travel #photo Aysel july,56,0.0,1.0,0.0,0.0,2021-07-11 09:47:56
#Turkey #Malatya zol county #Karakaya Dam Lake #google earth virtual travel #photo Aysel july,56,0.0,1.0,0.0,0.0,2021-07-11 09:47:40
#Turkey #Malatya zollu county #google earth virtual travel #photo Aysel july,56,0.0,1.0,0.0,0.0,2021-07-11 09:47:35
#Turkey #Malatya zol county #Karakaya Dam Lake #google earth virtual travel #photo Aysel july,56,0.0,1.0,0.0,0.0,2021-07-11 09:47:29
#Turkey #Malatya zol county #Apricot gardens the shore Karakaya Dam Lake #google earth virtual travel #photo Aysel,56,0.0,1.0,0.0,0.0,2021-07-11 09:47:21
#Turkey #Malatya zol county #goricot groves and rain #google earth virtual travel #photo Aysel july,56,0.0,1.0,0.0,0.0,2021-07-11 09:47:15
#Turkey #Malatya zollu now let take tour village #google earth virtual travel #photo Aysel july,56,0.0,1.0,0.0,0.0,2021-07-11 09:47:12
#Turkey #Malatya #Entrance zollu county #google earth virtual travel #photo Aysel july,56,0.0,1.0,0.0,0.0,2021-07-11 09:47:02
Fancy #Apple #Google car Tech behemoths eye #selfdriving car market projected top trillion http,1504,0.0,0.878,0.122,0.2023,2021-07-11 09:46:46
Google and also Youtube autocomplete when searching Chinese are Korean Absolutely disgusting,253,0.251,0.749,0.0,-0.5709,2021-07-11 09:45:43
#Turkey #Malatya zollu #mountain slopes village #google earth virtual travel #photo Aysel july,56,0.0,1.0,0.0,0.0,2021-07-11 09:44:49
