tweet,follower_count,neg,neu,pos,compound,time
#Google Replacing Android APK with AAB,266,0.0,1.0,0.0,0.0,2021-07-21 12:07:34
Track time within #Salesforce mobile #iOS and #Android #Google #chrome extension the Web And,87,0.0,1.0,0.0,0.0,2021-07-21 12:06:13
When your rank falls dramatically natural think that you might facing Google Penalty That not alw,11,0.154,0.718,0.128,-0.128,2021-07-21 12:05:39
Learn our blog post which Google Analytics key metrics you should check regularly #google #analytics,900,0.0,1.0,0.0,0.0,2021-07-21 12:04:59
Amazon Kindle all major Stores Barnes amp Noble Manhattan and online Startup Kudos published Worldwi,102,0.0,0.6,0.4,0.7906,2021-07-21 12:03:36
How did Google revolutionize search What all does #Google today This short academic encyclopedia entry answers,3648,0.0,1.0,0.0,0.0,2021-07-21 12:02:03
#infographic The Most Innovative Companies via #Apple #inn,1779,0.0,0.687,0.313,0.4927,2021-07-21 12:01:36
Very kind and professional service always have good experience calling them too They out their way,117,0.0,0.68,0.32,0.7645,2021-07-21 12:01:34
Compare URLs discover how similar they are and avoid duplicate content #google #bing #seo,351,0.145,0.855,0.0,-0.296,2021-07-21 12:00:55
Viktor goldene Regel keep short and simple #seo #google #sem,3027,0.0,1.0,0.0,0.0,2021-07-21 12:00:55
More and more people reached his article which will prove very helpful #DeepLearning #DataScience #AI #MachineLearnin,271,0.0,0.746,0.254,0.5819,2021-07-21 12:00:06
More and more people reached his article which will prove very helpful #DeepLearning #DataScience #AI #MachineLearnin,581,0.0,0.746,0.254,0.5819,2021-07-21 12:00:03
More and more people reached his article which will prove very helpful #DeepLearning #DataScience #AI #MachineLearnin,581,0.0,0.746,0.254,0.5819,2021-07-21 12:00:03
Gmail Tips That Will Help You Crush Efficiency #Google #Gmail #Email #Efficiency,305,0.101,0.57,0.329,0.5574,2021-07-21 12:00:01
More and more people reached his article which will prove very helpful #DeepLearning #DataScience #AI #MachineLearnin,1790,0.0,0.746,0.254,0.5819,2021-07-21 11:59:25
#USA #Bryce canyon lone king the canyon #google earth virtual travel #photo Aysel july,56,0.139,0.861,0.0,-0.2732,2021-07-21 11:58:57
#Google AMP icon has been removed the Top Stories carousel and organic search results,330,0.0,0.878,0.122,0.2023,2021-07-21 11:58:57
The SEO agency KPIs dashboard way unlock growth #digitalmarketing #seo #google #searchengine,1186,0.0,0.809,0.191,0.3818,2021-07-21 11:58:52
Step Step Guide Marketing Your Mobile App #digitalmarketing #seo,1029,0.0,1.0,0.0,0.0,2021-07-21 11:58:14
Have you left Google review Let know about your experience next time you visit Cubo,299,0.0,1.0,0.0,0.0,2021-07-21 11:58:03
Domain For Sale #Socratic #SocraticApp DaysOfCode #javascript #python #Apple #vr #Microsoft,1790,0.0,1.0,0.0,0.0,2021-07-21 11:57:45
Domain For Sale #Socratic #SocraticApp DaysOfCode #javascript #python #Apple #vr #Microsoft,250,0.0,1.0,0.0,0.0,2021-07-21 11:57:42
Domain For Sale #Socratic #SocraticApp DaysOfCode #javascript #python #Apple #vr #Microsoft,13,0.0,1.0,0.0,0.0,2021-07-21 11:57:39
Domain For Sale Buy Now With Low Bin Price #Socratic #SocraticApp #google #learning #school,13,0.139,0.861,0.0,-0.2732,2021-07-21 11:56:39
Domain Listed For Sale #Socratic #SocraticApp #App #satech #google #learning #school #stud,13,0.0,1.0,0.0,0.0,2021-07-21 11:56:36
#USA #Bryce canyon silent majority #google earth virtual travel #photo Aysel july,56,0.0,1.0,0.0,0.0,2021-07-21 11:55:56
#Google Ads plans expand the scope the project after the initial pilot include more policy types,40988,0.0,0.867,0.133,0.3182,2021-07-21 11:55:03
The ingredient you need incorporate into your shower routine for plump healthy skin Copaiba Soap from the Rainfores,907,0.0,0.863,0.137,0.4019,2021-07-21 11:54:44
Cheeky #Google Search Tips Help you Google Like Pro #Search #Online,487,0.0,0.634,0.366,0.6369,2021-07-21 11:53:59
The ingredient you need incorporate into your shower routine for plump healthy skin Copaiba Soap from the Rain,2800,0.0,0.863,0.137,0.4019,2021-07-21 11:53:56
#USA #Bryce canyon differences height between stone groups #google earth virtual travel #photo Aysel july,56,0.0,1.0,0.0,0.0,2021-07-21 11:53:23
Robotaxis have #Google and #Amazon backed the wrong #technology #SelfDrivingCars #AI #IoT,309,0.218,0.704,0.077,-0.4588,2021-07-21 11:52:57
Domain Listed For Sale Buy Now With Low Bin Price #Socratic #SocraticApp #google #learning,13,0.139,0.861,0.0,-0.2732,2021-07-21 11:51:11
Domain Listed For Sale Buy Now With Low Bin Price #Socratic #SocraticApp #App #satech #goog,13,0.13,0.87,0.0,-0.2732,2021-07-21 11:51:09
#USA #Bryce canyon #google earth virtual travel #photo Aysel july,56,0.0,1.0,0.0,0.0,2021-07-21 11:50:01
All powerful god like entity Zaps your website into existence Google Serve static assets with efficient cac,8436,0.0,0.502,0.498,0.872,2021-07-21 11:49:54
GOOGLE are thrilled ranked #Google for Pressings Midlands What achievement for our,565,0.0,0.791,0.209,0.4404,2021-07-21 11:49:26
Please note our updated hours Monday Thursday NFS Bandera Tax Services #Google,138,0.0,0.827,0.173,0.3182,2021-07-21 11:48:26
#USA #Bryce canyon stone families #google earth virtual travel #photo Aysel july,56,0.0,1.0,0.0,0.0,2021-07-21 11:47:55
Games Stadia Valve and Splitgate #Google,7835,0.0,1.0,0.0,0.0,2021-07-21 11:47:23
Important High Tech SEO Trends Know For #SEO #Google #SearchEngineOptimization,1130,0.0,0.833,0.167,0.2023,2021-07-21 11:47:01
General Trivia About Cloud Services #cloudcomputing #microsoft #microsoft #cloud #google #am,84,0.0,1.0,0.0,0.0,2021-07-21 11:45:45
And Team Bring Enhanced Messaging Services Android Users #Verizon,5773,0.0,1.0,0.0,0.0,2021-07-21 11:45:24
Important High Tech SEO Trends Know For #SEO #Google #SearchEngineOptimization,954,0.0,0.833,0.167,0.2023,2021-07-21 11:45:11
BOUND RING amp SECRET Warm funny heartbreaking amazing story #Kindle KindleUK https,6709,0.153,0.408,0.439,0.6808,2021-07-21 11:44:35
The positive Impacts which #Brightcom will benefit from following its MCM Partnership with #google,143,0.0,0.645,0.355,0.765,2021-07-21 11:44:08
#BCG #brightcomgroup cmp times weeks from our reco Upper circuit continues,143,0.0,1.0,0.0,0.0,2021-07-21 11:44:00
#USA #Bryce canyon canyon walkway #google earth virtual travel #photo Aysel july,56,0.0,1.0,0.0,0.0,2021-07-21 11:43:18
General Trivia About Cloud Services #cloudcomputing #microsoft #microsoft #cloud #google #am,163,0.0,1.0,0.0,0.0,2021-07-21 11:42:42
General Trivia About Cloud Services #cloudcomputing #microsoft #microsoft #cloud #google #am,163,0.0,1.0,0.0,0.0,2021-07-21 11:42:42
Trojan #joker issues with new features #Google PlayStore Joker analysis,1693,0.0,0.857,0.143,0.128,2021-07-21 11:41:46
Delete Personal Information From Google ads Click here for full episode,193,0.0,1.0,0.0,0.0,2021-07-21 11:41:34
Trojan #joker issues with new features #Google PlayStore Joker analysis,19,0.0,0.857,0.143,0.128,2021-07-21 11:41:20
#USA #Bryce canyon two windows the canyon #google earth virtual travel #photo Aysel july,56,0.0,1.0,0.0,0.0,2021-07-21 11:40:55
All powerful god like entity Zaps your website into existence Google Serve static assets with effi,967,0.0,0.569,0.431,0.7964,2021-07-21 11:40:39
the back the recent availability search data #Google remembered how much liked using #GoogleTrends,644,0.0,0.823,0.177,0.4215,2021-07-21 11:40:33
cloudologic General Trivia About Cloud Services Microsoft Amazon Google #cloudcomputing #microsoft,1208,0.0,0.855,0.145,0.1779,2021-07-21 11:39:51
Delete Personal Information From Google ads Click here for full episode,29219,0.0,1.0,0.0,0.0,2021-07-21 11:39:47
General Trivia About Cloud Services #cloudcomputing #microsoft #microsoft #cloud #google #am,36495,0.0,1.0,0.0,0.0,2021-07-21 11:39:02
General Trivia About Cloud Services #cloudcomputing #microsoft #microsoft #cloud #google #am,1612,0.0,1.0,0.0,0.0,2021-07-21 11:38:57
states have sued Google over commission for app developers They also accuse the company downgrading third par,6725,0.101,0.899,0.0,-0.2023,2021-07-21 11:38:09
#USA #Bryce canyon #google earth virtual travel #photo Aysel july,56,0.0,1.0,0.0,0.0,2021-07-21 11:37:57
With passkeys #iCloud Keychain the iPhone maker joins #Microsoft and #Google advocating for passwordless authentic,975,0.0,1.0,0.0,0.0,2021-07-21 11:37:53
Journalists face years prison for stories embarrassing the Government under proposed changes the Off,4329,0.33,0.67,0.0,-0.7096,2021-07-21 11:37:02
General Trivia About Cloud Services #cloudcomputing #microsoft #microsoft #cloud,190,0.0,1.0,0.0,0.0,2021-07-21 11:36:57
#USA #Bryce canyon residents the canyon #google earth virtual travel #photo Aysel july,56,0.0,1.0,0.0,0.0,2021-07-21 11:36:40
Pitman Training Swords #Google,1754,0.0,1.0,0.0,0.0,2021-07-21 11:33:15
#USA #Bryce canyon panorama #google earth virtual travel #photo Aysel july,56,0.0,1.0,0.0,0.0,2021-07-21 11:33:13
Pitman Training Swords #Google,1754,0.0,1.0,0.0,0.0,2021-07-21 11:33:12
Pitman Training Swords #Google,1754,0.0,1.0,0.0,0.0,2021-07-21 11:32:55
Pitman Training Swords #Google,1754,0.0,1.0,0.0,0.0,2021-07-21 11:32:52
Nothing wrong with something during the Summer You know what that got thinking about something,20,0.0,0.846,0.154,0.3724,2021-07-21 11:32:35
Google Authorship How Get Your Author Image SERPs #Google #SERPs #googleauthorship #Marketing #digitalmarketing,8436,0.0,1.0,0.0,0.0,2021-07-21 11:31:16
Domain Listed For Sale #Socratic #SocraticApp #App #satech #google #hebrews #janeiro #filosof,13,0.0,1.0,0.0,0.0,2021-07-21 11:31:11
Listed For Sale Buy Now With Low Bin Price #Socratic #SocraticApp #App #satech #google #he,13,0.13,0.87,0.0,-0.2732,2021-07-21 11:31:09
Listed For Sale #Socratic #SocraticApp #App #satech #google #hebrews #janeiro #filosofia,13,0.0,1.0,0.0,0.0,2021-07-21 11:31:05
How happy google what are you searching for have humans lost imagination initiative amp stopped being crea,39,0.192,0.639,0.169,0.128,2021-07-21 11:30:46
Pitman Training Swords #Google,1754,0.0,1.0,0.0,0.0,2021-07-21 11:30:29
How Successful Using Google Ads This Year and Beyond #Marketing,4466,0.0,0.703,0.297,0.5859,2021-07-21 11:30:13
Google making easier manage permissions Chrome site site basis The feat,61,0.0,0.781,0.219,0.4215,2021-07-21 11:30:00
With passkeys #iCloud Keychain the iPhone maker joins #Microsoft and #Google advocating for passwordless aut,74285,0.0,1.0,0.0,0.0,2021-07-21 11:29:00
Nothing wrong with something during the Summer You know what that got thinking about something,220,0.0,0.846,0.154,0.3724,2021-07-21 11:28:45
Golden Union #Google,7822,0.0,1.0,0.0,0.0,2021-07-21 11:28:41
Important High Tech SEO Trends Know For #SEO #Google #SearchEngineOptimization #Ranking,4217,0.0,0.847,0.153,0.2023,2021-07-21 11:28:37
DuckDuckGo launches new email protection service remove trackers #privacy #gmail #outlook,111,0.0,1.0,0.0,0.0,2021-07-21 11:28:07
Great episode #TotallyUnscripted all about automating Really interesting hear from Jay Lee the,65,0.0,0.608,0.392,0.796,2021-07-21 11:27:24
MarketWatch Artificial Intelligence more profound than fire electricity the internet says #Google boss https,1490,0.15,0.676,0.175,0.1119,2021-07-21 11:27:23
Modern Versatile Designs Your Versatile Design Studio where house plans are drawn professionals very affordabl,444,0.0,1.0,0.0,0.0,2021-07-21 11:27:01
Important High Tech SEO Trends Know For #SEO #Google #SearchEngineOptimization,29453,0.0,0.833,0.167,0.2023,2021-07-21 11:27:01
Google Authorship How Get Your Author Image SERPs #Google #SERPs #googleauthorship #Marketing #digitalmarketing,3236,0.0,1.0,0.0,0.0,2021-07-21 11:23:01
Google gives site owners seven tips for analyzing the main causes drops organic search traffic via,1092,0.0,1.0,0.0,0.0,2021-07-21 11:21:56
Listed For Sale #Socratic #SocraticApp #App #satech #google #hebrews #janeiro #filosofia #so,13,0.0,1.0,0.0,0.0,2021-07-21 11:21:48
wouldn surprised Members #Parliament did not #Google what ammonium nitrate does large quantities,6781,0.0,0.863,0.137,0.2263,2021-07-21 11:21:23
#LaraLogan sounds the alarm gov #surveillance depth intvs with #BillBinney #JacobAppelbaum everything from,28,0.167,0.833,0.0,-0.34,2021-07-21 11:20:21
#Wedding Planners Christine Worthy Wedding Planner #Google,2000,0.0,0.674,0.326,0.4404,2021-07-21 11:19:49
Narappa Indian Telugu language period activity show movie coordinated Srikan,0,0.0,1.0,0.0,0.0,2021-07-21 11:19:35
Thanx #Google,1274,0.0,1.0,0.0,0.0,2021-07-21 11:19:26
Welcome #Broogle #Brightcom Group #Google,165,0.0,0.571,0.429,0.4588,2021-07-21 11:17:59
Did you know Follow Retweet #Python #javascript #Coding #Java #DataScience #Linux #MachineLearning #cloud DaysOf,99,0.0,1.0,0.0,0.0,2021-07-21 11:17:26
tips navigate and explore safely with Google Maps via #digitalmarketing #Google #SEO htt,1841,0.0,0.789,0.211,0.4939,2021-07-21 11:17:23
#GodofAbraham #Jesus Archive jdshow com #Twitter #Google #GooglePhotos #Googlemaps #Facebook #mix #NP #Actor,341,0.0,1.0,0.0,0.0,2021-07-21 11:17:09
July buy #oneplus #device #smoothos #oneplus tpro #neversettle #beyondthespeed,119,0.0,1.0,0.0,0.0,2021-07-21 11:16:02
#Google Navigate new normals with Google Maps,11122,0.0,1.0,0.0,0.0,2021-07-21 11:15:54
Our amazing #peachfolio #DeFi tracking app now with different currencies added for our worldwide community and soon,25,0.0,0.808,0.192,0.5859,2021-07-21 11:15:44
Google gives site owners seven tips for analyzing the main causes drops organic search traffic via,2073,0.0,1.0,0.0,0.0,2021-07-21 11:15:43
tips navigate and explore safely with Google Maps via #digitalmarketing,737,0.0,0.738,0.262,0.4939,2021-07-21 11:15:10
tips navigate and explore safely with Google Maps via #digitalmarketing #Google #SEO htt,957,0.0,0.789,0.211,0.4939,2021-07-21 11:11:38
Goobuntu was #Linux distribution based Ubuntu LTS was used almost #Google employees added,1839,0.0,0.783,0.217,0.516,2021-07-21 11:11:30
#GodofAbraham #Jesus Archive jdshow com #Twitter #Google #GooglePhotos #Googlemaps #Facebook #mix #NP #Actor #Ente,318,0.0,1.0,0.0,0.0,2021-07-21 11:11:03
tips navigate and explore safely with Google Maps via #digitalmarketing,365,0.0,0.738,0.262,0.4939,2021-07-21 11:10:44
Concerned about possible Cyryptocurrency Audit Defending Canadian Taxpayers Call Milot Law TODAY,870,0.0,1.0,0.0,0.0,2021-07-21 11:10:04
#GodofAbraham #Jesus Archive jdshow com #Twitter #Google #GooglePhotos #Googlemaps #Facebook #mix #NP #Actor,341,0.0,1.0,0.0,0.0,2021-07-21 11:09:50
Google gives site owners seven tips for analyzing the main causes drops organic search traffic via,3454,0.0,1.0,0.0,0.0,2021-07-21 11:09:09
MOVE DMV #Google,75,0.0,1.0,0.0,0.0,2021-07-21 11:08:34
#Keyword difficulty #metric that can make break your #SEO strategy and SERP rankings But how you,210165,0.102,0.898,0.0,-0.1779,2021-07-21 11:08:22
#Google #Apple #TwitterCensorship Biden picks third trustbuster for his administration putting Big Tech notice,394,0.103,0.897,0.0,-0.128,2021-07-21 11:08:12
Users can now leave more detailed restaurant reviews #Google #marketing #seo,47197,0.107,0.893,0.0,-0.0516,2021-07-21 11:08:01
Hello #Google #gmail #YouTube Riddhi Ghosh mail riddhi ghosh,0,0.0,1.0,0.0,0.0,2021-07-21 11:07:49
#Google #Apple #TwitterCensorship Biden picks third trustbuster for his administration putting Big Tech noti,2035,0.103,0.897,0.0,-0.128,2021-07-21 11:07:49
Get discovered today via Google Ads whether you want promote seasonal offers run regular promotions check,2,0.0,0.782,0.218,0.4404,2021-07-21 11:07:19
Google gives site owners seven tips for analyzing the main causes drops organic search traffic via,327,0.0,1.0,0.0,0.0,2021-07-21 11:07:16
Users can now leave more detailed restaurant reviews Google #digitalmarketing #seo #google #sear,8436,0.091,0.909,0.0,-0.0516,2021-07-21 11:04:58
Person Slots now available London Ela Nedra Health Coaching Reiki EFT Therapy Healing Detox,786,0.0,1.0,0.0,0.0,2021-07-21 11:04:26
Some Google Play Store apps reported having Joker malware #Malware #Joker,610,0.0,0.698,0.302,0.4404,2021-07-21 11:03:25
This American multinational conglomerate known the father Google unbelievable that Alphabet has obta,4,0.0,0.87,0.13,0.2023,2021-07-21 11:02:18
Why the algorithms lecturer fat Ans Because always minimises the running time #algo #Algorithms #code #co,250,0.0,1.0,0.0,0.0,2021-07-21 11:01:54
Why the algorithms lecturer fat Ans Because always minimises the running time #algo #Algorithms #code #co,533,0.0,1.0,0.0,0.0,2021-07-21 11:01:54
Why the algorithms lecturer fat Ans Because always minimises the running time #algo #Algorithms,16,0.0,1.0,0.0,0.0,2021-07-21 11:01:34
consumers say that online reviews influenced their purchase decisions Claim your #Google listing now sta,306,0.0,1.0,0.0,0.0,2021-07-21 11:01:00
This week #mustread articles #DigitalDiplomacy #UN uses #AI conflict zones and Japan share militray #techno,99,0.131,0.743,0.126,-0.0258,2021-07-21 11:00:10
#SEO Manager based London paying considered for this position you will have experience,794,0.0,1.0,0.0,0.0,2021-07-21 11:00:02
#CM Google HARAMIchan #Google #CM,54,0.0,1.0,0.0,0.0,2021-07-21 10:59:41
Users can now leave more detailed restaurant reviews Google #digitalmarketing #seo #google #sear,539,0.091,0.909,0.0,-0.0516,2021-07-21 10:59:35
This week #mustread articles #DigitalDiplomacy #UN uses #AI conflict zones and Japan share militray,3595,0.139,0.727,0.133,-0.0258,2021-07-21 10:59:11
Users can now leave more detailed restaurant reviews Google #digitalmarketing #seo #google #searchengine,1186,0.091,0.909,0.0,-0.0516,2021-07-21 10:58:45
India Dental #Google,456,0.0,1.0,0.0,0.0,2021-07-21 10:56:14
Google Wear update makes apps easier find and download You also able remot,61,0.0,0.811,0.189,0.4215,2021-07-21 10:55:58
Compelling data Big ideas Creative juice Did you know has bevvy different newsletters sat,122,0.0,0.714,0.286,0.5859,2021-07-21 10:55:29
Four the five elements Google User Experience are the factors that Google has been emphasising for some time,410,0.0,1.0,0.0,0.0,2021-07-21 10:55:27
Let just wait for smart engineers #Apple and #Google #Android solve phone problems while fol,7,0.141,0.625,0.234,0.2023,2021-07-21 10:55:24
Google gives site owners seven tips for analyzing the main causes drops organic search traffic via,1480,0.0,1.0,0.0,0.0,2021-07-21 10:54:53
Google Wifi Mesh WiFi System Wifi Router Coverage #Google #Wifi,4693,0.0,1.0,0.0,0.0,2021-07-21 10:52:36
Hey There You Need organic wordpress page optimization,52,0.0,0.729,0.271,0.3818,2021-07-21 10:52:24
Benefits #Googleanalytics will provide you more insights about your business #website Understand why #Google,2,0.0,0.833,0.167,0.3818,2021-07-21 10:51:31
Google has strategy only indexing higher quality web pages and not indexing the low quality web pages,1916,0.0,0.898,0.102,0.2057,2021-07-21 10:51:01
Did you know Follow Retweet #Python #javascript #Coding #Java #DataScience #Linux #MachineLearning #cloud DaysOf,533,0.0,1.0,0.0,0.0,2021-07-21 10:50:12
Did you know Follow Retweet #Python #javascript #Coding #Java #DataScience #Linux #MachineLearning #cloud,36,0.0,1.0,0.0,0.0,2021-07-21 10:50:01
Google gives site owners seven tips for analyzing the main causes drops organic search traffic via,1673,0.0,1.0,0.0,0.0,2021-07-21 10:49:42
Golden Union #Google,1029,0.0,1.0,0.0,0.0,2021-07-21 10:48:58
Creatively Yours posting #Google,138,0.0,0.545,0.455,0.3612,2021-07-21 10:48:24
Google Has New Way Quickly and Easily Delete Your Search History #Google #privacy via,4052,0.0,0.844,0.156,0.34,2021-07-21 10:48:03
Start selling online today with simplified ecommerce store setups Visit #marketing #africa #ken,4368,0.0,1.0,0.0,0.0,2021-07-21 10:45:39
Your life became open secret after #Android phone cause you are communicating live through #Google All,4,0.0,1.0,0.0,0.0,2021-07-21 10:45:08
Google gives site owners seven tips for analyzing the main causes drops organic search traffic via,237460,0.0,1.0,0.0,0.0,2021-07-21 10:45:06
Very interesting #Apple #innovation #Google #Amazon #Microsoft #AI #ArtificialIntelligence #Facebook #Cloud #ecommerc,2092,0.0,0.786,0.214,0.4576,2021-07-21 10:40:43
Avalon House Light #Google,103,0.0,1.0,0.0,0.0,2021-07-21 10:40:09
Users can now leave more detailed restaurant reviews #Google,2905,0.13,0.87,0.0,-0.0516,2021-07-21 10:40:02
#Jenkins #devops #developer #programmers #Cloud #DeveloperJobs #google #Microsoft #code #worki,1115,0.0,1.0,0.0,0.0,2021-07-21 10:39:54
#Jenkins #devops #developer #programmers #Cloud #DeveloperJobs #google #Microsoft #code,1208,0.0,1.0,0.0,0.0,2021-07-21 10:39:51
Netflix Confirms Jeff Bezos amp Blue Origin Google Wear PlayStation The New Target Cryptocurrency,3,0.0,1.0,0.0,0.0,2021-07-21 10:39:22
Netflix Confirms Jeff Bezos amp Blue Origin Google Wear PlayStation The New Target Cryptocurrency,1,0.0,1.0,0.0,0.0,2021-07-21 10:38:17
Creatively WILD Art Studio #Google #artclasses #paintingtechniques #artclasses,356,0.0,0.737,0.263,0.3612,2021-07-21 10:37:48
How Integrate Google reCAPTCHA with PHP Step Step Guide #google #recaptcha #php #tutorial #phptutorial #webdevelop,1328,0.0,1.0,0.0,0.0,2021-07-21 10:37:36
post July Daniel Waisberg from #Google gives four main reasons explain drop traffic from,154,0.139,0.861,0.0,-0.2732,2021-07-21 10:37:06
Google John Mueller explains what looks like bug Search Console that reports indexed URLs crawled but not indexed,50,0.0,0.907,0.093,0.1901,2021-07-21 10:36:05
Loopy Place #Google,1733,0.0,1.0,0.0,0.0,2021-07-21 10:35:31
How Integrate Google reCAPTCHA with PHP Step Step Guide #google #recaptcha #php #tutorial #phptutorial #webdevelop,533,0.0,1.0,0.0,0.0,2021-07-21 10:35:02
How Integrate Google reCAPTCHA with PHP Step Step Guide #google #recaptcha #php #tutorial #phptutorial,641,0.0,1.0,0.0,0.0,2021-07-21 10:35:00
Personal Best #Google,517,0.0,0.323,0.677,0.6369,2021-07-21 10:34:44
#Google hates blind people Wanna prove Try signing into your account with your eyes closed using text reade,754,0.259,0.741,0.0,-0.6808,2021-07-21 10:34:39
The Time Took Assets Reach Trillion Market Cap #MarketCap #Apple #Amazon #Microsoft #Google #BTC,12166,0.0,0.811,0.189,0.2023,2021-07-21 10:34:32
Legal #betting Villamartin Plaza The Ale House #Google,2000,0.0,0.824,0.176,0.128,2021-07-21 10:33:28
BallsMania MIRTA #Google Quality meeting the customer needs and exceeding their,360,0.0,1.0,0.0,0.0,2021-07-21 10:32:34
Femme Politics Incubator Program For Young #African #Women Scholarships for #Google Career Certificates #womenintec,533,0.0,1.0,0.0,0.0,2021-07-21 10:32:22
Femme Politics Incubator Program For Young #African #Women Scholarships for #Google Career Certificates #womenintec,4,0.0,1.0,0.0,0.0,2021-07-21 10:32:03
Butter Pakaya have been mistaken all life #Google #Instagram #InstaGood #Colombo #SriLanka #CMB #LKA,152,0.161,0.839,0.0,-0.3612,2021-07-21 10:32:01
Google launches Pixel battery repair programme some countries #Google #Pixel,291,0.0,1.0,0.0,0.0,2021-07-21 10:31:37
#infographic The Most Innovative Companies via #Apple #inn,288,0.0,0.687,0.313,0.4927,2021-07-21 10:31:23
Download the Sentinel dVPN onto your device now iOS Application coming soon Linux Windows Mac Android English,43,0.0,1.0,0.0,0.0,2021-07-21 10:31:03
behave yourself Chrome #infosec #cybersecurity #programming #programmers #coding #coders #Windows #Microsoft #Google #php,533,0.0,1.0,0.0,0.0,2021-07-21 10:31:02
behave yourself Chrome #infosec #cybersecurity #programming #programmers #coding #coders #Windows #Microsoft #Google #php,1951,0.0,1.0,0.0,0.0,2021-07-21 10:30:50
#infographic The Most Innovative Companies via #Apple #inn,800,0.0,0.687,0.313,0.4927,2021-07-21 10:30:49
behave yourself Chrome #infosec #cybersecurity #programming #programmers #coding #coders #Windows #Microsoft #Google #php,2899,0.0,1.0,0.0,0.0,2021-07-21 10:30:44
behave yourself Chrome #infosec #cybersecurity #programming #programmers #coding #coders #Windows #Microsoft,676,0.0,1.0,0.0,0.0,2021-07-21 10:30:42
Creatively WILD Art Studio #Google #thingstodoinbrooklyn #artclassesinbrooklyn,356,0.0,0.706,0.294,0.3612,2021-07-21 10:30:21
Let manage your Social Media Optimisation while you Focus Productivity Check out Our Services,1070,0.0,0.833,0.167,0.3818,2021-07-21 10:30:10
tips navigate and explore safely with Google Maps #Google,1660,0.0,0.714,0.286,0.4939,2021-07-21 10:28:13
Navigate new normals with Google Maps #Google,1660,0.0,1.0,0.0,0.0,2021-07-21 10:28:13
Users can now leave more detailed restaurant reviews Google Read more here #SEO #SEM,42,0.085,0.915,0.0,-0.0516,2021-07-21 10:24:18
SAF Rent Car Lahore #Google,224,0.0,1.0,0.0,0.0,2021-07-21 10:24:03
Creatively WILD Art Studio #Google #BROOKLYNTODDLERS #Toddlerlife,356,0.0,0.706,0.294,0.3612,2021-07-21 10:22:58
Very interesting #Apple #innovation #Google #Amazon #Microsoft #AI #ArtificialIntelligence #Facebook #Cloud #ecommerc,1017,0.0,0.786,0.214,0.4576,2021-07-21 10:21:08
With over billion active users #Android the most widely used operating system worldwide While the itsel,1839,0.0,0.847,0.153,0.4019,2021-07-21 10:20:19
#infographic The Most Innovative Companies via #Apple #inn,91623,0.0,0.687,0.313,0.4927,2021-07-21 10:19:52
Very interesting #Apple #innovation #Google #Amazon #Microsoft #AI #ArtificialIntelligence #Facebook #Cloud,91623,0.0,0.77,0.23,0.4576,2021-07-21 10:19:49
Navigate new normals with Google Maps via #digitalmarketing #Google #SEO,6780,0.0,1.0,0.0,0.0,2021-07-21 10:19:34
Besides #Google there are many other #search engines the #market here are these best search engines search,130,0.0,0.792,0.208,0.6369,2021-07-21 10:17:51
French Authorities fined Google million #Law #Latest #LatestLaws #LegalNews #India #IndianNews #News #Legal,13202,0.0,1.0,0.0,0.0,2021-07-21 10:16:35
Creatively WILD Art Studio #Google #BEGINNERARTCLASSES #artforteens,356,0.0,0.706,0.294,0.3612,2021-07-21 10:15:47
