tweet,follower_count,neg,neu,pos,compound,time
LATEST REVIEW Five Stars Dylan Aifantis MOSMAN Fit Physio Sports Physiotherapy amp Massage Mosman,689,0.0,0.839,0.161,0.3612,2021-06-17 00:26:47
Discover This New Click Software That Creates Profit Pulling Ads Which Turns Into Every Single Day https,625,0.0,0.75,0.25,0.6124,2021-06-17 00:26:36
Google using design its next generation chips #MachineLearning #DataScience,8498,0.0,1.0,0.0,0.0,2021-06-17 00:26:29
Google using design its next generation chips #MachineLearning #DataScience,16556,0.0,1.0,0.0,0.0,2021-06-17 00:26:24
Google Lifts Crypto Ban CityCoins amp Miami Borderless Capital Fund Algorand Circle USDC WATCH,0,0.217,0.783,0.0,-0.5574,2021-06-17 00:26:00
Summer Camp Week use check out code FLASHSALE for OFF Summer Camp #Google #pasadena,14,0.0,1.0,0.0,0.0,2021-06-17 00:25:51
Google Page Experience algorithm update starting roll out now and will completed the end August via,192,0.0,1.0,0.0,0.0,2021-06-17 00:24:00
Usually issues like this gets resolves but man customer service really crappy This the,302,0.275,0.566,0.159,-0.6416,2021-06-17 00:22:58
#NewRelease BOUND RING amp SECRET Warm funny heartbreaking amazing story #Kindle,6700,0.161,0.376,0.462,0.6808,2021-06-17 00:22:57
Today grade watched video about what like work #Google Then coded our own moving goo,1203,0.0,0.848,0.152,0.3612,2021-06-17 00:20:56
#Apple amp #Google revealed upgrades for their phones that protect data and reduce reliance the cloud also bin,254,0.0,0.867,0.133,0.3818,2021-06-17 00:20:36
Technical SEO alert you need know this #Google ranks pages not websites order get your page indexed should,9314,0.0,0.885,0.115,0.296,2021-06-17 00:20:10
Technical SEO alert you need know this #Google ranks pages not websites order get your page indexed should,160,0.0,0.885,0.115,0.296,2021-06-17 00:18:21
Sign below Every ticket #payment #AI #ArtificiallIntelligence #techno #Entreprene,618,0.0,1.0,0.0,0.0,2021-06-17 00:15:49
Note User Experience Research src Google course #raydasnotes #coursera #Google DaysOfCode #womenintech,1127,0.0,1.0,0.0,0.0,2021-06-17 00:15:12
Court Appeal #Judgment #Defamation#viclaw #auslaw #google Defteros Google LLC,2120,0.0,1.0,0.0,0.0,2021-06-17 00:15:06
Keep mind many consumers will now skip right over #Google Yahoo when conducting search and instead use,1969,0.0,1.0,0.0,0.0,2021-06-17 00:15:03
Note User Experience Research src Google course #raydasnotes #coursera #Google DaysOfCode #womenintech,5806,0.0,1.0,0.0,0.0,2021-06-17 00:14:47
Sign below every invested ticket #payment #AI #ArtificiallIntelligence #techno #En,618,0.0,1.0,0.0,0.0,2021-06-17 00:13:58
#Anker #Car Charger Metal Dual USB #Car Charger Adapter PowerDrive III Port Alloy for Galaxy,194,0.0,1.0,0.0,0.0,2021-06-17 00:13:08
#Google #Gmail #unifiedinterface and #GoogleChat launches for everyone #GoogleDocs,24700,0.0,1.0,0.0,0.0,2021-06-17 00:13:03
Note User Experience Research src Google course #raydasnotes #coursera #Google DaysOfCode #womenintech,1201,0.0,1.0,0.0,0.0,2021-06-17 00:11:51
Google Limit Page Indexing For One Site Matt Southern #Google,4571,0.0,1.0,0.0,0.0,2021-06-17 00:11:05
#AIRTEETH #VERIFIED #GOOGLE,21512,0.0,1.0,0.0,0.0,2021-06-17 00:10:26
Climbing New Heights has been haven for climbers West Virginia since When the pandemic hit Chris and owner Jordy,4765,0.0,1.0,0.0,0.0,2021-06-17 00:10:17
#AIRTEETH #VERIFIED #GOOGLE,11197,0.0,1.0,0.0,0.0,2021-06-17 00:09:56
launch probe Google and Apple Duopoly #duopoly #monopoly #google #apple #uk,366,0.0,1.0,0.0,0.0,2021-06-17 00:07:52
This morning explored the #FinancialLiteracy world #Minecraft Students have make decisions,39,0.0,1.0,0.0,0.0,2021-06-17 00:05:05
Google Workspace and Google Chat are officially available everybody,10,0.0,1.0,0.0,0.0,2021-06-17 00:05:03
Suite users can choose language their preference Find out how change language default language settings,3252,0.0,1.0,0.0,0.0,2021-06-17 00:05:02
Angela Nwalie Educational Services Inc #Google #WritingCommunity,18401,0.0,1.0,0.0,0.0,2021-06-17 00:04:23
Angela Nwalie Educational Services Inc #Google Happy June Friends #WritingCommunity #writer,18401,0.0,0.57,0.43,0.7783,2021-06-17 00:04:13
Brave Search may present challenge Google Preview new privacy first search engine that respects publishers and,205,0.0,0.65,0.35,0.7184,2021-06-17 00:04:01
Covid speeding things executives say they have embraced digital enablers like artificial intelligence,1237,0.0,0.663,0.337,0.6808,2021-06-17 00:03:59
Covid speeding things executives say they have embraced digital enablers like artificial intelligence,969,0.0,0.663,0.337,0.6808,2021-06-17 00:03:08
Help boost our ratings Leave review below want hear from you #citylabsinc #students #summer,16,0.067,0.559,0.374,0.6705,2021-06-17 00:03:03
Very cool Google and Boston Children teaming identify places with limited access COVID vaccines #Google,6824,0.109,0.743,0.148,0.1761,2021-06-17 00:02:31
Very cool Google and Boston Children teaming identify places with limited access COVID vaccines,29235,0.115,0.728,0.157,0.1761,2021-06-17 00:02:29
easy feat Google health vice president David Feinberg said doesn feel pressure produce revenue but,29235,0.097,0.785,0.118,0.09,2021-06-17 00:02:07
Cell Phone Stand Phone Stand for Desk Adjustable Cell Phone Stand Cradle Dock Phone Stand Tablet Stand Holder,194,0.0,1.0,0.0,0.0,2021-06-17 00:02:04
Covid speeding things executives say they have embraced digital enablers like artificial intellige,29235,0.0,0.828,0.172,0.3612,2021-06-17 00:01:26
Brave Search may present challenge Google Preview new privacy first search engine that respects publishers and,453,0.0,0.65,0.35,0.7184,2021-06-17 00:01:14
Hey #Developers make sure read latest article Web Campaign from Google Forms Enga,53347,0.0,0.839,0.161,0.3182,2021-06-17 00:00:30
launch probe Google and Apple Duopoly #duopoly #monopoly #google #apple #uk,7061,0.0,1.0,0.0,0.0,2021-06-17 00:00:11
Regaloshoppe Festive Gifts Wedding Decors #Google,41,0.0,0.625,0.375,0.4588,2021-06-16 23:58:56
Check out this new photograph that uploaded #Seattle #GreatWheel,15000,0.0,1.0,0.0,0.0,2021-06-16 23:57:53
Sleepy Hollow Hostel #Google,154,0.0,1.0,0.0,0.0,2021-06-16 23:56:34
Sleepy Hollow Hostel #Google,154,0.0,1.0,0.0,0.0,2021-06-16 23:56:07
you search Google Maps for locations #Gaza Strip won give you names contrary illegal settlements #Google,448,0.169,0.657,0.174,0.0258,2021-06-16 23:55:24
#NewRelease BOUND RING amp SECRET Warm funny heartbreaking amazing story #Kindle,2712,0.161,0.376,0.462,0.6808,2021-06-16 23:53:24
#NewRelease BOUND RING amp SECRET Warm funny heartbreaking amazing story #Kindle,33287,0.161,0.376,0.462,0.6808,2021-06-16 23:52:55
#NewRelease BOUND RING amp SECRET Warm funny heartbreaking amazing story #Kindle,18401,0.161,0.376,0.462,0.6808,2021-06-16 23:52:25
This morning explored the #FinancialLiteracy world #Minecraft Students have make decisions,48038,0.0,1.0,0.0,0.0,2021-06-16 23:51:09
#NewRelease BOUND RING amp SECRET Warm funny heartbreaking amazing story #Kindle,3278,0.161,0.376,0.462,0.6808,2021-06-16 23:49:56
#MOOD #HappyMidweek Loves #SherylDenise #VoiceActor #Actor #VoiceOverArtist #Writer #Choreographer,634,0.0,0.684,0.316,0.5719,2021-06-16 23:49:38
Top #YouTube #Video Maker #Tools #Google #Vlog #youtubevideo #videoeditor #Features #YouTuber #contentmarketing,1126,0.0,0.859,0.141,0.2023,2021-06-16 23:49:00
out both simple framework for plotting your cloud migration #GCP #Google #Perspecti,1237,0.0,1.0,0.0,0.0,2021-06-16 23:48:58
This morning explored the #FinancialLiteracy world #Minecraft Students have make decisions,78567,0.0,1.0,0.0,0.0,2021-06-16 23:48:53
#Google #GoogleTool Establish Yourself Brand Google tools Help Marketers Succeed,3203,0.0,0.576,0.424,0.7096,2021-06-16 23:48:00
Crawl stats powerful report within Google Search Console though not accessible from within the main inte,71,0.0,0.843,0.157,0.4215,2021-06-16 23:47:32
Entermission Melbourne Virtual Reality Escape Rooms #Google,110,0.0,0.779,0.221,0.1779,2021-06-16 23:45:38
#June Coup #EURO #Trump #blackkpopstans #dax #SkeemSaam #StarTrekPicard #imgxnct #sunrise #muftiazizurrehman,191,0.0,1.0,0.0,0.0,2021-06-16 23:45:35
Don ask #Google ask your #localrealtor Call for answers all your #realestate questio,54,0.0,1.0,0.0,0.0,2021-06-16 23:45:03
#Google #AdSense #Policy #Change Verify Every New Site Blog How and Why #easkme #gauravkumar #googleadsense #makemoney,120,0.0,1.0,0.0,0.0,2021-06-16 23:45:01
How many times have you used Google check your spelling #spelling #Google #words #checkspelling #search,183,0.0,1.0,0.0,0.0,2021-06-16 23:45:01
#Google #AdSense #Policy #Change Verify Every New Site Blog How and Why #easkme #gauravkumar #googleadsense,48945,0.0,1.0,0.0,0.0,2021-06-16 23:44:35
Whoot Whoot Adriel certified Google Premier Partner The badge given partners who have successfully,247,0.0,0.802,0.198,0.4939,2021-06-16 23:43:00
After horrible birthday did retail therapy whole set clothes and awesome little piece technolog,884,0.179,0.612,0.209,0.1531,2021-06-16 23:42:35
Google Dorking have just completed this room Check out #tryhackme #osint #google,131,0.0,1.0,0.0,0.0,2021-06-16 23:42:19
Google now betting photo realistic full scale volumetric videos with audio and sensorial perception that will make,1098,0.0,1.0,0.0,0.0,2021-06-16 23:42:01
Mandao Returns now available Google Play Watch now Jay Mandao amp his friends astral project back time sav,1110,0.0,0.744,0.256,0.6705,2021-06-16 23:41:18
#Google Hates #Optimization How When and Where Here #On Page Optimization Techniques that Google Hates,48945,0.284,0.588,0.127,-0.4939,2021-06-16 23:41:03
mistaken Have our medical records already been given #Google,695,0.238,0.762,0.0,-0.3612,2021-06-16 23:40:34
you search Google Maps for locations #Gaza Strip won give you names contrary illegal settlements #Google,10,0.169,0.657,0.174,0.0258,2021-06-16 23:39:58
#JavaScript Fetch queries can add value #SEO they can used pull related information into page These are cra,1021,0.0,0.876,0.124,0.34,2021-06-16 23:37:56
How activate and use #Google #Chat via,8662,0.0,1.0,0.0,0.0,2021-06-16 23:35:25
BREAKING Let Hear for the #Mets and Get Frank About the #Yanks Smashes Things,5795,0.0,1.0,0.0,0.0,2021-06-16 23:35:02
Hey GOOGLE Put Palestine the map #FreePalestine #GazaUnderAttack #EndApartheid #EthnicCleansing,23,0.0,1.0,0.0,0.0,2021-06-16 23:34:55
Google using design its next generation chips #MachineLearning #DataScience,391,0.0,1.0,0.0,0.0,2021-06-16 23:34:52
Google using design its next generation chips #MachineLearning #DataScience,1494,0.0,1.0,0.0,0.0,2021-06-16 23:34:49
Google using design its next generation chips #MachineLearning #DataScience,4766,0.0,1.0,0.0,0.0,2021-06-16 23:34:48
Google using design its next generation chips #MachineLearning #DataScience,781,0.0,1.0,0.0,0.0,2021-06-16 23:34:47
Google using design its next generation chips #MachineLearning #DataScience,2551,0.0,1.0,0.0,0.0,2021-06-16 23:34:44
When the Pixel coming out Desperately need upgrade #pixel #Google,23,0.224,0.776,0.0,-0.3818,2021-06-16 23:34:05
#JavaScript Fetch queries can add value #SEO they can used pull related information into page These are cra,2399,0.0,0.876,0.124,0.34,2021-06-16 23:33:39
#JavaScript Fetch queries can add value #SEO they can used pull related information into page These are cra,2853,0.0,0.876,0.124,0.34,2021-06-16 23:33:33
#JavaScript Fetch queries can add value #SEO they can used pull related information into page These are cra,581,0.0,0.876,0.124,0.34,2021-06-16 23:33:27
#JavaScript Fetch queries can add value #SEO they can used pull related information into page These are,180,0.0,0.87,0.13,0.34,2021-06-16 23:33:22
Ever wondered why recently Google runs Online Outdoor banners and Ads Check this out,0,0.0,1.0,0.0,0.0,2021-06-16 23:31:21
Top #YouTube #Video Maker #Tools #Google #Vlog #youtubevideo #videoeditor #Features #YouTuber,248,0.0,0.847,0.153,0.2023,2021-06-16 23:30:00
This one sounds like bad urban legend but true Due budget constraints don forget even the founders,548,0.2,0.564,0.236,0.2144,2021-06-16 23:29:44
DigitalChamber #eCommerce #Hardware #Google #googlestore #NewYork look inside Google first store opening,1769,0.0,1.0,0.0,0.0,2021-06-16 23:28:35
The Oracle called after made this calculation You might have new Blue Pro driver stars,7,0.0,1.0,0.0,0.0,2021-06-16 23:27:47
look inside #Google first store opening NYC Chelsea neighborhood tomorrow,13,0.0,1.0,0.0,0.0,2021-06-16 23:27:39
look inside #Google first store opening NYC Chelsea neighborhood tomorrow,13,0.0,1.0,0.0,0.0,2021-06-16 23:27:38
look inside #Google first store opening NYC Chelsea neighborhood tomorrow,10,0.0,1.0,0.0,0.0,2021-06-16 23:27:33
look inside Google first store opening NYC Chelsea neighborhood tomorrow #googlestore #newyorkcity #Google,7557,0.0,1.0,0.0,0.0,2021-06-16 23:27:24
look inside #Google first store opening NYC Chelsea neighborhood tomorrow,11955,0.0,1.0,0.0,0.0,2021-06-16 23:27:04
Google using design its next generation chips #MachineLearning #DataScience,16637,0.0,1.0,0.0,0.0,2021-06-16 23:26:56
Google using design its next generation chips #MachineLearning #DataScience,36044,0.0,1.0,0.0,0.0,2021-06-16 23:26:46
How Use Keywords Correctly Main Criteria this Subtle Art,470,0.0,1.0,0.0,0.0,2021-06-16 23:26:19
Google using design its next generation chips #MachineLearning #DataScience,391,0.0,1.0,0.0,0.0,2021-06-16 23:26:12
Google using design its next generation chips #MachineLearning #DataScience,1494,0.0,1.0,0.0,0.0,2021-06-16 23:26:02
Google using design its next generation chips #MachineLearning #DataScience,1564,0.0,1.0,0.0,0.0,2021-06-16 23:26:01
the link #Google,372,0.0,1.0,0.0,0.0,2021-06-16 23:25:52
you search Google Maps for locations #Gaza Strip won give you names contrary illegal settlements #Google,2296,0.169,0.657,0.174,0.0258,2021-06-16 23:25:03
ENE TRENDS #Google,1,0.0,1.0,0.0,0.0,2021-06-16 23:24:17
Check out this new photograph that uploaded #Beach #Woman #Dress,5721,0.0,1.0,0.0,0.0,2021-06-16 23:23:28
The more accessible Google technology the more empower people build their own solutions Sarah Sirajuddin engineer,779,0.0,0.898,0.102,0.1779,2021-06-16 23:20:07
Paid Organic Website Traffic Pros amp Cons #Google #SEO #PPC #SEM #PayPerClick #PPCChat #PP,3712,0.0,1.0,0.0,0.0,2021-06-16 23:19:08
The platform not accepting feedbacks How give feedback for anything working #Google,38,0.166,0.834,0.0,-0.2924,2021-06-16 23:16:31
#FREE #eBook #Google Play via,43187,0.0,0.625,0.375,0.34,2021-06-16 23:16:15
#FREE #eBook #Google Play via,4766,0.0,0.625,0.375,0.34,2021-06-16 23:15:30
California Hospice And Palliative Care Association #Google,33,0.0,0.652,0.348,0.4939,2021-06-16 23:15:20
#Google enables end end #encryption for #Android default SMS RCS app #HITB,12904,0.0,1.0,0.0,0.0,2021-06-16 23:15:09
June buy #oneplus #device #smoothos #oneplus tpro #neversettle #beyondthespeed,116,0.0,1.0,0.0,0.0,2021-06-16 23:15:01
GNS Party Rentals #Google,7,0.0,0.526,0.474,0.4019,2021-06-16 23:14:37
Technical SEO alert you need know this #Google ranks pages not websites order get your page indexed should,149,0.0,0.885,0.115,0.296,2021-06-16 23:14:04
The owner for the domain getting charged monthly basis but the account does not show any billing,38,0.08,0.92,0.0,-0.1027,2021-06-16 23:13:52
Pay Per Click Ads Strategies for Jewellery store #google #online #Jewellery,7958,0.123,0.877,0.0,-0.1027,2021-06-16 23:13:35
fuck #youtube censoring song lyrics adult fuck #google for treating everyone like kids who dont know any better #Ihateyoutube,25,0.35,0.557,0.093,-0.7849,2021-06-16 23:12:53
What Alt Text for Images Alternative text describes the content and the context image website page,517,0.0,1.0,0.0,0.0,2021-06-16 23:11:04
Technical SEO alert you need know this #Google ranks pages not websites order get your page indexed should,2,0.0,0.885,0.115,0.296,2021-06-16 23:10:41
The admin has provided access developer profile for account and still unable create develop,38,0.0,0.861,0.139,0.2732,2021-06-16 23:10:28
Mandao Returns now available Google Play Watch now Jay Mandao amp his friends astral project back time sav,6798,0.0,0.744,0.256,0.6705,2021-06-16 23:09:25
Threat hxxp encrypt microsoftonlinems com ExcelSession zip #phishing #opendir #google,190,0.274,0.726,0.0,-0.5267,2021-06-16 23:08:55
Cherry Hill Garage Door #Google,169,0.0,1.0,0.0,0.0,2021-06-16 23:06:32
Check out this new photograph that uploaded #Beach #Woman #Dress,1696,0.0,1.0,0.0,0.0,2021-06-16 23:06:27
Fresno All Star Credit Repair #Google,41,0.0,0.658,0.342,0.3818,2021-06-16 23:05:43
great now attracted #TRUSTWALLET scammers with #GOOGLE form asking for private keys,626,0.0,0.592,0.408,0.7845,2021-06-16 23:05:38
you want hear and chat with one half this award winning team join online with next week #aiwales,310,0.0,0.559,0.441,0.8757,2021-06-16 23:04:48
#mobile #health #mhealth #app #available for #download #google #playstore,33,0.0,1.0,0.0,0.0,2021-06-16 23:04:33
#Google abandons #URL shortening #Chrome via,564,0.315,0.685,0.0,-0.3182,2021-06-16 23:03:53
Interesting Now #Google has its own physical store,961,0.0,0.722,0.278,0.4019,2021-06-16 23:02:46
This song has been stuck head for years and couldn figure out the song #google #humtosearch feature,777,0.111,0.889,0.0,-0.25,2021-06-16 23:02:28
#Amazon blocking #Google #FLoC #web #tracking system #privacy #walledgardens,958,0.245,0.755,0.0,-0.3818,2021-06-16 23:01:18
latest mini project for client Saudi Arabia #Flutter #Firebase DaysOfCoding #MobileApp #Google #PlayStore #Coup,15023,0.0,1.0,0.0,0.0,2021-06-16 23:00:47
Mandao Returns now available Google Play Watch now Jay Mandao amp his friends astral project back time,10100,0.0,0.732,0.268,0.6705,2021-06-16 23:00:33
you connecting your website the different #Google website tools you going want use the Google,141,0.0,0.915,0.085,0.0772,2021-06-16 23:00:01
latest mini project for client Saudi Arabia #Flutter #Firebase DaysOfCoding #MobileApp #Google #PlayStore #Coup,1238,0.0,1.0,0.0,0.0,2021-06-16 22:58:57
Google has announced its generation tensor processing units TPUs which the company claims can complete #AI and,241,0.0,1.0,0.0,0.0,2021-06-16 22:58:26
Youre not helping #Google XRP QNT ALGO HBAR SHIB,35,0.191,0.809,0.0,-0.2235,2021-06-16 22:57:02
ARV Furniture Ontario Ltd #Google,3339,0.0,1.0,0.0,0.0,2021-06-16 22:55:28
Google the internet #google #googl #goog #stock #market #tech #technology #epic #internet #monster,208,0.0,1.0,0.0,0.0,2021-06-16 22:53:46
#NewRelease BOUND RING amp SECRET Warm funny heartbreaking amazing story #Kindle,24295,0.161,0.376,0.462,0.6808,2021-06-16 22:53:18
#FREE #eBook #Google Play #bookaddict #MustRead #IndieAuthor #ian #BookCommunity https,4818,0.0,0.789,0.211,0.34,2021-06-16 22:53:00
Happen #NewYorkCity tomorrow Stop the very first physical #Google retail store #technology #travel GOOGL,202,0.145,0.855,0.0,-0.296,2021-06-16 22:52:59
latest mini project for client Saudi Arabia #Flutter #Firebase DaysOfCoding #MobileApp #Google #PlayStore #Coup,5806,0.0,1.0,0.0,0.0,2021-06-16 22:52:45
#NewRelease BOUND RING amp SECRET Warm funny heartbreaking amazing story #Kindle,69894,0.161,0.376,0.462,0.6808,2021-06-16 22:52:39
Google Messages end end encryption rolling out all Android users Read more #technology,95,0.0,1.0,0.0,0.0,2021-06-16 22:52:36
Wow #Apple #Google #Visa #Mastercard #Huuuuge TEL,67,0.0,0.612,0.388,0.5859,2021-06-16 22:52:29
latest mini project for client Saudi Arabia #Flutter #Firebase DaysOfCoding #MobileApp #Google #PlayStore #Coup,1506,0.0,1.0,0.0,0.0,2021-06-16 22:52:12
latest mini project for client Saudi Arabia #Flutter #Firebase DaysOfCoding #MobileApp #Google,58,0.0,1.0,0.0,0.0,2021-06-16 22:52:07
almost everyone uses Google does that make public utility Thursday daily brief #speak #google #screen,2488,0.0,1.0,0.0,0.0,2021-06-16 22:50:16
Google PageSpeed Insights Adds Partial Field Data #commons #creative #data #google #present #seo via,2488,0.0,1.0,0.0,0.0,2021-06-16 22:49:11
Check out this new photograph that uploaded #Beach #Woman #Dress,1439,0.0,1.0,0.0,0.0,2021-06-16 22:48:39
Katy Pet Nannies #Google,62,0.0,1.0,0.0,0.0,2021-06-16 22:48:27
Researchers find #Google serves nearly half all traffic fake news sites,3257,0.237,0.763,0.0,-0.4767,2021-06-16 22:45:03
Finally Core Web Vitals guide that includes common issues and how solve them too you score well already,1449,0.0,0.714,0.286,0.6124,2021-06-16 22:42:02
VIDEO Christiana Manzocco Interim Lead Start Alberta discusses the new world class database that has been,3201,0.0,1.0,0.0,0.0,2021-06-16 22:41:47
The Factory #Google,107,0.0,1.0,0.0,0.0,2021-06-16 22:40:13
didn know #Google searched about #skulls Now are even more excited pair #Black #titanium with #Pea,16175,0.0,0.848,0.152,0.4005,2021-06-16 22:37:09
Boost your #Google #rank top #SEOeStore offers full #SEO campaigns start from,406,0.0,0.69,0.31,0.5423,2021-06-16 22:35:34
The Factory #Google,107,0.0,1.0,0.0,0.0,2021-06-16 22:34:49
#FREE #eBook #Google Play #bookaddict #MustRead #IndieAuthor #ian #BookCommunity https,8239,0.0,0.789,0.211,0.34,2021-06-16 22:34:39
The Factory #Google,107,0.0,1.0,0.0,0.0,2021-06-16 22:32:22
#AIRTEETH #VERIFIED #GOOGLE,24327,0.0,1.0,0.0,0.0,2021-06-16 22:31:14
easy feat Google health vice president David Feinberg said doesn feel pressure produce revenue but,80,0.097,0.785,0.118,0.09,2021-06-16 22:31:14
For those who need Card name Ears wide open MORE INFO #redmoontarot #june,80,0.0,1.0,0.0,0.0,2021-06-16 22:31:04
The Factory #Google,107,0.0,1.0,0.0,0.0,2021-06-16 22:30:47
#SEO Tip Make sure that your important keywords have high keyword density your pages #google #bing #yahoo,347,0.0,0.785,0.215,0.4767,2021-06-16 22:30:45
Google Wifi Mesh WiFi System Wifi Router Coverage #Google #Wifi,4426,0.0,1.0,0.0,0.0,2021-06-16 22:30:05
#FREE #eBook #Google Play #bookaddict #MustRead #IndieAuthor #ian #BookCommunity https,16435,0.0,0.789,0.211,0.34,2021-06-16 22:28:49
The Factory #Google,107,0.0,1.0,0.0,0.0,2021-06-16 22:28:24
GLIZZY Cake Music Video via #Google Play #On Facebook,31,0.0,0.769,0.231,0.34,2021-06-16 22:27:24
you search Google Maps for locations #Gaza Strip won give you names contrary illegal settlements #Google,2,0.169,0.657,0.174,0.0258,2021-06-16 22:26:41
Check out PHULL video #TikTok #THE MUSIC #TheChi #GooglePlay #GH #Google #TikTokviral #writers,2554,0.0,1.0,0.0,0.0,2021-06-16 22:25:54
#FREE #eBook #Google Play #bookaddict #MustRead #IndieAuthor #ian #BookCommunity https,9656,0.0,0.789,0.211,0.34,2021-06-16 22:25:46
out both simple framework for plotting your cloud migration #GCP #Google,222,0.0,1.0,0.0,0.0,2021-06-16 22:25:01
#FREE #eBook #Google Play #bookaddict #MustRead #IndieAuthor #ian #BookCommunity https,14594,0.0,0.789,0.211,0.34,2021-06-16 22:23:52
Google What Can Say #google #googl #stock #tech #internet #goog #technology #epic #monster,208,0.0,1.0,0.0,0.0,2021-06-16 22:23:46
didn know #Google searched about #skulls Now are even more excited pair #Black #titanium with,1240,0.0,0.839,0.161,0.4005,2021-06-16 22:22:52
you know that why You Should Never Use #Google #Chrome Your #iPhone #iPad #Mac #InformationSecurity #Privac,16556,0.0,1.0,0.0,0.0,2021-06-16 22:20:51
#AIRTEETH #VERIFIED #GOOGLE,272,0.0,1.0,0.0,0.0,2021-06-16 22:20:08
#Google #Apple #Microsoft #Facebook ehhh but the Business Model selling Data for stop using,497,0.177,0.823,0.0,-0.4215,2021-06-16 22:19:26
Hey lost chromecast remote can borrow one for few #ask #Google,18,0.187,0.813,0.0,-0.3182,2021-06-16 22:18:43
Please don make #google the top shareholders each Surely they are not,162,0.0,0.562,0.438,0.7184,2021-06-16 22:17:55
Important What You Need Know Now About #Google Core Web Vitals #SocialSavvy,2002,0.0,0.719,0.281,0.4404,2021-06-16 22:17:42
Pet Directory Services #Google,83,0.0,1.0,0.0,0.0,2021-06-16 22:17:38
#Ohio sues #Google claiming tech giant should public utility While amusing and the argument probably fil,875,0.131,0.733,0.136,0.0258,2021-06-16 22:17:12
AMP will not requirement rank the Top Stories carousel and Google will retire the AMP icon Here what all,49,0.0,0.909,0.091,0.2023,2021-06-16 22:16:03
#NewRelease BOUND RING amp SECRET Warm funny heartbreaking amazing story #Kindle,15357,0.161,0.376,0.462,0.6808,2021-06-16 22:15:13
How much you REALLY know about your website #content Are people who use #Google search engine finding your,1488,0.0,1.0,0.0,0.0,2021-06-16 22:13:16
you like Learn How Using The Softwares listed below ranked Virgin Google Business Listing the pack,626,0.0,0.857,0.143,0.3612,2021-06-16 22:11:18
#google Lens Arrives #sony Xperia Camera #app Smart Text Selection Real Time,4854,0.0,0.803,0.197,0.4019,2021-06-16 22:10:43
#Google #Apple #Microsoft #Facebook ehhh but the Business Model selling Data for stop using,2496,0.177,0.823,0.0,-0.4215,2021-06-16 22:09:57
#Google #Apple #Microsoft #Facebook ehhh but the Business Model selling Data for,12,0.0,1.0,0.0,0.0,2021-06-16 22:09:51
Yes current #steampunk #wip using French German Italian Japanese Chinese and Apache,4687,0.0,0.803,0.197,0.4019,2021-06-16 22:09:26
New WebExtensions Community Group aims standardize browser extensions #Microsoft #Google,624,0.0,1.0,0.0,0.0,2021-06-16 22:08:02
#NewRelease BOUND RING amp SECRET Warm funny heartbreaking amazing story #Kindle,3726,0.161,0.376,0.462,0.6808,2021-06-16 22:07:59
mistaken Have our medical records already been given #Google,402,0.238,0.762,0.0,-0.3612,2021-06-16 22:07:39
LIVE stream this week shapes brand content for the year Some will emerge pop culture WATCH EVENT,1486,0.0,1.0,0.0,0.0,2021-06-16 22:07:12
Happen #NewYorkCity tomorrow Stop the very first physical #Google retail store #technology #travel GOOGL,2675,0.145,0.855,0.0,-0.296,2021-06-16 22:05:10
mistaken Have our medical records already been given #Google,28077,0.238,0.762,0.0,-0.3612,2021-06-16 22:05:08
#Google searches old,3316,0.0,1.0,0.0,0.0,2021-06-16 22:03:07
#Google searches old,3316,0.0,1.0,0.0,0.0,2021-06-16 22:03:04
