tweet,follower_count,neg,neu,pos,compound,time
Why does #google insist pushing #Bloatware our devices almost daily,8,0.0,1.0,0.0,0.0,2021-06-16 22:02:45
Why does #google insist pushing #Bloatware our devices almost daily,28,0.0,1.0,0.0,0.0,2021-06-16 22:02:39
LIVE stream this week shapes brand content for the year Some will emerge pop culture WATCH EVENT,2071,0.0,1.0,0.0,0.0,2021-06-16 22:02:03
Why does #google insist pushing #Bloatware our devices almost daily,357,0.0,1.0,0.0,0.0,2021-06-16 22:02:00
LIVE stream this week shapes brand content for the year Some will emerge pop culture WATCH EVENT,480,0.0,1.0,0.0,0.0,2021-06-16 22:01:56
After topping banks Google Pay signs another via #geektech,112,0.149,0.851,0.0,-0.1027,2021-06-16 22:00:14
#Google Geofence Warrants Endanger Privacy Judges Now See The Threat,265,0.274,0.726,0.0,-0.5267,2021-06-16 22:00:00
GUARANTEED PAGE ONE SEARCH Business Keyword Portals our Network Largest Keyword Network World Read our Guarantee,2437,0.0,0.882,0.118,0.25,2021-06-16 21:59:29
LIVE stream this week shapes brand content for the year Some will emerge pop culture WATCH EVENT,145,0.0,1.0,0.0,0.0,2021-06-16 21:57:09
LIVE stream this week shapes brand content for the year Some will emerge pop culture WATCH EVENT,188,0.0,1.0,0.0,0.0,2021-06-16 21:55:11
Watford Gymnastics Club #Google,2833,0.0,1.0,0.0,0.0,2021-06-16 21:54:42
want our fundamental right #privacy #Big needs out the earth #Microsoft #Google #Facebook and #Apple,196,0.0,0.915,0.085,0.0772,2021-06-16 21:54:39
Happen #NewYorkCity tomorrow Stop the very first physical #Google retail store #technology #travel,44466,0.155,0.845,0.0,-0.296,2021-06-16 21:54:39
The stage set microphones checked preparations are iron clad foremost media tech firm ForeMedia group meet Mic,588,0.0,1.0,0.0,0.0,2021-06-16 21:53:58
you search Google Maps for locations #Gaza Strip won give you names contrary illegal settlements #Google,669,0.169,0.657,0.174,0.0258,2021-06-16 21:53:27
small business owner know that most small business owners don have the capital invest the new enterpri,7525,0.0,1.0,0.0,0.0,2021-06-16 21:53:19
This week compare Suite Office see which suite should your business use Read,415,0.0,1.0,0.0,0.0,2021-06-16 21:51:45
While don know all the ways impacts search looking Google patents can help understand what Google algorith,208,0.0,0.856,0.144,0.4019,2021-06-16 21:50:43
#NewRelease BOUND RING amp SECRET Warm funny heartbreaking amazing story #Kindle,19093,0.161,0.376,0.462,0.6808,2021-06-16 21:50:14
AMP will not requirement rank the Top Stories carousel and Google will retire the AMP icon Here what all,4023,0.0,0.909,0.091,0.2023,2021-06-16 21:50:03
Critical Defense Group #Google,139,0.397,0.345,0.259,-0.2023,2021-06-16 21:49:21
small business owner know that most small business owners don have the capital invest the new enter,1408,0.0,1.0,0.0,0.0,2021-06-16 21:48:33
The era third party #cookies will end when #Google Chrome pulls the plug them but that doesn mean,387,0.0,0.902,0.098,0.2144,2021-06-16 21:48:20
Atlanta Home Listings #Google,282,0.0,1.0,0.0,0.0,2021-06-16 21:46:14
Tom Dixon REALTOR Team Dixon Keller Williams Realty #Google,111,0.0,1.0,0.0,0.0,2021-06-16 21:44:22
Critical Defense Group #Google,139,0.397,0.345,0.259,-0.2023,2021-06-16 21:44:13
Seen advertising News today #AgePartnership #Tui #AppealHomeShading #Motability #Haus,1462,0.0,1.0,0.0,0.0,2021-06-16 21:43:59
Wyze Lock adds long awaited support for Google Assistant latest software update #Google,1834,0.074,0.743,0.182,0.3818,2021-06-16 21:42:36
#Google Innovatively Wealthy That People Users Should Able Paste Photos Within GLOBAL Search,49,0.0,0.828,0.172,0.3612,2021-06-16 21:41:04
VIDEO Nigel Istvanffy tell the epiphany that lead Kettera from square foot matrix hanging his wal,3201,0.0,1.0,0.0,0.0,2021-06-16 21:40:31
Android Smart notification center widget almost ready allows read full notification text dismiss,126,0.0,0.692,0.308,0.6003,2021-06-16 21:40:30
Control your Beliefs via #podcasting #business #instagram #google #google #help,32,0.0,1.0,0.0,0.0,2021-06-16 21:40:20
BUSINESS NEWS BRIEFS for today Lead story French sporting goods retailer Decathlon opening Southcentre Mall,3201,0.0,1.0,0.0,0.0,2021-06-16 21:40:07
Never #Google,301,0.0,1.0,0.0,0.0,2021-06-16 21:39:28
Sick #Facebook and #Google making Billions selling your #Data ADS the solution and you get,2127,0.177,0.699,0.124,-0.25,2021-06-16 21:37:57
The best phone buy right now #google,1761,0.0,0.588,0.412,0.6369,2021-06-16 21:36:23
Known GMB Issues amp What About Them June via #search #team #business,2488,0.0,1.0,0.0,0.0,2021-06-16 21:36:13
Still only get like years guaranteed support from most makers #Android #Google #Samsung,3147,0.0,0.679,0.321,0.6369,2021-06-16 21:35:59
#Google announced the introduction new artificial intelligence tools help fight against range spam Learn,969,0.244,0.478,0.278,0.1779,2021-06-16 21:31:41
don trust #Google and #privacy don hand hand,151,0.0,0.34,0.66,0.8658,2021-06-16 21:31:19
#Google announced the introduction new artificial intelligence tools help fight against range spam Learn,9382,0.244,0.478,0.278,0.1779,2021-06-16 21:30:51
#Google adds RCS encryption Messages emoji mashup suggests and more for #Android,12144,0.0,1.0,0.0,0.0,2021-06-16 21:30:23
Technical SEO alert you need know this #Google ranks pages not websites order get your page indexed should,92,0.0,0.885,0.115,0.296,2021-06-16 21:29:40
VIDEO Barbara Lawlor CEO Baker Real Estate discusses Canada hot pre construction condo market,3201,0.0,1.0,0.0,0.0,2021-06-16 21:29:34
Android making the ADID that users can opt out Read more about what marketers need know about this change,7528,0.0,1.0,0.0,0.0,2021-06-16 21:26:58
GUARANTEED PAGE ONE SEARCH Business Keyword Portals our Network Largest Keyword Network World Read our Guarantee,2689,0.0,0.882,0.118,0.25,2021-06-16 21:26:26
Phoenix Black Hoodie Ted Phoenix Heroes #Google,610,0.0,0.645,0.355,0.5106,2021-06-16 21:26:23
Develop your own website for #Website #seo #google #amazon #workfromhome #hosting #We,3,0.0,1.0,0.0,0.0,2021-06-16 21:25:04
Navigating #HybridWork with single connected experience #GoogleWorkspace has never been easier with the recent #Google,1237,0.143,0.857,0.0,-0.3252,2021-06-16 21:23:58
What new with Google Cloud #GCP #Google #GoogleWorkspace #InsideGoogleCloud,1237,0.0,1.0,0.0,0.0,2021-06-16 21:23:57
Android making the ADID that users can opt out Read more about what marketers need know about this change,2854,0.0,1.0,0.0,0.0,2021-06-16 21:23:45
seems like Google was only yesterday but Google has already announced new features coming Android later,11149,0.0,0.896,0.104,0.1901,2021-06-16 21:23:07
Phoenix Ted Phoenix Heroes #Google,610,0.0,0.548,0.452,0.5106,2021-06-16 21:23:03
Galvan Real Estate and Services #Google,28805,0.0,1.0,0.0,0.0,2021-06-16 21:21:02
Lord Malloren TEMPTING FORTUNE BESTSELL Beverley #Romance #Regency #ebook #Google,61894,0.0,1.0,0.0,0.0,2021-06-16 21:19:38
Google Still Dominates Advertiser Perceptions SSP Report But The Field Has Toughened,894,0.0,0.816,0.184,0.0644,2021-06-16 21:19:18
Looking for Social login your Prestashop store Well have covered you miniOrange provides you Social Login,58,0.0,0.877,0.123,0.2732,2021-06-16 21:19:04
Google new features open opportunities for visibility Here how optimize your content for Google News Top Stories,148,0.0,0.648,0.352,0.765,2021-06-16 21:19:04
#DevOps has evolved over the years and become integral part the way organizations function #development #managemen,1238,0.0,1.0,0.0,0.0,2021-06-16 21:18:56
LIVE stream this week shapes brand content for the year Some will emerge pop culture WATCH EVENT,238,0.0,1.0,0.0,0.0,2021-06-16 21:18:45
Ditch Google Chrome for something better Linux #Google #Chrome #Linux,4631,0.0,0.756,0.244,0.4404,2021-06-16 21:17:43
#Apple and #Google investigated competition body,554,0.0,1.0,0.0,0.0,2021-06-16 21:17:20
Are you magnesium silicate iron hydroxide #Google Hehe sure hope,334,0.0,0.606,0.394,0.6369,2021-06-16 21:16:38
#DevOps has evolved over the years and become integral part the way organizations function #development #managemen,147,0.0,1.0,0.0,0.0,2021-06-16 21:15:54
Best SEO Extensions for Google Chrome Boost Website Rankings Click Here #Google #GoogleChrom,6,0.0,0.615,0.385,0.7845,2021-06-16 21:15:40
Watford Gymnastics Club #Google,145,0.0,1.0,0.0,0.0,2021-06-16 21:15:29
Technical SEO alert you need know this #Google ranks pages not websites order get your page indexed should,148,0.0,0.885,0.115,0.296,2021-06-16 21:15:05
Google Ditches AMP Badge Search will not requirement rank the Top Stories carousel anymore and,800,0.0,0.886,0.114,0.2023,2021-06-16 21:15:04
#Google Chrome phasing out third party cookies the name user privacy How will this impact your,1752,0.0,0.847,0.153,0.4019,2021-06-16 21:15:02
June buy #oneplus #device #smoothos #oneplus tpro #neversettle #beyondthespeed,116,0.0,1.0,0.0,0.0,2021-06-16 21:15:02
Life Wave Buzz #Google,3135,0.0,1.0,0.0,0.0,2021-06-16 21:14:30
Google Still Dominates Advertiser Perceptions SSP Report But The Field Has Toughened,32,0.0,0.816,0.184,0.0644,2021-06-16 21:13:04
#Holofuel currency that pays hosts for the hosting power they provide #Holochain apps that need serve mainstream,86,0.0,1.0,0.0,0.0,2021-06-16 21:12:49
Technical SEO alert you need know this #Google ranks pages not websites order get your page indexed should,376,0.0,0.885,0.115,0.296,2021-06-16 21:12:29
How Next Gen will reignite the travel industry #Google #Think,5073,0.0,1.0,0.0,0.0,2021-06-16 21:12:08
Congratulations her confirmation commissioner and nomination chair Khan has shown her,21935,0.0,0.719,0.281,0.5994,2021-06-16 21:10:02
Big news Google Page Experience update officially underway Changes will take place through August Learn mor,185,0.0,1.0,0.0,0.0,2021-06-16 21:10:00
Splitting hard House reps proposed legislation aimed reining the country biggest tech companie,196,0.104,0.896,0.0,-0.1027,2021-06-16 21:08:04
How Next Gen will reignite the travel industry #Google #Think,1227,0.0,1.0,0.0,0.0,2021-06-16 21:07:41
Please boycott #tommyhilfiger #ZARA #twitch who owned,3,0.24,0.521,0.24,0.0,2021-06-16 21:07:02
Ironically using will not help you with tonight #Google #trivia quiz #nocheating Test your search engin,300,0.131,0.869,0.0,-0.3089,2021-06-16 21:01:27
you search Google Maps for locations #Gaza Strip won give you names contrary illegal settlements #Google,13,0.169,0.657,0.174,0.0258,2021-06-16 21:01:15
Join and Let talk Jamboard Alice Keeler Part with,29309,0.0,0.784,0.216,0.296,2021-06-16 21:00:51
Who say what happened with #YazidiWomen just #google for the YAZIDI Kidnapped Women #YazidiPlight #SearchForYazidisInMo,2694,0.0,1.0,0.0,0.0,2021-06-16 21:00:29
#Google using #AI design processors that run more efficiently #Artificial,180,0.0,0.75,0.25,0.4576,2021-06-16 21:00:05
#google doing this bull shit Again,98,0.419,0.581,0.0,-0.5574,2021-06-16 21:00:05
Google Doesn Rank Pages Different From Posts Find out here #Google #GoogleRanking #Googlebot,44,0.0,1.0,0.0,0.0,2021-06-16 21:00:00
Our team solely focused helping underrepresented founders grow their businesses and succeed space,1128,0.0,0.556,0.444,0.7906,2021-06-16 20:59:42
#Google using #AI design processors that run more efficiently #Artificial,30074,0.0,0.75,0.25,0.4576,2021-06-16 20:59:41
Intelligent Authentication What and How Can Help #technology #business #mobile #tacoma #google #blockchain,1829,0.0,0.659,0.341,0.6908,2021-06-16 20:57:57
#Google opening its Workspace feature all users around the world even those without corporate accoun,1087,0.0,1.0,0.0,0.0,2021-06-16 20:57:52
Intelligent Authentication What and How Can Help #technology #business #mobile #tacoma #google #blockchain,4168,0.0,0.659,0.341,0.6908,2021-06-16 20:57:28
Intelligent Authentication What and How Can Help #technology #business #mobile #tacoma #google #blockchain,1563,0.0,0.659,0.341,0.6908,2021-06-16 20:57:28
Intelligent Authentication What and How Can Help #technology #business #mobile #tacoma #google #blockchain,581,0.0,0.659,0.341,0.6908,2021-06-16 20:57:28
Intelligent Authentication What and How Can Help #technology #business #mobile #tacoma #google,8919,0.0,0.637,0.363,0.6908,2021-06-16 20:57:23
worked #AI for decades This flaw #Google system shocked Fast Company,59981,0.187,0.813,0.0,-0.3182,2021-06-16 20:57:00
Chances are you use some sort Google account you ever wonder how much data Google collecting from your account,2320,0.0,0.909,0.091,0.2023,2021-06-16 20:56:59
Google Strategies for Jewellery Business #google #advertising #Jewellery,7959,0.0,1.0,0.0,0.0,2021-06-16 20:55:45
Thank you Linda for the wonderful review Google are always happy read that helped relieve patien,20,0.0,0.492,0.508,0.9081,2021-06-16 20:55:03
#NewRelease BOUND RING amp SECRET Warm funny heartbreaking amazing story #Kindle,24100,0.161,0.376,0.462,0.6808,2021-06-16 20:54:35
Join Steve Scott take look #Google Analytics shiny new toy and discover whether good choice for,233,0.0,0.733,0.267,0.6249,2021-06-16 20:54:00
#seo job update your #website copyright date the footer small #google ranking factor but factor nonetheless,7525,0.0,1.0,0.0,0.0,2021-06-16 20:52:36
Referral Commissions For Life Get Paid Connect amp Socialize #Facebook #Instagram,1449,0.0,1.0,0.0,0.0,2021-06-16 20:52:14
Our team solely focused helping underrepresented founders grow their businesses and succeed,19177,0.0,0.529,0.471,0.7906,2021-06-16 20:51:34
American Cancer Association #Google,948,0.595,0.405,0.0,-0.6597,2021-06-16 20:51:12
Join Veterans Raffle and help support our veteran projects around the Phoenix Heroes #Google,610,0.0,0.478,0.522,0.872,2021-06-16 20:50:15
#Ohio Attorney General Dave #Yost filed #lawsuit asking the #court declare #Google #public #utility whi,128,0.0,1.0,0.0,0.0,2021-06-16 20:49:02
Google using design its next generation chips #MachineLearning #DataScience #Pytho,1237,0.0,1.0,0.0,0.0,2021-06-16 20:48:58
Episode Available Now Welcome Delicate Dominance First Dates Intro and some Talking Episode OTW,1053,0.0,0.647,0.353,0.6124,2021-06-16 20:48:38
Google using design its next generation chips #MachineLearning #DataScience #Pytho,1828,0.0,1.0,0.0,0.0,2021-06-16 20:47:56
#seo job update your #website copyright date the footer small #google ranking factor but factor nonetheless,725,0.0,1.0,0.0,0.0,2021-06-16 20:47:43
Google using design its next generation chips #MachineLearning #DataScience #Pytho,1564,0.0,1.0,0.0,0.0,2021-06-16 20:47:39
Google using design its next generation chips #MachineLearning #DataScience #Pytho,4766,0.0,1.0,0.0,0.0,2021-06-16 20:47:39
Google using design its next generation chips #MachineLearning #DataScience #Pytho,781,0.0,1.0,0.0,0.0,2021-06-16 20:47:35
Google using design its next generation chips #MachineLearning #DataScience #Pytho,2551,0.0,1.0,0.0,0.0,2021-06-16 20:47:34
This bring your notice June #stylevelly constantly doing Google and looting people,29,0.0,1.0,0.0,0.0,2021-06-16 20:46:56
LVMH signs unprecedented partnership with Google Cloud #LVMH #LVMHxGoogleCloud #Google #GoogleClo,40782,0.0,1.0,0.0,0.0,2021-06-16 20:46:24
Phoenix Heroes Authorised dealer for Powapacs Products Phoenix Heroes #Google,610,0.0,0.548,0.452,0.765,2021-06-16 20:45:37
Phoenix Heroes Authorised dealer for Powapacs Products Phoenix Heroes #Google,610,0.0,0.548,0.452,0.765,2021-06-16 20:44:19
Are corporate interests always more important than workers rights #Google #Microsoft #Facebook amp many more ended,27,0.0,0.774,0.226,0.4754,2021-06-16 20:43:54
Phoenix Heroes Authorised dealer for Powapacs Products Phoenix Heroes #Google,610,0.0,0.548,0.452,0.765,2021-06-16 20:42:57
top storage challenges based StackExchange records processed through the new text,12761,0.0,0.744,0.256,0.2732,2021-06-16 20:42:46
Join and Let talk Jamboard Alice Keeler Part with,7081,0.0,0.784,0.216,0.296,2021-06-16 20:40:44
Amazon Blocking Google FLoC Could Seriously Weaken Fledgling System #data #digital #google #hotels,517,0.399,0.506,0.096,-0.6597,2021-06-16 20:40:37
Covid speeding things executives say they have embraced digital enablers like artificial intelligence,1717,0.0,0.663,0.337,0.6808,2021-06-16 20:40:19
LIVE stream this week shapes brand content for the year Some will emerge pop culture WATCH EVENT,208,0.0,1.0,0.0,0.0,2021-06-16 20:39:32
Google new features open opportunities for visibility Here how optimize your content for Google News Top Stories,674,0.0,0.648,0.352,0.765,2021-06-16 20:38:12
Eyebrows amp More Tahira #Google,22,0.0,1.0,0.0,0.0,2021-06-16 20:37:58
Pros debate picking one stock between Amazon and Alphabet #Amazon #Alphabet #Google #Jefferies #StockMarketNews,1652,0.0,0.884,0.116,0.1779,2021-06-16 20:37:25
data drill downs for increasing ecommerce products sales via #Google #Analytics via,4605,0.0,1.0,0.0,0.0,2021-06-16 20:36:01
and discuss Will The Real Martian Please Stand and whether not the bus driver would,1347,0.0,0.859,0.141,0.3182,2021-06-16 20:35:44
Great discuss the way which #GoogleWorkspace tools can aid communication schools Great tips from the lovely,577,0.0,0.52,0.48,0.9186,2021-06-16 20:35:26
Covid speeding things executives say they have embraced digital enablers like artificial intelligence,3735,0.0,0.663,0.337,0.6808,2021-06-16 20:34:57
Great opportunity learn all about the future Google AMP project Join the incredible special guest and,16827,0.0,0.504,0.496,0.8957,2021-06-16 20:34:44
Johans Safe Abortion Clinic #Google,752,0.0,0.58,0.42,0.4404,2021-06-16 20:34:38
How activate and use Google Chat #Google,3344,0.0,1.0,0.0,0.0,2021-06-16 20:33:33
Covid speeding things executives say they have embraced digital enablers like artificial intellige,80,0.0,0.828,0.172,0.3612,2021-06-16 20:33:08
#google #publicutility #commoncarrier says yes Find out why,19,0.0,0.722,0.278,0.4019,2021-06-16 20:31:14
#Apple and #Google investigated competition body,7786,0.0,1.0,0.0,0.0,2021-06-16 20:30:42
How Google indexes passages page and what means for #SEO via #google #SearchEngineOptimization,179,0.0,1.0,0.0,0.0,2021-06-16 20:30:40
FLoC the privacy scapegoat Ethan Elshyeb #ITNEXT #Google google #Tag #Tagslug #Privacy privacy,3757,0.184,0.816,0.0,-0.4019,2021-06-16 20:30:07
#innovation #creativity #technology #design #Apps #applewallet #ApplePay #Google #Coinbase #Cryptocurency,1237,0.0,1.0,0.0,0.0,2021-06-16 20:30:00
#Apple and #Google investigated competition body,90341,0.0,1.0,0.0,0.0,2021-06-16 20:29:26
Sportsman Warehouse hldg #facebook #youtube #twitter #tiktok #music #socialmedia,391,0.0,1.0,0.0,0.0,2021-06-16 20:27:47
Paid Organic Website Traffic Pros amp Cons #Google #SEO #PPC #SEM #PayPerClick #PPCChat #PP,213827,0.0,1.0,0.0,0.0,2021-06-16 20:27:44
Ooh Google Tests Refinement Bubbles People Also Ask #SEO #Google,3861,0.0,1.0,0.0,0.0,2021-06-16 20:27:00
Self driving car pioneer Waymo gets fuel ambitions ##Google #AutonomousVehicle #Minivan,169,0.0,1.0,0.0,0.0,2021-06-16 20:26:48
anthony fineran diane agent #google #art,7,0.0,1.0,0.0,0.0,2021-06-16 20:25:25
Technical SEO alert you need know this #Google ranks pages not websites order get your page indexed should,912,0.0,0.885,0.115,0.296,2021-06-16 20:25:11
What new with Google Cloud #GCP #Google #GoogleWorkspace #InsideGoogleCloud,222,0.0,1.0,0.0,0.0,2021-06-16 20:25:02
Yeap #Switzerland according #google #royalconnectionhour,3877,0.0,1.0,0.0,0.0,2021-06-16 20:24:48
Join and Let talk Jamboard Alice Keeler Part with,6675,0.0,0.784,0.216,0.296,2021-06-16 20:24:10
you search Google Maps for locations #Gaza Strip won give you names contrary illegal settlements #Google,850,0.169,0.657,0.174,0.0258,2021-06-16 20:24:02
Maybe know France Germany was yesterday #royalconnectionhour wait second will #google,3877,0.0,1.0,0.0,0.0,2021-06-16 20:24:00
Google Messages end end encryption rolling out all Android users Read more #technology,647,0.0,1.0,0.0,0.0,2021-06-16 20:23:54
Technical SEO alert you need know this #Google ranks pages not websites order get your page indexed should,510,0.0,0.885,0.115,0.296,2021-06-16 20:23:54
Best Novel Deal #twitter #tiktok #music #facebook #socialmedia #whatsapp #google #photograp,391,0.0,0.581,0.419,0.7579,2021-06-16 20:23:48
Check out this job from Think Caffee Culture Pvt Ltd TCC Cafe Attendant,24,0.0,1.0,0.0,0.0,2021-06-16 20:23:18
Slimming World Stamford and Wittering #Google,115,0.0,1.0,0.0,0.0,2021-06-16 20:23:04
Join and Let talk Jamboard Alice Keeler Part with,40328,0.0,0.784,0.216,0.296,2021-06-16 20:23:01
Google just got sassy with told stop and that did not ask for play some song said,4,0.22,0.78,0.0,-0.5,2021-06-16 20:22:45
The Verge Father Day Gift Guide #google,1761,0.0,0.674,0.326,0.4404,2021-06-16 20:21:51
Google using design its next generation chips #MachineLearning #DataScience,496,0.0,1.0,0.0,0.0,2021-06-16 20:21:48
Google using design its next generation chips #MachineLearning #DataScience,4766,0.0,1.0,0.0,0.0,2021-06-16 20:21:38
Google using design its next generation chips #MachineLearning #DataScience,781,0.0,1.0,0.0,0.0,2021-06-16 20:21:34
Google using design its next generation chips #MachineLearning #DataScience,136,0.0,1.0,0.0,0.0,2021-06-16 20:21:24
Return investment going CRAZY Thank you Eat Clean LLC #marketing #marketingdigital #marketingtips #marketingo,1879,0.171,0.545,0.284,0.2656,2021-06-16 20:21:03
Sick #Facebook and #Google making Billions selling your #Data ADS the solution and you get,923,0.177,0.699,0.124,-0.25,2021-06-16 20:20:49
Learn object oriented programming principles creating your own text based adventure game #Python Supported,678,0.0,0.618,0.382,0.7003,2021-06-16 20:20:27
Lavine Extended Care Benefits Advisor #Google,1262,0.0,0.408,0.592,0.7003,2021-06-16 20:20:26
Sick #Facebook and #Google making Billions selling your #Data ADS the solution and you get,497,0.177,0.699,0.124,-0.25,2021-06-16 20:19:50
Are corporate interests always more important than workers rights #Google #Microsoft #Facebook amp many more,5149,0.0,0.761,0.239,0.4754,2021-06-16 20:19:48
#nasdaq #huawei #google #amazon The way things are Google and amazon can face stiff competition from Huawei Mob,0,0.0,0.909,0.091,0.1779,2021-06-16 20:17:46
#Holofuel currency that pays hosts for the hosting power they provide #Holochain apps that need serve mainstream,47979,0.0,1.0,0.0,0.0,2021-06-16 20:17:33
Sick #Facebook and #Google making Billions selling your #Data ADS the solution and you get,575,0.177,0.699,0.124,-0.25,2021-06-16 20:16:55
#NewRelease BOUND RING amp SECRET Warm funny heartbreaking amazing story #Kindle,35953,0.161,0.376,0.462,0.6808,2021-06-16 20:16:40
Western Skies Golf Club #Google,88,0.0,1.0,0.0,0.0,2021-06-16 20:16:34
Always keep your blog updated with fresh content Visit and get #good quality post for your,244,0.0,0.867,0.133,0.3182,2021-06-16 20:16:22
you search Google Maps for locations #Gaza Strip won give you names contrary illegal settlements #Google,1507,0.169,0.657,0.174,0.0258,2021-06-16 20:16:17
Leafed Washable Kraft Paper Vegan Faux Leather Alternative Craft Supplies #Google,1,0.0,1.0,0.0,0.0,2021-06-16 20:15:12
Core Web Vitals are new ranking factors #Google seems pretty excited about CWV focus user experience spec,1752,0.0,0.645,0.355,0.7717,2021-06-16 20:15:03
Sick #Facebook and #Google making Billions selling your #Data ADS the solution and you get,2496,0.177,0.699,0.124,-0.25,2021-06-16 20:14:47
Sick #Facebook and #Google making Billions selling your #Data ADS the solution and you,989,0.187,0.682,0.131,-0.25,2021-06-16 20:14:41
Have you ever tried learning code #ProgrammingHub #Certificate #programming #app #python #javascript #webdevelopment,690,0.0,1.0,0.0,0.0,2021-06-16 20:14:13
June buy #oneplus #device #smoothos #oneplus tpro #neversettle #beyondthespeed,116,0.0,1.0,0.0,0.0,2021-06-16 20:14:03
nailed this Good Evil analogy #Google #BigTech #SiliconValley,556,0.331,0.451,0.218,-0.3612,2021-06-16 20:13:58
LVMH signs unprecedented partnership with Google Cloud #LVMH #LVMHxGoogleCloud #Google,3790,0.0,1.0,0.0,0.0,2021-06-16 20:13:29
first ever physical store here Take look #retail #retailnews #google #storedesign,16351,0.0,1.0,0.0,0.0,2021-06-16 20:12:59
CISA suggests using blockers fend off malvertising #cybersecurity #security #privacy #networksecurity #privacy,174,0.0,1.0,0.0,0.0,2021-06-16 20:12:41
About head into consulting meeting and all had stop admire the amazing lobby area #msp #mspartners,115,0.099,0.541,0.36,0.7003,2021-06-16 20:12:24
One #SEO projects #digitalmarketing #google,46,0.0,1.0,0.0,0.0,2021-06-16 20:12:10
#chipdesign #techjobs #Google #consequences First came for the layout engineers and did not speak because,61,0.0,1.0,0.0,0.0,2021-06-16 20:11:00
CISA suggests using blockers fend off malvertising #cybersecurity #security #privacy #networksecurity #privacy #malwar,1563,0.0,1.0,0.0,0.0,2021-06-16 20:09:51
#Google #Search Console New Features,21,0.0,1.0,0.0,0.0,2021-06-16 20:09:16
Business owners this #free event tomorrow that you won want miss Secret #Google #Tools You Didn Know,1893,0.078,0.68,0.243,0.5267,2021-06-16 20:09:03
Order Now #LenovoFlex #Laptop #TouchDisplay #Processor #RadeonGraphics #DigitalPen,528,0.0,1.0,0.0,0.0,2021-06-16 20:08:50
#NewRelease BOUND RING amp SECRET Warm funny heartbreaking amazing story #Kindle,5116,0.161,0.376,0.462,0.6808,2021-06-16 20:08:24
you search Google Maps for locations #Gaza Strip won give you names contrary illegal settlements #Google,1096,0.169,0.657,0.174,0.0258,2021-06-16 20:08:05
CISA suggests using blockers fend off malvertising #cybersecurity #security #privacy #networksecuri,1828,0.0,1.0,0.0,0.0,2021-06-16 20:07:54
Shampoo Avenue #Google,314,0.0,1.0,0.0,0.0,2021-06-16 20:07:30
VIDEO Tegan Hill Economist with the Fraser Institute discusses introducing savings account for Alberta resou,3201,0.0,1.0,0.0,0.0,2021-06-16 20:07:24
CISA suggests using blockers fend off malvertising #cybersecurity #security #privacy #networksecurity #privacy,1564,0.0,1.0,0.0,0.0,2021-06-16 20:07:17
