tweet,follower_count,neg,neu,pos,compound,time
#google name today for fun didn realize had many fans that love #jokes #solodev #toma,1416,0.0,0.634,0.366,0.8176,2021-05-14 19:30:49
business people doing marketing not the other way around care about business outcome New Clients New Reven,6148,0.0,0.833,0.167,0.4939,2021-05-14 19:30:13
Can relate #consumers #programming #coding #code #software #softwaredevelopment #business #tech #mobileapps #mobileap,148,0.0,1.0,0.0,0.0,2021-05-14 19:29:46
Can relate #consumers #programming #coding #code #software #softwaredevelopment #business #tech #mobileapps #mobileap,2212,0.0,1.0,0.0,0.0,2021-05-14 19:29:36
Check out Gig #Fiverr design awesome #google #banners Adwords display #ads,960,0.0,0.709,0.291,0.6249,2021-05-14 19:29:27
DevOps the Federal Government What Means and How Can Help #google #video #amazon daysofcode #infosec #devops,353,0.0,0.847,0.153,0.4019,2021-05-14 19:29:25
DevOps the Federal Government What Means and How Can Help #google #video #amazon daysofcode #infosec #devops,3831,0.0,0.847,0.153,0.4019,2021-05-14 19:29:18
DevOps the Federal Government What Means and How Can Help #google #video #amazon daysofcode #infosec,8829,0.0,0.838,0.162,0.4019,2021-05-14 19:29:13
ISRO amp MapmyIndia build alternative Google Maps #ISRO India answer #NASA #MapmyIndia that,364,0.0,1.0,0.0,0.0,2021-05-14 19:27:16
The Google world account Stay tuned #Google #Alphabet #YouTube #GoogleEarth #Constellatio,8,0.0,1.0,0.0,0.0,2021-05-14 19:26:59
This interesting Pixel After years Android finally getting its own iPhone PhoneArena #GooglePixel,269,0.0,0.816,0.184,0.4019,2021-05-14 19:26:24
Presenting #FirstSignalMovie latest press release #TheWhiteHouse #President #SciFi #PoliticalThriller,3189,0.0,1.0,0.0,0.0,2021-05-14 19:25:04
Kai Travel Services #Google,55,0.0,1.0,0.0,0.0,2021-05-14 19:25:00
The news comes after five months internal turmoil sparked #Google firing both leaders its ethics divisio,300,0.259,0.741,0.0,-0.5994,2021-05-14 19:24:57
Sono great products SUING #GOOGLE GOOG too for theft Just remember the great company and chip mak,172,0.113,0.559,0.328,0.7482,2021-05-14 19:24:47
Open Letter Honorable Premier Jason Kenney Alberta Canada amp Energy Industry Leaders from Krishnan Suthanthira,1368,0.0,0.699,0.301,0.6808,2021-05-14 19:23:06
#starlink teams with google #google governing council #hederahashgraph #hbar #HelloFuture,8,0.0,1.0,0.0,0.0,2021-05-14 19:22:57
The news comes after five months internal turmoil sparked #Google firing both leaders its ethics divisio,197,0.259,0.741,0.0,-0.5994,2021-05-14 19:21:31
business people doing marketing not the other way around care about business outcome New Clients New Reven,1807,0.0,0.833,0.167,0.4939,2021-05-14 19:21:27
Alhamdulillah the full series the Qur anic Sciences now available #Youtube ads,615,0.0,1.0,0.0,0.0,2021-05-14 19:20:44
Which you prefer #android #iphone #ios #samsung #smartphone #apple #tech #pro #technology #mobile,6,0.0,1.0,0.0,0.0,2021-05-14 19:20:28
business people doing marketing not the other way around care about business outcome New Clients New,39,0.0,0.824,0.176,0.4939,2021-05-14 19:20:00
Google files legal brief protect work program for immigrant spouses #Google,3350,0.0,0.687,0.313,0.4767,2021-05-14 19:19:20
These extensions EAD are basic needs force immigrants into Servitude leading Suppression,65,0.0,1.0,0.0,0.0,2021-05-14 19:15:45
According #Google site speed crucial ranking factor But how exactly does affect rankings Check out,1679,0.0,1.0,0.0,0.0,2021-05-14 19:15:03
Even more Matter #IoT #apple #amazon #google,3047,0.0,0.812,0.188,0.101,2021-05-14 19:14:54
The New #Google Nest can recognize your face and trak your movement #Innovation #IoT #AI #FacialRecogn,16,0.0,1.0,0.0,0.0,2021-05-14 19:14:50
#starlink teams with google #google governing council #hederahashgraph #hbar #HelloFuture,0,0.0,1.0,0.0,0.0,2021-05-14 19:14:38
Italian authorities fine Google million for Android Auto issue that already solved #google,1637,0.0,0.738,0.262,0.4404,2021-05-14 19:14:11
#starlink teams with google #google governing council #hederahashgraph #hbar #HelloFuture,100,0.0,1.0,0.0,0.0,2021-05-14 19:13:28
Alhamdulillah the full series the Qur anic Sciences now available #Youtube ads,2393,0.0,1.0,0.0,0.0,2021-05-14 19:11:26
The new partnership aims help Starlink customers better reach Google cloud services #google,9143,0.0,0.599,0.401,0.6908,2021-05-14 19:11:14
Kai Travel Services #Google,55,0.0,1.0,0.0,0.0,2021-05-14 19:11:00
New PowerBI Course English Build Amazing Dashboards and take your work the next level,3898,0.0,0.774,0.226,0.5859,2021-05-14 19:10:27
#DowJones Gains Rally Continues #Google Stock Offers Buy Point #Apple Retakes Key Level GOOGL AAPL,2033,0.0,0.854,0.146,0.34,2021-05-14 19:10:18
Even more Matter #IoT #apple #amazon #google,7482,0.0,0.812,0.188,0.101,2021-05-14 19:08:48
DaysOfCode daysofcodechallenge #Progress Day All about embedded structs declaration and usage also checke,8626,0.0,1.0,0.0,0.0,2021-05-14 19:07:59
not joking #Google #MILL,256,0.357,0.643,0.0,-0.1695,2021-05-14 19:07:55
LET HIM #religious #god #AnimalCrossing #mondaythoughts #Google #nature #lifestyle #Video #movies #bbcan #Vtuber #love,3551,0.0,1.0,0.0,0.0,2021-05-14 19:07:52
How Report False Information Facebook Google and Every Other Social App #PARENTALCONTRO,5736,0.0,1.0,0.0,0.0,2021-05-14 19:07:33
New PowerBI Course English Build Amazing Dashboards and take your work the next level,1146,0.0,0.774,0.226,0.5859,2021-05-14 19:06:23
Who Want Ask About Google #AdSense Feel Free Ask Any Question You Have #AdSense #Google #Ads Limited,2999,0.093,0.683,0.224,0.4019,2021-05-14 19:06:14
Friday business and entrepreneur resource Learn how create one stop shop for all your business videos with,138,0.114,0.777,0.109,-0.0258,2021-05-14 19:05:18
New PowerBI Course English Build Amazing Dashboards and take your work the next level,155,0.0,0.774,0.226,0.5859,2021-05-14 19:05:05
How Report False Information Facebook Google and Every Other Social App #PARENTALCONTRO,6155,0.0,1.0,0.0,0.0,2021-05-14 19:05:04
How Report False Information Facebook Google and Every Other Social App,607,0.0,1.0,0.0,0.0,2021-05-14 19:04:36
DaysOfCode daysofcodechallenge #Progress Day All about embedded structs declaration and usage also checke,1510,0.0,1.0,0.0,0.0,2021-05-14 19:04:24
DaysOfCode daysofcodechallenge #Progress Day All about embedded structs declaration and usage also checke,651,0.0,1.0,0.0,0.0,2021-05-14 19:04:09
DaysOfCode daysofcodechallenge #Progress Day All about embedded structs declaration and usage also checke,353,0.0,1.0,0.0,0.0,2021-05-14 19:04:04
DaysOfCode daysofcodechallenge #Progress Day All about embedded structs declaration and usage also checke,1267,0.0,1.0,0.0,0.0,2021-05-14 19:04:01
DaysOfCode daysofcodechallenge #Progress Day All about embedded structs declaration and usage also checke,3831,0.0,1.0,0.0,0.0,2021-05-14 19:03:59
DaysOfCode daysofcodechallenge #Progress Day All about embedded structs declaration and usage also checke,1422,0.0,1.0,0.0,0.0,2021-05-14 19:03:59
DaysOfCode daysofcodechallenge #Progress Day All about embedded structs declaration and usage also checke,4612,0.0,1.0,0.0,0.0,2021-05-14 19:03:56
DaysOfCode daysofcodechallenge #Progress Day All about embedded structs declaration and usage also,125,0.0,1.0,0.0,0.0,2021-05-14 19:03:54
The news comes after five months internal turmoil sparked #Google firing both leaders its ethics divisio,285,0.259,0.741,0.0,-0.5994,2021-05-14 19:03:23
Google Analytics Will Track Data Without Cookies via #marketing #google #analytics,1048,0.0,1.0,0.0,0.0,2021-05-14 19:03:09
#Google searches old,3334,0.0,1.0,0.0,0.0,2021-05-14 19:03:04
Google Analytics Will Track Data Without Cookies via #marketing #google #analytics,3898,0.0,1.0,0.0,0.0,2021-05-14 19:02:41
Google Analytics Will Track Data Without Cookies via #marketing #google #analytics,327598,0.0,1.0,0.0,0.0,2021-05-14 19:01:21
#SEO Tip Avoid changing the name the this way you lose links and Pagerank #google #bing #web,360,0.246,0.754,0.0,-0.5994,2021-05-14 19:00:56
Google putting end Third Party Cookies But before you celebrate the end web tracking they are repla,1,0.0,0.685,0.315,0.7845,2021-05-14 19:00:53
Day DaysOfCode Learned dart basics fuctions and types #flutterdev #flutter #dart #google,592,0.0,1.0,0.0,0.0,2021-05-14 19:00:24
The Core Elements Ranking Google #onlinelearning #education #Google #SEO #BusinessOwners,3011,0.0,1.0,0.0,0.0,2021-05-14 18:59:53
Achelois Wellness Massage #Google,380,0.0,0.508,0.492,0.4404,2021-05-14 18:59:45
These extensions EAD are basic needs force immigrants into Servitude leading Suppression,34,0.0,1.0,0.0,0.0,2021-05-14 18:59:23
write ready publish #Google friendly website content for agencies and marketers Everything you need from,12653,0.0,0.695,0.305,0.6908,2021-05-14 18:59:16
Kai Travel Services #Google,55,0.0,1.0,0.0,0.0,2021-05-14 18:59:00
just Who why Why this thing #vulture #google,25,0.0,1.0,0.0,0.0,2021-05-14 18:58:48
#starlink teams with google #google governing council #hederahashgraph #hbar #HelloFuture,25,0.0,1.0,0.0,0.0,2021-05-14 18:58:44
#Reviews #Camera #Google Pixel leaked renders reveal huge camera speed bump,418,0.169,0.662,0.169,0.0,2021-05-14 18:58:39
Google joins other tech companies support the work visas for immigrant spouses Indiablooms First Portal,18421,0.0,0.838,0.162,0.4019,2021-05-14 18:57:50
The Cats Made #Google,390,0.0,1.0,0.0,0.0,2021-05-14 18:57:29
Day DaysOfCode Learned dart basics fuctions and types #flutterdev #flutter #dart #google,1510,0.0,1.0,0.0,0.0,2021-05-14 18:57:24
Day DaysOfCode Learned dart basics fuctions and types #flutterdev #flutter #dart #google,11106,0.0,1.0,0.0,0.0,2021-05-14 18:56:51
Day DaysOfCode Learned dart basics fuctions and types #flutterdev #flutter #dart #google,199,0.0,1.0,0.0,0.0,2021-05-14 18:56:18
Dear WOMEN Please Security Conscious study published the Journal General Psychology contended that #Googl,257,0.0,0.601,0.399,0.743,2021-05-14 18:56:09
love hbar #hederahashgraph #google #cloud #spacex,101,0.0,0.543,0.457,0.6369,2021-05-14 18:55:57
Join Direct Booking Masterclass Monday May EST for Ways Maximize Direct Bookings,6148,0.0,0.833,0.167,0.296,2021-05-14 18:55:47
Leaked renders reveal even more affordable Samsung phone from #google,227,0.204,0.796,0.0,-0.3182,2021-05-14 18:54:33
How organizers plan make the Olympics happen #facebook #instagram #youtube #twitter,779,0.0,1.0,0.0,0.0,2021-05-14 18:53:31
Well after the gardener cut through the internet cable now have the internet back and running the,457,0.109,0.781,0.109,0.0,2021-05-14 18:53:21
Six Useful Google Search Operators https,50885,0.0,0.633,0.367,0.4404,2021-05-14 18:52:18
CartersCollectablesUK #Google #CCUK,1539,0.0,1.0,0.0,0.0,2021-05-14 18:51:46
Nothing fills greater sense resignation than messages from #google that Gmail almost full like what the,3471,0.221,0.666,0.114,-0.2705,2021-05-14 18:51:00
How many you use Safari prefer over Chrome for the simple reason CPU thankful But would definitely like,157,0.0,0.621,0.379,0.8462,2021-05-14 18:50:48
now Google news #Google #news TOKA Google News via,6433,0.0,1.0,0.0,0.0,2021-05-14 18:49:54
Willow Tree Home Health Care #Google,374,0.0,0.61,0.39,0.4939,2021-05-14 18:49:50
Mathesul Invisalign Invisible Braces Orthodontic Dental Implant Clinic #Google,627,0.0,1.0,0.0,0.0,2021-05-14 18:49:15
Check out Gig #Fiverr design awesome #google #banners Adwords display #ads,206,0.0,0.709,0.291,0.6249,2021-05-14 18:49:06
How many you use Safari prefer over Chrome for the simple reason CPU thankful But would definite,202,0.0,0.75,0.25,0.6124,2021-05-14 18:48:44
Mathesul Invisalign Invisible Braces Orthodontic Dental Implant Clinic #Google,627,0.0,1.0,0.0,0.0,2021-05-14 18:48:07
Nothing fills greater sense resignation than messages from #google that Gmail almost full like what the,27547,0.221,0.666,0.114,-0.2705,2021-05-14 18:47:28
this episode visit with Kate Biberdorf aka along with Christian artist influencer podcaster,675,0.0,1.0,0.0,0.0,2021-05-14 18:47:12
love #google but these guys plant trees for every search ciao ciao,1967,0.0,0.809,0.191,0.3818,2021-05-14 18:47:05
this episode visit with Kate Biberdorf aka along with Christian artist influencer podcaster,293,0.0,1.0,0.0,0.0,2021-05-14 18:47:00
this episode visit with Kate Biberdorf aka along with Christian artist influencer podcaster,71,0.0,1.0,0.0,0.0,2021-05-14 18:46:39
Cisco Umbrella Offers Full Coverage Cloud Security #blockchain #youtube #bitcoin #music #twitter #art #live,8829,0.0,0.844,0.156,0.34,2021-05-14 18:46:37
Appliance Repair OKC Services #Google,749,0.0,1.0,0.0,0.0,2021-05-14 18:46:36
These Blazing Stars Just Disappeared The Missing Generation Women the Washington Post,779,0.291,0.709,0.0,-0.4767,2021-05-14 18:46:12
Join Direct Booking Masterclass Monday May EST for Ways Maximize Direct Book,1314,0.0,0.833,0.167,0.296,2021-05-14 18:46:07
this episode visit with Kate Biberdorf aka along with Christian artist influencer podcas,2887,0.0,1.0,0.0,0.0,2021-05-14 18:46:06
#starlink teams with google #google governing council #hederahashgraph #hbar #HelloFuture,0,0.0,1.0,0.0,0.0,2021-05-14 18:45:54
Appliance Repair OKC Services #Google,2,0.0,1.0,0.0,0.0,2021-05-14 18:45:49
JOBS The Technology Coalition incl #Google #Facebook #Amazon #Apple #Microsoft #Twitter group tech companie,1745,0.0,1.0,0.0,0.0,2021-05-14 18:45:42
Alhamdulillah the full series the Qur anic Sciences now available #Youtube,23905,0.0,1.0,0.0,0.0,2021-05-14 18:45:22
#Google will soon switch two factor authentication default #infosec #cybersecurity,42,0.0,1.0,0.0,0.0,2021-05-14 18:44:50
The news comes after five months internal turmoil sparked #Google firing both leaders its ethics divisio,2581,0.259,0.741,0.0,-0.5994,2021-05-14 18:44:00
Nothing fills greater sense resignation than messages from #google that Gmail almost full like,2635,0.246,0.627,0.127,-0.2705,2021-05-14 18:43:58
#Work customer engagement application built #Dynamics and unlocks new revenue opportunities and boosts client,422,0.0,0.582,0.418,0.7845,2021-05-14 18:43:40
Google Has Not Launches Broad Core Update Since December #Google #Search #SEO via,10799,0.0,1.0,0.0,0.0,2021-05-14 18:42:50
YouTube Not Working Try These Quick Fixes First #musicindustry #musicbusiness #musicbiz #yo,3327,0.0,1.0,0.0,0.0,2021-05-14 18:42:09
#SuperAnimalRoyale and #ShantaeandthePiratesCurse are coming #Stadia later this year #CloudGaming,71,0.0,1.0,0.0,0.0,2021-05-14 18:40:03
and discuss the episode Hundred Yards Over The Rim and the practicality,52,0.0,1.0,0.0,0.0,2021-05-14 18:40:00
These extensions EAD are basic needs force immigrants into Servitude leading Suppression,21,0.0,1.0,0.0,0.0,2021-05-14 18:38:45
Ask Something about Massive Rockerz Entertainment #Google,145,0.0,0.682,0.318,0.4215,2021-05-14 18:38:39
the wordings the #icta seem imply that #google and #mozilla agree with them,95,0.0,0.828,0.172,0.3612,2021-05-14 18:38:21
Planning for Weekend picnic hiking camping shopping yoga just nothing,32,0.0,1.0,0.0,0.0,2021-05-14 18:38:11
Few companies own both the services that can this well the video platforms they are competing against #Amazon,14,0.0,0.877,0.123,0.3346,2021-05-14 18:37:38
Under the deal #ElonMusk space development company will install #Starlink ground stations #Google data centres that,7,0.0,1.0,0.0,0.0,2021-05-14 18:37:30
These extensions EAD are basic needs force immigrants into Servitude leading Suppression,568,0.0,1.0,0.0,0.0,2021-05-14 18:37:10
See you the bar tonight partner #Google #googlepartners #fridayfunday #TGIF #DryJokesFriday #instadaily,138,0.0,1.0,0.0,0.0,2021-05-14 18:36:52
now verified Google Message our Google Business Profile visit using the Google Maps Here,5,0.0,1.0,0.0,0.0,2021-05-14 18:36:51
Google leads business push preserve work permits for spouses #Google always fights for immigrants but NEV,1035,0.11,0.89,0.0,-0.2144,2021-05-14 18:36:34
#Google #AkshayaTritiya #IndianArmy #YouTube #Technical #technicalguruji Chinese document leaked Australian med,5,0.187,0.813,0.0,-0.3182,2021-05-14 18:35:44
Ain that the truth #google,8727,0.0,0.635,0.365,0.3182,2021-05-14 18:35:18
#Google shit #Gmail more problematic than ever #Google not spending money for security now have countles,31,0.306,0.586,0.108,-0.659,2021-05-14 18:34:01
#Google #Apple and #Microsoft and leading chip manufacturers including #Intel have been have united with the,7559,0.0,0.843,0.157,0.4215,2021-05-14 18:33:55
Friday business and entrepreneur resource Learn how create one stop shop for all your business videos,203,0.12,0.765,0.115,-0.0258,2021-05-14 18:33:19
How Adobe Sign Microsoft Helps Businesses Solve Their Paper Problem #technology #business #cybersecurity #google #ama,651,0.141,0.628,0.23,0.1779,2021-05-14 18:33:19
How Adobe Sign Microsoft Helps Businesses Solve Their Paper Problem #technology #business #cybersecurity #google #ama,1267,0.141,0.628,0.23,0.1779,2021-05-14 18:33:14
How Adobe Sign Microsoft Helps Businesses Solve Their Paper Problem #technology #business #cybersecurity,8829,0.158,0.585,0.257,0.1779,2021-05-14 18:33:08
Watch Royal Marines fly over the sea onto military ship using jetsuit #technology #business #mobile #google #blockchain,1267,0.0,1.0,0.0,0.0,2021-05-14 18:32:47
can creat and manage verified Google Business listing month for your business #business,5,0.0,1.0,0.0,0.0,2021-05-14 18:32:45
Watch Royal Marines fly over the sea onto military ship using jetsuit #technology #business #mobile #google #blockchain,2084,0.0,1.0,0.0,0.0,2021-05-14 18:32:42
#sunder Pichai #Google Raises Internal Donations For NGOs India Helping With COVID Fight Google has,0,0.146,0.73,0.124,-0.1027,2021-05-14 18:32:39
Online Branding Easy and interesting way grow your business Know about #facebookmarketing,41,0.0,0.641,0.359,0.6808,2021-05-14 18:32:15
Bitcoin bad for the environment #Bitcoin #datacenters #google #environment,671,0.304,0.696,0.0,-0.5423,2021-05-14 18:32:13
Put Palestine your map #Google,2579,0.0,1.0,0.0,0.0,2021-05-14 18:31:55
From Niche Mainstream The Evolution the Multicloud #technology #business #cybersecurity #google #amazon #blockcha,2084,0.0,1.0,0.0,0.0,2021-05-14 18:31:39
#Google Maps #StreetView offers detailed views some the most beautiful landscapes #Zimbabwe and,42962,0.0,0.741,0.259,0.6361,2021-05-14 18:31:33
Day DaysOfCode Learned dart basics fuctions and types #flutterdev #flutter #dart #google,1360,0.0,1.0,0.0,0.0,2021-05-14 18:31:09
Day DaysOfCode Learned dart basics fuctions and types #flutterdev #flutter #dart #google,1806,0.0,1.0,0.0,0.0,2021-05-14 18:31:09
Day DaysOfCode Learned dart basics fuctions and types #flutterdev #flutter #dart #google,28672,0.0,1.0,0.0,0.0,2021-05-14 18:31:08
Day DaysOfCode Learned dart basics fuctions and types #flutterdev #flutter #dart #google,20,0.0,1.0,0.0,0.0,2021-05-14 18:31:03
Check your competitors rankings #google amp amp #bing and compare them with yours #seo,360,0.0,1.0,0.0,0.0,2021-05-14 18:30:51
Lord Malloren TEMPTING FORTUNE BESTSELL Beverley #Romance #Regency #ebook #Google,62553,0.0,1.0,0.0,0.0,2021-05-14 18:30:40
Ten Amazing Tips Improve Organic Search Rankings Google #wordpress #wordpressblogs #brndlethemes,115,0.0,0.573,0.427,0.7717,2021-05-14 18:30:03
#Google will soon switch two factor authentication default #infosec,218,0.0,1.0,0.0,0.0,2021-05-14 18:30:03
Determining which Google campaign type works best for you based your goals marketing plans and business strategies,960,0.0,0.792,0.208,0.6369,2021-05-14 18:29:29
#Google didn want follow the usual Square they went ahead with Rectangle,3398,0.0,0.894,0.106,0.0772,2021-05-14 18:28:11
Seems history keep repeating Same like #Kashmir even #Palestine medical staff are attacked amp ambulances are stopped,767,0.229,0.654,0.117,-0.34,2021-05-14 18:27:23
Watch Royal Marines fly over the sea onto military ship using jetsuit #technology #business #mobile #google #blockchain,11106,0.0,1.0,0.0,0.0,2021-05-14 18:26:52
Watch Royal Marines fly over the sea onto military ship using jetsuit #technology #business #mobile #google #blockchain,228,0.0,1.0,0.0,0.0,2021-05-14 18:26:41
Reel Google Earth but there twist #Google #comedy #reelsinstagram,32,0.0,1.0,0.0,0.0,2021-05-14 18:26:39
Seems history keep repeating Same like #Kashmir even #Palestine medical staff are attacked amp ambulances are stopped,67,0.229,0.654,0.117,-0.34,2021-05-14 18:24:21
Maine teen compete Doodle for Google Scholarship finals #Android #Google #Facebook,1368,0.0,1.0,0.0,0.0,2021-05-14 18:24:08
May connect with developers from around the world for discussions gain hands learning with #Google experts,9111,0.0,0.815,0.185,0.5267,2021-05-14 18:23:41
#Put Palestine Your Maps #Google #Gazaunderattak Google Inc GOOGLE Put Palestine Your Maps Sign the,60,0.0,1.0,0.0,0.0,2021-05-14 18:22:48
CDW Tech Talk Series Join the Live Experience #blockchain #youtube #bitcoin #music #twitter #art #live daysofcode #nowp,4314,0.0,0.879,0.121,0.296,2021-05-14 18:21:23
CDW Tech Talk Series Join the Live Experience #blockchain #youtube #bitcoin #music #twitter #art #live daysofcode #nowp,842,0.0,0.879,0.121,0.296,2021-05-14 18:20:58
CDW Tech Talk Series Join the Live Experience #blockchain #youtube #bitcoin #music #twitter #art #live,8829,0.0,0.864,0.136,0.296,2021-05-14 18:20:40
From Niche Mainstream The Evolution the Multicloud #technology #business #cybersecurity #google #amazon #blockcha,994,0.0,1.0,0.0,0.0,2021-05-14 18:20:26
#Google balloons travel the stratosphere deliver #internet people remote areas,1614,0.0,1.0,0.0,0.0,2021-05-14 18:19:57
Dear WOMEN Please Security Conscious study published the Journal General Psychology contended that #Googl,841,0.0,0.601,0.399,0.743,2021-05-14 18:19:52
From Niche Mainstream The Evolution the Multicloud #technology #business #cybersecurity #google #amazon #blockcha,842,0.0,1.0,0.0,0.0,2021-05-14 18:19:51
From Niche Mainstream The Evolution the Multicloud #technology #business #cybersecurity #google #amazon #blockcha,1806,0.0,1.0,0.0,0.0,2021-05-14 18:19:31
From Niche Mainstream The Evolution the Multicloud #technology #business #cybersecurity #google #amazon,8829,0.0,1.0,0.0,0.0,2021-05-14 18:19:26
Samsung might use Google Fuchsia for future Galaxy devices #Samsung #Google #FuchsiaOS,1325,0.0,1.0,0.0,0.0,2021-05-14 18:19:06
Scholarships for underrepresented leaders journalism via #digitalmarketing #Google #SEO,6493,0.0,1.0,0.0,0.0,2021-05-14 18:18:38
Google announces several updates that will help provide site owners and advertisers with relevant data when cookies,2794,0.0,0.856,0.144,0.4019,2021-05-14 18:17:15
#Google now shows partial tables snippets search results For example IntegerScaler compatibility table when,12,0.0,1.0,0.0,0.0,2021-05-14 18:16:57
The news comes after five months internal turmoil sparked #Google firing both leaders its ethics divisio,2011,0.259,0.741,0.0,-0.5994,2021-05-14 18:16:56
Google announces several updates that will help provide site owners and advertisers with relevant data when cookies,4278,0.0,0.856,0.144,0.4019,2021-05-14 18:16:27
Whiskey River The Water #Google,46,0.0,1.0,0.0,0.0,2021-05-14 18:15:40
#google #googlebusiness Will they find your business when they search your category,604,0.0,1.0,0.0,0.0,2021-05-14 18:15:27
Whiskey River The Water #Google,46,0.0,1.0,0.0,0.0,2021-05-14 18:15:27
Watch Royal Marines fly over the sea onto military ship using jetsuit #technology #business #mobile #google #blockchain,651,0.0,1.0,0.0,0.0,2021-05-14 18:15:27
Watch Royal Marines fly over the sea onto military ship using jetsuit #technology #business #mobile #google #blockchain,1510,0.0,1.0,0.0,0.0,2021-05-14 18:15:21
#Google balloons travel the stratosphere deliver #internet people remote areas,11269,0.0,1.0,0.0,0.0,2021-05-14 18:15:08
May connect with developers from around the world for discussions gain hands learning with #Google exp,6803,0.0,0.815,0.185,0.5267,2021-05-14 18:15:08
Grow your small business without website Google business #googlemybusiness #google #digitalmarketing,41,0.0,1.0,0.0,0.0,2021-05-14 18:15:07
Well after the gardener cut through the internet cable now have the internet back and running,25,0.115,0.769,0.115,0.0,2021-05-14 18:14:18
That why always hope for the best This was time had visited this place then got some clicks otherwise was,3850,0.0,0.717,0.283,0.7964,2021-05-14 18:13:43
Seems history keep repeating Same like #Kashmir even #Palestine medical staff are attacked amp ambulances are stopped,3671,0.229,0.654,0.117,-0.34,2021-05-14 18:13:18
Watch Royal Marines fly over the sea onto military ship using jetsuit #technology #business #mobile #google #blockchain,3831,0.0,1.0,0.0,0.0,2021-05-14 18:13:04
Watch Royal Marines fly over the sea onto military ship using jetsuit #technology #business #mobile #google,8829,0.0,1.0,0.0,0.0,2021-05-14 18:12:58
Never use #Google,364,0.0,1.0,0.0,0.0,2021-05-14 18:12:26
Dear WOMEN Please Security Conscious study published the Journal General Psychology contended that #Googl,192,0.0,0.601,0.399,0.743,2021-05-14 18:12:10
new book The Tyranny #BigTech recommended reading The Senator has persuasively warned about what,478,0.132,0.755,0.113,-0.0772,2021-05-14 18:12:07
Future proof your measurement with privacy safe solutions via #digitalmarketing #Google #SEO,6493,0.0,0.685,0.315,0.5574,2021-05-14 18:12:04
Can Give California Edge the Fight Against Wildfires #technology #business #infosec #google #blockchain,8829,0.178,0.822,0.0,-0.3818,2021-05-14 18:11:54
iGo Driving School Wallasey #Google,114,0.0,1.0,0.0,0.0,2021-05-14 18:11:19
Overhead Door Company Sacramento Inc #Google,379,0.0,1.0,0.0,0.0,2021-05-14 18:11:14
Google Pixel leak shows off distinctive new design #Tech #android #google #Pixel,8275,0.179,0.821,0.0,-0.34,2021-05-14 18:11:03
Outfit for You #Google,339,0.0,1.0,0.0,0.0,2021-05-14 18:10:46
