tweet,follower_count,neg,neu,pos,compound,time
Free udemy certificate courses Free #python #machinelearning #Microsoft,2771,0.0,0.476,0.524,0.765,2021-06-01 07:11:57
Free udemy certificate courses Free #python #machinelearning #Microsoft,9197,0.0,0.476,0.524,0.765,2021-06-01 07:11:52
Google affecting your reality #google #recaptcha #WhistleblowerMovement #Whistleblower hours per day,1871,0.0,1.0,0.0,0.0,2021-06-01 07:11:36
Shafa Home Rehabilitation Addiction Treatment Center Delhi #Google,120,0.0,1.0,0.0,0.0,2021-06-01 07:11:25
Come and enjoy the benefits DEALICOPTER #seo #digitalmarketing #marketing #socialmediamarketing #socialmedia #webdesig,13867,0.0,0.633,0.367,0.7003,2021-06-01 07:09:44
#bigtech control not just how you spend #money but where and through which platforms #Apple #Google face real troub,223,0.0,1.0,0.0,0.0,2021-06-01 07:09:32
Google Announces Three Data amp Analytics Tools Cloud Summit #ai #artificialintelligence #machin,8932,0.0,1.0,0.0,0.0,2021-06-01 07:08:19
Arizona Attorney says that #Google continues collect location data even after users turn off #tracking,1277,0.0,1.0,0.0,0.0,2021-06-01 07:07:05
Google Ads online advertising platform developed Google where advertisers bid display brief advertisem,142,0.0,1.0,0.0,0.0,2021-06-01 07:06:38
Google Announces Three Data amp Analytics Tools Cloud Summit #ai #artificialintelligence #machin,2815,0.0,1.0,0.0,0.0,2021-06-01 07:05:55
Come and enjoy the benefits DEALICOPTER #seo #digitalmarketing #marketing #socialmediamarketing #socialmedia,22,0.0,0.608,0.392,0.7003,2021-06-01 07:05:51
Tweet from DORA BSC Finance DORA BSC Finance Tweeted Druckenmiller Ethereum,1,0.0,1.0,0.0,0.0,2021-06-01 07:05:51
Sounds about right #MarketingTwitter #seo #google,2239,0.0,1.0,0.0,0.0,2021-06-01 07:05:22
Google Announces Three Data amp Analytics Tools Cloud Summit #ai #artificialintelligence,59477,0.0,1.0,0.0,0.0,2021-06-01 07:05:03
How Password Protect Your #Google Search History #Privacy,5598,0.0,0.729,0.271,0.3818,2021-06-01 07:05:02
Apple design Apple products protect your privacy and give you control over your information not always,77,0.0,0.852,0.148,0.3818,2021-06-01 07:03:29
Check out #education #learning #ideas #learn life alicekeeler Jams for Beginners with,492,0.0,1.0,0.0,0.0,2021-06-01 07:03:20
the good old days not being automatically opted selling all personal data just for searchin,6,0.0,0.828,0.172,0.4404,2021-06-01 07:02:47
Everyone knows #SundarPichai Few know Prabhakar Raghavan not its CEO but may well Read,1746,0.0,0.831,0.169,0.3919,2021-06-01 07:02:02
Todays setup Wall lux green icon Kwgt Android widgets,1494,0.0,1.0,0.0,0.0,2021-06-01 07:01:20
Website Key Performance Indicators amp amp #Google #Analytics #marketing #webmaster,357,0.0,1.0,0.0,0.0,2021-06-01 07:00:51
How Encourage Employee Well being During the Pandemic #DataScience #Job #ModiResign,7637,0.0,0.625,0.375,0.6597,2021-06-01 07:00:43
What SEO Rank Tracking dead alive What changing How should you today #SEO #Google,103342,0.228,0.635,0.138,-0.4019,2021-06-01 07:00:11
Google #franklinlakes #wyckoff #oaklandnj #franklinlakesmoms #technology #jmor #google #googleearth #googlemaps,406,0.0,1.0,0.0,0.0,2021-06-01 07:00:05
#Formatting Service ebook Paperback will provide you with digital files for #Kindle #Apple #Nook #Kobo and #Goog,9088,0.0,1.0,0.0,0.0,2021-06-01 06:58:27
Apple iPhone pro images leaked Check out #Apple #iPhone #Google #privacy #Faceb,16,0.173,0.827,0.0,-0.3182,2021-06-01 06:58:19
Lakh New COVID Cases Deaths India Tally #sadahaqpb #sadahaqenglish #sadahaqurdu,21741,0.0,1.0,0.0,0.0,2021-06-01 06:57:36
the series #Castle streaming #DisneyHotstar #India #Google search showed,61,0.0,1.0,0.0,0.0,2021-06-01 06:57:16
Low page load time drives your bounce rate your time you are likely see bounce learn,16,0.123,0.877,0.0,-0.2732,2021-06-01 06:57:00
know #OoerationGreif Grab What #OperationTransit Strangely #Google somewhat miserly,673,0.381,0.619,0.0,-0.5118,2021-06-01 06:56:44
Most Common #SEO Mistakes #Google #business #Digital #DigitalTransformation,4,0.283,0.717,0.0,-0.4144,2021-06-01 06:56:34
Shouldn #Google held responsible for this the end the day #THEFT THEFT,324,0.0,0.827,0.173,0.3182,2021-06-01 06:56:26
Court documents allege Google hid privacy settings Android Read more #technology #Google #pr,6568,0.104,0.896,0.0,-0.1027,2021-06-01 06:56:24
Free udemy certificate courses Free #python #machinelearning #Microsoft,4859,0.0,0.476,0.524,0.765,2021-06-01 06:56:10
#Formatting Service ebook Paperback will provide you with digital files for #Kindle #Apple #Nook #Kobo and,32858,0.0,1.0,0.0,0.0,2021-06-01 06:55:08
Have you already claimed and verified your Google Business listing #google,10,0.0,1.0,0.0,0.0,2021-06-01 06:55:00
#Flutter all new now how #Google announced Flutter Let explore what all about Continue rea,127,0.0,1.0,0.0,0.0,2021-06-01 06:54:48
Today really Missing one the best feature Unlimited High quality Upload world best and Smart,18,0.101,0.447,0.451,0.8627,2021-06-01 06:54:38
#MoneyRobot Submitter powerful #SEOautomation tool You have days free trial days money back guarantee #buywebsitet,29280,0.0,0.597,0.403,0.7964,2021-06-01 06:54:37
ClickMagick the next generation #ClickTracker #Rotator and #LinkManager guaranteed make every click more profitabl,29280,0.0,1.0,0.0,0.0,2021-06-01 06:54:34
Japanese space agency put Transformable Lunar Robot the moon #Android #Google #Facebook,1378,0.0,1.0,0.0,0.0,2021-06-01 06:53:33
Mufti Faiz Waheed who first translated Quran into Gojri language passes away #sadahaqpb #sadahaqenglish,21741,0.0,1.0,0.0,0.0,2021-06-01 06:53:16
Parcel forwarding service Poland This the way rent mailing address Poland that will forward your,238,0.0,1.0,0.0,0.0,2021-06-01 06:52:33
Everyone knows #SundarPichai Few know Prabhakar Raghavan not its CEO but may well,1113649,0.0,0.819,0.181,0.3919,2021-06-01 06:52:27
Yep about the future the tablets but without the device monopoly #Apple #iOS and the software big,236,0.0,0.909,0.091,0.1531,2021-06-01 06:51:51
Free udemy certificate courses Free #python #machinelearning #Microsoft,14,0.0,0.476,0.524,0.765,2021-06-01 06:51:36
Free udemy certificate courses Free #python #machinelearning #Microsoft,1660,0.0,0.476,0.524,0.765,2021-06-01 06:50:23
Free udemy certificate courses Free #python #machinelearning #Microsoft,1389,0.0,0.476,0.524,0.765,2021-06-01 06:50:15
Free udemy certificate courses Free #python #machinelearning #Microsoft,443,0.0,0.476,0.524,0.765,2021-06-01 06:50:15
Free udemy certificate courses Free #python #machinelearning,91,0.0,0.431,0.569,0.765,2021-06-01 06:50:10
The #technologySector has certainly gained popularity the #COVID #pandemic says Evercore ISI head,64,0.0,0.552,0.448,0.7964,2021-06-01 06:48:58
Global Covid update caseload tops Deaths surge more than #sadahaqpb #sadahaqenglish,21741,0.0,0.752,0.248,0.5106,2021-06-01 06:48:03
Please recommend names journalists who frequently write #China Hindi English Urdu any other vernacular als,528,0.0,0.73,0.27,0.5859,2021-06-01 06:46:50
Coolook #Google,794,0.0,1.0,0.0,0.0,2021-06-01 06:45:57
#Google #Youtube #linkedin #Airtel and many other app developers Please clearly mention what the update,29,0.0,0.722,0.278,0.6124,2021-06-01 06:44:12
#Google submits plan for storey city extension bets their staff will return the office Proposed extens,22203,0.0,1.0,0.0,0.0,2021-06-01 06:43:31
#Google could delete your #Gmail #Photos and #Drive New rules start TODAY via,245,0.0,1.0,0.0,0.0,2021-06-01 06:43:18
Ladakh reports new COVID cases #sadahaqpb #sadahaqenglish #sadahaqurdu #saaddahaqnews #sadahaq,21741,0.0,1.0,0.0,0.0,2021-06-01 06:41:50
Download now #BeaNominee #TrendingNow #DigitalIndia #MakeInIndia #finance,1946,0.0,1.0,0.0,0.0,2021-06-01 06:41:08
Shree Hari Clock Industries #Google,52,0.0,1.0,0.0,0.0,2021-06-01 06:41:05
The biggist problem with large #ICT companies that they don deliver what they promise #apple #microsoft #google and many others,205,0.117,0.783,0.1,-0.1027,2021-06-01 06:40:59
Download now #BeaNominee #TrendingNow #DigitalIndia #MakeInIndia,41,0.0,1.0,0.0,0.0,2021-06-01 06:40:13
world mailk Day june #facebook #instagram #youtube #twitter #love #tiktok #follow #instagood #like,12,0.0,1.0,0.0,0.0,2021-06-01 06:39:22
Court documents allege Google hid privacy settings Android Read more #technology #Google #pr,907,0.104,0.896,0.0,-0.1027,2021-06-01 06:38:52
Quote The Day june #facebook #instagram #youtube #twitter #love #tiktok #follow #instagood #like,12,0.0,1.0,0.0,0.0,2021-06-01 06:38:40
The impact Covid cybersecurity #Digital #CyberSecurity #DevOps #Covid #Google #CISO #Cybersecurity #Transformat,53,0.0,1.0,0.0,0.0,2021-06-01 06:37:29
Some the hardware products Google Which one you will select Follow for more updates #hardware,14,0.0,1.0,0.0,0.0,2021-06-01 06:36:50
Philippines extends ban travel from India six other countries #sadahaqpb #sadahaqenglish #sadahaqurdu,21741,0.238,0.662,0.099,-0.4767,2021-06-01 06:36:49
#DomainNameForSale Visit #GooglePlay #Startups #Branding,570,0.0,1.0,0.0,0.0,2021-06-01 06:34:52
Please recommend names journalists who frequently write #China Hindi English Urdu any other vernacular als,442,0.0,0.73,0.27,0.5859,2021-06-01 06:34:51
Todays setup Wall lux green icon Kwgt Android widgets,1148,0.0,1.0,0.0,0.0,2021-06-01 06:34:49
#DomainNameForSale Visit #GooglePlay #Startups,1821,0.0,1.0,0.0,0.0,2021-06-01 06:34:47
Does anyone use the Chrome extension edit Office files directly from the #Google Docs home screen,416,0.0,1.0,0.0,0.0,2021-06-01 06:34:22
true stories about switching Linux #opensource #google #Linux #Programming #coding #Sustaina,8564,0.0,0.781,0.219,0.4215,2021-06-01 06:33:38
true stories about switching Linux #opensource #google #Linux #Programming #coding #Sustaina,2243,0.0,0.781,0.219,0.4215,2021-06-01 06:33:33
true stories about switching Linux #opensource #google #Linux #Programming #coding #Sustaina,2243,0.0,0.781,0.219,0.4215,2021-06-01 06:33:33
true stories about switching Linux #opensource #google #Linux #Programming #coding #Sustaina,2243,0.0,0.781,0.219,0.4215,2021-06-01 06:33:33
Easy Branches #Google,51521,0.0,0.408,0.592,0.4404,2021-06-01 06:32:04
Army jawan found dead inside army camp Jammu Akhnoor #sadahaqpb #sadahaqenglish #sadahaqurdu #saaddahaqnews,21741,0.264,0.736,0.0,-0.6486,2021-06-01 06:32:02
#GMB listings help You get the #Google neighbourhood #map #VeerMich Literally places Your #business the,32,0.0,0.838,0.162,0.4019,2021-06-01 06:31:04
true stories about switching Linux #opensource #google #Linux #Programming #coding #Sustaina,850,0.0,0.781,0.219,0.4215,2021-06-01 06:30:27
true stories about switching Linux #opensource #google #Linux #Programming #coding #Sustaina,1660,0.0,0.781,0.219,0.4215,2021-06-01 06:30:22
Twitter has three weeks show compliance with India new rules #NewITRules #Twitter #IntermediaryRules,583,0.0,1.0,0.0,0.0,2021-06-01 06:30:22
true stories about switching Linux #opensource #google #Linux #Programming #coding #Sustaina,1389,0.0,0.781,0.219,0.4215,2021-06-01 06:30:06
true stories about switching Linux #opensource #google #Linux #Programming #coding #Sustaina,2167,0.0,0.781,0.219,0.4215,2021-06-01 06:30:06
true stories about switching Linux #opensource #google #Linux #Programming #coding #Sustaina,4013,0.0,0.781,0.219,0.4215,2021-06-01 06:30:05
true stories about switching Linux #opensource #google #Linux #Programming #coding #Sustaina,443,0.0,0.781,0.219,0.4215,2021-06-01 06:30:05
true stories about switching Linux #opensource #google #Linux #Programming #coding #Sustaina,243,0.0,0.781,0.219,0.4215,2021-06-01 06:30:03
Google deals with the shares all desktop searches August data shows that Google has the highest mar,49,0.0,0.879,0.121,0.296,2021-06-01 06:30:00
true stories about switching Linux #opensource #google #Linux #Programming #coding,65,0.0,0.763,0.237,0.4215,2021-06-01 06:30:00
Inevitable told you First there was CashApp then #Paypal then Venmo #Google Pay will next And now,182,0.08,0.92,0.0,-0.1027,2021-06-01 06:29:27
Druckenmiller says #Ethereum MySpace before #Facebook while #Bitcoin won #Google #CryptoUnity,91,0.0,0.73,0.27,0.5719,2021-06-01 06:29:20
#birthdaygirl #linkedin #twitter #facebook #instagram #tumblr #socialmedia #pinterest #google #deal #gift #gifts,67572,0.0,1.0,0.0,0.0,2021-06-01 06:27:20
Father allegedly kills two sons self Doda #sadahaqpb #sadahaqenglish #sadahaqurdu #saaddahaqnews #sadahaq,21741,0.241,0.759,0.0,-0.5423,2021-06-01 06:26:53
Salary Experience How Weigh Benefits Choosing Job #DataScience #Job,7637,0.0,0.755,0.245,0.3818,2021-06-01 06:26:14
Please recommend names journalists who frequently write #China Hindi English Urdu any other vernacular als,616,0.0,0.73,0.27,0.5859,2021-06-01 06:24:39
Check out latest article will #SEO #backlinks white hat manual link building service for #Google top ran,408,0.0,0.899,0.101,0.2023,2021-06-01 06:23:14
Please recommend names journalists who frequently write #China Hindi English Urdu any other vernacular als,180,0.0,0.73,0.27,0.5859,2021-06-01 06:22:27
Nur Maidin amp #Google,0,0.0,1.0,0.0,0.0,2021-06-01 06:22:21
Court documents from lawsuit against #Google reveal that the company reportedly made accessing location settings,5618,0.119,0.881,0.0,-0.2263,2021-06-01 06:21:47
Court documents from lawsuit against #Google reveal that the company reportedly made accessing location settings,307,0.119,0.881,0.0,-0.2263,2021-06-01 06:21:28
Google Chelsea and enjoy the fireworks with #ChampionsOfEurope #Google #ChelseaManCity #CFC,53,0.0,0.758,0.242,0.4939,2021-06-01 06:21:17
Please recommend names journalists who frequently write #China Hindi English Urdu any other vernacular als,254,0.0,0.73,0.27,0.5859,2021-06-01 06:21:14
All free Google accounts will now have storage limit that shared across Gmail photos and Drive For more update,7395,0.0,0.749,0.251,0.6908,2021-06-01 06:20:54
#GoogleCloud unveiled three new products Dataplex Datastream and #Analytics Hub #CloudComputing #Cloud,62,0.0,1.0,0.0,0.0,2021-06-01 06:20:23
people killed attacks eastern Congo villages #sadahaqpb #sadahaqenglish #sadahaqurdu #saaddahaqnews,21741,0.481,0.519,0.0,-0.8126,2021-06-01 06:19:57
All free Google accounts will now have storage limit that shared across Gmail photos and Drive For more update,1946,0.0,0.749,0.251,0.6908,2021-06-01 06:19:43
save you time amp spend our time reading your #reviews #Google amp LOVE Read what our #customers have,387,0.0,0.663,0.337,0.8455,2021-06-01 06:19:36
Nice Insights Core Web Vitals indeed one the most important rankings determining factor ahead,50,0.0,0.611,0.389,0.7178,2021-06-01 06:19:25
Have app that enabling #Covid relief response Need any help that can help reach the impacted users faster,212,0.0,0.593,0.407,0.8225,2021-06-01 06:19:03
All free Google accounts will now have storage limit that shared across Gmail photos and Drive For more,2,0.0,0.737,0.263,0.6908,2021-06-01 06:17:47
Let Explore Google Kubernetes Engine Understand What Google Kubernetes Engine How does work Use,13,0.0,1.0,0.0,0.0,2021-06-01 06:17:32
amp Bank board meet this week capital infusion plan #sadahaqpb #sadahaqenglish #sadahaqurdu #saaddahaqnews,21741,0.0,1.0,0.0,0.0,2021-06-01 06:16:06
Vertrauliche Mail Korrespondenz von #Google Mitarbeitern Gerichtsverfahren offengelegt This doesn sound like some,564,0.0,0.828,0.172,0.3612,2021-06-01 06:15:44
Vertrauliche Mail Korrespondenz von #Google Mitarbeitern Gerichtsverfahren offengelegt This doesn sound like some,1230,0.0,0.828,0.172,0.3612,2021-06-01 06:14:22
Vertrauliche Mail Korrespondenz von #Google Mitarbeitern Gerichtsverfahren offengelegt This doesn sound like some,7564,0.0,0.828,0.172,0.3612,2021-06-01 06:14:03
Vertrauliche Mail Korrespondenz von #Google Mitarbeitern Gerichtsverfahren offengelegt This doesn sound like some,468,0.0,0.828,0.172,0.3612,2021-06-01 06:13:50
Vertrauliche Mail Korrespondenz von #Google Mitarbeitern Gerichtsverfahren offengelegt This doesn sound like some,57,0.0,0.828,0.172,0.3612,2021-06-01 06:13:47
#GooglePhotos longer FREE What next Watch this video know Google Photos Alternatives,37,0.0,0.732,0.268,0.6166,2021-06-01 06:13:31
#WhoAreTheseFolk Ugh #ReadingIsFundamental AND #Google University removed the barrier #Jeez,154,0.35,0.65,0.0,-0.5106,2021-06-01 06:12:57
Western Union Islamabad amp #Google,27,0.0,1.0,0.0,0.0,2021-06-01 06:12:53
#GooglePhotos longer FREE What next Watch this video know Google Photos Alternatives,30723,0.0,0.732,0.268,0.6166,2021-06-01 06:12:32
Here brief difference between Google and DuckDuckGo #Google #duckduckgo #Browser #webdevelopment #ios #weba,840,0.0,1.0,0.0,0.0,2021-06-01 06:11:51
Curtain designs and rods #Google,388,0.0,1.0,0.0,0.0,2021-06-01 06:11:33
Vertrauliche Mail Korrespondenz von #Google Mitarbeitern Gerichtsverfahren offengelegt This doesn sound like some,1156,0.0,0.828,0.172,0.3612,2021-06-01 06:11:16
Here brief difference between Google and DuckDuckGo #Google #duckduckgo #Browser #webdevelopment #ios,542,0.0,1.0,0.0,0.0,2021-06-01 06:10:45
Absconder arrested after years amp #sadahaqpb #sadahaqenglish #sadahaqurdu #saaddahaqnews #sadahaq,21741,0.256,0.744,0.0,-0.4767,2021-06-01 06:10:21
Vertrauliche Mail Korrespondenz von #Google Mitarbeitern Gerichtsverfahren offengelegt This doesn soun,141776,0.0,1.0,0.0,0.0,2021-06-01 06:10:00
#Ethereum #Bitcoin what #MySpace #Google,127,0.0,1.0,0.0,0.0,2021-06-01 06:09:14
Please recommend names journalists who frequently write #China Hindi English Urdu any other vernacular als,132,0.0,0.73,0.27,0.5859,2021-06-01 06:09:13
AMP Content Links Spread Outside Search Results #SEO #Google #AMP,11320,0.0,1.0,0.0,0.0,2021-06-01 06:09:06
God Kabir said that without true worship king will also have,82,0.295,0.559,0.147,-0.2778,2021-06-01 06:08:23
Bankers once kings capital may dethroned payment platforms #fintech #bigtech #technology,4087,0.0,1.0,0.0,0.0,2021-06-01 06:06:32
#imageextensions are now going available all #googleads marketers Test out and see how improves,1088,0.0,0.823,0.177,0.4215,2021-06-01 06:06:02
Please recommend names journalists who frequently write #China Hindi English Urdu any other vernacular als,111,0.0,0.73,0.27,0.5859,2021-06-01 06:05:11
Climbing New Heights has been haven for climbers West Virginia since When the pandemic hit Chris and owner Jordy,13154,0.0,1.0,0.0,0.0,2021-06-01 06:04:08
Full Potential Learning Academy FPLA #Google What tested Terranova Test,158,0.0,1.0,0.0,0.0,2021-06-01 06:01:34
New #google panel #airsoft #videogames #IndieGameDev #indiedev #gamedev #gamedevelopment #fps,856,0.0,1.0,0.0,0.0,2021-06-01 06:01:33
New #google panel #airsoft #videogames #IndieGameDev #indiedev #gamedev #gamedevelopment #fps,1812,0.0,1.0,0.0,0.0,2021-06-01 06:01:25
Don forget Organic traffic only part your total traffic #seo #search #google #traffic,357,0.137,0.863,0.0,-0.2263,2021-06-01 06:00:51
Your search amp browsing history private info right Here how keep private You can now password protect,159,0.0,0.86,0.14,0.3818,2021-06-01 06:00:11
Field data more important than lab data rely make decisions you are analyzing core web vitals,175,0.0,0.77,0.23,0.4927,2021-06-01 06:00:08
When #Google tested versions its Android that made #privacy settings easier find users took advantage them,120,0.0,0.745,0.255,0.5859,2021-06-01 05:59:48
#Google review fantastic reputable way gain some feedback amp shine light your #business Take look,39,0.0,0.65,0.35,0.7906,2021-06-01 05:59:19
Have app that enabling #Covid relief response Need any help that can help reach the impacted users faster,1113576,0.0,0.593,0.407,0.8225,2021-06-01 05:58:56
Google Photos storage paid subscription that will add more storage your account depending what,398,0.0,1.0,0.0,0.0,2021-06-01 05:58:02
enforce mandatory account use #Iview and share your data with #facebook and #google unless opt out,254,0.0,0.8,0.2,0.3612,2021-06-01 05:57:51
Google says there need worry about JavaScript when comes search there nothing fundamentally different,2666,0.182,0.818,0.0,-0.4404,2021-06-01 05:57:24
Google now allows users disable FLoC tracking but still troublesome operate #News #Google,665,0.271,0.729,0.0,-0.6652,2021-06-01 05:56:09
Please recommend names journalists who frequently write #China Hindi English Urdu any other vernacular als,197,0.0,0.73,0.27,0.5859,2021-06-01 05:54:47
Now the future Internet Explorer will Microsoft Edge faster more secure and offer more modern bro,14,0.0,0.848,0.152,0.4005,2021-06-01 05:53:46
Nine strikes deals with Facebook Google #Android #Google #Facebook,1378,0.238,0.762,0.0,-0.3612,2021-06-01 05:53:03
When #Google tested versions its Android that made #privacy settings easier find users took advantage them,3231,0.0,0.745,0.255,0.5859,2021-06-01 05:52:22
Please recommend names journalists who frequently write #China Hindi English Urdu any other vernacular als,561,0.0,0.73,0.27,0.5859,2021-06-01 05:51:53
What First Input Delay FID amp How Optimize for better Website Speed and User Experience,1140,0.113,0.588,0.299,0.5859,2021-06-01 05:51:30
Google Hid Privacy Settings Android Phones Made Confusing Data Collection Policies Report Court documents fro,6,0.202,0.798,0.0,-0.3182,2021-06-01 05:50:00
The impact Covid cybersecurity #Digital #CyberSecurity #DevOps #Covid #Google #CISO #Cybersecurity #Transformat,16264,0.0,1.0,0.0,0.0,2021-06-01 05:49:12
Google core web vitals for Elementor #Google #CoreWebVitals,415,0.0,0.769,0.231,0.2732,2021-06-01 05:49:00
Free unlimited storage Google Photos ends monthly given for,8,0.0,0.708,0.292,0.5106,2021-06-01 05:48:42
Disable ipv missing wait native ipv already possible #azure #google Cloud,220,0.18,0.82,0.0,-0.296,2021-06-01 05:47:45
Twitter has three weeks show compliance with India new rules #NewITRules #Twitter #IntermediaryRules #DelhiHighCourt,212,0.0,1.0,0.0,0.0,2021-06-01 05:47:15
officially certified Thank you #GADS #GADSStories #GADS #Google,16,0.0,0.737,0.263,0.3612,2021-06-01 05:46:44
How Use #Google #Maps Features For #Businesses googlemaps,1366,0.0,1.0,0.0,0.0,2021-06-01 05:46:37
#GooglePhotos free unlimited storage ends Check #GoogleOne plans amp prices here #Google,70065,0.0,0.769,0.231,0.5106,2021-06-01 05:46:06
Margaret River Bookshop #Google,227,0.0,1.0,0.0,0.0,2021-06-01 05:45:43
Internet Run Businesses Guide Becoming Your Own Boss Using The Internet #Google #internet #LatestNews,1086,0.0,1.0,0.0,0.0,2021-06-01 05:45:17
Please recommend names journalists who frequently write #China Hindi English Urdu any other vernacular als,311,0.0,0.73,0.27,0.5859,2021-06-01 05:45:17
Please recommend names journalists who frequently write #China Hindi English Urdu any other vernacular als,1019,0.0,0.73,0.27,0.5859,2021-06-01 05:44:11
Zoom Google Meet and Microsoft Teams added hundreds millions users during pandemic Here are the most down,899,0.0,1.0,0.0,0.0,2021-06-01 05:42:49
When #Google tested versions its Android that made #privacy settings easier find users took advantage them,390,0.0,0.745,0.255,0.5859,2021-06-01 05:41:52
like today #google #doodle because out are left handed #lefthanded,553,0.0,0.783,0.217,0.3612,2021-06-01 05:41:31
The impact Covid cybersecurity #Digital #CyberSecurity #DevOps #Covid #Google #CISO #Cybersecurity #Transformat,1714,0.0,1.0,0.0,0.0,2021-06-01 05:40:44
How you feel about the fact that Google Photos not FREE anymore #google,237,0.213,0.787,0.0,-0.5014,2021-06-01 05:40:33
The impact Covid cybersecurity #Digital #CyberSecurity #DevOps #Covid #Google #CISO #Cybersecurity #Transformat,544,0.0,1.0,0.0,0.0,2021-06-01 05:40:11
Failure part our daily lives One cannot avoid failures but learn from them You should admire failures and,4132,0.084,0.506,0.411,0.8128,2021-06-01 05:40:00
The impact Covid cybersecurity #Digital #CyberSecurity #DevOps #Covid #Google #CISO #Cybersecurity #Transformat,992,0.0,1.0,0.0,0.0,2021-06-01 05:38:59
Please recommend names journalists who frequently write #China Hindi English Urdu any other vernacular als,829,0.0,0.73,0.27,0.5859,2021-06-01 05:38:29
like today #google #doodle because out are left handed #lefthanded,1448,0.0,0.783,0.217,0.3612,2021-06-01 05:37:51
#Apartment for sale #koraytem #beirut #lebanon #mbolb #realestate #realtor #beirutrealestate #lebanonrealestate,1073,0.0,1.0,0.0,0.0,2021-06-01 05:37:51
Please recommend names journalists who frequently write #China Hindi English Urdu any other vernacular als,416,0.0,0.73,0.27,0.5859,2021-06-01 05:37:25
Ration card banwaye Solutions Visit Solutions CSC Digital eGov Services sattowali ghati Feel,0,0.0,0.764,0.236,0.34,2021-06-01 05:37:19
Please recommend names journalists who frequently write #China Hindi English Urdu any other vernacular als,371,0.0,0.73,0.27,0.5859,2021-06-01 05:37:13
Turn Those Searches Into Sales Reaching Top #Google Searches You want reach the first page google,26,0.0,0.667,0.333,0.4588,2021-06-01 05:35:53
were contacted for comment new #AI dermatology tool #Google shares her concerns that clinica,143,0.0,0.855,0.145,0.296,2021-06-01 05:35:01
Please recommend names journalists who frequently write #China Hindi English Urdu any other vernacular als,294,0.0,0.73,0.27,0.5859,2021-06-01 05:34:52
Goodbye the most used feature Free storage Google Photos #Google #like #GooglePhotos #freestorage,45,0.0,0.771,0.229,0.552,2021-06-01 05:34:15
#Apartment for sale #Marchaaya #Broumana #Lebanon #mbolb #realestate #beirutrealestate #lebanonrealestate,1073,0.0,1.0,0.0,0.0,2021-06-01 05:33:29
very long day but finally completed #Google Automation with #Python specialization need few days absorb,11266,0.0,1.0,0.0,0.0,2021-06-01 05:32:37
Join next week for workshop using our #Google Cloud native provider where build infrastructure using the #TypeS,2961,0.0,0.879,0.121,0.296,2021-06-01 05:32:04
The impact Covid cybersecurity #Digital #CyberSecurity #DevOps #Covid #Google #CISO #Cybersecurity,583,0.0,1.0,0.0,0.0,2021-06-01 05:30:24
Twitter has three weeks show compliance with India new rules #NewITRules #Twitter #IntermediaryRules,583,0.0,1.0,0.0,0.0,2021-06-01 05:30:13
