tweet,follower_count,neg,neu,pos,compound,time
The time buy Safebank now before the Whales before the bull run Buy the dip Catch the higher pric,4600,0.0,1.0,0.0,0.0,2021-05-17 06:44:33
The time buy Safebank now before the Whales before the bull run Buy the dip Catch the higher pric,0,0.0,1.0,0.0,0.0,2021-05-17 06:44:27
Check out National Productivity Council Google Please follow NPC Google and stay,3901,0.0,0.827,0.173,0.3182,2021-05-17 06:44:15
Google admitted copying Oracle source code the genesis the suit filed Oracle lower courts seeking damage,5937,0.273,0.657,0.071,-0.6124,2021-05-17 06:43:56
image map where you map links within image via coordinates Using this HTML technique you can use one imag,9171,0.0,1.0,0.0,0.0,2021-05-17 06:43:03
AWS Microsoft and Google secure spots government Cloud Compute framework #Android #Google #Facebook,1373,0.0,0.833,0.167,0.34,2021-05-17 06:43:02
Google Android redesign leaks with theme support new animations #Google #Android,228,0.0,0.787,0.213,0.4019,2021-05-17 06:41:59
population just men work women Benefits cost billion plus houses wonder they look,1407,0.0,0.822,0.178,0.3818,2021-05-17 06:41:51
#Google redesigning Gboard only for Pixel phones equipped with #Android system #apps #gboard #news,2068,0.0,1.0,0.0,0.0,2021-05-17 06:41:40
#Google redesigning Gboard only for Pixel phones equipped with #Android system #apps #gboard #news,2068,0.0,1.0,0.0,0.0,2021-05-17 06:41:39
Google may use unique solution equip the Pixel with under screen camera #News #Pixel #Google,657,0.0,0.859,0.141,0.3182,2021-05-17 06:41:35
you Prefer #decentralized Join #BTCZ #decentralized #BTC #BTCZ #Bitcoin #DenizBaysal #demetoezdemir #deve,2834,0.0,0.833,0.167,0.296,2021-05-17 06:41:20
you Prefer #decentralized Join #BTCZ #decentralized #BTC #BTCZ #Bitcoin #DenizBaysal,374,0.0,0.804,0.196,0.296,2021-05-17 06:40:37
Google admitted copying Oracle source code the genesis the suit filed Oracle lower courts seeking damage,4018,0.273,0.657,0.071,-0.6124,2021-05-17 06:40:27
Here the post which can help record your screen for making videos,5,0.0,0.803,0.197,0.4019,2021-05-17 06:40:25
Birthday Celebration #Ohshitsahil #Viral #Google #Keepsupporting #Sahilkumar #Pose #cake #photography,0,0.0,1.0,0.0,0.0,2021-05-17 06:40:13
YouTube Will pay creators for making Shorts #youtube #google #alphabet #youtubeshorts #india #us #usa,2,0.097,0.903,0.0,-0.1027,2021-05-17 06:38:18
StackOverflow and Google are the two things every developer use the daily basis #coderadda #Google #Python #javascript,1293,0.0,1.0,0.0,0.0,2021-05-17 06:37:21
StackOverflow and Google are the two things every developer use the daily basis #coderadda #Google #Python #javascript,15911,0.0,1.0,0.0,0.0,2021-05-17 06:37:16
How Long Does SEO Take And Why #page #google #show #search #year #seo via,2491,0.0,1.0,0.0,0.0,2021-05-17 06:36:10
ALLEGRO INTERNATIONAL SHIPPING PARCEL FORWARDING FROM POLAND AND WORLDWIDE SHIPPING HOW BUY ALLEGRO POLAND AND,215,0.0,1.0,0.0,0.0,2021-05-17 06:35:06
were invited Studio Digital share some tips how you can optimise your WordPress business site,11,0.0,0.718,0.282,0.6249,2021-05-17 06:35:02
Yea well when they started that program #Adobe didn have contract with #Google #Samsung the,28869,0.0,0.87,0.13,0.2732,2021-05-17 06:34:55
completed Foundations User Experience Design Update skills always work progress Check out,685,0.0,0.797,0.203,0.4215,2021-05-17 06:34:55
population just men work women Benefits cost billion plus houses wonder they look,863,0.0,0.822,0.178,0.3818,2021-05-17 06:34:52
#GooglePay dips toe cross border market signs cross border #payments partnership with #WesternUnion and,2263,0.0,1.0,0.0,0.0,2021-05-17 06:34:31
Best Ways Market Yourself the Top Feng Shui Master Singapore #fengshui #singapore #google,7997,0.0,0.647,0.353,0.7184,2021-05-17 06:33:57
#RT Riafy was the first Indian developer showcased Google Android largest annual event,311,0.0,1.0,0.0,0.0,2021-05-17 06:33:34
Google admitted copying Oracle source code the genesis the suit filed Oracle lower courts seeking damage,3578,0.273,0.657,0.071,-0.6124,2021-05-17 06:33:28
Google admitted copying Oracle source code the genesis the suit filed Oracle lower courts seeking,10736,0.133,0.783,0.084,-0.2023,2021-05-17 06:32:17
#SCAM #GOOGLE what this behaviour #RCB saala fraud namm,248,0.322,0.678,0.0,-0.5859,2021-05-17 06:32:05
can understand the reason for such Please help get back badges Kindly solve issue #VIPULKRISHNA,105,0.0,0.524,0.476,0.8402,2021-05-17 06:31:43
Ahy Consulting Magento Wordpress and Enterprise eCommerce Agency #Google #userinterfacede,1660,0.0,1.0,0.0,0.0,2021-05-17 06:31:17
Riafy was the first Indian developer showcased Google Android largest annual event held virtually this yea,448,0.0,1.0,0.0,0.0,2021-05-17 06:31:08
Best #Gmail Tools Supercharge Your Email Experience #Google,13648,0.0,0.625,0.375,0.6369,2021-05-17 06:31:00
#AI #Asset #Management Market Ecosystem expected grow #CAGR during the forecast period,50,0.0,1.0,0.0,0.0,2021-05-17 06:30:55
Google Analytics Event Tracking Virtual Pageviews #google #analytics,344,0.0,1.0,0.0,0.0,2021-05-17 06:30:51
Riafy was the first Indian developer showcased Google Android largest annual event held virtually,65,0.0,1.0,0.0,0.0,2021-05-17 06:30:43
digital giant Google Get the news and data Follow #Constellatio #Google,41,0.0,1.0,0.0,0.0,2021-05-17 06:30:18
Google Phone app finally adds basic Caller feature #Google #GooglePhone,228,0.0,1.0,0.0,0.0,2021-05-17 06:30:14
Need Targeted Visitors from Google and Other Search Engines have Year Experience SEO Payment Based Tracked,6206,0.0,1.0,0.0,0.0,2021-05-17 06:29:15
Check out Gig #Fiverr #google #scraping for #search results #business #profiles,1669,0.0,1.0,0.0,0.0,2021-05-17 06:29:02
SEO not something you anymore what happens when you everything else right #seo #socialmedia #socialma,373,0.0,1.0,0.0,0.0,2021-05-17 06:28:11
Profits from #COVID Net sales crore Serum earned Net Profit crore Net Margin,69,0.0,0.655,0.345,0.7003,2021-05-17 06:26:53
Some Clarification Show Must #cryptotwitter #dogecoin #Coinmarketcap #FFXIV #Crypto #Dogecoinarmy #BTCZ,133,0.0,1.0,0.0,0.0,2021-05-17 06:25:32
SEO not something you anymore what happens when you everything else right #seo #socialmedia #socialma,2822,0.0,1.0,0.0,0.0,2021-05-17 06:24:05
SEO not something you anymore what happens when you everything else right #seo #socialmedia #socialma,2822,0.0,1.0,0.0,0.0,2021-05-17 06:24:05
SEO not something you anymore what happens when you everything else right #seo #socialmedia #socialma,2822,0.0,1.0,0.0,0.0,2021-05-17 06:24:05
Need Targeted Visitors from Google and Other Search Engines have Year Experience SEO Payment Based Tracked,118,0.0,1.0,0.0,0.0,2021-05-17 06:23:49
population just men work women Benefits cost billion plus houses wonder they look,1619,0.0,0.822,0.178,0.3818,2021-05-17 06:23:41
Ahy Consulting Magento Wordpress and Enterprise eCommerce Agency #Google,150,0.0,1.0,0.0,0.0,2021-05-17 06:22:38
New episode Its that time again Another episode TJR Aftermath this episode joined Lacy from,4522,0.0,1.0,0.0,0.0,2021-05-17 06:22:01
Spent Sunday learning Google Analytics Sharing the link here for you all #Trending #NEW #GoogleEdu #Analytics #Go,1807,0.0,0.851,0.149,0.4215,2021-05-17 06:21:10
Google Pixel smartphone with under screen camera #Google,228,0.0,1.0,0.0,0.0,2021-05-17 06:20:21
#Army conducted orientation #lecture Join Army and Live Life Less #ordinary Pathanateer District #Poonch,296,0.0,0.855,0.145,0.296,2021-05-17 06:20:12
APANT KAHENGE CARTOON THE DAY #poorabtimes #cartoonart #cartoon #COVID India #FilmReview,296,0.0,1.0,0.0,0.0,2021-05-17 06:20:12
#Google Chrome Tricks You Might Not Know Here are awesome google chrome tricks which will amaze you knowing,607,0.122,0.569,0.309,0.765,2021-05-17 06:19:49
Google Device Policy more support for iOS #Google #GoogleDevicePolicy #iOS,4,0.0,0.75,0.25,0.4576,2021-05-17 06:19:23
The time buy Safebank now before the Whales before the bull run Buy the dip,0,0.0,1.0,0.0,0.0,2021-05-17 06:18:04
APANT KAHENGE CARTOON THE DAY #poorabtimes #cartoonart #cartoon #COVID India,90,0.0,1.0,0.0,0.0,2021-05-17 06:18:03
The Role #Hashtags Social Media and Search #backlinking #google #contentmarketing #seotools #so,2803,0.0,1.0,0.0,0.0,2021-05-17 06:17:11
ISRO amp MapmyIndia build alternative Google Maps #ISRO India answer #NASA #MapmyIndia that,1364,0.0,1.0,0.0,0.0,2021-05-17 06:16:22
The Role #Hashtags Social Media and Search #backlinking #google #contentmarketing,1478,0.0,1.0,0.0,0.0,2021-05-17 06:15:41
NEWS #TorrentFreak #copyright #copyrights #google YouTube Takedown Numbers are Mystery But #ContentID,7448,0.0,1.0,0.0,0.0,2021-05-17 06:15:20
Now google really over flowing the info Why don they just add all the content instead trying this feature #Google #seo,203,0.0,1.0,0.0,0.0,2021-05-17 06:14:57
Check out Gig Fiverr build american authority backlinks #USA #backlinks #seo,1478,0.0,0.885,0.115,0.0772,2021-05-17 06:14:39
BeachTanning Tanning Salon Philadelphia #Google,146,0.0,1.0,0.0,0.0,2021-05-17 06:14:13
Check out our #Google page and add get daily event updates and #festival reviews,866,0.0,1.0,0.0,0.0,2021-05-17 06:14:09
Threat Actors Continue Use #Google Alerts Spread #malware and Scams via,850,0.444,0.556,0.0,-0.802,2021-05-17 06:13:38
searching google #Google #sleep,156,0.0,1.0,0.0,0.0,2021-05-17 06:13:30
judge dismisses advertisers antitrust claims against Google Read here Follow,4,0.0,1.0,0.0,0.0,2021-05-17 06:13:25
Sometimes not that God will have seen everything you judgement day Try deleting your browser cookies #Google,19,0.102,0.898,0.0,-0.2057,2021-05-17 06:11:49
Any data you provide will remain secure amp will not stored anywhere Real time transcription for meetings,469,0.0,0.87,0.13,0.34,2021-05-17 06:06:46
Stories Flooring #Google,310,0.0,1.0,0.0,0.0,2021-05-17 06:05:54
Love mom Mug #Google #Coffee #coffeetime #coffeelovers #gift #redbubbleshop #mommy #mom,5,0.0,0.704,0.296,0.6369,2021-05-17 06:05:42
Sunset #TeamPixel #madebygoogle #Google,377,0.0,1.0,0.0,0.0,2021-05-17 06:04:10
StackOverflow and Google are the two things every developer use the daily basis #coderadda #Google #Python #javascript,635,0.0,1.0,0.0,0.0,2021-05-17 06:03:56
Spent Sunday learning Google Analytics Sharing the link here for you all #Trending #NEW #GoogleEdu,2,0.0,0.833,0.167,0.4215,2021-05-17 06:03:35
Sunset #TeamPixel #madebygoogle #Google,287,0.0,1.0,0.0,0.0,2021-05-17 06:03:26
StackOverflow and Google are the two things every developer use the daily basis #coderadda #Google #Python #javascript,6293,0.0,1.0,0.0,0.0,2021-05-17 06:03:14
StackOverflow and Google are the two things every developer use the daily basis #coderadda #Google #Python #javascript,2131,0.0,1.0,0.0,0.0,2021-05-17 06:03:08
Leverage intelligent automation capabilities decreasing time spent common repetitive business tasks #centrax #teamcent,3135,0.125,0.688,0.188,0.25,2021-05-17 06:02:16
Threat Actors Continue Use #Google Alerts Spread #malware and Scams via,869,0.444,0.556,0.0,-0.802,2021-05-17 06:02:04
Google announces several updates that will help provide site owners and advertisers with relevant data when cookies aren,610,0.0,0.863,0.137,0.4019,2021-05-17 06:01:21
Threat Actors Continue Use #Google Alerts Spread #malware and Scams via,10845,0.444,0.556,0.0,-0.802,2021-05-17 06:01:05
#Google #Facebook Like the similarities and the differences #marketing #socialmedia,344,0.0,0.783,0.217,0.3612,2021-05-17 06:00:56
Check out paidmarketer will increase sales #shopify website #Google #AdWords #Fiverr adwords fiverr #ppc,896,0.0,0.85,0.15,0.3182,2021-05-17 06:00:55
Cloud computing often far more secure than traditional computing you agree with this Get touch with know,451,0.0,0.743,0.257,0.6361,2021-05-17 06:00:33
Google announces several updates that will help provide site owners and advertisers with relevant data when cookies,968,0.0,0.856,0.144,0.4019,2021-05-17 06:00:03
Leverage intelligent automation capabilities decreasing time spent common repetitive business tasks #centrax,297,0.133,0.667,0.2,0.25,2021-05-17 06:00:03
ISRO amp MapmyIndia build alternative Google Maps #ISRO India answer #NASA #MapmyIndia that,413,0.0,1.0,0.0,0.0,2021-05-17 06:00:02
#CAPTCHA inefficient amp obsolete #google tech #Signata will leverage cryptography #YubiKey minimize #BigTech,1474,0.155,0.845,0.0,-0.296,2021-05-17 05:59:28
When you return work after long weekend and click restore #Google #Chrome and tabs open The anxio,2,0.0,0.879,0.121,0.296,2021-05-17 05:58:05
Take your business next level will provide you complete analytic report your online presence easy,73,0.0,0.828,0.172,0.4404,2021-05-17 05:58:00
New episode Its that time again Another episode TJR Aftermath this episode joined Lacy from,1914,0.0,1.0,0.0,0.0,2021-05-17 05:54:00
Without making big changes There way for Google retain its research credibility especially ethical #AI #Et,46,0.0,0.807,0.193,0.5563,2021-05-17 05:52:56
The Google world account Stay tuned #Google #Alphabet #YouTube #GoogleEarth #Constellatio,47,0.0,1.0,0.0,0.0,2021-05-17 05:52:10
#SinthSity and #CooleHigh #DarkMagenta out now #iTunes #GooglePlay #Amazon #AmazonMusic #TIDAL #Deeze,8864,0.0,1.0,0.0,0.0,2021-05-17 05:50:52
#Android likely unveil fresh design for widgets amp notifications #GoogleIO #Google,158,0.0,0.813,0.187,0.3182,2021-05-17 05:50:29
population just men work women Benefits cost billion plus houses wonder they look,1113,0.0,0.822,0.178,0.3818,2021-05-17 05:50:14
WOULD HAVE GONE #PRISON HAD COMMIT THE SAME #CRIMES #GOOGLE DID AGAINST,2689,0.0,0.833,0.167,0.296,2021-05-17 05:49:11
Speech Text Google Speech Amazon Transcribe Via #SpeechtoText,2519,0.0,0.805,0.195,0.1779,2021-05-17 05:48:58
Google Inc GOOGLE Put Palestine Your Maps Sign the Petition via #Google,1081,0.0,1.0,0.0,0.0,2021-05-17 05:46:31
#Army conducted orientation #lecture Join Army and Live Life Less #ordinary Pathanateer District,2241,0.0,0.845,0.155,0.296,2021-05-17 05:46:08
#Apple and #Google are now the world #privacy regulators,8618,0.0,1.0,0.0,0.0,2021-05-17 05:45:55
population just men work women Benefits cost billion plus houses wonder they look,3487,0.0,0.822,0.178,0.3818,2021-05-17 05:45:10
WOULD HAVE GONE #PRISON HAD COMMIT THE SAME #CRIMES #GOOGLE DID AGAINST,6106,0.0,0.833,0.167,0.296,2021-05-17 05:45:08
Download now #BeaNominee #TrendingNow #DigitalIndia #MakeInIndia #finance,57,0.0,1.0,0.0,0.0,2021-05-17 05:44:59
Download now #BeaNominee #TrendingNow #DigitalIndia #MakeInIndia #finance,26,0.0,1.0,0.0,0.0,2021-05-17 05:44:35
How Tech Companies are helping India battle Covid crisis Pic via #oneplus #google #xiaomi #zomato #cred,158,0.306,0.594,0.1,-0.6705,2021-05-17 05:44:16
Download now #BeaNominee #TrendingNow #DigitalIndia #MakeInIndia #finance,240,0.0,1.0,0.0,0.0,2021-05-17 05:43:58
Mid May Google Search Ranking Algorithm Update Continues #googleupdate #google,235,0.0,1.0,0.0,0.0,2021-05-17 05:43:16
Interact amp learn with huge community like minded individuals amp alums from top #tech cos like #Walmart,2708,0.0,0.588,0.412,0.7964,2021-05-17 05:39:00
#Google suddenly pushes little known #Pixel feature and marvelous,173,0.0,0.672,0.328,0.5994,2021-05-17 05:38:24
Download now #BeaNominee #TrendingNow #DigitalIndia #MakeInIndia #finance,50,0.0,1.0,0.0,0.0,2021-05-17 05:37:43
#SEOtip #Content that fulfills the #Google #EAT principle will rank higher EAT stands for expertise authoritativ,422,0.0,0.882,0.118,0.25,2021-05-17 05:37:43
Download now #BeaNominee #TrendingNow #DigitalIndia #MakeInIndia #finance,41,0.0,1.0,0.0,0.0,2021-05-17 05:37:17
Trade Key #Google,1032,0.0,1.0,0.0,0.0,2021-05-17 05:36:38
The number and type ranking factors Google search algorithm uses are constantly changing keep,51,0.0,0.909,0.091,0.0772,2021-05-17 05:36:07
All Shortcuts Ctrl Ctrl Excel Amazing Keyboard Shortcut #Free Palesti,221,0.0,0.541,0.459,0.7783,2021-05-17 05:35:29
All Shortcuts Ctrl Ctrl Excel Amazing Keyboard Shortcut #Free Palesti,338,0.0,0.541,0.459,0.7783,2021-05-17 05:35:27
All Shortcuts Ctrl Ctrl Excel Amazing Keyboard Shortcut,8,0.0,0.469,0.531,0.7783,2021-05-17 05:35:22
Safe and easy use recover deleted photo restore images restore photoswith single tap #google #play #link,145,0.0,0.541,0.459,0.8481,2021-05-17 05:35:12
The most important parts #SEO and the most important Google ranking factors are the webpage titles and heading tags,710,0.0,0.802,0.198,0.4915,2021-05-17 05:35:04
Download now #BeaNominee #TrendingNow #DigitalIndia #MakeInIndia,41,0.0,1.0,0.0,0.0,2021-05-17 05:34:04
The time buy Safebank now before the Whales before the bull run Buy the dip Catch the higher price,74,0.0,1.0,0.0,0.0,2021-05-17 05:33:02
The time buy Safebank now before the Whales before the bull run Buy the dip Catch the higher,74,0.0,1.0,0.0,0.0,2021-05-17 05:31:21
Microsoft AWS share top spot Public Cloud Services market IDC #InternationalDataCorporation,582,0.0,0.692,0.308,0.4588,2021-05-17 05:30:28
How Fake your Location #Google Chrome Sometimes websites may request access your location that they can,607,0.171,0.829,0.0,-0.4767,2021-05-17 05:30:22
Microsoft AWS share top spot Public Cloud Services market IDC #InternationalDataCorporation,7271,0.0,0.692,0.308,0.4588,2021-05-17 05:30:19
District hospital #Medical #oxygen plant #Ramban nearing completion more sanctioned for Banihal Batote,296,0.0,1.0,0.0,0.0,2021-05-17 05:29:55
The time buy Safebank now before the Whales before the bull run Buy the dip Catch the higher price #Cr,74,0.0,1.0,0.0,0.0,2021-05-17 05:29:33
Android official First Look #Google #android,228,0.0,1.0,0.0,0.0,2021-05-17 05:29:29
Cloud computing often far more secure than traditional computing you agree with this Get touch with know,635,0.0,0.743,0.257,0.6361,2021-05-17 05:28:56
Cloud computing often far more secure than traditional computing you agree with this Get touch with,76,0.0,0.729,0.271,0.6361,2021-05-17 05:27:48
Now the time get your #business found Google Make easy for your local customers find information,128,0.0,0.838,0.162,0.4404,2021-05-17 05:27:17
Google Marketing Live coming soon screen near you And now the agenda for #GML also the,312,0.0,1.0,0.0,0.0,2021-05-17 05:27:11
Salesforce Training Institute Pune #Google,68,0.0,1.0,0.0,0.0,2021-05-17 05:26:31
RidgeRun proud announce brand new partnership with Coral From Google For more detail,116,0.0,0.795,0.205,0.4767,2021-05-17 05:26:13
Here great #google colab introduction for the #CodeNewbies out there #code daysofcode,4445,0.0,0.728,0.272,0.6249,2021-05-17 05:23:13
Phone cleaner will helps boost your phones speed while removing log files apk files temp files empty files and,923,0.076,0.63,0.294,0.6369,2021-05-17 05:23:02
Machine Learning with TensorFlow Google Cloud Platform #Machine #Learning #TensorFlow #Google #Cloud #Platform Googl,85,0.0,1.0,0.0,0.0,2021-05-17 05:22:46
There are over million blogs the Internet people search how start blog every month Google,19,0.0,1.0,0.0,0.0,2021-05-17 05:22:45
Google scheduled take place from May Here what expect #GoogleIO,73,0.0,1.0,0.0,0.0,2021-05-17 05:22:24
PMZ Marketing #Google,1717,0.0,1.0,0.0,0.0,2021-05-17 05:21:11
#About #USP why #Google #Analytics can #Close Down,27015,0.0,1.0,0.0,0.0,2021-05-17 05:20:57
Here great #google colab introduction for the #CodeNewbies out there #code daysofcode,2074,0.0,0.728,0.272,0.6249,2021-05-17 05:20:33
GOOGLE MAN RUDOLF GERMANY via was Gothic nightclub would play,66,0.0,0.789,0.211,0.34,2021-05-17 05:20:17
Machine Learning with TensorFlow Google Cloud Platform #Machine #Learning #TensorFlow #Google #Cloud #Platform Googl,635,0.0,1.0,0.0,0.0,2021-05-17 05:18:56
Machine Learning with TensorFlow Google Cloud Platform #Machine #Learning #TensorFlow #Google #Cloud #Platform Googl,430,0.0,1.0,0.0,0.0,2021-05-17 05:18:33
Here great #google colab introduction for the #CodeNewbies out there #code daysofcode,2651,0.0,0.728,0.272,0.6249,2021-05-17 05:18:22
Here great #google colab introduction for the #CodeNewbies out there #code daysofcode,393,0.0,0.728,0.272,0.6249,2021-05-17 05:18:21
Here great #google colab introduction for the #CodeNewbies out there #code daysofcode,160,0.0,0.728,0.272,0.6249,2021-05-17 05:18:20
Here great #google colab introduction for the #CodeNewbies out there #code daysofcode,1175,0.0,0.728,0.272,0.6249,2021-05-17 05:18:12
Here great #google colab introduction for the #CodeNewbies out there #code daysofcode,508,0.0,0.728,0.272,0.6249,2021-05-17 05:18:07
file Recovery app that will help recover deleted photo recover deleted video amp recovery deleted audio,923,0.0,0.847,0.153,0.4019,2021-05-17 05:17:36
Launch VSCode codeserver Google Colab using ColabCode Thank you for creating this Video Link,13,0.0,0.719,0.281,0.5719,2021-05-17 05:17:19
CDW Solutions Blog Improve Management and Security with Multi Cloud Strategy #technology #business #live daysofcode,15911,0.0,0.632,0.368,0.7184,2021-05-17 05:13:23
#Google #Cloud #Platform #Training amp #Certification for you make the most Google Cloud technologies #Call #Wh,697,0.0,1.0,0.0,0.0,2021-05-17 05:11:17
hello Sundar curious why Google not have customer support like Apple Microsoft Amazo,1,0.132,0.586,0.281,0.3699,2021-05-17 05:11:16
#Google #Cloud #Platform #Training amp #Certification for you make the most Google Cloud technologies #Call #Wh,2370,0.0,1.0,0.0,0.0,2021-05-17 05:11:09
Google promises new data center Qubec puts plans for three Dutch data centers hold DCD,1373,0.0,0.843,0.157,0.3818,2021-05-17 05:11:04
#Google #Cloud #Platform #Training amp #Certification for you make the most Google Cloud technologies #Call #Wh,4445,0.0,1.0,0.0,0.0,2021-05-17 05:10:15
#Google #Cloud #Platform #Training amp #Certification for you make the most Google Cloud technologies #Call #Wh,2822,0.0,1.0,0.0,0.0,2021-05-17 05:10:05
#Google #Cloud #Platform #Training amp #Certification for you make the most Google Cloud technologies #Call #Wh,7714,0.0,1.0,0.0,0.0,2021-05-17 05:09:50
#Google #Cloud #Platform #Training amp #Certification for you make the most Google Cloud technologies #Call #Wh,755,0.0,1.0,0.0,0.0,2021-05-17 05:09:46
#Google #Cloud #Platform #Training amp #Certification for you make the most Google Cloud technologies #Call #Wh,1939,0.0,1.0,0.0,0.0,2021-05-17 05:09:21
The time buy Safebank now before the Whales before the bull run Buy the dip Catch the higher,560,0.0,1.0,0.0,0.0,2021-05-17 05:08:34
Smart Watch for Android iOS Phones Compatible iPhone Samsung Touchscreen Bluetooth Smartwatch Fitness Tracke,323,0.0,0.714,0.286,0.5859,2021-05-17 05:08:25
Hickory Crawdads Baseball Cap Plaque #baseball #HickoryCrawdads #collectibles #sports #homedecor #BookResquePlus #Etsy,1698,0.0,1.0,0.0,0.0,2021-05-17 05:08:00
#Google #Cloud #Platform #Training amp #Certification for you make the most Google Cloud technologies #Call #Wh,1175,0.0,1.0,0.0,0.0,2021-05-17 05:07:10
#Google #Cloud #Platform #Training amp #Certification for you make the most Google Cloud technologies #Call #Wh,338,0.0,1.0,0.0,0.0,2021-05-17 05:07:09
#Google #Cloud #Platform #Training amp #Certification for you make the most Google Cloud technologies #Call #Wh,3858,0.0,1.0,0.0,0.0,2021-05-17 05:07:09
#Google #Cloud #Platform #Training amp #Certification for you make the most Google Cloud technologies #Call #Wh,160,0.0,1.0,0.0,0.0,2021-05-17 05:07:09
#Google #Cloud #Platform #Training amp #Certification for you make the most Google Cloud technologies #Call,4,0.0,1.0,0.0,0.0,2021-05-17 05:07:04
Smart Watch for Android iOS Phones Compatible iPhone Samsung Touchscreen Bluetooth Smartwatch Fitness Tra,189,0.0,0.714,0.286,0.5859,2021-05-17 05:07:03
what your customer support phone number having trouble connect Google hub with nest after,1,0.153,0.621,0.226,0.0772,2021-05-17 05:05:35
How Use Pop Ups Without Negatively Affecting Your SEO #Google #SEO #Penalty,7122,0.0,1.0,0.0,0.0,2021-05-17 05:05:08
New Video Samsung Galaxy Watch Lacking Features #Samsung #Google #GalaxyWatch,25,0.0,1.0,0.0,0.0,2021-05-17 05:04:32
The Google world account Stay tuned #Google #Alphabet #YouTube #GoogleEarth #Constellatio,0,0.0,1.0,0.0,0.0,2021-05-17 05:03:45
What you think about this photo #GooglePlay #Google #looking #love #foodblog,332,0.0,1.0,0.0,0.0,2021-05-17 05:01:41
New Google Cookie Third Party Cookies Chrome and Google Proposed Technology Listen now,757,0.0,0.816,0.184,0.4019,2021-05-17 05:00:44
Women the focus for gaming platforms #OnlineGaming #RedBull #GamingIndustry #Logitech #Google #TeamLease,582,0.0,1.0,0.0,0.0,2021-05-17 05:00:12
Women the focus for gaming platforms #OnlineGaming #RedBull #GamingIndustry #Logitech #Google #TeamLease,36671,0.0,1.0,0.0,0.0,2021-05-17 05:00:09
#Ranking #rankingrights Women bible site Keyword #Google search #page traffic,3645,0.0,1.0,0.0,0.0,2021-05-17 04:59:01
got audio now got captions Live Caption helping make every moment more accessible Click learn more about,185,0.0,0.879,0.121,0.296,2021-05-17 04:58:46
Semiconductor Industry News Week Review #SIA #Apple #Google #COMPUTEX #AMD #GlobalFoundries,295,0.0,1.0,0.0,0.0,2021-05-17 04:57:08
Machine Learning with TensorFlow Google Cloud Platform #Machine #Learning #TensorFlow #Google #Cloud #Platform,819,0.0,1.0,0.0,0.0,2021-05-17 04:56:01
doing new #Rust thingy This time for #Google Maps Static APIs Still #WIP but you can stay tuned #GitHub http,1362,0.0,1.0,0.0,0.0,2021-05-17 04:55:45
The time buy Safebank now before the Whales before the bull run Buy the dip Catch the,929,0.0,1.0,0.0,0.0,2021-05-17 04:53:15
The time buy Safebank now before the Whales before the bull run Buy the dip Catch,83,0.0,1.0,0.0,0.0,2021-05-17 04:53:09
What the best medium get more leads and queries short period time Organic social media #RetweeetPlea,634,0.0,0.781,0.219,0.6369,2021-05-17 04:52:57
Easy Downloading Kaggle Data Google Drive Priyanka Dandale #google #kaggle #datascience,1175,0.0,0.775,0.225,0.4404,2021-05-17 04:52:36
