tweet,follower_count,neg,neu,pos,compound,time
Intensive Online Teachers Training Program being organized for RKM CBSE amp RKM MPBSE Gwalior School Teachers,512,0.0,1.0,0.0,0.0,2021-06-06 17:23:43
Check out The New Google Pay Free Recorded Webinar available now,4761,0.102,0.657,0.241,0.4404,2021-06-06 17:22:00
Outraged back back attempts humiliate Kannadigas global search engine #Google and world largest tai,65677,0.368,0.632,0.0,-0.7906,2021-06-06 17:21:51
The best way gain local interest for your business and ensure that your site has regular updates include,11265,0.0,0.515,0.485,0.9217,2021-06-06 17:21:42
Nepal full outdoor activities and one can enjoy these activities all while being under these magical natural,51,0.0,0.725,0.275,0.6908,2021-06-06 17:21:29
Buy Now #USA #UKGiftHour #UK #unitedkingdom #UnitedStatesofAl #newphone #Google,264,0.0,1.0,0.0,0.0,2021-06-06 17:21:27
Watch the Case Study the YEAR Google CEO Click #SundarPichai #Google,50,0.0,1.0,0.0,0.0,2021-06-06 17:20:45
These extensions EAD are basic needs force immigrants into Servitude leading Suppression,356,0.0,1.0,0.0,0.0,2021-06-06 17:20:37
careful with words Once they are said they can only forgiven not forgotten #Google #KannadaQueenOfAllLangu,46,0.0,0.672,0.328,0.5948,2021-06-06 17:20:34
was just announced that Arizona Attorney General suing #Google for lying its users about location privac,267,0.282,0.718,0.0,-0.6705,2021-06-06 17:20:03
Watch the Case Study the YEAR Google CEO Click #SundarPichai #Google,1570,0.0,1.0,0.0,0.0,2021-06-06 17:19:48
Ella Jones REALTOR Serving Southern Reliance Real Estate Services #Google,248,0.0,1.0,0.0,0.0,2021-06-06 17:19:23
Search engine giant #Google has quite remunerative bug bounty program where the company offers #inspiration,5399,0.0,1.0,0.0,0.0,2021-06-06 17:18:19
Adding Google Analytics and Google AdSense Jekyll Website #Git #Jekyll #Google,8655,0.0,1.0,0.0,0.0,2021-06-06 17:18:01
Studio Twenty LLC #Google,174,0.0,1.0,0.0,0.0,2021-06-06 17:17:06
Thank you all including students from #waterlooregion for attending #Coding workshop Happy see many young students,1119,0.0,0.693,0.307,0.7351,2021-06-06 17:15:42
Thank you all including students from #waterlooregion for attending #Coding workshop Happy see many young students,11324,0.0,0.693,0.307,0.7351,2021-06-06 17:15:28
Thank you all including students from #waterlooregion for attending #Coding workshop Happy see many young students,11324,0.0,0.693,0.307,0.7351,2021-06-06 17:15:28
DaysOfCode #DEVCommunity Day started IoT internship with full stack development,272,0.0,1.0,0.0,0.0,2021-06-06 17:15:28
Thank you all including students from #waterlooregion for attending #Coding workshop Happy see many young students,4235,0.0,0.693,0.307,0.7351,2021-06-06 17:14:03
Thank you all including students from #waterlooregion for attending #Coding workshop Happy see many young students,1080,0.0,0.693,0.307,0.7351,2021-06-06 17:14:01
Thank you all including students from #waterlooregion for attending #Coding workshop Happy see many young students,2426,0.0,0.693,0.307,0.7351,2021-06-06 17:13:16
Many people rely Google translate for Urdu Hindi word meaning Please keep mind translate not reliable Ple,4550,0.0,0.874,0.126,0.3182,2021-06-06 17:11:45
#MassEffect Part available now amp #ApplePodcasts,931,0.0,1.0,0.0,0.0,2021-06-06 17:11:13
Dragon cargo ship delivers baby squid fruits and vegetables space station crew Global News,37,0.0,1.0,0.0,0.0,2021-06-06 17:09:49
compiled everything that you need know about FLoC what why receiving pushback and how prepare via,349,0.0,1.0,0.0,0.0,2021-06-06 17:08:44
#MassEffect Part available now amp #ApplePodcasts,2230,0.0,1.0,0.0,0.0,2021-06-06 17:08:26
compiled everything that you need know about FLoC what why receiving pushback and how prepare via,1179,0.0,1.0,0.0,0.0,2021-06-06 17:07:04
outstanding tool that suggests more accurate sentence you have written Thank you for reading Val,293,0.0,0.598,0.402,0.7951,2021-06-06 17:06:57
Google WiFi System Pack Router Replacement Whole Home Coverage NLS white,4235,0.0,1.0,0.0,0.0,2021-06-06 17:04:54
DaysOfCode #DEVCommunity Day started IoT internship with full stack development,8866,0.0,1.0,0.0,0.0,2021-06-06 17:04:51
DaysOfCode #DEVCommunity Day started IoT internship with full stack development,1508,0.0,1.0,0.0,0.0,2021-06-06 17:01:51
DaysOfCode #DEVCommunity Day started IoT internship with full stack development,646,0.0,1.0,0.0,0.0,2021-06-06 17:01:49
DaysOfCode #DEVCommunity Day started IoT internship with full stack development,4694,0.0,1.0,0.0,0.0,2021-06-06 17:01:46
DaysOfCode #DEVCommunity Day started IoT internship with full stack developm,18,0.0,1.0,0.0,0.0,2021-06-06 17:01:46
Why #Google banning responsible orgs Can anti vaxxers manipulate YouTube algorithms throw off health advocates,1726,0.131,0.739,0.131,0.0,2021-06-06 17:01:36
#MassEffect Part available now amp #ApplePodcasts,5137,0.0,1.0,0.0,0.0,2021-06-06 17:00:58
Your search amp browsing history private info right Here how keep private You can now password protect,165,0.0,0.86,0.14,0.3818,2021-06-06 17:00:52
google open first physical store new york Via #Business #Marketing,88,0.0,1.0,0.0,0.0,2021-06-06 17:00:30
Not sure why #Google #deindexed your #WordPress site Take look some the possible reasons for this occurren,659,0.109,0.891,0.0,-0.2411,2021-06-06 17:00:09
Learn How implement #google #pubSub #javascript #typescript #nodeJs creating #cipher working with #angular #react,459,0.0,0.855,0.145,0.296,2021-06-06 17:00:01
Learn How implement #google #pubSub #javascript #typescript #nodeJs creating #cipher working with #angular #react,459,0.0,0.855,0.145,0.296,2021-06-06 17:00:01
Google Pixel might get new Astrotimelapse feature Report #Google #GooglePixel #Astrotimelapse,112147,0.0,1.0,0.0,0.0,2021-06-06 16:59:53
website #webshop hoger #google #notime #tdd,1411,0.0,1.0,0.0,0.0,2021-06-06 16:59:38
Top Tech Companies The World #tech #technology #amazon #apple #google #company,1376,0.0,0.847,0.153,0.2023,2021-06-06 16:59:00
Data Backed Reasons Ramp #Google Business #Reviews,79,0.0,0.845,0.155,0.0258,2021-06-06 16:58:02
Why #Google banning responsible orgs Can anti vaxxers manipulate YouTube algorithms throw off health advocat,5139,0.131,0.739,0.131,0.0,2021-06-06 16:57:42
How does SEO handle algorithm that ranks content from multiple languages for questions composed images and text via,202,0.0,1.0,0.0,0.0,2021-06-06 16:56:45
#MassEffect Part available now amp #ApplePodcasts,4095,0.0,1.0,0.0,0.0,2021-06-06 16:56:37
Google releasing broad core algorithm update later today June via,80,0.0,1.0,0.0,0.0,2021-06-06 16:56:04
#MassEffect Part available now amp #ApplePodcasts,938,0.0,1.0,0.0,0.0,2021-06-06 16:56:02
Learn How implement #google #pubSub #javascript #typescript #nodeJs creating #cipher working with #angular #react,2795,0.0,0.855,0.145,0.296,2021-06-06 16:55:54
Learn How implement #google #pubSub #javascript #typescript #nodeJs creating #cipher working with #angular #react,4197,0.0,0.855,0.145,0.296,2021-06-06 16:55:49
Subscribe and Support Please #gamer #PUBGMOBILE #PlayStation #Google #youtubechannel,5,0.0,0.583,0.417,0.6124,2021-06-06 16:55:14
comforting know that even the CEO tech giant like #Google still learning few things about how,29780,0.0,0.729,0.271,0.6369,2021-06-06 16:54:02
Don just pass Check out new post #dribbble #google #logo,139,0.0,1.0,0.0,0.0,2021-06-06 16:54:00
SillyPants Has you Covered Everything you will need teach the entire Probability unit Junior Perfect for Distan,1386,0.0,0.812,0.188,0.5719,2021-06-06 16:53:31
Maybe better pop the bubble when its small skip the massive dot com collapse But instead,169,0.116,0.776,0.108,-0.0387,2021-06-06 16:52:54
#Nigeria BABY #BanTWITTER #TwitterBanNigeria #Nigeria BABY #dogecoin #Cryptocurency #poem,1008,0.0,1.0,0.0,0.0,2021-06-06 16:50:12
Safest Search Engines #cybersecurity #infosec #informationsecurity #web #network #google #tools #ethicalhacking #hacker,16374,0.0,0.803,0.197,0.4019,2021-06-06 16:49:51
Google future What you think Follow for best Futuristic and Unique facts #facts #funfacts,0,0.0,0.756,0.244,0.6369,2021-06-06 16:49:46
Google requiring your Canonical and AMP Pages Match SEO #Google SEONews,11321,0.0,1.0,0.0,0.0,2021-06-06 16:49:10
Cloud Users Cloud Comparison #AWS #Azure #Google #IBM,67,0.0,1.0,0.0,0.0,2021-06-06 16:49:04
#MassEffect Part available now amp #ApplePodcasts,918,0.0,1.0,0.0,0.0,2021-06-06 16:48:34
#GitHub kelseyhightower kubernetes the hard way Bootstrap Kubernetes the hard way #Google Cloud Platform,1468,0.189,0.811,0.0,-0.2023,2021-06-06 16:47:08
Because reCaptcha likely every page website you signed into your Google account there,5339,0.0,1.0,0.0,0.0,2021-06-06 16:47:06
Wishart Brain and Spine Law #Google Vancouver Personal #Injury #Lawyers who want you Liv,76,0.0,0.909,0.091,0.0772,2021-06-06 16:45:23
Google wants find the holy grail which Artificial General Intelligence,1331,0.0,0.744,0.256,0.4767,2021-06-06 16:44:56
Possible threat hxxp rbcpack com #phishing #google,85,0.362,0.638,0.0,-0.5267,2021-06-06 16:43:22
Fight corrupt America social media,11,0.394,0.606,0.0,-0.3818,2021-06-06 16:43:13
not everyone had experienced Some blogs which did allow crawling stop accepting requests,3,0.132,0.599,0.269,0.3182,2021-06-06 16:43:07
ALL NEW JUNE LOVE KARMA TAROT READINGS FOR ALL ZODIAC SIGNS SINGLES amp COUPLES Come check out NEW JUNE TAR,81,0.0,0.794,0.206,0.7125,2021-06-06 16:43:06
#Google Offers #Nexus Holiday Deal Free Shipping Play Store Credit #android #deal,14332,0.0,0.421,0.579,0.875,2021-06-06 16:42:12
Please stop them from texting phone tried please #Gmail #Google,330,0.159,0.507,0.333,0.34,2021-06-06 16:41:21
Get better more complete view things June #Facebook #Apple #Amazon #Netflix amp #Google Weekly,11898,0.0,0.818,0.182,0.4404,2021-06-06 16:41:11
This #domain for sale #VR #Robots #Python #Coding #ML #FEATURED #Analytics #WomenWhoCode #Prog,2363,0.0,1.0,0.0,0.0,2021-06-06 16:40:48
Website audit using GSC #SEO #Google #Search #GSC #Website,19,0.0,1.0,0.0,0.0,2021-06-06 16:40:20
#JavaScript developments from #web dev machine learning make perfect language learn for SEO Here what,6738,0.0,0.791,0.209,0.5719,2021-06-06 16:40:17
#JavaScript developments from #web dev machine learning make perfect language learn for SEO Here,202,0.0,0.778,0.222,0.5719,2021-06-06 16:40:12
Major Google Maps Error Fixed Android Auto Now Plaguing CarPlay #Android #Google #Facebook,1385,0.184,0.816,0.0,-0.4019,2021-06-06 16:40:03
#google was invented All info before inconclusive only trust google,10,0.0,0.732,0.268,0.5106,2021-06-06 16:39:22
Android prohibits replacing the official share menu sharing #Android #Android #Google,1663,0.0,0.643,0.357,0.6124,2021-06-06 16:36:49
need talk about #Google #reCAPTCHA for moment ran into #Cookie banner informing about the,215,0.0,1.0,0.0,0.0,2021-06-06 16:36:45
#GodofAbraham #Jesus News Release #photos #photo #photography #Twitter #Google #GooglePhotos #Facebook,342,0.0,1.0,0.0,0.0,2021-06-06 16:36:29
compiled everything that you need know about FLoC what why receiving pushback and how prepare via,202,0.0,1.0,0.0,0.0,2021-06-06 16:35:35
#GodofAbraham #Jesus News Release #photos #photo #photography #Twitter #Google #GooglePhotos #Facebook,342,0.0,1.0,0.0,0.0,2021-06-06 16:34:56
Google Photos app will longer package compressed photos high quality #Google #GooglePhotos,1663,0.0,1.0,0.0,0.0,2021-06-06 16:34:22
you are looking for digital marketing service Then you can knock Fiverr,979,0.0,1.0,0.0,0.0,2021-06-06 16:33:53
Why #Google Website Speed Test Important For Your Website #Websites #SEO #Googlespeed,2064,0.0,0.859,0.141,0.2023,2021-06-06 16:33:02
Win google play free gift card Click the below link amp collect your free offer,651,0.0,0.389,0.611,0.9403,2021-06-06 16:32:59
working web app that makes use Google APIs amp have connected using OAuth through gapi library,112,0.0,1.0,0.0,0.0,2021-06-06 16:32:12
you are looking for digital marketing service Then you can knock Fiverr,7074,0.0,1.0,0.0,0.0,2021-06-06 16:31:35
#GodofAbraham #Jesus News Release #photos #photo #photography #Twitter #Google #GooglePhotos #Facebook,342,0.0,1.0,0.0,0.0,2021-06-06 16:31:22
expecting response this #Google #YouTube #youth,0,0.0,1.0,0.0,0.0,2021-06-06 16:31:16
Google hires former SiriusXM CPO CTO lead its Maps team #maiyro #technology #blogging,2998,0.0,1.0,0.0,0.0,2021-06-06 16:31:15
Compelled marry she UNWILLING BRIDE BESTSELL Beverley #Romance #Regency #ebook #Google,62059,0.0,0.893,0.107,0.0516,2021-06-06 16:30:40
#Google #FeedBurner RSS Feeds for Automated Tweets #GrowthHack,18713,0.0,1.0,0.0,0.0,2021-06-06 16:30:05
#Alibaba #Google among companies seeking Singapore #Crypto Licenses,235,0.0,1.0,0.0,0.0,2021-06-06 16:29:05
Google reasigna liderazgo diversidad via #diversity,310,0.0,1.0,0.0,0.0,2021-06-06 16:28:24
you are looking for digital marketing service Then you can knock Fiverr,7074,0.0,1.0,0.0,0.0,2021-06-06 16:27:54
#linkedin #twitter #facebook #instagram #tumblr #socialmedia #pinterest #google #deal #gift #giftsforher #gifts,67655,0.0,1.0,0.0,0.0,2021-06-06 16:27:27
you are looking for digital marketing service Then you can knock Fiverr,7074,0.0,1.0,0.0,0.0,2021-06-06 16:26:14
Need refresh your local SEO campaigns Learn everything you need know about ranking and visibility for Google Busin,430,0.0,1.0,0.0,0.0,2021-06-06 16:24:54
Obligatory pic from recent trip New York they sporting their rainbow logo celebrating,13623,0.0,0.764,0.236,0.5719,2021-06-06 16:24:11
Rely CDW for our full stack GCP expertise From Anthos CCAI Contact Center our Google Cloud Fellows and engine,1080,0.0,1.0,0.0,0.0,2021-06-06 16:23:58
you are looking for digital marketing service Then you can knock Fiverr,60,0.0,1.0,0.0,0.0,2021-06-06 16:22:34
compiled everything that you need know about FLoC what why receiving pushback and how prepare via,23,0.0,1.0,0.0,0.0,2021-06-06 16:22:20
#Google reassigns diversity chief who wrote Jews have insatiable appetite for war via,1053,0.245,0.755,0.0,-0.5994,2021-06-06 16:21:53
you are looking for digital marketing service Then you can knock Fiverr,60,0.0,1.0,0.0,0.0,2021-06-06 16:21:27
First #internet #surfing then #orkuting then #google then #yahoochatroom then #FacebookLive then #instareel now,639,0.0,1.0,0.0,0.0,2021-06-06 16:21:06
Anne COURTINE sur #Google happy sponsored take advantage,1295,0.0,0.513,0.487,0.6908,2021-06-06 16:20:44
Google Pixel Buds series TWS receive the Indian BIS certification launch seems imminent #Google #PixelBudsASeries,22,0.0,1.0,0.0,0.0,2021-06-06 16:20:43
Eco Cleaning London #Google,85,0.0,1.0,0.0,0.0,2021-06-06 16:20:40
you are looking for digital marketing service Then you can knock Fiverr,60,0.0,1.0,0.0,0.0,2021-06-06 16:20:31
#Android users will have know that this checkbox exists and then find the settings almost certainly resultin,151,0.0,0.884,0.116,0.2748,2021-06-06 16:20:18
#Google #BroadCore #Algorithm Update rolled Out June Don too quick celebrate you see positive changes,52,0.0,0.64,0.36,0.8074,2021-06-06 16:20:00
#ibiza #electro #techno #club #art #popart #soundcloud #music #beatport #itunes,17459,0.0,1.0,0.0,0.0,2021-06-06 16:19:59
have successfully completed the Foundations Project Management course Thank you Google and Coursera,396,0.0,0.659,0.341,0.6908,2021-06-06 16:19:58
indian CEO and still google didn launch their many gadgets India and they ever,9,0.0,1.0,0.0,0.0,2021-06-06 16:19:48
SillyPants Has you Covered Everything you will need teach the entire Probability unit Junior Perfect for,2,0.0,0.802,0.198,0.5719,2021-06-06 16:19:09
Check out paidmarketer will increase sales #shopify website #Google #AdWords #Fiverr adwords fiverr #ppc,996,0.0,0.85,0.15,0.3182,2021-06-06 16:19:01
New Google Cloud innovations unify your data cloud #cloud #Google #innovation #techno #banking,1080,0.0,1.0,0.0,0.0,2021-06-06 16:18:57
you are looking for digital marketing service Then you can knock Fiverr,60,0.0,1.0,0.0,0.0,2021-06-06 16:18:09
New Google Cloud innovations unify your data cloud #cloud #Google #innovation #techno #banking,3156,0.0,1.0,0.0,0.0,2021-06-06 16:17:41
are not convinced say that this story too browsers should not profile users #FLoC #Google,215,0.139,0.861,0.0,-0.3089,2021-06-06 16:17:25
Doodle #Google hoy #votemosperu,2,0.0,1.0,0.0,0.0,2021-06-06 16:17:21
you are looking for digital marketing service Then you can knock Fiverr,60,0.0,1.0,0.0,0.0,2021-06-06 16:17:15
First #internet #surfing then #orkuting then #google then #yahoochatroom then #FacebookLive then #instareel,1509,0.0,1.0,0.0,0.0,2021-06-06 16:17:10
Possible threat hxxp rbcpack com #phishing #google,779,0.362,0.638,0.0,-0.5267,2021-06-06 16:16:57
Open school NIOS Admission online form Classes #Google Apply for National Open Sch,260,0.0,1.0,0.0,0.0,2021-06-06 16:16:07
ISRO amp MapmyIndia build alternative Google Maps #ISRO India answer #NASA #MapmyIndia that,48,0.0,1.0,0.0,0.0,2021-06-06 16:15:58
Google Pixel This just rumored picture Google Pixel but you like the Design Comment Below,19,0.0,0.812,0.188,0.5023,2021-06-06 16:15:53
expert link building #linkbuilding #seo #digitalmarketing #backlinks #searchengineo,13,0.0,1.0,0.0,0.0,2021-06-06 16:15:36
Check out latest video The most competitive housing markets the #google,752,0.0,0.834,0.166,0.2484,2021-06-06 16:15:11
#Android users will have know that this checkbox exists and then find the settings almost certainly resultin,1298,0.0,0.884,0.116,0.2748,2021-06-06 16:15:10
Possible threat hxxp rbcpack com #phishing #google,779,0.362,0.638,0.0,-0.5267,2021-06-06 16:14:59
Google releasing broad core algorithm update later today June via,4023,0.0,1.0,0.0,0.0,2021-06-06 16:14:12
Google releasing broad core algorithm update later today June via,45,0.0,1.0,0.0,0.0,2021-06-06 16:14:09
youtube video promotion google video ads campaign you need service please contact and Fiverr link below,34,0.0,0.867,0.133,0.3182,2021-06-06 16:13:05
Take look this #free #download #starkinesis the first #indiegames designe,332,0.0,1.0,0.0,0.0,2021-06-06 16:11:54
How Mandala Exchange Kucoin THETA only Huobi THETA only #Google #Samsu,42,0.0,1.0,0.0,0.0,2021-06-06 16:11:43
are their biggest weapon and using against only #Facebook #Google #apple #WhatsApp #AI #VR,60,0.145,0.855,0.0,-0.296,2021-06-06 16:11:33
Safest Search Engines #cybersecurity #infosec #informationsecurity #web #network #google #tools #ethicalhacking,318,0.0,0.787,0.213,0.4019,2021-06-06 16:11:08
WOW not too shocking considering Google #Google #privacy,621,0.0,0.469,0.531,0.7777,2021-06-06 16:10:46
Checkout Rotation Rush only Google Play #indiedev #gamedev #mobiledev #game #gaming #mobile,3450,0.0,0.821,0.179,0.34,2021-06-06 16:10:29
New Google Cloud innovations unify your data cloud #cloud #Google #innovation #techno #banking,1123,0.0,1.0,0.0,0.0,2021-06-06 16:10:27
#Google Will Let You #OptOut Being #Tracked Apps #Android Hmmmm,507,0.0,1.0,0.0,0.0,2021-06-06 16:09:45
Possible threat hxxp rbcpack com #phishing #google,510,0.362,0.638,0.0,-0.5267,2021-06-06 16:09:38
Checkout Rotation Rush only Google Play #indiedev #gamedev #mobiledev #game,256,0.0,0.789,0.211,0.34,2021-06-06 16:09:22
When asked directly users have overwhelmingly rejected tracking Android users won asked directly they wan,160,0.234,0.585,0.18,-0.0258,2021-06-06 16:07:12
Finally beautiful day #bitcoiners has came out #ElSalvador making public #tender their country,60,0.0,0.755,0.245,0.5994,2021-06-06 16:06:53
Only weeks after #rebranding Spore and launching are ranking the result for spore,9,0.0,1.0,0.0,0.0,2021-06-06 16:06:24
Come Even got that one right without #Google,161,0.0,1.0,0.0,0.0,2021-06-06 16:06:20
Win autographed copy modern classic #google #goodreads #giveaway #bestsellingbooks Plz,717,0.0,0.611,0.389,0.6249,2021-06-06 16:05:57
Today #RankRiskIndex Jun Red Seismic changes the SERPs Don panic before checking your site #Google,815,0.191,0.809,0.0,-0.5106,2021-06-06 16:05:22
Possible threat hxxp rbcpack com #phishing #google,510,0.362,0.638,0.0,-0.5267,2021-06-06 16:05:17
How Change #Google #Assistant #Voice amp #Language #Android #App #Tech #Technology #TechNews,287,0.0,1.0,0.0,0.0,2021-06-06 16:04:43
How Change #Google #Assistant #Voice amp #Language #Android #App #Tech #Technology #TechNews,5740,0.0,1.0,0.0,0.0,2021-06-06 16:04:40
Imagine non Black leader the largest tech company the world stating that Blacks Asian Americans have appeti,10465,0.0,1.0,0.0,0.0,2021-06-06 16:03:41
Today #RankRiskIndex Jun Red Seismic changes the SERPs Don panic before checking your site,33,0.202,0.798,0.0,-0.5106,2021-06-06 16:03:27
#Google searches old,3323,0.0,1.0,0.0,0.0,2021-06-06 16:03:15
How Change #Google #Assistant #Voice amp #Language #Android #App #Tech #Technology,2988,0.0,1.0,0.0,0.0,2021-06-06 16:02:03
Google reportedly made difficult for smartphone users find privacy settings #Google #Privacy,151,0.185,0.815,0.0,-0.3612,2021-06-06 16:00:52
via Influencers #Cruella #BTCZ #Graviex #Google #Bitcoin #CoinMarketCap #Binance #dogecoin,256,0.0,1.0,0.0,0.0,2021-06-06 16:00:38
compiled everything that you need know about FLoC what why receiving pushback and how pre,234558,0.0,1.0,0.0,0.0,2021-06-06 16:00:32
One the best returns discuss her career and much more You don want mis,7827,0.0,0.676,0.324,0.6969,2021-06-06 16:00:24
With new innovations Search Google can get you even closer what you looking for #Google,10,0.0,1.0,0.0,0.0,2021-06-06 16:00:14
Are you walking the RIGHT PATH #seo #conversions #facebookads #ppc #digitalmarketing #growth #growthhacking #lea,32,0.0,1.0,0.0,0.0,2021-06-06 16:00:07
One the best returns discuss her career and much more You don want mis,4651,0.0,0.676,0.324,0.6969,2021-06-06 16:00:06
What Happens When You Type URL Address Bar DaysOfCode #coding #webdevelopment #Google #womenwhocode,3031,0.0,1.0,0.0,0.0,2021-06-06 16:00:06
Data Backed Reasons Ramp #Google Business #Reviews,72,0.0,0.845,0.155,0.0258,2021-06-06 16:00:05
One the best returns discuss her career and much more You don want,546,0.0,0.656,0.344,0.6969,2021-06-06 16:00:01
Influencers #Cruella #BTCZ #Graviex #Google #Bitcoin #CoinMarketCap #Binance #dogecoin #shibainu #ShibaCoin,180,0.0,1.0,0.0,0.0,2021-06-06 15:59:57
Looking for books like Catcher the rye #books #google #goodreads #bestsellingbooks Plz,717,0.0,0.725,0.275,0.4215,2021-06-06 15:59:51
#NarendraModi has much fan following that can close #Apple #Google #Microsoft,4994,0.0,0.813,0.187,0.3182,2021-06-06 15:57:52
#google indic keyword has interesting translation for the most talked about city name getting wron,839,0.0,0.838,0.162,0.4019,2021-06-06 15:57:10
Messin with Resin #Google,361,0.0,1.0,0.0,0.0,2021-06-06 15:55:46
#Alibaba #Google among companies seeking Singapore #Crypto Licenses,8758,0.0,1.0,0.0,0.0,2021-06-06 15:55:45
Looking for books like The Alchemist Check these out #google #goodreads #books #bestsellingbooks,717,0.0,0.828,0.172,0.3612,2021-06-06 15:55:26
Messin with Resin #Google,361,0.0,1.0,0.0,0.0,2021-06-06 15:55:18
Messin with Resin #Google,361,0.0,1.0,0.0,0.0,2021-06-06 15:54:22
One thing that learned from ads Goldfish scientific name Carassius auratus hai #googleads #google,8,0.0,1.0,0.0,0.0,2021-06-06 15:53:18
you are looking for digital marketing service Then you can knock Fiverr,60,0.0,1.0,0.0,0.0,2021-06-06 15:53:12
#Google withdrew #Huawei licence use Android its devices soon after the trade ban The decision aff,100,0.194,0.806,0.0,-0.5574,2021-06-06 15:52:42
#Day DaysOfCode Learn about #FireBase authentication how works and about #YouTube API #technology,3909,0.0,1.0,0.0,0.0,2021-06-06 15:52:29
High time Facebook advertisement business was investigated Next should the secret,642,0.0,1.0,0.0,0.0,2021-06-06 15:52:14
announces first devices with #HarmonyOS set take #Apple and #Google with its house operating system https,100,0.0,1.0,0.0,0.0,2021-06-06 15:52:01
Hello may help you grow your online presence with real organic followers and sales who engage with your website,1364,0.0,0.769,0.231,0.6249,2021-06-06 15:51:09
ISRO amp MapmyIndia build alternative Google Maps #ISRO India answer #NASA #MapmyIndia that,177,0.0,1.0,0.0,0.0,2021-06-06 15:50:56
Ride Peloton with Get off accessories when you buy the bike using referral code YCG,30,0.0,1.0,0.0,0.0,2021-06-06 15:50:02
#Google reportedly working new timelapse feature that could make the astrophotography mode Pix,65677,0.0,1.0,0.0,0.0,2021-06-06 15:49:56
#Day DaysOfCode Learn about #FireBase authentication how works and about #YouTube API #technology,1710,0.0,1.0,0.0,0.0,2021-06-06 15:49:55
Why need #website #social #media probably more convincing and appealing the audience The internet changing and,2207,0.0,0.834,0.166,0.4576,2021-06-06 15:49:48
#Day DaysOfCode Learn about #FireBase authentication how works and about #YouTube API #technology,4048,0.0,1.0,0.0,0.0,2021-06-06 15:49:35
#Day DaysOfCode Learn about #FireBase authentication how works and about #YouTube API #technology,289,0.0,1.0,0.0,0.0,2021-06-06 15:49:34
#Day DaysOfCode Learn about #FireBase authentication how works and about #YouTube API #technology,54,0.0,1.0,0.0,0.0,2021-06-06 15:49:30
#Day DaysOfCode Learn about #FireBase authentication how works and about #YouTube API #technology,1449,0.0,1.0,0.0,0.0,2021-06-06 15:49:30
#Day DaysOfCode Learn about #FireBase authentication how works and about #YouTube API #technology,29405,0.0,1.0,0.0,0.0,2021-06-06 15:49:30
#Day DaysOfCode Learn about #FireBase authentication how works and about #YouTube API #technology,27,0.0,1.0,0.0,0.0,2021-06-06 15:49:25
you like magical realism check this out #google #books #goodreads #bestsellingbooks Plz,717,0.0,0.725,0.275,0.4215,2021-06-06 15:49:24
Zilliqa NOT the next #Google #Amazon #Facebook #AirBNB #Tesla also not the next #Bitcoin #Ethereum,75,0.0,1.0,0.0,0.0,2021-06-06 15:49:04
The Google world account Stay tuned #Google #Alphabet #YouTube #GoogleEarth #Constellatio,19,0.0,1.0,0.0,0.0,2021-06-06 15:48:23
