tweet,follower_count,neg,neu,pos,compound,time
Google announces several updates that will help provide site owners and advertisers with relevant data when cookies aren,1927,0.0,0.863,0.137,0.4019,2021-05-15 00:31:37
How does the Google button affect the SEO Web SEO Analytics #google #socialmedia #marketing,360,0.0,1.0,0.0,0.0,2021-05-15 00:30:51
Google Cloud will connect the SpaceX Starlink satellite broadband network and host ground stati,5121,0.0,1.0,0.0,0.0,2021-05-15 00:30:02
Here What the Dreams #Google #ArtificialIntelligence Look Like #fintech #AI #Machi,1063,0.0,0.634,0.366,0.6369,2021-05-15 00:29:11
Let your freak flag fly from time time humanizes your brand #Google #Rebrand #Twitter #Photo #Digital #Love #Mar,4314,0.146,0.854,0.0,-0.4404,2021-05-15 00:27:28
Link introduces four smart home solutions for whole home security and control,554,0.0,0.57,0.43,0.7003,2021-05-15 00:26:34
Let your freak flag fly from time time humanizes your brand #Google #Rebrand #Twitter #Photo #Digital #Love #Mar,2790,0.146,0.854,0.0,-0.4404,2021-05-15 00:24:05
The Technology Google and other tech companies defend work visas for spouses high tech immigrants,1368,0.0,1.0,0.0,0.0,2021-05-15 00:22:04
HERE WHAT THE DREAMS #GOOGLE ARTIFICIAL INTELLIGENCE LOOK LIKE Google innovative #DeepD,2790,0.0,0.374,0.626,0.9246,2021-05-15 00:21:04
HERE WHAT THE DREAMS #GOOGLE ARTIFICIAL INTELLIGENCE LOOK LIKE Google innovative #DeepD,1672,0.0,0.374,0.626,0.9246,2021-05-15 00:19:25
the joys using something free host Especially when the owner giant like,297,0.0,0.5,0.5,0.8402,2021-05-15 00:19:22
How the USPS deploying help track packages year #blockchain #youtube #bitcoin #music #twitter #art #live,4314,0.0,0.838,0.162,0.4019,2021-05-15 00:19:08
Here What the Dreams #Google #ArtificialIntelligence Look Like #fintech #AI #Machi,57,0.0,0.634,0.366,0.6369,2021-05-15 00:17:24
Fake Chrome App Anchors Rapidly Worming Smish Cyberattack #chrome #google #fake #smish #worm #cybera,842,0.193,0.807,0.0,-0.4767,2021-05-15 00:17:18
How the USPS deploying help track packages year #blockchain #youtube #bitcoin #music #twitter #art #live,2084,0.0,0.838,0.162,0.4019,2021-05-15 00:16:28
Green Meal Ticket Yung Prod Bow #PUDEmpire #FamUp #VMB #MoCity #Alief #Houston #NewMusicFrid,752,0.0,1.0,0.0,0.0,2021-05-15 00:16:08
The #nofollow attribute was introduced let web developers better signal search crawlers the nature their,7278,0.0,0.828,0.172,0.4404,2021-05-15 00:15:05
Sul Sul Simmers Our blog temporarily unavailable due Google error all hosted blogs are currently inacces,118,0.153,0.847,0.0,-0.4019,2021-05-15 00:13:28
Fake Chrome App Anchors Rapidly Worming Smish Cyberattack #chrome #google #fake #smish #worm #cybera,35718,0.193,0.807,0.0,-0.4767,2021-05-15 00:12:45
Fake Chrome App Anchors Rapidly Worming Smish Cyberattack #chrome #google #fake #smish #worm #cybera,15344,0.193,0.807,0.0,-0.4767,2021-05-15 00:12:37
Replacement For Google Structured Data Testing Tool Launches Matt Southern #Google,4644,0.0,1.0,0.0,0.0,2021-05-15 00:11:03
Fake Chrome App Anchors Rapidly Worming Smish Cyberattack #chrome #google #fake #smish #worm #cybera,4234,0.193,0.807,0.0,-0.4767,2021-05-15 00:10:39
Fake Chrome App Anchors Rapidly Worming Smish Cyberattack #chrome #google #fake #smish #worm #cybera,730,0.193,0.807,0.0,-0.4767,2021-05-15 00:07:32
erolsogut Google #Google #Blogger work hard write every day Friends supportive stand injustic,1146,0.084,0.599,0.317,0.5994,2021-05-15 00:06:27
Fake Chrome App Anchors Rapidly Worming Smish Cyberattack #chrome #google #fake #smish #worm #cybera,679,0.193,0.807,0.0,-0.4767,2021-05-15 00:05:21
All Grade History Map #Activity #Teachers #TPT #GregsGoods #classroom,441,0.0,1.0,0.0,0.0,2021-05-15 00:05:05
Fake Chrome App Anchors Rapidly Worming Smish Cyberattack #chrome #google #fake #smish,129,0.22,0.78,0.0,-0.4767,2021-05-15 00:05:02
Free Email Course SEO for Beginners Join this email course learn the basics creating online presence and,12824,0.0,0.645,0.355,0.7717,2021-05-15 00:04:34
HERE WHAT THE DREAMS #GOOGLE ARTIFICIAL INTELLIGENCE LOOK LIKE Google innovative #DeepD,5081,0.0,0.374,0.626,0.9246,2021-05-15 00:04:34
HERE WHAT THE DREAMS #GOOGLE ARTIFICIAL INTELLIGENCE LOOK LIKE Google innovati,377,0.0,0.432,0.568,0.8885,2021-05-15 00:04:02
this how bugs are fixed #Google code Just put band aid and not address the root cause The root cause,44,0.0,1.0,0.0,0.0,2021-05-15 00:03:28
Looking back You will soon able remove duplicates and trim white space Google Sheets #eduk,13521,0.0,1.0,0.0,0.0,2021-05-15 00:03:01
Looking back You will soon able remove duplicates and trim white space Google Sheets #eduk,7597,0.0,1.0,0.0,0.0,2021-05-15 00:03:01
great see that companies like #Google not only affirm the lead #Oracle #Database but also give their uni,3320,0.0,0.788,0.212,0.5106,2021-05-15 00:02:57
One time was parked across the street from the Frost building Austin thought was being,8,0.0,1.0,0.0,0.0,2021-05-15 00:02:42
Venmo now lets users buy and sell Bitcoin and Ethereum #technology #business #mobile #google #blockchain #youtube #live,2084,0.0,1.0,0.0,0.0,2021-05-15 00:00:55
#GoogleAnalytics #RT Read get subj grasp site Need #traffic for page #Google,2922,0.0,1.0,0.0,0.0,2021-05-14 23:56:02
Extremely Simple Ways How Boost Blog Traffic #bloggingtips #SEO #startablog #makemoneyonl,311,0.0,0.787,0.213,0.4019,2021-05-14 23:52:39
Extremely Simple Ways How Boost Blog Traffic #bloggingtips #SEO #startablog,2132,0.0,0.769,0.231,0.4019,2021-05-14 23:52:12
Play Pac Man and get the items #indiegame #indiedev #gamedev #unity,269,0.0,0.806,0.194,0.34,2021-05-14 23:48:06
The news comes after five months internal turmoil sparked #Google firing both leaders its ethics divisio,1073,0.259,0.741,0.0,-0.5994,2021-05-14 23:45:16
this how bugs are fixed #Google code Just put band aid and not address the root cause The root cause,800,0.0,1.0,0.0,0.0,2021-05-14 23:45:03
this how bugs are fixed #Google code Just put band aid and not address the root cause The,353,0.0,1.0,0.0,0.0,2021-05-14 23:42:52
Play Pac Man and get the items #indiegame #indiedev #gamedev #unity,539,0.0,0.806,0.194,0.34,2021-05-14 23:42:13
Play Pac Man and get the items #indiegame #indiedev #gamedev #unity,2366,0.0,0.806,0.194,0.34,2021-05-14 23:41:53
Play Pac Man and get the items #indiegame #indiedev #gamedev #unity,1963,0.0,0.806,0.194,0.34,2021-05-14 23:41:01
Stadia Changelog new games increased efforts from Ubisoft new Chromebook perk more,1828,0.0,0.84,0.16,0.2732,2021-05-14 23:37:06
Best Android app deals the day Cessabit Mars Power Industries Launcher Pro more,1828,0.0,0.741,0.259,0.6369,2021-05-14 23:37:05
Play Pac Man and get the items #indiegame #indiedev #gamedev #unity,3343,0.0,0.806,0.194,0.34,2021-05-14 23:34:18
Play Pac Man and get the items #indiegame #indiedev #gamedev #unity,701,0.0,0.806,0.194,0.34,2021-05-14 23:33:26
Play Pac Man and get the items #indiegame #indiedev #gamedev,63,0.0,0.789,0.211,0.34,2021-05-14 23:33:19
Effective Websites strategies for Feng Shui Master Singapore #bazi #sg #google,8010,0.0,0.763,0.237,0.4767,2021-05-14 23:31:32
How DueDil leverages Apigee API first approach deliver data insights scale #GCP #Google,601,0.0,1.0,0.0,0.0,2021-05-14 23:28:57
DevOps the Federal Government What Means and How Can Help #google #video #amazon daysofcode #infosec #devops,15878,0.0,0.847,0.153,0.4019,2021-05-14 23:26:50
New PowerBI Course English Build Amazing Dashboards and take your work the next level,7268,0.0,0.774,0.226,0.5859,2021-05-14 23:25:04
#NewTaxYear Seasons Greetings one and all time for corporations like #Amazon and #Google reflect And celebra,13552,0.0,0.725,0.275,0.6486,2021-05-14 23:24:56
Roundup retail sales COVID vaccinations Google #Android #Google #Facebook,1368,0.0,1.0,0.0,0.0,2021-05-14 23:23:02
More Info order now #startup daysofcode #codenewbie #freelancing #introvert #medium #programming,2084,0.0,1.0,0.0,0.0,2021-05-14 23:22:54
#angeladezigns #atlantahairstylist #pixiecut #google #atlanta #gardenparcatl Angela Dezigns Salon amp Hair Empori,699,0.0,1.0,0.0,0.0,2021-05-14 23:22:35
These extensions EAD are basic needs force immigrants into Servitude leading Suppression,52,0.0,1.0,0.0,0.0,2021-05-14 23:20:27
LINO ARCI REAL ESTATE AGENT amp TEAM Your Home Sold Guaranteed Buy #Google,138,0.0,1.0,0.0,0.0,2021-05-14 23:20:09
Alhamdulillah the full series the Qur anic Sciences now available #Youtube ads,248,0.0,1.0,0.0,0.0,2021-05-14 23:19:32
the end the day #apple #google #youtube #twitter and company will allow posts and streams crazy and nas,1720,0.118,0.788,0.094,-0.128,2021-05-14 23:19:30
Dear would like thank you for giving the best products all times And for providing with our privacy,1310,0.0,0.478,0.522,0.9217,2021-05-14 23:18:43
Dear would like thank you for giving the best products all times And for providing with our,11,0.0,0.458,0.542,0.9217,2021-05-14 23:18:21
#Lenovo Chromebook Flex FHD Touchscreen #Laptop Intel Core Processor DDR RAM,187,0.0,1.0,0.0,0.0,2021-05-14 23:18:10
Can birds eat grass seeds #HeyGoogle #google #bird #autism,991,0.0,1.0,0.0,0.0,2021-05-14 23:11:33
Chill Zone Alert You asked for them and they coming Glad see taking interest,578,0.0,0.573,0.427,0.802,2021-05-14 23:10:26
These extensions EAD are basic needs force immigrants into Servitude leading Suppression,29,0.0,1.0,0.0,0.0,2021-05-14 23:10:20
Aaand back Next Tuesday amp Thursday our Tech Talks return starting with #Google Forms Sign for this topic and othe,36,0.0,1.0,0.0,0.0,2021-05-14 23:08:55
Alhamdulillah the full series the Qur anic Sciences now available #Youtube ads,119,0.0,1.0,0.0,0.0,2021-05-14 23:07:12
New PowerBI Course English Build Amazing Dashboards and take your work the next level,2594,0.0,0.774,0.226,0.5859,2021-05-14 23:05:08
New PowerBI Course English Build Amazing Dashboards and take your work the next level,155,0.0,0.774,0.226,0.5859,2021-05-14 23:05:06
Vintage Brownie Uniform Belt Tie Cap and Socks #doyourememberwhen #Etsy #Google,329,0.0,1.0,0.0,0.0,2021-05-14 23:04:52
How the USPS deploying help track packages year #blockchain #youtube #bitcoin #music #twitter #art #live,4612,0.0,0.838,0.162,0.4019,2021-05-14 23:03:24
How the USPS deploying help track packages year #blockchain #youtube #bitcoin #music #twitter #art #live,15878,0.0,0.838,0.162,0.4019,2021-05-14 23:03:20
#Google searches old,3334,0.0,1.0,0.0,0.0,2021-05-14 23:03:08
Please visit know more #DaybookLabs #alexa #amazonalexa #assistant #googleassistant,335,0.0,0.777,0.223,0.3182,2021-05-14 23:01:35
Thanks for the star review happy your realtors for life #ReedTeam #TheReedTeam,212,0.0,0.602,0.398,0.765,2021-05-14 23:00:44
want hear from you Leave REGIONAL honest review #Google #Facebook let know how can provide,392,0.067,0.674,0.258,0.5267,2021-05-14 23:00:00
Sono great products SUING #GOOGLE GOOG too for theft Just remember the great company and chip mak,116,0.113,0.559,0.328,0.7482,2021-05-14 22:57:14
Free Email Course SEO for Beginners Join this email course learn the basics creating online presence and,6148,0.0,0.645,0.355,0.7717,2021-05-14 22:55:37
Future Proof #google #news Follow for latest news Apple Music for Android offers more details,230,0.0,1.0,0.0,0.0,2021-05-14 22:54:44
Forget about these The new mecool Netflix google certified Amazing review and device #AndroidTV #Google,1,0.102,0.695,0.203,0.4404,2021-05-14 22:53:51
#Ecommerce News Lightspeed amp Google Partner Benefit Local Sellers The partnership between #Lightspeed and #Googl,1,0.0,0.824,0.176,0.4588,2021-05-14 22:51:54
Alhamdulillah the full series the Qur anic Sciences now available #Youtube ads,104,0.0,1.0,0.0,0.0,2021-05-14 22:49:07
What Dataflow #google #Storage #CloudComputing #technology #innovation #GCP #Cloud #creativity #future #dataflow,601,0.0,1.0,0.0,0.0,2021-05-14 22:48:59
Free Email Course SEO for Beginners Join this email course learn the basics creating online presence and,13921,0.0,0.645,0.355,0.7717,2021-05-14 22:45:18
ARV Furniture Ontario Ltd #Google,3383,0.0,1.0,0.0,0.0,2021-05-14 22:44:42
Upload your photos Google Photos now Unlimited Storage ends soon Google Photos will end its free unlimited,43348,0.0,0.829,0.171,0.5106,2021-05-14 22:44:21
you SSL #Google gives you better ranking addition the #security benefits,232,0.0,0.621,0.379,0.6705,2021-05-14 22:43:58
What Dataflow #google #Storage #CloudComputing #technology #innovation #GCP #Cloud #creativity #future #dataflow,2790,0.0,1.0,0.0,0.0,2021-05-14 22:43:05
Pro tips #VideoMarketing Aggression Consistently Editing Target #Google Radical,75,0.216,0.784,0.0,-0.296,2021-05-14 22:43:00
#Google #Pixel Google Pixel screen protector surfaces,2233,0.0,1.0,0.0,0.0,2021-05-14 22:41:23
These extensions EAD are basic needs force immigrants into Servitude leading Suppression,111,0.0,1.0,0.0,0.0,2021-05-14 22:40:57
CAPABILITIES YOU DIDN KNOW GOOGLE CHROME POSSESSED Scan Code you can open website via your phone,186,0.0,1.0,0.0,0.0,2021-05-14 22:39:33
What Dataflow #google #Storage #CloudComputing #technology #innovation #GCP #Cloud #creativity #future #dataflow,1,0.0,1.0,0.0,0.0,2021-05-14 22:38:09
Chill Zone Alert You asked for them and they coming Glad see taking interest,23,0.0,0.573,0.427,0.802,2021-05-14 22:37:22
#Google #AI #Lyra new very low bitrate #Codec for Speech Compression,1321,0.193,0.807,0.0,-0.3384,2021-05-14 22:33:01
Google Cloud CEO predicts boom business process service VentureBeat #google #tech #business #bigtech,10132,0.0,1.0,0.0,0.0,2021-05-14 22:30:11
Here What the Dreams Google Artificial Intelligence Look Like #ArtificialIntelligence,1423,0.0,0.458,0.542,0.8074,2021-05-14 22:29:19
That would automated #KnowledgeEngine #Google any other #SearchEngine were change would switch,72,0.0,1.0,0.0,0.0,2021-05-14 22:27:59
CoinGeek Zurich #amc #gme #binance #bnb #google #tesla #btc #eth #ltc #btt #doge,68,0.0,1.0,0.0,0.0,2021-05-14 22:27:50
Here What the Dreams Google Artificial Intelligence Look Like #ArtificialIntelligence #LatestNews #Google,7268,0.0,0.52,0.48,0.8074,2021-05-14 22:27:28
Google announces several updates that will help provide site owners and advertisers with relevant data when cookies aren,90,0.0,0.863,0.137,0.4019,2021-05-14 22:26:00
#Google #AI #Lyra new very low bitrate #Codec for Speech Compression,374,0.193,0.807,0.0,-0.3384,2021-05-14 22:25:25
Colorado high schooler wins Doodle for Google contest #Android #Google #Facebook,1368,0.0,0.73,0.27,0.5719,2021-05-14 22:24:02
Even the likes Bill Ackman dont understand #cryptocurrency Many billionaires stay with what they know fast,1,0.0,0.843,0.157,0.4215,2021-05-14 22:23:29
the visa holders were granted the work permit only after their spouses were well off receive permanent res,1272,0.0,0.796,0.204,0.4767,2021-05-14 22:23:12
day after #Germany banned #Facebook from using #WhatsApp users #data over #privacy concerns #Italy May fined,9786,0.167,0.833,0.0,-0.4588,2021-05-14 22:22:34
These extensions EAD are basic needs force immigrants into Servitude leading Suppression,62,0.0,1.0,0.0,0.0,2021-05-14 22:22:33
How Use Digital Marketing Yourselves the Top Feng Shui Master Singapore #fengshui #singapore #google,8010,0.0,0.878,0.122,0.2023,2021-05-14 22:22:11
VIMAN FUNDS #Google #mutualfunds,646,0.0,1.0,0.0,0.0,2021-05-14 22:14:31
LINO ARCI REAL ESTATE AGENT amp TEAM Your Home Sold Guaranteed Buy #Google,138,0.0,1.0,0.0,0.0,2021-05-14 22:14:20
Dow Jones Closes Highs Google Stock Offers Buy Point Apple Retakes Key Level #comdowjones,1711,0.0,1.0,0.0,0.0,2021-05-14 22:14:20
Ellis Music #Google,855,0.0,1.0,0.0,0.0,2021-05-14 22:12:32
Top Level Traffic Web Design Bridgend #Google #topleveltraffic #bridgend #digitalmarketin,803,0.0,0.833,0.167,0.2023,2021-05-14 22:11:56
Top Level Traffic Web Design Bridgend #Google #topleveltraffic #bridgend,2639,0.0,0.816,0.184,0.2023,2021-05-14 22:11:14
Seems history keep repeating Same like #Kashmir even #Palestine medical staff are attacked amp ambulances are sto,566,0.146,0.732,0.122,-0.128,2021-05-14 22:10:10
The best phone buy right now #google,1637,0.0,0.588,0.412,0.6369,2021-05-14 22:09:44
VIDEO Ben Myers President Bullpen Research amp Consulting discusses the latest National Rent Report,593,0.0,1.0,0.0,0.0,2021-05-14 22:09:43
OMG has leaked the design the upcoming Pixel amp Pixel Pro seems like really the year,154,0.122,0.745,0.133,0.0516,2021-05-14 22:09:41
#google doesn want refresh for Any one else having this problem,29,0.233,0.67,0.097,-0.4263,2021-05-14 22:09:13
Best Computer Repair Bridgend and South Wales #Google #custombuild #customgamingpc,389,0.0,0.682,0.318,0.6369,2021-05-14 22:06:33
day after #Germany banned #Facebook from using #WhatsApp users #data over #privacy concerns #Italy May fined,1508,0.167,0.833,0.0,-0.4588,2021-05-14 22:06:12
Best Computer Repair Bridgend and South Wales #Google #custombuild #customgamingpc,2440,0.0,0.682,0.318,0.6369,2021-05-14 22:05:49
Simplicity Key WordLift Tool Review SEO #WordLift #Google SEOTool,7134,0.0,1.0,0.0,0.0,2021-05-14 22:05:05
Awesome course just completed Troubleshooting and Debugging Techniques Check out certificate,101,0.0,0.608,0.392,0.7003,2021-05-14 22:05:01
Dear WOMEN Please Security Conscious study published the Journal General Psychology contended that #Googl,4404,0.0,0.601,0.399,0.743,2021-05-14 22:03:54
#Google searches Law and Order Organized Crime old,3334,0.333,0.667,0.0,-0.5423,2021-05-14 22:03:06
#Google searches Newcastle Man City old,3334,0.0,1.0,0.0,0.0,2021-05-14 22:03:03
Medical Waste #Google #followforfollow #RT #AZ #medicalwastedisposal #nurse,55,0.286,0.714,0.0,-0.4215,2021-05-14 22:02:47
Italy fines #Google for not allowing #JuicePass app favour Google Maps,2338,0.0,0.775,0.225,0.4404,2021-05-14 22:00:49
Check out Gig #Fiverr #google #scraping for search results #business #profiles provide #bulk,1673,0.0,1.0,0.0,0.0,2021-05-14 21:58:01
How Clear Cache Chrome #google #informationtechnology,4379,0.0,0.658,0.342,0.3818,2021-05-14 21:57:54
Google announces several updates that will help provide site owners and advertisers with relevant data when cookies aren,4376,0.0,0.863,0.137,0.4019,2021-05-14 21:56:56
you are any one the educational institutions warehousing and cargo companies healthcare and medical facil,76,0.0,1.0,0.0,0.0,2021-05-14 21:56:06
unable understand that how the price crypto currency can different Google different and,5,0.0,1.0,0.0,0.0,2021-05-14 21:55:41
Google DVD Screensaver Easter egg makes the logo bounce around your screen accordingly #eastereggs #Google #TC,7268,0.0,1.0,0.0,0.0,2021-05-14 21:52:44
#Google DVD Screensaver Easter egg makes the logo bounce around your screen accordingly https,1742,0.0,1.0,0.0,0.0,2021-05-14 21:51:32
hello world #google,0,0.0,1.0,0.0,0.0,2021-05-14 21:51:27
#Google DVD Screensaver Easter egg makes the logo bounce around your screen accordingly,2941,0.0,1.0,0.0,0.0,2021-05-14 21:51:06
DigitalChamber #TC #eastereggs #Google Google DVD Screensaver Easter egg makes the logo bounce around your scre,1765,0.0,1.0,0.0,0.0,2021-05-14 21:51:06
THE ITALIAN UNEXPECTED HEIR vineyard romance #Kindle KindleUK,18426,0.0,0.66,0.34,0.5574,2021-05-14 21:49:59
Alhamdulillah the full series the Qur anic Sciences now available #Youtube ads,454,0.0,1.0,0.0,0.0,2021-05-14 21:47:56
THE ITALIAN UNEXPECTED HEIR vineyard romance #Kindle KindleUK,43233,0.0,0.66,0.34,0.5574,2021-05-14 21:47:03
Here What the Dreams #Google #ArtificialIntelligence Look Like #fintech #AI #Machi,1672,0.0,0.634,0.366,0.6369,2021-05-14 21:46:18
What gRPC #grpc #rpc #protobuf #rest #api #google #cplusplus #java #dev #web #programming #python #java #php,148,0.0,1.0,0.0,0.0,2021-05-14 21:46:12
What gRPC #grpc #rpc #protobuf #rest #api #google #cplusplus #java #dev #web #programming #python #java #php,2084,0.0,1.0,0.0,0.0,2021-05-14 21:45:57
How good all these other metrics are but slow website can cause buyers leave Plus Google page experience,121,0.068,0.831,0.101,0.1655,2021-05-14 21:45:12
Why #Google #Chrome the ONLY major browser whose privacy label says links ALL the data collects user identities,11278,0.0,1.0,0.0,0.0,2021-05-14 21:44:24
PSA Google Photos Unlimited Storage Ending Here Are the Best Alternatives #google #photos,994,0.0,0.741,0.259,0.6369,2021-05-14 21:44:16
can only dumb down much Get better code scanner thanks least tries #apple,8,0.173,0.524,0.304,0.3612,2021-05-14 21:43:00
VIDEO Phil Soper President and CEO Royal LePage Canada discusses the anxiety facing first time home buyers,3204,0.096,0.904,0.0,-0.1779,2021-05-14 21:42:03
Docking Real Estate #Google,59,0.0,1.0,0.0,0.0,2021-05-14 21:41:42
Check out latest #podcast Emeka Nzekwu CEO and Founder Nation Vision who bringing #eyecare and,3204,0.0,0.875,0.125,0.25,2021-05-14 21:41:32
BUSINESS NEWS BRIEFS for today Lead story Manufacturing sales Canada highest level since June,3204,0.0,1.0,0.0,0.0,2021-05-14 21:41:12
VIDEO Jennifer Hunt national real estate expert discusses the frenzy the Calgary resale housing market,3204,0.141,0.859,0.0,-0.3182,2021-05-14 21:40:58
VIDEO Ben Myers President Bullpen Research amp Consulting discusses the latest National Rent Report,3204,0.0,1.0,0.0,0.0,2021-05-14 21:40:38
you worried about being punished #Google for duplicate #content having multiple URLs leading the same page,7278,0.271,0.729,0.0,-0.6369,2021-05-14 21:40:03
you already have some #Google Nest devices add indoor camera your set #electronics,7,0.0,1.0,0.0,0.0,2021-05-14 21:36:27
Reportedly Google Pixel and Pro may arrive soon spotting social media online #google #googlepixel #googlepix,1267,0.0,1.0,0.0,0.0,2021-05-14 21:34:36
Reportedly Google Pixel and Pro may arrive soon spotting social media online #google #googlepixel,105,0.0,1.0,0.0,0.0,2021-05-14 21:34:30
Google Top Products Carousel Everything You Need Know via #product #products,2493,0.0,0.847,0.153,0.2023,2021-05-14 21:33:12
Chill Zone Alert You asked for them and they coming Glad see taking interest,8,0.0,0.573,0.427,0.802,2021-05-14 21:31:28
#GooglePay launches international #payments with #Wise and #WesternUnion #Google Pay users can now transfer money,793,0.091,0.909,0.0,-0.1027,2021-05-14 21:28:34
Language Models Like GPT Could Herald New Type Search Engine #google,7268,0.0,0.8,0.2,0.3612,2021-05-14 21:27:36
Here What the Dreams #Google Artificial Intelligence Look Like #AI,8891,0.0,0.458,0.542,0.8074,2021-05-14 21:27:00
Language Models Like GPT Could Herald New Type Search Engine #google,405,0.0,0.8,0.2,0.3612,2021-05-14 21:26:11
VIMAN FUNDS #Google #mutualfunds,121,0.0,1.0,0.0,0.0,2021-05-14 21:25:50
Check out the best passive income #apps Build network and #earn from #amc #gme #binance,5737,0.0,0.684,0.316,0.7184,2021-05-14 21:25:40
Alhamdulillah the full series the Qur anic Sciences now available #Youtube ads,55,0.0,1.0,0.0,0.0,2021-05-14 21:25:17
How DueDil leverages Apigee API first approach deliver data insights scale #GCP,185,0.0,1.0,0.0,0.0,2021-05-14 21:25:02
While #Google search great still requires the user ask the right question fixed #iPhone #WiFi problem,46,0.13,0.673,0.197,0.34,2021-05-14 21:23:23
Check out the best passive income #apps Build network and #earn from #amc #gme,68,0.0,0.667,0.333,0.7184,2021-05-14 21:23:15
#Google Chrome Tricks You Might Not Know Here are awesome google chrome tricks which will amaze you knowing,605,0.122,0.569,0.309,0.765,2021-05-14 21:21:50
These extensions EAD are basic needs force immigrants into Servitude leading Suppression,61,0.0,1.0,0.0,0.0,2021-05-14 21:19:59
Google announces several updates that will help provide site owners and advertisers with relevant data when cookies aren,817,0.0,0.863,0.137,0.4019,2021-05-14 21:18:57
Pixel will True Apple Competitor Don you think #Google #Pixel via,28,0.0,0.781,0.219,0.4215,2021-05-14 21:16:51
Buy Houses Cash Dallas #Google Are you still waiting for your house sell Skip the,168,0.0,1.0,0.0,0.0,2021-05-14 21:15:39
Got cookie notice your page Make sure implement with best practices they can impact Web Vitals,4616,0.0,0.602,0.398,0.8225,2021-05-14 21:15:23
#UGC creates more #organictraffic and #conversions providing the most credible #content that both #Google and,43161,0.0,0.87,0.13,0.2732,2021-05-14 21:15:00
Top Gun Anthem The Green Planet Project featuring myself guitar #SPOTIFYPLAYLIST #TopGun #guitar #spotify,2625,0.148,0.741,0.111,-0.1531,2021-05-14 21:14:04
TAXI SERVICE BIDDEFORD #Google,6,0.0,1.0,0.0,0.0,2021-05-14 21:13:22
#Google balloons travel the stratosphere deliver #internet people remote areas,437,0.0,1.0,0.0,0.0,2021-05-14 21:12:37
#News #Android #Google can all explore Zimbabwe Google Maps Street View thanks one person,418,0.0,0.818,0.182,0.4404,2021-05-14 21:10:47
JasonYanowitz IMHO its SergeyNazarov everything will running and processing through #Chainlink will much,25,0.0,1.0,0.0,0.0,2021-05-14 21:09:51
NEW EPISODE joins for inspiring conversation about his relationship with Jesus #WrestlingForTheF,133,0.0,0.797,0.203,0.4215,2021-05-14 21:08:02
Get that #Stadia right here #StadiaPro #Google,129,0.0,1.0,0.0,0.0,2021-05-14 21:07:52
#Facebook want put your site can pay you using #BitTorrent since you use #BitTorrent protoc,21,0.089,0.828,0.083,-0.0258,2021-05-14 21:07:50
How Create Meta Tag Tips and Tricks How Rank Google SEO Onpage Series Hindi,678,0.096,0.769,0.135,0.1531,2021-05-14 21:07:38
Before was know for #Tesla and #Doge was know for animations gifs look #Google This image probably,11838,0.0,1.0,0.0,0.0,2021-05-14 21:06:32
JasonYanowitz IMHO its SergeyNazarov everything will running and processing through #Chainlink will much,1146,0.0,1.0,0.0,0.0,2021-05-14 21:06:24
Update More pins #Google sending out swag some developers Gallery,522,0.0,1.0,0.0,0.0,2021-05-14 21:06:22
IMHO its everything will running and processing through #Chainlink will,28,0.0,1.0,0.0,0.0,2021-05-14 21:05:44
#googlesearch #web World wisdom hand site #Google #isnt enough its #slots,2984,0.0,0.577,0.423,0.765,2021-05-14 21:04:02
Friday GOOGL #Google closing price USD CALL Premiun USD PUT Premiun,117,0.0,1.0,0.0,0.0,2021-05-14 21:04:00
