tweet,follower_count,neg,neu,pos,compound,time
The Core Elements Ranking Google #onlinelearning #education #Google #SEO #BusinessOwners,17679,0.0,1.0,0.0,0.0,2021-05-17 12:09:12
Google Pay users the may now send money app users India and Singapore Plans extend countries suppo,328,0.077,0.829,0.094,0.0772,2021-05-17 12:08:54
What Google Drive #GoogleDrive #Google #Drive What Google Drive Used For,391,0.0,1.0,0.0,0.0,2021-05-17 12:06:33
Instagram will soon let you create posts desktop Check out #Instagram #Desktop,14,0.0,0.84,0.16,0.2732,2021-05-17 12:06:21
Google announces several updates that will help provide site owners and advertisers with relevant data when cookies aren,78,0.0,0.863,0.137,0.4019,2021-05-17 12:05:08
Tel Aviv University And Google Launch Artificial Intelligence For Social Good #ai #artifici,59247,0.0,0.647,0.353,0.7184,2021-05-17 12:05:01
SEO specialist will develop content include keywords phrases order increase traffic website #SEO,6206,0.0,0.839,0.161,0.3182,2021-05-17 12:04:52
Vinyl Percious Moments Patti Doll Pet Goose #Etsy #doyourememberwhen #Google,329,0.0,1.0,0.0,0.0,2021-05-17 12:04:52
#Coronavirus charts and #PopCulture explained #Politico #secupp #UnfilteredSE #thehill,525,0.0,1.0,0.0,0.0,2021-05-17 12:04:46
The Core Elements Ranking Google #onlinelearning #education #Google #SEO #BusinessOwners,14960,0.0,1.0,0.0,0.0,2021-05-17 12:04:26
Get free exposure for your business Google Business For all things web design get,2265,0.0,0.798,0.202,0.5106,2021-05-17 12:03:27
Google Pay users the may now send money app users India and Singapore Plans extend countries suppo,676,0.077,0.829,0.094,0.0772,2021-05-17 12:03:13
Why did Joe Dooley participate RSLC policy working group that working suppress voting,1412,0.0,1.0,0.0,0.0,2021-05-17 12:02:40
#FAANG stock performance #BigTech #Facebook #Apple #Amazon #Netflix #Google,2470,0.0,1.0,0.0,0.0,2021-05-17 12:02:07
Google SpaceX partnership #blockchain #AWSSummit #ArtificialIntelligence #Clubhouse #DigitalTransformation #cybersecurity,1905,0.0,1.0,0.0,0.0,2021-05-17 12:01:34
Google has brilliant idea for Pixels with under display camera tech #google #Pixel #Pixel,1773,0.0,0.774,0.226,0.5859,2021-05-17 12:01:04
Check your competitors rankings #google amp amp #bing and compare them with yours #seo,344,0.0,1.0,0.0,0.0,2021-05-17 12:00:55
APP THE DAY Google Duo Google Duo simple video calling app that free amp works Android iPhones table,0,0.0,0.837,0.163,0.5106,2021-05-17 12:00:39
Google What developers can expect Android TensorFlow Material Design via,1514,0.0,1.0,0.0,0.0,2021-05-17 12:00:31
Android leaks show redesigned with better animations Article Nikhil Sharma,37,0.0,0.756,0.244,0.4404,2021-05-17 12:00:21
#Google Blowing Online Rules What Financial Marketers Must Know,28496,0.0,1.0,0.0,0.0,2021-05-17 12:00:19
SEO specialist will develop content include keywords phrases order increase traffic website #SEO,2822,0.0,0.839,0.161,0.3182,2021-05-17 12:00:08
Can you answer this Database structure for combaning local login with social login #google,1632,0.0,1.0,0.0,0.0,2021-05-17 12:00:02
Google annual developer event #GoogleIO kick starts tomorrow and will continue till May #technews,732,0.0,1.0,0.0,0.0,2021-05-17 12:00:02
Mom Knows everything #google #youtube #smile #parenting,328,0.0,1.0,0.0,0.0,2021-05-17 11:59:00
SEO specialist will develop content include keywords phrases order increase traffic website #SEO,23,0.0,0.839,0.161,0.3182,2021-05-17 11:58:39
Check out Gig #Fiverr #google #scraping for search results #business #profiles provide #bulk,1669,0.0,1.0,0.0,0.0,2021-05-17 11:58:01
for your construction engineering amp real estate development needs pls contact CDO HOME BUILDERS amp Development Corp,1042,0.0,0.925,0.075,0.0772,2021-05-17 11:57:48
Phil Venables view cloud security gets credibility from the fact that sat major financial firm prior,487,0.0,0.862,0.138,0.34,2021-05-17 11:55:43
#Google says yes,21,0.0,0.426,0.574,0.4019,2021-05-17 11:54:06
Harjass Travels Amritsar #Google,1989,0.0,1.0,0.0,0.0,2021-05-17 11:53:41
Inside #Google Plan Disrupt the College Degree Inc #Education #Careers,58335,0.0,1.0,0.0,0.0,2021-05-17 11:51:00
Reach the clients you need and promote your location Google Maps with Zareklamy Ads Read more,62,0.0,0.791,0.209,0.4019,2021-05-17 11:50:38
According marketers SEO the most effective tactic drive more traffic While the other hand,19,0.0,0.645,0.355,0.7645,2021-05-17 11:50:16
Google wins cloud deal from SpaceX for Starlink internet service #starlink #spacex #google,4,0.0,0.764,0.236,0.5719,2021-05-17 11:49:05
The initiative includes three year grant NPower Canada deliver Google Certificate programs and deploy,11183,0.0,0.839,0.161,0.3612,2021-05-17 11:48:20
#TechToday May Google Dialer lets you screen unwanted calls with long awaited Caller feature Read Mor,4,0.176,0.824,0.0,-0.25,2021-05-17 11:47:50
Yes now #digital #antitrust,4433,0.0,0.526,0.474,0.4019,2021-05-17 11:47:21
News Xilla #rather faisal #google #googlesearch #mohammadfaisalrather #picoftheday #newpost #news #support #karate,1310,0.0,1.0,0.0,0.0,2021-05-17 11:46:56
When doesn allow removal review which you know complete LIE #Google,74,0.0,0.84,0.16,0.2263,2021-05-17 11:46:34
service care office sharvanlal change your life #Google,1021,0.0,0.686,0.314,0.4939,2021-05-17 11:46:11
Yes now #digital #antitrust cases are fast #Google shopping started November,4433,0.0,0.787,0.213,0.4019,2021-05-17 11:46:06
Google Pay users the may now send money app users India and Singapore Plans extend countries suppo,469,0.077,0.829,0.094,0.0772,2021-05-17 11:45:28
Why wouldn someone sell some #DOGE and buy #BTT something else BTT time The Dog had day #BitTorr,54,0.0,1.0,0.0,0.0,2021-05-17 11:44:49
Run Forrest Run #btt and leave the #doge behind Sorry again man,54,0.2,0.8,0.0,-0.128,2021-05-17 11:44:40
Interesting Back Work the Google Way maybe you saw this one,15505,0.0,0.787,0.213,0.4019,2021-05-17 11:43:14
Interesting Back Work the Google Way maybe you saw thi,5092,0.0,0.769,0.231,0.4019,2021-05-17 11:42:55
LET RIDE THE BIG #BTT #WAVE WITH,54,0.0,1.0,0.0,0.0,2021-05-17 11:42:48
The power SEO What difference can SEO make your business #seo #digitalmarketing #marketing,5,0.0,1.0,0.0,0.0,2021-05-17 11:40:53
buy new phone and every website that sends text method locks out due being unrecogize,21840,0.0,1.0,0.0,0.0,2021-05-17 11:40:21
Unisol Communications Pvt Ltd #Google,76,0.0,1.0,0.0,0.0,2021-05-17 11:40:01
Google announces several updates that will help provide site owners and advertisers with relevant data when cookies aren,159,0.0,0.863,0.137,0.4019,2021-05-17 11:38:18
Check out the video understand more about How Google Ads works #basecampdigital #digitalmarketing,367,0.0,1.0,0.0,0.0,2021-05-17 11:38:04
Google coming very excited announce that our latest project will showed the event too Stay,59,0.0,0.839,0.161,0.4005,2021-05-17 11:37:15
Every Company have FAQ here ours Have look look this thread #MondayMotivaton #House #realtors,3,0.0,1.0,0.0,0.0,2021-05-17 11:37:11
The Chelsea Bijouterie Ltd #Google,2789,0.0,1.0,0.0,0.0,2021-05-17 11:37:09
#Android leak reveals significant redesign before #Google #Technews #worldnews,4466,0.214,0.625,0.161,-0.1531,2021-05-17 11:36:09
Hey #Google did you forgot optimise the line height for ipad was intentional #GoogleIO,39,0.0,0.818,0.182,0.4404,2021-05-17 11:35:52
#Legendary #TV Alex Jones #jeffdavisshow #YouTube America Communism Karl Marx Study Adam Weishaupt Jesu,342,0.0,1.0,0.0,0.0,2021-05-17 11:35:41
Use search instead #Google and with privacy extensions and this issue will,33,0.0,1.0,0.0,0.0,2021-05-17 11:34:17
Company Snapshot Google Inc Follow for Daily Content stocks #Google,719,0.0,1.0,0.0,0.0,2021-05-17 11:33:49
How Fix Not Enough Memory Open This Page Error Google Chrome #HowTo #fix,20,0.184,0.816,0.0,-0.4019,2021-05-17 11:33:15
you need #Logo Check out #Portfolio All Original #Designs copy pastin,5,0.0,0.813,0.187,0.3182,2021-05-17 11:32:19
Sharp Aquos launches with huge inch camera sensor display #Google #Technology,1826,0.0,0.813,0.187,0.3182,2021-05-17 11:31:38
Google Phone gains Caller announcement feature help you manually screen calls #Google,1826,0.0,0.662,0.338,0.6249,2021-05-17 11:31:35
brand new #podcast jumpstart the week #iTunes #Google,597,0.0,1.0,0.0,0.0,2021-05-17 11:31:08
#GoogleCloudRun fully managed compute platform that enables users run stateless containers which can,449,0.0,1.0,0.0,0.0,2021-05-17 11:31:00
#SEO Tip Write quality texts Avoid duplicates Check out your site with this tool #google #bing #yahoo,344,0.121,0.879,0.0,-0.296,2021-05-17 11:30:51
Google updates its original Search Console and adds new Associations Page For more Google updates like,578,0.0,0.734,0.266,0.6204,2021-05-17 11:29:44
Google AdWords Upgrades Dynamic Search Ads #SEO #Google #AdWords,11386,0.0,0.755,0.245,0.3818,2021-05-17 11:29:05
#flyinghighwithflutter Guest #KasperLund founder #Dart amp CEO #Toit platform for #IoT dev,1361,0.0,1.0,0.0,0.0,2021-05-17 11:28:43
#flyinghighwithflutter Guest #KasperLund founder #Dart amp CEO #Toit platform for #IoT dev,272,0.0,1.0,0.0,0.0,2021-05-17 11:28:38
When and why remove content from Google search results #Google #content #GoogleSERPs,166,0.0,1.0,0.0,0.0,2021-05-17 11:28:13
Dear when happening #Linux #Google,433,0.0,0.606,0.394,0.3818,2021-05-17 11:27:55
Although Project Loon was sadly shut down #Alphabet after nine years amp its technologies will forwarde,301231,0.157,0.843,0.0,-0.4215,2021-05-17 11:27:06
Question was asked about Google rankings dropping after buying PPC Ads then coming back right after turning off the ads via,579,0.0,1.0,0.0,0.0,2021-05-17 11:26:25
Without making big changes There way for Google retain its research credibility especially ethical #AI #Et,10009,0.0,0.807,0.193,0.5563,2021-05-17 11:25:51
Accountant Friend #Google,84,0.0,0.385,0.615,0.4939,2021-05-17 11:25:21
Google balloons deliver internet and connectivity people remote and disaster areas Although Project Loon was shut,934,0.215,0.785,0.0,-0.6249,2021-05-17 11:24:56
Google balloons deliver internet and connectivity people remote and disaster areas Although Project Loon,18875,0.24,0.76,0.0,-0.6249,2021-05-17 11:24:10
Israeli lobby stopping Google maps from showing the destruction gaza Expose and stop the Israeli lobby #Google https,3689,0.391,0.515,0.094,-0.7845,2021-05-17 11:23:45
Have you visited recently would really appreciate you could leave some feedback following your experien,7032,0.07,0.756,0.174,0.4201,2021-05-17 11:23:20
Google Authorship How Get Your Author Image SERPs #Google #SERPs #googleauthorship #Marketing #digitalmarketing,3264,0.0,1.0,0.0,0.0,2021-05-17 11:23:01
Google announces several updates that will help provide site owners and advertisers with relevant data when cookies aren,1015,0.0,0.863,0.137,0.4019,2021-05-17 11:22:15
Oldie but still gives you laughs #Google #Funny,199,0.0,0.619,0.381,0.6486,2021-05-17 11:20:38
Judgment Announcement Trailer PlayStation Xbox Series Stadia #Judgment #Sega #PlayS,3226,0.0,1.0,0.0,0.0,2021-05-17 11:20:33
Israeli lobby stopping Google maps from showing the destruction gaza Expose and stop the Israeli lobby #Google,2111,0.408,0.493,0.099,-0.7845,2021-05-17 11:20:09
When cookies aren available Google Analytics will soon able gather data using machine learning via,4274,0.0,1.0,0.0,0.0,2021-05-17 11:20:03
Vous voulez voir panoramique #visitevirtuelle #google #visitez #photo #visitevirtuellegoogle,42,0.0,1.0,0.0,0.0,2021-05-17 11:20:00
Google announces several updates that will help provide site owners and advertisers with relevant data when cookies aren,165,0.0,0.863,0.137,0.4019,2021-05-17 11:19:47
Did you know Contact our experts today for your digital marketing branding SEOS and design needs DMs open #Digital,403,0.0,1.0,0.0,0.0,2021-05-17 11:19:27
When doesn allow removal review which you know complete LIE #Google,273,0.0,0.84,0.16,0.2263,2021-05-17 11:19:20
Scheme Flooding Allows Websites Track Users Across Browsers flaw that allows browsers enumerate application,869,0.0,1.0,0.0,0.0,2021-05-17 11:18:24
replacement for Google Structured Data Testing Tool called the Schema Markup Validator now available use,862,0.0,1.0,0.0,0.0,2021-05-17 11:18:06
Invite only audio app Clubhouse arrive Android India Friday #Android #Google #Facebook,1373,0.0,0.873,0.127,0.1531,2021-05-17 11:18:03
Possible threat hxxp ambimagnet com #phishing #facebook #google,500,0.327,0.673,0.0,-0.5267,2021-05-17 11:17:54
Scheme Flooding Allows Websites Track Users Across Browsers flaw that allows browsers enumerate applicat,4179,0.0,1.0,0.0,0.0,2021-05-17 11:17:39
Google gives makeover Android with new designs for widgets and notifications #Google #Android #Android,2113,0.0,1.0,0.0,0.0,2021-05-17 11:15:50
#GOOGLE Billy Kravitz Vampire Wonderland for countless portals onto detailed and rich world night folk life and lore,43913,0.0,0.825,0.175,0.5574,2021-05-17 11:14:56
Google announces several updates that will help provide site owners and advertisers with relevant data when cookies aren,2111,0.0,0.863,0.137,0.4019,2021-05-17 11:14:10
Advantages PPC Advertising Cost Effective Highly Targetable Increase Brand Exposure Goal Focused Insta,201,0.0,0.455,0.545,0.8683,2021-05-17 11:13:05
Google announces several updates that will help provide site owners and advertisers with relevant data when cookies aren,1323,0.0,0.863,0.137,0.4019,2021-05-17 11:13:00
What Google Drive #GoogleDrive #Google #Drive What Google Drive Used For,151,0.0,1.0,0.0,0.0,2021-05-17 11:12:07
Cookieless data isn the only concern search marketing #digitalmarketing #seo #google #searchen,810,0.0,1.0,0.0,0.0,2021-05-17 11:11:29
all time favourite song Please subscribe this channel #youtubechannel #YouTuber,0,0.0,0.796,0.204,0.3182,2021-05-17 11:10:23
Google announces several updates that will help provide site owners and advertisers with relevant data when cookies,234188,0.0,0.856,0.144,0.4019,2021-05-17 11:10:01
Cookieless data isn the only concern search marketing #digitalmarketing #seo #google #searchengine,1084,0.0,1.0,0.0,0.0,2021-05-17 11:09:55
Question was asked about Google rankings dropping after buying PPC Ads then coming back right after turning off the ads via,2395,0.0,1.0,0.0,0.0,2021-05-17 11:09:11
you even Spot SEO bro #seo #searchengineoptimization #google #DigitalMarketing #megathread,14251,0.0,1.0,0.0,0.0,2021-05-17 11:09:03
Google pure Evil Whenever you seek any help from they make money from you pretending making favor,43,0.182,0.537,0.281,0.1027,2021-05-17 11:08:17
#Google #Pixel smartphone with under screen camera #Pixel Via letsgodigital,1549,0.0,1.0,0.0,0.0,2021-05-17 11:05:42
New PowerBI Course English Build Amazing Dashboards and take your work the next level,160,0.0,0.774,0.226,0.5859,2021-05-17 11:05:05
Seriously Seriously #Google and quietly collaborate with #GOP group pushing voter sup,1286,0.254,0.746,0.0,-0.34,2021-05-17 11:05:04
Did you know Contact our experts today for your digital marketing branding SEOS and design needs DMs open #Digital,6206,0.0,1.0,0.0,0.0,2021-05-17 11:03:14
file Recovery app that will help recover deleted photo recover deleted video amp recovery deleted audio #google,923,0.0,0.856,0.144,0.4019,2021-05-17 11:02:07
Google offers lot Free Apps such Google docs What the best Google app you have used #Google,24,0.0,0.667,0.333,0.8176,2021-05-17 11:01:47
Phone cleaner will helps boost your phones speed while removing log files apk files temp files empty files and hel,923,0.073,0.645,0.282,0.6369,2021-05-17 11:01:39
#consumers prefer watch #video learn about product topic making your website more likely,1244,0.0,1.0,0.0,0.0,2021-05-17 11:01:05
How Speed Search Engine Indexing Web SEO Analytics #SEO #google #bing #SEM #howto,344,0.0,1.0,0.0,0.0,2021-05-17 11:00:57
Did you know Contact our experts today for your digital marketing branding SEOS and design needs DMs open #Digital,427,0.0,1.0,0.0,0.0,2021-05-17 11:00:35
Digital Marketing services offer SWIPE #seo #ppc #conversion #contentmarketing #socialmediamarketing,1273,0.0,1.0,0.0,0.0,2021-05-17 11:00:17
And regrets therefore decision approve #Google takeover the wearab,7047,0.238,0.762,0.0,-0.3612,2021-05-17 11:00:15
Identifying what caused #Google search engine penalty and then fixing can long and arduous task,374,0.176,0.824,0.0,-0.4588,2021-05-17 11:00:07
Massive Android leak might tease Google Pixel design #Android #google #GoogleIO,1773,0.343,0.657,0.0,-0.5719,2021-05-17 11:00:03
GOOGLE MAY UPDATE EVERYTHING YOU NEED KNOW Google May Update Everything You Need Know,1434,0.0,1.0,0.0,0.0,2021-05-17 11:00:00
Did you know Contact our experts today for your digital marketing branding SEOS and design needs DMs open,1044,0.0,1.0,0.0,0.0,2021-05-17 10:59:27
The Google world account Stay tuned #Google #Alphabet #YouTube #GoogleEarth #Constellatio,1,0.0,1.0,0.0,0.0,2021-05-17 10:59:24
Shanklin Pet Stores #Google,4184,0.0,1.0,0.0,0.0,2021-05-17 10:57:12
DarrenAquino WHPC radio show announcing the seasons Emma children book part copy written patented series,79,0.0,1.0,0.0,0.0,2021-05-17 10:56:57
Pitman Training Swords #Google,1705,0.0,1.0,0.0,0.0,2021-05-17 10:56:37
Question was asked about Google rankings dropping after buying PPC Ads then coming back right after,19641,0.0,1.0,0.0,0.0,2021-05-17 10:56:33
Pitman Training Swords #Google,1705,0.0,1.0,0.0,0.0,2021-05-17 10:56:33
Pitman Training Swords #Google,1705,0.0,1.0,0.0,0.0,2021-05-17 10:56:25
Pitman Training Swords #Google,1705,0.0,1.0,0.0,0.0,2021-05-17 10:56:18
Pitman Training Swords #Google,1705,0.0,1.0,0.0,0.0,2021-05-17 10:56:13
Pitman Training Swords #Google,1705,0.0,1.0,0.0,0.0,2021-05-17 10:56:08
Pitman Training Swords #Google,1705,0.0,1.0,0.0,0.0,2021-05-17 10:56:05
Pitman Training Swords #Google,1705,0.0,1.0,0.0,0.0,2021-05-17 10:55:59
Pitman Training Swords #Google,1705,0.0,1.0,0.0,0.0,2021-05-17 10:55:55
Here are few main things consider when optimizing your content for Google Discover via,427,0.0,0.812,0.188,0.4588,2021-05-17 10:55:55
Pitman Training Swords #Google,1705,0.0,1.0,0.0,0.0,2021-05-17 10:55:52
Question was asked about Google rankings dropping after buying PPC Ads then coming back right after,419,0.0,1.0,0.0,0.0,2021-05-17 10:55:12
Google Extension are one most underrated tools There are literally thousands extensions which can help,4,0.0,0.838,0.162,0.4019,2021-05-17 10:54:25
Google Pay will now let users the send money their friends and families India and Singapore This,44,0.072,0.769,0.159,0.4019,2021-05-17 10:54:15
not compromise the happiness your family with power outage get SOLARed #SolarEnergy #oraabsolar #Google,9,0.184,0.816,0.0,-0.4449,2021-05-17 10:53:45
Google Earth shows the Human impact #innovation #google #sustainabilty #earth #mappingthefuture,217,0.0,1.0,0.0,0.0,2021-05-17 10:50:59
RayLiqour #Google Glenfiddich years old Price Khs Delivery,7,0.0,1.0,0.0,0.0,2021-05-17 10:50:41
Here are few main things consider when optimizing your content for Google Discover via,209,0.0,0.812,0.188,0.4588,2021-05-17 10:50:38
Integrate your Google AdWords account with the Builderfly store and setup the ads for Builderfly products easily,913,0.0,0.87,0.13,0.34,2021-05-17 10:49:33
Get more traffic your local stores and website optimizing local search steps publish daily content for,100,0.0,0.833,0.167,0.4588,2021-05-17 10:48:23
BeachTanning Tanning Salon Philadelphia #Google,146,0.0,1.0,0.0,0.0,2021-05-17 10:48:16
Google Earth shows the Human impact #innovation #google #sustainabilty #earth #mappingthefuture,1070,0.0,1.0,0.0,0.0,2021-05-17 10:48:12
Here are few main things consider when optimizing your content for Google Discover via,314,0.0,0.812,0.188,0.4588,2021-05-17 10:47:37
Great review our services #FiveStar #LawMadeSimple #MondayMotivation #mondaythoughts #MondayVibes #Monday #MondayMo,28116,0.0,0.709,0.291,0.6249,2021-05-17 10:46:34
Pitman Training Swords #Google,1705,0.0,1.0,0.0,0.0,2021-05-17 10:46:14
#Google Pay #international send money #feature launches with limited reach via,36,0.266,0.645,0.089,-0.296,2021-05-17 10:46:12
Pitman Training Swords #Google,1705,0.0,1.0,0.0,0.0,2021-05-17 10:46:11
Pitman Training Swords #Google,1705,0.0,1.0,0.0,0.0,2021-05-17 10:46:07
Pitman Training Swords #Google,1705,0.0,1.0,0.0,0.0,2021-05-17 10:46:03
Pitman Training Swords #Google,1705,0.0,1.0,0.0,0.0,2021-05-17 10:45:59
Begin with thorough keyword research Have well thought out product name Write excellent product desc,0,0.0,0.691,0.309,0.7003,2021-05-17 10:45:27
BeachTanning Tanning Salon Philadelphia #Google,146,0.0,1.0,0.0,0.0,2021-05-17 10:44:33
The Google world account Stay tuned #Google #Alphabet #YouTube #GoogleEarth #Constellatio,2,0.0,1.0,0.0,0.0,2021-05-17 10:44:13
Company Snapshot Google Inc Follow for Daily Content stocks #Google,915,0.0,1.0,0.0,0.0,2021-05-17 10:44:12
you are starting your first podcast SEO can reliable promo tool used correctly Here are some tips,286,0.0,1.0,0.0,0.0,2021-05-17 10:44:03
Ready enhance your Make your communication truly conversational with Google #BusinessMessages Drive,1034,0.0,0.649,0.351,0.6597,2021-05-17 10:43:59
Check out National Productivity Council Google Please follow NPC Google and stay tuned,77,0.0,0.839,0.161,0.3182,2021-05-17 10:43:18
How Search Engines Works Please like amp share Subscribe,11,0.0,0.462,0.538,0.7184,2021-05-17 10:43:17
Tel Aviv University And Google Launch Artificial Intelligence For Social Good #ai #artifici,3139,0.0,0.647,0.353,0.7184,2021-05-17 10:42:31
Final Fantasy director Paralympics RPG launching next month #finalfantasy,273,0.0,1.0,0.0,0.0,2021-05-17 10:42:30
And regrets therefore decision approve #Google takeover the wearab,4433,0.238,0.762,0.0,-0.3612,2021-05-17 10:42:26
Here Are Some Cool Google Experiments Which You Need See #Google #AI #NeuralNetwork #Ar,8455,0.0,0.85,0.15,0.3182,2021-05-17 10:41:35
Here Are Some Cool Google Experiments Which You Need See #Google #AI #NeuralNetwork #Ar,2020,0.0,0.85,0.15,0.3182,2021-05-17 10:41:30
The Technology and Approach Needed Quickly Enable Digital Government Services #technology #business #infosec #google #blo,1293,0.0,1.0,0.0,0.0,2021-05-17 10:41:02
The Technology and Approach Needed Quickly Enable Digital Government Services #technology #business #infosec #google #blo,3185,0.0,1.0,0.0,0.0,2021-05-17 10:40:57
And regrets therefore decision approve #Google takeover,4433,0.294,0.706,0.0,-0.3612,2021-05-17 10:40:50
want open debate you think Google will disappear the future bet YES #Google #Debate #privacymatters #bored,95,0.097,0.662,0.241,0.4278,2021-05-17 10:38:52
Advanced Film Solutions #Google,4473,0.0,0.351,0.649,0.4019,2021-05-17 10:37:40
Friends got #free #Google #Play #Gift #Card this website,0,0.0,0.721,0.279,0.4767,2021-05-17 10:37:39
Check out National Productivity Council Google Please follow NPC Google and stay tuned,332,0.0,0.839,0.161,0.3182,2021-05-17 10:37:09
Pixel Pro will feature primary sensor along with Triple camera array will launch late August Love,146,0.0,0.781,0.219,0.6369,2021-05-17 10:32:36
Google gives predictions for the future security #Google #GoogleSecurity,49,0.0,0.769,0.231,0.34,2021-05-17 10:32:36
Telegraphing the future security #Google,1674,0.0,0.625,0.375,0.34,2021-05-17 10:31:16
You can buy #HGV #Anti #Siphon #Devices aide automotive website Also #Truck #Tank Sender Unit Covers amp,485,0.0,1.0,0.0,0.0,2021-05-17 10:31:02
days your Google Business Page will Verified All you need click the link below,1644,0.0,1.0,0.0,0.0,2021-05-17 10:28:12
Learn How implement #google #pubSub #javascript #typescript #nodeJs creating #cipher working with #angular #react,221,0.0,0.855,0.145,0.296,2021-05-17 10:25:18
Learn How implement #google #pubSub #javascript #typescript #nodeJs creating #cipher working with #angular #react,2822,0.0,0.855,0.145,0.296,2021-05-17 10:25:05
The morning after #Crew game and not single mention #Google news feed never too late,128,0.0,1.0,0.0,0.0,2021-05-17 10:23:51
Here are few main things consider when optimizing your content for Google Discover via,1015,0.0,0.812,0.188,0.4588,2021-05-17 10:21:54
Boost your #Google #rank top #SEOeStore offers full #SEO campaigns start from,230,0.0,0.69,0.31,0.5423,2021-05-17 10:20:52
Ranked website #Google for #bermuda #entertainment,1670,0.0,1.0,0.0,0.0,2021-05-17 10:20:48
wanted Google why does husband get more steps Fitbit but see other people have bigger fish fry,1128,0.0,1.0,0.0,0.0,2021-05-17 10:20:47
Ranked #Website #Google for #bermuda #entertainment,1670,0.0,1.0,0.0,0.0,2021-05-17 10:20:37
Learn How implement #google #pubSub #javascript #typescript #nodeJs creating #cipher working with #angular #react,1308,0.0,0.855,0.145,0.296,2021-05-17 10:20:26
Inspiration Motivation Digitals work for you #ecommerce #MarketingDigital #chatbots #socia,16,0.0,0.58,0.42,0.7003,2021-05-17 10:19:51
Quick Way Recover Deleted Photos Images from Google Hangouts #Google #Hangouts collaborative applicatio,23647,0.0,1.0,0.0,0.0,2021-05-17 10:19:16
ISRO amp MapmyIndia build alternative Google Maps #ISRO India answer #NASA #MapmyIndia that,104,0.0,1.0,0.0,0.0,2021-05-17 10:18:38
Global Collaborative Robot System Market Sales Revenue Key Players Analysis Development Status Opportunity,1373,0.0,0.811,0.189,0.4215,2021-05-17 10:18:33
Ranked website #Google for #bermuda #entertainment,6,0.0,1.0,0.0,0.0,2021-05-17 10:17:42
Walkie talkie mode short voice messages #Samsung #GalaxyWatch #Google #GalaxyWatch Series #WearOS #OneUI #TizenOS #galaxyunpacked,232,0.0,1.0,0.0,0.0,2021-05-17 10:16:32
Telegraphing the future security via #digitalmarketing #Google #SEO,6500,0.0,0.745,0.255,0.34,2021-05-17 10:16:07
Advanced Film Solutions #Google,4473,0.0,0.351,0.649,0.4019,2021-05-17 10:16:05
days your Google Business Page will Verified All you need click the link below,2,0.0,1.0,0.0,0.0,2021-05-17 10:15:38
Ranked #Website #Google for #bermuda #entertainment,71,0.0,1.0,0.0,0.0,2021-05-17 10:15:31
